[{"name": "Senior PHP Developer in Laravel and Code Igniter", "company": "Digital Agency Catmandu Private Limited", "level": "Senior Level", "vacancy": "2", "address": "Thirbam Sadak, Baluwatar, Kathmandu, Nepal", "salary": "NRs. 15000-20000", "deadline": "31 Dec 2020", "time": "Full Time", "education": "Required Education :Not Required", "desct": "Job overview:Job Category:ITPreferred Gender:Male/FemaleJob Level:Senior LevelNo. of vacancy/s:2Salary:NRs. 15000-20000Experience:0-1 YearsJob Type:Full TimeJob Location:KathmanduApply Before:31 Dec 2020Educational Descriptions:Required Education :Not RequiredJob Specification:As a \u0938\u093f\u0928\u093f\u0905\u0930 PHP \u0926\u0947\u0935\u094d\u0932\u092a\u0930, you're responsible for Making Stuff Go. You will build infrastructure to create new products, improve existing features, squash bugs, and help us rapidly scale our platform.Key Performance Indicators:The number of release deadlines met per quarter.Quality of pitches as graded by supervisor.Quality of code as graded by supervisor.Support: response time and happiness score (rating from the customer).To love this role, here's the type of person you are:You're a self-starter who loves taking initiative and seeing things through to completion.You're analytical and inquisitive, with excellent attention to detail.You're passionate about development, with a general thirst for knowledge and a significant interest in new technology.You have a passion for excellence.You're proactive and highly organized, with strong time management and planning skills.You have the curiosity and desire to learn and grow your skills.You're able to meet tight deadlines and remain calm under pressure.You're good at absorbing large amounts of information, with a general hunger for learning.You're credible, confident and articulate, with excellent communication skills who makes sure nothing slips through the cracks.You're innovative and creative, with a concise, precise and effective approach to problem-solving.You take pride in the quality and craftsmanship of your work rather than just doing it to get it done.Specific Requirement :Competencies:REQUIRED: \u092a\u093e\u0901\u091a \u092c\u0930\u094d\u0937\u00a0minimum, 10+ years preferred, experience with WordPress development in the same or a similar role.REQUIRED: Advanced proficiency in PHP and Javascript (e.g. React, ES6, etc).Previous experience working on projects on a massive scale.Experience using version control in a collaborative environment.Experience with CSS preprocessors like Sass or LESS, MySQL database programming, and SAAS platforms.Familiar with responsive design principles.Deep understanding of WordPress plugin architecture and engineering.Familiar with API Integrations like MailChimp, AWeber, Zapier, etc.The ability to iterate and ship ideas quickly.Exceptional troubleshooting abilities.Must be comfortable with customer-facing roles including support and documentation.Role Responsibilities:Review current code, systems, and practices, and iteratively improve their quality and efficiency.Work closely with support technicians, marketers, and designers.Produce detailed specifications and pitches for future developments.Develop new features, fix bugs, and iteratively optimize performance and quality of code.Test the product in real-life situations before release.Prepare internal documentation for Development team and support technicians.Assist customers in resolving highly technical issues.This is not an exhaustive list of role responsibilities. This outline indicates the major responsibilities of this role on a regular basis.How to apply for this post ?\u0905\u0928\u0932\u093e\u0907\u0928 Apply \u0917\u0930\u094d\u0928\u0941\u0939\u094b\u0938\u094dApply NowThe deadline to apply for the above position is December 31 2020.", "experience": "0-1 Years", "Page_URL": "https://globaljob.com.np/job/it/it/senior-php-developer-in-larave/5953", "websitename": "globaljob.com"}, {"name": "Marketing Officer", "company": "Ultrabyte International Pvt ltd", "level": "Mid Level", "vacancy": "4", "address": "Kathmandu", "salary": "As per the Company's Policy", "deadline": "23 Dec 2020", "time": "Full Time", "education": "Required Education :Bachelor", "desct": "Job overview:Job Category:ITPreferred Gender:Male/FemaleJob Level:Mid LevelNo. of vacancy/s:4Salary:As per the Company's PolicyExperience:Not RequiredJob Type:Full TimeApply Before:23 Dec 2020Educational Descriptions:Required Education :BachelorJob Specification:Bachelors degree and minimum 1 year experienceProven experience as marketing officer or similar roleSolid knowledge of marketing techniques and principlesGood understanding of market research techniques, statistical and data analysis methodsExcellent organizational and multi-tasking skillsOutstanding communication and interpersonal abilitiesCreativity and commercial awarenessHow to apply for this post ?Interested candidate can apply online or can send their updated CV at ultrabyte71@gmail.comApply NowThe deadline to apply for the above position is December 23 2020.", "experience": "Not Required", "Page_URL": "https://globaljob.com.np/job/it/it/marketing-officer/6963", "websitename": "globaljob.com"}, {"name": "Freelancer Marketer", "company": "Ultrabyte International Pvt ltd", "level": "Entry Level", "vacancy": "10", "address": "Kathmandu", "salary": "As per the Company's Policy", "deadline": "31 Dec 2020", "time": "Full Time", "education": "Required Education :Bachelor", "desct": "Job overview:Job Category:ITPreferred Gender:Male/FemaleJob Level:Entry LevelNo. of vacancy/s:10Salary:As per the Company's PolicyExperience:Not RequiredJob Type:Full TimeApply Before:31 Dec 2020Educational Descriptions:Required Education :BachelorMandatory Documents :Citizenship, SLC Marksheet, 11/12 Transcript,Job Specification:Contribute in the implementation of marketing strategiesSupport the marketing manager in overseeing the department\u2019s operationsOrganize and attend marketing activities or events to raise brand awarenessHow to apply for this post ?Interested candidate can apply online or can send their updated CV at ultrabyte71@gmail.comApply NowThe deadline to apply for the above position is December 31 2020.", "experience": "Not Required", "Page_URL": "https://globaljob.com.np/job/it/it/freelancer-marketer/6964", "websitename": "globaljob.com"}, {"name": "Mobile App Developer", "company": "Genius Systems Pvt. Ltd", "level": "Mid Level", "vacancy": "1", "address": "xxx", "salary": "Negotiable", "deadline": "15 Dec 2020", "time": "Full Time", "education": "Required Education :Other", "desct": "Job overview:Job Category:ITPreferred Gender:Male/FemaleJob Level:Mid LevelNo. of vacancy/s:1Salary:NegotiableExperience:4-5 yearsJob Type:Full TimeJob Location:KathmanduApply Before:15 Dec 2020Educational Descriptions:Required Education :OtherJob Specification:1.4+ years of mobile application development experience with at least two apps that are on the\u00a0\u00a0 app store or play store that you are proud to discuss with us.2.Having a healthy GitHub profile, contributing to open source, and having at least one maintained open source project is really preferable.3.Proficient with the languages, tools, and frameworks core to iOS or Android development (or both).4.1.5+ years experience in Flutter with solid knowledge on state management, threading, platform channels, error handling, debugging, and scaling large applications.5.Experience with RESTful APIs, GraphQL, ORM, and databases.-->1.4+ years of mobile application development experience with at least two apps that are on the\u00a0\u00a0 app store or play store that you are proud to discuss with us.2.Having a healthy GitHub profile, contributing to open source, and having at least one maintained open source project is really preferable.3.Proficient with the languages, tools, and frameworks core to iOS or Android development (or both).4.1.5+ years experience in Flutter with solid knowledge on state management, threading, platform channels, error handling, debugging, and scaling large applications.5.Experience with RESTful APIs, GraphQL, ORM, and databases.Specific Requirement :1.Design and Develop iOS/ Android and hybrid mobile applications.2.Collaborate with cross-functional teams to analyze, design, and deliver new features.3.Fully responsible for mobile app development in the team.4.Build and publish applications in the play store and app store, TV.5.Ensure the performance, quality, and responsiveness of the application.6.Mentors and Leads the mobile developers to build an architecturally sustainable codebase that delivers a high-quality experience.7.Answers team member questions, helps with team member problems, and oversees team member work for quality and guideline compliance.8.Continuously learn new technology, libraries, and frameworks as well as share your knowledge with the team.How to apply for this post ?Interested candidates are requested to send their updated resume tohr@geniussystems.com.npApply NowThe deadline to apply for the above position is December 15 2020.", "experience": "4-5 years", "Page_URL": "https://globaljob.com.np/job/it/it/mobile-app-developer/7056", "websitename": "globaljob.com"}, {"name": "React Native Developer", "company": "Agile Solutions", "level": "Mid Level", "vacancy": "1", "address": "Gairidhara, Kathmandu", "salary": "Negotiable", "deadline": "15 Dec 2020", "time": "Full Time", "education": "Required Education :Bachelor", "desct": "Job overview:Job Category:ITPreferred Gender:Male/FemaleJob Level:Mid LevelNo. of vacancy/s:1Salary:NegotiableExperience:2-3 YearsJob Type:Full TimeJob Location:KathmanduApply Before:15 Dec 2020Educational Descriptions:Required Education :BachelorSpecific Requirement :Design and implement a mobile application for iOS and Android using React Native.Create a the scalable, testable, documented application so that we can grow the product over time.Keep up with technology changes in our space and leverages them when appropriateLeverage native APIs for deep integrations with both platforms.Build reusable components and front-end libraries for future use.Participate in product design, offer new ideas, and understand that not every idea will be adopted.Diagnose and fix bugs and performance bottlenecks for performance that feels native.Work independently to deliver software on time.Document all aspects of your workHow to apply for this post ?Interested and qualified candidate please send in your CV to aruna.rai@agile.com.npApply NowThe deadline to apply for the above position is December 15 2020.", "experience": "2-3 Years", "Page_URL": "https://globaljob.com.np/job/it/it/react-native-developer/7098", "websitename": "globaljob.com"}, {"name": "UI/UX Designer", "company": "Agile Solutions", "level": "Mid Level", "vacancy": "1", "address": "Gairidhara, Kathmandu", "salary": "Negotiable", "deadline": "15 Dec 2020", "time": "Full Time", "education": "Required Education :Bachelor", "desct": "Job overview:Job Category:ITPreferred Gender:Male/FemaleJob Level:Mid LevelNo. of vacancy/s:1Salary:NegotiableExperience:1-2 YearsJob Type:Full TimeJob Location:KathmanduApply Before:15 Dec 2020Educational Descriptions:Required Education :BachelorJob Specification:At least 1-2 years of proven experience as a UI/UX Designer.Up-to-date knowledge of design software like Adobe, Illustrator and Photoshop.Knowledge of wireframe tools (e.g. Figma, Sketch, XD, Wireframe.cc and InVision)Knowledge of design language like CSS, Android XML layout.Specific Requirement :Gather and evaluate user requirements in collaboration with Managers.Illustrate design ideas using storyboards, process flows, and sitemapsDesign graphic user interface elements, like menus, tabs, and widgetsDevelop UI mockups and prototypes that clearly illustrate how sites function and look likeCreate original graphic designs (e.g. images, sketches, and tables)Prepare and present rough drafts to internal teams.Identify and troubleshoot UX problems (e.g. responsiveness)Conduct layout adjustments based on user feedbackAdhere to style standards on fonts, colors, and imagesHow to apply for this post ?Interested and qualified candidate please send in your CV to aruna.rai@agile.com.npApply NowThe deadline to apply for the above position is December 15 2020.", "experience": "1-2 Years", "Page_URL": "https://globaljob.com.np/job/it/it/uiux-designer/7099", "websitename": "globaljob.com"}, {"name": ".NET Intern", "company": "Okaysoft App Development Pvt company", "level": "Entry Level", "vacancy": "1", "address": "Kathmandu, Nepal", "salary": "As per the Company's Policy", "deadline": "15 Dec 2020", "time": "Full Time", "education": "Required Education :Bachelor", "desct": "Job overview:Job Category:ITPreferred Gender:Male/FemaleJob Level:Entry LevelNo. of vacancy/s:1Salary:As per the Company's PolicyExperience:Not RequiredJob Type:Full TimeJob Location:KathmanduApply Before:15 Dec 2020Educational Descriptions:Required Education :BachelorJob Specification:Develop software projects based on .NET Core,ASP.NETMVC, and Microsoft .NET Framework in C#Participating in the development portion of software productionDesign and create database backend as well as web-services to interface with external applicationsWork with the latest development and server technologies from Microsoft and 3rd party web APIs for payment processing, networking, messaging, etc.Specific Requirement :Basic knowledge inASP.NETMVC, Microsoft .NET Framework \u2013 .NET 4.x(4.8 >=), .NET 3.1.x(3.1.8>=) and web technologies such as HTML 5, CSS 3, JavaScript and jQueryBasic knowledge in database design and implementation \u2013 Microsoft SQL Server 2017/19.Spoken and written EnglishA passion for building great softwareResponsible and team-oriented personMust have done at least one small to medium level projectHow to apply for this post ?Interested candidate can send their resume to Sanjeev.cybil@gmail.comNOTE:The internship duration will be 4 months (travel allowances, lunch allowances, and other benefits provided). Best interns will be offered a job.The 4th-month full salary of the internship period is paid by the company according to company policy.Apply NowThe deadline to apply for the above position is December 15 2020.", "experience": "Not Required", "Page_URL": "https://globaljob.com.np/job/it/it/net-intern/7103", "websitename": "globaljob.com"}, {"name": "C# .NET Developer", "company": "Okaysoft App Development Pvt company", "level": "Entry Level", "vacancy": "1", "address": "Kathmandu, Nepal", "salary": "As per the Company's Policy", "deadline": "15 Dec 2020", "time": "Full Time", "education": "Required Education :Not Required", "desct": "Job overview:Job Category:ITPreferred Gender:Male/FemaleJob Level:Entry LevelNo. of vacancy/s:1Salary:As per the Company's PolicyExperience:0-1 YearsJob Type:Full TimeApply Before:15 Dec 2020Educational Descriptions:Required Education :Not RequiredJob Specification:Basic knowledge inASP.NETMVC, Microsoft .NET Framework \u2013 .NET 4.x(4.8>=), .NET 3.1.x(3.1.8 >=) and web technologies such as HTML 5, CSS 3, JavaScript and jQueryKnowledge of c++ preferredBasic knowledge in database design and implementation \u2013 Microsoft SQL Server 2017/19.At least 1+ years of professional experience.Must have done 2+ enterprise-level projects.Spoken and written EnglishA passion for building great softwareResponsible and team-oriented personSpecific Requirement :Develop software projects based on .NET Core,ASP.NETMVC, and Microsoft .NET Framework in C#Participating in the development portion of software productionDesign and create database backend as well as web-services to interface with external applicationsWork with the latest development and server technologies from Microsoft and 3rd party web APIs for payment processing, networking, messaging, etc.How to apply for this post ?Interested candidate can send their resume to Sanjeev.cybil@gmail.comApply NowThe deadline to apply for the above position is December 15 2020.", "experience": "0-1 Years", "Page_URL": "https://globaljob.com.np/job/it/it/c-net-developer/7101", "websitename": "globaljob.com"}, {"name": "Frontend Developer (Intern)", "company": "Okaysoft App Development Pvt company", "level": "Entry Level", "vacancy": "1", "address": "Kathmandu, Nepal", "salary": "As per the Company's Policy", "deadline": "15 Dec 2020", "time": "Full Time", "education": "Required Education :Bachelor", "desct": "Job overview:Job Category:ITPreferred Gender:Male/FemaleJob Level:Entry LevelNo. of vacancy/s:1Salary:As per the Company's PolicyExperience:Not RequiredJob Type:Full TimeJob Location:KathmanduApply Before:15 Dec 2020Educational Descriptions:Required Education :BachelorJob Specification:Knowledge of HTML, CSS, JS, and related web technologiesExperience with responsive designKnowledge of BootstrapBasic graphic design knowledge with image editing software such as Photoshop is an advantageGood communication skills and ability to work in a teamMust have built at least one front end responsive template for a website (please share GitHub linkSpecific Requirement :Working on Real-world projectsWorking individually on a single project if necessaryAssisting senior developers in projectsHow to apply for this post ?Interested candidate can send their resume to Sanjeev.cybil@gmail.comNOTE:The internship duration will be 4 months (travel allowances, lunch allowances, and other benefits provided). Best interns will be offered a job.The 4th-month full salary of the internship period is paid by the company according to company policy.Apply NowThe deadline to apply for the above position is December 15 2020.", "experience": "Not Required", "Page_URL": "https://globaljob.com.np/job/it/it/frontend-developer-intern/7102", "websitename": "globaljob.com"}, {"name": "Desktop Application Developer (Java) Intern", "company": "Mokshya Tech & I.T. Solutions", "level": "Mid Level", "vacancy": "2", "address": "Kathmandu", "salary": "As per the Company's Policy", "deadline": "03 Dec 2020", "time": "Full Time", "education": "Required Education :Bachelor", "desct": "Job overview:Job Category:ITPreferred Gender:Male/FemaleJob Level:Mid LevelNo. of vacancy/s:2Salary:As per the Company's PolicyExperience:Not RequiredJob Type:Full TimeJob Location:KathmanduApply Before:03 Dec 2020Educational Descriptions:Required Education :BachelorJob Specification:A Bachelor's degree in Computer Science or related field.Working knowledge of programming languages such as Java and ORACLE.Experience in application and software development.Knowledge of software design and programming principles.Good mathematical and problem-solving skills.Good communication and team-working skills.Specific Requirement :Developing software solutions to meet customer needs.Creating and implementing the source code of new applications.Testing source code and debugging code.Evaluating existing applications and performing updates and modifications.Developing technical handbooks to represent the design and code of new applications.How to apply for this post ?Interested candidate can apply online or can send their updated CV at\u00a0clientrelation@globaljob.com.np", "experience": "Not Required", "Page_URL": "https://globaljob.com.np/job/it/it/desktop-application-developer-/7105", "websitename": "globaljob.com"}, {"name": "Laravel Developer", "company": "Electronics Concern and Research Center Pvt. LTD", "level": "Entry Level", "vacancy": "1", "address": "newroad", "salary": "As per the Company's Policy", "deadline": "04 Dec 2020", "time": "Full Time", "education": "Required Education :Bachelor", "desct": "Job overview:Job Category:ITPreferred Gender:Male/FemaleJob Level:Entry LevelNo. of vacancy/s:1Salary:As per the Company's PolicyExperience:1-2 YearsJob Type:Full TimeJob Location:KathmanduApply Before:04 Dec 2020Educational Descriptions:Required Education :BachelorJob Specification:\u25cf Previous working experience as a PHP / Laravel developer for 3 years.\u25cf In-depth knowledge of object-oriented PHP and Laravel 5 PHP Framework\u25cf Hands-on experience with SQL schema design, SOLID principles, REST API design\u25cf MySQL profiling and query optimization\u25cf Creative and efficient problem solver\u25cf Knowledgeable with Git version control.\u25cf Ability to meet project deadlines, even under pressure\u25cf Experience working with third-party APIs like Payment Gateways, Google Maps, etc.How to apply for this post ?Send your CV to clientrelation@globaljob.com.np", "experience": "1-2 Years", "Page_URL": "https://globaljob.com.np/job/it/it/laravel-developer/7115", "websitename": "globaljob.com"}, {"name": "Front Desk Officer.", "company": "Electronics Concern and Research Center Pvt. LTD", "level": "Entry Level", "vacancy": "1", "address": "newroad", "salary": "As per the Company's Policy", "deadline": "04 Dec 2020", "time": "Full Time", "education": "Required Education :Intermediate", "desct": "Job overview:Job Category:ITPreferred Gender:Male/FemaleJob Level:Entry LevelNo. of vacancy/s:1Salary:As per the Company's PolicyExperience:0-1 YearsJob Type:Full TimeJob Location:KathmanduApply Before:04 Dec 2020Educational Descriptions:Required Education :IntermediateJob Specification:Good understanding of office administration and basic bookkeeping practices.Superb written and verbal communication skills.Excellent organizational and multi-tasking abilities.Strong knowledge of MS Office programs.Specific Requirement :Greet guests and provide them with superb customer service.Ensure the front desk is neat, presentable, and equipped with all the necessary supplies such as pens, forms, and paper.Answer all client questions and incoming calls.Redirect phone calls to the appropriate department and takedown messages.Accept all letters and packages, and distribute them to their appropriate departments.Monitor, organize, and forward emails.Track and order office equipment and supplies.Maintain records and files.Oversee the office budget.How to apply for this post ?Send your CV to clientrelation@globaljob.com.np", "experience": "0-1 Years", "Page_URL": "https://globaljob.com.np/job/it/it/front-desk-officer/7116", "websitename": "globaljob.com"}, {"name": "Social Media Manager", "company": "Property 360 Nepal", "level": "Mid Level", "vacancy": "1", "address": "Gairidhara, Kathmandu", "salary": "As per the Company's Policy", "deadline": "04 Dec 2020", "time": "Full Time", "education": "Required Education :Bachelor", "desct": "Job overview:Job Category:ITPreferred Gender:Male/FemaleJob Level:Mid LevelNo. of vacancy/s:1Salary:As per the Company's PolicyExperience:1-2 YearsJob Type:Full TimeJob Location:KathmanduApply Before:04 Dec 2020Educational Descriptions:Required Education :BachelorJob Specification:Experience in running Social Media Campaign is a must with knowledge on- Facebook/ Instagram Ad Manager, Facebook/Instagram, Insights, Google/Youtube Ads, LinkedIn Advertise an absolute mustGood communications and reporting skillsKnowlegde of Excel is a mustKnowledge of any analytics tools like Google Analysism Facebook/ Instagram Analytics is necessarySound knowledge of content writingKnowledge of Graphic Designing (Canca and similar apps) will be added advantageExperience in Real Estate Services Industry will be an added advantagesSpecific Requirement :He/ She will be responsiblr for planning/ strategizing/ implementing campaigns and updating content on social media- Facebook, LinkedIn, Twitterm Instagram, Youtube, Pinterest and TikTok.Understand how to do targetting on each platformOversee social media accounts design (layout, sizesm dimensions of photos, video, gid, cover page/ picture, etc)Know very well the different formats available and minute details on the same are it in terms of dimensions, possibility to promote on each platformManaging and populating Social Media Content alendar with expected engagement possibleMedia buyinh on various relevant platforms- suggesting, getting quotes, implementingRunning SEM, GDN campaignsMeasure ROI and KPIsManage and improve online content, considering SEO and Google AnalyticsCoordinating with client servicing & creative teamsStay up to date with the latest technology and best practicesManage all digital marketing channelsMonitor the company's brand on social mediaPrepare and manage a digital marketing budgetOversee all the company's social media accountsBuild an inbound marketing planHow to apply for this post ?Apply through this post.Apply NowThe deadline to apply for the above position is December 04 2020.", "experience": "1-2 Years", "Page_URL": "https://globaljob.com.np/job/it/it/social-media-manager/7117", "websitename": "globaljob.com"}, {"name": "Sr. Android Developer", "company": "Ensue Nepal", "level": "Senior Level", "vacancy": "1", "address": "Kathmandu", "salary": "As per the Company's Policy", "deadline": "30 Dec 2020", "time": "Full Time", "education": "Required Education :Bachelor", "desct": "Job overview:Job Category:ITPreferred Gender:Male/FemaleJob Level:Senior LevelNo. of vacancy/s:1Salary:As per the Company's PolicyExperience:2-3 YearsJob Type:Full TimeJob Location:KathmanduApply Before:30 Dec 2020Educational Descriptions:Required Education :BachelorJob Specification:Should have at least 2 years of experience in android app developmentStrong coding and analytical skillsVery good understanding of OOP, design patterns, and SOLID principlesVery strong knowledge of android design principles and design guidelinesExperienced in multi-threading and performance tuningShould have knowledge of RESTful web servicesVery good understanding of android app life-cycleExperienced in SQL LiteStrong knowledge of MVC, MVVSound knowledge of GITHave published at least one App in PlaystoHow to apply for this post ?Send in your CV to clientrelation@globaljob.com.npApply NowThe deadline to apply for the above position is December 30 2020.", "experience": "2-3 Years", "Page_URL": "https://globaljob.com.np/job/it/it/sr-android-developer/7120", "websitename": "globaljob.com"}, {"name": "Jr. iOS Developer", "company": "Ensue Nepal", "level": "Entry Level", "vacancy": "1", "address": "Kathmandu", "salary": "As per the Company's Policy", "deadline": "30 Dec 2020", "time": "Full Time", "education": "Required Education :None", "desct": "Job overview:Job Category:ITPreferred Gender:Male/FemaleJob Level:Entry LevelNo. of vacancy/s:1Salary:As per the Company's PolicyExperience:0-1 YearsJob Type:Full TimeJob Location:KathmanduApply Before:30 Dec 2020Educational Descriptions:Required Education :NoneJob Specification:Knowledge of iOS frameworks such as Core Data, Core Animation, etc.Knowledge of offline storage, threading, and performance tuningFamiliarity with RESTful APIs to connect iOS applications to back-end servicesKnowledge of other web technologies and UI/UX standardsExperience with performance and memory tuning with tools such as InstrumentsHow to apply for this post ?Send in your CV to clientrelation@globaljob.com.npApply NowThe deadline to apply for the above position is December 30 2020.", "experience": "0-1 Years", "Page_URL": "https://globaljob.com.np/job/it/it/jr-ios-developer/7121", "websitename": "globaljob.com"}, {"name": "Backend Developer In PHP", "company": "Ensue Nepal", "level": "Entry Level", "vacancy": "1", "address": "Kathmandu", "salary": "As per the Company's Policy", "deadline": "30 Dec 2020", "time": "Full Time", "education": "Required Education :Bachelor", "desct": "Job overview:Job Category:ITPreferred Gender:Male/FemaleJob Level:Entry LevelNo. of vacancy/s:1Salary:As per the Company's PolicyExperience:1-2 YearsJob Type:Full TimeJob Location:KathmanduApply Before:30 Dec 2020Educational Descriptions:Required Education :BachelorJob Specification:Must have experience of 1 year or more in the field of PHP based web developmentFamiliarity with PHP frameworks - preferably LaravelFamiliarity with the Version control systemMust have good knowledge of OOPMust have good understanding of RESTful APIMust have knowledge of Software design patterns is preferred.Must have good communication skillsMust be self motivatedHow to apply for this post ?Send in your CV to clientrelation@globaljob.com.npApply NowThe deadline to apply for the above position is December 30 2020.", "experience": "1-2 Years", "Page_URL": "https://globaljob.com.np/job/it/it/backend-developer-in-php/7122", "websitename": "globaljob.com"}, {"name": "Mid Level Frontend Web Developer", "company": "Ensue Nepal", "level": "Mid Level", "vacancy": "1", "address": "Kathmandu", "salary": "As per the Company's Policy", "deadline": "30 Dec 2020", "time": "Full Time", "education": "Required Education :Bachelor", "desct": "Job overview:Job Category:ITPreferred Gender:Male/FemaleJob Level:Mid LevelNo. of vacancy/s:1Salary:As per the Company's PolicyExperience:1-2 YearsJob Type:Full TimeJob Location:KathmanduApply Before:30 Dec 2020Educational Descriptions:Required Education :BachelorJob Specification:Must have 1 year of web development experienceStrong experience in developing rich client functionality with good knowledge of JavascriptExperience in at least one of the javascript frameworks: Angular/AngularJS and ReactJSExperience with RESTful APIs to connect with backend web servicesHow to apply for this post ?Send in your CV to clientrelation@globaljob.com.npApply NowThe deadline to apply for the above position is December 30 2020.", "experience": "1-2 Years", "Page_URL": "https://globaljob.com.np/job/it/it/mid-level-frontend-web-develop/7123", "websitename": "globaljob.com"}, {"name": "React Developer Intern", "company": "Mokshya Tech & I.T. Solutions", "level": "Entry Level", "vacancy": "3", "address": "Kathmandu", "salary": "As per the Company's Policy", "deadline": "24 Dec 2020", "time": "Full Time", "education": "Required Education :Bachelor", "desct": "Job overview:Job Category:ITPreferred Gender:Male/FemaleJob Level:Entry LevelNo. of vacancy/s:3Salary:As per the Company's PolicyExperience:Not RequiredJob Type:Full TimeJob Location:KathmanduApply Before:24 Dec 2020Educational Descriptions:Required Education :BachelorSpecific Requirement :Strong proficiency in JavaScript, including DOM manipulation and the JavaScript object modelThorough understanding of React.js and its core principlesExperience with popular React.js workflows (such as Flux or Redux)Familiarity with newer specifications of EcmaScriptExperience with data structure libraries (e.g., Immutable.js)Knowledge of isomorphic React is a plusFamiliarity with RESTful APIsKnowledge of modern authorization mechanisms, such as JSON Web TokenFamiliarity with modern front-end build pipelines and toolsHow to apply for this post ?Interested candidate can apply online or can send their updated CV at\u00a0clientrelation@globaljob.com.np", "experience": "Not Required", "Page_URL": "https://globaljob.com.np/job/it/it/react-developer-intern/7124", "websitename": "globaljob.com"}, {"name": "Flutter Developer", "company": "Delta Tech Pvt. Ltd.", "level": "Senior Level", "vacancy": "1", "address": "Chand Kripaa, Tinpaini, Biratnagar-02, Morang", "salary": "Salary not a constraint for deserving candidates", "deadline": "05 Jan 2021", "time": "Full Time", "education": "Required Education :Bachelor", "desct": "Job overview:Job Category:ITPreferred Gender:Male/FemaleJob Level:Senior LevelNo. of vacancy/s:1Salary:Salary not a constraint for deserving candidatesExperience:Not RequiredJob Type:Full TimeJob Location:BiratnagarApply Before:05 Jan 2021Educational Descriptions:Required Education :BachelorExpected Faculty :Bachelor of IT/ BE Computer EngineeringSpecific Requirement :Design and Build sophisticated and highly scalable apps using Flutter.Build custom packages in Flutter using the functionalities and APIs already available in native Android and IOS.Translate and Build the designs and Wireframes into hight quality reaponsive UI code.Write efficient queries for core Data.Use of Model-View-Controller ( MVC) and Model-View-ViewModel-Controller (MVVM) as it relates to designing, developing architecture and developing maintainable, testable and functional software that meets product requirements.Explore feasible architectures for implementing new features.How to apply for this post ?Send us your updated resume along with the cover letter at career@deltatechnepal.com or hello@deltatechnepal.comApply NowThe deadline to apply for the above position is January 05 2021.", "experience": "Not Required", "Page_URL": "https://globaljob.com.np/job/it/it/flutter-developer/6429", "websitename": "globaljob.com"}, {"name": "Flutter Developer", "company": "UpTechSys", "level": "Mid Level", "vacancy": "1", "address": "Kathmandu", "salary": "As per the Company's Policy", "deadline": "02 Jan 2021", "time": "Full Time", "education": "Required Education :Bachelor", "desct": "Job overview:Job Category:ITPreferred Gender:Male/FemaleJob Level:Mid LevelNo. of vacancy/s:1Salary:As per the Company's PolicyExperience:Not RequiredJob Type:Full TimeApply Before:02 Jan 2021Educational Descriptions:Required Education :BachelorJob Specification:Technical SkillsExpert in Dart, with strong knowledge of any other native or cross-platform mobile developmentframework (Swift iOS, Java Android, React Native)Able to integrate multiple data sources and databases into one systemUnderstanding of Bloc PatternMust have built at least two Android and/or iOS apps with Flutter published on the app storeExperience with third-party libraries and APIsWorking knowledge of the general mobile landscape, architectures, trends and emerging technologiesSolid understanding of full mobile development life cycle, including automated testing and buildingExperience working in an agile development processMust come from Native or Cross-Platform Development background using other technologies such as Swift iOS, Java Android or React NativeUnderstanding of accessibility and security complianceStrong unit test and debugging skillsProficient understanding of code versioning tools (Git)Non-technical skillsTeam playerExcellent time-management skillsSpecific Requirement :Writing reusable, testable, and efficient codeDesign and implementation of low-latency, high-availability, and performant applicationsDeveloping User Interface of the application based on assets provided by the design teamDeveloping business logic based on application requirements and integrating API based on endpoints provided by the backend development teamImplementation of security and data protectionIntegration of data storage solutionsHow to apply for this post ?Interested candidate can apply online or can send their updated CV at\u00a0career@uptechsys.comApply NowThe deadline to apply for the above position is January 02 2021.", "experience": "Not Required", "Page_URL": "https://globaljob.com.np/job/it/it/flutter-developer/6955", "websitename": "globaljob.com"}, {"name": "Graphic Designer", "company": "UpTechSys", "level": "Mid Level", "vacancy": "1", "address": "Kathmandu", "salary": "As per the Company's Policy", "deadline": "02 Jan 2021", "time": "Full Time", "education": "Required Education :Bachelor", "desct": "Job overview:Job Category:ITPreferred Gender:Male/FemaleJob Level:Mid LevelNo. of vacancy/s:1Salary:As per the Company's PolicyExperience:Not RequiredJob Type:Full TimeApply Before:02 Jan 2021Educational Descriptions:Required Education :BachelorSpecific Requirement :Experience in designing attractive graphics, images, and other visual elements, and adapting them for the website's pages UI Design mobile and desktop web applications.Responsible for ideating and designing communications across all social media platforms through brand-compliant design and videos.Should be up-to-date with the new trends in social media and what works best in different platforms.Collaborate with copywriters, web designers, developers, and marketing leadProficiency in using adobe creative suiteHow to apply for this post ?Interested candidate can apply online or can send their updated CV at\u00a0career@uptechsys.comApply NowThe deadline to apply for the above position is January 02 2021.", "experience": "Not Required", "Page_URL": "https://globaljob.com.np/job/it/it/graphic-designer/6956", "websitename": "globaljob.com"}, {"name": "Front-end developer", "company": "UpTechSys", "level": "Entry Level", "vacancy": "1", "address": "Kathmandu", "salary": "As per the Company's Policy", "deadline": "02 Jan 2021", "time": "Full Time", "education": "Required Education :Bachelor", "desct": "Job overview:Job Category:ITPreferred Gender:Male/FemaleJob Level:Entry LevelNo. of vacancy/s:1Salary:As per the Company's PolicyExperience:2-3 YearsJob Type:Full TimeApply Before:02 Jan 2021Educational Descriptions:Required Education :BachelorJob Specification:2+ experiences in related fields.Specific Requirement :Excellent knowledge in javascript, css,Knowledge of front-end frameworksMust be illsutrator or knows how to use photoshop.How to apply for this post ?Interested candidate can apply online or can send their updated CV at\u00a0career@uptechsys.comApply NowThe deadline to apply for the above position is January 02 2021.", "experience": "2-3 Years", "Page_URL": "https://globaljob.com.np/job/it/it/front-end-developer/6957", "websitename": "globaljob.com"}, {"name": "PHP Programmer", "company": "byteRays Technology Pvt. Ltd.", "level": "Mid Level", "vacancy": "1", "address": "Baneswor, Kathmandu Nepal", "salary": "As per the Company's Policy", "deadline": "07 Jan 2021", "time": "Full Time", "education": "Required Education :Bachelor", "desct": "Job overview:Job Category:ITPreferred Gender:Male/FemaleJob Level:Mid LevelNo. of vacancy/s:1Salary:As per the Company's PolicyExperience:2-3 YearsJob Type:Full TimeApply Before:07 Jan 2021Educational Descriptions:Required Education :BachelorJob Specification:Bachelors in a related field2+ experienceHow to apply for this post ?Send your CV at career@byterays.comApply NowThe deadline to apply for the above position is January 07 2021.", "experience": "2-3 Years", "Page_URL": "https://globaljob.com.np/job/it/it/php-programmer/6987", "websitename": "globaljob.com"}, {"name": "Android/iOS Developer", "company": "byteRays Technology Pvt. Ltd.", "level": "Mid Level", "vacancy": "1", "address": "Baneswor, Kathmandu Nepal", "salary": "As per the Company's Policy", "deadline": "08 Jan 2021", "time": "Full Time", "education": "Required Education :Bachelor", "desct": "Job overview:Job Category:ITPreferred Gender:Male/FemaleJob Level:Mid LevelNo. of vacancy/s:1Salary:As per the Company's PolicyExperience:0-1 YearsJob Type:Full TimeApply Before:08 Jan 2021Educational Descriptions:Required Education :BachelorJob Specification:Bachelors in a related field2+ experienceSpecific Requirement :Send your CV at career@byterays.comHow to apply for this post ?Send your CV at career@byterays.comApply NowThe deadline to apply for the above position is January 08 2021.", "experience": "0-1 Years", "Page_URL": "https://globaljob.com.np/job/it/it/androidios-developer/6988", "websitename": "globaljob.com"}, {"name": "NET Developer", "company": "byteRays Technology Pvt. Ltd.", "level": "Mid Level", "vacancy": "1", "address": "Baneswor, Kathmandu Nepal", "salary": "As per the Company's Policy", "deadline": "07 Jan 2021", "time": "Full Time", "education": "Required Education :Bachelor", "desct": "Job overview:Job Category:ITPreferred Gender:Male/FemaleJob Level:Mid LevelNo. of vacancy/s:1Salary:As per the Company's PolicyExperience:0-1 YearsJob Type:Full TimeApply Before:07 Jan 2021Educational Descriptions:Required Education :BachelorJob Specification:Bachelors in a related field2+ experienceHow to apply for this post ?Send your CV at career@byterays.comApply NowThe deadline to apply for the above position is January 07 2021.", "experience": "0-1 Years", "Page_URL": "https://globaljob.com.np/job/it/it/net-developer/6989", "websitename": "globaljob.com"}, {"name": "UI/UX Developer", "company": "byteRays Technology Pvt. Ltd.", "level": "Mid Level", "vacancy": "1", "address": "Baneswor, Kathmandu Nepal", "salary": "As per the Company's Policy", "deadline": "07 Jan 2021", "time": "Full Time", "education": "Required Education :Bachelor", "desct": "Job overview:Job Category:ITPreferred Gender:Male/FemaleJob Level:Mid LevelNo. of vacancy/s:1Salary:As per the Company's PolicyExperience:2-3 YearsJob Type:Full TimeApply Before:07 Jan 2021Educational Descriptions:Required Education :BachelorJob Specification:Bachelors in a related field2+ experienceHow to apply for this post ?Send your CV at career@byterays.comApply NowThe deadline to apply for the above position is January 07 2021.", "experience": "2-3 Years", "Page_URL": "https://globaljob.com.np/job/it/it/uiux-developer/6990", "websitename": "globaljob.com"}, {"name": "Graphics Designer (Publishing)", "company": "byteRays Technology Pvt. Ltd.", "level": "Mid Level", "vacancy": "1", "address": "Baneswor, Kathmandu Nepal", "salary": "As per the Company's Policy", "deadline": "07 Jan 2021", "time": "Full Time", "education": "Required Education :Intermediate", "desct": "Job overview:Job Category:ITPreferred Gender:Male/FemaleJob Level:Mid LevelNo. of vacancy/s:1Salary:As per the Company's PolicyExperience:2-3 YearsJob Type:Full TimeApply Before:07 Jan 2021Educational Descriptions:Required Education :IntermediateJob Specification:Intermediate\u00a0in a related field2+ experienceHow to apply for this post ?Send your CV at career@byterays.comApply NowThe deadline to apply for the above position is January 07 2021.", "experience": "2-3 Years", "Page_URL": "https://globaljob.com.np/job/it/it/graphics-designer-publishing/6991", "websitename": "globaljob.com"}, {"name": "Web and Graphics Designer", "company": "byteRays Technology Pvt. Ltd.", "level": "Mid Level", "vacancy": "1", "address": "Baneswor, Kathmandu Nepal", "salary": "As per the Company's Policy", "deadline": "07 Jan 2021", "time": "Full Time", "education": "Required Education :Intermediate", "desct": "Job overview:Job Category:ITPreferred Gender:Male/FemaleJob Level:Mid LevelNo. of vacancy/s:1Salary:As per the Company's PolicyExperience:2-3 YearsJob Type:Full TimeApply Before:07 Jan 2021Educational Descriptions:Required Education :IntermediateJob Specification:Intermediate\u00a0in a related field2+ experienceHow to apply for this post ?Send your CV at career@byterays.comApply NowThe deadline to apply for the above position is January 07 2021.", "experience": "2-3 Years", "Page_URL": "https://globaljob.com.np/job/it/it/web-and-graphics-designer/6992", "websitename": "globaljob.com"}, {"name": "SEO specialist", "company": "byteRays Technology Pvt. Ltd.", "level": "Mid Level", "vacancy": "1", "address": "Baneswor, Kathmandu Nepal", "salary": "As per the Company's Policy", "deadline": "07 Jan 2021", "time": "Full Time", "education": "Required Education :Intermediate", "desct": "Job overview:Job Category:ITPreferred Gender:Male/FemaleJob Level:Mid LevelNo. of vacancy/s:1Salary:As per the Company's PolicyExperience:0-1 YearsJob Type:Full TimeApply Before:07 Jan 2021Educational Descriptions:Required Education :IntermediateJob Specification:Intermediate\u00a0in a related field2+ experienceHow to apply for this post ?Send your CV at career@byterays.comApply NowThe deadline to apply for the above position is January 07 2021.", "experience": "0-1 Years", "Page_URL": "https://globaljob.com.np/job/it/it/seo-specialist/6994", "websitename": "globaljob.com"}, {"name": "React Developer", "company": "UpTechSys", "level": "Mid Level", "vacancy": "1", "address": "Kathmandu", "salary": "As per the Company's Policy", "deadline": "02 Jan 2021", "time": "Full Time", "education": "Required Education :Bachelor", "desct": "Job overview:Job Category:ITPreferred Gender:Male/FemaleJob Level:Mid LevelNo. of vacancy/s:1Salary:As per the Company's PolicyExperience:2-3 YearsJob Type:Full TimeApply Before:02 Jan 2021Educational Descriptions:Required Education :BachelorSpecific Requirement :As a React Developer, you will help develop the next generation of our apps using tools such as React.js, Redux, Enzyme, and Webpack.Should be familiar with React and its ecosystem.Past experience with a React codebase is a plus but it's not a requirement.How to apply for this post ?Interested candidate can apply online or can send their updated CV at\u00a0career@uptechsys.comApply NowThe deadline to apply for the above position is January 02 2021.", "experience": "2-3 Years", "Page_URL": "https://globaljob.com.np/job/it/it/react-developer/7055", "websitename": "globaljob.com"}, {"name": "Sr. Frontend Engineer (ReactJs)", "company": "TEKKON", "level": "Senior Level", "vacancy": "1", "address": "Shree Hari Marg, Baluwatar, Kathmandu, Nepal", "salary": "As per the Company's Policy", "deadline": "10 Jan 2021", "time": "Full Time", "education": "Required Education :Bachelor", "desct": "Job overview:Job Category:ITPreferred Gender:Male/FemaleJob Level:Senior LevelNo. of vacancy/s:1Salary:As per the Company's PolicyExperience:3-5 YearsJob Type:Full TimeJob Location:KathmanduApply Before:10 Jan 2021Educational Descriptions:Required Education :BachelorJob Specification:Previous experience working as a React.js Developer.In-depth knowledge of JavaScript, CSS, HTML, and front-end languages.Knowledge of REACT tools including React.js, Webpack, Enzyme, Redux, and Flux.Experience with user interface design.Knowledge of performance testing frameworks including Mocha and Jest.Experience with browser-based debugging and performance testing software.Excellent troubleshooting skills.Good project management skills.Specific Requirement :Solid understanding of Object-Oriented JavaScript conceptsMeeting with the development team to discuss user interface ideas and applications.Reviewing application requirements and interface designs.Identifying web-based user interactions.Developing and implementing highly-responsive user interface components using React concepts.Writing application interface codes using JavaScript following React.js workflows.Troubleshooting interface software and debugging application codes.Developing and implementing front-end architecture to support user interface concepts.Monitoring and improving front-end performance.Documenting application changes and developing updates.How to apply for this post ?Interested candidates fulfilling the criteria mentioned above are highly encouraged to send a cover letter with their updated resume at\u00a0jobs@tekkon.com.npApply NowThe deadline to apply for the above position is January 10 2021.", "experience": "3-5 Years", "Page_URL": "https://globaljob.com.np/job/it/it/sr-frontend-engineer-reactjs/7140", "websitename": "globaljob.com"}, {"name": "Sr. UI/UX Designer", "company": "TEKKON", "level": "Senior Level", "vacancy": "1", "address": "Shree Hari Marg, Baluwatar, Kathmandu, Nepal", "salary": "As per the Company's Policy", "deadline": "10 Jan 2021", "time": "Full Time", "education": "Required Education :Bachelor", "desct": "Job overview:Job Category:ITPreferred Gender:Male/FemaleJob Level:Senior LevelNo. of vacancy/s:1Salary:As per the Company's PolicyExperience:3-4 yearsJob Type:Full TimeJob Location:KathmanduApply Before:10 Jan 2021Educational Descriptions:Required Education :BachelorJob Specification:Proven work experience as a UI/UX Designer or similar role.Portfolio of design projects.Knowledge of wireframe tools (e.g. wireframe.cc and InVision).Up-to-date knowledge of design software like Adobe Illustrator and Photoshop.Expert in Adobe XD, Photoshop.Knowledge around HTML5, CSS 3.0, jQuery, JS is an added advantage.Team spirit; strong communication skills to collaborate with various stakeholders.Good time-management skills.BSc in Design, Computer Science or relevant field.Specific Requirement :Gather and evaluate user requirements in collaboration with product managers and engineers.Illustrate design ideas using storyboards, process flows, and sitemaps.Design graphic user interface elements, like menus, tabs, and widgets.Build page navigation buttons and search fields.Develop UI mockups and prototypes that clearly illustrate how sites function and look like.Create original graphic designs (e.g. images, sketches, and tables).Prepare and present rough drafts to internal teams and key stakeholders.Identify and troubleshoot UX problems (e.g. responsiveness).Conduct layout adjustments based on user feedback.Adhere to style standards on fonts, colors, and imagesHow to apply for this post ?Interested candidates fulfilling the criteria mentioned above are highly encouraged to send a cover letter with their updated resume at\u00a0jobs@tekkon.com.npApply NowThe deadline to apply for the above position is January 10 2021.", "experience": "3-4 years", "Page_URL": "https://globaljob.com.np/job/it/it/sr-uiux-designer/7141", "websitename": "globaljob.com"}, {"name": "Software Engineer", "company": "Sparkle Times Pvt Limited", "level": "Mid Level", "vacancy": "1", "address": "Bhaktapur, Nepal", "salary": "As per the Company's Policy", "deadline": "14 Jan 2021", "time": "Full Time", "education": "Required Education :Bachelor", "desct": "Job overview:Job Category:ITPreferred Gender:Male/FemaleJob Level:Mid LevelNo. of vacancy/s:1Salary:As per the Company's PolicyExperience:2-3 YearsJob Type:Full TimeJob Location:KathmanduApply Before:14 Jan 2021Educational Descriptions:Required Education :BachelorJob Specification:Any Bachelor degree (preferably in Computer Science)Hands on experience in newer version of AngularExperience in HTML/CSS/JavaScript/TypeScriptKnowledge or experience in back-end development in Java or C#.NetExperience or knowledge of SQL or NoSQL databasesGood written and verbal communication skills in EnglishResult oriented and flexible in dynamic work environmentHow to apply for this post ?Send in your CV at hr@sparkletimes.coApply NowThe deadline to apply for the above position is January 14 2021.", "experience": "2-3 Years", "Page_URL": "https://globaljob.com.np/job/it/it/software-engineer/7142", "websitename": "globaljob.com"}]