[
    {
        "name": "UI/UX Designer",
        "company": "Codewing Solutions",
        "vacancy": "2",
        "time": "full-time",
        "address": "Kathmandu, Nepal",
        "deadline": "2020-12-26",
        "education": "Others",
        "experience": "2-5 years",
        "level": "Expert",
        "salary": "Rs.40000- Rs.100000",
        "desct": "UI/UX DesignerCodewing SolutionsApplyExperience:2-5 yearsLevel:ExpertTotal Positions:2Job Type:full-timeSalary:Rs.40000- Rs.100000Education:OthersLocation:Kathmandu, NepalApply Before:2020-12-26Are you passionate about design? Keep reading!.We, at Codewing Solutionsare looking for a highly skilled web designer (UI/UX or UI or UX) to join our product team to create beautiful themes, not client websites.The work requires you to work closely with our company growth strategy team and developers to create meaningful designs following WordPress theme design guidelines.If you are hired, you will work remotely but are expected to work from our office in Hadigaun (near Baluwatar) when the lockdown is over and it is safe to work from the office.What Does Codewing Solutions do?We are a creative digital agency. We are a product-based company rather than a service-oriented company.We have products in many niches.\u00a0Two of our popular products areRara ThemesandWP Travel Engine, both based on WordPress.With\u00a0millions of downloads, Rara Themes is one of the leading WordPress theme companies in the world. Similarly, WP Travel Engine is currently the world\u2019s #1 travel booking WordPress plugin.Besides\u00a0creating world-class products, we also believe in having fun at work. We work 5 days a week and, and we chill on weekends!What will you be responsible for?The job requires you to keep create beautiful designs following strategy documents provided by our strategy team. The theme you will design will be used by thousands of people from all around the world.The design you create should also be clean, user-friendly, and visually appealing.How qualified you should be?At least 2 years of experience in the UI/UX field or a similar fieldBachelor\u2019s degree in design, IT, or similar degreeStrong understanding of UI which can be proved via your sample design or previous workKnowledge about WordPress will be preferredProficient in Adobe XD, Adobe Photoshop, and Adobe IllustratorProficient in Adobe Suite, Figma, Wireframing & Prototyping tool will serve as an advantageWhy you will love working with us?When you join our team, these are some of the perks that you get.Create digital products that will be used by thousands of people all around the worldWork with a team which has a proven record of building and scaling world-class productsFun and friendly people to work withCozy workspace with CPU, dual monitor working station, and\u00a0ergonomic seating arrangement once we are back at the officeFree lunch and snacks once we are back at the officeUnlimited coffee and tea once we are back at the officeFlexible working hoursTimely performance review and annual salary reviewRecreational activitiesProvident Fund, gratuity, Dashain bonus, insurance, and paid leavesWait! Before sending your CV to us, make sure at least three of the profile matches you:I have traveled to at least 1 place in the last 1 year.I am passionate about at least one other thing apart from designing or have a hobby. Passion for designing is expected.I exercise regularly and take care of my health.I have read at least 1 book in the last 6 months.I have helped at least 1 person after the lockdown.I follow at least 1 Youtube Channel or blog regularly.Ready to Apply?If the vacancy appeals to you and matches your interest, send an email to[email\u00a0protected](NOT .COM).\u00a0The email should include the following:Your CV/ResumeYour Work PortfolioIt should also include answers to at least two of the following questions:What is the last book you read and how did that change your thought process?What causes are you passionate about?What are your 5 major strengths?We\u2019ll take it from there.Web DesignerUI/UX DesignerApply",
        "Page_URL": "https://kathmandujobs.com/jobs/25828/uiux-designer-job-in-kathmandu"
    },
    {
        "name": "Boot-Camp/ Internship For Freshers",
        "company": "Codewing Solutions",
        "vacancy": "29",
        "time": "internship",
        "address": "Kathmandu, Nepal",
        "deadline": "2020-12-26",
        "education": "Others",
        "experience": "0-1 years",
        "level": "Beginner",
        "salary": "Negotiable",
        "desct": "Boot-Camp/ Internship For FreshersCodewing SolutionsApplyExperience:0-1 yearsLevel:BeginnerTotal Positions:29Job Type:internshipSalary:NegotiableEducation:OthersLocation:Kathmandu, NepalApply Before:2020-12-26Looking for an internship program where you can have actual work experience? Keep reading\u2026.About the Program:We, at Codewing, are looking for candidates to join our Boot-camp/Internship program to have potential candidates from scratch. This program will be a self-paced internship and will not require much guidance from team leads. It is focused more on peer-to-peer learning.During this program, you will be assigned with projects, which you will need to complete to graduate from Boot-camp. The internship will be unpaid but You will be provided with free and premium resources to learn and complete the tasks.The program is intended to train and polish your skills in your respective field. Therefore, if an intern demonstrates discipline and performs well, they will be hired as a full-time employee and enrolled in six months of an extensive training program.Who we are:We are Codewing Solutions, a creative digital agency. We are a product - based company rather than a service-oriented company.We are the company behind world-class products likeRara ThemesandWP Travel Engine, both based on WordPress. Along with this, we have products in many niches.While WP Travel Engine is currently the world\u2019s no. 1 travel booking WordPress plugin with over 250,000 downloads and users from more than 50 countries, Rara Themes is one of the leading WordPress theme companies in the world.We have 85+ free and premium themes. Our themes have been downloaded more than 2 million times, and we have users from more than 100+ countries.Now, what will you get? Well,You will be provided with the necessary resources and Programs to learnGrowth with diverse projectsYou will have practical work experienceYou will have maximum exposure to a software developing environmentYour chance of getting hired will increase by many foldBy the end of the internship, candidates who performed really well will be hired.We have openings for:Front-End Development \u2013 Intern (2 Positions)We are looking for an ambitious, excited, resourceful candidate with a passion for code. Candidates must have a good grasp of Front-End tools and technologies and a keen sense of design thinking. One who is passionate about making things work and making them look good would be exactly what we are looking for.WordPress Theme Development \u2013 Intern (3 Positions)We are looking for a WordPress Development intern who is familiar with WordPress\u2019s best practices. Candidates should have an excellent grasp of PHP programming language, HTML skills, JavaScript, CSS, and have a good understanding of the WordPress framework. Good communication is always the priority. Working around theme customization will be added beneficial.Customer Support/Happiness \u2013 Intern (3 Positions)As a Customer Support/Happiness, you will be responding to our customers\u2019 emails and assist them with the issues facing while using our product. We are looking for candidates who have a good command of English and excellent communication skills. You will also be writing documentation as a part of your task. Basic knowledge of WordPress will be beneficial.Plugin Development \u2013 Intern (4 Positions)We are looking for a candidate with a basic understanding of web programming. Some experience with PHP programming language is a must. Candidates who have experience in creating and managing websites with WordPress CMS will be given preference. Basic knowledge of HTML, CSS, and JS is required.The Right candidate would possess the below qualities:PassionateEager to learnTeam PlayerAmbitiousGood Communication skillsReady to apply?Submit your updated CV along with a cover letter to[email\u00a0protected](Not .COM). Do send us your project or work done during college. It can also be something you learned on your job. Tell us why you are the best fit for this program.Note: Please mention the program name you are interested in, in the mail subject.Example:\u00a0 Applying for an SEO intern.We\u2019ll take it from here...InternshipApply",
        "Page_URL": "https://kathmandujobs.com/jobs/25827/bootcamp-internship-for-freshers-job-in-kathmandu"
    },
    {
        "name": ".net Developer with Xamarin",
        "company": "Dailo Technologies",
        "vacancy": "1",
        "time": "full-time",
        "address": "Kathmandu, Nepal",
        "deadline": "2020-12-30",
        "education": "Bachelor Degree",
        "experience": "2-5 years",
        "level": "Intermediate",
        "salary": "Negotiable",
        "desct": ".net Developer with XamarinDailo TechnologiesApplyExperience:2-5 yearsLevel:IntermediateTotal Positions:1Job Type:full-timeSalary:NegotiableEducation:Bachelor DegreeLocation:Kathmandu, NepalApply Before:2020-12-30Inbox your cv at[email\u00a0protected].net framework and XamarinApply",
        "Page_URL": "https://kathmandujobs.com/jobs/25826/net-developer-with-xamarin-job-in-kathmandu"
    },
    {
        "name": "Flutter Developer",
        "company": "Delta Tech Pvt. Ltd.",
        "vacancy": "1",
        "time": "full-time",
        "address": "Biratnagar, Nepal",
        "deadline": "2020-12-10",
        "education": "Bachelor Degree",
        "experience": "1-2 years",
        "level": "Intermediate",
        "salary": "Negotiable",
        "desct": "Flutter DeveloperDelta Tech Pvt. Ltd.ApplyExperience:1-2 yearsLevel:IntermediateTotal Positions:1Job Type:full-timeSalary:NegotiableEducation:Bachelor DegreeLocation:Biratnagar, NepalApply Before:2020-12-10Other SpecificationMin. 1 year working as a full-time professional developer (mobile) with at least 6 months experience in FlutterExperience building a moderately complex android app with knowledge of dart. Bonus if it\u2019s on the play store or we can view the projectWilling to work with cross-platform frameworksWilling to learn and work on different mobile platforms/ frameworks when neededPublished at least one app on the play store using Flutter/ Native (Java/Kotlin/ Swift/ Object c)Networking and integrating third-party APIsWorking with a version control system (i.e. Git)You areAble to multitask and focus on deadlines under pressureTeam playerPassionate about new technologyExcellent team-working skills, hardworking, creative and innovativeJob DescriptionDelta Tech is seeking a Flutter Developer who is an in-depth understanding of iOS and Android using Google Flutter Development Framework and also creative and innovative. You will be working on various internal products (DeltaSalesApp, DeltaRetailerApp, DeltaSalesCRM & DeltaInventory) and external projects with different levels of complexities and challenges.Role and Responsibilities:Your responsibilities will include (but are not limited to):As a Flutter Developer, you will create multi-platform apps for iOS and Android using Google's Flutter development framework.The primary focus will be on creating new experiences and maintaining the acclaimed app.You will additionally work on innovative new app projects as well as internally incubated ventures.Deep experience contributing to and managing high-scale production mobile apps. You must have previous experience in Flutter development.What we offerDelta Tech is looking for candidates who are loyal and plan to make a long-term commitment. In return for your loyalty we offer:Position BenefitsCompetitive/ Attractive Salary (No bar for right and deserving candidate)Timely performance appraisal and salary reviewsPaid holiday & paid leavesFestive bonusGreat work cultureFlexible timings against performanceMulti Platform AppsTime ManagementMobile Application DevelopmentGoogle'S Flutter Development FrameworkIos And AndroidTeamworkApply",
        "Page_URL": "https://kathmandujobs.com/jobs/25825/flutter-developer-job-in-biratnagar"
    },
    {
        "name": "PHP Developer",
        "company": "Podamibe Nepal Pvt. Ltd.",
        "vacancy": "1",
        "time": "full-time",
        "address": "Kathmandu, Nepal",
        "deadline": "2020-12-24",
        "education": "Bachelor Degree",
        "experience": "2-5 years",
        "level": "Intermediate",
        "salary": "Negotiable",
        "desct": "PHP DeveloperPodamibe Nepal Pvt. Ltd.ApplyExperience:2-5 yearsLevel:IntermediateTotal Positions:1Job Type:full-timeSalary:NegotiableEducation:Bachelor DegreeLocation:Kathmandu, NepalApply Before:2020-12-24Job RequirementExperience with pure- PHP (both OOP and Procedural)Excellent working knowledge of MVC framework preferable CIWorking knowledge of JavaScript, jQuery, Json, Gurnt, Saas and AjaxProficiency in SQL database development, writing and optimizing MySQL,keys, relation, indexes etc.Proficiency in using version control tool preferably GITStrong creative, analytical and problem-solving skillsAbility to challenge yourself and work well under pressureTeamworkCritical ThinkingPhpCreative ThinkingApply",
        "Page_URL": "https://kathmandujobs.com/jobs/25824/php-developer-job-in-kathmandu"
    },
    {
        "name": "Full Stack Java Developer",
        "company": "Gamenic Nalamiz Tech",
        "vacancy": "2",
        "time": "full-time",
        "address": "Bhaktapur, Nepal",
        "deadline": "2020-12-10",
        "education": "Bachelor Degree",
        "experience": "0-1 years",
        "level": "Intermediate",
        "salary": "Rs.20000- Rs.100000",
        "desct": "Full Stack Java DeveloperGamenic Nalamiz TechApplyExperience:0-1 yearsLevel:IntermediateTotal Positions:2Job Type:full-timeSalary:Rs.20000- Rs.100000Education:Bachelor DegreeLocation:Bhaktapur, NepalApply Before:2020-12-10Skills and KnowledgeExperience in parallel and multithreaded programming.Knowledge of algorithms and data structures.Interest in achieving maximum performance from available hardware and software.Familiar with design patterns.UI Development Skills (JavaFx, JavaScript, CSS, HTML, jQuery).Hands-on knowledge of Spring Framework.Strong knowledge of Relational Databases, SQL, and ORM technologies.Experience working with source control systems, such as Subversion, and GIT including branching and merging strategies.Essential technologyJavaEE \uff0b GlassFish3TypeScriptJavaScriptMariaDBExperienced and desirable technologyNode.JSAngularExperience using GithubSpring BootContainer knowledge such as DockerKnowledge that can design Class and InterfaceJavaHTMlCSSOOPJQueryGithubJsApply",
        "Page_URL": "https://kathmandujobs.com/jobs/25823/full-stack-java-developer-job-in-bhaktapur"
    },
    {
        "name": "Dot Net Software Developer (.NET Core, .NET Framework)",
        "company": "Podamibe Nepal Pvt. Ltd.",
        "vacancy": "2",
        "time": "full-time",
        "address": "Kathmandu, Nepal",
        "deadline": "2020-12-23",
        "education": "Bachelor Degree",
        "experience": "2-5 years",
        "level": "Intermediate",
        "salary": "Negotiable",
        "desct": "Dot Net Software Developer (.NET Core, .NET Framework)Podamibe Nepal Pvt. Ltd.ApplyExperience:2-5 yearsLevel:IntermediateTotal Positions:2Job Type:full-timeSalary:NegotiableEducation:Bachelor DegreeLocation:Kathmandu, NepalApply Before:2020-12-23We are looking for a C# developer responsible for building C# applications, including anything from back-end services to their client-end counterparts.Your primary responsibilities will be to design and develop these applications, and to coordinate with the rest of the team working on different layers of the infrastructure.Responsibilities- Translate application requirement to functional applications- Design, build and maintain efficient, reusable, and reliable C# code- Ensure the best possible performance, quality, and responsiveness of applications- Identify bottlenecks and bugs, and devise solutions to these problems- Help maintain code quality, organization, and atomization Skills- Proficient in C#, with a good knowledge of its ecosystems- Familiarity with the .NET framework- Familiarity with the Javascript grids- Strong understanding of object-oriented programming- Skill for writing reusable C# libraries- Familiar with various design and architectural patterns- Knowledge of concurrency patterns in C#- Familiarity with SQL Server and MySQL- The knack for writing clean, readable C# code- Proficient understanding of code versioning tools such as \u00a0git..net core .NET Framework ASP.NET Javascript MS SQL mysqlApply",
        "Page_URL": "https://kathmandujobs.com/jobs/25822/dot-net-software-developer-net-core-net-framework-job-in-kathmandu"
    },
    {
        "name": "Job Vaccancy For Laravel+ Vue Js and Quality Assurance",
        "company": "Softechpark Pvt.Ltd.",
        "vacancy": "1",
        "time": "full-time",
        "address": "Kathmandu, Nepal",
        "deadline": "2020-11-27",
        "education": "Secondary Education Examination ( SEE)",
        "experience": "2-5 years",
        "level": "Expert",
        "salary": "Rs.30000- Rs.50000",
        "desct": "Job Vaccancy For Laravel+ Vue Js and Quality AssuranceSoftechpark Pvt.Ltd.ApplyExperience:2-5 yearsLevel:ExpertTotal Positions:1Job Type:full-timeSalary:Rs.30000- Rs.50000Education:Secondary Education Examination ( SEE)Location:Kathmandu, NepalApply Before:2020-11-27Required Skill & Experiences for Laravel Developer3+ years of experiance for senior level developer and must be capable for team leading.Should be expert knowledge in web technologies including HTML, CSS, Javascript, AJAX etc.Experience working with Laravel Framework.Write quality OOP code and follow existing development standards-Knowledge of Vue.js and VueX-knowledge of Vue CLIRestful API development experience.Experience with Test-Driven Development (PHPUnit)Experience in refactoring and improving the legacy code to use modern standards and tests.Strong problem-solving skills and attention to detail.Knowledge of GIT.Work experienced in ERP based projects.Daily stand-up meetings to review current progress and obstacles with direct team.Required Skill & Experiences for Quality AssuranceProven work experience in software Quality Assurance1+ experience in related fieldStrong knowledge of software QA methodologies, tools and processesReviewing requirements and development design.Writing Test Cases.Preparing test environment.Execution of test cases and test plans.Performing different types of testing (Manual and Automation).Reporting, tracking and following-up bugs using Team Foundation Server (TFS).Performing the needed documentation related to tested software.Salary:Laravel & Vue JS Developer : 30-50 k/monthQuality Assurance:15-30kDeadline :2020-11-27We are seeking Senior Laravel+ Vue Js and one Quality Assuranceto join our Softechpark development team. We're looking for a self-motivatedinnovative programmer & Quality Assurance who's excited about leveraging new technology to improve existing enterprise systems. We need an experienced & passionate candidate only to fill this position.Apply",
        "Page_URL": "https://kathmandujobs.com/jobs/25821/job-vaccancy-for-laravel-vue-js-and-quality-assurance-job-in-kathmandu"
    },
    {
        "name": "PHP/Vue Developer (Back-end )",
        "company": "Apiera",
        "vacancy": "1",
        "time": "freelance",
        "address": "Kathmandu, Nepal",
        "deadline": "2020-11-07",
        "education": "Secondary Education Examination ( SEE)",
        "experience": "2-5 years",
        "level": "Expert",
        "salary": "Negotiable",
        "desct": "PHP/Vue Developer (Back-end )ApieraApplyExperience:2-5 yearsLevel:ExpertTotal Positions:1Job Type:freelanceSalary:NegotiableEducation:Secondary Education Examination ( SEE)Location:Kathmandu, NepalApply Before:2020-11-07Ideally: self-motivated, proactive, result-oriented, best practises, hard-working, Go-getter...PHP/Vue Developer (Back-end )Position: Senior/Mid-levelWork Environment: RemoteEmployment Type: Full-time / Part-time(Minimum 25hrs/week)Salary: Depends on Experience. No bar for Deserving Candidate.Our hiring process for this vacancy:1) CV review2) Technical evaluation test3) HR interview4) OfferThe focus of your role:PHP Developer is responsible for managing back-end services and the interchange of data between the server and the users. Your primary focus will be the development of all server-side logic, definition and maintenance of the central database, and ensuring high performance and responsiveness to requests from the front-end. You will also be responsible for integrating the front-end elements built by your co-workers into the application. Therefore, a basic understanding of front-end technologies is necessary as well.Apply by filling the form: https://forms.gle/MgGPKfxXPDkCUgwo6Please feel free to inquire at[email\u00a0protected]PHPVUELaravelApply",
        "Page_URL": "https://kathmandujobs.com/jobs/25820/phpvue-developer-backend--job-in-kathmandu"
    },
    {
        "name": "Flutter Developer",
        "company": "Codavatar Tech Private Limited",
        "vacancy": "3",
        "time": "full-time",
        "address": "Kathmandu, Nepal",
        "deadline": "2020-12-15",
        "education": "Secondary Education Examination ( SEE)",
        "experience": "2-5 years",
        "level": "Intermediate",
        "salary": "Negotiable",
        "desct": "Flutter DeveloperCodavatar Tech Private LimitedApplyExperience:2-5 yearsLevel:IntermediateTotal Positions:3Job Type:full-timeSalary:NegotiableEducation:Secondary Education Examination ( SEE)Location:Kathmandu, NepalApply Before:2020-12-15???? Job DescriptionAs a Flutter Developer, you will create multi-platform apps for iOS and Android using Google's Flutter development framework. Ideal candidates will possess a drive for thinking creatively to resolve complex problems and enjoy contributing to solutions.???? Job Requirements\u27a4 Min. 3 year working as a full-time professional developer (Mobile) with at least 1 year experience in Flutter.\u27a4 Should have strong knowledge of OOP.\u27a4 Should have clean Code architecture, patterns\u27a4 Collaborate with QA to test and deliver the product with high quality and high speed\u27a4 Experience building a moderately complex Android app with knowledge of dart.\u27a4 Willing to work with cross-platform frameworks.\u27a4 Willing to learn and work on different mobile platforms/frameworks when needed.\u27a4 Published at least one app on the Play Store using Flutter/ Native (Java/Kotlin/Swift/Object c).\u27a4 Networking and integrating third-party APIs.\u27a4 Working with a version control system (i.e., Git)\u27a4 Job Duties and Responsibilities\u27a4 As a Flutter Developer, you will create multi-platform apps for iOS and Android using Google's Flutter development framework.\u27a4 The primary focus will be on creating new applications from scratch.\u27a4 Develop SDKs, libraries, and widgets to create a mobile application development platform\u27a4 Provide feedback regarding system performance and usability issues\u27a4 Deep experience contributing to and managing high-scale production mobile apps. You must have previous experience in Flutter development.???? Required Technical and Professional Expertise\u2022 Problem Solving\u2022 Time Management\u2022 Communication\u2022 Flutter???? What we offer?\u2713 Insurance policy and Benefits\u2713 Competitive Salary\u2713 Festival & Relocation Allowance\u2713 Provident Fund & Gratuity???? About CompanyCodavatar is an Application (Web/Mobile) Development firm which provides best in class solutions on the Web, Mobility, Cloud and more internet-based services.Website Link:https://www.codavatar.com/\u270d How to applyTo apply for this position, send an email to[email\u00a0protected]with \u201cFlutter Developer\u201d in the subject line. In the email, make sure to include your resume (in word or PDF preferred), cover letter, salary requirements, and any additional information you would feel relevant for this role.*No Age Bar for deserving candidates.Problem SolvingTime ManagementCommunicationFlutterApply",
        "Page_URL": "https://kathmandujobs.com/jobs/25819/flutter-developer-job-in-kathmandu"
    },
    {
        "name": "Visual Editor/ Animator",
        "company": "Ombryo Lab Pvt. Ltd.",
        "vacancy": "3",
        "time": "full-time",
        "address": "Kathmandu, Nepal",
        "deadline": "2020-12-22",
        "education": "Bachelor Degree",
        "experience": "2-5 years",
        "level": "Intermediate",
        "salary": "Negotiable",
        "desct": "Visual Editor/ AnimatorOmbryo Lab Pvt. Ltd.ApplyExperience:2-5 yearsLevel:IntermediateTotal Positions:3Job Type:full-timeSalary:NegotiableEducation:Bachelor DegreeLocation:Kathmandu, NepalApply Before:2020-12-22\u2705 Job Requirements\u27a4 At least 2-4 years of experience in Visual Editing and Animating.\u27a4 Proficient in After Effects, Illustrator, Adobe Character Animator are preferred.\u27a4 Experience in Auto Desk Maya is encouraged.\u27a4 Good drawing skills and creativity.\u27a4 Excellent time management skills.\u27a4 Strong communication and active listening skills.\u27a4 He/ She is required to understand how a good story works and tells best through animation.\u27a4 Must be able to work in a fast-paced startup working culture\u27a4 Experienced on making Logo Animation,2D/3D animation, Short Video Ads etc.\u27a4 Worked on projects of App & Website Previews and should have a good knowledge of character animation.\u2705 Job Duties and Responsibilities\u27a4 He/ She Should work on project Line Action Explainers, 3D Product Animation and must be conceptual with video editing, visual effects.\u27a4 He/ She needs to operate and edit on Whiteboard & Animated Explainers.\u27a4 Manipulate visual effects and animations like 2D, 3D using computerized technology and software applications.\u27a4 Creating visuals for video games and mobile applications.\u27a4 Generating simulations and mockups to be viewed and approved by those involved in media production and stakeholders.\u27a4 Troubleshooting any issues with animations.\u27a4 Establish storyboards to understand the images needed for the storyline and purpose of production.\u27a4 Ensure logical sequencing and smooth running.\u27a4 Adhering to tight deadlines and other constraints to meet production times.\u2705Required Technical and Professional Expertise\u27a4 Bachelor\u2019s degree in relevant field\u27a4 Excellent interpersonal and communication skills\u27a4 Research Oriented\u27a4 Critical Thinker\u27a4 Must have a solid Animation and Graphic Design Portfolio\u27a4 Should possess creativity and innovativeness\u27a4 Must be a team player\u27a4 Must be able to work in fast paced startup working culture\u27a4 Must be able to navigate complicated processes with many users, and convey information in an understandable way to them\u2705 What we offer?\u27a4 Competitive Salary\u27a4 Festival & Relocation Allowance\u27a4 Provident Fund & Gratuity\u27a4 Growth & Development Opportunities\u27a4 Friendly and creative working environment\u2705 About CompanyOmbryo Lab is a Startup Incubator which aims in changing the IT Landscape of Nepal with the adoption of Silicon Valley culture. We create a long term impact by sprouting the right talent to a fully grown venture which is capable of driving the next generation innovation and developing cutting edge products.???? How to apply\u270f\ufe0f To apply for this position, send an email with a link to your latest portfolio to[email\u00a0protected]with \u201cAnimator/ Visual Editor\u201d in the subject line. In the email, make sure to include your resume (in word or PDF preferred), cover letter, salary requirements and any additional information you would feel relevant for this role.Critical ThinkerMust have a solid Animation and Graphic Design PortfolioShould possess creativity and innovativenessMust be a team playerMust be able to work in fast paced startup working cultureApply",
        "Page_URL": "https://kathmandujobs.com/jobs/25818/visual-editor-animator-job-in-kathmandu"
    },
    {
        "name": "Urdu Tutor",
        "company": "Ombryo Lab Pvt. Ltd.",
        "vacancy": "3",
        "time": "full-time",
        "address": "Kathmandu, Nepal",
        "deadline": "2020-12-15",
        "education": "Secondary Education Examination ( SEE)",
        "experience": "0-1 years",
        "level": "Beginner",
        "salary": "Negotiable",
        "desct": "Urdu TutorOmbryo Lab Pvt. Ltd.ApplyExperience:0-1 yearsLevel:BeginnerTotal Positions:3Job Type:full-timeSalary:NegotiableEducation:Secondary Education Examination ( SEE)Location:Kathmandu, NepalApply Before:2020-12-15????Requirement:\u2705Should have completed minimum +2\u2705Should have good fluency in English and Urdu not only inwritten but speaking will be given more importance.\u2705Able to type in Urdu\u2705Should be able to interact with student freely. Extrovertnature will be preferred.????Responsibilities:\u2705Translation of documents from Urdu to English and Viceversa\u2705Conduct classes\u2705Design the study materialsShould have good fluency in English and Urdu not only in written but speaking will be given more importance.Able to type in UrduShould be able to interact with student freely. Extrovert nature will be preferred.Apply",
        "Page_URL": "https://kathmandujobs.com/jobs/25817/urdu-tutor-job-in-kathmandu"
    },
    {
        "name": "UI/UX Designer",
        "company": "Codavatar Tech Private Limited",
        "vacancy": "3",
        "time": "full-time",
        "address": "Kathmandu, Nepal",
        "deadline": "2020-12-15",
        "education": "Secondary Education Examination ( SEE)",
        "experience": "2-5 years",
        "level": "Intermediate",
        "salary": "Negotiable",
        "desct": "UI/UX DesignerCodavatar Tech Private LimitedApplyExperience:2-5 yearsLevel:IntermediateTotal Positions:3Job Type:full-timeSalary:NegotiableEducation:Secondary Education Examination ( SEE)Location:Kathmandu, NepalApply Before:2020-12-15Job Duties and Responsibiliies\u2022 Plan and implement new designs\u2022 Optimize existing user interface designs\u2022 Test for intuitivity and experience\u2022 Communicate with clients to understand their business goals and objectives\u2022 Develop technical and business requirements and always strive to deliver intuitive and user-centered solutions\u2022 Combine creativity with an awareness of the design elements\u2022 Create prototypes for new product ideas\u2022 Test new ideas before implementing\u2022 Conduct an ongoing user research\u2713 Problem solver and customer-centeredKnowledge of Adobe range of products including Photoshop0IllustratorInDesignAcrobat and DreamweaverYears of experience with HTML5 & CSS3Some knowledge of Usability Factors in Human Computer Interaction.Apply",
        "Page_URL": "https://kathmandujobs.com/jobs/25816/uiux-designer-job-in-kathmandu"
    },
    {
        "name": "React.js Developer (Web Developer)",
        "company": "e-digital Nepal Pvt. Ltd.",
        "vacancy": "1",
        "time": "full-time",
        "address": "Kathmandu, Nepal",
        "deadline": "2020-12-05",
        "education": "Bachelor Degree",
        "experience": "1-2 years",
        "level": "Intermediate",
        "salary": "Negotiable",
        "desct": "React.js Developer (Web Developer)e-digital Nepal Pvt. Ltd.ApplyExperience:1-2 yearsLevel:IntermediateTotal Positions:1Job Type:full-timeSalary:NegotiableEducation:Bachelor DegreeLocation:Kathmandu, NepalApply Before:2020-12-05We are looking for a skilled React.js Developer to join our front-end development team. In this role, you will be responsible for developing and implementing user interface components using React.js concepts and workflows such as Redux, Flux, and Webpack. You will also be responsible for profiling and improving front-end performance and documenting our front-end codebase.To ensure success as a React.js Developer, you should have in-depth knowledge of JavaScript and React concepts, excellent front-end coding skills, and a good understanding of progressive web applications. Ultimately, a top-class React.js Developer should be able to design and build modern user interface components to enhance application performance.React.js Developer Responsibilities:Meeting with the development team to discuss user interface ideas and applications.Reviewing application requirements and interface designs.Identifying web-based user interactions.Developing and implementing highly-responsive user interface components using React concepts.Writing application interface codes using JavaScript following React.js workflows.Troubleshooting interface software and debugging application codes.Developing and implementing front-end architecture to support user interface concepts.Monitoring and improving front-end performance.Documenting application changes and developing updates.React.js Developer Requirements:Bachelor\u2019s degree in Computer Science, Information Technology, or a similar field.Previous experience working as a React.js Developer.In-depth knowledge of JavaScript, CSS, HTML, and front-end languages.Knowledge of REACT tools including React.js, Webpack, Enzyme, Redux, and Flux.Experience with user interface design.Knowledge of performance testing frameworks including Mocha and Jest.Experience with browser-based debugging and performance testing software.Excellent troubleshooting skills.Good project management skills.Knowledge of REACT tools including React.jsWebpackEnzymeReduxand Flux.Apply",
        "Page_URL": "https://kathmandujobs.com/jobs/25815/reactjs-developer-web-developer-job-in-kathmandu"
    },
    {
        "name": "UI/UX Designer",
        "company": "Codewing Solutions",
        "vacancy": "2",
        "time": "full-time",
        "address": "Kathmandu, Nepal",
        "deadline": "2020-12-26",
        "education": "Others",
        "experience": "2-5 years",
        "level": "Expert",
        "salary": "Rs.40000- Rs.100000",
        "desct": "UI/UX DesignerCodewing SolutionsApplyExperience:2-5 yearsLevel:ExpertTotal Positions:2Job Type:full-timeSalary:Rs.40000- Rs.100000Education:OthersLocation:Kathmandu, NepalApply Before:2020-12-26Are you passionate about design? Keep reading!.We, at Codewing Solutionsare looking for a highly skilled web designer (UI/UX or UI or UX) to join our product team to create beautiful themes, not client websites.The work requires you to work closely with our company growth strategy team and developers to create meaningful designs following WordPress theme design guidelines.If you are hired, you will work remotely but are expected to work from our office in Hadigaun (near Baluwatar) when the lockdown is over and it is safe to work from the office.What Does Codewing Solutions do?We are a creative digital agency. We are a product-based company rather than a service-oriented company.We have products in many niches.\u00a0Two of our popular products areRara ThemesandWP Travel Engine, both based on WordPress.With\u00a0millions of downloads, Rara Themes is one of the leading WordPress theme companies in the world. Similarly, WP Travel Engine is currently the world\u2019s #1 travel booking WordPress plugin.Besides\u00a0creating world-class products, we also believe in having fun at work. We work 5 days a week and, and we chill on weekends!What will you be responsible for?The job requires you to keep create beautiful designs following strategy documents provided by our strategy team. The theme you will design will be used by thousands of people from all around the world.The design you create should also be clean, user-friendly, and visually appealing.How qualified you should be?At least 2 years of experience in the UI/UX field or a similar fieldBachelor\u2019s degree in design, IT, or similar degreeStrong understanding of UI which can be proved via your sample design or previous workKnowledge about WordPress will be preferredProficient in Adobe XD, Adobe Photoshop, and Adobe IllustratorProficient in Adobe Suite, Figma, Wireframing & Prototyping tool will serve as an advantageWhy you will love working with us?When you join our team, these are some of the perks that you get.Create digital products that will be used by thousands of people all around the worldWork with a team which has a proven record of building and scaling world-class productsFun and friendly people to work withCozy workspace with CPU, dual monitor working station, and\u00a0ergonomic seating arrangement once we are back at the officeFree lunch and snacks once we are back at the officeUnlimited coffee and tea once we are back at the officeFlexible working hoursTimely performance review and annual salary reviewRecreational activitiesProvident Fund, gratuity, Dashain bonus, insurance, and paid leavesWait! Before sending your CV to us, make sure at least three of the profile matches you:I have traveled to at least 1 place in the last 1 year.I am passionate about at least one other thing apart from designing or have a hobby. Passion for designing is expected.I exercise regularly and take care of my health.I have read at least 1 book in the last 6 months.I have helped at least 1 person after the lockdown.I follow at least 1 Youtube Channel or blog regularly.Ready to Apply?If the vacancy appeals to you and matches your interest, send an email to[email\u00a0protected](NOT .COM).\u00a0The email should include the following:Your CV/ResumeYour Work PortfolioIt should also include answers to at least two of the following questions:What is the last book you read and how did that change your thought process?What causes are you passionate about?What are your 5 major strengths?We\u2019ll take it from there.Web DesignerUI/UX DesignerApply",
        "Page_URL": "https://kathmandujobs.com/jobs/25828/uiux-designer-job-in-kathmandu"
    },
    {
        "name": "Boot-Camp/ Internship For Freshers",
        "company": "Codewing Solutions",
        "vacancy": "29",
        "time": "internship",
        "address": "Kathmandu, Nepal",
        "deadline": "2020-12-26",
        "education": "Others",
        "experience": "0-1 years",
        "level": "Beginner",
        "salary": "Negotiable",
        "desct": "Boot-Camp/ Internship For FreshersCodewing SolutionsApplyExperience:0-1 yearsLevel:BeginnerTotal Positions:29Job Type:internshipSalary:NegotiableEducation:OthersLocation:Kathmandu, NepalApply Before:2020-12-26Looking for an internship program where you can have actual work experience? Keep reading\u2026.About the Program:We, at Codewing, are looking for candidates to join our Boot-camp/Internship program to have potential candidates from scratch. This program will be a self-paced internship and will not require much guidance from team leads. It is focused more on peer-to-peer learning.During this program, you will be assigned with projects, which you will need to complete to graduate from Boot-camp. The internship will be unpaid but You will be provided with free and premium resources to learn and complete the tasks.The program is intended to train and polish your skills in your respective field. Therefore, if an intern demonstrates discipline and performs well, they will be hired as a full-time employee and enrolled in six months of an extensive training program.Who we are:We are Codewing Solutions, a creative digital agency. We are a product - based company rather than a service-oriented company.We are the company behind world-class products likeRara ThemesandWP Travel Engine, both based on WordPress. Along with this, we have products in many niches.While WP Travel Engine is currently the world\u2019s no. 1 travel booking WordPress plugin with over 250,000 downloads and users from more than 50 countries, Rara Themes is one of the leading WordPress theme companies in the world.We have 85+ free and premium themes. Our themes have been downloaded more than 2 million times, and we have users from more than 100+ countries.Now, what will you get? Well,You will be provided with the necessary resources and Programs to learnGrowth with diverse projectsYou will have practical work experienceYou will have maximum exposure to a software developing environmentYour chance of getting hired will increase by many foldBy the end of the internship, candidates who performed really well will be hired.We have openings for:Front-End Development \u2013 Intern (2 Positions)We are looking for an ambitious, excited, resourceful candidate with a passion for code. Candidates must have a good grasp of Front-End tools and technologies and a keen sense of design thinking. One who is passionate about making things work and making them look good would be exactly what we are looking for.WordPress Theme Development \u2013 Intern (3 Positions)We are looking for a WordPress Development intern who is familiar with WordPress\u2019s best practices. Candidates should have an excellent grasp of PHP programming language, HTML skills, JavaScript, CSS, and have a good understanding of the WordPress framework. Good communication is always the priority. Working around theme customization will be added beneficial.Customer Support/Happiness \u2013 Intern (3 Positions)As a Customer Support/Happiness, you will be responding to our customers\u2019 emails and assist them with the issues facing while using our product. We are looking for candidates who have a good command of English and excellent communication skills. You will also be writing documentation as a part of your task. Basic knowledge of WordPress will be beneficial.Plugin Development \u2013 Intern (4 Positions)We are looking for a candidate with a basic understanding of web programming. Some experience with PHP programming language is a must. Candidates who have experience in creating and managing websites with WordPress CMS will be given preference. Basic knowledge of HTML, CSS, and JS is required.The Right candidate would possess the below qualities:PassionateEager to learnTeam PlayerAmbitiousGood Communication skillsReady to apply?Submit your updated CV along with a cover letter to[email\u00a0protected](Not .COM). Do send us your project or work done during college. It can also be something you learned on your job. Tell us why you are the best fit for this program.Note: Please mention the program name you are interested in, in the mail subject.Example:\u00a0 Applying for an SEO intern.We\u2019ll take it from here...InternshipApply",
        "Page_URL": "https://kathmandujobs.com/jobs/25827/bootcamp-internship-for-freshers-job-in-kathmandu"
    },
    {
        "name": ".net Developer with Xamarin",
        "company": "Dailo Technologies",
        "vacancy": "1",
        "time": "full-time",
        "address": "Kathmandu, Nepal",
        "deadline": "2020-12-30",
        "education": "Bachelor Degree",
        "experience": "2-5 years",
        "level": "Intermediate",
        "salary": "Negotiable",
        "desct": ".net Developer with XamarinDailo TechnologiesApplyExperience:2-5 yearsLevel:IntermediateTotal Positions:1Job Type:full-timeSalary:NegotiableEducation:Bachelor DegreeLocation:Kathmandu, NepalApply Before:2020-12-30Inbox your cv at[email\u00a0protected].net framework and XamarinApply",
        "Page_URL": "https://kathmandujobs.com/jobs/25826/net-developer-with-xamarin-job-in-kathmandu"
    },
    {
        "name": "Flutter Developer",
        "company": "Delta Tech Pvt. Ltd.",
        "vacancy": "1",
        "time": "full-time",
        "address": "Biratnagar, Nepal",
        "deadline": "2020-12-10",
        "education": "Bachelor Degree",
        "experience": "1-2 years",
        "level": "Intermediate",
        "salary": "Negotiable",
        "desct": "Flutter DeveloperDelta Tech Pvt. Ltd.ApplyExperience:1-2 yearsLevel:IntermediateTotal Positions:1Job Type:full-timeSalary:NegotiableEducation:Bachelor DegreeLocation:Biratnagar, NepalApply Before:2020-12-10Other SpecificationMin. 1 year working as a full-time professional developer (mobile) with at least 6 months experience in FlutterExperience building a moderately complex android app with knowledge of dart. Bonus if it\u2019s on the play store or we can view the projectWilling to work with cross-platform frameworksWilling to learn and work on different mobile platforms/ frameworks when neededPublished at least one app on the play store using Flutter/ Native (Java/Kotlin/ Swift/ Object c)Networking and integrating third-party APIsWorking with a version control system (i.e. Git)You areAble to multitask and focus on deadlines under pressureTeam playerPassionate about new technologyExcellent team-working skills, hardworking, creative and innovativeJob DescriptionDelta Tech is seeking a Flutter Developer who is an in-depth understanding of iOS and Android using Google Flutter Development Framework and also creative and innovative. You will be working on various internal products (DeltaSalesApp, DeltaRetailerApp, DeltaSalesCRM & DeltaInventory) and external projects with different levels of complexities and challenges.Role and Responsibilities:Your responsibilities will include (but are not limited to):As a Flutter Developer, you will create multi-platform apps for iOS and Android using Google's Flutter development framework.The primary focus will be on creating new experiences and maintaining the acclaimed app.You will additionally work on innovative new app projects as well as internally incubated ventures.Deep experience contributing to and managing high-scale production mobile apps. You must have previous experience in Flutter development.What we offerDelta Tech is looking for candidates who are loyal and plan to make a long-term commitment. In return for your loyalty we offer:Position BenefitsCompetitive/ Attractive Salary (No bar for right and deserving candidate)Timely performance appraisal and salary reviewsPaid holiday & paid leavesFestive bonusGreat work cultureFlexible timings against performanceMulti Platform AppsTime ManagementMobile Application DevelopmentGoogle'S Flutter Development FrameworkIos And AndroidTeamworkApply",
        "Page_URL": "https://kathmandujobs.com/jobs/25825/flutter-developer-job-in-biratnagar"
    },
    {
        "name": "PHP Developer",
        "company": "Podamibe Nepal Pvt. Ltd.",
        "vacancy": "1",
        "time": "full-time",
        "address": "Kathmandu, Nepal",
        "deadline": "2020-12-24",
        "education": "Bachelor Degree",
        "experience": "2-5 years",
        "level": "Intermediate",
        "salary": "Negotiable",
        "desct": "PHP DeveloperPodamibe Nepal Pvt. Ltd.ApplyExperience:2-5 yearsLevel:IntermediateTotal Positions:1Job Type:full-timeSalary:NegotiableEducation:Bachelor DegreeLocation:Kathmandu, NepalApply Before:2020-12-24Job RequirementExperience with pure- PHP (both OOP and Procedural)Excellent working knowledge of MVC framework preferable CIWorking knowledge of JavaScript, jQuery, Json, Gurnt, Saas and AjaxProficiency in SQL database development, writing and optimizing MySQL,keys, relation, indexes etc.Proficiency in using version control tool preferably GITStrong creative, analytical and problem-solving skillsAbility to challenge yourself and work well under pressureTeamworkCritical ThinkingPhpCreative ThinkingApply",
        "Page_URL": "https://kathmandujobs.com/jobs/25824/php-developer-job-in-kathmandu"
    },
    {
        "name": "Full Stack Java Developer",
        "company": "Gamenic Nalamiz Tech",
        "vacancy": "2",
        "time": "full-time",
        "address": "Bhaktapur, Nepal",
        "deadline": "2020-12-10",
        "education": "Bachelor Degree",
        "experience": "0-1 years",
        "level": "Intermediate",
        "salary": "Rs.20000- Rs.100000",
        "desct": "Full Stack Java DeveloperGamenic Nalamiz TechApplyExperience:0-1 yearsLevel:IntermediateTotal Positions:2Job Type:full-timeSalary:Rs.20000- Rs.100000Education:Bachelor DegreeLocation:Bhaktapur, NepalApply Before:2020-12-10Skills and KnowledgeExperience in parallel and multithreaded programming.Knowledge of algorithms and data structures.Interest in achieving maximum performance from available hardware and software.Familiar with design patterns.UI Development Skills (JavaFx, JavaScript, CSS, HTML, jQuery).Hands-on knowledge of Spring Framework.Strong knowledge of Relational Databases, SQL, and ORM technologies.Experience working with source control systems, such as Subversion, and GIT including branching and merging strategies.Essential technologyJavaEE \uff0b GlassFish3TypeScriptJavaScriptMariaDBExperienced and desirable technologyNode.JSAngularExperience using GithubSpring BootContainer knowledge such as DockerKnowledge that can design Class and InterfaceJavaHTMlCSSOOPJQueryGithubJsApply",
        "Page_URL": "https://kathmandujobs.com/jobs/25823/full-stack-java-developer-job-in-bhaktapur"
    },
    {
        "name": "Dot Net Software Developer (.NET Core, .NET Framework)",
        "company": "Podamibe Nepal Pvt. Ltd.",
        "vacancy": "2",
        "time": "full-time",
        "address": "Kathmandu, Nepal",
        "deadline": "2020-12-23",
        "education": "Bachelor Degree",
        "experience": "2-5 years",
        "level": "Intermediate",
        "salary": "Negotiable",
        "desct": "Dot Net Software Developer (.NET Core, .NET Framework)Podamibe Nepal Pvt. Ltd.ApplyExperience:2-5 yearsLevel:IntermediateTotal Positions:2Job Type:full-timeSalary:NegotiableEducation:Bachelor DegreeLocation:Kathmandu, NepalApply Before:2020-12-23We are looking for a C# developer responsible for building C# applications, including anything from back-end services to their client-end counterparts.Your primary responsibilities will be to design and develop these applications, and to coordinate with the rest of the team working on different layers of the infrastructure.Responsibilities- Translate application requirement to functional applications- Design, build and maintain efficient, reusable, and reliable C# code- Ensure the best possible performance, quality, and responsiveness of applications- Identify bottlenecks and bugs, and devise solutions to these problems- Help maintain code quality, organization, and atomization Skills- Proficient in C#, with a good knowledge of its ecosystems- Familiarity with the .NET framework- Familiarity with the Javascript grids- Strong understanding of object-oriented programming- Skill for writing reusable C# libraries- Familiar with various design and architectural patterns- Knowledge of concurrency patterns in C#- Familiarity with SQL Server and MySQL- The knack for writing clean, readable C# code- Proficient understanding of code versioning tools such as \u00a0git..net core .NET Framework ASP.NET Javascript MS SQL mysqlApply",
        "Page_URL": "https://kathmandujobs.com/jobs/25822/dot-net-software-developer-net-core-net-framework-job-in-kathmandu"
    },
    {
        "name": "Job Vaccancy For Laravel+ Vue Js and Quality Assurance",
        "company": "Softechpark Pvt.Ltd.",
        "vacancy": "1",
        "time": "full-time",
        "address": "Kathmandu, Nepal",
        "deadline": "2020-11-27",
        "education": "Secondary Education Examination ( SEE)",
        "experience": "2-5 years",
        "level": "Expert",
        "salary": "Rs.30000- Rs.50000",
        "desct": "Job Vaccancy For Laravel+ Vue Js and Quality AssuranceSoftechpark Pvt.Ltd.ApplyExperience:2-5 yearsLevel:ExpertTotal Positions:1Job Type:full-timeSalary:Rs.30000- Rs.50000Education:Secondary Education Examination ( SEE)Location:Kathmandu, NepalApply Before:2020-11-27Required Skill & Experiences for Laravel Developer3+ years of experiance for senior level developer and must be capable for team leading.Should be expert knowledge in web technologies including HTML, CSS, Javascript, AJAX etc.Experience working with Laravel Framework.Write quality OOP code and follow existing development standards-Knowledge of Vue.js and VueX-knowledge of Vue CLIRestful API development experience.Experience with Test-Driven Development (PHPUnit)Experience in refactoring and improving the legacy code to use modern standards and tests.Strong problem-solving skills and attention to detail.Knowledge of GIT.Work experienced in ERP based projects.Daily stand-up meetings to review current progress and obstacles with direct team.Required Skill & Experiences for Quality AssuranceProven work experience in software Quality Assurance1+ experience in related fieldStrong knowledge of software QA methodologies, tools and processesReviewing requirements and development design.Writing Test Cases.Preparing test environment.Execution of test cases and test plans.Performing different types of testing (Manual and Automation).Reporting, tracking and following-up bugs using Team Foundation Server (TFS).Performing the needed documentation related to tested software.Salary:Laravel & Vue JS Developer : 30-50 k/monthQuality Assurance:15-30kDeadline :2020-11-27We are seeking Senior Laravel+ Vue Js and one Quality Assuranceto join our Softechpark development team. We're looking for a self-motivatedinnovative programmer & Quality Assurance who's excited about leveraging new technology to improve existing enterprise systems. We need an experienced & passionate candidate only to fill this position.Apply",
        "Page_URL": "https://kathmandujobs.com/jobs/25821/job-vaccancy-for-laravel-vue-js-and-quality-assurance-job-in-kathmandu"
    },
    {
        "name": "PHP/Vue Developer (Back-end )",
        "company": "Apiera",
        "vacancy": "1",
        "time": "freelance",
        "address": "Kathmandu, Nepal",
        "deadline": "2020-11-07",
        "education": "Secondary Education Examination ( SEE)",
        "experience": "2-5 years",
        "level": "Expert",
        "salary": "Negotiable",
        "desct": "PHP/Vue Developer (Back-end )ApieraApplyExperience:2-5 yearsLevel:ExpertTotal Positions:1Job Type:freelanceSalary:NegotiableEducation:Secondary Education Examination ( SEE)Location:Kathmandu, NepalApply Before:2020-11-07Ideally: self-motivated, proactive, result-oriented, best practises, hard-working, Go-getter...PHP/Vue Developer (Back-end )Position: Senior/Mid-levelWork Environment: RemoteEmployment Type: Full-time / Part-time(Minimum 25hrs/week)Salary: Depends on Experience. No bar for Deserving Candidate.Our hiring process for this vacancy:1) CV review2) Technical evaluation test3) HR interview4) OfferThe focus of your role:PHP Developer is responsible for managing back-end services and the interchange of data between the server and the users. Your primary focus will be the development of all server-side logic, definition and maintenance of the central database, and ensuring high performance and responsiveness to requests from the front-end. You will also be responsible for integrating the front-end elements built by your co-workers into the application. Therefore, a basic understanding of front-end technologies is necessary as well.Apply by filling the form: https://forms.gle/MgGPKfxXPDkCUgwo6Please feel free to inquire at[email\u00a0protected]PHPVUELaravelApply",
        "Page_URL": "https://kathmandujobs.com/jobs/25820/phpvue-developer-backend--job-in-kathmandu"
    },
    {
        "name": "Flutter Developer",
        "company": "Codavatar Tech Private Limited",
        "vacancy": "3",
        "time": "full-time",
        "address": "Kathmandu, Nepal",
        "deadline": "2020-12-15",
        "education": "Secondary Education Examination ( SEE)",
        "experience": "2-5 years",
        "level": "Intermediate",
        "salary": "Negotiable",
        "desct": "Flutter DeveloperCodavatar Tech Private LimitedApplyExperience:2-5 yearsLevel:IntermediateTotal Positions:3Job Type:full-timeSalary:NegotiableEducation:Secondary Education Examination ( SEE)Location:Kathmandu, NepalApply Before:2020-12-15???? Job DescriptionAs a Flutter Developer, you will create multi-platform apps for iOS and Android using Google's Flutter development framework. Ideal candidates will possess a drive for thinking creatively to resolve complex problems and enjoy contributing to solutions.???? Job Requirements\u27a4 Min. 3 year working as a full-time professional developer (Mobile) with at least 1 year experience in Flutter.\u27a4 Should have strong knowledge of OOP.\u27a4 Should have clean Code architecture, patterns\u27a4 Collaborate with QA to test and deliver the product with high quality and high speed\u27a4 Experience building a moderately complex Android app with knowledge of dart.\u27a4 Willing to work with cross-platform frameworks.\u27a4 Willing to learn and work on different mobile platforms/frameworks when needed.\u27a4 Published at least one app on the Play Store using Flutter/ Native (Java/Kotlin/Swift/Object c).\u27a4 Networking and integrating third-party APIs.\u27a4 Working with a version control system (i.e., Git)\u27a4 Job Duties and Responsibilities\u27a4 As a Flutter Developer, you will create multi-platform apps for iOS and Android using Google's Flutter development framework.\u27a4 The primary focus will be on creating new applications from scratch.\u27a4 Develop SDKs, libraries, and widgets to create a mobile application development platform\u27a4 Provide feedback regarding system performance and usability issues\u27a4 Deep experience contributing to and managing high-scale production mobile apps. You must have previous experience in Flutter development.???? Required Technical and Professional Expertise\u2022 Problem Solving\u2022 Time Management\u2022 Communication\u2022 Flutter???? What we offer?\u2713 Insurance policy and Benefits\u2713 Competitive Salary\u2713 Festival & Relocation Allowance\u2713 Provident Fund & Gratuity???? About CompanyCodavatar is an Application (Web/Mobile) Development firm which provides best in class solutions on the Web, Mobility, Cloud and more internet-based services.Website Link:https://www.codavatar.com/\u270d How to applyTo apply for this position, send an email to v[email\u00a0protected]with \u201cFlutter Developer\u201d in the subject line. In the email, make sure to include your resume (in word or PDF preferred), cover letter, salary requirements, and any additional information you would feel relevant for this role.*No Age Bar for deserving candidates.Problem SolvingTime ManagementCommunicationFlutterApply",
        "Page_URL": "https://kathmandujobs.com/jobs/25819/flutter-developer-job-in-kathmandu"
    },
    {
        "name": "Visual Editor/ Animator",
        "company": "Ombryo Lab Pvt. Ltd.",
        "vacancy": "3",
        "time": "full-time",
        "address": "Kathmandu, Nepal",
        "deadline": "2020-12-22",
        "education": "Bachelor Degree",
        "experience": "2-5 years",
        "level": "Intermediate",
        "salary": "Negotiable",
        "desct": "Visual Editor/ AnimatorOmbryo Lab Pvt. Ltd.ApplyExperience:2-5 yearsLevel:IntermediateTotal Positions:3Job Type:full-timeSalary:NegotiableEducation:Bachelor DegreeLocation:Kathmandu, NepalApply Before:2020-12-22\u2705 Job Requirements\u27a4 At least 2-4 years of experience in Visual Editing and Animating.\u27a4 Proficient in After Effects, Illustrator, Adobe Character Animator are preferred.\u27a4 Experience in Auto Desk Maya is encouraged.\u27a4 Good drawing skills and creativity.\u27a4 Excellent time management skills.\u27a4 Strong communication and active listening skills.\u27a4 He/ She is required to understand how a good story works and tells best through animation.\u27a4 Must be able to work in a fast-paced startup working culture\u27a4 Experienced on making Logo Animation,2D/3D animation, Short Video Ads etc.\u27a4 Worked on projects of App & Website Previews and should have a good knowledge of character animation.\u2705 Job Duties and Responsibilities\u27a4 He/ She Should work on project Line Action Explainers, 3D Product Animation and must be conceptual with video editing, visual effects.\u27a4 He/ She needs to operate and edit on Whiteboard & Animated Explainers.\u27a4 Manipulate visual effects and animations like 2D, 3D using computerized technology and software applications.\u27a4 Creating visuals for video games and mobile applications.\u27a4 Generating simulations and mockups to be viewed and approved by those involved in media production and stakeholders.\u27a4 Troubleshooting any issues with animations.\u27a4 Establish storyboards to understand the images needed for the storyline and purpose of production.\u27a4 Ensure logical sequencing and smooth running.\u27a4 Adhering to tight deadlines and other constraints to meet production times.\u2705Required Technical and Professional Expertise\u27a4 Bachelor\u2019s degree in relevant field\u27a4 Excellent interpersonal and communication skills\u27a4 Research Oriented\u27a4 Critical Thinker\u27a4 Must have a solid Animation and Graphic Design Portfolio\u27a4 Should possess creativity and innovativeness\u27a4 Must be a team player\u27a4 Must be able to work in fast paced startup working culture\u27a4 Must be able to navigate complicated processes with many users, and convey information in an understandable way to them\u2705 What we offer?\u27a4 Competitive Salary\u27a4 Festival & Relocation Allowance\u27a4 Provident Fund & Gratuity\u27a4 Growth & Development Opportunities\u27a4 Friendly and creative working environment\u2705 About CompanyOmbryo Lab is a Startup Incubator which aims in changing the IT Landscape of Nepal with the adoption of Silicon Valley culture. We create a long term impact by sprouting the right talent to a fully grown venture which is capable of driving the next generation innovation and developing cutting edge products.???? How to apply\u270f\ufe0f To apply for this position, send an email with a link to your latest portfolio to[email\u00a0protected]with \u201cAnimator/ Visual Editor\u201d in the subject line. In the email, make sure to include your resume (in word or PDF preferred), cover letter, salary requirements and any additional information you would feel relevant for this role.Critical ThinkerMust have a solid Animation and Graphic Design PortfolioShould possess creativity and innovativenessMust be a team playerMust be able to work in fast paced startup working cultureApply",
        "Page_URL": "https://kathmandujobs.com/jobs/25818/visual-editor-animator-job-in-kathmandu"
    },
    {
        "name": "Urdu Tutor",
        "company": "Ombryo Lab Pvt. Ltd.",
        "vacancy": "3",
        "time": "full-time",
        "address": "Kathmandu, Nepal",
        "deadline": "2020-12-15",
        "education": "Secondary Education Examination ( SEE)",
        "experience": "0-1 years",
        "level": "Beginner",
        "salary": "Negotiable",
        "desct": "Urdu TutorOmbryo Lab Pvt. Ltd.ApplyExperience:0-1 yearsLevel:BeginnerTotal Positions:3Job Type:full-timeSalary:NegotiableEducation:Secondary Education Examination ( SEE)Location:Kathmandu, NepalApply Before:2020-12-15????Requirement:\u2705Should have completed minimum +2\u2705Should have good fluency in English and Urdu not only inwritten but speaking will be given more importance.\u2705Able to type in Urdu\u2705Should be able to interact with student freely. Extrovertnature will be preferred.????Responsibilities:\u2705Translation of documents from Urdu to English and Viceversa\u2705Conduct classes\u2705Design the study materialsShould have good fluency in English and Urdu not only in written but speaking will be given more importance.Able to type in UrduShould be able to interact with student freely. Extrovert nature will be preferred.Apply",
        "Page_URL": "https://kathmandujobs.com/jobs/25817/urdu-tutor-job-in-kathmandu"
    },
    {
        "name": "UI/UX Designer",
        "company": "Codavatar Tech Private Limited",
        "vacancy": "3",
        "time": "full-time",
        "address": "Kathmandu, Nepal",
        "deadline": "2020-12-15",
        "education": "Secondary Education Examination ( SEE)",
        "experience": "2-5 years",
        "level": "Intermediate",
        "salary": "Negotiable",
        "desct": "UI/UX DesignerCodavatar Tech Private LimitedApplyExperience:2-5 yearsLevel:IntermediateTotal Positions:3Job Type:full-timeSalary:NegotiableEducation:Secondary Education Examination ( SEE)Location:Kathmandu, NepalApply Before:2020-12-15Job Duties and Responsibiliies\u2022 Plan and implement new designs\u2022 Optimize existing user interface designs\u2022 Test for intuitivity and experience\u2022 Communicate with clients to understand their business goals and objectives\u2022 Develop technical and business requirements and always strive to deliver intuitive and user-centered solutions\u2022 Combine creativity with an awareness of the design elements\u2022 Create prototypes for new product ideas\u2022 Test new ideas before implementing\u2022 Conduct an ongoing user research\u2713 Problem solver and customer-centeredKnowledge of Adobe range of products including Photoshop0IllustratorInDesignAcrobat and DreamweaverYears of experience with HTML5 & CSS3Some knowledge of Usability Factors in Human Computer Interaction.Apply",
        "Page_URL": "https://kathmandujobs.com/jobs/25816/uiux-designer-job-in-kathmandu"
    },
    {
        "name": "React.js Developer (Web Developer)",
        "company": "e-digital Nepal Pvt. Ltd.",
        "vacancy": "1",
        "time": "full-time",
        "address": "Kathmandu, Nepal",
        "deadline": "2020-12-05",
        "education": "Bachelor Degree",
        "experience": "1-2 years",
        "level": "Intermediate",
        "salary": "Negotiable",
        "desct": "React.js Developer (Web Developer)e-digital Nepal Pvt. Ltd.ApplyExperience:1-2 yearsLevel:IntermediateTotal Positions:1Job Type:full-timeSalary:NegotiableEducation:Bachelor DegreeLocation:Kathmandu, NepalApply Before:2020-12-05We are looking for a skilled React.js Developer to join our front-end development team. In this role, you will be responsible for developing and implementing user interface components using React.js concepts and workflows such as Redux, Flux, and Webpack. You will also be responsible for profiling and improving front-end performance and documenting our front-end codebase.To ensure success as a React.js Developer, you should have in-depth knowledge of JavaScript and React concepts, excellent front-end coding skills, and a good understanding of progressive web applications. Ultimately, a top-class React.js Developer should be able to design and build modern user interface components to enhance application performance.React.js Developer Responsibilities:Meeting with the development team to discuss user interface ideas and applications.Reviewing application requirements and interface designs.Identifying web-based user interactions.Developing and implementing highly-responsive user interface components using React concepts.Writing application interface codes using JavaScript following React.js workflows.Troubleshooting interface software and debugging application codes.Developing and implementing front-end architecture to support user interface concepts.Monitoring and improving front-end performance.Documenting application changes and developing updates.React.js Developer Requirements:Bachelor\u2019s degree in Computer Science, Information Technology, or a similar field.Previous experience working as a React.js Developer.In-depth knowledge of JavaScript, CSS, HTML, and front-end languages.Knowledge of REACT tools including React.js, Webpack, Enzyme, Redux, and Flux.Experience with user interface design.Knowledge of performance testing frameworks including Mocha and Jest.Experience with browser-based debugging and performance testing software.Excellent troubleshooting skills.Good project management skills.Knowledge of REACT tools including React.jsWebpackEnzymeReduxand Flux.Apply",
        "Page_URL": "https://kathmandujobs.com/jobs/25815/reactjs-developer-web-developer-job-in-kathmandu"
    },
    {
        "name": "React.js Developer (Web Developer)",
        "company": "e-digital Nepal Pvt. Ltd.",
        "vacancy": "1",
        "time": "full-time",
        "address": "Kathmandu, Nepal",
        "deadline": "2020-12-05",
        "education": "Bachelor Degree",
        "experience": "1-2 years",
        "level": "Intermediate",
        "salary": "Negotiable",
        "desct": "React.js Developer (Web Developer)e-digital Nepal Pvt. Ltd.ApplyExperience:1-2 yearsLevel:IntermediateTotal Positions:1Job Type:full-timeSalary:NegotiableEducation:Bachelor DegreeLocation:Kathmandu, NepalApply Before:2020-12-05We are looking for a skilled React.js Developer to join our front-end development team. In this role, you will be responsible for developing and implementing user interface components using React.js concepts and workflows such as Redux, Flux, and Webpack. You will also be responsible for profiling and improving front-end performance and documenting our front-end codebase.To ensure success as a React.js Developer, you should have in-depth knowledge of JavaScript and React concepts, excellent front-end coding skills, and a good understanding of progressive web applications. Ultimately, a top-class React.js Developer should be able to design and build modern user interface components to enhance application performance.React.js Developer Responsibilities:Meeting with the development team to discuss user interface ideas and applications.Reviewing application requirements and interface designs.Identifying web-based user interactions.Developing and implementing highly-responsive user interface components using React concepts.Writing application interface codes using JavaScript following React.js workflows.Troubleshooting interface software and debugging application codes.Developing and implementing front-end architecture to support user interface concepts.Monitoring and improving front-end performance.Documenting application changes and developing updates.React.js Developer Requirements:Bachelor\u2019s degree in Computer Science, Information Technology, or a similar field.Previous experience working as a React.js Developer.In-depth knowledge of JavaScript, CSS, HTML, and front-end languages.Knowledge of REACT tools including React.js, Webpack, Enzyme, Redux, and Flux.Experience with user interface design.Knowledge of performance testing frameworks including Mocha and Jest.Experience with browser-based debugging and performance testing software.Excellent troubleshooting skills.Good project management skills.Knowledge of REACT tools including React.jsWebpackEnzymeReduxand Flux.Apply",
        "Page_URL": "https://kathmandujobs.com/jobs/25815/reactjs-developer-web-developer-job-in-kathmandu"
    },
    {
        "name": "Software Trainer",
        "company": "Quantum IT SOLUTIONS",
        "vacancy": "5",
        "time": "freelance",
        "address": "Kathmandu, Nepal",
        "deadline": "2020-11-30",
        "education": "Higher Secondary Level (+2)",
        "experience": "0-1 years",
        "level": "Beginner",
        "salary": "Negotiable",
        "desct": "Software TrainerQuantum IT SOLUTIONSApplyExperience:0-1 yearsLevel:BeginnerTotal Positions:5Job Type:freelanceSalary:NegotiableEducation:Higher Secondary Level (+2)Location:Kathmandu, NepalApply Before:2020-11-30\u2022 Maintaining relationships with the existing client bases related to software.\u2022 Identifying and solving queries and concerns of the clients and ensuring client satisfaction.\u2022 Good communication skills.\u2022 Experience in presenting to groups of individuals face to face and running online demonstrations of products/servicesGood CommunicationApply",
        "Page_URL": "https://kathmandujobs.com/jobs/25814/software-trainer-job-in-kathmandu"
    },
    {
        "name": "Machine Learning Engineer - Part Time",
        "company": "Techrise",
        "vacancy": "1",
        "time": "part-time",
        "address": "Lalitpur, Nepal",
        "deadline": "2020-11-21",
        "education": "Bachelor Degree",
        "experience": "2-5 years",
        "level": "Intermediate",
        "salary": "Rs.30000- Rs.45000",
        "desct": "Machine Learning Engineer - Part TimeTechriseApplyExperience:2-5 yearsLevel:IntermediateTotal Positions:1Job Type:part-timeSalary:Rs.30000- Rs.45000Education:Bachelor DegreeLocation:Lalitpur, NepalApply Before:2020-11-21We are looking for:An expert in machine learning to help us to design and build an online e-learning program.A person who can work part-time for about 15 - 20 hours a week. (It is remote work. Working hours can be decided according to your circumstances.)Required skills:Advanced degree in computer science, math, statistics or a related disciplineExtensive data modeling and data architecture skillsProgramming experience in PythonExperience in machine learning frameworks in python such as TensorFlow or KerasStrong knowledge about machine learning and deep learning algorithms such as k-Nearest, NLP and sequence modeling, along with CNNStrong written and verbal communications in EnglishCore responsibilities:Create, check, and modify online courses about machine learningCommunicate with the foreign team for any improvement in our online programsResearch, Design and Frame Machine Learning SystemsUnderstand and Transform the Prototypes of Data ScienceVerifying data quality, and/or ensuring it via data cleaningPerform Machine Learning Model Tests and ExperimentsDevelop the Machine Learning Model as per the NeedSelect and Implement Right Machine Learning AlgorithmsUnderstand Business Objectives and Developing the ML ModelsCompany benefits:Friendly, creative working environment with a foreign teamWorking with the latest technologiesTimely salary reviewRemote working policyApplying Procedure:If you believe you are the one and have a passion to work with us,APPLY NOWwithYour recent resume\u00a0in PDF formatYour desired weekly working hours and\u00a0monthly salaryat[email\u00a0protected].We are looking forward to receiving your application!Machine LearningApply",
        "Page_URL": "https://kathmandujobs.com/jobs/25813/machine-learning-engineer-part-time-job-in-lalitpur"
    },
    {
        "name": "Senior .NET developer",
        "company": "Singapore Ecommerce App Pte. Ltd",
        "vacancy": "2",
        "time": "full-time",
        "address": "Kathmandu, Nepal",
        "deadline": "2020-12-16",
        "education": "Bachelor Degree",
        "experience": "5-10 years",
        "level": "Expert",
        "salary": "Negotiable",
        "desct": "Senior .NET developerSingapore Ecommerce App Pte. LtdApplyExperience:5-10 yearsLevel:ExpertTotal Positions:2Job Type:full-timeSalary:NegotiableEducation:Bachelor DegreeLocation:Kathmandu, NepalApply Before:2020-12-16Please state your current salary, expected salary, notice period, contact-able referenceStrong knowledge of Object-Oriented Programming and Design ConceptsKnowledge of software development life-cycle for web-based applicationsExperience in design and development experience with C#, Angular, .NET web framework, .NET and/or .NET CoreProficient in MS SQL queries, familiar with Database Design and Stored ProceduresExperience in web technologies: JavaScript, AJAX, jQuery, HTML5, CSSDesign and develop and maintain simple to complex modules for our productsInvestigate new APIs and learn how to use themUbuntuWindows Serversystem designSQL Server.NET coreasp.net.NET MVCversion controlsearch database like elasticsearchcache system like redisApply",
        "Page_URL": "https://kathmandujobs.com/jobs/25812/senior-net-developer-job-in-kathmandu"
    },
    {
        "name": ".Net Developer",
        "company": "Krennova Pvt. Ltd",
        "vacancy": "2",
        "time": "full-time",
        "address": "Kathmandu, Nepal",
        "deadline": "2020-11-30",
        "education": "Bachelor Degree",
        "experience": "2-5 years",
        "level": "Intermediate",
        "salary": "Rs.30000- Rs.45000",
        "desct": ".Net DeveloperKrennova Pvt. LtdApplyExperience:2-5 yearsLevel:IntermediateTotal Positions:2Job Type:full-timeSalary:Rs.30000- Rs.45000Education:Bachelor DegreeLocation:Kathmandu, NepalApply Before:2020-11-30Krennova Tech is looking for Associate Software Engineer (.NET), who will be responsible for creating ASP.NET web applications, providing support to clients and writing quality and scalable codes in .NET Framework.Job Responsibilities:Develop web applications using ASP.NET.Modify existing ASP.NET web applications according to requirements.Develop ASP.NET Web APIs and Web Services for mobile applications.Professional Skill Required:.NET Core, ASP.NET MVC, Web API, Entity Framework, MSSqlOther Specification:Bachelor in Computer Engineering/Science or related field or equivalentPrior experience as a .NET developer (At least 2 year)Knowledge of .NET Framework (ASP.NET MVC, Web API and Web Services)Knowledge of Umbraco CMS V 7.0 will be plus.Ability to use Visual Studio for application development and debuggingKnowledge of MSSQL (SQL Queries, tables, stored-procedures and functions)Proficiencies in HTML, CSS, JavaScriptWork remotely during pandemic. Please send your details to[email\u00a0protected]..NET CoreASP.NET MVCWeb APIEntity FrameworkMSSqlApply",
        "Page_URL": "https://kathmandujobs.com/jobs/25811/net-developer-job-in-kathmandu"
    },
    {
        "name": "Product photographer",
        "company": "parsa handicraft",
        "vacancy": "1",
        "time": "full-time",
        "address": "Kathmandu, Nepal",
        "deadline": "2020-12-08",
        "education": "Higher Secondary Level (+2)",
        "experience": "1-2 years",
        "level": "Intermediate",
        "salary": "Rs.30000- Rs.38000",
        "desct": "Product photographerparsa handicraftApplyExperience:1-2 yearsLevel:IntermediateTotal Positions:1Job Type:full-timeSalary:Rs.30000- Rs.38000Education:Higher Secondary Level (+2)Location:Kathmandu, NepalApply Before:2020-12-08Take professional pictures in a studio or in a particular locationTo produce high-quality photographic imagesUse different techniques to enhance the photographs as requiredUse photo manipulation software such as Adobe Suite to get desired resultsRecommend creative ideas to exceed expectations of goals and objectivesUse artistic knowledge to enhance and compose photographsReview sets of photographs and select the best resultsOperate various photographic equipment such as single lens reflex cameras and film or digital cameras and lighting.high-quality photographicApply",
        "Page_URL": "https://kathmandujobs.com/jobs/25809/product-photographer-job-in-kathmandu"
    },
    {
        "name": "Angular Developer",
        "company": "PalmMind IT",
        "vacancy": "3",
        "time": "full-time",
        "address": "Kathmandu, Nepal",
        "deadline": "2020-12-10",
        "education": "Bachelor Degree",
        "experience": "2-5 years",
        "level": "Expert",
        "salary": "Negotiable",
        "desct": "Angular DeveloperPalmMind ITApplyExperience:2-5 yearsLevel:ExpertTotal Positions:3Job Type:full-timeSalary:NegotiableEducation:Bachelor DegreeLocation:Kathmandu, NepalApply Before:2020-12-10Strong Knowledge of Angular FrameworkWork as a part of an Agile team.Build and maintain JS based code baseStrong knowledge of NodeJSGood problem-solving skillsStrong knowledge of developing and utilising APIs.Problem-solving skillsApply",
        "Page_URL": "https://kathmandujobs.com/jobs/25808/angular-developer-job-in-kathmandu"
    },
    {
        "name": "Python Developer",
        "company": "Numeric Mind",
        "vacancy": "2",
        "time": "full-time",
        "address": "Kathmandu, Nepal",
        "deadline": "2020-11-30",
        "education": "Bachelor Degree",
        "experience": "1-2 years",
        "level": "Intermediate",
        "salary": "Negotiable",
        "desct": "Python DeveloperNumeric MindApplyExperience:1-2 yearsLevel:IntermediateTotal Positions:2Job Type:full-timeSalary:NegotiableEducation:Bachelor DegreeLocation:Kathmandu, NepalApply Before:2020-11-30About the company and Partner: Nimble Clinical Research is a US based technology company dedicated towards creating innovative software applications for pharmaceutical and biotech companies. We are building our local Nepal team via our partner company, Numeric Mind Pvt Ltd (numericmind.com) in Nepal, and looking for the best python developers. Visit Nimble Clinical Research, LLC (nimble-cr.com) to know\u00a0about our current software applications.Role and Responsibilities\u2022 As a Python developer, you\u2019ll design and develop highly complex modules in our data analytics platform.\u2022 The ideal candidate is a self-starter, independent and passionate developer with a strong desire to create high-quality applications.\u2022 You are expected to continually learn and apply best software development practices and technologies to the tasks at hand.\u2022 Use core python, data analysis related packages (such as numpy, pandas, matplotlib, SciPy) and QT (to design user interface elements).Requirements\u2022 Expert in core python, and OOP\u2022 Strong experience in numpy, pandas desired\u2022 At least 3 months on-job experience as a trainee or an employee; Over 1-year experience preferred\u2022 Education: BS in Computer Science or equivalent degree.Type: Full-timeNumber of Openings: 2Location: Remote/office in NepalCompensation:\u00a0Attractive salary, higher than the market rate, along with increments every 6 monthsREFERRAL: Do you know someone else who is a great python programmer? Earn NRP 20,000 by referring a candidate. Refer them to us! On successful hiring of the candidate, lasting at least a month of employment, you will get NR 20,000 as referral reward.Applying: if interested, send your resume directly to[email\u00a0protected]. In the resume include your git repository link and LinkedIn profile link if available.Python ProgrammingnumpypandasmatplotlibSciPy and QTApply",
        "Page_URL": "https://kathmandujobs.com/jobs/25807/python-developer-job-in-kathmandu"
    },
    {
        "name": "Full Stack Java Developer",
        "company": "Gamenic Nalamiz Tech",
        "vacancy": "2",
        "time": "full-time",
        "address": "Bhaktapur, Nepal",
        "deadline": "2020-11-15",
        "education": "Bachelor Degree",
        "experience": "0-1 years",
        "level": "Intermediate",
        "salary": "Rs.15000- Rs.50000",
        "desct": "Full Stack Java DeveloperGamenic Nalamiz TechApplyExperience:0-1 yearsLevel:IntermediateTotal Positions:2Job Type:full-timeSalary:Rs.15000- Rs.50000Education:Bachelor DegreeLocation:Bhaktapur, NepalApply Before:2020-11-15Skills and KnowledgeExperience in parallel and multithreaded programming.Knowledge of algorithms and data structures.Interest in achieving maximum performance from available hardware and software.Familiar with design patterns.UI Development Skills (JavaFx, JavaScript, CSS, HTML, jQuery).Hands-on knowledge on Spring Framework.Strong knowledge of Relational Databases, SQL, and ORM technologies.Experience working with source control systems, such as Subversion, and GIT including branching and merging strategies.Essential technologyJavaEE \uff0b GlassFish3TypeScriptJavaScriptMariDBExperienced and desirable technologyNode.JSAngularExperience using GitSpling BootContainer knowledge such as DockerKnowledge that can design Class and InterfaceCSSHTMLJavaJQueryOOPApply",
        "Page_URL": "https://kathmandujobs.com/jobs/25806/full-stack-java-developer-job-in-bhaktapur"
    },
    {
        "name": "Assitant PTE Tutor",
        "company": "Ombryo Lab Pvt. Ltd.",
        "vacancy": "1",
        "time": "full-time",
        "address": "Kathmandu, Nepal",
        "deadline": "2020-11-30",
        "education": "Bachelor Degree",
        "experience": "1-2 years",
        "level": "Intermediate",
        "salary": "Negotiable",
        "desct": "Assitant PTE TutorOmbryo Lab Pvt. Ltd.ApplyExperience:1-2 yearsLevel:IntermediateTotal Positions:1Job Type:full-timeSalary:NegotiableEducation:Bachelor DegreeLocation:Kathmandu, NepalApply Before:2020-11-30Requirement:Should have completed Bachelor\u2019s DegreeMinimum of 1 year experience in teaching PTE/IELTSShould have very good fluency in speaking and writing in English.Carry out the task given with diligenceHave to have good team spirit\u27a4 Responsibilities:\u270eWorking hours: 7 am to 3 pm (Should be flexible in timings)\u270eWorking Modality: Work from home. Everything required to do the job like the computer etc. will be providedShould have very good fluency in speaking and writing in English.Carry out the task given with diligenceHave to have good team spiritApply",
        "Page_URL": "https://kathmandujobs.com/jobs/25805/assitant-pte-tutor-job-in-kathmandu"
    },
    {
        "name": "Full Stack Developer Node.js / Vue.js - Senior Level",
        "company": "Outsource Array P. Ltd.",
        "vacancy": "2",
        "time": "full-time",
        "address": "Kathmandu, Nepal",
        "deadline": "2020-11-20",
        "education": "Bachelor Degree",
        "experience": "2-5 years",
        "level": "Expert",
        "salary": "Negotiable",
        "desct": "Full Stack Developer Node.js / Vue.js - Senior LevelOutsource Array P. Ltd.ApplyExperience:2-5 yearsLevel:ExpertTotal Positions:2Job Type:full-timeSalary:NegotiableEducation:Bachelor DegreeLocation:Kathmandu, NepalApply Before:2020-11-20We are looking for Full Stack developers who need to be able to work on a weekly release schedule, with online demos and a minimal SCRUM routine.Need to be experts at REST webservice, Node.js and/or Vue.js.Our technology stack is:Backend webservices: on Node.js, Postgresql, Docker, Assorted AWS managed services, OAuth2.Front-end: Vue.js, bootstrap.Applications can be made online here or send us your CVs to:[email\u00a0protected]REST webserviceNode.js and/or Vue.jsApply",
        "Page_URL": "https://kathmandujobs.com/jobs/25804/full-stack-developer-nodejs-vuejs-senior-level-job-in-kathmandu"
    },
    {
        "name": "UI/UX Designer",
        "company": "Ombryo Lab Pvt. Ltd.",
        "vacancy": "2",
        "time": "full-time",
        "address": "Kathmandu, Nepal",
        "deadline": "2020-12-02",
        "education": "Secondary Education Examination ( SEE)",
        "experience": "2-5 years",
        "level": "Intermediate",
        "salary": "Negotiable",
        "desct": "UI/UX DesignerOmbryo Lab Pvt. Ltd.ApplyExperience:2-5 yearsLevel:IntermediateTotal Positions:2Job Type:full-timeSalary:NegotiableEducation:Secondary Education Examination ( SEE)Location:Kathmandu, NepalApply Before:2020-12-02Job Duties and Responsibilities\u00d8 Collaborate with other team members and stakeholders of the project\u00d8 Gather and evaluate user requirements, in collaboration with product managers and engineers.\u00d8 Create customer journey maps to better understand customer\u2019s interactions with the business over time and across service channels and iterate the design to develop the best ever user experience.\u00d8 Illustrate design ideas using storyboards, process flows and sitemaps.\u00d8 Plan and Implement new designs and optimize existing user interface designs.\u00d8 Develop technical and business requirements and always strive to deliver intuitive and user-centered solutions\u00d8 Combine creativity with an awareness of the design elements\u00d8 Create prototypes for new product ideas\u00d8 Test new ideas before implementing\u00d8 Conduct an ongoing user research\u00d8 Be prepared to constantly be asked to try new things, and pushed to continuously improve.\u00a7 Required Technical and Professional Expertise\u00d8 Bachelor\u2019s degree in relevant field\u00d8 Excellent interpersonal and communication skills\u00d8 Research Oriented\u00d8 Critical Thinker\u00d8 Some knowledge of Usability Factors in Human Computer Interaction\u00d8 Must have a solid UI Design Portfolio\u00d8 Should possess creativity and innovativeness\u00d8 Must be a team player\u00d8 Must be able to work in fast paced startup working culture\u00d8 Must be able to navigate complicated processes with many users, and convey information in an understandable way to themProficient in HTML and CSSDeep Understanding of cutting edge latest UI/UX trends.Excellent knowledge about user interfacebrowser compatibility and Web 2.0Ability to breakdown complex interaction to simpleelegant and straightforward user interactions and experiences.Apply",
        "Page_URL": "https://kathmandujobs.com/jobs/25803/uiux-designer-job-in-kathmandu"
    },
    {
        "name": "Inside Sales Executive",
        "company": "Codavatar Tech Private Limited",
        "vacancy": "8",
        "time": "full-time",
        "address": "Kathmandu, Nepal",
        "deadline": "2020-11-10",
        "education": "Secondary Education Examination ( SEE)",
        "experience": "2-5 years",
        "level": "Intermediate",
        "salary": "Rs.40000- Rs.40000",
        "desct": "Inside Sales ExecutiveCodavatar Tech Private LimitedApplyExperience:2-5 yearsLevel:IntermediateTotal Positions:8Job Type:full-timeSalary:Rs.40000- Rs.40000Education:Secondary Education Examination ( SEE)Location:Kathmandu, NepalApply Before:2020-11-10Responsibilities:1. Performance inside sales (Remote selling model) for B2B Saas products (IT Products).2. Good communication skills. Good command on English language.3. Good presentation skills (Having skill to provide online demo)4. Having knowledge of various inside sales tool to generate lead.5. Having co-ordination skill to do co-ordination with the team members for decision making.6. Schedule online demonstration with customer.What is in store for you?1. An opportunity to define, lead and co-ordinate the entire sales of the product.2. Work in a fast-paced start up environmentReach usIf you think this role is aligned with your career, kindly write me an email along with your updated CV on[email\u00a0protected]for a confidential discussion on the role.Good communication skills. Good command on English language.Apply",
        "Page_URL": "https://kathmandujobs.com/jobs/25802/inside-sales-executive-job-in-kathmandu"
    },
    {
        "name": "Mid Level Python Developer",
        "company": "Codavatar Tech Private Limited",
        "vacancy": "3",
        "time": "full-time",
        "address": "Kathmandu, Nepal",
        "deadline": "2020-11-30",
        "education": "Secondary Education Examination ( SEE)",
        "experience": "2-5 years",
        "level": "Intermediate",
        "salary": "Negotiable",
        "desct": "Mid Level Python DeveloperCodavatar Tech Private LimitedApplyExperience:2-5 yearsLevel:IntermediateTotal Positions:3Job Type:full-timeSalary:NegotiableEducation:Secondary Education Examination ( SEE)Location:Kathmandu, NepalApply Before:2020-11-30\u00d8Knowledge of object-oriented programming\u00d8 Experience with Python Flask or Django\u00d8 Experience with MySQL/PostgreSQL\u00d8 Agile/Scrum experience and communication skills\u00d8 Basic understanding of HTML5, CSS and Javascript\u00d8 Familiarity with regular expressions\u00d8 Experience with writing Unit test cases\u00d8 Familiar with Pylint and PEP 8 Python development style guide????Additional experience will be plus\u2705\u00a0VueJS/React/Angular\u2705\u00a0AWS\u2705\u00a0Gitflow\u2705\u00a0Docker\u2705\u00a0Experience in third party API integrationsAgile/Scrum experience and communication skillsKnowledge of object-oriented programmingExperience with Python Flask or DjangoExperience with MySQL/PostgreSQLApply",
        "Page_URL": "https://kathmandujobs.com/jobs/25801/mid-level-python-developer-job-in-kathmandu"
    },
    {
        "name": "UI/UX Designer",
        "company": "Codewing Solutions",
        "vacancy": "2",
        "time": "full-time",
        "address": "Kathmandu, Nepal",
        "deadline": "2020-12-26",
        "education": "Others",
        "experience": "2-5 years",
        "level": "Expert",
        "salary": "Rs.40000- Rs.100000",
        "desct": "UI/UX DesignerCodewing SolutionsApplyExperience:2-5 yearsLevel:ExpertTotal Positions:2Job Type:full-timeSalary:Rs.40000- Rs.100000Education:OthersLocation:Kathmandu, NepalApply Before:2020-12-26Are you passionate about design? Keep reading!.We, at Codewing Solutionsare looking for a highly skilled web designer (UI/UX or UI or UX) to join our product team to create beautiful themes, not client websites.The work requires you to work closely with our company growth strategy team and developers to create meaningful designs following WordPress theme design guidelines.If you are hired, you will work remotely but are expected to work from our office in Hadigaun (near Baluwatar) when the lockdown is over and it is safe to work from the office.What Does Codewing Solutions do?We are a creative digital agency. We are a product-based company rather than a service-oriented company.We have products in many niches.\u00a0Two of our popular products areRara ThemesandWP Travel Engine, both based on WordPress.With\u00a0millions of downloads, Rara Themes is one of the leading WordPress theme companies in the world. Similarly, WP Travel Engine is currently the world\u2019s #1 travel booking WordPress plugin.Besides\u00a0creating world-class products, we also believe in having fun at work. We work 5 days a week and, and we chill on weekends!What will you be responsible for?The job requires you to keep create beautiful designs following strategy documents provided by our strategy team. The theme you will design will be used by thousands of people from all around the world.The design you create should also be clean, user-friendly, and visually appealing.How qualified you should be?At least 2 years of experience in the UI/UX field or a similar fieldBachelor\u2019s degree in design, IT, or similar degreeStrong understanding of UI which can be proved via your sample design or previous workKnowledge about WordPress will be preferredProficient in Adobe XD, Adobe Photoshop, and Adobe IllustratorProficient in Adobe Suite, Figma, Wireframing & Prototyping tool will serve as an advantageWhy you will love working with us?When you join our team, these are some of the perks that you get.Create digital products that will be used by thousands of people all around the worldWork with a team which has a proven record of building and scaling world-class productsFun and friendly people to work withCozy workspace with CPU, dual monitor working station, and\u00a0ergonomic seating arrangement once we are back at the officeFree lunch and snacks once we are back at the officeUnlimited coffee and tea once we are back at the officeFlexible working hoursTimely performance review and annual salary reviewRecreational activitiesProvident Fund, gratuity, Dashain bonus, insurance, and paid leavesWait! Before sending your CV to us, make sure at least three of the profile matches you:I have traveled to at least 1 place in the last 1 year.I am passionate about at least one other thing apart from designing or have a hobby. Passion for designing is expected.I exercise regularly and take care of my health.I have read at least 1 book in the last 6 months.I have helped at least 1 person after the lockdown.I follow at least 1 Youtube Channel or blog regularly.Ready to Apply?If the vacancy appeals to you and matches your interest, send an email to[email\u00a0protected](NOT .COM).\u00a0The email should include the following:Your CV/ResumeYour Work PortfolioIt should also include answers to at least two of the following questions:What is the last book you read and how did that change your thought process?What causes are you passionate about?What are your 5 major strengths?We\u2019ll take it from there.Web DesignerUI/UX DesignerApply",
        "Page_URL": "https://kathmandujobs.com/jobs/25828/uiux-designer-job-in-kathmandu"
    },
    {
        "name": "Boot-Camp/ Internship For Freshers",
        "company": "Codewing Solutions",
        "vacancy": "29",
        "time": "internship",
        "address": "Kathmandu, Nepal",
        "deadline": "2020-12-26",
        "education": "Others",
        "experience": "0-1 years",
        "level": "Beginner",
        "salary": "Negotiable",
        "desct": "Boot-Camp/ Internship For FreshersCodewing SolutionsApplyExperience:0-1 yearsLevel:BeginnerTotal Positions:29Job Type:internshipSalary:NegotiableEducation:OthersLocation:Kathmandu, NepalApply Before:2020-12-26Looking for an internship program where you can have actual work experience? Keep reading\u2026.About the Program:We, at Codewing, are looking for candidates to join our Boot-camp/Internship program to have potential candidates from scratch. This program will be a self-paced internship and will not require much guidance from team leads. It is focused more on peer-to-peer learning.During this program, you will be assigned with projects, which you will need to complete to graduate from Boot-camp. The internship will be unpaid but You will be provided with free and premium resources to learn and complete the tasks.The program is intended to train and polish your skills in your respective field. Therefore, if an intern demonstrates discipline and performs well, they will be hired as a full-time employee and enrolled in six months of an extensive training program.Who we are:We are Codewing Solutions, a creative digital agency. We are a product - based company rather than a service-oriented company.We are the company behind world-class products likeRara ThemesandWP Travel Engine, both based on WordPress. Along with this, we have products in many niches.While WP Travel Engine is currently the world\u2019s no. 1 travel booking WordPress plugin with over 250,000 downloads and users from more than 50 countries, Rara Themes is one of the leading WordPress theme companies in the world.We have 85+ free and premium themes. Our themes have been downloaded more than 2 million times, and we have users from more than 100+ countries.Now, what will you get? Well,You will be provided with the necessary resources and Programs to learnGrowth with diverse projectsYou will have practical work experienceYou will have maximum exposure to a software developing environmentYour chance of getting hired will increase by many foldBy the end of the internship, candidates who performed really well will be hired.We have openings for:Front-End Development \u2013 Intern (2 Positions)We are looking for an ambitious, excited, resourceful candidate with a passion for code. Candidates must have a good grasp of Front-End tools and technologies and a keen sense of design thinking. One who is passionate about making things work and making them look good would be exactly what we are looking for.WordPress Theme Development \u2013 Intern (3 Positions)We are looking for a WordPress Development intern who is familiar with WordPress\u2019s best practices. Candidates should have an excellent grasp of PHP programming language, HTML skills, JavaScript, CSS, and have a good understanding of the WordPress framework. Good communication is always the priority. Working around theme customization will be added beneficial.Customer Support/Happiness \u2013 Intern (3 Positions)As a Customer Support/Happiness, you will be responding to our customers\u2019 emails and assist them with the issues facing while using our product. We are looking for candidates who have a good command of English and excellent communication skills. You will also be writing documentation as a part of your task. Basic knowledge of WordPress will be beneficial.Plugin Development \u2013 Intern (4 Positions)We are looking for a candidate with a basic understanding of web programming. Some experience with PHP programming language is a must. Candidates who have experience in creating and managing websites with WordPress CMS will be given preference. Basic knowledge of HTML, CSS, and JS is required.The Right candidate would possess the below qualities:PassionateEager to learnTeam PlayerAmbitiousGood Communication skillsReady to apply?Submit your updated CV along with a cover letter to[email\u00a0protected](Not .COM). Do send us your project or work done during college. It can also be something you learned on your job. Tell us why you are the best fit for this program.Note: Please mention the program name you are interested in, in the mail subject.Example:\u00a0 Applying for an SEO intern.We\u2019ll take it from here...InternshipApply",
        "Page_URL": "https://kathmandujobs.com/jobs/25827/bootcamp-internship-for-freshers-job-in-kathmandu"
    },
    {
        "name": ".net Developer with Xamarin",
        "company": "Dailo Technologies",
        "vacancy": "1",
        "time": "full-time",
        "address": "Kathmandu, Nepal",
        "deadline": "2020-12-30",
        "education": "Bachelor Degree",
        "experience": "2-5 years",
        "level": "Intermediate",
        "salary": "Negotiable",
        "desct": ".net Developer with XamarinDailo TechnologiesApplyExperience:2-5 yearsLevel:IntermediateTotal Positions:1Job Type:full-timeSalary:NegotiableEducation:Bachelor DegreeLocation:Kathmandu, NepalApply Before:2020-12-30Inbox your cv at[email\u00a0protected].net framework and XamarinApply",
        "Page_URL": "https://kathmandujobs.com/jobs/25826/net-developer-with-xamarin-job-in-kathmandu"
    },
    {
        "name": "Flutter Developer",
        "company": "Delta Tech Pvt. Ltd.",
        "vacancy": "1",
        "time": "full-time",
        "address": "Biratnagar, Nepal",
        "deadline": "2020-12-10",
        "education": "Bachelor Degree",
        "experience": "1-2 years",
        "level": "Intermediate",
        "salary": "Negotiable",
        "desct": "Flutter DeveloperDelta Tech Pvt. Ltd.ApplyExperience:1-2 yearsLevel:IntermediateTotal Positions:1Job Type:full-timeSalary:NegotiableEducation:Bachelor DegreeLocation:Biratnagar, NepalApply Before:2020-12-10Other SpecificationMin. 1 year working as a full-time professional developer (mobile) with at least 6 months experience in FlutterExperience building a moderately complex android app with knowledge of dart. Bonus if it\u2019s on the play store or we can view the projectWilling to work with cross-platform frameworksWilling to learn and work on different mobile platforms/ frameworks when neededPublished at least one app on the play store using Flutter/ Native (Java/Kotlin/ Swift/ Object c)Networking and integrating third-party APIsWorking with a version control system (i.e. Git)You areAble to multitask and focus on deadlines under pressureTeam playerPassionate about new technologyExcellent team-working skills, hardworking, creative and innovativeJob DescriptionDelta Tech is seeking a Flutter Developer who is an in-depth understanding of iOS and Android using Google Flutter Development Framework and also creative and innovative. You will be working on various internal products (DeltaSalesApp, DeltaRetailerApp, DeltaSalesCRM & DeltaInventory) and external projects with different levels of complexities and challenges.Role and Responsibilities:Your responsibilities will include (but are not limited to):As a Flutter Developer, you will create multi-platform apps for iOS and Android using Google's Flutter development framework.The primary focus will be on creating new experiences and maintaining the acclaimed app.You will additionally work on innovative new app projects as well as internally incubated ventures.Deep experience contributing to and managing high-scale production mobile apps. You must have previous experience in Flutter development.What we offerDelta Tech is looking for candidates who are loyal and plan to make a long-term commitment. In return for your loyalty we offer:Position BenefitsCompetitive/ Attractive Salary (No bar for right and deserving candidate)Timely performance appraisal and salary reviewsPaid holiday & paid leavesFestive bonusGreat work cultureFlexible timings against performanceMulti Platform AppsTime ManagementMobile Application DevelopmentGoogle'S Flutter Development FrameworkIos And AndroidTeamworkApply",
        "Page_URL": "https://kathmandujobs.com/jobs/25825/flutter-developer-job-in-biratnagar"
    },
    {
        "name": "PHP Developer",
        "company": "Podamibe Nepal Pvt. Ltd.",
        "vacancy": "1",
        "time": "full-time",
        "address": "Kathmandu, Nepal",
        "deadline": "2020-12-24",
        "education": "Bachelor Degree",
        "experience": "2-5 years",
        "level": "Intermediate",
        "salary": "Negotiable",
        "desct": "PHP DeveloperPodamibe Nepal Pvt. Ltd.ApplyExperience:2-5 yearsLevel:IntermediateTotal Positions:1Job Type:full-timeSalary:NegotiableEducation:Bachelor DegreeLocation:Kathmandu, NepalApply Before:2020-12-24Job RequirementExperience with pure- PHP (both OOP and Procedural)Excellent working knowledge of MVC framework preferable CIWorking knowledge of JavaScript, jQuery, Json, Gurnt, Saas and AjaxProficiency in SQL database development, writing and optimizing MySQL,keys, relation, indexes etc.Proficiency in using version control tool preferably GITStrong creative, analytical and problem-solving skillsAbility to challenge yourself and work well under pressureTeamworkCritical ThinkingPhpCreative ThinkingApply",
        "Page_URL": "https://kathmandujobs.com/jobs/25824/php-developer-job-in-kathmandu"
    },
    {
        "name": "Full Stack Java Developer",
        "company": "Gamenic Nalamiz Tech",
        "vacancy": "2",
        "time": "full-time",
        "address": "Bhaktapur, Nepal",
        "deadline": "2020-12-10",
        "education": "Bachelor Degree",
        "experience": "0-1 years",
        "level": "Intermediate",
        "salary": "Rs.20000- Rs.100000",
        "desct": "Full Stack Java DeveloperGamenic Nalamiz TechApplyExperience:0-1 yearsLevel:IntermediateTotal Positions:2Job Type:full-timeSalary:Rs.20000- Rs.100000Education:Bachelor DegreeLocation:Bhaktapur, NepalApply Before:2020-12-10Skills and KnowledgeExperience in parallel and multithreaded programming.Knowledge of algorithms and data structures.Interest in achieving maximum performance from available hardware and software.Familiar with design patterns.UI Development Skills (JavaFx, JavaScript, CSS, HTML, jQuery).Hands-on knowledge of Spring Framework.Strong knowledge of Relational Databases, SQL, and ORM technologies.Experience working with source control systems, such as Subversion, and GIT including branching and merging strategies.Essential technologyJavaEE \uff0b GlassFish3TypeScriptJavaScriptMariaDBExperienced and desirable technologyNode.JSAngularExperience using GithubSpring BootContainer knowledge such as DockerKnowledge that can design Class and InterfaceJavaHTMlCSSOOPJQueryGithubJsApply",
        "Page_URL": "https://kathmandujobs.com/jobs/25823/full-stack-java-developer-job-in-bhaktapur"
    },
    {
        "name": "Dot Net Software Developer (.NET Core, .NET Framework)",
        "company": "Podamibe Nepal Pvt. Ltd.",
        "vacancy": "2",
        "time": "full-time",
        "address": "Kathmandu, Nepal",
        "deadline": "2020-12-23",
        "education": "Bachelor Degree",
        "experience": "2-5 years",
        "level": "Intermediate",
        "salary": "Negotiable",
        "desct": "Dot Net Software Developer (.NET Core, .NET Framework)Podamibe Nepal Pvt. Ltd.ApplyExperience:2-5 yearsLevel:IntermediateTotal Positions:2Job Type:full-timeSalary:NegotiableEducation:Bachelor DegreeLocation:Kathmandu, NepalApply Before:2020-12-23We are looking for a C# developer responsible for building C# applications, including anything from back-end services to their client-end counterparts.Your primary responsibilities will be to design and develop these applications, and to coordinate with the rest of the team working on different layers of the infrastructure.Responsibilities- Translate application requirement to functional applications- Design, build and maintain efficient, reusable, and reliable C# code- Ensure the best possible performance, quality, and responsiveness of applications- Identify bottlenecks and bugs, and devise solutions to these problems- Help maintain code quality, organization, and atomization Skills- Proficient in C#, with a good knowledge of its ecosystems- Familiarity with the .NET framework- Familiarity with the Javascript grids- Strong understanding of object-oriented programming- Skill for writing reusable C# libraries- Familiar with various design and architectural patterns- Knowledge of concurrency patterns in C#- Familiarity with SQL Server and MySQL- The knack for writing clean, readable C# code- Proficient understanding of code versioning tools such as \u00a0git..net core .NET Framework ASP.NET Javascript MS SQL mysqlApply",
        "Page_URL": "https://kathmandujobs.com/jobs/25822/dot-net-software-developer-net-core-net-framework-job-in-kathmandu"
    },
    {
        "name": "Job Vaccancy For Laravel+ Vue Js and Quality Assurance",
        "company": "Softechpark Pvt.Ltd.",
        "vacancy": "1",
        "time": "full-time",
        "address": "Kathmandu, Nepal",
        "deadline": "2020-11-27",
        "education": "Secondary Education Examination ( SEE)",
        "experience": "2-5 years",
        "level": "Expert",
        "salary": "Rs.30000- Rs.50000",
        "desct": "Job Vaccancy For Laravel+ Vue Js and Quality AssuranceSoftechpark Pvt.Ltd.ApplyExperience:2-5 yearsLevel:ExpertTotal Positions:1Job Type:full-timeSalary:Rs.30000- Rs.50000Education:Secondary Education Examination ( SEE)Location:Kathmandu, NepalApply Before:2020-11-27Required Skill & Experiences for Laravel Developer3+ years of experiance for senior level developer and must be capable for team leading.Should be expert knowledge in web technologies including HTML, CSS, Javascript, AJAX etc.Experience working with Laravel Framework.Write quality OOP code and follow existing development standards-Knowledge of Vue.js and VueX-knowledge of Vue CLIRestful API development experience.Experience with Test-Driven Development (PHPUnit)Experience in refactoring and improving the legacy code to use modern standards and tests.Strong problem-solving skills and attention to detail.Knowledge of GIT.Work experienced in ERP based projects.Daily stand-up meetings to review current progress and obstacles with direct team.Required Skill & Experiences for Quality AssuranceProven work experience in software Quality Assurance1+ experience in related fieldStrong knowledge of software QA methodologies, tools and processesReviewing requirements and development design.Writing Test Cases.Preparing test environment.Execution of test cases and test plans.Performing different types of testing (Manual and Automation).Reporting, tracking and following-up bugs using Team Foundation Server (TFS).Performing the needed documentation related to tested software.Salary:Laravel & Vue JS Developer : 30-50 k/monthQuality Assurance:15-30kDeadline :2020-11-27We are seeking Senior Laravel+ Vue Js and one Quality Assuranceto join our Softechpark development team. We're looking for a self-motivatedinnovative programmer & Quality Assurance who's excited about leveraging new technology to improve existing enterprise systems. We need an experienced & passionate candidate only to fill this position.Apply",
        "Page_URL": "https://kathmandujobs.com/jobs/25821/job-vaccancy-for-laravel-vue-js-and-quality-assurance-job-in-kathmandu"
    },
    {
        "name": "PHP/Vue Developer (Back-end )",
        "company": "Apiera",
        "vacancy": "1",
        "time": "freelance",
        "address": "Kathmandu, Nepal",
        "deadline": "2020-11-07",
        "education": "Secondary Education Examination ( SEE)",
        "experience": "2-5 years",
        "level": "Expert",
        "salary": "Negotiable",
        "desct": "PHP/Vue Developer (Back-end )ApieraApplyExperience:2-5 yearsLevel:ExpertTotal Positions:1Job Type:freelanceSalary:NegotiableEducation:Secondary Education Examination ( SEE)Location:Kathmandu, NepalApply Before:2020-11-07Ideally: self-motivated, proactive, result-oriented, best practises, hard-working, Go-getter...PHP/Vue Developer (Back-end )Position: Senior/Mid-levelWork Environment: RemoteEmployment Type: Full-time / Part-time(Minimum 25hrs/week)Salary: Depends on Experience. No bar for Deserving Candidate.Our hiring process for this vacancy:1) CV review2) Technical evaluation test3) HR interview4) OfferThe focus of your role:PHP Developer is responsible for managing back-end services and the interchange of data between the server and the users. Your primary focus will be the development of all server-side logic, definition and maintenance of the central database, and ensuring high performance and responsiveness to requests from the front-end. You will also be responsible for integrating the front-end elements built by your co-workers into the application. Therefore, a basic understanding of front-end technologies is necessary as well.Apply by filling the form: https://forms.gle/MgGPKfxXPDkCUgwo6Please feel free to inquire at[email\u00a0protected]PHPVUELaravelApply",
        "Page_URL": "https://kathmandujobs.com/jobs/25820/phpvue-developer-backend--job-in-kathmandu"
    },
    {
        "name": "Flutter Developer",
        "company": "Codavatar Tech Private Limited",
        "vacancy": "3",
        "time": "full-time",
        "address": "Kathmandu, Nepal",
        "deadline": "2020-12-15",
        "education": "Secondary Education Examination ( SEE)",
        "experience": "2-5 years",
        "level": "Intermediate",
        "salary": "Negotiable",
        "desct": "Flutter DeveloperCodavatar Tech Private LimitedApplyExperience:2-5 yearsLevel:IntermediateTotal Positions:3Job Type:full-timeSalary:NegotiableEducation:Secondary Education Examination ( SEE)Location:Kathmandu, NepalApply Before:2020-12-15???? Job DescriptionAs a Flutter Developer, you will create multi-platform apps for iOS and Android using Google's Flutter development framework. Ideal candidates will possess a drive for thinking creatively to resolve complex problems and enjoy contributing to solutions.???? Job Requirements\u27a4 Min. 3 year working as a full-time professional developer (Mobile) with at least 1 year experience in Flutter.\u27a4 Should have strong knowledge of OOP.\u27a4 Should have clean Code architecture, patterns\u27a4 Collaborate with QA to test and deliver the product with high quality and high speed\u27a4 Experience building a moderately complex Android app with knowledge of dart.\u27a4 Willing to work with cross-platform frameworks.\u27a4 Willing to learn and work on different mobile platforms/frameworks when needed.\u27a4 Published at least one app on the Play Store using Flutter/ Native (Java/Kotlin/Swift/Object c).\u27a4 Networking and integrating third-party APIs.\u27a4 Working with a version control system (i.e., Git)\u27a4 Job Duties and Responsibilities\u27a4 As a Flutter Developer, you will create multi-platform apps for iOS and Android using Google's Flutter development framework.\u27a4 The primary focus will be on creating new applications from scratch.\u27a4 Develop SDKs, libraries, and widgets to create a mobile application development platform\u27a4 Provide feedback regarding system performance and usability issues\u27a4 Deep experience contributing to and managing high-scale production mobile apps. You must have previous experience in Flutter development.???? Required Technical and Professional Expertise\u2022 Problem Solving\u2022 Time Management\u2022 Communication\u2022 Flutter???? What we offer?\u2713 Insurance policy and Benefits\u2713 Competitive Salary\u2713 Festival & Relocation Allowance\u2713 Provident Fund & Gratuity???? About CompanyCodavatar is an Application (Web/Mobile) Development firm which provides best in class solutions on the Web, Mobility, Cloud and more internet-based services.Website Link:https://www.codavatar.com/\u270d How to applyTo apply for this position, send an email to[email\u00a0protected]with \u201cFlutter Developer\u201d in the subject line. In the email, make sure to include your resume (in word or PDF preferred), cover letter, salary requirements, and any additional information you would feel relevant for this role.*No Age Bar for deserving candidates.Problem SolvingTime ManagementCommunicationFlutterApply",
        "Page_URL": "https://kathmandujobs.com/jobs/25819/flutter-developer-job-in-kathmandu"
    },
    {
        "name": "Visual Editor/ Animator",
        "company": "Ombryo Lab Pvt. Ltd.",
        "vacancy": "3",
        "time": "full-time",
        "address": "Kathmandu, Nepal",
        "deadline": "2020-12-22",
        "education": "Bachelor Degree",
        "experience": "2-5 years",
        "level": "Intermediate",
        "salary": "Negotiable",
        "desct": "Visual Editor/ AnimatorOmbryo Lab Pvt. Ltd.ApplyExperience:2-5 yearsLevel:IntermediateTotal Positions:3Job Type:full-timeSalary:NegotiableEducation:Bachelor DegreeLocation:Kathmandu, NepalApply Before:2020-12-22\u2705 Job Requirements\u27a4 At least 2-4 years of experience in Visual Editing and Animating.\u27a4 Proficient in After Effects, Illustrator, Adobe Character Animator are preferred.\u27a4 Experience in Auto Desk Maya is encouraged.\u27a4 Good drawing skills and creativity.\u27a4 Excellent time management skills.\u27a4 Strong communication and active listening skills.\u27a4 He/ She is required to understand how a good story works and tells best through animation.\u27a4 Must be able to work in a fast-paced startup working culture\u27a4 Experienced on making Logo Animation,2D/3D animation, Short Video Ads etc.\u27a4 Worked on projects of App & Website Previews and should have a good knowledge of character animation.\u2705 Job Duties and Responsibilities\u27a4 He/ She Should work on project Line Action Explainers, 3D Product Animation and must be conceptual with video editing, visual effects.\u27a4 He/ She needs to operate and edit on Whiteboard & Animated Explainers.\u27a4 Manipulate visual effects and animations like 2D, 3D using computerized technology and software applications.\u27a4 Creating visuals for video games and mobile applications.\u27a4 Generating simulations and mockups to be viewed and approved by those involved in media production and stakeholders.\u27a4 Troubleshooting any issues with animations.\u27a4 Establish storyboards to understand the images needed for the storyline and purpose of production.\u27a4 Ensure logical sequencing and smooth running.\u27a4 Adhering to tight deadlines and other constraints to meet production times.\u2705Required Technical and Professional Expertise\u27a4 Bachelor\u2019s degree in relevant field\u27a4 Excellent interpersonal and communication skills\u27a4 Research Oriented\u27a4 Critical Thinker\u27a4 Must have a solid Animation and Graphic Design Portfolio\u27a4 Should possess creativity and innovativeness\u27a4 Must be a team player\u27a4 Must be able to work in fast paced startup working culture\u27a4 Must be able to navigate complicated processes with many users, and convey information in an understandable way to them\u2705 What we offer?\u27a4 Competitive Salary\u27a4 Festival & Relocation Allowance\u27a4 Provident Fund & Gratuity\u27a4 Growth & Development Opportunities\u27a4 Friendly and creative working environment\u2705 About CompanyOmbryo Lab is a Startup Incubator which aims in changing the IT Landscape of Nepal with the adoption of Silicon Valley culture. We create a long term impact by sprouting the right talent to a fully grown venture which is capable of driving the next generation innovation and developing cutting edge products.???? How to apply\u270f\ufe0f To apply for this position, send an email with a link to your latest portfolio to[email\u00a0protected]with \u201cAnimator/ Visual Editor\u201d in the subject line. In the email, make sure to include your resume (in word or PDF preferred), cover letter, salary requirements and any additional information you would feel relevant for this role.Critical ThinkerMust have a solid Animation and Graphic Design PortfolioShould possess creativity and innovativenessMust be a team playerMust be able to work in fast paced startup working cultureApply",
        "Page_URL": "https://kathmandujobs.com/jobs/25818/visual-editor-animator-job-in-kathmandu"
    },
    {
        "name": "Urdu Tutor",
        "company": "Ombryo Lab Pvt. Ltd.",
        "vacancy": "3",
        "time": "full-time",
        "address": "Kathmandu, Nepal",
        "deadline": "2020-12-15",
        "education": "Secondary Education Examination ( SEE)",
        "experience": "0-1 years",
        "level": "Beginner",
        "salary": "Negotiable",
        "desct": "Urdu TutorOmbryo Lab Pvt. Ltd.ApplyExperience:0-1 yearsLevel:BeginnerTotal Positions:3Job Type:full-timeSalary:NegotiableEducation:Secondary Education Examination ( SEE)Location:Kathmandu, NepalApply Before:2020-12-15????Requirement:\u2705Should have completed minimum +2\u2705Should have good fluency in English and Urdu not only inwritten but speaking will be given more importance.\u2705Able to type in Urdu\u2705Should be able to interact with student freely. Extrovertnature will be preferred.????Responsibilities:\u2705Translation of documents from Urdu to English and Viceversa\u2705Conduct classes\u2705Design the study materialsShould have good fluency in English and Urdu not only in written but speaking will be given more importance.Able to type in UrduShould be able to interact with student freely. Extrovert nature will be preferred.Apply",
        "Page_URL": "https://kathmandujobs.com/jobs/25817/urdu-tutor-job-in-kathmandu"
    },
    {
        "name": "UI/UX Designer",
        "company": "Codavatar Tech Private Limited",
        "vacancy": "3",
        "time": "full-time",
        "address": "Kathmandu, Nepal",
        "deadline": "2020-12-15",
        "education": "Secondary Education Examination ( SEE)",
        "experience": "2-5 years",
        "level": "Intermediate",
        "salary": "Negotiable",
        "desct": "UI/UX DesignerCodavatar Tech Private LimitedApplyExperience:2-5 yearsLevel:IntermediateTotal Positions:3Job Type:full-timeSalary:NegotiableEducation:Secondary Education Examination ( SEE)Location:Kathmandu, NepalApply Before:2020-12-15Job Duties and Responsibiliies\u2022 Plan and implement new designs\u2022 Optimize existing user interface designs\u2022 Test for intuitivity and experience\u2022 Communicate with clients to understand their business goals and objectives\u2022 Develop technical and business requirements and always strive to deliver intuitive and user-centered solutions\u2022 Combine creativity with an awareness of the design elements\u2022 Create prototypes for new product ideas\u2022 Test new ideas before implementing\u2022 Conduct an ongoing user research\u2713 Problem solver and customer-centeredKnowledge of Adobe range of products including Photoshop0IllustratorInDesignAcrobat and DreamweaverYears of experience with HTML5 & CSS3Some knowledge of Usability Factors in Human Computer Interaction.Apply",
        "Page_URL": "https://kathmandujobs.com/jobs/25816/uiux-designer-job-in-kathmandu"
    },
    {
        "name": "React.js Developer (Web Developer)",
        "company": "e-digital Nepal Pvt. Ltd.",
        "vacancy": "1",
        "time": "full-time",
        "address": "Kathmandu, Nepal",
        "deadline": "2020-12-05",
        "education": "Bachelor Degree",
        "experience": "1-2 years",
        "level": "Intermediate",
        "salary": "Negotiable",
        "desct": "React.js Developer (Web Developer)e-digital Nepal Pvt. Ltd.ApplyExperience:1-2 yearsLevel:IntermediateTotal Positions:1Job Type:full-timeSalary:NegotiableEducation:Bachelor DegreeLocation:Kathmandu, NepalApply Before:2020-12-05We are looking for a skilled React.js Developer to join our front-end development team. In this role, you will be responsible for developing and implementing user interface components using React.js concepts and workflows such as Redux, Flux, and Webpack. You will also be responsible for profiling and improving front-end performance and documenting our front-end codebase.To ensure success as a React.js Developer, you should have in-depth knowledge of JavaScript and React concepts, excellent front-end coding skills, and a good understanding of progressive web applications. Ultimately, a top-class React.js Developer should be able to design and build modern user interface components to enhance application performance.React.js Developer Responsibilities:Meeting with the development team to discuss user interface ideas and applications.Reviewing application requirements and interface designs.Identifying web-based user interactions.Developing and implementing highly-responsive user interface components using React concepts.Writing application interface codes using JavaScript following React.js workflows.Troubleshooting interface software and debugging application codes.Developing and implementing front-end architecture to support user interface concepts.Monitoring and improving front-end performance.Documenting application changes and developing updates.React.js Developer Requirements:Bachelor\u2019s degree in Computer Science, Information Technology, or a similar field.Previous experience working as a React.js Developer.In-depth knowledge of JavaScript, CSS, HTML, and front-end languages.Knowledge of REACT tools including React.js, Webpack, Enzyme, Redux, and Flux.Experience with user interface design.Knowledge of performance testing frameworks including Mocha and Jest.Experience with browser-based debugging and performance testing software.Excellent troubleshooting skills.Good project management skills.Knowledge of REACT tools including React.jsWebpackEnzymeReduxand Flux.Apply",
        "Page_URL": "https://kathmandujobs.com/jobs/25815/reactjs-developer-web-developer-job-in-kathmandu"
    },
    {
        "name": "React.js Developer (Web Developer)",
        "company": "e-digital Nepal Pvt. Ltd.",
        "vacancy": "1",
        "time": "full-time",
        "address": "Kathmandu, Nepal",
        "deadline": "2020-12-05",
        "education": "Bachelor Degree",
        "experience": "1-2 years",
        "level": "Intermediate",
        "salary": "Negotiable",
        "desct": "React.js Developer (Web Developer)e-digital Nepal Pvt. Ltd.ApplyExperience:1-2 yearsLevel:IntermediateTotal Positions:1Job Type:full-timeSalary:NegotiableEducation:Bachelor DegreeLocation:Kathmandu, NepalApply Before:2020-12-05We are looking for a skilled React.js Developer to join our front-end development team. In this role, you will be responsible for developing and implementing user interface components using React.js concepts and workflows such as Redux, Flux, and Webpack. You will also be responsible for profiling and improving front-end performance and documenting our front-end codebase.To ensure success as a React.js Developer, you should have in-depth knowledge of JavaScript and React concepts, excellent front-end coding skills, and a good understanding of progressive web applications. Ultimately, a top-class React.js Developer should be able to design and build modern user interface components to enhance application performance.React.js Developer Responsibilities:Meeting with the development team to discuss user interface ideas and applications.Reviewing application requirements and interface designs.Identifying web-based user interactions.Developing and implementing highly-responsive user interface components using React concepts.Writing application interface codes using JavaScript following React.js workflows.Troubleshooting interface software and debugging application codes.Developing and implementing front-end architecture to support user interface concepts.Monitoring and improving front-end performance.Documenting application changes and developing updates.React.js Developer Requirements:Bachelor\u2019s degree in Computer Science, Information Technology, or a similar field.Previous experience working as a React.js Developer.In-depth knowledge of JavaScript, CSS, HTML, and front-end languages.Knowledge of REACT tools including React.js, Webpack, Enzyme, Redux, and Flux.Experience with user interface design.Knowledge of performance testing frameworks including Mocha and Jest.Experience with browser-based debugging and performance testing software.Excellent troubleshooting skills.Good project management skills.Knowledge of REACT tools including React.jsWebpackEnzymeReduxand Flux.Apply",
        "Page_URL": "https://kathmandujobs.com/jobs/25815/reactjs-developer-web-developer-job-in-kathmandu"
    },
    {
        "name": "Software Trainer",
        "company": "Quantum IT SOLUTIONS",
        "vacancy": "5",
        "time": "freelance",
        "address": "Kathmandu, Nepal",
        "deadline": "2020-11-30",
        "education": "Higher Secondary Level (+2)",
        "experience": "0-1 years",
        "level": "Beginner",
        "salary": "Negotiable",
        "desct": "Software TrainerQuantum IT SOLUTIONSApplyExperience:0-1 yearsLevel:BeginnerTotal Positions:5Job Type:freelanceSalary:NegotiableEducation:Higher Secondary Level (+2)Location:Kathmandu, NepalApply Before:2020-11-30\u2022 Maintaining relationships with the existing client bases related to software.\u2022 Identifying and solving queries and concerns of the clients and ensuring client satisfaction.\u2022 Good communication skills.\u2022 Experience in presenting to groups of individuals face to face and running online demonstrations of products/servicesGood CommunicationApply",
        "Page_URL": "https://kathmandujobs.com/jobs/25814/software-trainer-job-in-kathmandu"
    },
    {
        "name": "Machine Learning Engineer - Part Time",
        "company": "Techrise",
        "vacancy": "1",
        "time": "part-time",
        "address": "Lalitpur, Nepal",
        "deadline": "2020-11-21",
        "education": "Bachelor Degree",
        "experience": "2-5 years",
        "level": "Intermediate",
        "salary": "Rs.30000- Rs.45000",
        "desct": "Machine Learning Engineer - Part TimeTechriseApplyExperience:2-5 yearsLevel:IntermediateTotal Positions:1Job Type:part-timeSalary:Rs.30000- Rs.45000Education:Bachelor DegreeLocation:Lalitpur, NepalApply Before:2020-11-21We are looking for:An expert in machine learning to help us to design and build an online e-learning program.A person who can work part-time for about 15 - 20 hours a week. (It is remote work. Working hours can be decided according to your circumstances.)Required skills:Advanced degree in computer science, math, statistics or a related disciplineExtensive data modeling and data architecture skillsProgramming experience in PythonExperience in machine learning frameworks in python such as TensorFlow or KerasStrong knowledge about machine learning and deep learning algorithms such as k-Nearest, NLP and sequence modeling, along with CNNStrong written and verbal communications in EnglishCore responsibilities:Create, check, and modify online courses about machine learningCommunicate with the foreign team for any improvement in our online programsResearch, Design and Frame Machine Learning SystemsUnderstand and Transform the Prototypes of Data ScienceVerifying data quality, and/or ensuring it via data cleaningPerform Machine Learning Model Tests and ExperimentsDevelop the Machine Learning Model as per the NeedSelect and Implement Right Machine Learning AlgorithmsUnderstand Business Objectives and Developing the ML ModelsCompany benefits:Friendly, creative working environment with a foreign teamWorking with the latest technologiesTimely salary reviewRemote working policyApplying Procedure:If you believe you are the one and have a passion to work with us,APPLY NOWwithYour recent resume\u00a0in PDF formatYour desired weekly working hours and\u00a0monthly salaryat[email\u00a0protected].We are looking forward to receiving your application!Machine LearningApply",
        "Page_URL": "https://kathmandujobs.com/jobs/25813/machine-learning-engineer-part-time-job-in-lalitpur"
    },
    {
        "name": "Senior .NET developer",
        "company": "Singapore Ecommerce App Pte. Ltd",
        "vacancy": "2",
        "time": "full-time",
        "address": "Kathmandu, Nepal",
        "deadline": "2020-12-16",
        "education": "Bachelor Degree",
        "experience": "5-10 years",
        "level": "Expert",
        "salary": "Negotiable",
        "desct": "Senior .NET developerSingapore Ecommerce App Pte. LtdApplyExperience:5-10 yearsLevel:ExpertTotal Positions:2Job Type:full-timeSalary:NegotiableEducation:Bachelor DegreeLocation:Kathmandu, NepalApply Before:2020-12-16Please state your current salary, expected salary, notice period, contact-able referenceStrong knowledge of Object-Oriented Programming and Design ConceptsKnowledge of software development life-cycle for web-based applicationsExperience in design and development experience with C#, Angular, .NET web framework, .NET and/or .NET CoreProficient in MS SQL queries, familiar with Database Design and Stored ProceduresExperience in web technologies: JavaScript, AJAX, jQuery, HTML5, CSSDesign and develop and maintain simple to complex modules for our productsInvestigate new APIs and learn how to use themUbuntuWindows Serversystem designSQL Server.NET coreasp.net.NET MVCversion controlsearch database like elasticsearchcache system like redisApply",
        "Page_URL": "https://kathmandujobs.com/jobs/25812/senior-net-developer-job-in-kathmandu"
    },
    {
        "name": ".Net Developer",
        "company": "Krennova Pvt. Ltd",
        "vacancy": "2",
        "time": "full-time",
        "address": "Kathmandu, Nepal",
        "deadline": "2020-11-30",
        "education": "Bachelor Degree",
        "experience": "2-5 years",
        "level": "Intermediate",
        "salary": "Rs.30000- Rs.45000",
        "desct": ".Net DeveloperKrennova Pvt. LtdApplyExperience:2-5 yearsLevel:IntermediateTotal Positions:2Job Type:full-timeSalary:Rs.30000- Rs.45000Education:Bachelor DegreeLocation:Kathmandu, NepalApply Before:2020-11-30Krennova Tech is looking for Associate Software Engineer (.NET), who will be responsible for creating ASP.NET web applications, providing support to clients and writing quality and scalable codes in .NET Framework.Job Responsibilities:Develop web applications using ASP.NET.Modify existing ASP.NET web applications according to requirements.Develop ASP.NET Web APIs and Web Services for mobile applications.Professional Skill Required:.NET Core, ASP.NET MVC, Web API, Entity Framework, MSSqlOther Specification:Bachelor in Computer Engineering/Science or related field or equivalentPrior experience as a .NET developer (At least 2 year)Knowledge of .NET Framework (ASP.NET MVC, Web API and Web Services)Knowledge of Umbraco CMS V 7.0 will be plus.Ability to use Visual Studio for application development and debuggingKnowledge of MSSQL (SQL Queries, tables, stored-procedures and functions)Proficiencies in HTML, CSS, JavaScriptWork remotely during pandemic. Please send your details to[email\u00a0protected]..NET CoreASP.NET MVCWeb APIEntity FrameworkMSSqlApply",
        "Page_URL": "https://kathmandujobs.com/jobs/25811/net-developer-job-in-kathmandu"
    },
    {
        "name": "Product photographer",
        "company": "parsa handicraft",
        "vacancy": "1",
        "time": "full-time",
        "address": "Kathmandu, Nepal",
        "deadline": "2020-12-08",
        "education": "Higher Secondary Level (+2)",
        "experience": "1-2 years",
        "level": "Intermediate",
        "salary": "Rs.30000- Rs.38000",
        "desct": "Product photographerparsa handicraftApplyExperience:1-2 yearsLevel:IntermediateTotal Positions:1Job Type:full-timeSalary:Rs.30000- Rs.38000Education:Higher Secondary Level (+2)Location:Kathmandu, NepalApply Before:2020-12-08Take professional pictures in a studio or in a particular locationTo produce high-quality photographic imagesUse different techniques to enhance the photographs as requiredUse photo manipulation software such as Adobe Suite to get desired resultsRecommend creative ideas to exceed expectations of goals and objectivesUse artistic knowledge to enhance and compose photographsReview sets of photographs and select the best resultsOperate various photographic equipment such as single lens reflex cameras and film or digital cameras and lighting.high-quality photographicApply",
        "Page_URL": "https://kathmandujobs.com/jobs/25809/product-photographer-job-in-kathmandu"
    },
    {
        "name": "Angular Developer",
        "company": "PalmMind IT",
        "vacancy": "3",
        "time": "full-time",
        "address": "Kathmandu, Nepal",
        "deadline": "2020-12-10",
        "education": "Bachelor Degree",
        "experience": "2-5 years",
        "level": "Expert",
        "salary": "Negotiable",
        "desct": "Angular DeveloperPalmMind ITApplyExperience:2-5 yearsLevel:ExpertTotal Positions:3Job Type:full-timeSalary:NegotiableEducation:Bachelor DegreeLocation:Kathmandu, NepalApply Before:2020-12-10Strong Knowledge of Angular FrameworkWork as a part of an Agile team.Build and maintain JS based code baseStrong knowledge of NodeJSGood problem-solving skillsStrong knowledge of developing and utilising APIs.Problem-solving skillsApply",
        "Page_URL": "https://kathmandujobs.com/jobs/25808/angular-developer-job-in-kathmandu"
    },
    {
        "name": "Python Developer",
        "company": "Numeric Mind",
        "vacancy": "2",
        "time": "full-time",
        "address": "Kathmandu, Nepal",
        "deadline": "2020-11-30",
        "education": "Bachelor Degree",
        "experience": "1-2 years",
        "level": "Intermediate",
        "salary": "Negotiable",
        "desct": "Python DeveloperNumeric MindApplyExperience:1-2 yearsLevel:IntermediateTotal Positions:2Job Type:full-timeSalary:NegotiableEducation:Bachelor DegreeLocation:Kathmandu, NepalApply Before:2020-11-30About the company and Partner: Nimble Clinical Research is a US based technology company dedicated towards creating innovative software applications for pharmaceutical and biotech companies. We are building our local Nepal team via our partner company, Numeric Mind Pvt Ltd (numericmind.com) in Nepal, and looking for the best python developers. Visit Nimble Clinical Research, LLC (nimble-cr.com) to know\u00a0about our current software applications.Role and Responsibilities\u2022 As a Python developer, you\u2019ll design and develop highly complex modules in our data analytics platform.\u2022 The ideal candidate is a self-starter, independent and passionate developer with a strong desire to create high-quality applications.\u2022 You are expected to continually learn and apply best software development practices and technologies to the tasks at hand.\u2022 Use core python, data analysis related packages (such as numpy, pandas, matplotlib, SciPy) and QT (to design user interface elements).Requirements\u2022 Expert in core python, and OOP\u2022 Strong experience in numpy, pandas desired\u2022 At least 3 months on-job experience as a trainee or an employee; Over 1-year experience preferred\u2022 Education: BS in Computer Science or equivalent degree.Type: Full-timeNumber of Openings: 2Location: Remote/office in NepalCompensation:\u00a0Attractive salary, higher than the market rate, along with increments every 6 monthsREFERRAL: Do you know someone else who is a great python programmer? Earn NRP 20,000 by referring a candidate. Refer them to us! On successful hiring of the candidate, lasting at least a month of employment, you will get NR 20,000 as referral reward.Applying: if interested, send your resume directly to[email\u00a0protected]. In the resume include your git repository link and LinkedIn profile link if available.Python ProgrammingnumpypandasmatplotlibSciPy and QTApply",
        "Page_URL": "https://kathmandujobs.com/jobs/25807/python-developer-job-in-kathmandu"
    },
    {
        "name": "Full Stack Java Developer",
        "company": "Gamenic Nalamiz Tech",
        "vacancy": "2",
        "time": "full-time",
        "address": "Bhaktapur, Nepal",
        "deadline": "2020-11-15",
        "education": "Bachelor Degree",
        "experience": "0-1 years",
        "level": "Intermediate",
        "salary": "Rs.15000- Rs.50000",
        "desct": "Full Stack Java DeveloperGamenic Nalamiz TechApplyExperience:0-1 yearsLevel:IntermediateTotal Positions:2Job Type:full-timeSalary:Rs.15000- Rs.50000Education:Bachelor DegreeLocation:Bhaktapur, NepalApply Before:2020-11-15Skills and KnowledgeExperience in parallel and multithreaded programming.Knowledge of algorithms and data structures.Interest in achieving maximum performance from available hardware and software.Familiar with design patterns.UI Development Skills (JavaFx, JavaScript, CSS, HTML, jQuery).Hands-on knowledge on Spring Framework.Strong knowledge of Relational Databases, SQL, and ORM technologies.Experience working with source control systems, such as Subversion, and GIT including branching and merging strategies.Essential technologyJavaEE \uff0b GlassFish3TypeScriptJavaScriptMariDBExperienced and desirable technologyNode.JSAngularExperience using GitSpling BootContainer knowledge such as DockerKnowledge that can design Class and InterfaceCSSHTMLJavaJQueryOOPApply",
        "Page_URL": "https://kathmandujobs.com/jobs/25806/full-stack-java-developer-job-in-bhaktapur"
    },
    {
        "name": "Assitant PTE Tutor",
        "company": "Ombryo Lab Pvt. Ltd.",
        "vacancy": "1",
        "time": "full-time",
        "address": "Kathmandu, Nepal",
        "deadline": "2020-11-30",
        "education": "Bachelor Degree",
        "experience": "1-2 years",
        "level": "Intermediate",
        "salary": "Negotiable",
        "desct": "Assitant PTE TutorOmbryo Lab Pvt. Ltd.ApplyExperience:1-2 yearsLevel:IntermediateTotal Positions:1Job Type:full-timeSalary:NegotiableEducation:Bachelor DegreeLocation:Kathmandu, NepalApply Before:2020-11-30Requirement:Should have completed Bachelor\u2019s DegreeMinimum of 1 year experience in teaching PTE/IELTSShould have very good fluency in speaking and writing in English.Carry out the task given with diligenceHave to have good team spirit\u27a4 Responsibilities:\u270eWorking hours: 7 am to 3 pm (Should be flexible in timings)\u270eWorking Modality: Work from home. Everything required to do the job like the computer etc. will be providedShould have very good fluency in speaking and writing in English.Carry out the task given with diligenceHave to have good team spiritApply",
        "Page_URL": "https://kathmandujobs.com/jobs/25805/assitant-pte-tutor-job-in-kathmandu"
    },
    {
        "name": "Full Stack Developer Node.js / Vue.js - Senior Level",
        "company": "Outsource Array P. Ltd.",
        "vacancy": "2",
        "time": "full-time",
        "address": "Kathmandu, Nepal",
        "deadline": "2020-11-20",
        "education": "Bachelor Degree",
        "experience": "2-5 years",
        "level": "Expert",
        "salary": "Negotiable",
        "desct": "Full Stack Developer Node.js / Vue.js - Senior LevelOutsource Array P. Ltd.ApplyExperience:2-5 yearsLevel:ExpertTotal Positions:2Job Type:full-timeSalary:NegotiableEducation:Bachelor DegreeLocation:Kathmandu, NepalApply Before:2020-11-20We are looking for Full Stack developers who need to be able to work on a weekly release schedule, with online demos and a minimal SCRUM routine.Need to be experts at REST webservice, Node.js and/or Vue.js.Our technology stack is:Backend webservices: on Node.js, Postgresql, Docker, Assorted AWS managed services, OAuth2.Front-end: Vue.js, bootstrap.Applications can be made online here or send us your CVs to:[email\u00a0protected]REST webserviceNode.js and/or Vue.jsApply",
        "Page_URL": "https://kathmandujobs.com/jobs/25804/full-stack-developer-nodejs-vuejs-senior-level-job-in-kathmandu"
    },
    {
        "name": "UI/UX Designer",
        "company": "Ombryo Lab Pvt. Ltd.",
        "vacancy": "2",
        "time": "full-time",
        "address": "Kathmandu, Nepal",
        "deadline": "2020-12-02",
        "education": "Secondary Education Examination ( SEE)",
        "experience": "2-5 years",
        "level": "Intermediate",
        "salary": "Negotiable",
        "desct": "UI/UX DesignerOmbryo Lab Pvt. Ltd.ApplyExperience:2-5 yearsLevel:IntermediateTotal Positions:2Job Type:full-timeSalary:NegotiableEducation:Secondary Education Examination ( SEE)Location:Kathmandu, NepalApply Before:2020-12-02Job Duties and Responsibilities\u00d8 Collaborate with other team members and stakeholders of the project\u00d8 Gather and evaluate user requirements, in collaboration with product managers and engineers.\u00d8 Create customer journey maps to better understand customer\u2019s interactions with the business over time and across service channels and iterate the design to develop the best ever user experience.\u00d8 Illustrate design ideas using storyboards, process flows and sitemaps.\u00d8 Plan and Implement new designs and optimize existing user interface designs.\u00d8 Develop technical and business requirements and always strive to deliver intuitive and user-centered solutions\u00d8 Combine creativity with an awareness of the design elements\u00d8 Create prototypes for new product ideas\u00d8 Test new ideas before implementing\u00d8 Conduct an ongoing user research\u00d8 Be prepared to constantly be asked to try new things, and pushed to continuously improve.\u00a7 Required Technical and Professional Expertise\u00d8 Bachelor\u2019s degree in relevant field\u00d8 Excellent interpersonal and communication skills\u00d8 Research Oriented\u00d8 Critical Thinker\u00d8 Some knowledge of Usability Factors in Human Computer Interaction\u00d8 Must have a solid UI Design Portfolio\u00d8 Should possess creativity and innovativeness\u00d8 Must be a team player\u00d8 Must be able to work in fast paced startup working culture\u00d8 Must be able to navigate complicated processes with many users, and convey information in an understandable way to themProficient in HTML and CSSDeep Understanding of cutting edge latest UI/UX trends.Excellent knowledge about user interfacebrowser compatibility and Web 2.0Ability to breakdown complex interaction to simpleelegant and straightforward user interactions and experiences.Apply",
        "Page_URL": "https://kathmandujobs.com/jobs/25803/uiux-designer-job-in-kathmandu"
    },
    {
        "name": "Inside Sales Executive",
        "company": "Codavatar Tech Private Limited",
        "vacancy": "8",
        "time": "full-time",
        "address": "Kathmandu, Nepal",
        "deadline": "2020-11-10",
        "education": "Secondary Education Examination ( SEE)",
        "experience": "2-5 years",
        "level": "Intermediate",
        "salary": "Rs.40000- Rs.40000",
        "desct": "Inside Sales ExecutiveCodavatar Tech Private LimitedApplyExperience:2-5 yearsLevel:IntermediateTotal Positions:8Job Type:full-timeSalary:Rs.40000- Rs.40000Education:Secondary Education Examination ( SEE)Location:Kathmandu, NepalApply Before:2020-11-10Responsibilities:1. Performance inside sales (Remote selling model) for B2B Saas products (IT Products).2. Good communication skills. Good command on English language.3. Good presentation skills (Having skill to provide online demo)4. Having knowledge of various inside sales tool to generate lead.5. Having co-ordination skill to do co-ordination with the team members for decision making.6. Schedule online demonstration with customer.What is in store for you?1. An opportunity to define, lead and co-ordinate the entire sales of the product.2. Work in a fast-paced start up environmentReach usIf you think this role is aligned with your career, kindly write me an email along with your updated CV on[email\u00a0protected]for a confidential discussion on the role.Good communication skills. Good command on English language.Apply",
        "Page_URL": "https://kathmandujobs.com/jobs/25802/inside-sales-executive-job-in-kathmandu"
    },
    {
        "name": "Mid Level Python Developer",
        "company": "Codavatar Tech Private Limited",
        "vacancy": "3",
        "time": "full-time",
        "address": "Kathmandu, Nepal",
        "deadline": "2020-11-30",
        "education": "Secondary Education Examination ( SEE)",
        "experience": "2-5 years",
        "level": "Intermediate",
        "salary": "Negotiable",
        "desct": "Mid Level Python DeveloperCodavatar Tech Private LimitedApplyExperience:2-5 yearsLevel:IntermediateTotal Positions:3Job Type:full-timeSalary:NegotiableEducation:Secondary Education Examination ( SEE)Location:Kathmandu, NepalApply Before:2020-11-30\u00d8Knowledge of object-oriented programming\u00d8 Experience with Python Flask or Django\u00d8 Experience with MySQL/PostgreSQL\u00d8 Agile/Scrum experience and communication skills\u00d8 Basic understanding of HTML5, CSS and Javascript\u00d8 Familiarity with regular expressions\u00d8 Experience with writing Unit test cases\u00d8 Familiar with Pylint and PEP 8 Python development style guide????Additional experience will be plus\u2705\u00a0VueJS/React/Angular\u2705\u00a0AWS\u2705\u00a0Gitflow\u2705\u00a0Docker\u2705\u00a0Experience in third party API integrationsAgile/Scrum experience and communication skillsKnowledge of object-oriented programmingExperience with Python Flask or DjangoExperience with MySQL/PostgreSQLApply",
        "Page_URL": "https://kathmandujobs.com/jobs/25801/mid-level-python-developer-job-in-kathmandu"
    },
    {
        "name": "Senior Laravel & Vue/React Js Developer",
        "company": "Gamenic Nalamiz Tech",
        "vacancy": "3",
        "time": "full-time",
        "address": "Bhaktapur, Nepal",
        "deadline": "2020-11-10",
        "education": "Bachelor Degree",
        "experience": "1-2 years",
        "level": "Expert",
        "salary": "Rs.20000- Rs.200000",
        "desct": "Senior Laravel & Vue/React Js DeveloperGamenic Nalamiz TechApplyExperience:1-2 yearsLevel:ExpertTotal Positions:3Job Type:full-timeSalary:Rs.20000- Rs.200000Education:Bachelor DegreeLocation:Bhaktapur, NepalApply Before:2020-11-10We are a Japanese based IT Company and also have our branch in Bhaktapur called Gamenic Nalamiz Tech. We are looking for a PHP (Laravel/Vuejs) Developer responsible for managing back-end services and the interchange of data between the server and the users and to build new features and maintain our existing business systems. You would be working on PHP, Laravel, VueJs,HTML, and CSS.Requirements:\u2013 Sound knowledge in Php based frameworks like Laravel.\u2013 Experience with front end technology like VueJs, ReactJs, AngularJs, HTML5, CSS3.\u2013 Experience in Datastores like Mysql, Redis.Responsibilities:\u2013 Write clean, secure, test-driven, easily maintainable, and modular codes.\u2013 Database designing and maintenance.\u2013 Build reusable code and libraries for future use.\u2013 Troubleshoot and debug applications.\u2013 Perform UI/backend tests to optimize performance.\u2013 Collaborate and work with frontend and mobile app developers on the backend needs of projects.LaravelVuejsReact JsHTMLCSSApply",
        "Page_URL": "https://kathmandujobs.com/jobs/25800/senior-laravel-vuereact-js-developer-job-in-bhaktapur"
    },
    {
        "name": "Jr. iOS Developer",
        "company": "Ensue Nepal Pvt. Ltd",
        "vacancy": "1",
        "time": "full-time",
        "address": "Kathmandu, Nepal",
        "deadline": "2020-11-21",
        "education": "Secondary Education Examination ( SEE)",
        "experience": "0-1 years",
        "level": "Intermediate",
        "salary": "Rs.35000- Rs.55000",
        "desct": "Jr. iOS DeveloperEnsue Nepal Pvt. LtdApplyExperience:0-1 yearsLevel:IntermediateTotal Positions:1Job Type:full-timeSalary:Rs.35000- Rs.55000Education:Secondary Education Examination ( SEE)Location:Kathmandu, NepalApply Before:2020-11-21We are looking for an enthusiastic\u00a0 iOS developer who will be responsible for helping develop iOS applications. You will be helping develop applications and their integration with back-end services.Basic understanding of software design patterns and design patterns incorporated in iOS apps is required.RequirementsProficient with SwiftKnowledge of iOS frameworks such as Core Data, Core Animation, etc.Knowledge with offline storage, threading, and performance tuningFamiliarity with RESTful APIs to connect iOS applications to back-end servicesKnowledge of other web technologies and UI/UX standardsExperience with performance and memory tuning with tools such as InstrumentsFamiliarity with cloud message APIs and push notificationsFine knowledge of design principles and interface guidelinesGood understanding of GitTDDResponsibilitiesWriting scalable, robust, testable, efficient, and easily maintainable codeEnsure the performance, quality, and responsiveness of applicationsCollaborate with a team to define, design, and ship new featuresIdentify and correct bottlenecks and fix bugsiOSGitSwiftObjective - CApply",
        "Page_URL": "https://kathmandujobs.com/jobs/25799/jr-ios-developer-job-in-kathmandu"
    },
    {
        "name": "Sr. Android Developer",
        "company": "Ensue Nepal Pvt. Ltd",
        "vacancy": "1",
        "time": "full-time",
        "address": "Kathmandu, Nepal",
        "deadline": "2020-11-21",
        "education": "Secondary Education Examination ( SEE)",
        "experience": "2-5 years",
        "level": "Expert",
        "salary": "Rs.80000- Rs.120000",
        "desct": "Sr. Android DeveloperEnsue Nepal Pvt. LtdApplyExperience:2-5 yearsLevel:ExpertTotal Positions:1Job Type:full-timeSalary:Rs.80000- Rs.120000Education:Secondary Education Examination ( SEE)Location:Kathmandu, NepalApply Before:2020-11-21At Ensue, we believe in growing and learning together. We strive to be nimble problem-solvers and proud builder.We are looking for an experienced Android app developer, with a very good grasp of Java / Kotlin to join our exceptional team. In-depth hands-on knowledge of OOP and software design patterns with 2 years experience is a must. Along with that, the candidate should be well versed in software architecture and quality of code.RequirementAt least 2 years of experience in android app developmentStrong coding and analytical skillsVery good understanding of OOP, design patterns and SOLID principlesVery strong knowledge of android design principles and design guidelinesExperienced in multi-threading and performance tuningShould have knowledge of RESTful web servicesVery good understanding of android app life-cycleExperienced in SQL LiteStrong knowledge of MVC, MVVMKnowledge of unit testingFamiliarity with CI/CDKnowledge of firebase.Sound knowledge of GITHave published at least one App in PlaystoreSelf-motivated and a team playerAndroidRESTful APIGitApply",
        "Page_URL": "https://kathmandujobs.com/jobs/25798/sr-android-developer-job-in-kathmandu"
    },
    {
        "name": "Backend Developer in PHP",
        "company": "Ensue Nepal Pvt. Ltd",
        "vacancy": "2",
        "time": "full-time",
        "address": "Kathmandu, Nepal",
        "deadline": "2020-11-21",
        "education": "Bachelor Degree",
        "experience": "1-2 years",
        "level": "Intermediate",
        "salary": "Rs.40000- Rs.60000",
        "desct": "Backend Developer in PHPEnsue Nepal Pvt. LtdApplyExperience:1-2 yearsLevel:IntermediateTotal Positions:2Job Type:full-timeSalary:Rs.40000- Rs.60000Education:Bachelor DegreeLocation:Kathmandu, NepalApply Before:2020-11-21We are looking for an enthusiastic PHP developer. With a technical background, some years of experience and self-motivated mindset \u2013 you are our ideal candidate. You will be working on projects with a highly experienced team. Our clients and projects are primarily US based.Being a part of our fast-paced team you will experienceFast and Efficient learning and research methodsProject managementDifferent Development tools and methodologiesJob RequirementMust have experience of 1 year or more in the field of PHP based web developmentFamiliarity with PHP frameworks - preferably LaravelFamiliarity with Version control systemMust have good knowledge of OOPMust have good understanding of RESTful APIMust have knowledge of Software design patterns is preferred.Must have good communication skillsMust be self motivatedHTMLCSSMySQLPHPLaravelApply",
        "Page_URL": "https://kathmandujobs.com/jobs/25797/backend-developer-in-php-job-in-kathmandu"
    },
    {
        "name": "Mid Level Frontend Web Developer",
        "company": "Ensue Nepal Pvt. Ltd",
        "vacancy": "1",
        "time": "full-time",
        "address": "Kathmandu, Nepal",
        "deadline": "2020-11-21",
        "education": "Bachelor Degree",
        "experience": "1-2 years",
        "level": "Intermediate",
        "salary": "Rs.30000- Rs.60000",
        "desct": "Mid Level Frontend Web DeveloperEnsue Nepal Pvt. LtdApplyExperience:1-2 yearsLevel:IntermediateTotal Positions:1Job Type:full-timeSalary:Rs.30000- Rs.60000Education:Bachelor DegreeLocation:Kathmandu, NepalApply Before:2020-11-21Job DescriptionAt Ensue we believe in growing and learning together. We strive to be nimble problem solvers and proud builders.We are looking for an experienced Front-end developer, with very good grasp of javascript, to join our exceptional team. In depth hands on knowledge of OOP in javascript and software design patterns with 2+ years experience is a must. Along with that, candidate should be well versed in software architecture, software design patterns and quality of code.Job RequirementsMust have 1 years of web development experienceStrong experience in developing rich client functionality with good knowledge of JavascriptExperience in at least one of the javascript frameworks: Angular/AngularJS and ReactJSExperience with RESTful APIs to connect with backend web servicesExcellent HTML, CSS and cross-browser layout skills and knowledgePassion for developing, releasing and maintaining a large-scale web applicationExperienced with version control tool such as GitlabAble to give keen attention to detail and ability to build scalable and flexible softwareComfortable working with a teamGood ability to solve a problemConfidence in learning new languages and platformResponsibilitiesHands on development and testingProduction supportCreate flexible, reusable and pluggable software components.Identify new technologies that improve product development and end user experience.JavascriptAngular or any other javascript framework/libraryApply",
        "Page_URL": "https://kathmandujobs.com/jobs/25796/mid-level-frontend-web-developer-job-in-kathmandu"
    },
    {
        "name": "Senior Graphic Designer",
        "company": "Swivt Technologies",
        "vacancy": "1",
        "time": "full-time",
        "address": "Kathmandu, Nepal",
        "deadline": "2020-11-30",
        "education": "Higher Secondary Level (+2)",
        "experience": "2-5 years",
        "level": "Expert",
        "salary": "Rs.30000- Rs.700000",
        "desct": "Senior Graphic DesignerSwivt TechnologiesApplyExperience:2-5 yearsLevel:ExpertTotal Positions:1Job Type:full-timeSalary:Rs.30000- Rs.700000Education:Higher Secondary Level (+2)Location:Kathmandu, NepalApply Before:2020-11-30As a Senior Designer at Swivt Technologies, you are required to have an educated design sense, creative flair, keen interest and ability to deliver effective design solutions that are aligned with the creative vision. You are expected to have passion for conceptualising creative solutions, and an in-depth understanding of market tools, trends and touch-points. You will also initiate and facilitate the growth of your juniors and assist them in creating design solutions that are rationalised and justified. You will take responsibility in assisting in the development big ideas for projects. You should be capable in shaping visual aspects of online and offline media, as well as the ability to execute deliverables that adhere to a concept that solves a creative problem for the client that is on brand.Job responsibilities.Heavily involved in design projects from concept to completion, applying design principles and techniquesPitch and execute creative ideas that solves creative problemsProducing establish sketches, mockups, decks and engaging design solutionsReceive and provide feedback from and to team members to hone skills and improve designResponsible for creating design solutions that have a high visual impactUnderstand briefs and client\u2019s requirements and offer solutions to creative problemsTranslate requirements into highly engaging and attractive design conceptsEffectively conceptualise, design and create high quality visuals in a variety of formatsUse various techniques to create design solutionsDevelop and maintain cohesive work relationship with key stakeholdersAble to work independently respecting multiple deadlinesPaying close attention to detail and grasp project needs and assist in translating that with the teamQualifications.4 - 5 years of relevant work experience in creative or marketing agencies or similar relevant experiences from similar fieldsBachelor degree in graphic design, visual communication, web design, or related fields of study.Well established knowledge in visual design principles, information design, typography, colour theory, imagery, iconography and layout design.High Proficiency with Adobe Creative Suite programs, specifically Illustrator, Photoshop and InDesign, additional skills in other programs are appreciated.Design portfolio that\u2019s innovative, reflects current design trends and showcases design solutions that demonstrate an in-depth understanding of different markets.Salary and benefits will commensurate with qualifications and experiences.Candidates with less experiences will be considered as DesignerIf you wish to apply for this position, please attach your r\u00e9sum\u00e9, portfolio and expected salary to[email\u00a0protected]PhotoshopXDSketchApply",
        "Page_URL": "https://kathmandujobs.com/jobs/25795/senior-graphic-designer-job-in-kathmandu"
    },
    {
        "name": "App Developer",
        "company": "Medic Mobile",
        "vacancy": "1",
        "time": "full-time",
        "address": "Kathmandu, Nepal",
        "deadline": "2020-10-31",
        "education": "Bachelor Degree",
        "experience": "2-5 years",
        "level": "Intermediate",
        "salary": "Negotiable",
        "desct": "App DeveloperMedic MobileApplyExperience:2-5 yearsLevel:IntermediateTotal Positions:1Job Type:full-timeSalary:NegotiableEducation:Bachelor DegreeLocation:Kathmandu, NepalApply Before:2020-10-31About Medic MobileMedic Mobile is a 501(c)(3) nonprofit organization founded in 2010 to advance health and human flourishing with and for the hardest-to-reach communities. We envision a more just world in which health workers are supported as they provide care for their neighbors, universal health coverage is a reality, and health is a secured human right. Practically, we have advanced our mission by building, implementing, and supporting open-source digital tools that support Community Health Workers, managers, and facility-based health workers. Along with our partners, we build and apply software that helps health workers deliver high-quality, equitable care in redesigned health systems. Our team and partners support more than 28,000 frontline health workers caring for an estimated 15 million people in 18 countries across Africa and Asia.Each member of our team was drawn to this mission and emboldened by a vision of global health equity. Our diversity of skills and experiences helps us tackle complex challenges \u2013 we look forward to hearing from you and exploring ways to work together.We are searching for an App Developer to contribute to our team, mission, and impact. This is a unique opportunity to bring together your passion for global health and technology, and working at the grassroots level. As\u00a0 App Developer, you will manage project app development. We believe that the technologies, work environments, and approaches to global health and development you've experienced in the past, and have mastered in-depth will be useful to further build Medic\u2019s tools and technology. We expect that you are a quick learner and equally quick to adapt to new and changing technologies. You will work closely with design and project teams.Key ResponsibilitiesManage project technical development/configurations: Work alongside partnerships leads, project managers, and designers to define scope, design, write technical specifications, and build public health applicationsDevelop internal and partner-facing interactive data visualizations. Work with designers and project managers to ensure that dashboard designs are feasible within the Medic Mobile Analytics platformContribute to and maintain a growing codebase of JavaScript, JSON configuration, technical documentation, and interactive data visualizations.Conduct functional and unit testing on all developed code and scripts in line with testing frameworks to ensure conformance with defined requirements.Manage client timelines, monitor usage of the platform, and any relevant software costs for invoicing purposes to foster strong relationships with partners.Support end-users and stakeholders (internal and external) on any arising technology issues/bugs to resolve, escalate and resolve.Describe digital health needs and opportunities in your projects/region and propel these needs to be addressed in Medic Mobile\u2019s current tool kit or product roadmapSupport in proposal writing, publications, present Medic Mobile in meetings, seminars, summits & forums when called upon to do so.Skills Knowledge & ExpertiseBachelor's degree in Computer Science or equivalent.3+ years of progressive experience in similar roles with demonstrated technical leadership.Strong command of written and spoken English.Proficient in Javascript or other programming languages.Proficient with relational databases, Postgres or MySQLExperience with data analysis and data visualization languages R/Matlab/Python would be of benefitHave experience using command-line tools on Linux (preferred) or another UNIX-like operating system.Be committed to frequent and timely communication, both in-person and online (via email, Slack, and other online chat applications).Have an interest in working with and learning from a globally distributed team of mHealth technology experts.Have good communication and interpersonal skills with the ability to pass on information clearly to users and to grasp difficulties perceived by users.Strong user support orientation with an attitude of wanting to assist people and pass-on their knowledge and experience to others establishing a good working relationship with users/partners.Ability to work under high pressure, meet deadlines, monitor, and follow-up on pending matters under minimum supervision.Additional SkillsBe familiar with Android SDK, NoSQL databases.Project work experience with open source technology.Good logical diagnostic skills and ability to exercise good judgment in the resolution of problems.Fluency in other languages would be nice to have e.g French, Swahili.APPLY NOWExperience with data analysis and data visualization languages R/Matlab/Python would be of benefitApply",
        "Page_URL": "https://kathmandujobs.com/jobs/25794/app-developer-job-in-kathmandu"
    },
    {
        "name": "Software Engineer, Ruby on Rails, ReactJS",
        "company": "Truemark Technology",
        "vacancy": "1",
        "time": "full-time",
        "address": "Kathmandu, Nepal",
        "deadline": "2020-11-20",
        "education": "Bachelor Degree",
        "experience": "1-2 years",
        "level": "Intermediate",
        "salary": "Negotiable",
        "desct": "Software Engineer, Ruby on Rails, ReactJSTruemark TechnologyApplyExperience:1-2 yearsLevel:IntermediateTotal Positions:1Job Type:full-timeSalary:NegotiableEducation:Bachelor DegreeLocation:Kathmandu, NepalApply Before:2020-11-20Job DescriptionAnalysis, design, development, deployment, and maintenance of projects with minimal supervision.Write modular, reusable, and top quality code, code reviews, and implementation of best practices.Create and maintain technical documentation. Share knowledge within the team andactively participate in the code review process.Involve in Continuous research and learning; discover, evaluate, and implement new technologies to maximize development efficiency.SkillsGraduate in Computer Engineering or similar IT background or equivalent practical experience.At least 1.5 year of professional experience in Software development.Demonstrable experience with Ruby, Ruby on Rails, Reactjs.Experienced with databases like MySQL, PostgreSQL, and ORM (Object Relational Mapper) libraries.Knowledge of AWS ecosystem or similar cloud-based provider developing scalable websites/services.Hands-on experience in developing, releasing, and maintaining software applications.RenumerationSalary based on skills and qualificationsAnnual leave and sick leave as per labor lawsYou can also drop your cv at:[email\u00a0protected]reactjsruby on railsApply",
        "Page_URL": "https://kathmandujobs.com/jobs/25793/software-engineer-ruby-on-rails-reactjs-job-in-kathmandu"
    },
    {
        "name": "Mobile App developer",
        "company": "Claudemill Technology Pvt. Ltd.",
        "vacancy": "1",
        "time": "full-time",
        "address": "Bhaktapur, Nepal",
        "deadline": "2020-11-30",
        "education": "Bachelor Degree",
        "experience": "1-2 years",
        "level": "Intermediate",
        "salary": "Negotiable",
        "desct": "Mobile App developerClaudemill Technology Pvt. Ltd.ApplyExperience:1-2 yearsLevel:IntermediateTotal Positions:1Job Type:full-timeSalary:NegotiableEducation:Bachelor DegreeLocation:Bhaktapur, NepalApply Before:2020-11-30Experience using version control systems like GitIn lieu of formal tertiary qualifications, relevant work experience and formal training will be considered.2+ years mobile development experience utilizing a range of modern technologiesExperience working in a software development teamExperience building, testing and deploying mobile applications in both iOS and Android ( Flutter or React Native is Preferred)Comfortable working with ES6 JS Libraries (Vue.js / React.js)Confident\u00a0with modern Javascript build tools, eg Node & Webpack, reactProficiency and accuracy in scoping development timelinesExperience designing creative and unique mobile app flowsExperience in working with multi disciplinary, agile teamExperience using design patternsReact Native/FlutterFirebaseAPIsAgile MethodologyDesign PatternApply",
        "Page_URL": "https://kathmandujobs.com/jobs/25792/mobile-app-developer-job-in-bhaktapur"
    },
    {
        "name": "Mid-level PHP Software Engineer",
        "company": "Claudemill Technology Pvt. Ltd.",
        "vacancy": "1",
        "time": "full-time",
        "address": "Bhaktapur, Nepal",
        "deadline": "2020-11-30",
        "education": "Bachelor Degree",
        "experience": "1-2 years",
        "level": "Intermediate",
        "salary": "Negotiable",
        "desct": "Mid-level PHP Software EngineerClaudemill Technology Pvt. Ltd.ApplyExperience:1-2 yearsLevel:IntermediateTotal Positions:1Job Type:full-timeSalary:NegotiableEducation:Bachelor DegreeLocation:Bhaktapur, NepalApply Before:2020-11-30An IT (computer programming) related degree and minimum 2 years digital agency experienceAdvanced knowledge of WordPress / WooCommerce / CMS (knowledge of hooks & custom WP dev)Advanced knowledge in JavaScript and related frameworksAdvanced knowledge of databases and SQLUnderstanding of PHP frameworks such as LaravelStrong understanding of HTML / CSS / JavaScriptStrong understanding of computer programming principles / git and version controlGood understanding of database design and SQLGood understanding of Sketch / Adobe Creative SuiteA genuine passion for web development (provide links to side projects if any)Good communication skills (a willingness to speak to clients a bonus)Familier with API for Mobile appsPHPReactNodeLaravel FrameworkWordpressCMSAPIAgile MethodologyVersion ControlApply",
        "Page_URL": "https://kathmandujobs.com/jobs/25791/midlevel-php-software-engineer-job-in-bhaktapur"
    },
    {
        "name": "Frontend Developer",
        "company": "Empathy IT Club",
        "vacancy": "1",
        "time": "full-time",
        "address": "Kathmandu, Nepal",
        "deadline": "2020-10-20",
        "education": "Bachelor Degree",
        "experience": "2-5 years",
        "level": "Expert",
        "salary": "Rs.70000- Rs.100000",
        "desct": "Frontend DeveloperEmpathy IT ClubApplyExperience:2-5 yearsLevel:ExpertTotal Positions:1Job Type:full-timeSalary:Rs.70000- Rs.100000Education:Bachelor DegreeLocation:Kathmandu, NepalApply Before:2020-10-20We are looking for programmers with a keen eye for design for the position of Front End Developer. Front end Developers are responsible for ensuring the alignment of web design and user experience requirements, optimizing web pages for maximum efficiency and maintaining brand consistency across all web pages, among other duties.Front End Developers are required to work in teams alongside Back end Developers, Graphic Designers and User Experience Designers to ensure all elements of web creation are consistent. This requires excellent communication and interpersonal skills.HtmlCssJavaScript and able to work in any Frontend FrameworkApply",
        "Page_URL": "https://kathmandujobs.com/jobs/25790/frontend-developer-job-in-kathmandu"
    },
    {
        "name": "Software QA Engineer",
        "company": "Swivt Technologies",
        "vacancy": "1",
        "time": "full-time",
        "address": "Kathmandu, Nepal",
        "deadline": "2020-10-31",
        "education": "Bachelor Degree",
        "experience": "2-5 years",
        "level": "Expert",
        "salary": "Rs.35000- Rs.70000",
        "desct": "Software QA EngineerSwivt TechnologiesApplyExperience:2-5 yearsLevel:ExpertTotal Positions:1Job Type:full-timeSalary:Rs.35000- Rs.70000Education:Bachelor DegreeLocation:Kathmandu, NepalApply Before:2020-10-31Requirements:\u2013 Lead the test strategy and test process of all testing activities across the platforms.\u2013 Lead the test project management and manage the test environment, test process, and test team resources.\u2013 Develop and build test strategies for testing and system assurance under an Agile and Scrum environment.\u2013 Manager Agile sprints and support rapid iteration and development through Test-Driven Development / Behaviour-Driven Development.\u2013 Manage and oversight the test plans, test scripts, test reports. Translate user expectations\u2013 Lead the testing function in the development division and drive testing governance plan for best practices.\u2013 Manage the testing resources, ensure the test quality and output is fulfill the overall requirements.Responsibilities:\u2013 Strong leadership experience in leading a sizeable testing function.\u2013 Senior management experience in leading teams and building relationships with senior management.\u2013 Experience with Agile, Scrum and/or Lean principles and practices.\u2013 Experience in Test Driven Development (TDD), and Behavior Driven Development (BDD) is a great plus.\u2013 Experience with at least one hybrid automation modern test framework.\u2013 Experience with ALM tools like JIRA, HP-ALM, MS-TFS, and test automation\u2013 Experience in testing tools including Cucumber and JBehave is a great plus.\u2013 Strong knowledge of the Software Development Life Cycle with expertise in QA processes and methodology, specifically in Agile.\u2013 Experience with various test methods, tools, and toolkits: Functional, Automated, Performance\u2013 Strong working experience in a DevOps / CICD environment.\u2013 Excellent communication skills in English.\u2013 Bachelor degree from a reputed UniversityZestGit version ControlDevOpsReact.JsNode.jSApply",
        "Page_URL": "https://kathmandujobs.com/jobs/25789/software-qa-engineer-job-in-kathmandu"
    },
    {
        "name": "SEO Expert",
        "company": "Swivt Technologies",
        "vacancy": "1",
        "time": "full-time",
        "address": "Kathmandu, Nepal",
        "deadline": "2020-10-31",
        "education": "Secondary Education Examination ( SEE)",
        "experience": "2-5 years",
        "level": "Expert",
        "salary": "Rs.35000- Rs.70000",
        "desct": "SEO ExpertSwivt TechnologiesApplyExperience:2-5 yearsLevel:ExpertTotal Positions:1Job Type:full-timeSalary:Rs.35000- Rs.70000Education:Secondary Education Examination ( SEE)Location:Kathmandu, NepalApply Before:2020-10-31Responsibilities:Work with a team of digital marketing experts covering 8 countries to support the SEO growth opportunities to support growing organic traffic across search enginesHelp set up the roadmap for SEO best practices to maximise search engine optimisationDevelop insights through performance analysis and make recommendations to guide decision makingConduct a site audit and follow up on-site issues with the technical data teamsPartner with product and data team and own the delivery of SEO product and technical prioritiesDevelop strategic and exclusive partnerships to broaden online audience reachRequirements:5+ years of experience in online marketing / SEO within a B2C environmentTrack record of exceeding aggressive growth targets and leading SEO projectsExpert in Google Analytics, SEMRush, keyword research, performance optimisation, Tag, and familiar with leading SEO toolsFluent in English writing and verbal.Must be a data-driven and detail-oriented with problem-solving skillsStrong team player with excellent organisation and time management abilityLoves using and analysing data to perform high quality resultsGoogle AnalyticsBling Webmasterbacklinksmeta TagsApply",
        "Page_URL": "https://kathmandujobs.com/jobs/25788/seo-expert-job-in-kathmandu"
    },
    {
        "name": "Social Media Manager",
        "company": "leckr",
        "vacancy": "1",
        "time": "full-time",
        "address": "Kathmandu, Nepal",
        "deadline": "2021-01-01",
        "education": "Secondary Education Examination ( SEE)",
        "experience": "0-1 years",
        "level": "Beginner",
        "salary": "Rs.10000- Rs.35000",
        "desct": "Social Media ManagerleckrApplyExperience:0-1 yearsLevel:BeginnerTotal Positions:1Job Type:full-timeSalary:Rs.10000- Rs.35000Education:Secondary Education Examination ( SEE)Location:Kathmandu, NepalApply Before:2021-01-01Hi,I have a couple of Instagram accounts that I'd like to grow.@eatcodekiterepeat@techtribe_ecovillage@kitelightretreats@himalayapreneurs@backpacking_tribeI'd like to generate as many followers as possible in order to generate traffic to my website. I'd like to find someone that understands the niche and knows who to target.When applying, let me know what you think about each account and what your growth strategy would be.instagramFacebookApply",
        "Page_URL": "https://kathmandujobs.com/jobs/25786/social-media-manager-job-in-kathmandu"
    },
    {
        "name": "UI/UX Designer",
        "company": "Codewing Solutions",
        "vacancy": "2",
        "time": "full-time",
        "address": "Kathmandu, Nepal",
        "deadline": "2020-12-26",
        "education": "Others",
        "experience": "2-5 years",
        "level": "Expert",
        "salary": "Rs.40000- Rs.100000",
        "desct": "UI/UX DesignerCodewing SolutionsApplyExperience:2-5 yearsLevel:ExpertTotal Positions:2Job Type:full-timeSalary:Rs.40000- Rs.100000Education:OthersLocation:Kathmandu, NepalApply Before:2020-12-26Are you passionate about design? Keep reading!.We, at Codewing Solutionsare looking for a highly skilled web designer (UI/UX or UI or UX) to join our product team to create beautiful themes, not client websites.The work requires you to work closely with our company growth strategy team and developers to create meaningful designs following WordPress theme design guidelines.If you are hired, you will work remotely but are expected to work from our office in Hadigaun (near Baluwatar) when the lockdown is over and it is safe to work from the office.What Does Codewing Solutions do?We are a creative digital agency. We are a product-based company rather than a service-oriented company.We have products in many niches.\u00a0Two of our popular products areRara ThemesandWP Travel Engine, both based on WordPress.With\u00a0millions of downloads, Rara Themes is one of the leading WordPress theme companies in the world. Similarly, WP Travel Engine is currently the world\u2019s #1 travel booking WordPress plugin.Besides\u00a0creating world-class products, we also believe in having fun at work. We work 5 days a week and, and we chill on weekends!What will you be responsible for?The job requires you to keep create beautiful designs following strategy documents provided by our strategy team. The theme you will design will be used by thousands of people from all around the world.The design you create should also be clean, user-friendly, and visually appealing.How qualified you should be?At least 2 years of experience in the UI/UX field or a similar fieldBachelor\u2019s degree in design, IT, or similar degreeStrong understanding of UI which can be proved via your sample design or previous workKnowledge about WordPress will be preferredProficient in Adobe XD, Adobe Photoshop, and Adobe IllustratorProficient in Adobe Suite, Figma, Wireframing & Prototyping tool will serve as an advantageWhy you will love working with us?When you join our team, these are some of the perks that you get.Create digital products that will be used by thousands of people all around the worldWork with a team which has a proven record of building and scaling world-class productsFun and friendly people to work withCozy workspace with CPU, dual monitor working station, and\u00a0ergonomic seating arrangement once we are back at the officeFree lunch and snacks once we are back at the officeUnlimited coffee and tea once we are back at the officeFlexible working hoursTimely performance review and annual salary reviewRecreational activitiesProvident Fund, gratuity, Dashain bonus, insurance, and paid leavesWait! Before sending your CV to us, make sure at least three of the profile matches you:I have traveled to at least 1 place in the last 1 year.I am passionate about at least one other thing apart from designing or have a hobby. Passion for designing is expected.I exercise regularly and take care of my health.I have read at least 1 book in the last 6 months.I have helped at least 1 person after the lockdown.I follow at least 1 Youtube Channel or blog regularly.Ready to Apply?If the vacancy appeals to you and matches your interest, send an email to[email\u00a0protected](NOT .COM).\u00a0The email should include the following:Your CV/ResumeYour Work PortfolioIt should also include answers to at least two of the following questions:What is the last book you read and how did that change your thought process?What causes are you passionate about?What are your 5 major strengths?We\u2019ll take it from there.Web DesignerUI/UX DesignerApply",
        "Page_URL": "https://kathmandujobs.com/jobs/25828/uiux-designer-job-in-kathmandu"
    },
    {
        "name": "Boot-Camp/ Internship For Freshers",
        "company": "Codewing Solutions",
        "vacancy": "29",
        "time": "internship",
        "address": "Kathmandu, Nepal",
        "deadline": "2020-12-26",
        "education": "Others",
        "experience": "0-1 years",
        "level": "Beginner",
        "salary": "Negotiable",
        "desct": "Boot-Camp/ Internship For FreshersCodewing SolutionsApplyExperience:0-1 yearsLevel:BeginnerTotal Positions:29Job Type:internshipSalary:NegotiableEducation:OthersLocation:Kathmandu, NepalApply Before:2020-12-26Looking for an internship program where you can have actual work experience? Keep reading\u2026.About the Program:We, at Codewing, are looking for candidates to join our Boot-camp/Internship program to have potential candidates from scratch. This program will be a self-paced internship and will not require much guidance from team leads. It is focused more on peer-to-peer learning.During this program, you will be assigned with projects, which you will need to complete to graduate from Boot-camp. The internship will be unpaid but You will be provided with free and premium resources to learn and complete the tasks.The program is intended to train and polish your skills in your respective field. Therefore, if an intern demonstrates discipline and performs well, they will be hired as a full-time employee and enrolled in six months of an extensive training program.Who we are:We are Codewing Solutions, a creative digital agency. We are a product - based company rather than a service-oriented company.We are the company behind world-class products likeRara ThemesandWP Travel Engine, both based on WordPress. Along with this, we have products in many niches.While WP Travel Engine is currently the world\u2019s no. 1 travel booking WordPress plugin with over 250,000 downloads and users from more than 50 countries, Rara Themes is one of the leading WordPress theme companies in the world.We have 85+ free and premium themes. Our themes have been downloaded more than 2 million times, and we have users from more than 100+ countries.Now, what will you get? Well,You will be provided with the necessary resources and Programs to learnGrowth with diverse projectsYou will have practical work experienceYou will have maximum exposure to a software developing environmentYour chance of getting hired will increase by many foldBy the end of the internship, candidates who performed really well will be hired.We have openings for:Front-End Development \u2013 Intern (2 Positions)We are looking for an ambitious, excited, resourceful candidate with a passion for code. Candidates must have a good grasp of Front-End tools and technologies and a keen sense of design thinking. One who is passionate about making things work and making them look good would be exactly what we are looking for.WordPress Theme Development \u2013 Intern (3 Positions)We are looking for a WordPress Development intern who is familiar with WordPress\u2019s best practices. Candidates should have an excellent grasp of PHP programming language, HTML skills, JavaScript, CSS, and have a good understanding of the WordPress framework. Good communication is always the priority. Working around theme customization will be added beneficial.Customer Support/Happiness \u2013 Intern (3 Positions)As a Customer Support/Happiness, you will be responding to our customers\u2019 emails and assist them with the issues facing while using our product. We are looking for candidates who have a good command of English and excellent communication skills. You will also be writing documentation as a part of your task. Basic knowledge of WordPress will be beneficial.Plugin Development \u2013 Intern (4 Positions)We are looking for a candidate with a basic understanding of web programming. Some experience with PHP programming language is a must. Candidates who have experience in creating and managing websites with WordPress CMS will be given preference. Basic knowledge of HTML, CSS, and JS is required.The Right candidate would possess the below qualities:PassionateEager to learnTeam PlayerAmbitiousGood Communication skillsReady to apply?Submit your updated CV along with a cover letter to[email\u00a0protected](Not .COM). Do send us your project or work done during college. It can also be something you learned on your job. Tell us why you are the best fit for this program.Note: Please mention the program name you are interested in, in the mail subject.Example:\u00a0 Applying for an SEO intern.We\u2019ll take it from here...InternshipApply",
        "Page_URL": "https://kathmandujobs.com/jobs/25827/bootcamp-internship-for-freshers-job-in-kathmandu"
    },
    {
        "name": ".net Developer with Xamarin",
        "company": "Dailo Technologies",
        "vacancy": "1",
        "time": "full-time",
        "address": "Kathmandu, Nepal",
        "deadline": "2020-12-30",
        "education": "Bachelor Degree",
        "experience": "2-5 years",
        "level": "Intermediate",
        "salary": "Negotiable",
        "desct": ".net Developer with XamarinDailo TechnologiesApplyExperience:2-5 yearsLevel:IntermediateTotal Positions:1Job Type:full-timeSalary:NegotiableEducation:Bachelor DegreeLocation:Kathmandu, NepalApply Before:2020-12-30Inbox your cv at[email\u00a0protected].net framework and XamarinApply",
        "Page_URL": "https://kathmandujobs.com/jobs/25826/net-developer-with-xamarin-job-in-kathmandu"
    },
    {
        "name": "Flutter Developer",
        "company": "Delta Tech Pvt. Ltd.",
        "vacancy": "1",
        "time": "full-time",
        "address": "Biratnagar, Nepal",
        "deadline": "2020-12-10",
        "education": "Bachelor Degree",
        "experience": "1-2 years",
        "level": "Intermediate",
        "salary": "Negotiable",
        "desct": "Flutter DeveloperDelta Tech Pvt. Ltd.ApplyExperience:1-2 yearsLevel:IntermediateTotal Positions:1Job Type:full-timeSalary:NegotiableEducation:Bachelor DegreeLocation:Biratnagar, NepalApply Before:2020-12-10Other SpecificationMin. 1 year working as a full-time professional developer (mobile) with at least 6 months experience in FlutterExperience building a moderately complex android app with knowledge of dart. Bonus if it\u2019s on the play store or we can view the projectWilling to work with cross-platform frameworksWilling to learn and work on different mobile platforms/ frameworks when neededPublished at least one app on the play store using Flutter/ Native (Java/Kotlin/ Swift/ Object c)Networking and integrating third-party APIsWorking with a version control system (i.e. Git)You areAble to multitask and focus on deadlines under pressureTeam playerPassionate about new technologyExcellent team-working skills, hardworking, creative and innovativeJob DescriptionDelta Tech is seeking a Flutter Developer who is an in-depth understanding of iOS and Android using Google Flutter Development Framework and also creative and innovative. You will be working on various internal products (DeltaSalesApp, DeltaRetailerApp, DeltaSalesCRM & DeltaInventory) and external projects with different levels of complexities and challenges.Role and Responsibilities:Your responsibilities will include (but are not limited to):As a Flutter Developer, you will create multi-platform apps for iOS and Android using Google's Flutter development framework.The primary focus will be on creating new experiences and maintaining the acclaimed app.You will additionally work on innovative new app projects as well as internally incubated ventures.Deep experience contributing to and managing high-scale production mobile apps. You must have previous experience in Flutter development.What we offerDelta Tech is looking for candidates who are loyal and plan to make a long-term commitment. In return for your loyalty we offer:Position BenefitsCompetitive/ Attractive Salary (No bar for right and deserving candidate)Timely performance appraisal and salary reviewsPaid holiday & paid leavesFestive bonusGreat work cultureFlexible timings against performanceMulti Platform AppsTime ManagementMobile Application DevelopmentGoogle'S Flutter Development FrameworkIos And AndroidTeamworkApply",
        "Page_URL": "https://kathmandujobs.com/jobs/25825/flutter-developer-job-in-biratnagar"
    },
    {
        "name": "PHP Developer",
        "company": "Podamibe Nepal Pvt. Ltd.",
        "vacancy": "1",
        "time": "full-time",
        "address": "Kathmandu, Nepal",
        "deadline": "2020-12-24",
        "education": "Bachelor Degree",
        "experience": "2-5 years",
        "level": "Intermediate",
        "salary": "Negotiable",
        "desct": "PHP DeveloperPodamibe Nepal Pvt. Ltd.ApplyExperience:2-5 yearsLevel:IntermediateTotal Positions:1Job Type:full-timeSalary:NegotiableEducation:Bachelor DegreeLocation:Kathmandu, NepalApply Before:2020-12-24Job RequirementExperience with pure- PHP (both OOP and Procedural)Excellent working knowledge of MVC framework preferable CIWorking knowledge of JavaScript, jQuery, Json, Gurnt, Saas and AjaxProficiency in SQL database development, writing and optimizing MySQL,keys, relation, indexes etc.Proficiency in using version control tool preferably GITStrong creative, analytical and problem-solving skillsAbility to challenge yourself and work well under pressureTeamworkCritical ThinkingPhpCreative ThinkingApply",
        "Page_URL": "https://kathmandujobs.com/jobs/25824/php-developer-job-in-kathmandu"
    },
    {
        "name": "Full Stack Java Developer",
        "company": "Gamenic Nalamiz Tech",
        "vacancy": "2",
        "time": "full-time",
        "address": "Bhaktapur, Nepal",
        "deadline": "2020-12-10",
        "education": "Bachelor Degree",
        "experience": "0-1 years",
        "level": "Intermediate",
        "salary": "Rs.20000- Rs.100000",
        "desct": "Full Stack Java DeveloperGamenic Nalamiz TechApplyExperience:0-1 yearsLevel:IntermediateTotal Positions:2Job Type:full-timeSalary:Rs.20000- Rs.100000Education:Bachelor DegreeLocation:Bhaktapur, NepalApply Before:2020-12-10Skills and KnowledgeExperience in parallel and multithreaded programming.Knowledge of algorithms and data structures.Interest in achieving maximum performance from available hardware and software.Familiar with design patterns.UI Development Skills (JavaFx, JavaScript, CSS, HTML, jQuery).Hands-on knowledge of Spring Framework.Strong knowledge of Relational Databases, SQL, and ORM technologies.Experience working with source control systems, such as Subversion, and GIT including branching and merging strategies.Essential technologyJavaEE \uff0b GlassFish3TypeScriptJavaScriptMariaDBExperienced and desirable technologyNode.JSAngularExperience using GithubSpring BootContainer knowledge such as DockerKnowledge that can design Class and InterfaceJavaHTMlCSSOOPJQueryGithubJsApply",
        "Page_URL": "https://kathmandujobs.com/jobs/25823/full-stack-java-developer-job-in-bhaktapur"
    },
    {
        "name": "Dot Net Software Developer (.NET Core, .NET Framework)",
        "company": "Podamibe Nepal Pvt. Ltd.",
        "vacancy": "2",
        "time": "full-time",
        "address": "Kathmandu, Nepal",
        "deadline": "2020-12-23",
        "education": "Bachelor Degree",
        "experience": "2-5 years",
        "level": "Intermediate",
        "salary": "Negotiable",
        "desct": "Dot Net Software Developer (.NET Core, .NET Framework)Podamibe Nepal Pvt. Ltd.ApplyExperience:2-5 yearsLevel:IntermediateTotal Positions:2Job Type:full-timeSalary:NegotiableEducation:Bachelor DegreeLocation:Kathmandu, NepalApply Before:2020-12-23We are looking for a C# developer responsible for building C# applications, including anything from back-end services to their client-end counterparts.Your primary responsibilities will be to design and develop these applications, and to coordinate with the rest of the team working on different layers of the infrastructure.Responsibilities- Translate application requirement to functional applications- Design, build and maintain efficient, reusable, and reliable C# code- Ensure the best possible performance, quality, and responsiveness of applications- Identify bottlenecks and bugs, and devise solutions to these problems- Help maintain code quality, organization, and atomization Skills- Proficient in C#, with a good knowledge of its ecosystems- Familiarity with the .NET framework- Familiarity with the Javascript grids- Strong understanding of object-oriented programming- Skill for writing reusable C# libraries- Familiar with various design and architectural patterns- Knowledge of concurrency patterns in C#- Familiarity with SQL Server and MySQL- The knack for writing clean, readable C# code- Proficient understanding of code versioning tools such as \u00a0git..net core .NET Framework ASP.NET Javascript MS SQL mysqlApply",
        "Page_URL": "https://kathmandujobs.com/jobs/25822/dot-net-software-developer-net-core-net-framework-job-in-kathmandu"
    },
    {
        "name": "Job Vaccancy For Laravel+ Vue Js and Quality Assurance",
        "company": "Softechpark Pvt.Ltd.",
        "vacancy": "1",
        "time": "full-time",
        "address": "Kathmandu, Nepal",
        "deadline": "2020-11-27",
        "education": "Secondary Education Examination ( SEE)",
        "experience": "2-5 years",
        "level": "Expert",
        "salary": "Rs.30000- Rs.50000",
        "desct": "Job Vaccancy For Laravel+ Vue Js and Quality AssuranceSoftechpark Pvt.Ltd.ApplyExperience:2-5 yearsLevel:ExpertTotal Positions:1Job Type:full-timeSalary:Rs.30000- Rs.50000Education:Secondary Education Examination ( SEE)Location:Kathmandu, NepalApply Before:2020-11-27Required Skill & Experiences for Laravel Developer3+ years of experiance for senior level developer and must be capable for team leading.Should be expert knowledge in web technologies including HTML, CSS, Javascript, AJAX etc.Experience working with Laravel Framework.Write quality OOP code and follow existing development standards-Knowledge of Vue.js and VueX-knowledge of Vue CLIRestful API development experience.Experience with Test-Driven Development (PHPUnit)Experience in refactoring and improving the legacy code to use modern standards and tests.Strong problem-solving skills and attention to detail.Knowledge of GIT.Work experienced in ERP based projects.Daily stand-up meetings to review current progress and obstacles with direct team.Required Skill & Experiences for Quality AssuranceProven work experience in software Quality Assurance1+ experience in related fieldStrong knowledge of software QA methodologies, tools and processesReviewing requirements and development design.Writing Test Cases.Preparing test environment.Execution of test cases and test plans.Performing different types of testing (Manual and Automation).Reporting, tracking and following-up bugs using Team Foundation Server (TFS).Performing the needed documentation related to tested software.Salary:Laravel & Vue JS Developer : 30-50 k/monthQuality Assurance:15-30kDeadline :2020-11-27We are seeking Senior Laravel+ Vue Js and one Quality Assuranceto join our Softechpark development team. We're looking for a self-motivatedinnovative programmer & Quality Assurance who's excited about leveraging new technology to improve existing enterprise systems. We need an experienced & passionate candidate only to fill this position.Apply",
        "Page_URL": "https://kathmandujobs.com/jobs/25821/job-vaccancy-for-laravel-vue-js-and-quality-assurance-job-in-kathmandu"
    },
    {
        "name": "PHP/Vue Developer (Back-end )",
        "company": "Apiera",
        "vacancy": "1",
        "time": "freelance",
        "address": "Kathmandu, Nepal",
        "deadline": "2020-11-07",
        "education": "Secondary Education Examination ( SEE)",
        "experience": "2-5 years",
        "level": "Expert",
        "salary": "Negotiable",
        "desct": "PHP/Vue Developer (Back-end )ApieraApplyExperience:2-5 yearsLevel:ExpertTotal Positions:1Job Type:freelanceSalary:NegotiableEducation:Secondary Education Examination ( SEE)Location:Kathmandu, NepalApply Before:2020-11-07Ideally: self-motivated, proactive, result-oriented, best practises, hard-working, Go-getter...PHP/Vue Developer (Back-end )Position: Senior/Mid-levelWork Environment: RemoteEmployment Type: Full-time / Part-time(Minimum 25hrs/week)Salary: Depends on Experience. No bar for Deserving Candidate.Our hiring process for this vacancy:1) CV review2) Technical evaluation test3) HR interview4) OfferThe focus of your role:PHP Developer is responsible for managing back-end services and the interchange of data between the server and the users. Your primary focus will be the development of all server-side logic, definition and maintenance of the central database, and ensuring high performance and responsiveness to requests from the front-end. You will also be responsible for integrating the front-end elements built by your co-workers into the application. Therefore, a basic understanding of front-end technologies is necessary as well.Apply by filling the form: https://forms.gle/MgGPKfxXPDkCUgwo6Please feel free to inquire at[email\u00a0protected]PHPVUELaravelApply",
        "Page_URL": "https://kathmandujobs.com/jobs/25820/phpvue-developer-backend--job-in-kathmandu"
    },
    {
        "name": "Flutter Developer",
        "company": "Codavatar Tech Private Limited",
        "vacancy": "3",
        "time": "full-time",
        "address": "Kathmandu, Nepal",
        "deadline": "2020-12-15",
        "education": "Secondary Education Examination ( SEE)",
        "experience": "2-5 years",
        "level": "Intermediate",
        "salary": "Negotiable",
        "desct": "Flutter DeveloperCodavatar Tech Private LimitedApplyExperience:2-5 yearsLevel:IntermediateTotal Positions:3Job Type:full-timeSalary:NegotiableEducation:Secondary Education Examination ( SEE)Location:Kathmandu, NepalApply Before:2020-12-15???? Job DescriptionAs a Flutter Developer, you will create multi-platform apps for iOS and Android using Google's Flutter development framework. Ideal candidates will possess a drive for thinking creatively to resolve complex problems and enjoy contributing to solutions.???? Job Requirements\u27a4 Min. 3 year working as a full-time professional developer (Mobile) with at least 1 year experience in Flutter.\u27a4 Should have strong knowledge of OOP.\u27a4 Should have clean Code architecture, patterns\u27a4 Collaborate with QA to test and deliver the product with high quality and high speed\u27a4 Experience building a moderately complex Android app with knowledge of dart.\u27a4 Willing to work with cross-platform frameworks.\u27a4 Willing to learn and work on different mobile platforms/frameworks when needed.\u27a4 Published at least one app on the Play Store using Flutter/ Native (Java/Kotlin/Swift/Object c).\u27a4 Networking and integrating third-party APIs.\u27a4 Working with a version control system (i.e., Git)\u27a4 Job Duties and Responsibilities\u27a4 As a Flutter Developer, you will create multi-platform apps for iOS and Android using Google's Flutter development framework.\u27a4 The primary focus will be on creating new applications from scratch.\u27a4 Develop SDKs, libraries, and widgets to create a mobile application development platform\u27a4 Provide feedback regarding system performance and usability issues\u27a4 Deep experience contributing to and managing high-scale production mobile apps. You must have previous experience in Flutter development.???? Required Technical and Professional Expertise\u2022 Problem Solving\u2022 Time Management\u2022 Communication\u2022 Flutter???? What we offer?\u2713 Insurance policy and Benefits\u2713 Competitive Salary\u2713 Festival & Relocation Allowance\u2713 Provident Fund & Gratuity???? About CompanyCodavatar is an Application (Web/Mobile) Development firm which provides best in class solutions on the Web, Mobility, Cloud and more internet-based services.Website Link:https://www.codavatar.com/\u270d How to applyTo apply for this position, send an email to[email\u00a0protected]with \u201cFlutter Developer\u201d in the subject line. In the email, make sure to include your resume (in word or PDF preferred), cover letter, salary requirements, and any additional information you would feel relevant for this role.*No Age Bar for deserving candidates.Problem SolvingTime ManagementCommunicationFlutterApply",
        "Page_URL": "https://kathmandujobs.com/jobs/25819/flutter-developer-job-in-kathmandu"
    },
    {
        "name": "Visual Editor/ Animator",
        "company": "Ombryo Lab Pvt. Ltd.",
        "vacancy": "3",
        "time": "full-time",
        "address": "Kathmandu, Nepal",
        "deadline": "2020-12-22",
        "education": "Bachelor Degree",
        "experience": "2-5 years",
        "level": "Intermediate",
        "salary": "Negotiable",
        "desct": "Visual Editor/ AnimatorOmbryo Lab Pvt. Ltd.ApplyExperience:2-5 yearsLevel:IntermediateTotal Positions:3Job Type:full-timeSalary:NegotiableEducation:Bachelor DegreeLocation:Kathmandu, NepalApply Before:2020-12-22\u2705 Job Requirements\u27a4 At least 2-4 years of experience in Visual Editing and Animating.\u27a4 Proficient in After Effects, Illustrator, Adobe Character Animator are preferred.\u27a4 Experience in Auto Desk Maya is encouraged.\u27a4 Good drawing skills and creativity.\u27a4 Excellent time management skills.\u27a4 Strong communication and active listening skills.\u27a4 He/ She is required to understand how a good story works and tells best through animation.\u27a4 Must be able to work in a fast-paced startup working culture\u27a4 Experienced on making Logo Animation,2D/3D animation, Short Video Ads etc.\u27a4 Worked on projects of App & Website Previews and should have a good knowledge of character animation.\u2705 Job Duties and Responsibilities\u27a4 He/ She Should work on project Line Action Explainers, 3D Product Animation and must be conceptual with video editing, visual effects.\u27a4 He/ She needs to operate and edit on Whiteboard & Animated Explainers.\u27a4 Manipulate visual effects and animations like 2D, 3D using computerized technology and software applications.\u27a4 Creating visuals for video games and mobile applications.\u27a4 Generating simulations and mockups to be viewed and approved by those involved in media production and stakeholders.\u27a4 Troubleshooting any issues with animations.\u27a4 Establish storyboards to understand the images needed for the storyline and purpose of production.\u27a4 Ensure logical sequencing and smooth running.\u27a4 Adhering to tight deadlines and other constraints to meet production times.\u2705Required Technical and Professional Expertise\u27a4 Bachelor\u2019s degree in relevant field\u27a4 Excellent interpersonal and communication skills\u27a4 Research Oriented\u27a4 Critical Thinker\u27a4 Must have a solid Animation and Graphic Design Portfolio\u27a4 Should possess creativity and innovativeness\u27a4 Must be a team player\u27a4 Must be able to work in fast paced startup working culture\u27a4 Must be able to navigate complicated processes with many users, and convey information in an understandable way to them\u2705 What we offer?\u27a4 Competitive Salary\u27a4 Festival & Relocation Allowance\u27a4 Provident Fund & Gratuity\u27a4 Growth & Development Opportunities\u27a4 Friendly and creative working environment\u2705 About CompanyOmbryo Lab is a Startup Incubator which aims in changing the IT Landscape of Nepal with the adoption of Silicon Valley culture. We create a long term impact by sprouting the right talent to a fully grown venture which is capable of driving the next generation innovation and developing cutting edge products.???? How to apply\u270f\ufe0f To apply for this position, send an email with a link to your latest portfolio to[email\u00a0protected]with \u201cAnimator/ Visual Editor\u201d in the subject line. In the email, make sure to include your resume (in word or PDF preferred), cover letter, salary requirements and any additional information you would feel relevant for this role.Critical ThinkerMust have a solid Animation and Graphic Design PortfolioShould possess creativity and innovativenessMust be a team playerMust be able to work in fast paced startup working cultureApply",
        "Page_URL": "https://kathmandujobs.com/jobs/25818/visual-editor-animator-job-in-kathmandu"
    },
    {
        "name": "Urdu Tutor",
        "company": "Ombryo Lab Pvt. Ltd.",
        "vacancy": "3",
        "time": "full-time",
        "address": "Kathmandu, Nepal",
        "deadline": "2020-12-15",
        "education": "Secondary Education Examination ( SEE)",
        "experience": "0-1 years",
        "level": "Beginner",
        "salary": "Negotiable",
        "desct": "Urdu TutorOmbryo Lab Pvt. Ltd.ApplyExperience:0-1 yearsLevel:BeginnerTotal Positions:3Job Type:full-timeSalary:NegotiableEducation:Secondary Education Examination ( SEE)Location:Kathmandu, NepalApply Before:2020-12-15????Requirement:\u2705Should have completed minimum +2\u2705Should have good fluency in English and Urdu not only inwritten but speaking will be given more importance.\u2705Able to type in Urdu\u2705Should be able to interact with student freely. Extrovertnature will be preferred.????Responsibilities:\u2705Translation of documents from Urdu to English and Viceversa\u2705Conduct classes\u2705Design the study materialsShould have good fluency in English and Urdu not only in written but speaking will be given more importance.Able to type in UrduShould be able to interact with student freely. Extrovert nature will be preferred.Apply",
        "Page_URL": "https://kathmandujobs.com/jobs/25817/urdu-tutor-job-in-kathmandu"
    },
    {
        "name": "UI/UX Designer",
        "company": "Codavatar Tech Private Limited",
        "vacancy": "3",
        "time": "full-time",
        "address": "Kathmandu, Nepal",
        "deadline": "2020-12-15",
        "education": "Secondary Education Examination ( SEE)",
        "experience": "2-5 years",
        "level": "Intermediate",
        "salary": "Negotiable",
        "desct": "UI/UX DesignerCodavatar Tech Private LimitedApplyExperience:2-5 yearsLevel:IntermediateTotal Positions:3Job Type:full-timeSalary:NegotiableEducation:Secondary Education Examination ( SEE)Location:Kathmandu, NepalApply Before:2020-12-15Job Duties and Responsibiliies\u2022 Plan and implement new designs\u2022 Optimize existing user interface designs\u2022 Test for intuitivity and experience\u2022 Communicate with clients to understand their business goals and objectives\u2022 Develop technical and business requirements and always strive to deliver intuitive and user-centered solutions\u2022 Combine creativity with an awareness of the design elements\u2022 Create prototypes for new product ideas\u2022 Test new ideas before implementing\u2022 Conduct an ongoing user research\u2713 Problem solver and customer-centeredKnowledge of Adobe range of products including Photoshop0IllustratorInDesignAcrobat and DreamweaverYears of experience with HTML5 & CSS3Some knowledge of Usability Factors in Human Computer Interaction.Apply",
        "Page_URL": "https://kathmandujobs.com/jobs/25816/uiux-designer-job-in-kathmandu"
    },
    {
        "name": "React.js Developer (Web Developer)",
        "company": "e-digital Nepal Pvt. Ltd.",
        "vacancy": "1",
        "time": "full-time",
        "address": "Kathmandu, Nepal",
        "deadline": "2020-12-05",
        "education": "Bachelor Degree",
        "experience": "1-2 years",
        "level": "Intermediate",
        "salary": "Negotiable",
        "desct": "React.js Developer (Web Developer)e-digital Nepal Pvt. Ltd.ApplyExperience:1-2 yearsLevel:IntermediateTotal Positions:1Job Type:full-timeSalary:NegotiableEducation:Bachelor DegreeLocation:Kathmandu, NepalApply Before:2020-12-05We are looking for a skilled React.js Developer to join our front-end development team. In this role, you will be responsible for developing and implementing user interface components using React.js concepts and workflows such as Redux, Flux, and Webpack. You will also be responsible for profiling and improving front-end performance and documenting our front-end codebase.To ensure success as a React.js Developer, you should have in-depth knowledge of JavaScript and React concepts, excellent front-end coding skills, and a good understanding of progressive web applications. Ultimately, a top-class React.js Developer should be able to design and build modern user interface components to enhance application performance.React.js Developer Responsibilities:Meeting with the development team to discuss user interface ideas and applications.Reviewing application requirements and interface designs.Identifying web-based user interactions.Developing and implementing highly-responsive user interface components using React concepts.Writing application interface codes using JavaScript following React.js workflows.Troubleshooting interface software and debugging application codes.Developing and implementing front-end architecture to support user interface concepts.Monitoring and improving front-end performance.Documenting application changes and developing updates.React.js Developer Requirements:Bachelor\u2019s degree in Computer Science, Information Technology, or a similar field.Previous experience working as a React.js Developer.In-depth knowledge of JavaScript, CSS, HTML, and front-end languages.Knowledge of REACT tools including React.js, Webpack, Enzyme, Redux, and Flux.Experience with user interface design.Knowledge of performance testing frameworks including Mocha and Jest.Experience with browser-based debugging and performance testing software.Excellent troubleshooting skills.Good project management skills.Knowledge of REACT tools including React.jsWebpackEnzymeReduxand Flux.Apply",
        "Page_URL": "https://kathmandujobs.com/jobs/25815/reactjs-developer-web-developer-job-in-kathmandu"
    },
    {
        "name": "React.js Developer (Web Developer)",
        "company": "e-digital Nepal Pvt. Ltd.",
        "vacancy": "1",
        "time": "full-time",
        "address": "Kathmandu, Nepal",
        "deadline": "2020-12-05",
        "education": "Bachelor Degree",
        "experience": "1-2 years",
        "level": "Intermediate",
        "salary": "Negotiable",
        "desct": "React.js Developer (Web Developer)e-digital Nepal Pvt. Ltd.ApplyExperience:1-2 yearsLevel:IntermediateTotal Positions:1Job Type:full-timeSalary:NegotiableEducation:Bachelor DegreeLocation:Kathmandu, NepalApply Before:2020-12-05We are looking for a skilled React.js Developer to join our front-end development team. In this role, you will be responsible for developing and implementing user interface components using React.js concepts and workflows such as Redux, Flux, and Webpack. You will also be responsible for profiling and improving front-end performance and documenting our front-end codebase.To ensure success as a React.js Developer, you should have in-depth knowledge of JavaScript and React concepts, excellent front-end coding skills, and a good understanding of progressive web applications. Ultimately, a top-class React.js Developer should be able to design and build modern user interface components to enhance application performance.React.js Developer Responsibilities:Meeting with the development team to discuss user interface ideas and applications.Reviewing application requirements and interface designs.Identifying web-based user interactions.Developing and implementing highly-responsive user interface components using React concepts.Writing application interface codes using JavaScript following React.js workflows.Troubleshooting interface software and debugging application codes.Developing and implementing front-end architecture to support user interface concepts.Monitoring and improving front-end performance.Documenting application changes and developing updates.React.js Developer Requirements:Bachelor\u2019s degree in Computer Science, Information Technology, or a similar field.Previous experience working as a React.js Developer.In-depth knowledge of JavaScript, CSS, HTML, and front-end languages.Knowledge of REACT tools including React.js, Webpack, Enzyme, Redux, and Flux.Experience with user interface design.Knowledge of performance testing frameworks including Mocha and Jest.Experience with browser-based debugging and performance testing software.Excellent troubleshooting skills.Good project management skills.Knowledge of REACT tools including React.jsWebpackEnzymeReduxand Flux.Apply",
        "Page_URL": "https://kathmandujobs.com/jobs/25815/reactjs-developer-web-developer-job-in-kathmandu"
    },
    {
        "name": "Software Trainer",
        "company": "Quantum IT SOLUTIONS",
        "vacancy": "5",
        "time": "freelance",
        "address": "Kathmandu, Nepal",
        "deadline": "2020-11-30",
        "education": "Higher Secondary Level (+2)",
        "experience": "0-1 years",
        "level": "Beginner",
        "salary": "Negotiable",
        "desct": "Software TrainerQuantum IT SOLUTIONSApplyExperience:0-1 yearsLevel:BeginnerTotal Positions:5Job Type:freelanceSalary:NegotiableEducation:Higher Secondary Level (+2)Location:Kathmandu, NepalApply Before:2020-11-30\u2022 Maintaining relationships with the existing client bases related to software.\u2022 Identifying and solving queries and concerns of the clients and ensuring client satisfaction.\u2022 Good communication skills.\u2022 Experience in presenting to groups of individuals face to face and running online demonstrations of products/servicesGood CommunicationApply",
        "Page_URL": "https://kathmandujobs.com/jobs/25814/software-trainer-job-in-kathmandu"
    },
    {
        "name": "Machine Learning Engineer - Part Time",
        "company": "Techrise",
        "vacancy": "1",
        "time": "part-time",
        "address": "Lalitpur, Nepal",
        "deadline": "2020-11-21",
        "education": "Bachelor Degree",
        "experience": "2-5 years",
        "level": "Intermediate",
        "salary": "Rs.30000- Rs.45000",
        "desct": "Machine Learning Engineer - Part TimeTechriseApplyExperience:2-5 yearsLevel:IntermediateTotal Positions:1Job Type:part-timeSalary:Rs.30000- Rs.45000Education:Bachelor DegreeLocation:Lalitpur, NepalApply Before:2020-11-21We are looking for:An expert in machine learning to help us to design and build an online e-learning program.A person who can work part-time for about 15 - 20 hours a week. (It is remote work. Working hours can be decided according to your circumstances.)Required skills:Advanced degree in computer science, math, statistics or a related disciplineExtensive data modeling and data architecture skillsProgramming experience in PythonExperience in machine learning frameworks in python such as TensorFlow or KerasStrong knowledge about machine learning and deep learning algorithms such as k-Nearest, NLP and sequence modeling, along with CNNStrong written and verbal communications in EnglishCore responsibilities:Create, check, and modify online courses about machine learningCommunicate with the foreign team for any improvement in our online programsResearch, Design and Frame Machine Learning SystemsUnderstand and Transform the Prototypes of Data ScienceVerifying data quality, and/or ensuring it via data cleaningPerform Machine Learning Model Tests and ExperimentsDevelop the Machine Learning Model as per the NeedSelect and Implement Right Machine Learning AlgorithmsUnderstand Business Objectives and Developing the ML ModelsCompany benefits:Friendly, creative working environment with a foreign teamWorking with the latest technologiesTimely salary reviewRemote working policyApplying Procedure:If you believe you are the one and have a passion to work with us,APPLY NOWwithYour recent resume\u00a0in PDF formatYour desired weekly working hours and\u00a0monthly salaryat[email\u00a0protected].We are looking forward to receiving your application!Machine LearningApply",
        "Page_URL": "https://kathmandujobs.com/jobs/25813/machine-learning-engineer-part-time-job-in-lalitpur"
    },
    {
        "name": "Senior .NET developer",
        "company": "Singapore Ecommerce App Pte. Ltd",
        "vacancy": "2",
        "time": "full-time",
        "address": "Kathmandu, Nepal",
        "deadline": "2020-12-16",
        "education": "Bachelor Degree",
        "experience": "5-10 years",
        "level": "Expert",
        "salary": "Negotiable",
        "desct": "Senior .NET developerSingapore Ecommerce App Pte. LtdApplyExperience:5-10 yearsLevel:ExpertTotal Positions:2Job Type:full-timeSalary:NegotiableEducation:Bachelor DegreeLocation:Kathmandu, NepalApply Before:2020-12-16Please state your current salary, expected salary, notice period, contact-able referenceStrong knowledge of Object-Oriented Programming and Design ConceptsKnowledge of software development life-cycle for web-based applicationsExperience in design and development experience with C#, Angular, .NET web framework, .NET and/or .NET CoreProficient in MS SQL queries, familiar with Database Design and Stored ProceduresExperience in web technologies: JavaScript, AJAX, jQuery, HTML5, CSSDesign and develop and maintain simple to complex modules for our productsInvestigate new APIs and learn how to use themUbuntuWindows Serversystem designSQL Server.NET coreasp.net.NET MVCversion controlsearch database like elasticsearchcache system like redisApply",
        "Page_URL": "https://kathmandujobs.com/jobs/25812/senior-net-developer-job-in-kathmandu"
    },
    {
        "name": ".Net Developer",
        "company": "Krennova Pvt. Ltd",
        "vacancy": "2",
        "time": "full-time",
        "address": "Kathmandu, Nepal",
        "deadline": "2020-11-30",
        "education": "Bachelor Degree",
        "experience": "2-5 years",
        "level": "Intermediate",
        "salary": "Rs.30000- Rs.45000",
        "desct": ".Net DeveloperKrennova Pvt. LtdApplyExperience:2-5 yearsLevel:IntermediateTotal Positions:2Job Type:full-timeSalary:Rs.30000- Rs.45000Education:Bachelor DegreeLocation:Kathmandu, NepalApply Before:2020-11-30Krennova Tech is looking for Associate Software Engineer (.NET), who will be responsible for creating ASP.NET web applications, providing support to clients and writing quality and scalable codes in .NET Framework.Job Responsibilities:Develop web applications using ASP.NET.Modify existing ASP.NET web applications according to requirements.Develop ASP.NET Web APIs and Web Services for mobile applications.Professional Skill Required:.NET Core, ASP.NET MVC, Web API, Entity Framework, MSSqlOther Specification:Bachelor in Computer Engineering/Science or related field or equivalentPrior experience as a .NET developer (At least 2 year)Knowledge of .NET Framework (ASP.NET MVC, Web API and Web Services)Knowledge of Umbraco CMS V 7.0 will be plus.Ability to use Visual Studio for application development and debuggingKnowledge of MSSQL (SQL Queries, tables, stored-procedures and functions)Proficiencies in HTML, CSS, JavaScriptWork remotely during pandemic. Please send your details to[email\u00a0protected]..NET CoreASP.NET MVCWeb APIEntity FrameworkMSSqlApply",
        "Page_URL": "https://kathmandujobs.com/jobs/25811/net-developer-job-in-kathmandu"
    },
    {
        "name": "Product photographer",
        "company": "parsa handicraft",
        "vacancy": "1",
        "time": "full-time",
        "address": "Kathmandu, Nepal",
        "deadline": "2020-12-08",
        "education": "Higher Secondary Level (+2)",
        "experience": "1-2 years",
        "level": "Intermediate",
        "salary": "Rs.30000- Rs.38000",
        "desct": "Product photographerparsa handicraftApplyExperience:1-2 yearsLevel:IntermediateTotal Positions:1Job Type:full-timeSalary:Rs.30000- Rs.38000Education:Higher Secondary Level (+2)Location:Kathmandu, NepalApply Before:2020-12-08Take professional pictures in a studio or in a particular locationTo produce high-quality photographic imagesUse different techniques to enhance the photographs as requiredUse photo manipulation software such as Adobe Suite to get desired resultsRecommend creative ideas to exceed expectations of goals and objectivesUse artistic knowledge to enhance and compose photographsReview sets of photographs and select the best resultsOperate various photographic equipment such as single lens reflex cameras and film or digital cameras and lighting.high-quality photographicApply",
        "Page_URL": "https://kathmandujobs.com/jobs/25809/product-photographer-job-in-kathmandu"
    },
    {
        "name": "Angular Developer",
        "company": "PalmMind IT",
        "vacancy": "3",
        "time": "full-time",
        "address": "Kathmandu, Nepal",
        "deadline": "2020-12-10",
        "education": "Bachelor Degree",
        "experience": "2-5 years",
        "level": "Expert",
        "salary": "Negotiable",
        "desct": "Angular DeveloperPalmMind ITApplyExperience:2-5 yearsLevel:ExpertTotal Positions:3Job Type:full-timeSalary:NegotiableEducation:Bachelor DegreeLocation:Kathmandu, NepalApply Before:2020-12-10Strong Knowledge of Angular FrameworkWork as a part of an Agile team.Build and maintain JS based code baseStrong knowledge of NodeJSGood problem-solving skillsStrong knowledge of developing and utilising APIs.Problem-solving skillsApply",
        "Page_URL": "https://kathmandujobs.com/jobs/25808/angular-developer-job-in-kathmandu"
    },
    {
        "name": "Python Developer",
        "company": "Numeric Mind",
        "vacancy": "2",
        "time": "full-time",
        "address": "Kathmandu, Nepal",
        "deadline": "2020-11-30",
        "education": "Bachelor Degree",
        "experience": "1-2 years",
        "level": "Intermediate",
        "salary": "Negotiable",
        "desct": "Python DeveloperNumeric MindApplyExperience:1-2 yearsLevel:IntermediateTotal Positions:2Job Type:full-timeSalary:NegotiableEducation:Bachelor DegreeLocation:Kathmandu, NepalApply Before:2020-11-30About the company and Partner: Nimble Clinical Research is a US based technology company dedicated towards creating innovative software applications for pharmaceutical and biotech companies. We are building our local Nepal team via our partner company, Numeric Mind Pvt Ltd (numericmind.com) in Nepal, and looking for the best python developers. Visit Nimble Clinical Research, LLC (nimble-cr.com) to know\u00a0about our current software applications.Role and Responsibilities\u2022 As a Python developer, you\u2019ll design and develop highly complex modules in our data analytics platform.\u2022 The ideal candidate is a self-starter, independent and passionate developer with a strong desire to create high-quality applications.\u2022 You are expected to continually learn and apply best software development practices and technologies to the tasks at hand.\u2022 Use core python, data analysis related packages (such as numpy, pandas, matplotlib, SciPy) and QT (to design user interface elements).Requirements\u2022 Expert in core python, and OOP\u2022 Strong experience in numpy, pandas desired\u2022 At least 3 months on-job experience as a trainee or an employee; Over 1-year experience preferred\u2022 Education: BS in Computer Science or equivalent degree.Type: Full-timeNumber of Openings: 2Location: Remote/office in NepalCompensation:\u00a0Attractive salary, higher than the market rate, along with increments every 6 monthsREFERRAL: Do you know someone else who is a great python programmer? Earn NRP 20,000 by referring a candidate. Refer them to us! On successful hiring of the candidate, lasting at least a month of employment, you will get NR 20,000 as referral reward.Applying: if interested, send your resume directly to[email\u00a0protected]. In the resume include your git repository link and LinkedIn profile link if available.Python ProgrammingnumpypandasmatplotlibSciPy and QTApply",
        "Page_URL": "https://kathmandujobs.com/jobs/25807/python-developer-job-in-kathmandu"
    },
    {
        "name": "Full Stack Java Developer",
        "company": "Gamenic Nalamiz Tech",
        "vacancy": "2",
        "time": "full-time",
        "address": "Bhaktapur, Nepal",
        "deadline": "2020-11-15",
        "education": "Bachelor Degree",
        "experience": "0-1 years",
        "level": "Intermediate",
        "salary": "Rs.15000- Rs.50000",
        "desct": "Full Stack Java DeveloperGamenic Nalamiz TechApplyExperience:0-1 yearsLevel:IntermediateTotal Positions:2Job Type:full-timeSalary:Rs.15000- Rs.50000Education:Bachelor DegreeLocation:Bhaktapur, NepalApply Before:2020-11-15Skills and KnowledgeExperience in parallel and multithreaded programming.Knowledge of algorithms and data structures.Interest in achieving maximum performance from available hardware and software.Familiar with design patterns.UI Development Skills (JavaFx, JavaScript, CSS, HTML, jQuery).Hands-on knowledge on Spring Framework.Strong knowledge of Relational Databases, SQL, and ORM technologies.Experience working with source control systems, such as Subversion, and GIT including branching and merging strategies.Essential technologyJavaEE \uff0b GlassFish3TypeScriptJavaScriptMariDBExperienced and desirable technologyNode.JSAngularExperience using GitSpling BootContainer knowledge such as DockerKnowledge that can design Class and InterfaceCSSHTMLJavaJQueryOOPApply",
        "Page_URL": "https://kathmandujobs.com/jobs/25806/full-stack-java-developer-job-in-bhaktapur"
    },
    {
        "name": "Assitant PTE Tutor",
        "company": "Ombryo Lab Pvt. Ltd.",
        "vacancy": "1",
        "time": "full-time",
        "address": "Kathmandu, Nepal",
        "deadline": "2020-11-30",
        "education": "Bachelor Degree",
        "experience": "1-2 years",
        "level": "Intermediate",
        "salary": "Negotiable",
        "desct": "Assitant PTE TutorOmbryo Lab Pvt. Ltd.ApplyExperience:1-2 yearsLevel:IntermediateTotal Positions:1Job Type:full-timeSalary:NegotiableEducation:Bachelor DegreeLocation:Kathmandu, NepalApply Before:2020-11-30Requirement:Should have completed Bachelor\u2019s DegreeMinimum of 1 year experience in teaching PTE/IELTSShould have very good fluency in speaking and writing in English.Carry out the task given with diligenceHave to have good team spirit\u27a4 Responsibilities:\u270eWorking hours: 7 am to 3 pm (Should be flexible in timings)\u270eWorking Modality: Work from home. Everything required to do the job like the computer etc. will be providedShould have very good fluency in speaking and writing in English.Carry out the task given with diligenceHave to have good team spiritApply",
        "Page_URL": "https://kathmandujobs.com/jobs/25805/assitant-pte-tutor-job-in-kathmandu"
    },
    {
        "name": "Full Stack Developer Node.js / Vue.js - Senior Level",
        "company": "Outsource Array P. Ltd.",
        "vacancy": "2",
        "time": "full-time",
        "address": "Kathmandu, Nepal",
        "deadline": "2020-11-20",
        "education": "Bachelor Degree",
        "experience": "2-5 years",
        "level": "Expert",
        "salary": "Negotiable",
        "desct": "Full Stack Developer Node.js / Vue.js - Senior LevelOutsource Array P. Ltd.ApplyExperience:2-5 yearsLevel:ExpertTotal Positions:2Job Type:full-timeSalary:NegotiableEducation:Bachelor DegreeLocation:Kathmandu, NepalApply Before:2020-11-20We are looking for Full Stack developers who need to be able to work on a weekly release schedule, with online demos and a minimal SCRUM routine.Need to be experts at REST webservice, Node.js and/or Vue.js.Our technology stack is:Backend webservices: on Node.js, Postgresql, Docker, Assorted AWS managed services, OAuth2.Front-end: Vue.js, bootstrap.Applications can be made online here or send us your CVs to:[email\u00a0protected]REST webserviceNode.js and/or Vue.jsApply",
        "Page_URL": "https://kathmandujobs.com/jobs/25804/full-stack-developer-nodejs-vuejs-senior-level-job-in-kathmandu"
    },
    {
        "name": "UI/UX Designer",
        "company": "Ombryo Lab Pvt. Ltd.",
        "vacancy": "2",
        "time": "full-time",
        "address": "Kathmandu, Nepal",
        "deadline": "2020-12-02",
        "education": "Secondary Education Examination ( SEE)",
        "experience": "2-5 years",
        "level": "Intermediate",
        "salary": "Negotiable",
        "desct": "UI/UX DesignerOmbryo Lab Pvt. Ltd.ApplyExperience:2-5 yearsLevel:IntermediateTotal Positions:2Job Type:full-timeSalary:NegotiableEducation:Secondary Education Examination ( SEE)Location:Kathmandu, NepalApply Before:2020-12-02Job Duties and Responsibilities\u00d8 Collaborate with other team members and stakeholders of the project\u00d8 Gather and evaluate user requirements, in collaboration with product managers and engineers.\u00d8 Create customer journey maps to better understand customer\u2019s interactions with the business over time and across service channels and iterate the design to develop the best ever user experience.\u00d8 Illustrate design ideas using storyboards, process flows and sitemaps.\u00d8 Plan and Implement new designs and optimize existing user interface designs.\u00d8 Develop technical and business requirements and always strive to deliver intuitive and user-centered solutions\u00d8 Combine creativity with an awareness of the design elements\u00d8 Create prototypes for new product ideas\u00d8 Test new ideas before implementing\u00d8 Conduct an ongoing user research\u00d8 Be prepared to constantly be asked to try new things, and pushed to continuously improve.\u00a7 Required Technical and Professional Expertise\u00d8 Bachelor\u2019s degree in relevant field\u00d8 Excellent interpersonal and communication skills\u00d8 Research Oriented\u00d8 Critical Thinker\u00d8 Some knowledge of Usability Factors in Human Computer Interaction\u00d8 Must have a solid UI Design Portfolio\u00d8 Should possess creativity and innovativeness\u00d8 Must be a team player\u00d8 Must be able to work in fast paced startup working culture\u00d8 Must be able to navigate complicated processes with many users, and convey information in an understandable way to themProficient in HTML and CSSDeep Understanding of cutting edge latest UI/UX trends.Excellent knowledge about user interfacebrowser compatibility and Web 2.0Ability to breakdown complex interaction to simpleelegant and straightforward user interactions and experiences.Apply",
        "Page_URL": "https://kathmandujobs.com/jobs/25803/uiux-designer-job-in-kathmandu"
    },
    {
        "name": "Inside Sales Executive",
        "company": "Codavatar Tech Private Limited",
        "vacancy": "8",
        "time": "full-time",
        "address": "Kathmandu, Nepal",
        "deadline": "2020-11-10",
        "education": "Secondary Education Examination ( SEE)",
        "experience": "2-5 years",
        "level": "Intermediate",
        "salary": "Rs.40000- Rs.40000",
        "desct": "Inside Sales ExecutiveCodavatar Tech Private LimitedApplyExperience:2-5 yearsLevel:IntermediateTotal Positions:8Job Type:full-timeSalary:Rs.40000- Rs.40000Education:Secondary Education Examination ( SEE)Location:Kathmandu, NepalApply Before:2020-11-10Responsibilities:1. Performance inside sales (Remote selling model) for B2B Saas products (IT Products).2. Good communication skills. Good command on English language.3. Good presentation skills (Having skill to provide online demo)4. Having knowledge of various inside sales tool to generate lead.5. Having co-ordination skill to do co-ordination with the team members for decision making.6. Schedule online demonstration with customer.What is in store for you?1. An opportunity to define, lead and co-ordinate the entire sales of the product.2. Work in a fast-paced start up environmentReach usIf you think this role is aligned with your career, kindly write me an email along with your updated CV on[email\u00a0protected]for a confidential discussion on the role.Good communication skills. Good command on English language.Apply",
        "Page_URL": "https://kathmandujobs.com/jobs/25802/inside-sales-executive-job-in-kathmandu"
    },
    {
        "name": "Mid Level Python Developer",
        "company": "Codavatar Tech Private Limited",
        "vacancy": "3",
        "time": "full-time",
        "address": "Kathmandu, Nepal",
        "deadline": "2020-11-30",
        "education": "Secondary Education Examination ( SEE)",
        "experience": "2-5 years",
        "level": "Intermediate",
        "salary": "Negotiable",
        "desct": "Mid Level Python DeveloperCodavatar Tech Private LimitedApplyExperience:2-5 yearsLevel:IntermediateTotal Positions:3Job Type:full-timeSalary:NegotiableEducation:Secondary Education Examination ( SEE)Location:Kathmandu, NepalApply Before:2020-11-30\u00d8Knowledge of object-oriented programming\u00d8 Experience with Python Flask or Django\u00d8 Experience with MySQL/PostgreSQL\u00d8 Agile/Scrum experience and communication skills\u00d8 Basic understanding of HTML5, CSS and Javascript\u00d8 Familiarity with regular expressions\u00d8 Experience with writing Unit test cases\u00d8 Familiar with Pylint and PEP 8 Python development style guide????Additional experience will be plus\u2705\u00a0VueJS/React/Angular\u2705\u00a0AWS\u2705\u00a0Gitflow\u2705\u00a0Docker\u2705\u00a0Experience in third party API integrationsAgile/Scrum experience and communication skillsKnowledge of object-oriented programmingExperience with Python Flask or DjangoExperience with MySQL/PostgreSQLApply",
        "Page_URL": "https://kathmandujobs.com/jobs/25801/mid-level-python-developer-job-in-kathmandu"
    },
    {
        "name": "Senior Laravel & Vue/React Js Developer",
        "company": "Gamenic Nalamiz Tech",
        "vacancy": "3",
        "time": "full-time",
        "address": "Bhaktapur, Nepal",
        "deadline": "2020-11-10",
        "education": "Bachelor Degree",
        "experience": "1-2 years",
        "level": "Expert",
        "salary": "Rs.20000- Rs.200000",
        "desct": "Senior Laravel & Vue/React Js DeveloperGamenic Nalamiz TechApplyExperience:1-2 yearsLevel:ExpertTotal Positions:3Job Type:full-timeSalary:Rs.20000- Rs.200000Education:Bachelor DegreeLocation:Bhaktapur, NepalApply Before:2020-11-10We are a Japanese based IT Company and also have our branch in Bhaktapur called Gamenic Nalamiz Tech. We are looking for a PHP (Laravel/Vuejs) Developer responsible for managing back-end services and the interchange of data between the server and the users and to build new features and maintain our existing business systems. You would be working on PHP, Laravel, VueJs,HTML, and CSS.Requirements:\u2013 Sound knowledge in Php based frameworks like Laravel.\u2013 Experience with front end technology like VueJs, ReactJs, AngularJs, HTML5, CSS3.\u2013 Experience in Datastores like Mysql, Redis.Responsibilities:\u2013 Write clean, secure, test-driven, easily maintainable, and modular codes.\u2013 Database designing and maintenance.\u2013 Build reusable code and libraries for future use.\u2013 Troubleshoot and debug applications.\u2013 Perform UI/backend tests to optimize performance.\u2013 Collaborate and work with frontend and mobile app developers on the backend needs of projects.LaravelVuejsReact JsHTMLCSSApply",
        "Page_URL": "https://kathmandujobs.com/jobs/25800/senior-laravel-vuereact-js-developer-job-in-bhaktapur"
    },
    {
        "name": "Jr. iOS Developer",
        "company": "Ensue Nepal Pvt. Ltd",
        "vacancy": "1",
        "time": "full-time",
        "address": "Kathmandu, Nepal",
        "deadline": "2020-11-21",
        "education": "Secondary Education Examination ( SEE)",
        "experience": "0-1 years",
        "level": "Intermediate",
        "salary": "Rs.35000- Rs.55000",
        "desct": "Jr. iOS DeveloperEnsue Nepal Pvt. LtdApplyExperience:0-1 yearsLevel:IntermediateTotal Positions:1Job Type:full-timeSalary:Rs.35000- Rs.55000Education:Secondary Education Examination ( SEE)Location:Kathmandu, NepalApply Before:2020-11-21We are looking for an enthusiastic\u00a0 iOS developer who will be responsible for helping develop iOS applications. You will be helping develop applications and their integration with back-end services.Basic understanding of software design patterns and design patterns incorporated in iOS apps is required.RequirementsProficient with SwiftKnowledge of iOS frameworks such as Core Data, Core Animation, etc.Knowledge with offline storage, threading, and performance tuningFamiliarity with RESTful APIs to connect iOS applications to back-end servicesKnowledge of other web technologies and UI/UX standardsExperience with performance and memory tuning with tools such as InstrumentsFamiliarity with cloud message APIs and push notificationsFine knowledge of design principles and interface guidelinesGood understanding of GitTDDResponsibilitiesWriting scalable, robust, testable, efficient, and easily maintainable codeEnsure the performance, quality, and responsiveness of applicationsCollaborate with a team to define, design, and ship new featuresIdentify and correct bottlenecks and fix bugsiOSGitSwiftObjective - CApply",
        "Page_URL": "https://kathmandujobs.com/jobs/25799/jr-ios-developer-job-in-kathmandu"
    },
    {
        "name": "Sr. Android Developer",
        "company": "Ensue Nepal Pvt. Ltd",
        "vacancy": "1",
        "time": "full-time",
        "address": "Kathmandu, Nepal",
        "deadline": "2020-11-21",
        "education": "Secondary Education Examination ( SEE)",
        "experience": "2-5 years",
        "level": "Expert",
        "salary": "Rs.80000- Rs.120000",
        "desct": "Sr. Android DeveloperEnsue Nepal Pvt. LtdApplyExperience:2-5 yearsLevel:ExpertTotal Positions:1Job Type:full-timeSalary:Rs.80000- Rs.120000Education:Secondary Education Examination ( SEE)Location:Kathmandu, NepalApply Before:2020-11-21At Ensue, we believe in growing and learning together. We strive to be nimble problem-solvers and proud builder.We are looking for an experienced Android app developer, with a very good grasp of Java / Kotlin to join our exceptional team. In-depth hands-on knowledge of OOP and software design patterns with 2 years experience is a must. Along with that, the candidate should be well versed in software architecture and quality of code.RequirementAt least 2 years of experience in android app developmentStrong coding and analytical skillsVery good understanding of OOP, design patterns and SOLID principlesVery strong knowledge of android design principles and design guidelinesExperienced in multi-threading and performance tuningShould have knowledge of RESTful web servicesVery good understanding of android app life-cycleExperienced in SQL LiteStrong knowledge of MVC, MVVMKnowledge of unit testingFamiliarity with CI/CDKnowledge of firebase.Sound knowledge of GITHave published at least one App in PlaystoreSelf-motivated and a team playerAndroidRESTful APIGitApply",
        "Page_URL": "https://kathmandujobs.com/jobs/25798/sr-android-developer-job-in-kathmandu"
    },
    {
        "name": "Backend Developer in PHP",
        "company": "Ensue Nepal Pvt. Ltd",
        "vacancy": "2",
        "time": "full-time",
        "address": "Kathmandu, Nepal",
        "deadline": "2020-11-21",
        "education": "Bachelor Degree",
        "experience": "1-2 years",
        "level": "Intermediate",
        "salary": "Rs.40000- Rs.60000",
        "desct": "Backend Developer in PHPEnsue Nepal Pvt. LtdApplyExperience:1-2 yearsLevel:IntermediateTotal Positions:2Job Type:full-timeSalary:Rs.40000- Rs.60000Education:Bachelor DegreeLocation:Kathmandu, NepalApply Before:2020-11-21We are looking for an enthusiastic PHP developer. With a technical background, some years of experience and self-motivated mindset \u2013 you are our ideal candidate. You will be working on projects with a highly experienced team. Our clients and projects are primarily US based.Being a part of our fast-paced team you will experienceFast and Efficient learning and research methodsProject managementDifferent Development tools and methodologiesJob RequirementMust have experience of 1 year or more in the field of PHP based web developmentFamiliarity with PHP frameworks - preferably LaravelFamiliarity with Version control systemMust have good knowledge of OOPMust have good understanding of RESTful APIMust have knowledge of Software design patterns is preferred.Must have good communication skillsMust be self motivatedHTMLCSSMySQLPHPLaravelApply",
        "Page_URL": "https://kathmandujobs.com/jobs/25797/backend-developer-in-php-job-in-kathmandu"
    },
    {
        "name": "Mid Level Frontend Web Developer",
        "company": "Ensue Nepal Pvt. Ltd",
        "vacancy": "1",
        "time": "full-time",
        "address": "Kathmandu, Nepal",
        "deadline": "2020-11-21",
        "education": "Bachelor Degree",
        "experience": "1-2 years",
        "level": "Intermediate",
        "salary": "Rs.30000- Rs.60000",
        "desct": "Mid Level Frontend Web DeveloperEnsue Nepal Pvt. LtdApplyExperience:1-2 yearsLevel:IntermediateTotal Positions:1Job Type:full-timeSalary:Rs.30000- Rs.60000Education:Bachelor DegreeLocation:Kathmandu, NepalApply Before:2020-11-21Job DescriptionAt Ensue we believe in growing and learning together. We strive to be nimble problem solvers and proud builders.We are looking for an experienced Front-end developer, with very good grasp of javascript, to join our exceptional team. In depth hands on knowledge of OOP in javascript and software design patterns with 2+ years experience is a must. Along with that, candidate should be well versed in software architecture, software design patterns and quality of code.Job RequirementsMust have 1 years of web development experienceStrong experience in developing rich client functionality with good knowledge of JavascriptExperience in at least one of the javascript frameworks: Angular/AngularJS and ReactJSExperience with RESTful APIs to connect with backend web servicesExcellent HTML, CSS and cross-browser layout skills and knowledgePassion for developing, releasing and maintaining a large-scale web applicationExperienced with version control tool such as GitlabAble to give keen attention to detail and ability to build scalable and flexible softwareComfortable working with a teamGood ability to solve a problemConfidence in learning new languages and platformResponsibilitiesHands on development and testingProduction supportCreate flexible, reusable and pluggable software components.Identify new technologies that improve product development and end user experience.JavascriptAngular or any other javascript framework/libraryApply",
        "Page_URL": "https://kathmandujobs.com/jobs/25796/mid-level-frontend-web-developer-job-in-kathmandu"
    },
    {
        "name": "Senior Graphic Designer",
        "company": "Swivt Technologies",
        "vacancy": "1",
        "time": "full-time",
        "address": "Kathmandu, Nepal",
        "deadline": "2020-11-30",
        "education": "Higher Secondary Level (+2)",
        "experience": "2-5 years",
        "level": "Expert",
        "salary": "Rs.30000- Rs.700000",
        "desct": "Senior Graphic DesignerSwivt TechnologiesApplyExperience:2-5 yearsLevel:ExpertTotal Positions:1Job Type:full-timeSalary:Rs.30000- Rs.700000Education:Higher Secondary Level (+2)Location:Kathmandu, NepalApply Before:2020-11-30As a Senior Designer at Swivt Technologies, you are required to have an educated design sense, creative flair, keen interest and ability to deliver effective design solutions that are aligned with the creative vision. You are expected to have passion for conceptualising creative solutions, and an in-depth understanding of market tools, trends and touch-points. You will also initiate and facilitate the growth of your juniors and assist them in creating design solutions that are rationalised and justified. You will take responsibility in assisting in the development big ideas for projects. You should be capable in shaping visual aspects of online and offline media, as well as the ability to execute deliverables that adhere to a concept that solves a creative problem for the client that is on brand.Job responsibilities.Heavily involved in design projects from concept to completion, applying design principles and techniquesPitch and execute creative ideas that solves creative problemsProducing establish sketches, mockups, decks and engaging design solutionsReceive and provide feedback from and to team members to hone skills and improve designResponsible for creating design solutions that have a high visual impactUnderstand briefs and client\u2019s requirements and offer solutions to creative problemsTranslate requirements into highly engaging and attractive design conceptsEffectively conceptualise, design and create high quality visuals in a variety of formatsUse various techniques to create design solutionsDevelop and maintain cohesive work relationship with key stakeholdersAble to work independently respecting multiple deadlinesPaying close attention to detail and grasp project needs and assist in translating that with the teamQualifications.4 - 5 years of relevant work experience in creative or marketing agencies or similar relevant experiences from similar fieldsBachelor degree in graphic design, visual communication, web design, or related fields of study.Well established knowledge in visual design principles, information design, typography, colour theory, imagery, iconography and layout design.High Proficiency with Adobe Creative Suite programs, specifically Illustrator, Photoshop and InDesign, additional skills in other programs are appreciated.Design portfolio that\u2019s innovative, reflects current design trends and showcases design solutions that demonstrate an in-depth understanding of different markets.Salary and benefits will commensurate with qualifications and experiences.Candidates with less experiences will be considered as DesignerIf you wish to apply for this position, please attach your r\u00e9sum\u00e9, portfolio and expected salary to[email\u00a0protected]PhotoshopXDSketchApply",
        "Page_URL": "https://kathmandujobs.com/jobs/25795/senior-graphic-designer-job-in-kathmandu"
    },
    {
        "name": "App Developer",
        "company": "Medic Mobile",
        "vacancy": "1",
        "time": "full-time",
        "address": "Kathmandu, Nepal",
        "deadline": "2020-10-31",
        "education": "Bachelor Degree",
        "experience": "2-5 years",
        "level": "Intermediate",
        "salary": "Negotiable",
        "desct": "App DeveloperMedic MobileApplyExperience:2-5 yearsLevel:IntermediateTotal Positions:1Job Type:full-timeSalary:NegotiableEducation:Bachelor DegreeLocation:Kathmandu, NepalApply Before:2020-10-31About Medic MobileMedic Mobile is a 501(c)(3) nonprofit organization founded in 2010 to advance health and human flourishing with and for the hardest-to-reach communities. We envision a more just world in which health workers are supported as they provide care for their neighbors, universal health coverage is a reality, and health is a secured human right. Practically, we have advanced our mission by building, implementing, and supporting open-source digital tools that support Community Health Workers, managers, and facility-based health workers. Along with our partners, we build and apply software that helps health workers deliver high-quality, equitable care in redesigned health systems. Our team and partners support more than 28,000 frontline health workers caring for an estimated 15 million people in 18 countries across Africa and Asia.Each member of our team was drawn to this mission and emboldened by a vision of global health equity. Our diversity of skills and experiences helps us tackle complex challenges \u2013 we look forward to hearing from you and exploring ways to work together.We are searching for an App Developer to contribute to our team, mission, and impact. This is a unique opportunity to bring together your passion for global health and technology, and working at the grassroots level. As\u00a0 App Developer, you will manage project app development. We believe that the technologies, work environments, and approaches to global health and development you've experienced in the past, and have mastered in-depth will be useful to further build Medic\u2019s tools and technology. We expect that you are a quick learner and equally quick to adapt to new and changing technologies. You will work closely with design and project teams.Key ResponsibilitiesManage project technical development/configurations: Work alongside partnerships leads, project managers, and designers to define scope, design, write technical specifications, and build public health applicationsDevelop internal and partner-facing interactive data visualizations. Work with designers and project managers to ensure that dashboard designs are feasible within the Medic Mobile Analytics platformContribute to and maintain a growing codebase of JavaScript, JSON configuration, technical documentation, and interactive data visualizations.Conduct functional and unit testing on all developed code and scripts in line with testing frameworks to ensure conformance with defined requirements.Manage client timelines, monitor usage of the platform, and any relevant software costs for invoicing purposes to foster strong relationships with partners.Support end-users and stakeholders (internal and external) on any arising technology issues/bugs to resolve, escalate and resolve.Describe digital health needs and opportunities in your projects/region and propel these needs to be addressed in Medic Mobile\u2019s current tool kit or product roadmapSupport in proposal writing, publications, present Medic Mobile in meetings, seminars, summits & forums when called upon to do so.Skills Knowledge & ExpertiseBachelor's degree in Computer Science or equivalent.3+ years of progressive experience in similar roles with demonstrated technical leadership.Strong command of written and spoken English.Proficient in Javascript or other programming languages.Proficient with relational databases, Postgres or MySQLExperience with data analysis and data visualization languages R/Matlab/Python would be of benefitHave experience using command-line tools on Linux (preferred) or another UNIX-like operating system.Be committed to frequent and timely communication, both in-person and online (via email, Slack, and other online chat applications).Have an interest in working with and learning from a globally distributed team of mHealth technology experts.Have good communication and interpersonal skills with the ability to pass on information clearly to users and to grasp difficulties perceived by users.Strong user support orientation with an attitude of wanting to assist people and pass-on their knowledge and experience to others establishing a good working relationship with users/partners.Ability to work under high pressure, meet deadlines, monitor, and follow-up on pending matters under minimum supervision.Additional SkillsBe familiar with Android SDK, NoSQL databases.Project work experience with open source technology.Good logical diagnostic skills and ability to exercise good judgment in the resolution of problems.Fluency in other languages would be nice to have e.g French, Swahili.APPLY NOWExperience with data analysis and data visualization languages R/Matlab/Python would be of benefitApply",
        "Page_URL": "https://kathmandujobs.com/jobs/25794/app-developer-job-in-kathmandu"
    },
    {
        "name": "Software Engineer, Ruby on Rails, ReactJS",
        "company": "Truemark Technology",
        "vacancy": "1",
        "time": "full-time",
        "address": "Kathmandu, Nepal",
        "deadline": "2020-11-20",
        "education": "Bachelor Degree",
        "experience": "1-2 years",
        "level": "Intermediate",
        "salary": "Negotiable",
        "desct": "Software Engineer, Ruby on Rails, ReactJSTruemark TechnologyApplyExperience:1-2 yearsLevel:IntermediateTotal Positions:1Job Type:full-timeSalary:NegotiableEducation:Bachelor DegreeLocation:Kathmandu, NepalApply Before:2020-11-20Job DescriptionAnalysis, design, development, deployment, and maintenance of projects with minimal supervision.Write modular, reusable, and top quality code, code reviews, and implementation of best practices.Create and maintain technical documentation. Share knowledge within the team andactively participate in the code review process.Involve in Continuous research and learning; discover, evaluate, and implement new technologies to maximize development efficiency.SkillsGraduate in Computer Engineering or similar IT background or equivalent practical experience.At least 1.5 year of professional experience in Software development.Demonstrable experience with Ruby, Ruby on Rails, Reactjs.Experienced with databases like MySQL, PostgreSQL, and ORM (Object Relational Mapper) libraries.Knowledge of AWS ecosystem or similar cloud-based provider developing scalable websites/services.Hands-on experience in developing, releasing, and maintaining software applications.RenumerationSalary based on skills and qualificationsAnnual leave and sick leave as per labor lawsYou can also drop your cv at:[email\u00a0protected]reactjsruby on railsApply",
        "Page_URL": "https://kathmandujobs.com/jobs/25793/software-engineer-ruby-on-rails-reactjs-job-in-kathmandu"
    },
    {
        "name": "Mobile App developer",
        "company": "Claudemill Technology Pvt. Ltd.",
        "vacancy": "1",
        "time": "full-time",
        "address": "Bhaktapur, Nepal",
        "deadline": "2020-11-30",
        "education": "Bachelor Degree",
        "experience": "1-2 years",
        "level": "Intermediate",
        "salary": "Negotiable",
        "desct": "Mobile App developerClaudemill Technology Pvt. Ltd.ApplyExperience:1-2 yearsLevel:IntermediateTotal Positions:1Job Type:full-timeSalary:NegotiableEducation:Bachelor DegreeLocation:Bhaktapur, NepalApply Before:2020-11-30Experience using version control systems like GitIn lieu of formal tertiary qualifications, relevant work experience and formal training will be considered.2+ years mobile development experience utilizing a range of modern technologiesExperience working in a software development teamExperience building, testing and deploying mobile applications in both iOS and Android ( Flutter or React Native is Preferred)Comfortable working with ES6 JS Libraries (Vue.js / React.js)Confident\u00a0with modern Javascript build tools, eg Node & Webpack, reactProficiency and accuracy in scoping development timelinesExperience designing creative and unique mobile app flowsExperience in working with multi disciplinary, agile teamExperience using design patternsReact Native/FlutterFirebaseAPIsAgile MethodologyDesign PatternApply",
        "Page_URL": "https://kathmandujobs.com/jobs/25792/mobile-app-developer-job-in-bhaktapur"
    },
    {
        "name": "Mid-level PHP Software Engineer",
        "company": "Claudemill Technology Pvt. Ltd.",
        "vacancy": "1",
        "time": "full-time",
        "address": "Bhaktapur, Nepal",
        "deadline": "2020-11-30",
        "education": "Bachelor Degree",
        "experience": "1-2 years",
        "level": "Intermediate",
        "salary": "Negotiable",
        "desct": "Mid-level PHP Software EngineerClaudemill Technology Pvt. Ltd.ApplyExperience:1-2 yearsLevel:IntermediateTotal Positions:1Job Type:full-timeSalary:NegotiableEducation:Bachelor DegreeLocation:Bhaktapur, NepalApply Before:2020-11-30An IT (computer programming) related degree and minimum 2 years digital agency experienceAdvanced knowledge of WordPress / WooCommerce / CMS (knowledge of hooks & custom WP dev)Advanced knowledge in JavaScript and related frameworksAdvanced knowledge of databases and SQLUnderstanding of PHP frameworks such as LaravelStrong understanding of HTML / CSS / JavaScriptStrong understanding of computer programming principles / git and version controlGood understanding of database design and SQLGood understanding of Sketch / Adobe Creative SuiteA genuine passion for web development (provide links to side projects if any)Good communication skills (a willingness to speak to clients a bonus)Familier with API for Mobile appsPHPReactNodeLaravel FrameworkWordpressCMSAPIAgile MethodologyVersion ControlApply",
        "Page_URL": "https://kathmandujobs.com/jobs/25791/midlevel-php-software-engineer-job-in-bhaktapur"
    },
    {
        "name": "Frontend Developer",
        "company": "Empathy IT Club",
        "vacancy": "1",
        "time": "full-time",
        "address": "Kathmandu, Nepal",
        "deadline": "2020-10-20",
        "education": "Bachelor Degree",
        "experience": "2-5 years",
        "level": "Expert",
        "salary": "Rs.70000- Rs.100000",
        "desct": "Frontend DeveloperEmpathy IT ClubApplyExperience:2-5 yearsLevel:ExpertTotal Positions:1Job Type:full-timeSalary:Rs.70000- Rs.100000Education:Bachelor DegreeLocation:Kathmandu, NepalApply Before:2020-10-20We are looking for programmers with a keen eye for design for the position of Front End Developer. Front end Developers are responsible for ensuring the alignment of web design and user experience requirements, optimizing web pages for maximum efficiency and maintaining brand consistency across all web pages, among other duties.Front End Developers are required to work in teams alongside Back end Developers, Graphic Designers and User Experience Designers to ensure all elements of web creation are consistent. This requires excellent communication and interpersonal skills.HtmlCssJavaScript and able to work in any Frontend FrameworkApply",
        "Page_URL": "https://kathmandujobs.com/jobs/25790/frontend-developer-job-in-kathmandu"
    },
    {
        "name": "Software QA Engineer",
        "company": "Swivt Technologies",
        "vacancy": "1",
        "time": "full-time",
        "address": "Kathmandu, Nepal",
        "deadline": "2020-10-31",
        "education": "Bachelor Degree",
        "experience": "2-5 years",
        "level": "Expert",
        "salary": "Rs.35000- Rs.70000",
        "desct": "Software QA EngineerSwivt TechnologiesApplyExperience:2-5 yearsLevel:ExpertTotal Positions:1Job Type:full-timeSalary:Rs.35000- Rs.70000Education:Bachelor DegreeLocation:Kathmandu, NepalApply Before:2020-10-31Requirements:\u2013 Lead the test strategy and test process of all testing activities across the platforms.\u2013 Lead the test project management and manage the test environment, test process, and test team resources.\u2013 Develop and build test strategies for testing and system assurance under an Agile and Scrum environment.\u2013 Manager Agile sprints and support rapid iteration and development through Test-Driven Development / Behaviour-Driven Development.\u2013 Manage and oversight the test plans, test scripts, test reports. Translate user expectations\u2013 Lead the testing function in the development division and drive testing governance plan for best practices.\u2013 Manage the testing resources, ensure the test quality and output is fulfill the overall requirements.Responsibilities:\u2013 Strong leadership experience in leading a sizeable testing function.\u2013 Senior management experience in leading teams and building relationships with senior management.\u2013 Experience with Agile, Scrum and/or Lean principles and practices.\u2013 Experience in Test Driven Development (TDD), and Behavior Driven Development (BDD) is a great plus.\u2013 Experience with at least one hybrid automation modern test framework.\u2013 Experience with ALM tools like JIRA, HP-ALM, MS-TFS, and test automation\u2013 Experience in testing tools including Cucumber and JBehave is a great plus.\u2013 Strong knowledge of the Software Development Life Cycle with expertise in QA processes and methodology, specifically in Agile.\u2013 Experience with various test methods, tools, and toolkits: Functional, Automated, Performance\u2013 Strong working experience in a DevOps / CICD environment.\u2013 Excellent communication skills in English.\u2013 Bachelor degree from a reputed UniversityZestGit version ControlDevOpsReact.JsNode.jSApply",
        "Page_URL": "https://kathmandujobs.com/jobs/25789/software-qa-engineer-job-in-kathmandu"
    },
    {
        "name": "SEO Expert",
        "company": "Swivt Technologies",
        "vacancy": "1",
        "time": "full-time",
        "address": "Kathmandu, Nepal",
        "deadline": "2020-10-31",
        "education": "Secondary Education Examination ( SEE)",
        "experience": "2-5 years",
        "level": "Expert",
        "salary": "Rs.35000- Rs.70000",
        "desct": "SEO ExpertSwivt TechnologiesApplyExperience:2-5 yearsLevel:ExpertTotal Positions:1Job Type:full-timeSalary:Rs.35000- Rs.70000Education:Secondary Education Examination ( SEE)Location:Kathmandu, NepalApply Before:2020-10-31Responsibilities:Work with a team of digital marketing experts covering 8 countries to support the SEO growth opportunities to support growing organic traffic across search enginesHelp set up the roadmap for SEO best practices to maximise search engine optimisationDevelop insights through performance analysis and make recommendations to guide decision makingConduct a site audit and follow up on-site issues with the technical data teamsPartner with product and data team and own the delivery of SEO product and technical prioritiesDevelop strategic and exclusive partnerships to broaden online audience reachRequirements:5+ years of experience in online marketing / SEO within a B2C environmentTrack record of exceeding aggressive growth targets and leading SEO projectsExpert in Google Analytics, SEMRush, keyword research, performance optimisation, Tag, and familiar with leading SEO toolsFluent in English writing and verbal.Must be a data-driven and detail-oriented with problem-solving skillsStrong team player with excellent organisation and time management abilityLoves using and analysing data to perform high quality resultsGoogle AnalyticsBling Webmasterbacklinksmeta TagsApply",
        "Page_URL": "https://kathmandujobs.com/jobs/25788/seo-expert-job-in-kathmandu"
    },
    {
        "name": "Social Media Manager",
        "company": "leckr",
        "vacancy": "1",
        "time": "full-time",
        "address": "Kathmandu, Nepal",
        "deadline": "2021-01-01",
        "education": "Secondary Education Examination ( SEE)",
        "experience": "0-1 years",
        "level": "Beginner",
        "salary": "Rs.10000- Rs.35000",
        "desct": "Social Media ManagerleckrApplyExperience:0-1 yearsLevel:BeginnerTotal Positions:1Job Type:full-timeSalary:Rs.10000- Rs.35000Education:Secondary Education Examination ( SEE)Location:Kathmandu, NepalApply Before:2021-01-01Hi,I have a couple of Instagram accounts that I'd like to grow.@eatcodekiterepeat@techtribe_ecovillage@kitelightretreats@himalayapreneurs@backpacking_tribeI'd like to generate as many followers as possible in order to generate traffic to my website. I'd like to find someone that understands the niche and knows who to target.When applying, let me know what you think about each account and what your growth strategy would be.instagramFacebookApply",
        "Page_URL": "https://kathmandujobs.com/jobs/25786/social-media-manager-job-in-kathmandu"
    },
    {
        "name": "React Developer",
        "company": "TechDurbar",
        "vacancy": "1",
        "time": "full-time",
        "address": "Kathmandu, Nepal",
        "deadline": "2020-11-09",
        "education": "Others",
        "experience": "1-2 years",
        "level": "Intermediate",
        "salary": "Negotiable",
        "desct": "React DeveloperTechDurbarApplyExperience:1-2 yearsLevel:IntermediateTotal Positions:1Job Type:full-timeSalary:NegotiableEducation:OthersLocation:Kathmandu, NepalApply Before:2020-11-09Required Qualifications, Skills, and Knowledge:Thorough understanding of React.js and its core principlesExperience in user interface development including HTML, CSS, Javascript.Experience in Asynchronous programming.Understanding of functional components and hooks.Knowledge in GraphQL is a big plus.Proficient understanding of code versioning tools, such as Git.Working Conditions:Work from home.Working hours are Monday through Friday from 09:00 am \u2013 06:00 pm and Saturday and Sunday off. Additional time may be required to complete the above work or meet company objectives.React DeveloperApply",
        "Page_URL": "https://kathmandujobs.com/jobs/25785/react-developer-job-in-kathmandu"
    },
    {
        "name": "Mid Level Laravel & Vue/React Js Developer",
        "company": "Gamenic Nalamiz Tech",
        "vacancy": "4",
        "time": "full-time",
        "address": "Bhaktapur, Nepal",
        "deadline": "2020-10-23",
        "education": "Bachelor Degree",
        "experience": "0-1 years",
        "level": "Intermediate",
        "salary": "Rs.15000- Rs.100000",
        "desct": "Mid Level Laravel & Vue/React Js DeveloperGamenic Nalamiz TechApplyExperience:0-1 yearsLevel:IntermediateTotal Positions:4Job Type:full-timeSalary:Rs.15000- Rs.100000Education:Bachelor DegreeLocation:Bhaktapur, NepalApply Before:2020-10-23We are a Japanese based IT Company and also have our branch in Bhaktapur called Gamenic Nalamiz Tech. We are looking for a PHP (Laravel/Vuejs) Developer responsible for managing back-end services and the interchange of data between the server and the users and to build new features and maintain our existing business systems. You would be working on PHP, Laravel, VueJs,HTML, and CSS.Requirements:\u2013 Sound knowledge in Php based frameworks like Laravel.\u2013 Experience with front end technology like VueJs, ReactJs, AngularJs, HTML5, CSS3.\u2013 Experience in Datastores like Mysql, Redis.Responsibilities:\u2013 Write clean, secure, test-driven, easily maintainable, and modular codes.\u2013 Database designing and maintenance.\u2013 Build reusable code and libraries for future use.\u2013 Troubleshoot and debug applications.\u2013 Perform UI/backend tests to optimize performance.\u2013 Collaborate and work with frontend and mobile app developers on the backend needs of projects.LaravelVuejsReactjsHTMLCSSApply",
        "Page_URL": "https://kathmandujobs.com/jobs/25784/mid-level-laravel-vuereact-js-developer-job-in-bhaktapur"
    },
    {
        "name": "Digital Marketing Manager",
        "company": "Studydote Pvt. Ltd.",
        "vacancy": "1",
        "time": "full-time",
        "address": "Lalitpur, Nepal",
        "deadline": "2020-10-17",
        "education": "Higher Secondary Level (+2)",
        "experience": "1-2 years",
        "level": "Intermediate",
        "salary": "Negotiable",
        "desct": "Digital Marketing ManagerStudydote Pvt. Ltd.ApplyExperience:1-2 yearsLevel:IntermediateTotal Positions:1Job Type:full-timeSalary:NegotiableEducation:Higher Secondary Level (+2)Location:Lalitpur, NepalApply Before:2020-10-17Job Requirements:- Need to handle social medias, Facebook/Instagram posts & messages.- Experience with boosting ads is a plus.- Experience in graphics design.- Experience in editing videos for social media marketing.- Knowledge of Ms Office suites, Google docs.Digital MarketingGraphics DesignSocial MediaApply",
        "Page_URL": "https://kathmandujobs.com/jobs/25782/digital-marketing-manager-job-in-lalitpur"
    },
    {
        "name": "Mid Level Flutter Developer",
        "company": "ZenLab Pvt. Ltd.",
        "vacancy": "1",
        "time": "full-time",
        "address": "Kathmandu, Nepal",
        "deadline": "2020-10-06",
        "education": "Bachelor Degree",
        "experience": "1-2 years",
        "level": "Intermediate",
        "salary": "Rs.20000- Rs.30000",
        "desct": "Mid Level Flutter DeveloperZenLab Pvt. Ltd.ApplyExperience:1-2 yearsLevel:IntermediateTotal Positions:1Job Type:full-timeSalary:Rs.20000- Rs.30000Education:Bachelor DegreeLocation:Kathmandu, NepalApply Before:2020-10-06Good knowledge of Dart.Knowledge of native mobile application development.Knowledge of Version Control Tools.Knowledge of PMT.Great communication skills.Problem solving approach.Team player and capacity to work under pressure.DartFlutterMobile Application DevelopmentApply",
        "Page_URL": "https://kathmandujobs.com/jobs/25781/mid-level-flutter-developer-job-in-kathmandu"
    },
    {
        "name": "Backend Developer (NodeJS/Typescript)",
        "company": "Tekkon Technologies Pvt Ltd",
        "vacancy": "1",
        "time": "full-time",
        "address": "Kathmandu, Nepal",
        "deadline": "2020-10-19",
        "education": "Bachelor Degree",
        "experience": "2-5 years",
        "level": "Intermediate",
        "salary": "Negotiable",
        "desct": "Backend Developer (NodeJS/Typescript)Tekkon Technologies Pvt LtdApplyExperience:2-5 yearsLevel:IntermediateTotal Positions:1Job Type:full-timeSalary:NegotiableEducation:Bachelor DegreeLocation:Kathmandu, NepalApply Before:2020-10-19Are you an aspiring Backend developer looking for an opportunity to work in a great team and advance your skills and career? If you are an analytical problem solver with strong NodeJs, TypeScript, and GraphQL knowledge, having a passion for development and innovation, we have the perfect job for you!We are looking for a Backend Developer to join our fun, enthusiastic, dedicated, and energetic team who are running at full speed addressing the different business needs of international clients with technical solutions.Responsibilities:Creating and maintaining server-side application logic.Collaborate with front-end developers on combining their front-end elements and components with the server-side.Write high quality, readable, and testable code.Design and optimize applications for high performance, high availability, and low latency.Technical Qualifications:Have a strong understanding of Javascript and TypeScript.Good understanding of Node.js and the most common packages in the ecosystem (i.e. Express).Familiarity with GraphQL.Confident with asynchronous programming concepts and using them programmatically from Javascript.Working knowledge of node.js package management and the tools ecosystem (like npm, grunt).Ability to model and apply authorization and permission control between users, systems, and services.Knowledge of incorporating different data sources and databases and to deliver the optimal output to different client platforms (mobile vs web)Familiarity with creating scalable Node.js applications with microservices.Proficiency with relational databases and pragmatically modeling business processes through schema.Understanding of automated unit tests and testing platforms and how to implement and integrate them.Knowledge around Docker is a plus.Thorough knowledge of code versioning tools such as Git.Company Benefits:A friendly, competitive, and creative working environment with foreign managersCompetitive salary (No bar for deserving candidates)5 working days in a week(9 am \u2013 5:30 pm)Timely salary review and performance bonus facilitiesAccess to the paid learning materials (udemy)Working with the latest technologiesLunch provided in the office (Currently Work From Home)Paid leave, sick leaveRefreshment, Recreational, team building activities.JavaScriptTypeScriptNodeJSApply",
        "Page_URL": "https://kathmandujobs.com/jobs/25780/backend-developer-nodejstypescript-job-in-kathmandu"
    },
    {
        "name": "Laravel/Vuejs Developer",
        "company": "Gamenic Nalamiz Tech",
        "vacancy": "2",
        "time": "full-time",
        "address": "Kathmandu, Nepal",
        "deadline": "2020-10-20",
        "education": "Bachelor Degree",
        "experience": "0-1 years",
        "level": "Intermediate",
        "salary": "Rs.15000- Rs.100000",
        "desct": "Laravel/Vuejs DeveloperGamenic Nalamiz TechApplyExperience:0-1 yearsLevel:IntermediateTotal Positions:2Job Type:full-timeSalary:Rs.15000- Rs.100000Education:Bachelor DegreeLocation:Kathmandu, NepalApply Before:2020-10-20We are a Japanese based IT Company and also have our branch in Bhaktapur called Gamenic Nalamiz Tech . We are looking for a PHP (Laravel/Vuejs) Developer responsible for managing back-end services and the interchange of data between the server and the users and to build new features and maintain our existing business systems. You would be working on PHP, Laravel, VueJs,HTML and CSS.Requirements:\u2013 Sound knowledge in Php based frameworks like Laravel.\u2013 Experience with front end technology like VueJs, ReactJs, AngularJs, HTML5, CSS3.\u2013 Experience in Datastores like Mysql, Redis.Responsibilities:\u2013 Write clean, secure, test-driven, easily maintainable, and modular codes.\u2013 Database designing and maintenance.\u2013 Build reusable code and libraries for future use.\u2013 Troubleshoot and debug applications.\u2013 Perform UI/backend tests to optimize performance.\u2013 Collaborate and work with frontend and mobile app developers on the backend needs of projects.HTMLCSSLaravelVuejsWeb DevelopmentReactApply",
        "Page_URL": "https://kathmandujobs.com/jobs/25779/laravelvuejs-developer-job-in-kathmandu"
    },
    {
        "name": "Implementation engineer",
        "company": "e-digital Nepal Pvt. Ltd.",
        "vacancy": "1",
        "time": "full-time",
        "address": "Kathmandu, Nepal",
        "deadline": "2020-10-27",
        "education": "Bachelor Degree",
        "experience": "1-2 years",
        "level": "Intermediate",
        "salary": "Negotiable",
        "desct": "Implementation engineere-digital Nepal Pvt. Ltd.ApplyExperience:1-2 yearsLevel:IntermediateTotal Positions:1Job Type:full-timeSalary:NegotiableEducation:Bachelor DegreeLocation:Kathmandu, NepalApply Before:2020-10-27Key Duties and ResponsibilitiesConducting various experiments on the methods and procedures of implementation and design using the assistance of experimental instances, samples, and models and formulating and arranging written papers for the sameCollaborating with the administrator of the company in order to settle all the matters and solve all issues within the given timeInteracting with the administration of the company in order to report it with the delays in executing enforcement undertakings and operationsWorking with the enhancement and quality advancement unit of the company in order to develop and create new plans and strategies to be included in the customer enforcement tasksAdministrating interactions with his/her section in order to solve disputes among other associates working with him/herAiding the company associate or executive who is responsible for studying and examining the enforcement operations executed in the company, in handling and administrating information with respect to the manufacture and yield of the sameExecuting investigative operations on customer matters of the company and writing the results based on his/her findingsPutting specialized operations of the company into effect with the assistance of meta-information documented records that contain the details of the sameFormulating and upholding specialized and trade documented records and working with the customers and the information technology section of the company in order to give back-up to the systems and undertakings that are lagging behind or contain flaws and drawbacksSpecifying and forming a base of specialized task needs and upholding efficient and functional bonds with the customersArranging substances for their application in various task undertakings in the company and administrating their distribution in the sameHelping the customers to observe computer software package programming enforcement rotational series and helping in creating proper and functionally effective plans and programs for the software systems of the customersInstructing customer specialized working associates on various kinds of software and hardware matters that interfere with the routine functioning of the executives in the companyRecognizing problematic matters and errors in the already run or executed methods and procedures of the company and developing settlements for the sameEnsuring that the plans and programs designed for enhancing the company are enforced with compliance with the rules, standard regulations, and policies of the sameDeveloping, enhancing, preparing, and backing up the specialized and scientific side of the company to benefit itTalking to customers and helping them with upholding their systems, inductions, and other connectionsCompleting all other responsibilities, roles, tasks, duties, and jobs of an implementation engineer that require his/her willingness and supervisionRecognizing problematic matters and errors in the already run or executed methodsApply",
        "Page_URL": "https://kathmandujobs.com/jobs/25776/implementation-engineer-job-in-kathmandu"
    },
    {
        "name": "Quality Assurance Engineer",
        "company": "e-digital Nepal Pvt. Ltd.",
        "vacancy": "1",
        "time": "full-time",
        "address": "Kathmandu, Nepal",
        "deadline": "2020-10-27",
        "education": "Bachelor Degree",
        "experience": "1-2 years",
        "level": "Intermediate",
        "salary": "Negotiable",
        "desct": "Quality Assurance Engineere-digital Nepal Pvt. Ltd.ApplyExperience:1-2 yearsLevel:IntermediateTotal Positions:1Job Type:full-timeSalary:NegotiableEducation:Bachelor DegreeLocation:Kathmandu, NepalApply Before:2020-10-27ResponsibilitiesReview requirements, specifications, and technical design documents to provide timely and meaningful feedbackCreate detailed, comprehensive, and well-structured test plans and test casesEstimate, prioritize, plan and coordinate testing activitiesDesign, develop and execute automation scripts using open source toolsIdentify, record, document thoroughly, and track bugsPerform thorough regression testing when bugs are resolvedDevelop and apply testing processes for new and existing products to meet client needsLiaise with internal teams (e.g. developers and product managers) to identify system requirementsMonitor debugging process resultsInvestigate the causes of non-conforming software and train users to implement solutionsTrack quality assurance metrics, like defect densities and open defect countsStay up-to-date with new testing tools and test strategiesRequirementsProven work\u00a0experience in software developmentProven work\u00a0experience in software quality assuranceStrong knowledge of software QA methodologies, tools, and processesExperience in writing clear, concise, and comprehensive test plans and test casesHands-on experience with both white box and black box testingHands-on experience with automated testing toolsSolid knowledge of SQL and scriptingExperience working in an Agile/Scrum development processExperience with performance and/or security testing is a plusBS/MS degree in Computer Science, Engineering or a related subjectSQL and scriptingAgile/Scrum development processsoftware QA methodologiesApply",
        "Page_URL": "https://kathmandujobs.com/jobs/25775/quality-assurance-engineer-job-in-kathmandu"
    },
    {
        "name": "Laravel Developer",
        "company": "Cyclone Nepal Info Tech",
        "vacancy": "2",
        "time": "full-time",
        "address": "Kathmandu, Nepal",
        "deadline": "2020-10-27",
        "education": "Bachelor Degree",
        "experience": "1-2 years",
        "level": "Intermediate",
        "salary": "Negotiable",
        "desct": "Laravel DeveloperCyclone Nepal Info TechApplyExperience:1-2 yearsLevel:IntermediateTotal Positions:2Job Type:full-timeSalary:NegotiableEducation:Bachelor DegreeLocation:Kathmandu, NepalApply Before:2020-10-27Candidates are required to fill-up the google doc form linked below:https://bit.ly/cnlaravel\u2022 Analysis, design, development, deployment and maintenance of projects independently\u2022 Improve and maintain scalability, performance, reliability and security of the application\u2022 Mentor and share knowledge within the team and help in the continuous growth of junior team members\u2022 Involve in ensuring implementation of organizational culture, process, and standards in the team\u2022 Communicate with the client and team in an effective manner\u2022 Keep up with trends in the constantly evolving technology\u2022 Quality Human Resources in the field of IT world wideFull Stack Laravel DeveloperAbility to createintegrate and handle APIsReviews and evaluates existing systemsMust be able to transform presented requirements into codes.Apply",
        "Page_URL": "https://kathmandujobs.com/jobs/25774/laravel-developer-job-in-kathmandu"
    },
    {
        "name": "Senior Frontend Designer",
        "company": "Swivt Technologies",
        "vacancy": "1",
        "time": "full-time",
        "address": "Kathmandu, Nepal",
        "deadline": "2020-10-30",
        "education": "Bachelor Degree",
        "experience": "2-5 years",
        "level": "Expert",
        "salary": "Rs.25000- Rs.50000",
        "desct": "Senior Frontend DesignerSwivt TechnologiesApplyExperience:2-5 yearsLevel:ExpertTotal Positions:1Job Type:full-timeSalary:Rs.25000- Rs.50000Education:Bachelor DegreeLocation:Kathmandu, NepalApply Before:2020-10-30Build the front-end of applications through appealing visual design for website and webappDevelop and manage well-functioning databases and applicationsDesign and develop APIsTest software to ensure responsiveness and efficiencyTroubleshoot, debug and upgrade softwareBuild features and applications with a mobile responsive designWrite technical documentationWork with data scientists and analysts to improve softwareHTML 5CSSSAASJavaScriptReact JsNode JsApply",
        "Page_URL": "https://kathmandujobs.com/jobs/25773/senior-frontend-designer-job-in-kathmandu"
    },
    {
        "name": "Senior Flutter Developer ( Android )",
        "company": "Swivt Technologies",
        "vacancy": "1",
        "time": "full-time",
        "address": "Kathmandu, Nepal",
        "deadline": "2020-10-30",
        "education": "Bachelor Degree",
        "experience": "2-5 years",
        "level": "Expert",
        "salary": "Rs.25000- Rs.70000",
        "desct": "Senior Flutter Developer ( Android )Swivt TechnologiesApplyExperience:2-5 yearsLevel:ExpertTotal Positions:1Job Type:full-timeSalary:Rs.25000- Rs.70000Education:Bachelor DegreeLocation:Kathmandu, NepalApply Before:2020-10-30Develop applications mainly for the Android platformResponsible for mobile application design and developmentProvide recommendations in testing and implementation phasesEnsure applications are well-maintained with timely enhancementsWork closely with other stakeholders to ensure requirements can be metAd-hoc tasks as assigned by team leadFlutterXMLAndroid SDKAndroid StudioConceptual JavaApply",
        "Page_URL": "https://kathmandujobs.com/jobs/25772/senior-flutter-developer-android--job-in-kathmandu"
    },
    {
        "name": "Senior Flutter Developer ( IOS )",
        "company": "Swivt Technologies",
        "vacancy": "1",
        "time": "full-time",
        "address": "Kathmandu, Nepal",
        "deadline": "2020-10-30",
        "education": "Bachelor Degree",
        "experience": "2-5 years",
        "level": "Expert",
        "salary": "Rs.25000- Rs.70000",
        "desct": "Senior Flutter Developer ( IOS )Swivt TechnologiesApplyExperience:2-5 yearsLevel:ExpertTotal Positions:1Job Type:full-timeSalary:Rs.25000- Rs.70000Education:Bachelor DegreeLocation:Kathmandu, NepalApply Before:2020-10-30Design and Build complex multi industry B2B Mobile App in iOS and FlutterExtract and utilize data contributed by middleware and APIsAnalyse UX research and user requirement, and optimize UI for Mobile UsersWork closely with frontend and backend web teams throughout the entire SDLC lifecycleOngoingly improve application performance by implementing new technologies available or in the upcoming tech trend.Conduct Unit Test/Beta Test before deployment to the App Store.IOSFlutterNode.JsNative ReactReact.JsApply",
        "Page_URL": "https://kathmandujobs.com/jobs/25771/senior-flutter-developer-ios--job-in-kathmandu"
    },
    {
        "name": "PHP PROGRAMMERS",
        "company": "Bent Ray Technologies Pvt. Ltd.",
        "vacancy": "2",
        "time": "full-time",
        "address": "Lalitpur, Nepal",
        "deadline": "2020-12-25",
        "education": "Bachelor Degree",
        "experience": "1-2 years",
        "level": "Expert",
        "salary": "Negotiable",
        "desct": "PHP PROGRAMMERSBent Ray Technologies Pvt. Ltd.ApplyExperience:1-2 yearsLevel:ExpertTotal Positions:2Job Type:full-timeSalary:NegotiableEducation:Bachelor DegreeLocation:Lalitpur, NepalApply Before:2020-12-25Job Description :Identifying and managing risks and setting realistic expectations for the customerWork closely with Management, Customers, QA, Design, and Product Management to maintain and enhance existing product as well as to develop new products.Develop and execute unit testing strategy and processes.Coordinate with the team to establish an effective team communication.Develop a web based application using Yii v2.0 Framework.Research and study new available technologies and figure out the feasibility of its application.Perform other assigned job related duties.Job Specification:Experience in development of distributed/scalable systems and high-volume transaction applications.Must have at least 1+ years experience in developing web applications using PHP.Sound knowledge of Object Oriented Programming using PHP.Experience in popular MVC frameworks like Yii (Preferred).Able to use/create third party API & Web Services in PHP like REST, SOAP, JSON, XML-RPC etc.Should have good knowledge of XHTML and CSS.Must have good spoken and written English.Should be self-motivated and adaptive learner.Must be able to work under pressure and demonstrate work ability in rapidly changing\u00a0requirements.Bachelor Degree in Computer ScienceApply",
        "Page_URL": "https://kathmandujobs.com/jobs/25769/php-programmers-job-in-lalitpur"
    },
    {
        "name": "FRONTEND DEVELOPER(ANGULAR)",
        "company": "Bent Ray Technologies Pvt. Ltd.",
        "vacancy": "2",
        "time": "full-time",
        "address": "Kathmandu, Nepal",
        "deadline": "2020-11-25",
        "education": "Bachelor Degree",
        "experience": "1-2 years",
        "level": "Intermediate",
        "salary": "Negotiable",
        "desct": "FRONTEND DEVELOPER(ANGULAR)Bent Ray Technologies Pvt. Ltd.ApplyExperience:1-2 yearsLevel:IntermediateTotal Positions:2Job Type:full-timeSalary:NegotiableEducation:Bachelor DegreeLocation:Kathmandu, NepalApply Before:2020-11-25Job Description :Delivering a complete front end UI and user controls in AngularEnsuring high performance on all devices, mobile or laptops.Writing tested, idiomatic, and documented JavaScript, HTML and CSSCoordinating the workflow between the graphic designer, the backend programmer and yourselfCommunicating with web services developed by backend developersJob Specification:Proficiency with JavaScript, HTML5 and CSSProfessional, precise communication skillsDeep knowledge of Angular practices and commonly used modules based on extensive work experienceCreating self-contained, reusable, and testable modules and components for front endEnsuring a clear dependency chain, in regard to the app logic as well as the file systemExtensive knowledge of CSS and JS methods for providing performant visual effectsBachelor In Information TechnologyApply",
        "Page_URL": "https://kathmandujobs.com/jobs/25768/frontend-developerangular-job-in-kathmandu"
    },
    {
        "name": "UI/UX Designer",
        "company": "Codewing Solutions",
        "vacancy": "2",
        "time": "full-time",
        "address": "Kathmandu, Nepal",
        "deadline": "2020-12-26",
        "education": "Others",
        "experience": "2-5 years",
        "level": "Expert",
        "salary": "Rs.40000- Rs.100000",
        "desct": "UI/UX DesignerCodewing SolutionsApplyExperience:2-5 yearsLevel:ExpertTotal Positions:2Job Type:full-timeSalary:Rs.40000- Rs.100000Education:OthersLocation:Kathmandu, NepalApply Before:2020-12-26Are you passionate about design? Keep reading!.We, at Codewing Solutionsare looking for a highly skilled web designer (UI/UX or UI or UX) to join our product team to create beautiful themes, not client websites.The work requires you to work closely with our company growth strategy team and developers to create meaningful designs following WordPress theme design guidelines.If you are hired, you will work remotely but are expected to work from our office in Hadigaun (near Baluwatar) when the lockdown is over and it is safe to work from the office.What Does Codewing Solutions do?We are a creative digital agency. We are a product-based company rather than a service-oriented company.We have products in many niches.\u00a0Two of our popular products areRara ThemesandWP Travel Engine, both based on WordPress.With\u00a0millions of downloads, Rara Themes is one of the leading WordPress theme companies in the world. Similarly, WP Travel Engine is currently the world\u2019s #1 travel booking WordPress plugin.Besides\u00a0creating world-class products, we also believe in having fun at work. We work 5 days a week and, and we chill on weekends!What will you be responsible for?The job requires you to keep create beautiful designs following strategy documents provided by our strategy team. The theme you will design will be used by thousands of people from all around the world.The design you create should also be clean, user-friendly, and visually appealing.How qualified you should be?At least 2 years of experience in the UI/UX field or a similar fieldBachelor\u2019s degree in design, IT, or similar degreeStrong understanding of UI which can be proved via your sample design or previous workKnowledge about WordPress will be preferredProficient in Adobe XD, Adobe Photoshop, and Adobe IllustratorProficient in Adobe Suite, Figma, Wireframing & Prototyping tool will serve as an advantageWhy you will love working with us?When you join our team, these are some of the perks that you get.Create digital products that will be used by thousands of people all around the worldWork with a team which has a proven record of building and scaling world-class productsFun and friendly people to work withCozy workspace with CPU, dual monitor working station, and\u00a0ergonomic seating arrangement once we are back at the officeFree lunch and snacks once we are back at the officeUnlimited coffee and tea once we are back at the officeFlexible working hoursTimely performance review and annual salary reviewRecreational activitiesProvident Fund, gratuity, Dashain bonus, insurance, and paid leavesWait! Before sending your CV to us, make sure at least three of the profile matches you:I have traveled to at least 1 place in the last 1 year.I am passionate about at least one other thing apart from designing or have a hobby. Passion for designing is expected.I exercise regularly and take care of my health.I have read at least 1 book in the last 6 months.I have helped at least 1 person after the lockdown.I follow at least 1 Youtube Channel or blog regularly.Ready to Apply?If the vacancy appeals to you and matches your interest, send an email to[email\u00a0protected](NOT .COM).\u00a0The email should include the following:Your CV/ResumeYour Work PortfolioIt should also include answers to at least two of the following questions:What is the last book you read and how did that change your thought process?What causes are you passionate about?What are your 5 major strengths?We\u2019ll take it from there.Web DesignerUI/UX DesignerApply",
        "Page_URL": "https://kathmandujobs.com/jobs/25828/uiux-designer-job-in-kathmandu"
    },
    {
        "name": "Boot-Camp/ Internship For Freshers",
        "company": "Codewing Solutions",
        "vacancy": "29",
        "time": "internship",
        "address": "Kathmandu, Nepal",
        "deadline": "2020-12-26",
        "education": "Others",
        "experience": "0-1 years",
        "level": "Beginner",
        "salary": "Negotiable",
        "desct": "Boot-Camp/ Internship For FreshersCodewing SolutionsApplyExperience:0-1 yearsLevel:BeginnerTotal Positions:29Job Type:internshipSalary:NegotiableEducation:OthersLocation:Kathmandu, NepalApply Before:2020-12-26Looking for an internship program where you can have actual work experience? Keep reading\u2026.About the Program:We, at Codewing, are looking for candidates to join our Boot-camp/Internship program to have potential candidates from scratch. This program will be a self-paced internship and will not require much guidance from team leads. It is focused more on peer-to-peer learning.During this program, you will be assigned with projects, which you will need to complete to graduate from Boot-camp. The internship will be unpaid but You will be provided with free and premium resources to learn and complete the tasks.The program is intended to train and polish your skills in your respective field. Therefore, if an intern demonstrates discipline and performs well, they will be hired as a full-time employee and enrolled in six months of an extensive training program.Who we are:We are Codewing Solutions, a creative digital agency. We are a product - based company rather than a service-oriented company.We are the company behind world-class products likeRara ThemesandWP Travel Engine, both based on WordPress. Along with this, we have products in many niches.While WP Travel Engine is currently the world\u2019s no. 1 travel booking WordPress plugin with over 250,000 downloads and users from more than 50 countries, Rara Themes is one of the leading WordPress theme companies in the world.We have 85+ free and premium themes. Our themes have been downloaded more than 2 million times, and we have users from more than 100+ countries.Now, what will you get? Well,You will be provided with the necessary resources and Programs to learnGrowth with diverse projectsYou will have practical work experienceYou will have maximum exposure to a software developing environmentYour chance of getting hired will increase by many foldBy the end of the internship, candidates who performed really well will be hired.We have openings for:Front-End Development \u2013 Intern (2 Positions)We are looking for an ambitious, excited, resourceful candidate with a passion for code. Candidates must have a good grasp of Front-End tools and technologies and a keen sense of design thinking. One who is passionate about making things work and making them look good would be exactly what we are looking for.WordPress Theme Development \u2013 Intern (3 Positions)We are looking for a WordPress Development intern who is familiar with WordPress\u2019s best practices. Candidates should have an excellent grasp of PHP programming language, HTML skills, JavaScript, CSS, and have a good understanding of the WordPress framework. Good communication is always the priority. Working around theme customization will be added beneficial.Customer Support/Happiness \u2013 Intern (3 Positions)As a Customer Support/Happiness, you will be responding to our customers\u2019 emails and assist them with the issues facing while using our product. We are looking for candidates who have a good command of English and excellent communication skills. You will also be writing documentation as a part of your task. Basic knowledge of WordPress will be beneficial.Plugin Development \u2013 Intern (4 Positions)We are looking for a candidate with a basic understanding of web programming. Some experience with PHP programming language is a must. Candidates who have experience in creating and managing websites with WordPress CMS will be given preference. Basic knowledge of HTML, CSS, and JS is required.The Right candidate would possess the below qualities:PassionateEager to learnTeam PlayerAmbitiousGood Communication skillsReady to apply?Submit your updated CV along with a cover letter to[email\u00a0protected](Not .COM). Do send us your project or work done during college. It can also be something you learned on your job. Tell us why you are the best fit for this program.Note: Please mention the program name you are interested in, in the mail subject.Example:\u00a0 Applying for an SEO intern.We\u2019ll take it from here...InternshipApply",
        "Page_URL": "https://kathmandujobs.com/jobs/25827/bootcamp-internship-for-freshers-job-in-kathmandu"
    },
    {
        "name": ".net Developer with Xamarin",
        "company": "Dailo Technologies",
        "vacancy": "1",
        "time": "full-time",
        "address": "Kathmandu, Nepal",
        "deadline": "2020-12-30",
        "education": "Bachelor Degree",
        "experience": "2-5 years",
        "level": "Intermediate",
        "salary": "Negotiable",
        "desct": ".net Developer with XamarinDailo TechnologiesApplyExperience:2-5 yearsLevel:IntermediateTotal Positions:1Job Type:full-timeSalary:NegotiableEducation:Bachelor DegreeLocation:Kathmandu, NepalApply Before:2020-12-30Inbox your cv at[email\u00a0protected].net framework and XamarinApply",
        "Page_URL": "https://kathmandujobs.com/jobs/25826/net-developer-with-xamarin-job-in-kathmandu"
    },
    {
        "name": "Flutter Developer",
        "company": "Delta Tech Pvt. Ltd.",
        "vacancy": "1",
        "time": "full-time",
        "address": "Biratnagar, Nepal",
        "deadline": "2020-12-10",
        "education": "Bachelor Degree",
        "experience": "1-2 years",
        "level": "Intermediate",
        "salary": "Negotiable",
        "desct": "Flutter DeveloperDelta Tech Pvt. Ltd.ApplyExperience:1-2 yearsLevel:IntermediateTotal Positions:1Job Type:full-timeSalary:NegotiableEducation:Bachelor DegreeLocation:Biratnagar, NepalApply Before:2020-12-10Other SpecificationMin. 1 year working as a full-time professional developer (mobile) with at least 6 months experience in FlutterExperience building a moderately complex android app with knowledge of dart. Bonus if it\u2019s on the play store or we can view the projectWilling to work with cross-platform frameworksWilling to learn and work on different mobile platforms/ frameworks when neededPublished at least one app on the play store using Flutter/ Native (Java/Kotlin/ Swift/ Object c)Networking and integrating third-party APIsWorking with a version control system (i.e. Git)You areAble to multitask and focus on deadlines under pressureTeam playerPassionate about new technologyExcellent team-working skills, hardworking, creative and innovativeJob DescriptionDelta Tech is seeking a Flutter Developer who is an in-depth understanding of iOS and Android using Google Flutter Development Framework and also creative and innovative. You will be working on various internal products (DeltaSalesApp, DeltaRetailerApp, DeltaSalesCRM & DeltaInventory) and external projects with different levels of complexities and challenges.Role and Responsibilities:Your responsibilities will include (but are not limited to):As a Flutter Developer, you will create multi-platform apps for iOS and Android using Google's Flutter development framework.The primary focus will be on creating new experiences and maintaining the acclaimed app.You will additionally work on innovative new app projects as well as internally incubated ventures.Deep experience contributing to and managing high-scale production mobile apps. You must have previous experience in Flutter development.What we offerDelta Tech is looking for candidates who are loyal and plan to make a long-term commitment. In return for your loyalty we offer:Position BenefitsCompetitive/ Attractive Salary (No bar for right and deserving candidate)Timely performance appraisal and salary reviewsPaid holiday & paid leavesFestive bonusGreat work cultureFlexible timings against performanceMulti Platform AppsTime ManagementMobile Application DevelopmentGoogle'S Flutter Development FrameworkIos And AndroidTeamworkApply",
        "Page_URL": "https://kathmandujobs.com/jobs/25825/flutter-developer-job-in-biratnagar"
    },
    {
        "name": "PHP Developer",
        "company": "Podamibe Nepal Pvt. Ltd.",
        "vacancy": "1",
        "time": "full-time",
        "address": "Kathmandu, Nepal",
        "deadline": "2020-12-24",
        "education": "Bachelor Degree",
        "experience": "2-5 years",
        "level": "Intermediate",
        "salary": "Negotiable",
        "desct": "PHP DeveloperPodamibe Nepal Pvt. Ltd.ApplyExperience:2-5 yearsLevel:IntermediateTotal Positions:1Job Type:full-timeSalary:NegotiableEducation:Bachelor DegreeLocation:Kathmandu, NepalApply Before:2020-12-24Job RequirementExperience with pure- PHP (both OOP and Procedural)Excellent working knowledge of MVC framework preferable CIWorking knowledge of JavaScript, jQuery, Json, Gurnt, Saas and AjaxProficiency in SQL database development, writing and optimizing MySQL,keys, relation, indexes etc.Proficiency in using version control tool preferably GITStrong creative, analytical and problem-solving skillsAbility to challenge yourself and work well under pressureTeamworkCritical ThinkingPhpCreative ThinkingApply",
        "Page_URL": "https://kathmandujobs.com/jobs/25824/php-developer-job-in-kathmandu"
    },
    {
        "name": "Full Stack Java Developer",
        "company": "Gamenic Nalamiz Tech",
        "vacancy": "2",
        "time": "full-time",
        "address": "Bhaktapur, Nepal",
        "deadline": "2020-12-10",
        "education": "Bachelor Degree",
        "experience": "0-1 years",
        "level": "Intermediate",
        "salary": "Rs.20000- Rs.100000",
        "desct": "Full Stack Java DeveloperGamenic Nalamiz TechApplyExperience:0-1 yearsLevel:IntermediateTotal Positions:2Job Type:full-timeSalary:Rs.20000- Rs.100000Education:Bachelor DegreeLocation:Bhaktapur, NepalApply Before:2020-12-10Skills and KnowledgeExperience in parallel and multithreaded programming.Knowledge of algorithms and data structures.Interest in achieving maximum performance from available hardware and software.Familiar with design patterns.UI Development Skills (JavaFx, JavaScript, CSS, HTML, jQuery).Hands-on knowledge of Spring Framework.Strong knowledge of Relational Databases, SQL, and ORM technologies.Experience working with source control systems, such as Subversion, and GIT including branching and merging strategies.Essential technologyJavaEE \uff0b GlassFish3TypeScriptJavaScriptMariaDBExperienced and desirable technologyNode.JSAngularExperience using GithubSpring BootContainer knowledge such as DockerKnowledge that can design Class and InterfaceJavaHTMlCSSOOPJQueryGithubJsApply",
        "Page_URL": "https://kathmandujobs.com/jobs/25823/full-stack-java-developer-job-in-bhaktapur"
    },
    {
        "name": "Dot Net Software Developer (.NET Core, .NET Framework)",
        "company": "Podamibe Nepal Pvt. Ltd.",
        "vacancy": "2",
        "time": "full-time",
        "address": "Kathmandu, Nepal",
        "deadline": "2020-12-23",
        "education": "Bachelor Degree",
        "experience": "2-5 years",
        "level": "Intermediate",
        "salary": "Negotiable",
        "desct": "Dot Net Software Developer (.NET Core, .NET Framework)Podamibe Nepal Pvt. Ltd.ApplyExperience:2-5 yearsLevel:IntermediateTotal Positions:2Job Type:full-timeSalary:NegotiableEducation:Bachelor DegreeLocation:Kathmandu, NepalApply Before:2020-12-23We are looking for a C# developer responsible for building C# applications, including anything from back-end services to their client-end counterparts.Your primary responsibilities will be to design and develop these applications, and to coordinate with the rest of the team working on different layers of the infrastructure.Responsibilities- Translate application requirement to functional applications- Design, build and maintain efficient, reusable, and reliable C# code- Ensure the best possible performance, quality, and responsiveness of applications- Identify bottlenecks and bugs, and devise solutions to these problems- Help maintain code quality, organization, and atomization Skills- Proficient in C#, with a good knowledge of its ecosystems- Familiarity with the .NET framework- Familiarity with the Javascript grids- Strong understanding of object-oriented programming- Skill for writing reusable C# libraries- Familiar with various design and architectural patterns- Knowledge of concurrency patterns in C#- Familiarity with SQL Server and MySQL- The knack for writing clean, readable C# code- Proficient understanding of code versioning tools such as \u00a0git..net core .NET Framework ASP.NET Javascript MS SQL mysqlApply",
        "Page_URL": "https://kathmandujobs.com/jobs/25822/dot-net-software-developer-net-core-net-framework-job-in-kathmandu"
    },
    {
        "name": "Job Vaccancy For Laravel+ Vue Js and Quality Assurance",
        "company": "Softechpark Pvt.Ltd.",
        "vacancy": "1",
        "time": "full-time",
        "address": "Kathmandu, Nepal",
        "deadline": "2020-11-27",
        "education": "Secondary Education Examination ( SEE)",
        "experience": "2-5 years",
        "level": "Expert",
        "salary": "Rs.30000- Rs.50000",
        "desct": "Job Vaccancy For Laravel+ Vue Js and Quality AssuranceSoftechpark Pvt.Ltd.ApplyExperience:2-5 yearsLevel:ExpertTotal Positions:1Job Type:full-timeSalary:Rs.30000- Rs.50000Education:Secondary Education Examination ( SEE)Location:Kathmandu, NepalApply Before:2020-11-27Required Skill & Experiences for Laravel Developer3+ years of experiance for senior level developer and must be capable for team leading.Should be expert knowledge in web technologies including HTML, CSS, Javascript, AJAX etc.Experience working with Laravel Framework.Write quality OOP code and follow existing development standards-Knowledge of Vue.js and VueX-knowledge of Vue CLIRestful API development experience.Experience with Test-Driven Development (PHPUnit)Experience in refactoring and improving the legacy code to use modern standards and tests.Strong problem-solving skills and attention to detail.Knowledge of GIT.Work experienced in ERP based projects.Daily stand-up meetings to review current progress and obstacles with direct team.Required Skill & Experiences for Quality AssuranceProven work experience in software Quality Assurance1+ experience in related fieldStrong knowledge of software QA methodologies, tools and processesReviewing requirements and development design.Writing Test Cases.Preparing test environment.Execution of test cases and test plans.Performing different types of testing (Manual and Automation).Reporting, tracking and following-up bugs using Team Foundation Server (TFS).Performing the needed documentation related to tested software.Salary:Laravel & Vue JS Developer : 30-50 k/monthQuality Assurance:15-30kDeadline :2020-11-27We are seeking Senior Laravel+ Vue Js and one Quality Assuranceto join our Softechpark development team. We're looking for a self-motivatedinnovative programmer & Quality Assurance who's excited about leveraging new technology to improve existing enterprise systems. We need an experienced & passionate candidate only to fill this position.Apply",
        "Page_URL": "https://kathmandujobs.com/jobs/25821/job-vaccancy-for-laravel-vue-js-and-quality-assurance-job-in-kathmandu"
    },
    {
        "name": "PHP/Vue Developer (Back-end )",
        "company": "Apiera",
        "vacancy": "1",
        "time": "freelance",
        "address": "Kathmandu, Nepal",
        "deadline": "2020-11-07",
        "education": "Secondary Education Examination ( SEE)",
        "experience": "2-5 years",
        "level": "Expert",
        "salary": "Negotiable",
        "desct": "PHP/Vue Developer (Back-end )ApieraApplyExperience:2-5 yearsLevel:ExpertTotal Positions:1Job Type:freelanceSalary:NegotiableEducation:Secondary Education Examination ( SEE)Location:Kathmandu, NepalApply Before:2020-11-07Ideally: self-motivated, proactive, result-oriented, best practises, hard-working, Go-getter...PHP/Vue Developer (Back-end )Position: Senior/Mid-levelWork Environment: RemoteEmployment Type: Full-time / Part-time(Minimum 25hrs/week)Salary: Depends on Experience. No bar for Deserving Candidate.Our hiring process for this vacancy:1) CV review2) Technical evaluation test3) HR interview4) OfferThe focus of your role:PHP Developer is responsible for managing back-end services and the interchange of data between the server and the users. Your primary focus will be the development of all server-side logic, definition and maintenance of the central database, and ensuring high performance and responsiveness to requests from the front-end. You will also be responsible for integrating the front-end elements built by your co-workers into the application. Therefore, a basic understanding of front-end technologies is necessary as well.Apply by filling the form: https://forms.gle/MgGPKfxXPDkCUgwo6Please feel free to inquire at[email\u00a0protected]PHPVUELaravelApply",
        "Page_URL": "https://kathmandujobs.com/jobs/25820/phpvue-developer-backend--job-in-kathmandu"
    },
    {
        "name": "Flutter Developer",
        "company": "Codavatar Tech Private Limited",
        "vacancy": "3",
        "time": "full-time",
        "address": "Kathmandu, Nepal",
        "deadline": "2020-12-15",
        "education": "Secondary Education Examination ( SEE)",
        "experience": "2-5 years",
        "level": "Intermediate",
        "salary": "Negotiable",
        "desct": "Flutter DeveloperCodavatar Tech Private LimitedApplyExperience:2-5 yearsLevel:IntermediateTotal Positions:3Job Type:full-timeSalary:NegotiableEducation:Secondary Education Examination ( SEE)Location:Kathmandu, NepalApply Before:2020-12-15???? Job DescriptionAs a Flutter Developer, you will create multi-platform apps for iOS and Android using Google's Flutter development framework. Ideal candidates will possess a drive for thinking creatively to resolve complex problems and enjoy contributing to solutions.???? Job Requirements\u27a4 Min. 3 year working as a full-time professional developer (Mobile) with at least 1 year experience in Flutter.\u27a4 Should have strong knowledge of OOP.\u27a4 Should have clean Code architecture, patterns\u27a4 Collaborate with QA to test and deliver the product with high quality and high speed\u27a4 Experience building a moderately complex Android app with knowledge of dart.\u27a4 Willing to work with cross-platform frameworks.\u27a4 Willing to learn and work on different mobile platforms/frameworks when needed.\u27a4 Published at least one app on the Play Store using Flutter/ Native (Java/Kotlin/Swift/Object c).\u27a4 Networking and integrating third-party APIs.\u27a4 Working with a version control system (i.e., Git)\u27a4 Job Duties and Responsibilities\u27a4 As a Flutter Developer, you will create multi-platform apps for iOS and Android using Google's Flutter development framework.\u27a4 The primary focus will be on creating new applications from scratch.\u27a4 Develop SDKs, libraries, and widgets to create a mobile application development platform\u27a4 Provide feedback regarding system performance and usability issues\u27a4 Deep experience contributing to and managing high-scale production mobile apps. You must have previous experience in Flutter development.???? Required Technical and Professional Expertise\u2022 Problem Solving\u2022 Time Management\u2022 Communication\u2022 Flutter???? What we offer?\u2713 Insurance policy and Benefits\u2713 Competitive Salary\u2713 Festival & Relocation Allowance\u2713 Provident Fund & Gratuity???? About CompanyCodavatar is an Application (Web/Mobile) Development firm which provides best in class solutions on the Web, Mobility, Cloud and more internet-based services.Website Link:https://www.codavatar.com/\u270d How to applyTo apply for this position, send an email to[email\u00a0protected]with \u201cFlutter Developer\u201d in the subject line. In the email, make sure to include your resume (in word or PDF preferred), cover letter, salary requirements, and any additional information you would feel relevant for this role.*No Age Bar for deserving candidates.Problem SolvingTime ManagementCommunicationFlutterApply",
        "Page_URL": "https://kathmandujobs.com/jobs/25819/flutter-developer-job-in-kathmandu"
    },
    {
        "name": "Visual Editor/ Animator",
        "company": "Ombryo Lab Pvt. Ltd.",
        "vacancy": "3",
        "time": "full-time",
        "address": "Kathmandu, Nepal",
        "deadline": "2020-12-22",
        "education": "Bachelor Degree",
        "experience": "2-5 years",
        "level": "Intermediate",
        "salary": "Negotiable",
        "desct": "Visual Editor/ AnimatorOmbryo Lab Pvt. Ltd.ApplyExperience:2-5 yearsLevel:IntermediateTotal Positions:3Job Type:full-timeSalary:NegotiableEducation:Bachelor DegreeLocation:Kathmandu, NepalApply Before:2020-12-22\u2705 Job Requirements\u27a4 At least 2-4 years of experience in Visual Editing and Animating.\u27a4 Proficient in After Effects, Illustrator, Adobe Character Animator are preferred.\u27a4 Experience in Auto Desk Maya is encouraged.\u27a4 Good drawing skills and creativity.\u27a4 Excellent time management skills.\u27a4 Strong communication and active listening skills.\u27a4 He/ She is required to understand how a good story works and tells best through animation.\u27a4 Must be able to work in a fast-paced startup working culture\u27a4 Experienced on making Logo Animation,2D/3D animation, Short Video Ads etc.\u27a4 Worked on projects of App & Website Previews and should have a good knowledge of character animation.\u2705 Job Duties and Responsibilities\u27a4 He/ She Should work on project Line Action Explainers, 3D Product Animation and must be conceptual with video editing, visual effects.\u27a4 He/ She needs to operate and edit on Whiteboard & Animated Explainers.\u27a4 Manipulate visual effects and animations like 2D, 3D using computerized technology and software applications.\u27a4 Creating visuals for video games and mobile applications.\u27a4 Generating simulations and mockups to be viewed and approved by those involved in media production and stakeholders.\u27a4 Troubleshooting any issues with animations.\u27a4 Establish storyboards to understand the images needed for the storyline and purpose of production.\u27a4 Ensure logical sequencing and smooth running.\u27a4 Adhering to tight deadlines and other constraints to meet production times.\u2705Required Technical and Professional Expertise\u27a4 Bachelor\u2019s degree in relevant field\u27a4 Excellent interpersonal and communication skills\u27a4 Research Oriented\u27a4 Critical Thinker\u27a4 Must have a solid Animation and Graphic Design Portfolio\u27a4 Should possess creativity and innovativeness\u27a4 Must be a team player\u27a4 Must be able to work in fast paced startup working culture\u27a4 Must be able to navigate complicated processes with many users, and convey information in an understandable way to them\u2705 What we offer?\u27a4 Competitive Salary\u27a4 Festival & Relocation Allowance\u27a4 Provident Fund & Gratuity\u27a4 Growth & Development Opportunities\u27a4 Friendly and creative working environment\u2705 About CompanyOmbryo Lab is a Startup Incubator which aims in changing the IT Landscape of Nepal with the adoption of Silicon Valley culture. We create a long term impact by sprouting the right talent to a fully grown venture which is capable of driving the next generation innovation and developing cutting edge products.???? How to apply\u270f\ufe0f To apply for this position, send an email with a link to your latest portfolio to[email\u00a0protected]with \u201cAnimator/ Visual Editor\u201d in the subject line. In the email, make sure to include your resume (in word or PDF preferred), cover letter, salary requirements and any additional information you would feel relevant for this role.Critical ThinkerMust have a solid Animation and Graphic Design PortfolioShould possess creativity and innovativenessMust be a team playerMust be able to work in fast paced startup working cultureApply",
        "Page_URL": "https://kathmandujobs.com/jobs/25818/visual-editor-animator-job-in-kathmandu"
    },
    {
        "name": "Urdu Tutor",
        "company": "Ombryo Lab Pvt. Ltd.",
        "vacancy": "3",
        "time": "full-time",
        "address": "Kathmandu, Nepal",
        "deadline": "2020-12-15",
        "education": "Secondary Education Examination ( SEE)",
        "experience": "0-1 years",
        "level": "Beginner",
        "salary": "Negotiable",
        "desct": "Urdu TutorOmbryo Lab Pvt. Ltd.ApplyExperience:0-1 yearsLevel:BeginnerTotal Positions:3Job Type:full-timeSalary:NegotiableEducation:Secondary Education Examination ( SEE)Location:Kathmandu, NepalApply Before:2020-12-15????Requirement:\u2705Should have completed minimum +2\u2705Should have good fluency in English and Urdu not only inwritten but speaking will be given more importance.\u2705Able to type in Urdu\u2705Should be able to interact with student freely. Extrovertnature will be preferred.????Responsibilities:\u2705Translation of documents from Urdu to English and Viceversa\u2705Conduct classes\u2705Design the study materialsShould have good fluency in English and Urdu not only in written but speaking will be given more importance.Able to type in UrduShould be able to interact with student freely. Extrovert nature will be preferred.Apply",
        "Page_URL": "https://kathmandujobs.com/jobs/25817/urdu-tutor-job-in-kathmandu"
    },
    {
        "name": "UI/UX Designer",
        "company": "Codavatar Tech Private Limited",
        "vacancy": "3",
        "time": "full-time",
        "address": "Kathmandu, Nepal",
        "deadline": "2020-12-15",
        "education": "Secondary Education Examination ( SEE)",
        "experience": "2-5 years",
        "level": "Intermediate",
        "salary": "Negotiable",
        "desct": "UI/UX DesignerCodavatar Tech Private LimitedApplyExperience:2-5 yearsLevel:IntermediateTotal Positions:3Job Type:full-timeSalary:NegotiableEducation:Secondary Education Examination ( SEE)Location:Kathmandu, NepalApply Before:2020-12-15Job Duties and Responsibiliies\u2022 Plan and implement new designs\u2022 Optimize existing user interface designs\u2022 Test for intuitivity and experience\u2022 Communicate with clients to understand their business goals and objectives\u2022 Develop technical and business requirements and always strive to deliver intuitive and user-centered solutions\u2022 Combine creativity with an awareness of the design elements\u2022 Create prototypes for new product ideas\u2022 Test new ideas before implementing\u2022 Conduct an ongoing user research\u2713 Problem solver and customer-centeredKnowledge of Adobe range of products including Photoshop0IllustratorInDesignAcrobat and DreamweaverYears of experience with HTML5 & CSS3Some knowledge of Usability Factors in Human Computer Interaction.Apply",
        "Page_URL": "https://kathmandujobs.com/jobs/25816/uiux-designer-job-in-kathmandu"
    },
    {
        "name": "React.js Developer (Web Developer)",
        "company": "e-digital Nepal Pvt. Ltd.",
        "vacancy": "1",
        "time": "full-time",
        "address": "Kathmandu, Nepal",
        "deadline": "2020-12-05",
        "education": "Bachelor Degree",
        "experience": "1-2 years",
        "level": "Intermediate",
        "salary": "Negotiable",
        "desct": "React.js Developer (Web Developer)e-digital Nepal Pvt. Ltd.ApplyExperience:1-2 yearsLevel:IntermediateTotal Positions:1Job Type:full-timeSalary:NegotiableEducation:Bachelor DegreeLocation:Kathmandu, NepalApply Before:2020-12-05We are looking for a skilled React.js Developer to join our front-end development team. In this role, you will be responsible for developing and implementing user interface components using React.js concepts and workflows such as Redux, Flux, and Webpack. You will also be responsible for profiling and improving front-end performance and documenting our front-end codebase.To ensure success as a React.js Developer, you should have in-depth knowledge of JavaScript and React concepts, excellent front-end coding skills, and a good understanding of progressive web applications. Ultimately, a top-class React.js Developer should be able to design and build modern user interface components to enhance application performance.React.js Developer Responsibilities:Meeting with the development team to discuss user interface ideas and applications.Reviewing application requirements and interface designs.Identifying web-based user interactions.Developing and implementing highly-responsive user interface components using React concepts.Writing application interface codes using JavaScript following React.js workflows.Troubleshooting interface software and debugging application codes.Developing and implementing front-end architecture to support user interface concepts.Monitoring and improving front-end performance.Documenting application changes and developing updates.React.js Developer Requirements:Bachelor\u2019s degree in Computer Science, Information Technology, or a similar field.Previous experience working as a React.js Developer.In-depth knowledge of JavaScript, CSS, HTML, and front-end languages.Knowledge of REACT tools including React.js, Webpack, Enzyme, Redux, and Flux.Experience with user interface design.Knowledge of performance testing frameworks including Mocha and Jest.Experience with browser-based debugging and performance testing software.Excellent troubleshooting skills.Good project management skills.Knowledge of REACT tools including React.jsWebpackEnzymeReduxand Flux.Apply",
        "Page_URL": "https://kathmandujobs.com/jobs/25815/reactjs-developer-web-developer-job-in-kathmandu"
    },
    {
        "name": "React.js Developer (Web Developer)",
        "company": "e-digital Nepal Pvt. Ltd.",
        "vacancy": "1",
        "time": "full-time",
        "address": "Kathmandu, Nepal",
        "deadline": "2020-12-05",
        "education": "Bachelor Degree",
        "experience": "1-2 years",
        "level": "Intermediate",
        "salary": "Negotiable",
        "desct": "React.js Developer (Web Developer)e-digital Nepal Pvt. Ltd.ApplyExperience:1-2 yearsLevel:IntermediateTotal Positions:1Job Type:full-timeSalary:NegotiableEducation:Bachelor DegreeLocation:Kathmandu, NepalApply Before:2020-12-05We are looking for a skilled React.js Developer to join our front-end development team. In this role, you will be responsible for developing and implementing user interface components using React.js concepts and workflows such as Redux, Flux, and Webpack. You will also be responsible for profiling and improving front-end performance and documenting our front-end codebase.To ensure success as a React.js Developer, you should have in-depth knowledge of JavaScript and React concepts, excellent front-end coding skills, and a good understanding of progressive web applications. Ultimately, a top-class React.js Developer should be able to design and build modern user interface components to enhance application performance.React.js Developer Responsibilities:Meeting with the development team to discuss user interface ideas and applications.Reviewing application requirements and interface designs.Identifying web-based user interactions.Developing and implementing highly-responsive user interface components using React concepts.Writing application interface codes using JavaScript following React.js workflows.Troubleshooting interface software and debugging application codes.Developing and implementing front-end architecture to support user interface concepts.Monitoring and improving front-end performance.Documenting application changes and developing updates.React.js Developer Requirements:Bachelor\u2019s degree in Computer Science, Information Technology, or a similar field.Previous experience working as a React.js Developer.In-depth knowledge of JavaScript, CSS, HTML, and front-end languages.Knowledge of REACT tools including React.js, Webpack, Enzyme, Redux, and Flux.Experience with user interface design.Knowledge of performance testing frameworks including Mocha and Jest.Experience with browser-based debugging and performance testing software.Excellent troubleshooting skills.Good project management skills.Knowledge of REACT tools including React.jsWebpackEnzymeReduxand Flux.Apply",
        "Page_URL": "https://kathmandujobs.com/jobs/25815/reactjs-developer-web-developer-job-in-kathmandu"
    },
    {
        "name": "Software Trainer",
        "company": "Quantum IT SOLUTIONS",
        "vacancy": "5",
        "time": "freelance",
        "address": "Kathmandu, Nepal",
        "deadline": "2020-11-30",
        "education": "Higher Secondary Level (+2)",
        "experience": "0-1 years",
        "level": "Beginner",
        "salary": "Negotiable",
        "desct": "Software TrainerQuantum IT SOLUTIONSApplyExperience:0-1 yearsLevel:BeginnerTotal Positions:5Job Type:freelanceSalary:NegotiableEducation:Higher Secondary Level (+2)Location:Kathmandu, NepalApply Before:2020-11-30\u2022 Maintaining relationships with the existing client bases related to software.\u2022 Identifying and solving queries and concerns of the clients and ensuring client satisfaction.\u2022 Good communication skills.\u2022 Experience in presenting to groups of individuals face to face and running online demonstrations of products/servicesGood CommunicationApply",
        "Page_URL": "https://kathmandujobs.com/jobs/25814/software-trainer-job-in-kathmandu"
    },
    {
        "name": "Machine Learning Engineer - Part Time",
        "company": "Techrise",
        "vacancy": "1",
        "time": "part-time",
        "address": "Lalitpur, Nepal",
        "deadline": "2020-11-21",
        "education": "Bachelor Degree",
        "experience": "2-5 years",
        "level": "Intermediate",
        "salary": "Rs.30000- Rs.45000",
        "desct": "Machine Learning Engineer - Part TimeTechriseApplyExperience:2-5 yearsLevel:IntermediateTotal Positions:1Job Type:part-timeSalary:Rs.30000- Rs.45000Education:Bachelor DegreeLocation:Lalitpur, NepalApply Before:2020-11-21We are looking for:An expert in machine learning to help us to design and build an online e-learning program.A person who can work part-time for about 15 - 20 hours a week. (It is remote work. Working hours can be decided according to your circumstances.)Required skills:Advanced degree in computer science, math, statistics or a related disciplineExtensive data modeling and data architecture skillsProgramming experience in PythonExperience in machine learning frameworks in python such as TensorFlow or KerasStrong knowledge about machine learning and deep learning algorithms such as k-Nearest, NLP and sequence modeling, along with CNNStrong written and verbal communications in EnglishCore responsibilities:Create, check, and modify online courses about machine learningCommunicate with the foreign team for any improvement in our online programsResearch, Design and Frame Machine Learning SystemsUnderstand and Transform the Prototypes of Data ScienceVerifying data quality, and/or ensuring it via data cleaningPerform Machine Learning Model Tests and ExperimentsDevelop the Machine Learning Model as per the NeedSelect and Implement Right Machine Learning AlgorithmsUnderstand Business Objectives and Developing the ML ModelsCompany benefits:Friendly, creative working environment with a foreign teamWorking with the latest technologiesTimely salary reviewRemote working policyApplying Procedure:If you believe you are the one and have a passion to work with us,APPLY NOWwithYour recent resume\u00a0in PDF formatYour desired weekly working hours and\u00a0monthly salaryat[email\u00a0protected].We are looking forward to receiving your application!Machine LearningApply",
        "Page_URL": "https://kathmandujobs.com/jobs/25813/machine-learning-engineer-part-time-job-in-lalitpur"
    },
    {
        "name": "Senior .NET developer",
        "company": "Singapore Ecommerce App Pte. Ltd",
        "vacancy": "2",
        "time": "full-time",
        "address": "Kathmandu, Nepal",
        "deadline": "2020-12-16",
        "education": "Bachelor Degree",
        "experience": "5-10 years",
        "level": "Expert",
        "salary": "Negotiable",
        "desct": "Senior .NET developerSingapore Ecommerce App Pte. LtdApplyExperience:5-10 yearsLevel:ExpertTotal Positions:2Job Type:full-timeSalary:NegotiableEducation:Bachelor DegreeLocation:Kathmandu, NepalApply Before:2020-12-16Please state your current salary, expected salary, notice period, contact-able referenceStrong knowledge of Object-Oriented Programming and Design ConceptsKnowledge of software development life-cycle for web-based applicationsExperience in design and development experience with C#, Angular, .NET web framework, .NET and/or .NET CoreProficient in MS SQL queries, familiar with Database Design and Stored ProceduresExperience in web technologies: JavaScript, AJAX, jQuery, HTML5, CSSDesign and develop and maintain simple to complex modules for our productsInvestigate new APIs and learn how to use themUbuntuWindows Serversystem designSQL Server.NET coreasp.net.NET MVCversion controlsearch database like elasticsearchcache system like redisApply",
        "Page_URL": "https://kathmandujobs.com/jobs/25812/senior-net-developer-job-in-kathmandu"
    },
    {
        "name": ".Net Developer",
        "company": "Krennova Pvt. Ltd",
        "vacancy": "2",
        "time": "full-time",
        "address": "Kathmandu, Nepal",
        "deadline": "2020-11-30",
        "education": "Bachelor Degree",
        "experience": "2-5 years",
        "level": "Intermediate",
        "salary": "Rs.30000- Rs.45000",
        "desct": ".Net DeveloperKrennova Pvt. LtdApplyExperience:2-5 yearsLevel:IntermediateTotal Positions:2Job Type:full-timeSalary:Rs.30000- Rs.45000Education:Bachelor DegreeLocation:Kathmandu, NepalApply Before:2020-11-30Krennova Tech is looking for Associate Software Engineer (.NET), who will be responsible for creating ASP.NET web applications, providing support to clients and writing quality and scalable codes in .NET Framework.Job Responsibilities:Develop web applications using ASP.NET.Modify existing ASP.NET web applications according to requirements.Develop ASP.NET Web APIs and Web Services for mobile applications.Professional Skill Required:.NET Core, ASP.NET MVC, Web API, Entity Framework, MSSqlOther Specification:Bachelor in Computer Engineering/Science or related field or equivalentPrior experience as a .NET developer (At least 2 year)Knowledge of .NET Framework (ASP.NET MVC, Web API and Web Services)Knowledge of Umbraco CMS V 7.0 will be plus.Ability to use Visual Studio for application development and debuggingKnowledge of MSSQL (SQL Queries, tables, stored-procedures and functions)Proficiencies in HTML, CSS, JavaScriptWork remotely during pandemic. Please send your details to[email\u00a0protected]..NET CoreASP.NET MVCWeb APIEntity FrameworkMSSqlApply",
        "Page_URL": "https://kathmandujobs.com/jobs/25811/net-developer-job-in-kathmandu"
    },
    {
        "name": "Product photographer",
        "company": "parsa handicraft",
        "vacancy": "1",
        "time": "full-time",
        "address": "Kathmandu, Nepal",
        "deadline": "2020-12-08",
        "education": "Higher Secondary Level (+2)",
        "experience": "1-2 years",
        "level": "Intermediate",
        "salary": "Rs.30000- Rs.38000",
        "desct": "Product photographerparsa handicraftApplyExperience:1-2 yearsLevel:IntermediateTotal Positions:1Job Type:full-timeSalary:Rs.30000- Rs.38000Education:Higher Secondary Level (+2)Location:Kathmandu, NepalApply Before:2020-12-08Take professional pictures in a studio or in a particular locationTo produce high-quality photographic imagesUse different techniques to enhance the photographs as requiredUse photo manipulation software such as Adobe Suite to get desired resultsRecommend creative ideas to exceed expectations of goals and objectivesUse artistic knowledge to enhance and compose photographsReview sets of photographs and select the best resultsOperate various photographic equipment such as single lens reflex cameras and film or digital cameras and lighting.high-quality photographicApply",
        "Page_URL": "https://kathmandujobs.com/jobs/25809/product-photographer-job-in-kathmandu"
    },
    {
        "name": "Angular Developer",
        "company": "PalmMind IT",
        "vacancy": "3",
        "time": "full-time",
        "address": "Kathmandu, Nepal",
        "deadline": "2020-12-10",
        "education": "Bachelor Degree",
        "experience": "2-5 years",
        "level": "Expert",
        "salary": "Negotiable",
        "desct": "Angular DeveloperPalmMind ITApplyExperience:2-5 yearsLevel:ExpertTotal Positions:3Job Type:full-timeSalary:NegotiableEducation:Bachelor DegreeLocation:Kathmandu, NepalApply Before:2020-12-10Strong Knowledge of Angular FrameworkWork as a part of an Agile team.Build and maintain JS based code baseStrong knowledge of NodeJSGood problem-solving skillsStrong knowledge of developing and utilising APIs.Problem-solving skillsApply",
        "Page_URL": "https://kathmandujobs.com/jobs/25808/angular-developer-job-in-kathmandu"
    },
    {
        "name": "Python Developer",
        "company": "Numeric Mind",
        "vacancy": "2",
        "time": "full-time",
        "address": "Kathmandu, Nepal",
        "deadline": "2020-11-30",
        "education": "Bachelor Degree",
        "experience": "1-2 years",
        "level": "Intermediate",
        "salary": "Negotiable",
        "desct": "Python DeveloperNumeric MindApplyExperience:1-2 yearsLevel:IntermediateTotal Positions:2Job Type:full-timeSalary:NegotiableEducation:Bachelor DegreeLocation:Kathmandu, NepalApply Before:2020-11-30About the company and Partner: Nimble Clinical Research is a US based technology company dedicated towards creating innovative software applications for pharmaceutical and biotech companies. We are building our local Nepal team via our partner company, Numeric Mind Pvt Ltd (numericmind.com) in Nepal, and looking for the best python developers. Visit Nimble Clinical Research, LLC (nimble-cr.com) to know\u00a0about our current software applications.Role and Responsibilities\u2022 As a Python developer, you\u2019ll design and develop highly complex modules in our data analytics platform.\u2022 The ideal candidate is a self-starter, independent and passionate developer with a strong desire to create high-quality applications.\u2022 You are expected to continually learn and apply best software development practices and technologies to the tasks at hand.\u2022 Use core python, data analysis related packages (such as numpy, pandas, matplotlib, SciPy) and QT (to design user interface elements).Requirements\u2022 Expert in core python, and OOP\u2022 Strong experience in numpy, pandas desired\u2022 At least 3 months on-job experience as a trainee or an employee; Over 1-year experience preferred\u2022 Education: BS in Computer Science or equivalent degree.Type: Full-timeNumber of Openings: 2Location: Remote/office in NepalCompensation:\u00a0Attractive salary, higher than the market rate, along with increments every 6 monthsREFERRAL: Do you know someone else who is a great python programmer? Earn NRP 20,000 by referring a candidate. Refer them to us! On successful hiring of the candidate, lasting at least a month of employment, you will get NR 20,000 as referral reward.Applying: if interested, send your resume directly to[email\u00a0protected]. In the resume include your git repository link and LinkedIn profile link if available.Python ProgrammingnumpypandasmatplotlibSciPy and QTApply",
        "Page_URL": "https://kathmandujobs.com/jobs/25807/python-developer-job-in-kathmandu"
    },
    {
        "name": "Full Stack Java Developer",
        "company": "Gamenic Nalamiz Tech",
        "vacancy": "2",
        "time": "full-time",
        "address": "Bhaktapur, Nepal",
        "deadline": "2020-11-15",
        "education": "Bachelor Degree",
        "experience": "0-1 years",
        "level": "Intermediate",
        "salary": "Rs.15000- Rs.50000",
        "desct": "Full Stack Java DeveloperGamenic Nalamiz TechApplyExperience:0-1 yearsLevel:IntermediateTotal Positions:2Job Type:full-timeSalary:Rs.15000- Rs.50000Education:Bachelor DegreeLocation:Bhaktapur, NepalApply Before:2020-11-15Skills and KnowledgeExperience in parallel and multithreaded programming.Knowledge of algorithms and data structures.Interest in achieving maximum performance from available hardware and software.Familiar with design patterns.UI Development Skills (JavaFx, JavaScript, CSS, HTML, jQuery).Hands-on knowledge on Spring Framework.Strong knowledge of Relational Databases, SQL, and ORM technologies.Experience working with source control systems, such as Subversion, and GIT including branching and merging strategies.Essential technologyJavaEE \uff0b GlassFish3TypeScriptJavaScriptMariDBExperienced and desirable technologyNode.JSAngularExperience using GitSpling BootContainer knowledge such as DockerKnowledge that can design Class and InterfaceCSSHTMLJavaJQueryOOPApply",
        "Page_URL": "https://kathmandujobs.com/jobs/25806/full-stack-java-developer-job-in-bhaktapur"
    },
    {
        "name": "Assitant PTE Tutor",
        "company": "Ombryo Lab Pvt. Ltd.",
        "vacancy": "1",
        "time": "full-time",
        "address": "Kathmandu, Nepal",
        "deadline": "2020-11-30",
        "education": "Bachelor Degree",
        "experience": "1-2 years",
        "level": "Intermediate",
        "salary": "Negotiable",
        "desct": "Assitant PTE TutorOmbryo Lab Pvt. Ltd.ApplyExperience:1-2 yearsLevel:IntermediateTotal Positions:1Job Type:full-timeSalary:NegotiableEducation:Bachelor DegreeLocation:Kathmandu, NepalApply Before:2020-11-30Requirement:Should have completed Bachelor\u2019s DegreeMinimum of 1 year experience in teaching PTE/IELTSShould have very good fluency in speaking and writing in English.Carry out the task given with diligenceHave to have good team spirit\u27a4 Responsibilities:\u270eWorking hours: 7 am to 3 pm (Should be flexible in timings)\u270eWorking Modality: Work from home. Everything required to do the job like the computer etc. will be providedShould have very good fluency in speaking and writing in English.Carry out the task given with diligenceHave to have good team spiritApply",
        "Page_URL": "https://kathmandujobs.com/jobs/25805/assitant-pte-tutor-job-in-kathmandu"
    },
    {
        "name": "Full Stack Developer Node.js / Vue.js - Senior Level",
        "company": "Outsource Array P. Ltd.",
        "vacancy": "2",
        "time": "full-time",
        "address": "Kathmandu, Nepal",
        "deadline": "2020-11-20",
        "education": "Bachelor Degree",
        "experience": "2-5 years",
        "level": "Expert",
        "salary": "Negotiable",
        "desct": "Full Stack Developer Node.js / Vue.js - Senior LevelOutsource Array P. Ltd.ApplyExperience:2-5 yearsLevel:ExpertTotal Positions:2Job Type:full-timeSalary:NegotiableEducation:Bachelor DegreeLocation:Kathmandu, NepalApply Before:2020-11-20We are looking for Full Stack developers who need to be able to work on a weekly release schedule, with online demos and a minimal SCRUM routine.Need to be experts at REST webservice, Node.js and/or Vue.js.Our technology stack is:Backend webservices: on Node.js, Postgresql, Docker, Assorted AWS managed services, OAuth2.Front-end: Vue.js, bootstrap.Applications can be made online here or send us your CVs to:[email\u00a0protected]REST webserviceNode.js and/or Vue.jsApply",
        "Page_URL": "https://kathmandujobs.com/jobs/25804/full-stack-developer-nodejs-vuejs-senior-level-job-in-kathmandu"
    },
    {
        "name": "UI/UX Designer",
        "company": "Ombryo Lab Pvt. Ltd.",
        "vacancy": "2",
        "time": "full-time",
        "address": "Kathmandu, Nepal",
        "deadline": "2020-12-02",
        "education": "Secondary Education Examination ( SEE)",
        "experience": "2-5 years",
        "level": "Intermediate",
        "salary": "Negotiable",
        "desct": "UI/UX DesignerOmbryo Lab Pvt. Ltd.ApplyExperience:2-5 yearsLevel:IntermediateTotal Positions:2Job Type:full-timeSalary:NegotiableEducation:Secondary Education Examination ( SEE)Location:Kathmandu, NepalApply Before:2020-12-02Job Duties and Responsibilities\u00d8 Collaborate with other team members and stakeholders of the project\u00d8 Gather and evaluate user requirements, in collaboration with product managers and engineers.\u00d8 Create customer journey maps to better understand customer\u2019s interactions with the business over time and across service channels and iterate the design to develop the best ever user experience.\u00d8 Illustrate design ideas using storyboards, process flows and sitemaps.\u00d8 Plan and Implement new designs and optimize existing user interface designs.\u00d8 Develop technical and business requirements and always strive to deliver intuitive and user-centered solutions\u00d8 Combine creativity with an awareness of the design elements\u00d8 Create prototypes for new product ideas\u00d8 Test new ideas before implementing\u00d8 Conduct an ongoing user research\u00d8 Be prepared to constantly be asked to try new things, and pushed to continuously improve.\u00a7 Required Technical and Professional Expertise\u00d8 Bachelor\u2019s degree in relevant field\u00d8 Excellent interpersonal and communication skills\u00d8 Research Oriented\u00d8 Critical Thinker\u00d8 Some knowledge of Usability Factors in Human Computer Interaction\u00d8 Must have a solid UI Design Portfolio\u00d8 Should possess creativity and innovativeness\u00d8 Must be a team player\u00d8 Must be able to work in fast paced startup working culture\u00d8 Must be able to navigate complicated processes with many users, and convey information in an understandable way to themProficient in HTML and CSSDeep Understanding of cutting edge latest UI/UX trends.Excellent knowledge about user interfacebrowser compatibility and Web 2.0Ability to breakdown complex interaction to simpleelegant and straightforward user interactions and experiences.Apply",
        "Page_URL": "https://kathmandujobs.com/jobs/25803/uiux-designer-job-in-kathmandu"
    },
    {
        "name": "Inside Sales Executive",
        "company": "Codavatar Tech Private Limited",
        "vacancy": "8",
        "time": "full-time",
        "address": "Kathmandu, Nepal",
        "deadline": "2020-11-10",
        "education": "Secondary Education Examination ( SEE)",
        "experience": "2-5 years",
        "level": "Intermediate",
        "salary": "Rs.40000- Rs.40000",
        "desct": "Inside Sales ExecutiveCodavatar Tech Private LimitedApplyExperience:2-5 yearsLevel:IntermediateTotal Positions:8Job Type:full-timeSalary:Rs.40000- Rs.40000Education:Secondary Education Examination ( SEE)Location:Kathmandu, NepalApply Before:2020-11-10Responsibilities:1. Performance inside sales (Remote selling model) for B2B Saas products (IT Products).2. Good communication skills. Good command on English language.3. Good presentation skills (Having skill to provide online demo)4. Having knowledge of various inside sales tool to generate lead.5. Having co-ordination skill to do co-ordination with the team members for decision making.6. Schedule online demonstration with customer.What is in store for you?1. An opportunity to define, lead and co-ordinate the entire sales of the product.2. Work in a fast-paced start up environmentReach usIf you think this role is aligned with your career, kindly write me an email along with your updated CV on[email\u00a0protected]for a confidential discussion on the role.Good communication skills. Good command on English language.Apply",
        "Page_URL": "https://kathmandujobs.com/jobs/25802/inside-sales-executive-job-in-kathmandu"
    },
    {
        "name": "Mid Level Python Developer",
        "company": "Codavatar Tech Private Limited",
        "vacancy": "3",
        "time": "full-time",
        "address": "Kathmandu, Nepal",
        "deadline": "2020-11-30",
        "education": "Secondary Education Examination ( SEE)",
        "experience": "2-5 years",
        "level": "Intermediate",
        "salary": "Negotiable",
        "desct": "Mid Level Python DeveloperCodavatar Tech Private LimitedApplyExperience:2-5 yearsLevel:IntermediateTotal Positions:3Job Type:full-timeSalary:NegotiableEducation:Secondary Education Examination ( SEE)Location:Kathmandu, NepalApply Before:2020-11-30\u00d8Knowledge of object-oriented programming\u00d8 Experience with Python Flask or Django\u00d8 Experience with MySQL/PostgreSQL\u00d8 Agile/Scrum experience and communication skills\u00d8 Basic understanding of HTML5, CSS and Javascript\u00d8 Familiarity with regular expressions\u00d8 Experience with writing Unit test cases\u00d8 Familiar with Pylint and PEP 8 Python development style guide????Additional experience will be plus\u2705\u00a0VueJS/React/Angular\u2705\u00a0AWS\u2705\u00a0Gitflow\u2705\u00a0Docker\u2705\u00a0Experience in third party API integrationsAgile/Scrum experience and communication skillsKnowledge of object-oriented programmingExperience with Python Flask or DjangoExperience with MySQL/PostgreSQLApply",
        "Page_URL": "https://kathmandujobs.com/jobs/25801/mid-level-python-developer-job-in-kathmandu"
    },
    {
        "name": "Senior Laravel & Vue/React Js Developer",
        "company": "Gamenic Nalamiz Tech",
        "vacancy": "3",
        "time": "full-time",
        "address": "Bhaktapur, Nepal",
        "deadline": "2020-11-10",
        "education": "Bachelor Degree",
        "experience": "1-2 years",
        "level": "Expert",
        "salary": "Rs.20000- Rs.200000",
        "desct": "Senior Laravel & Vue/React Js DeveloperGamenic Nalamiz TechApplyExperience:1-2 yearsLevel:ExpertTotal Positions:3Job Type:full-timeSalary:Rs.20000- Rs.200000Education:Bachelor DegreeLocation:Bhaktapur, NepalApply Before:2020-11-10We are a Japanese based IT Company and also have our branch in Bhaktapur called Gamenic Nalamiz Tech. We are looking for a PHP (Laravel/Vuejs) Developer responsible for managing back-end services and the interchange of data between the server and the users and to build new features and maintain our existing business systems. You would be working on PHP, Laravel, VueJs,HTML, and CSS.Requirements:\u2013 Sound knowledge in Php based frameworks like Laravel.\u2013 Experience with front end technology like VueJs, ReactJs, AngularJs, HTML5, CSS3.\u2013 Experience in Datastores like Mysql, Redis.Responsibilities:\u2013 Write clean, secure, test-driven, easily maintainable, and modular codes.\u2013 Database designing and maintenance.\u2013 Build reusable code and libraries for future use.\u2013 Troubleshoot and debug applications.\u2013 Perform UI/backend tests to optimize performance.\u2013 Collaborate and work with frontend and mobile app developers on the backend needs of projects.LaravelVuejsReact JsHTMLCSSApply",
        "Page_URL": "https://kathmandujobs.com/jobs/25800/senior-laravel-vuereact-js-developer-job-in-bhaktapur"
    },
    {
        "name": "Jr. iOS Developer",
        "company": "Ensue Nepal Pvt. Ltd",
        "vacancy": "1",
        "time": "full-time",
        "address": "Kathmandu, Nepal",
        "deadline": "2020-11-21",
        "education": "Secondary Education Examination ( SEE)",
        "experience": "0-1 years",
        "level": "Intermediate",
        "salary": "Rs.35000- Rs.55000",
        "desct": "Jr. iOS DeveloperEnsue Nepal Pvt. LtdApplyExperience:0-1 yearsLevel:IntermediateTotal Positions:1Job Type:full-timeSalary:Rs.35000- Rs.55000Education:Secondary Education Examination ( SEE)Location:Kathmandu, NepalApply Before:2020-11-21We are looking for an enthusiastic\u00a0 iOS developer who will be responsible for helping develop iOS applications. You will be helping develop applications and their integration with back-end services.Basic understanding of software design patterns and design patterns incorporated in iOS apps is required.RequirementsProficient with SwiftKnowledge of iOS frameworks such as Core Data, Core Animation, etc.Knowledge with offline storage, threading, and performance tuningFamiliarity with RESTful APIs to connect iOS applications to back-end servicesKnowledge of other web technologies and UI/UX standardsExperience with performance and memory tuning with tools such as InstrumentsFamiliarity with cloud message APIs and push notificationsFine knowledge of design principles and interface guidelinesGood understanding of GitTDDResponsibilitiesWriting scalable, robust, testable, efficient, and easily maintainable codeEnsure the performance, quality, and responsiveness of applicationsCollaborate with a team to define, design, and ship new featuresIdentify and correct bottlenecks and fix bugsiOSGitSwiftObjective - CApply",
        "Page_URL": "https://kathmandujobs.com/jobs/25799/jr-ios-developer-job-in-kathmandu"
    },
    {
        "name": "Sr. Android Developer",
        "company": "Ensue Nepal Pvt. Ltd",
        "vacancy": "1",
        "time": "full-time",
        "address": "Kathmandu, Nepal",
        "deadline": "2020-11-21",
        "education": "Secondary Education Examination ( SEE)",
        "experience": "2-5 years",
        "level": "Expert",
        "salary": "Rs.80000- Rs.120000",
        "desct": "Sr. Android DeveloperEnsue Nepal Pvt. LtdApplyExperience:2-5 yearsLevel:ExpertTotal Positions:1Job Type:full-timeSalary:Rs.80000- Rs.120000Education:Secondary Education Examination ( SEE)Location:Kathmandu, NepalApply Before:2020-11-21At Ensue, we believe in growing and learning together. We strive to be nimble problem-solvers and proud builder.We are looking for an experienced Android app developer, with a very good grasp of Java / Kotlin to join our exceptional team. In-depth hands-on knowledge of OOP and software design patterns with 2 years experience is a must. Along with that, the candidate should be well versed in software architecture and quality of code.RequirementAt least 2 years of experience in android app developmentStrong coding and analytical skillsVery good understanding of OOP, design patterns and SOLID principlesVery strong knowledge of android design principles and design guidelinesExperienced in multi-threading and performance tuningShould have knowledge of RESTful web servicesVery good understanding of android app life-cycleExperienced in SQL LiteStrong knowledge of MVC, MVVMKnowledge of unit testingFamiliarity with CI/CDKnowledge of firebase.Sound knowledge of GITHave published at least one App in PlaystoreSelf-motivated and a team playerAndroidRESTful APIGitApply",
        "Page_URL": "https://kathmandujobs.com/jobs/25798/sr-android-developer-job-in-kathmandu"
    },
    {
        "name": "Backend Developer in PHP",
        "company": "Ensue Nepal Pvt. Ltd",
        "vacancy": "2",
        "time": "full-time",
        "address": "Kathmandu, Nepal",
        "deadline": "2020-11-21",
        "education": "Bachelor Degree",
        "experience": "1-2 years",
        "level": "Intermediate",
        "salary": "Rs.40000- Rs.60000",
        "desct": "Backend Developer in PHPEnsue Nepal Pvt. LtdApplyExperience:1-2 yearsLevel:IntermediateTotal Positions:2Job Type:full-timeSalary:Rs.40000- Rs.60000Education:Bachelor DegreeLocation:Kathmandu, NepalApply Before:2020-11-21We are looking for an enthusiastic PHP developer. With a technical background, some years of experience and self-motivated mindset \u2013 you are our ideal candidate. You will be working on projects with a highly experienced team. Our clients and projects are primarily US based.Being a part of our fast-paced team you will experienceFast and Efficient learning and research methodsProject managementDifferent Development tools and methodologiesJob RequirementMust have experience of 1 year or more in the field of PHP based web developmentFamiliarity with PHP frameworks - preferably LaravelFamiliarity with Version control systemMust have good knowledge of OOPMust have good understanding of RESTful APIMust have knowledge of Software design patterns is preferred.Must have good communication skillsMust be self motivatedHTMLCSSMySQLPHPLaravelApply",
        "Page_URL": "https://kathmandujobs.com/jobs/25797/backend-developer-in-php-job-in-kathmandu"
    },
    {
        "name": "Mid Level Frontend Web Developer",
        "company": "Ensue Nepal Pvt. Ltd",
        "vacancy": "1",
        "time": "full-time",
        "address": "Kathmandu, Nepal",
        "deadline": "2020-11-21",
        "education": "Bachelor Degree",
        "experience": "1-2 years",
        "level": "Intermediate",
        "salary": "Rs.30000- Rs.60000",
        "desct": "Mid Level Frontend Web DeveloperEnsue Nepal Pvt. LtdApplyExperience:1-2 yearsLevel:IntermediateTotal Positions:1Job Type:full-timeSalary:Rs.30000- Rs.60000Education:Bachelor DegreeLocation:Kathmandu, NepalApply Before:2020-11-21Job DescriptionAt Ensue we believe in growing and learning together. We strive to be nimble problem solvers and proud builders.We are looking for an experienced Front-end developer, with very good grasp of javascript, to join our exceptional team. In depth hands on knowledge of OOP in javascript and software design patterns with 2+ years experience is a must. Along with that, candidate should be well versed in software architecture, software design patterns and quality of code.Job RequirementsMust have 1 years of web development experienceStrong experience in developing rich client functionality with good knowledge of JavascriptExperience in at least one of the javascript frameworks: Angular/AngularJS and ReactJSExperience with RESTful APIs to connect with backend web servicesExcellent HTML, CSS and cross-browser layout skills and knowledgePassion for developing, releasing and maintaining a large-scale web applicationExperienced with version control tool such as GitlabAble to give keen attention to detail and ability to build scalable and flexible softwareComfortable working with a teamGood ability to solve a problemConfidence in learning new languages and platformResponsibilitiesHands on development and testingProduction supportCreate flexible, reusable and pluggable software components.Identify new technologies that improve product development and end user experience.JavascriptAngular or any other javascript framework/libraryApply",
        "Page_URL": "https://kathmandujobs.com/jobs/25796/mid-level-frontend-web-developer-job-in-kathmandu"
    },
    {
        "name": "Senior Graphic Designer",
        "company": "Swivt Technologies",
        "vacancy": "1",
        "time": "full-time",
        "address": "Kathmandu, Nepal",
        "deadline": "2020-11-30",
        "education": "Higher Secondary Level (+2)",
        "experience": "2-5 years",
        "level": "Expert",
        "salary": "Rs.30000- Rs.700000",
        "desct": "Senior Graphic DesignerSwivt TechnologiesApplyExperience:2-5 yearsLevel:ExpertTotal Positions:1Job Type:full-timeSalary:Rs.30000- Rs.700000Education:Higher Secondary Level (+2)Location:Kathmandu, NepalApply Before:2020-11-30As a Senior Designer at Swivt Technologies, you are required to have an educated design sense, creative flair, keen interest and ability to deliver effective design solutions that are aligned with the creative vision. You are expected to have passion for conceptualising creative solutions, and an in-depth understanding of market tools, trends and touch-points. You will also initiate and facilitate the growth of your juniors and assist them in creating design solutions that are rationalised and justified. You will take responsibility in assisting in the development big ideas for projects. You should be capable in shaping visual aspects of online and offline media, as well as the ability to execute deliverables that adhere to a concept that solves a creative problem for the client that is on brand.Job responsibilities.Heavily involved in design projects from concept to completion, applying design principles and techniquesPitch and execute creative ideas that solves creative problemsProducing establish sketches, mockups, decks and engaging design solutionsReceive and provide feedback from and to team members to hone skills and improve designResponsible for creating design solutions that have a high visual impactUnderstand briefs and client\u2019s requirements and offer solutions to creative problemsTranslate requirements into highly engaging and attractive design conceptsEffectively conceptualise, design and create high quality visuals in a variety of formatsUse various techniques to create design solutionsDevelop and maintain cohesive work relationship with key stakeholdersAble to work independently respecting multiple deadlinesPaying close attention to detail and grasp project needs and assist in translating that with the teamQualifications.4 - 5 years of relevant work experience in creative or marketing agencies or similar relevant experiences from similar fieldsBachelor degree in graphic design, visual communication, web design, or related fields of study.Well established knowledge in visual design principles, information design, typography, colour theory, imagery, iconography and layout design.High Proficiency with Adobe Creative Suite programs, specifically Illustrator, Photoshop and InDesign, additional skills in other programs are appreciated.Design portfolio that\u2019s innovative, reflects current design trends and showcases design solutions that demonstrate an in-depth understanding of different markets.Salary and benefits will commensurate with qualifications and experiences.Candidates with less experiences will be considered as DesignerIf you wish to apply for this position, please attach your r\u00e9sum\u00e9, portfolio and expected salary to[email\u00a0protected]PhotoshopXDSketchApply",
        "Page_URL": "https://kathmandujobs.com/jobs/25795/senior-graphic-designer-job-in-kathmandu"
    },
    {
        "name": "App Developer",
        "company": "Medic Mobile",
        "vacancy": "1",
        "time": "full-time",
        "address": "Kathmandu, Nepal",
        "deadline": "2020-10-31",
        "education": "Bachelor Degree",
        "experience": "2-5 years",
        "level": "Intermediate",
        "salary": "Negotiable",
        "desct": "App DeveloperMedic MobileApplyExperience:2-5 yearsLevel:IntermediateTotal Positions:1Job Type:full-timeSalary:NegotiableEducation:Bachelor DegreeLocation:Kathmandu, NepalApply Before:2020-10-31About Medic MobileMedic Mobile is a 501(c)(3) nonprofit organization founded in 2010 to advance health and human flourishing with and for the hardest-to-reach communities. We envision a more just world in which health workers are supported as they provide care for their neighbors, universal health coverage is a reality, and health is a secured human right. Practically, we have advanced our mission by building, implementing, and supporting open-source digital tools that support Community Health Workers, managers, and facility-based health workers. Along with our partners, we build and apply software that helps health workers deliver high-quality, equitable care in redesigned health systems. Our team and partners support more than 28,000 frontline health workers caring for an estimated 15 million people in 18 countries across Africa and Asia.Each member of our team was drawn to this mission and emboldened by a vision of global health equity. Our diversity of skills and experiences helps us tackle complex challenges \u2013 we look forward to hearing from you and exploring ways to work together.We are searching for an App Developer to contribute to our team, mission, and impact. This is a unique opportunity to bring together your passion for global health and technology, and working at the grassroots level. As\u00a0 App Developer, you will manage project app development. We believe that the technologies, work environments, and approaches to global health and development you've experienced in the past, and have mastered in-depth will be useful to further build Medic\u2019s tools and technology. We expect that you are a quick learner and equally quick to adapt to new and changing technologies. You will work closely with design and project teams.Key ResponsibilitiesManage project technical development/configurations: Work alongside partnerships leads, project managers, and designers to define scope, design, write technical specifications, and build public health applicationsDevelop internal and partner-facing interactive data visualizations. Work with designers and project managers to ensure that dashboard designs are feasible within the Medic Mobile Analytics platformContribute to and maintain a growing codebase of JavaScript, JSON configuration, technical documentation, and interactive data visualizations.Conduct functional and unit testing on all developed code and scripts in line with testing frameworks to ensure conformance with defined requirements.Manage client timelines, monitor usage of the platform, and any relevant software costs for invoicing purposes to foster strong relationships with partners.Support end-users and stakeholders (internal and external) on any arising technology issues/bugs to resolve, escalate and resolve.Describe digital health needs and opportunities in your projects/region and propel these needs to be addressed in Medic Mobile\u2019s current tool kit or product roadmapSupport in proposal writing, publications, present Medic Mobile in meetings, seminars, summits & forums when called upon to do so.Skills Knowledge & ExpertiseBachelor's degree in Computer Science or equivalent.3+ years of progressive experience in similar roles with demonstrated technical leadership.Strong command of written and spoken English.Proficient in Javascript or other programming languages.Proficient with relational databases, Postgres or MySQLExperience with data analysis and data visualization languages R/Matlab/Python would be of benefitHave experience using command-line tools on Linux (preferred) or another UNIX-like operating system.Be committed to frequent and timely communication, both in-person and online (via email, Slack, and other online chat applications).Have an interest in working with and learning from a globally distributed team of mHealth technology experts.Have good communication and interpersonal skills with the ability to pass on information clearly to users and to grasp difficulties perceived by users.Strong user support orientation with an attitude of wanting to assist people and pass-on their knowledge and experience to others establishing a good working relationship with users/partners.Ability to work under high pressure, meet deadlines, monitor, and follow-up on pending matters under minimum supervision.Additional SkillsBe familiar with Android SDK, NoSQL databases.Project work experience with open source technology.Good logical diagnostic skills and ability to exercise good judgment in the resolution of problems.Fluency in other languages would be nice to have e.g French, Swahili.APPLY NOWExperience with data analysis and data visualization languages R/Matlab/Python would be of benefitApply",
        "Page_URL": "https://kathmandujobs.com/jobs/25794/app-developer-job-in-kathmandu"
    },
    {
        "name": "Software Engineer, Ruby on Rails, ReactJS",
        "company": "Truemark Technology",
        "vacancy": "1",
        "time": "full-time",
        "address": "Kathmandu, Nepal",
        "deadline": "2020-11-20",
        "education": "Bachelor Degree",
        "experience": "1-2 years",
        "level": "Intermediate",
        "salary": "Negotiable",
        "desct": "Software Engineer, Ruby on Rails, ReactJSTruemark TechnologyApplyExperience:1-2 yearsLevel:IntermediateTotal Positions:1Job Type:full-timeSalary:NegotiableEducation:Bachelor DegreeLocation:Kathmandu, NepalApply Before:2020-11-20Job DescriptionAnalysis, design, development, deployment, and maintenance of projects with minimal supervision.Write modular, reusable, and top quality code, code reviews, and implementation of best practices.Create and maintain technical documentation. Share knowledge within the team andactively participate in the code review process.Involve in Continuous research and learning; discover, evaluate, and implement new technologies to maximize development efficiency.SkillsGraduate in Computer Engineering or similar IT background or equivalent practical experience.At least 1.5 year of professional experience in Software development.Demonstrable experience with Ruby, Ruby on Rails, Reactjs.Experienced with databases like MySQL, PostgreSQL, and ORM (Object Relational Mapper) libraries.Knowledge of AWS ecosystem or similar cloud-based provider developing scalable websites/services.Hands-on experience in developing, releasing, and maintaining software applications.RenumerationSalary based on skills and qualificationsAnnual leave and sick leave as per labor lawsYou can also drop your cv at:[email\u00a0protected]reactjsruby on railsApply",
        "Page_URL": "https://kathmandujobs.com/jobs/25793/software-engineer-ruby-on-rails-reactjs-job-in-kathmandu"
    },
    {
        "name": "Mobile App developer",
        "company": "Claudemill Technology Pvt. Ltd.",
        "vacancy": "1",
        "time": "full-time",
        "address": "Bhaktapur, Nepal",
        "deadline": "2020-11-30",
        "education": "Bachelor Degree",
        "experience": "1-2 years",
        "level": "Intermediate",
        "salary": "Negotiable",
        "desct": "Mobile App developerClaudemill Technology Pvt. Ltd.ApplyExperience:1-2 yearsLevel:IntermediateTotal Positions:1Job Type:full-timeSalary:NegotiableEducation:Bachelor DegreeLocation:Bhaktapur, NepalApply Before:2020-11-30Experience using version control systems like GitIn lieu of formal tertiary qualifications, relevant work experience and formal training will be considered.2+ years mobile development experience utilizing a range of modern technologiesExperience working in a software development teamExperience building, testing and deploying mobile applications in both iOS and Android ( Flutter or React Native is Preferred)Comfortable working with ES6 JS Libraries (Vue.js / React.js)Confident\u00a0with modern Javascript build tools, eg Node & Webpack, reactProficiency and accuracy in scoping development timelinesExperience designing creative and unique mobile app flowsExperience in working with multi disciplinary, agile teamExperience using design patternsReact Native/FlutterFirebaseAPIsAgile MethodologyDesign PatternApply",
        "Page_URL": "https://kathmandujobs.com/jobs/25792/mobile-app-developer-job-in-bhaktapur"
    },
    {
        "name": "Mid-level PHP Software Engineer",
        "company": "Claudemill Technology Pvt. Ltd.",
        "vacancy": "1",
        "time": "full-time",
        "address": "Bhaktapur, Nepal",
        "deadline": "2020-11-30",
        "education": "Bachelor Degree",
        "experience": "1-2 years",
        "level": "Intermediate",
        "salary": "Negotiable",
        "desct": "Mid-level PHP Software EngineerClaudemill Technology Pvt. Ltd.ApplyExperience:1-2 yearsLevel:IntermediateTotal Positions:1Job Type:full-timeSalary:NegotiableEducation:Bachelor DegreeLocation:Bhaktapur, NepalApply Before:2020-11-30An IT (computer programming) related degree and minimum 2 years digital agency experienceAdvanced knowledge of WordPress / WooCommerce / CMS (knowledge of hooks & custom WP dev)Advanced knowledge in JavaScript and related frameworksAdvanced knowledge of databases and SQLUnderstanding of PHP frameworks such as LaravelStrong understanding of HTML / CSS / JavaScriptStrong understanding of computer programming principles / git and version controlGood understanding of database design and SQLGood understanding of Sketch / Adobe Creative SuiteA genuine passion for web development (provide links to side projects if any)Good communication skills (a willingness to speak to clients a bonus)Familier with API for Mobile appsPHPReactNodeLaravel FrameworkWordpressCMSAPIAgile MethodologyVersion ControlApply",
        "Page_URL": "https://kathmandujobs.com/jobs/25791/midlevel-php-software-engineer-job-in-bhaktapur"
    },
    {
        "name": "Frontend Developer",
        "company": "Empathy IT Club",
        "vacancy": "1",
        "time": "full-time",
        "address": "Kathmandu, Nepal",
        "deadline": "2020-10-20",
        "education": "Bachelor Degree",
        "experience": "2-5 years",
        "level": "Expert",
        "salary": "Rs.70000- Rs.100000",
        "desct": "Frontend DeveloperEmpathy IT ClubApplyExperience:2-5 yearsLevel:ExpertTotal Positions:1Job Type:full-timeSalary:Rs.70000- Rs.100000Education:Bachelor DegreeLocation:Kathmandu, NepalApply Before:2020-10-20We are looking for programmers with a keen eye for design for the position of Front End Developer. Front end Developers are responsible for ensuring the alignment of web design and user experience requirements, optimizing web pages for maximum efficiency and maintaining brand consistency across all web pages, among other duties.Front End Developers are required to work in teams alongside Back end Developers, Graphic Designers and User Experience Designers to ensure all elements of web creation are consistent. This requires excellent communication and interpersonal skills.HtmlCssJavaScript and able to work in any Frontend FrameworkApply",
        "Page_URL": "https://kathmandujobs.com/jobs/25790/frontend-developer-job-in-kathmandu"
    },
    {
        "name": "Software QA Engineer",
        "company": "Swivt Technologies",
        "vacancy": "1",
        "time": "full-time",
        "address": "Kathmandu, Nepal",
        "deadline": "2020-10-31",
        "education": "Bachelor Degree",
        "experience": "2-5 years",
        "level": "Expert",
        "salary": "Rs.35000- Rs.70000",
        "desct": "Software QA EngineerSwivt TechnologiesApplyExperience:2-5 yearsLevel:ExpertTotal Positions:1Job Type:full-timeSalary:Rs.35000- Rs.70000Education:Bachelor DegreeLocation:Kathmandu, NepalApply Before:2020-10-31Requirements:\u2013 Lead the test strategy and test process of all testing activities across the platforms.\u2013 Lead the test project management and manage the test environment, test process, and test team resources.\u2013 Develop and build test strategies for testing and system assurance under an Agile and Scrum environment.\u2013 Manager Agile sprints and support rapid iteration and development through Test-Driven Development / Behaviour-Driven Development.\u2013 Manage and oversight the test plans, test scripts, test reports. Translate user expectations\u2013 Lead the testing function in the development division and drive testing governance plan for best practices.\u2013 Manage the testing resources, ensure the test quality and output is fulfill the overall requirements.Responsibilities:\u2013 Strong leadership experience in leading a sizeable testing function.\u2013 Senior management experience in leading teams and building relationships with senior management.\u2013 Experience with Agile, Scrum and/or Lean principles and practices.\u2013 Experience in Test Driven Development (TDD), and Behavior Driven Development (BDD) is a great plus.\u2013 Experience with at least one hybrid automation modern test framework.\u2013 Experience with ALM tools like JIRA, HP-ALM, MS-TFS, and test automation\u2013 Experience in testing tools including Cucumber and JBehave is a great plus.\u2013 Strong knowledge of the Software Development Life Cycle with expertise in QA processes and methodology, specifically in Agile.\u2013 Experience with various test methods, tools, and toolkits: Functional, Automated, Performance\u2013 Strong working experience in a DevOps / CICD environment.\u2013 Excellent communication skills in English.\u2013 Bachelor degree from a reputed UniversityZestGit version ControlDevOpsReact.JsNode.jSApply",
        "Page_URL": "https://kathmandujobs.com/jobs/25789/software-qa-engineer-job-in-kathmandu"
    },
    {
        "name": "SEO Expert",
        "company": "Swivt Technologies",
        "vacancy": "1",
        "time": "full-time",
        "address": "Kathmandu, Nepal",
        "deadline": "2020-10-31",
        "education": "Secondary Education Examination ( SEE)",
        "experience": "2-5 years",
        "level": "Expert",
        "salary": "Rs.35000- Rs.70000",
        "desct": "SEO ExpertSwivt TechnologiesApplyExperience:2-5 yearsLevel:ExpertTotal Positions:1Job Type:full-timeSalary:Rs.35000- Rs.70000Education:Secondary Education Examination ( SEE)Location:Kathmandu, NepalApply Before:2020-10-31Responsibilities:Work with a team of digital marketing experts covering 8 countries to support the SEO growth opportunities to support growing organic traffic across search enginesHelp set up the roadmap for SEO best practices to maximise search engine optimisationDevelop insights through performance analysis and make recommendations to guide decision makingConduct a site audit and follow up on-site issues with the technical data teamsPartner with product and data team and own the delivery of SEO product and technical prioritiesDevelop strategic and exclusive partnerships to broaden online audience reachRequirements:5+ years of experience in online marketing / SEO within a B2C environmentTrack record of exceeding aggressive growth targets and leading SEO projectsExpert in Google Analytics, SEMRush, keyword research, performance optimisation, Tag, and familiar with leading SEO toolsFluent in English writing and verbal.Must be a data-driven and detail-oriented with problem-solving skillsStrong team player with excellent organisation and time management abilityLoves using and analysing data to perform high quality resultsGoogle AnalyticsBling Webmasterbacklinksmeta TagsApply",
        "Page_URL": "https://kathmandujobs.com/jobs/25788/seo-expert-job-in-kathmandu"
    },
    {
        "name": "Social Media Manager",
        "company": "leckr",
        "vacancy": "1",
        "time": "full-time",
        "address": "Kathmandu, Nepal",
        "deadline": "2021-01-01",
        "education": "Secondary Education Examination ( SEE)",
        "experience": "0-1 years",
        "level": "Beginner",
        "salary": "Rs.10000- Rs.35000",
        "desct": "Social Media ManagerleckrApplyExperience:0-1 yearsLevel:BeginnerTotal Positions:1Job Type:full-timeSalary:Rs.10000- Rs.35000Education:Secondary Education Examination ( SEE)Location:Kathmandu, NepalApply Before:2021-01-01Hi,I have a couple of Instagram accounts that I'd like to grow.@eatcodekiterepeat@techtribe_ecovillage@kitelightretreats@himalayapreneurs@backpacking_tribeI'd like to generate as many followers as possible in order to generate traffic to my website. I'd like to find someone that understands the niche and knows who to target.When applying, let me know what you think about each account and what your growth strategy would be.instagramFacebookApply",
        "Page_URL": "https://kathmandujobs.com/jobs/25786/social-media-manager-job-in-kathmandu"
    },
    {
        "name": "React Developer",
        "company": "TechDurbar",
        "vacancy": "1",
        "time": "full-time",
        "address": "Kathmandu, Nepal",
        "deadline": "2020-11-09",
        "education": "Others",
        "experience": "1-2 years",
        "level": "Intermediate",
        "salary": "Negotiable",
        "desct": "React DeveloperTechDurbarApplyExperience:1-2 yearsLevel:IntermediateTotal Positions:1Job Type:full-timeSalary:NegotiableEducation:OthersLocation:Kathmandu, NepalApply Before:2020-11-09Required Qualifications, Skills, and Knowledge:Thorough understanding of React.js and its core principlesExperience in user interface development including HTML, CSS, Javascript.Experience in Asynchronous programming.Understanding of functional components and hooks.Knowledge in GraphQL is a big plus.Proficient understanding of code versioning tools, such as Git.Working Conditions:Work from home.Working hours are Monday through Friday from 09:00 am \u2013 06:00 pm and Saturday and Sunday off. Additional time may be required to complete the above work or meet company objectives.React DeveloperApply",
        "Page_URL": "https://kathmandujobs.com/jobs/25785/react-developer-job-in-kathmandu"
    },
    {
        "name": "Mid Level Laravel & Vue/React Js Developer",
        "company": "Gamenic Nalamiz Tech",
        "vacancy": "4",
        "time": "full-time",
        "address": "Bhaktapur, Nepal",
        "deadline": "2020-10-23",
        "education": "Bachelor Degree",
        "experience": "0-1 years",
        "level": "Intermediate",
        "salary": "Rs.15000- Rs.100000",
        "desct": "Mid Level Laravel & Vue/React Js DeveloperGamenic Nalamiz TechApplyExperience:0-1 yearsLevel:IntermediateTotal Positions:4Job Type:full-timeSalary:Rs.15000- Rs.100000Education:Bachelor DegreeLocation:Bhaktapur, NepalApply Before:2020-10-23We are a Japanese based IT Company and also have our branch in Bhaktapur called Gamenic Nalamiz Tech. We are looking for a PHP (Laravel/Vuejs) Developer responsible for managing back-end services and the interchange of data between the server and the users and to build new features and maintain our existing business systems. You would be working on PHP, Laravel, VueJs,HTML, and CSS.Requirements:\u2013 Sound knowledge in Php based frameworks like Laravel.\u2013 Experience with front end technology like VueJs, ReactJs, AngularJs, HTML5, CSS3.\u2013 Experience in Datastores like Mysql, Redis.Responsibilities:\u2013 Write clean, secure, test-driven, easily maintainable, and modular codes.\u2013 Database designing and maintenance.\u2013 Build reusable code and libraries for future use.\u2013 Troubleshoot and debug applications.\u2013 Perform UI/backend tests to optimize performance.\u2013 Collaborate and work with frontend and mobile app developers on the backend needs of projects.LaravelVuejsReactjsHTMLCSSApply",
        "Page_URL": "https://kathmandujobs.com/jobs/25784/mid-level-laravel-vuereact-js-developer-job-in-bhaktapur"
    },
    {
        "name": "Digital Marketing Manager",
        "company": "Studydote Pvt. Ltd.",
        "vacancy": "1",
        "time": "full-time",
        "address": "Lalitpur, Nepal",
        "deadline": "2020-10-17",
        "education": "Higher Secondary Level (+2)",
        "experience": "1-2 years",
        "level": "Intermediate",
        "salary": "Negotiable",
        "desct": "Digital Marketing ManagerStudydote Pvt. Ltd.ApplyExperience:1-2 yearsLevel:IntermediateTotal Positions:1Job Type:full-timeSalary:NegotiableEducation:Higher Secondary Level (+2)Location:Lalitpur, NepalApply Before:2020-10-17Job Requirements:- Need to handle social medias, Facebook/Instagram posts & messages.- Experience with boosting ads is a plus.- Experience in graphics design.- Experience in editing videos for social media marketing.- Knowledge of Ms Office suites, Google docs.Digital MarketingGraphics DesignSocial MediaApply",
        "Page_URL": "https://kathmandujobs.com/jobs/25782/digital-marketing-manager-job-in-lalitpur"
    },
    {
        "name": "Mid Level Flutter Developer",
        "company": "ZenLab Pvt. Ltd.",
        "vacancy": "1",
        "time": "full-time",
        "address": "Kathmandu, Nepal",
        "deadline": "2020-10-06",
        "education": "Bachelor Degree",
        "experience": "1-2 years",
        "level": "Intermediate",
        "salary": "Rs.20000- Rs.30000",
        "desct": "Mid Level Flutter DeveloperZenLab Pvt. Ltd.ApplyExperience:1-2 yearsLevel:IntermediateTotal Positions:1Job Type:full-timeSalary:Rs.20000- Rs.30000Education:Bachelor DegreeLocation:Kathmandu, NepalApply Before:2020-10-06Good knowledge of Dart.Knowledge of native mobile application development.Knowledge of Version Control Tools.Knowledge of PMT.Great communication skills.Problem solving approach.Team player and capacity to work under pressure.DartFlutterMobile Application DevelopmentApply",
        "Page_URL": "https://kathmandujobs.com/jobs/25781/mid-level-flutter-developer-job-in-kathmandu"
    },
    {
        "name": "Backend Developer (NodeJS/Typescript)",
        "company": "Tekkon Technologies Pvt Ltd",
        "vacancy": "1",
        "time": "full-time",
        "address": "Kathmandu, Nepal",
        "deadline": "2020-10-19",
        "education": "Bachelor Degree",
        "experience": "2-5 years",
        "level": "Intermediate",
        "salary": "Negotiable",
        "desct": "Backend Developer (NodeJS/Typescript)Tekkon Technologies Pvt LtdApplyExperience:2-5 yearsLevel:IntermediateTotal Positions:1Job Type:full-timeSalary:NegotiableEducation:Bachelor DegreeLocation:Kathmandu, NepalApply Before:2020-10-19Are you an aspiring Backend developer looking for an opportunity to work in a great team and advance your skills and career? If you are an analytical problem solver with strong NodeJs, TypeScript, and GraphQL knowledge, having a passion for development and innovation, we have the perfect job for you!We are looking for a Backend Developer to join our fun, enthusiastic, dedicated, and energetic team who are running at full speed addressing the different business needs of international clients with technical solutions.Responsibilities:Creating and maintaining server-side application logic.Collaborate with front-end developers on combining their front-end elements and components with the server-side.Write high quality, readable, and testable code.Design and optimize applications for high performance, high availability, and low latency.Technical Qualifications:Have a strong understanding of Javascript and TypeScript.Good understanding of Node.js and the most common packages in the ecosystem (i.e. Express).Familiarity with GraphQL.Confident with asynchronous programming concepts and using them programmatically from Javascript.Working knowledge of node.js package management and the tools ecosystem (like npm, grunt).Ability to model and apply authorization and permission control between users, systems, and services.Knowledge of incorporating different data sources and databases and to deliver the optimal output to different client platforms (mobile vs web)Familiarity with creating scalable Node.js applications with microservices.Proficiency with relational databases and pragmatically modeling business processes through schema.Understanding of automated unit tests and testing platforms and how to implement and integrate them.Knowledge around Docker is a plus.Thorough knowledge of code versioning tools such as Git.Company Benefits:A friendly, competitive, and creative working environment with foreign managersCompetitive salary (No bar for deserving candidates)5 working days in a week(9 am \u2013 5:30 pm)Timely salary review and performance bonus facilitiesAccess to the paid learning materials (udemy)Working with the latest technologiesLunch provided in the office (Currently Work From Home)Paid leave, sick leaveRefreshment, Recreational, team building activities.JavaScriptTypeScriptNodeJSApply",
        "Page_URL": "https://kathmandujobs.com/jobs/25780/backend-developer-nodejstypescript-job-in-kathmandu"
    },
    {
        "name": "Laravel/Vuejs Developer",
        "company": "Gamenic Nalamiz Tech",
        "vacancy": "2",
        "time": "full-time",
        "address": "Kathmandu, Nepal",
        "deadline": "2020-10-20",
        "education": "Bachelor Degree",
        "experience": "0-1 years",
        "level": "Intermediate",
        "salary": "Rs.15000- Rs.100000",
        "desct": "Laravel/Vuejs DeveloperGamenic Nalamiz TechApplyExperience:0-1 yearsLevel:IntermediateTotal Positions:2Job Type:full-timeSalary:Rs.15000- Rs.100000Education:Bachelor DegreeLocation:Kathmandu, NepalApply Before:2020-10-20We are a Japanese based IT Company and also have our branch in Bhaktapur called Gamenic Nalamiz Tech . We are looking for a PHP (Laravel/Vuejs) Developer responsible for managing back-end services and the interchange of data between the server and the users and to build new features and maintain our existing business systems. You would be working on PHP, Laravel, VueJs,HTML and CSS.Requirements:\u2013 Sound knowledge in Php based frameworks like Laravel.\u2013 Experience with front end technology like VueJs, ReactJs, AngularJs, HTML5, CSS3.\u2013 Experience in Datastores like Mysql, Redis.Responsibilities:\u2013 Write clean, secure, test-driven, easily maintainable, and modular codes.\u2013 Database designing and maintenance.\u2013 Build reusable code and libraries for future use.\u2013 Troubleshoot and debug applications.\u2013 Perform UI/backend tests to optimize performance.\u2013 Collaborate and work with frontend and mobile app developers on the backend needs of projects.HTMLCSSLaravelVuejsWeb DevelopmentReactApply",
        "Page_URL": "https://kathmandujobs.com/jobs/25779/laravelvuejs-developer-job-in-kathmandu"
    },
    {
        "name": "Implementation engineer",
        "company": "e-digital Nepal Pvt. Ltd.",
        "vacancy": "1",
        "time": "full-time",
        "address": "Kathmandu, Nepal",
        "deadline": "2020-10-27",
        "education": "Bachelor Degree",
        "experience": "1-2 years",
        "level": "Intermediate",
        "salary": "Negotiable",
        "desct": "Implementation engineere-digital Nepal Pvt. Ltd.ApplyExperience:1-2 yearsLevel:IntermediateTotal Positions:1Job Type:full-timeSalary:NegotiableEducation:Bachelor DegreeLocation:Kathmandu, NepalApply Before:2020-10-27Key Duties and ResponsibilitiesConducting various experiments on the methods and procedures of implementation and design using the assistance of experimental instances, samples, and models and formulating and arranging written papers for the sameCollaborating with the administrator of the company in order to settle all the matters and solve all issues within the given timeInteracting with the administration of the company in order to report it with the delays in executing enforcement undertakings and operationsWorking with the enhancement and quality advancement unit of the company in order to develop and create new plans and strategies to be included in the customer enforcement tasksAdministrating interactions with his/her section in order to solve disputes among other associates working with him/herAiding the company associate or executive who is responsible for studying and examining the enforcement operations executed in the company, in handling and administrating information with respect to the manufacture and yield of the sameExecuting investigative operations on customer matters of the company and writing the results based on his/her findingsPutting specialized operations of the company into effect with the assistance of meta-information documented records that contain the details of the sameFormulating and upholding specialized and trade documented records and working with the customers and the information technology section of the company in order to give back-up to the systems and undertakings that are lagging behind or contain flaws and drawbacksSpecifying and forming a base of specialized task needs and upholding efficient and functional bonds with the customersArranging substances for their application in various task undertakings in the company and administrating their distribution in the sameHelping the customers to observe computer software package programming enforcement rotational series and helping in creating proper and functionally effective plans and programs for the software systems of the customersInstructing customer specialized working associates on various kinds of software and hardware matters that interfere with the routine functioning of the executives in the companyRecognizing problematic matters and errors in the already run or executed methods and procedures of the company and developing settlements for the sameEnsuring that the plans and programs designed for enhancing the company are enforced with compliance with the rules, standard regulations, and policies of the sameDeveloping, enhancing, preparing, and backing up the specialized and scientific side of the company to benefit itTalking to customers and helping them with upholding their systems, inductions, and other connectionsCompleting all other responsibilities, roles, tasks, duties, and jobs of an implementation engineer that require his/her willingness and supervisionRecognizing problematic matters and errors in the already run or executed methodsApply",
        "Page_URL": "https://kathmandujobs.com/jobs/25776/implementation-engineer-job-in-kathmandu"
    },
    {
        "name": "Quality Assurance Engineer",
        "company": "e-digital Nepal Pvt. Ltd.",
        "vacancy": "1",
        "time": "full-time",
        "address": "Kathmandu, Nepal",
        "deadline": "2020-10-27",
        "education": "Bachelor Degree",
        "experience": "1-2 years",
        "level": "Intermediate",
        "salary": "Negotiable",
        "desct": "Quality Assurance Engineere-digital Nepal Pvt. Ltd.ApplyExperience:1-2 yearsLevel:IntermediateTotal Positions:1Job Type:full-timeSalary:NegotiableEducation:Bachelor DegreeLocation:Kathmandu, NepalApply Before:2020-10-27ResponsibilitiesReview requirements, specifications, and technical design documents to provide timely and meaningful feedbackCreate detailed, comprehensive, and well-structured test plans and test casesEstimate, prioritize, plan and coordinate testing activitiesDesign, develop and execute automation scripts using open source toolsIdentify, record, document thoroughly, and track bugsPerform thorough regression testing when bugs are resolvedDevelop and apply testing processes for new and existing products to meet client needsLiaise with internal teams (e.g. developers and product managers) to identify system requirementsMonitor debugging process resultsInvestigate the causes of non-conforming software and train users to implement solutionsTrack quality assurance metrics, like defect densities and open defect countsStay up-to-date with new testing tools and test strategiesRequirementsProven work\u00a0experience in software developmentProven work\u00a0experience in software quality assuranceStrong knowledge of software QA methodologies, tools, and processesExperience in writing clear, concise, and comprehensive test plans and test casesHands-on experience with both white box and black box testingHands-on experience with automated testing toolsSolid knowledge of SQL and scriptingExperience working in an Agile/Scrum development processExperience with performance and/or security testing is a plusBS/MS degree in Computer Science, Engineering or a related subjectSQL and scriptingAgile/Scrum development processsoftware QA methodologiesApply",
        "Page_URL": "https://kathmandujobs.com/jobs/25775/quality-assurance-engineer-job-in-kathmandu"
    },
    {
        "name": "Laravel Developer",
        "company": "Cyclone Nepal Info Tech",
        "vacancy": "2",
        "time": "full-time",
        "address": "Kathmandu, Nepal",
        "deadline": "2020-10-27",
        "education": "Bachelor Degree",
        "experience": "1-2 years",
        "level": "Intermediate",
        "salary": "Negotiable",
        "desct": "Laravel DeveloperCyclone Nepal Info TechApplyExperience:1-2 yearsLevel:IntermediateTotal Positions:2Job Type:full-timeSalary:NegotiableEducation:Bachelor DegreeLocation:Kathmandu, NepalApply Before:2020-10-27Candidates are required to fill-up the google doc form linked below:https://bit.ly/cnlaravel\u2022 Analysis, design, development, deployment and maintenance of projects independently\u2022 Improve and maintain scalability, performance, reliability and security of the application\u2022 Mentor and share knowledge within the team and help in the continuous growth of junior team members\u2022 Involve in ensuring implementation of organizational culture, process, and standards in the team\u2022 Communicate with the client and team in an effective manner\u2022 Keep up with trends in the constantly evolving technology\u2022 Quality Human Resources in the field of IT world wideFull Stack Laravel DeveloperAbility to createintegrate and handle APIsReviews and evaluates existing systemsMust be able to transform presented requirements into codes.Apply",
        "Page_URL": "https://kathmandujobs.com/jobs/25774/laravel-developer-job-in-kathmandu"
    },
    {
        "name": "Senior Frontend Designer",
        "company": "Swivt Technologies",
        "vacancy": "1",
        "time": "full-time",
        "address": "Kathmandu, Nepal",
        "deadline": "2020-10-30",
        "education": "Bachelor Degree",
        "experience": "2-5 years",
        "level": "Expert",
        "salary": "Rs.25000- Rs.50000",
        "desct": "Senior Frontend DesignerSwivt TechnologiesApplyExperience:2-5 yearsLevel:ExpertTotal Positions:1Job Type:full-timeSalary:Rs.25000- Rs.50000Education:Bachelor DegreeLocation:Kathmandu, NepalApply Before:2020-10-30Build the front-end of applications through appealing visual design for website and webappDevelop and manage well-functioning databases and applicationsDesign and develop APIsTest software to ensure responsiveness and efficiencyTroubleshoot, debug and upgrade softwareBuild features and applications with a mobile responsive designWrite technical documentationWork with data scientists and analysts to improve softwareHTML 5CSSSAASJavaScriptReact JsNode JsApply",
        "Page_URL": "https://kathmandujobs.com/jobs/25773/senior-frontend-designer-job-in-kathmandu"
    },
    {
        "name": "Senior Flutter Developer ( Android )",
        "company": "Swivt Technologies",
        "vacancy": "1",
        "time": "full-time",
        "address": "Kathmandu, Nepal",
        "deadline": "2020-10-30",
        "education": "Bachelor Degree",
        "experience": "2-5 years",
        "level": "Expert",
        "salary": "Rs.25000- Rs.70000",
        "desct": "Senior Flutter Developer ( Android )Swivt TechnologiesApplyExperience:2-5 yearsLevel:ExpertTotal Positions:1Job Type:full-timeSalary:Rs.25000- Rs.70000Education:Bachelor DegreeLocation:Kathmandu, NepalApply Before:2020-10-30Develop applications mainly for the Android platformResponsible for mobile application design and developmentProvide recommendations in testing and implementation phasesEnsure applications are well-maintained with timely enhancementsWork closely with other stakeholders to ensure requirements can be metAd-hoc tasks as assigned by team leadFlutterXMLAndroid SDKAndroid StudioConceptual JavaApply",
        "Page_URL": "https://kathmandujobs.com/jobs/25772/senior-flutter-developer-android--job-in-kathmandu"
    },
    {
        "name": "Senior Flutter Developer ( IOS )",
        "company": "Swivt Technologies",
        "vacancy": "1",
        "time": "full-time",
        "address": "Kathmandu, Nepal",
        "deadline": "2020-10-30",
        "education": "Bachelor Degree",
        "experience": "2-5 years",
        "level": "Expert",
        "salary": "Rs.25000- Rs.70000",
        "desct": "Senior Flutter Developer ( IOS )Swivt TechnologiesApplyExperience:2-5 yearsLevel:ExpertTotal Positions:1Job Type:full-timeSalary:Rs.25000- Rs.70000Education:Bachelor DegreeLocation:Kathmandu, NepalApply Before:2020-10-30Design and Build complex multi industry B2B Mobile App in iOS and FlutterExtract and utilize data contributed by middleware and APIsAnalyse UX research and user requirement, and optimize UI for Mobile UsersWork closely with frontend and backend web teams throughout the entire SDLC lifecycleOngoingly improve application performance by implementing new technologies available or in the upcoming tech trend.Conduct Unit Test/Beta Test before deployment to the App Store.IOSFlutterNode.JsNative ReactReact.JsApply",
        "Page_URL": "https://kathmandujobs.com/jobs/25771/senior-flutter-developer-ios--job-in-kathmandu"
    },
    {
        "name": "PHP PROGRAMMERS",
        "company": "Bent Ray Technologies Pvt. Ltd.",
        "vacancy": "2",
        "time": "full-time",
        "address": "Lalitpur, Nepal",
        "deadline": "2020-12-25",
        "education": "Bachelor Degree",
        "experience": "1-2 years",
        "level": "Expert",
        "salary": "Negotiable",
        "desct": "PHP PROGRAMMERSBent Ray Technologies Pvt. Ltd.ApplyExperience:1-2 yearsLevel:ExpertTotal Positions:2Job Type:full-timeSalary:NegotiableEducation:Bachelor DegreeLocation:Lalitpur, NepalApply Before:2020-12-25Job Description :Identifying and managing risks and setting realistic expectations for the customerWork closely with Management, Customers, QA, Design, and Product Management to maintain and enhance existing product as well as to develop new products.Develop and execute unit testing strategy and processes.Coordinate with the team to establish an effective team communication.Develop a web based application using Yii v2.0 Framework.Research and study new available technologies and figure out the feasibility of its application.Perform other assigned job related duties.Job Specification:Experience in development of distributed/scalable systems and high-volume transaction applications.Must have at least 1+ years experience in developing web applications using PHP.Sound knowledge of Object Oriented Programming using PHP.Experience in popular MVC frameworks like Yii (Preferred).Able to use/create third party API & Web Services in PHP like REST, SOAP, JSON, XML-RPC etc.Should have good knowledge of XHTML and CSS.Must have good spoken and written English.Should be self-motivated and adaptive learner.Must be able to work under pressure and demonstrate work ability in rapidly changing\u00a0requirements.Bachelor Degree in Computer ScienceApply",
        "Page_URL": "https://kathmandujobs.com/jobs/25769/php-programmers-job-in-lalitpur"
    },
    {
        "name": "FRONTEND DEVELOPER(ANGULAR)",
        "company": "Bent Ray Technologies Pvt. Ltd.",
        "vacancy": "2",
        "time": "full-time",
        "address": "Kathmandu, Nepal",
        "deadline": "2020-11-25",
        "education": "Bachelor Degree",
        "experience": "1-2 years",
        "level": "Intermediate",
        "salary": "Negotiable",
        "desct": "FRONTEND DEVELOPER(ANGULAR)Bent Ray Technologies Pvt. Ltd.ApplyExperience:1-2 yearsLevel:IntermediateTotal Positions:2Job Type:full-timeSalary:NegotiableEducation:Bachelor DegreeLocation:Kathmandu, NepalApply Before:2020-11-25Job Description :Delivering a complete front end UI and user controls in AngularEnsuring high performance on all devices, mobile or laptops.Writing tested, idiomatic, and documented JavaScript, HTML and CSSCoordinating the workflow between the graphic designer, the backend programmer and yourselfCommunicating with web services developed by backend developersJob Specification:Proficiency with JavaScript, HTML5 and CSSProfessional, precise communication skillsDeep knowledge of Angular practices and commonly used modules based on extensive work experienceCreating self-contained, reusable, and testable modules and components for front endEnsuring a clear dependency chain, in regard to the app logic as well as the file systemExtensive knowledge of CSS and JS methods for providing performant visual effectsBachelor In Information TechnologyApply",
        "Page_URL": "https://kathmandujobs.com/jobs/25768/frontend-developerangular-job-in-kathmandu"
    },
    {
        "name": "Senior PHP/Laravel Developer",
        "company": "Outsource Array P. Ltd.",
        "vacancy": "2",
        "time": "full-time",
        "address": "Kathmandu, Nepal",
        "deadline": "2020-10-05",
        "education": "Secondary Education Examination ( SEE)",
        "experience": "2-5 years",
        "level": "Expert",
        "salary": "Negotiable",
        "desct": "Senior PHP/Laravel DeveloperOutsource Array P. Ltd.ApplyExperience:2-5 yearsLevel:ExpertTotal Positions:2Job Type:full-timeSalary:NegotiableEducation:Secondary Education Examination ( SEE)Location:Kathmandu, NepalApply Before:2020-10-05We are looking for skilled Full Stack PHP Laravel Developers to join our development team. In this role, you will be responsible for developing and implementing user interface components using PHP Laravel concepts and workflows.Primarily this job includes PHP Laravel Web Application development aimed at customers wishing to hire products. The apps will have 3 separate interfaces for Customers, Suppliers and Administrators.Web application to support suppliersWeb application to support admin userAPI to support web and mobile applicationsIntegration with payment gateway (such as Stripe and PayPal)Integration with US and UK Postcode searchIntegration with Maps service (such as Google Maps)You need to be able to work in parallel coordination with React Native Developers working on mobile apps development.Work as part of a team to build Web Applications, APIs, React Native iOS / Android applications for FullStack's clients.Architect, build and maintain excellent PHP Web application with clean code.Implement pixel perfect UI's that match designs.Implement clean, modern, smooth animations and transitions that provide an excellent user experience.Integrate third-party API's.Write unit and integration tests.Work with native modules when required.Work as part of a small team, which will include other developers, a project manager, QA professional, and a designer.Interface with clients via Slack, Zoom, and email.Work with modern tools including Jira, Slack, GitHub, Google Docs, etc.Follow FullStack's detailed development processApplications can be made online here or send us your CVs to:[email\u00a0protected]Full Stack PHP Laravel DevelopmentApply",
        "Page_URL": "https://kathmandujobs.com/jobs/25767/senior-phplaravel-developer-job-in-kathmandu"
    },
    {
        "name": "Senior App Developer, React Native",
        "company": "Outsource Array P. Ltd.",
        "vacancy": "2",
        "time": "full-time",
        "address": "Kathmandu, Nepal",
        "deadline": "2020-10-05",
        "education": "Bachelor Degree",
        "experience": "2-5 years",
        "level": "Expert",
        "salary": "Negotiable",
        "desct": "Senior App Developer, React NativeOutsource Array P. Ltd.ApplyExperience:2-5 yearsLevel:ExpertTotal Positions:2Job Type:full-timeSalary:NegotiableEducation:Bachelor DegreeLocation:Kathmandu, NepalApply Before:2020-10-05We are looking for skilled React Native Developers to join our front-end development team. In this role, you will be responsible for developing and implementing user interface components using React Native concepts and workflows. You will also be responsible for profiling and improving front-end performance and documenting our front-end codebase.You should have in-depth knowledge of JavaScript and React concepts, excellent front-end coding skills, and a good understanding of progressive web applications. Ultimately, as a top-class React Native Developer you should be able to design and build modern user interface components to enhance application performance.Primarily this job includes iOS and Android Applications development aimed at customers wishing to hire products. The apps will have 3 separate interfaces for Customers, Suppliers and Administrators.Web application to support suppliersWeb application to support admin userAPI to support web and mobile applicationsIntegration with payment gateway (such as Stripe and PayPal)Integration with US and UK Postcode searchIntegration with Maps service (such as Google Maps)You need to be able to work in parallel coordination with Laravel Developers working on web interface.Work as part of a team to build React Native iOS / Android applications for FullStack's clients.Architect, build and maintain excellent React Native applications with clean code.Implement pixel perfect UI's that match designs.Implement clean, modern, smooth animations and transitions that provide an excellent user experience.Integrate third-party API's.Write unit and integration tests.Release applications to IOS and Google Play stores.Work with native modules when required.Work as part of a small team, which will include other developers, a project manager, QA professional, and a designer.Interface with clients via Slack, Zoom, and email.Work with modern tools including Jira, Slack, GitHub, Google Docs, etc.Follow FullStack's detailed development processApplications can be made online here or send us your CVs to:[email\u00a0protected]React NativeFront End Coding SkillsApply",
        "Page_URL": "https://kathmandujobs.com/jobs/25766/senior-app-developer-react-native-job-in-kathmandu"
    },
    {
        "name": "Full Stack Developer (Laravel/Vue)",
        "company": "SUSANKYA TECH PVT. LTD.",
        "vacancy": "1",
        "time": "full-time",
        "address": "Kathmandu, Nepal",
        "deadline": "2020-10-05",
        "education": "Bachelor Degree",
        "experience": "2-5 years",
        "level": "Expert",
        "salary": "Negotiable",
        "desct": "Full Stack Developer (Laravel/Vue)SUSANKYA TECH PVT. LTD.ApplyExperience:2-5 yearsLevel:ExpertTotal Positions:1Job Type:full-timeSalary:NegotiableEducation:Bachelor DegreeLocation:Kathmandu, NepalApply Before:2020-10-05About Susankya TechSusankya Tech is a software company, focused in SaaS Products, based in Nepal with highly experienced and like-minded experts focusing on real-world problems, implementing the best solutions to simplify day-to-day life. Over the last years, it has been successful in establishing a client network of more than 500 clients with a growth rate of over 200% in the last year alone.Though it started unofficially with only a team of 4 back in 2014, it was officially registered in 2016. Susankya Tech has been operating in Kathmandu, Nepal since then with a team that is 30+ strong. With its current office at Kupondole, Lalitpur, it hosts quite a number of commercial products. Susankya Tech specializes in different growing fields of Nepal such as e-commerce, modern education and management systems.Susankya Tech has published over 150 apps on Play Store and App Store altogether which have grossed more than 150,000 downloads. It\u2019s also a leading service provider to many education consultancies all over Nepal with innovative products such as Consultancy Manager (CMST) and Consultancy Finder.Requirements3+ years experience with modern PHP development strategies.Solid working experience with Laravel frameworkSolid working experience building RESTful APIs.Solid working experience with basic database fundamentals, data modeling, and optimization. (MySQL preferred).Experience with Test Driven Development (TDD).Experience integrating with third-party APIs.Experience working in the AWS (Amazon Web Services) ecosystem.Solid working experience with VueJS, particularly integrating with APIs.Experience with scalable/high traffic platforms.Strong attention to detail and documenting APIs is a must.Experience with standard Git development workflows.Experience working within Agile development environments.Understand entire project lifecycle for software development.Proficiency using PostgreSQL and Redis in an optimized production settingStrong knowledge of caching mechanisms such as Memcached and VarnishDutiesMaintain and scale existing productsBuild applications with Laravel and VueJS following clean code structure and well-documented practices.Optimization of queries and data generation methodslaravelvuejsvuefull stackuiphpApply",
        "Page_URL": "https://kathmandujobs.com/jobs/25763/full-stack-developer-laravelvue-job-in-kathmandu"
    },
    {
        "name": "Senior .NET developer",
        "company": "Singapore Ecommerce App Pte. Ltd",
        "vacancy": "1",
        "time": "full-time",
        "address": "Kathmandu, Nepal",
        "deadline": "2020-11-27",
        "education": "Bachelor Degree",
        "experience": "5-10 years",
        "level": "Expert",
        "salary": "Negotiable",
        "desct": "Senior .NET developerSingapore Ecommerce App Pte. LtdApplyExperience:5-10 yearsLevel:ExpertTotal Positions:1Job Type:full-timeSalary:NegotiableEducation:Bachelor DegreeLocation:Kathmandu, NepalApply Before:2020-11-27Please state your current salary, expected salary, notice period, contact-able referenceStrong knowledge of Object-Oriented Programming and Design ConceptsKnowledge of software development life-cycle for web-based applicationsExperience in design and development experience with C#, Angular, .NET web framework, .NET and/or .NET CoreProficient in MS SQL queries, familiar with Database Design and Stored ProceduresExperience in web technologies: JavaScript, AJAX, jQuery, HTML5, CSSDesign and develop and maintain simple to complex modules for our productsInvestigate new APIs and learn how to use themUbuntuWindows Serversystem designSQL Server.NET coreasp.net.NET MVCversion controlsearch database like elasticsearchcache system like redisApply",
        "Page_URL": "https://kathmandujobs.com/jobs/25762/senior-net-developer-job-in-kathmandu"
    },
    {
        "name": "Content Writer",
        "company": "Janata Technologies",
        "vacancy": "1",
        "time": "part-time",
        "address": "Kathmandu, Nepal",
        "deadline": "2020-10-05",
        "education": "Bachelor Degree",
        "experience": "2-5 years",
        "level": "Intermediate",
        "salary": "Negotiable",
        "desct": "Content WriterJanata TechnologiesApplyExperience:2-5 yearsLevel:IntermediateTotal Positions:1Job Type:part-timeSalary:NegotiableEducation:Bachelor DegreeLocation:Kathmandu, NepalApply Before:2020-10-05Janata Technologies Pvt. Ltd. is seeking for an amazing content writer with few years experience. Ideal candidate should be able to write content in both Nepali and English. If interested, please send your CV along with your writing samples to[email\u00a0protected]Proficient in writing in both Nepal and English and be able to write amazing content...Apply",
        "Page_URL": "https://kathmandujobs.com/jobs/25761/content-writer-job-in-kathmandu"
    },
    {
        "name": "QC ENGINEER",
        "company": "Bent Ray Technologies Pvt. Ltd.",
        "vacancy": "2",
        "time": "full-time",
        "address": "Kathmandu, Nepal",
        "deadline": "2020-11-22",
        "education": "Bachelor Degree",
        "experience": "0-1 years",
        "level": "Intermediate",
        "salary": "Negotiable",
        "desct": "QC ENGINEERBent Ray Technologies Pvt. Ltd.ApplyExperience:0-1 yearsLevel:IntermediateTotal Positions:2Job Type:full-timeSalary:NegotiableEducation:Bachelor DegreeLocation:Kathmandu, NepalApply Before:2020-11-22Job Description :Analyze the client requirement and formulate specificationIdentifying bugs and prepares technical documents, defect logging and tracking.Preparing test cases and performs follow ups with technical team to solve the issues.Job Specification:Must have at least 1 year experience in developing applications using PHP, JAVA or .NET platforms.Sound knowledge of testing tools like Selenium or Jmeter.Should have good understanding of test cases.Must have good spoken and written English.Should be self-motivated and adaptive learner.Must be able to work under pressure and demonstrate work ability in rapidly changing\u00a0requirements.Bachelor Degree in Computer ScienceApply",
        "Page_URL": "https://kathmandujobs.com/jobs/25758/qc-engineer-job-in-kathmandu"
    },
    {
        "name": "UI/UX DEVELOPER (GRAPHIC DESIGNER)",
        "company": "Bent Ray Technologies Pvt. Ltd.",
        "vacancy": "2",
        "time": "full-time",
        "address": "Kathmandu, Nepal",
        "deadline": "2020-11-22",
        "education": "Bachelor Degree",
        "experience": "0-1 years",
        "level": "Intermediate",
        "salary": "Negotiable",
        "desct": "UI/UX DEVELOPER (GRAPHIC DESIGNER)Bent Ray Technologies Pvt. Ltd.ApplyExperience:0-1 yearsLevel:IntermediateTotal Positions:2Job Type:full-timeSalary:NegotiableEducation:Bachelor DegreeLocation:Kathmandu, NepalApply Before:2020-11-22Job Description :Work as a team member and handle task assigned by Team Leader.Coordinate with the team to establish an effective team communication.Design a UI mockup\u00a0in graphic designing tools like Photoshop, Figma or Illustrator.Communicate with the client and visit them if necessary.Perform other assigned job related duties.Job Specification:Must have at least 1 year experience in developing UI for Mobile/Web\u00a0Application and Website.Must have good knowledge of UI development tools like Adobe XD or Figma.Possess good knowledge of Graphic Software like Adobe Photoshop, Illustrator and/or\u00a0Corel Draw.Should have basic knowledge of XHTML and CSS.Must have good spoken and written English.Should be self-motivated and adaptive learner.Bachelor Degree in Computer ScienceApply",
        "Page_URL": "https://kathmandujobs.com/jobs/25757/uiux-developer-graphic-designer-job-in-kathmandu"
    },
    {
        "name": "DEVOPS ENGINEER",
        "company": "Bent Ray Technologies Pvt. Ltd.",
        "vacancy": "2",
        "time": "full-time",
        "address": "Kathmandu, Nepal",
        "deadline": "2020-11-22",
        "education": "Bachelor Degree",
        "experience": "0-1 years",
        "level": "Intermediate",
        "salary": "Negotiable",
        "desct": "DEVOPS ENGINEERBent Ray Technologies Pvt. Ltd.ApplyExperience:0-1 yearsLevel:IntermediateTotal Positions:2Job Type:full-timeSalary:NegotiableEducation:Bachelor DegreeLocation:Kathmandu, NepalApply Before:2020-11-22Job Description :Design and build our platform's core infrastructure across many different servicesWork with Git, CI-CD Pipelines, Docker, Kubernetes and IAASCollaborate closely with developement teams to create scalable components.Diagnose and develop root cause solutions for failures and performance issues in our production environmentJob Specification:Deep knowledge and experience designing and building scalable platforms for SaaS productsCreating systems on which secure, reliable, and performant distributed services can run.Understanding of security best practicesShould be communicate with the development team and mentor\u00a0services in production at scaleShould\u00a0have exhibited a track record of trying and learning new thingsBachelor Degree in Computer ScienceApply",
        "Page_URL": "https://kathmandujobs.com/jobs/25756/devops-engineer-job-in-kathmandu"
    },
    {
        "name": "ARTIFICIAL INTELLIGENCE DEVELOPER (PYTHON)",
        "company": "Bent Ray Technologies Pvt. Ltd.",
        "vacancy": "2",
        "time": "full-time",
        "address": "Lalitpur, Nepal",
        "deadline": "2020-11-22",
        "education": "Bachelor Degree",
        "experience": "0-1 years",
        "level": "Intermediate",
        "salary": "Negotiable",
        "desct": "ARTIFICIAL INTELLIGENCE DEVELOPER (PYTHON)Bent Ray Technologies Pvt. Ltd.ApplyExperience:0-1 yearsLevel:IntermediateTotal Positions:2Job Type:full-timeSalary:NegotiableEducation:Bachelor DegreeLocation:Lalitpur, NepalApply Before:2020-11-22Job Description :Set up and manage our AI development and production infrastructure.Deploy AI models into production.Create APIs and help business customers put results of your AI models into operations.Keep current of latest AI research relevant to our business domain.Job Specification:Strong practical knowledge of Python coding skillsEnjoy working in a fast-paced, agile environment.Hands-on database experience, specifically experience using SQLExperience with text analytics (NLP) and working with unstructured data setsUnderstanding of database technologies like MySQL/MariaDB or MS SQLBachelor Degree in Computer ScienceApply",
        "Page_URL": "https://kathmandujobs.com/jobs/25755/artificial-intelligence-developer-python-job-in-lalitpur"
    },
    {
        "name": "Designer Intern",
        "company": "ZenLab Pvt. Ltd.",
        "vacancy": "2",
        "time": "full-time",
        "address": "Kathmandu, Nepal",
        "deadline": "2020-09-30",
        "education": "Secondary Education Examination ( SEE)",
        "experience": "0-1 years",
        "level": "Beginner",
        "salary": "Negotiable",
        "desct": "Designer InternZenLab Pvt. Ltd.ApplyExperience:0-1 yearsLevel:BeginnerTotal Positions:2Job Type:full-timeSalary:NegotiableEducation:Secondary Education Examination ( SEE)Location:Kathmandu, NepalApply Before:2020-09-30Basic knowledge of HTML, CSS, JS, JQuery, Adobe Photoshop, Adobe XD.Gather and evaluate user requirements in collaboration with product managers and engineersIllustrate design ideas using storyboards, process flows and sitemaps.Design graphic user interface elements, like menus, tabs and widgets etc.Develop UI mockups and prototypes that clearly illustrate how sites and mobile apps function and look like.Write elegant HTML, CSS codes following current trends and technologies.Team player and good communication skills.HTMLCSSJSJQueryAdobe PhotoshopAdobe XDApply",
        "Page_URL": "https://kathmandujobs.com/jobs/25752/designer-intern-job-in-kathmandu"
    },
    {
        "name": "Mid Level Designer",
        "company": "ZenLab Pvt. Ltd.",
        "vacancy": "2",
        "time": "full-time",
        "address": "Kathmandu, Nepal",
        "deadline": "2020-09-30",
        "education": "Secondary Education Examination ( SEE)",
        "experience": "1-2 years",
        "level": "Intermediate",
        "salary": "Rs.15000- Rs.25000",
        "desct": "Mid Level DesignerZenLab Pvt. Ltd.ApplyExperience:1-2 yearsLevel:IntermediateTotal Positions:2Job Type:full-timeSalary:Rs.15000- Rs.25000Education:Secondary Education Examination ( SEE)Location:Kathmandu, NepalApply Before:2020-09-30Gather and evaluate user requirements in collaboration with product managers and engineersIllustrate design ideas using storyboards, process flows and sitemaps.Design graphic user interface elements, like menus, tabs and widgets etc.Develop UI mockups and prototypes that clearly illustrate how sites and mobile apps function and look like.Write elegant HTML, CSS codes following current trends and technologies.Team player and good communication skills.HTMLCSSJSJQueryAdobe PhotoshopAdobe XDApply",
        "Page_URL": "https://kathmandujobs.com/jobs/25751/mid-level-designer-job-in-kathmandu"
    },
    {
        "name": "Junior Flutter Developer",
        "company": "ZenLab Pvt. Ltd.",
        "vacancy": "2",
        "time": "full-time",
        "address": "Kathmandu, Nepal",
        "deadline": "2020-09-30",
        "education": "Secondary Education Examination ( SEE)",
        "experience": "0-1 years",
        "level": "Beginner",
        "salary": "Rs.5000- Rs.15000",
        "desct": "Junior Flutter DeveloperZenLab Pvt. Ltd.ApplyExperience:0-1 yearsLevel:BeginnerTotal Positions:2Job Type:full-timeSalary:Rs.5000- Rs.15000Education:Secondary Education Examination ( SEE)Location:Kathmandu, NepalApply Before:2020-09-30Knowledge of Dart.Basic knowledge of native mobile application development.Knowledge of Version Control Tools.Knowledge of PMT.Great communication skills.Problem solving approach.Team player and capacity to work under pressure.DartFlutterMobile Application DevelopmentApply",
        "Page_URL": "https://kathmandujobs.com/jobs/25750/junior-flutter-developer-job-in-kathmandu"
    },
    {
        "name": "Junior React Native Developer",
        "company": "ZenLab Pvt. Ltd.",
        "vacancy": "2",
        "time": "full-time",
        "address": "Kathmandu, Nepal",
        "deadline": "2020-09-30",
        "education": "Bachelor Degree",
        "experience": "0-1 years",
        "level": "Beginner",
        "salary": "Rs.5000- Rs.15000",
        "desct": "Junior React Native DeveloperZenLab Pvt. Ltd.ApplyExperience:0-1 yearsLevel:BeginnerTotal Positions:2Job Type:full-timeSalary:Rs.5000- Rs.15000Education:Bachelor DegreeLocation:Kathmandu, NepalApply Before:2020-09-30Knowledge of JavaScript (ES6).Basic knowledge of native mobile application development.Knowledge of Version Control Tools.Knowledge of PMT.Great communication skills.Problem solving approach.Team player and capacity to work under pressure.JavaScriptReactJSXApply",
        "Page_URL": "https://kathmandujobs.com/jobs/25749/junior-react-native-developer-job-in-kathmandu"
    },
    {
        "name": "Mid Level React Native Developer",
        "company": "ZenLab Pvt. Ltd.",
        "vacancy": "2",
        "time": "full-time",
        "address": "Kathmandu, Nepal",
        "deadline": "2020-09-30",
        "education": "Secondary Education Examination ( SEE)",
        "experience": "1-2 years",
        "level": "Intermediate",
        "salary": "Rs.25000- Rs.50000",
        "desct": "Mid Level React Native DeveloperZenLab Pvt. Ltd.ApplyExperience:1-2 yearsLevel:IntermediateTotal Positions:2Job Type:full-timeSalary:Rs.25000- Rs.50000Education:Secondary Education Examination ( SEE)Location:Kathmandu, NepalApply Before:2020-09-30Knowledge of JavaScript (ES6).Knowledge of native mobile application development.Knowledge of Version Control Tools.Knowledge of PMT.Great communication skills.Problem solving approach.Team player and capacity to work under pressure.AndroidReactJSApply",
        "Page_URL": "https://kathmandujobs.com/jobs/25748/mid-level-react-native-developer-job-in-kathmandu"
    }
]
