[{"name": "Assistant Developer", "company": "FOCUSONE Payment Solutions Pvt.Ltd.", "level": "Negotiablemonth", "vacancy": "4", "address": "DD Plaza, 4th Floor, Kamaladi, Kathmandu", "salary": "BS/MS degree in Computer Science, Engineering or a related subject", "deadline": "", "education": "2020-11-30", "experience": "At Least 1.5 year", "desct": "Assistant DeveloperFOCUSONE Payment Solutions Pvt.Ltd.DD Plaza, 4th Floor, Kamaladi, Kathmandu58Share ItView company profileApply NowAboutusFOCUSONE Payment Solution Pvt. Ltd. (F1PS), Estd 2009; is a Payment Service Provider (PSP) licensed by Nepal Rastra Bank (NRB).\u00a0Our company revolves around 3 key principles Trust, Value and Security. \u00a0 F1PS since its establishment has been continuously working on innovative payment solution. We launched a mobile payment system in collaboration with SmartChoice Technology (SCT) under the brand name \u201cMOCO\u201d in May 2014, a one of a kind product till date. We reached\u00a0700,000\u00a0successful transactions in 2017 and are now connected to over 30 BFIs. \u00a0 We are proud to be one of the few companies in Nepal to have acquired a PCI-DSS certification, which is an internationally accepted data security standard governed international payment networks, American Express, Discover, JCB International, MasterCard and Visa Inc. We have now begun works on collaboration and partnership with international card and payment association. \u00a0 Come join the #FinTech revolution with F1PS. Let\u2019s work towards building a true cashless society in Nepal. Creative minds, innovative leaders, dedicated and persistent personalities are most welcome.Posted On : 2020-11-13Days Left : 12 days leftBasic InformationLocation:KathmanduNo. of vacancy:4Experience:At Least 1.5 yearJob category:IT&TelecommunicationSalary:NegotiablemonthEducational Qualification:BS/MS degree in Computer Science, Engineering or a related subjectExpiry date:2020-11-30Job DescriptionCoordinating with stakeholders to understand the scope of workPreparing requirement specification documentCommunicating the project status with the supervisor and/or product ownerCoordinating with different stakeholders of the projectPreparing wireframes and other necessary design documentsKnowledge of data structures and algorithmKnowledge of the programming language in useAbility to self-learn / enhance programming skill of the language in useKnowledge in the programming tools you useKnowledge in the frameworks and libraries available for programming languages you use.Coding and schedulingJob SpecificationOrientation on research of additional information independentlyAbility to provide information clearly and shortlyFamiliar with Linux console, Git and Tomcat.Familiarity with basic research methods and reporting techniquesExcellent Analytical Skills and\u00a0Communication SkillsExcellent Organizational and Time Management SkillsIntegrity and ConfidentialityGood in handling Work PressureExcellent Team WorkApplicants having knowledge of PHP Programming will be highly preferred.Apply InstructionIf you meet the above requirements and wish to join our dynamic team, please send your recent resume including expected salary tocareer@moco.com.np.Apply NowSavePrintShare", "Page_URL": "https://www.kumarijob.com/premiumjob/assistant-developer/29120"}, {"name": "Laravel Developer", "company": "kumarijob.com", "level": "Mid Level", "vacancy": "2", "address": "Tinkune, Kathmandu", "salary": "Upto 30,000month", "deadline": "2020-11-20", "education": "Bachelor's Degree", "experience": "Minimum 1-2 years experience in a related field", "desct": "Laravel Developerkumarijob.comTinkune, Kathmandu703Share ItView company profileApply NowAboutusKumari Job is one of the leading legally certified Human Resource consulting firm operating since 2014. Kumari Job offers multiple solutions in the field of HR, Recruitment and Placement services to different organizations in diversified fields like Financial Institutions, Corporate houses, Trading houses, Schools, Colleges, I/NGOs etc. Kumari Job is morally operating by following the principles where value of clients are highly understood and recognized to provide them with the best services. Kumari Job is also known for its professional training services to produce qualified and skilled manpower in diverse fields.Posted On : 2020-11-05Days Left : 2 days leftBasic InformationLocation:KathmanduNo. of vacancy:2Experience:Minimum 1-2 years experience in a related fieldJob category:Web DevelopersJob Level:Mid LevelSalary:Upto 30,000monthEducational Qualification:Bachelor's DegreeExpiry date:2020-11-20Job DescriptionInsight Of PHP/Laravel, SQL.Knowledge of HTML5, CSS3, Javascript.Knowledge of git version control.Work effectively in OS, admin system, Web API, Web server, HTTP protocols.Creative and efficient problem solver.Job SpecificationBachelor/ Ongoing degree in Computer Science, IT/Computer Engineering or related field.Highly motivated and target driven personality.Minimum 1-2 years experience in a related fieldApply InstructionInterested candidates are requested to send their resume tosagar@kumarijob.comContact:9801178853Apply NowSavePrintShare", "Page_URL": "https://www.kumarijob.com/premiumjob/laravel-developer/29035"}, {"name": "Senior MS-SQL Developer", "company": "Cotiviti Nepal Pvt. Ltd", "level": "Senior Level", "vacancy": "4", "address": "Hattisar, Kathmandu", "salary": "Negotiablemonth", "deadline": "2020-11-19", "education": "Bachelor of Engineering in Computer/IT or equivalent degree in Computer related studies", "experience": "Minimum 5 years of experience in Software development using MS-SQL.", "desct": "Senior MS-SQL DeveloperCotiviti Nepal Pvt. LtdHattisar, Kathmandu1481Share ItView company profileApply NowAboutusEstablished in 2004, Cotiviti Nepal Pvt. Ltd. is a leading American Software company in Nepal. We are a proud to team of around 300 professionals who are involved in the design, development, testing and maintenance of an impressive lineup of trend-setting healthcare informatics solutions. Besides that, our talented people sort and analyze voluminous data to help clients in decision analytics. \u00a0 We are one of the eight centers of Cotiviti Inc. which operates from seven more locations across the United States of America and constantly ranked among the best healthcare informatics companies. In Nepal, Cotiviti Nepal Pvt. Ltd. has its remarkable identity in the software industry.Posted On : 2020-10-28Days Left : 1 day leftBasic InformationLocation:KathmanduNo. of vacancy:4Experience:Minimum 5 years of experience in Software development using MS-SQL.Job category:IT&TelecommunicationJob Level:Senior LevelSalary:NegotiablemonthEducational Qualification:Bachelor of Engineering in Computer/IT or equivalent degree in Computer related studiesExpiry date:2020-11-19Job DescriptionShould have strong knowledge on all stages of Software life cycle process: Planning, design, development, Testing and deployment.Understanding business requirements and technical documentsTranslate design into functional unit.Follow coding standard during developmentDevelop optimized queriesCreate unit test to validate changesActive participation in Project level discussion/meeting.Maintain legacy code and implement the new requirements in best possible way.Prepare Technical/flow diagram.Prepare documentation of the changes or legacy code base.Job SpecificationMinimum 5 years of experience in Software development using MS-SQL.Strong knowledge of Relational DatabasesExperience working with source control systems, such as Subversion, and GIT including branching and merging strategies.Knowledge of SSIS.Preferable SkillsExperience with Atlassian suite of tools (Jira, Confluence, Bamboo, Crucible)Soft SkillsAbility to work independently or as part of a teamExperience of working in SCRUM/Agile team would be added valuePersuasive in both written and verbal communicationStrong Analytical SkillsUS Healthcare experience would be added valueApply InstructionTo apply, please log in tohttp://www.cotiviti.com.np/jobsor send your CV toktmjobs@cotiviti.comApply NowSavePrintShare", "Page_URL": "https://www.kumarijob.com/premiumjob/senior-ms-sql-developer/28997"}, {"name": "Project Manager", "company": "Cotiviti Nepal Pvt. Ltd", "level": "Senior Level", "vacancy": "2", "address": "Hattisar, Kathmandu", "salary": "Negotiablemonth", "deadline": "2020-11-19", "education": "Bachelor's Degree", "experience": "Minimum 2 years experience in a related field", "desct": "Project ManagerCotiviti Nepal Pvt. LtdHattisar, Kathmandu2653Share ItView company profileApply NowAboutusEstablished in 2004, Cotiviti Nepal Pvt. Ltd. is a leading American Software company in Nepal. We are a proud to team of around 300 professionals who are involved in the design, development, testing and maintenance of an impressive lineup of trend-setting healthcare informatics solutions. Besides that, our talented people sort and analyze voluminous data to help clients in decision analytics. \u00a0 We are one of the eight centers of Cotiviti Inc. which operates from seven more locations across the United States of America and constantly ranked among the best healthcare informatics companies. In Nepal, Cotiviti Nepal Pvt. Ltd. has its remarkable identity in the software industry.Posted On : 2020-10-28Days Left : 1 day leftBasic InformationLocation:KathmanduNo. of vacancy:2Experience:Minimum 2 years experience in a related fieldJob category:IT&TelecommunicationJob Level:Senior LevelSalary:NegotiablemonthEducational Qualification:Bachelor's DegreeExpiry date:2020-11-19Job DescriptionConduct and facilitate the planning. Help team to define their goals on eachplanning.Facilitate all the sprint rituals of own team.Coordinate with other teams on the Agile Release Train (ART) asneeded. Participate in SOS to present own team's progress.Own team\u2019s commitments and help team to achieve their goal.Help remove impediments and foster an environment for high-performing teamdynamics, continuous flow, and relentless improvement.Help and guide the team to optimally plan their capacity.Make sure the team\u2019s utilization is efficiently managed and has higherproductivity.Conduct regular retrospective on every event. Make sure every action items have individual/team\u2019s name and a date expected to get resolved with a follow up.Manage team\u2019s RAID \u2013 Risk, Assumption, Issues and Dependencies.Compile, collect, produce and publish team\u2019s report on different metrics.Work with Engineering manager for team\u2019s development that helps the team tbe more productive as well as efficient.Escalate to higher authority as required on any case that needs resolution fromcross team.Coach the team in Scrum, Extreme Programming (XP), Kanban, and SAFe,ensuring that the agreed Agile process is being followed.Develop, document and conduct Agile development and process training asrequired \u2013 getting started and regular refresher training. Work with organizationtraining manager/specialistApply InstructionTo apply, please log in tohttp://www.cotiviti.com.np/jobsor send your CV toktmjobs@cotiviti.comApply NowSavePrintShare", "Page_URL": "https://www.kumarijob.com/premiumjob/project-manager/28996"}, {"name": "Test Automation Engineer", "company": "Cotiviti Nepal Pvt. Ltd", "level": "Mid Level", "vacancy": "5", "address": "Hattisar, Kathmandu", "salary": "Negotiablemonth", "deadline": "2020-11-19", "education": "Bachelor\u2019s degree or equivalent degree in Computer related studies", "experience": "Minimum 3 years of Software Development/Programming in the past or recently. Preferably in .Net.", "desct": "Test Automation EngineerCotiviti Nepal Pvt. LtdHattisar, Kathmandu1486Share ItView company profileApply NowAboutusEstablished in 2004, Cotiviti Nepal Pvt. Ltd. is a leading American Software company in Nepal. We are a proud to team of around 300 professionals who are involved in the design, development, testing and maintenance of an impressive lineup of trend-setting healthcare informatics solutions. Besides that, our talented people sort and analyze voluminous data to help clients in decision analytics. \u00a0 We are one of the eight centers of Cotiviti Inc. which operates from seven more locations across the United States of America and constantly ranked among the best healthcare informatics companies. In Nepal, Cotiviti Nepal Pvt. Ltd. has its remarkable identity in the software industry.Posted On : 2020-10-28Days Left : 1 day leftBasic InformationLocation:KathmanduNo. of vacancy:5Experience:Minimum 3 years of Software Development/Programming in the past or recently. Preferably in .Net.Job category:IT&TelecommunicationJob Level:Mid LevelSalary:NegotiablemonthEducational Qualification:Bachelor\u2019s degree or equivalent degree in Computer related studiesExpiry date:2020-11-19Job DescriptionTest Automation using Selenium in .NetTest Execution on various level (System Test, Regression Test, Smoke Test)Understand the existing products and business flowDefect reportingPrepare Testing platform (Application and Database)Performance Test using JMeterTest Automation of data/database level testingResearch/implementation of latest test automation frameworks.Job SpecificationMinimum 3 years of Software Development/Programming in the past or recently. Preferably in .Net.Must have experience of selenium test automation in .netMust have sound knowledge of Software TestingExperience working with source control systems, such as Subversion, and GIT including branchingand merging strategies.Preferable SkillsKnowledge of Relational DatabasesKnowledge of Build Scripting using MSBuild with BambooExperience of working in IIS Application ServerApply InstructionTo apply, please log in tohttp://www.cotiviti.com.np/jobsor send your CV toktmjobs@cotiviti.comApply NowSavePrintShare", "Page_URL": "https://www.kumarijob.com/premiumjob/test-automation-engineer/28994"}, {"name": "Senior Test Automation Engineer", "company": "Cotiviti Nepal Pvt. Ltd", "level": "Senior Level", "vacancy": "5", "address": "Hattisar, Kathmandu", "salary": "Negotiablemonth", "deadline": "2020-11-19", "education": "Bachelor Degree or equivalent degree in Computer related studies", "experience": "Minimum 5 years of Software Development/Programming in the past or recently. Preferably in .Net.", "desct": "Senior Test Automation EngineerCotiviti Nepal Pvt. LtdHattisar, Kathmandu962Share ItView company profileApply NowAboutusEstablished in 2004, Cotiviti Nepal Pvt. Ltd. is a leading American Software company in Nepal. We are a proud to team of around 300 professionals who are involved in the design, development, testing and maintenance of an impressive lineup of trend-setting healthcare informatics solutions. Besides that, our talented people sort and analyze voluminous data to help clients in decision analytics. \u00a0 We are one of the eight centers of Cotiviti Inc. which operates from seven more locations across the United States of America and constantly ranked among the best healthcare informatics companies. In Nepal, Cotiviti Nepal Pvt. Ltd. has its remarkable identity in the software industry.Posted On : 2020-10-28Days Left : 1 day leftBasic InformationLocation:KathmanduNo. of vacancy:5Experience:Minimum 5 years of Software Development/Programming in the past or recently. Preferably in .Net.Job category:IT&TelecommunicationJob Level:Senior LevelSalary:NegotiablemonthEducational Qualification:Bachelor Degree or equivalent degree in Computer related studiesExpiry date:2020-11-19Job DescriptionTest Automation using Selenium in .NetTest Execution on various level (System Test, Regression Test, Smoke Test)Understand the existing products and business flowDefect reportingPrepare Testing platform (Application and Database)Performance Test using JMeterTest Automation of data/database level testingResearch/implementation of latest test automation frameworks.Job SpecificationMinimum 5 years of Software Development/Programming in the past or recently. Preferably in .Net.Must have experience of selenium test automation in .netMust have sound knowledge of Software TestingExperience working with source control systems, such as Subversion, and GIT including branchingand merging strategies.Preferable SkillsKnowledge of Relational DatabasesKnowledge of Build Scripting using MSBuild with BambooExperience of working in IIS Application ServerApply InstructionTo apply, please log in tohttp://www.cotiviti.com.np/jobsor send your CV toktmjobs@cotiviti.comApply NowSavePrintShare", "Page_URL": "https://www.kumarijob.com/premiumjob/senior-test-automation-engineer/28993"}, {"name": "Oracle- PL/SQL Developer", "company": "Cotiviti Nepal Pvt. Ltd", "level": "Mid Level", "vacancy": "2", "address": "Hattisar, Kathmandu", "salary": "Negotiablemonth", "deadline": "2020-11-19", "education": "Bachelor of Engineering in Computer/IT or equivalent degree in Computer related studies", "experience": "Minimum 2 years of experience in Software development using PL/SQL, MS-SQL.", "desct": "Oracle- PL/SQL DeveloperCotiviti Nepal Pvt. LtdHattisar, Kathmandu1068Share ItView company profileApply NowAboutusEstablished in 2004, Cotiviti Nepal Pvt. Ltd. is a leading American Software company in Nepal. We are a proud to team of around 300 professionals who are involved in the design, development, testing and maintenance of an impressive lineup of trend-setting healthcare informatics solutions. Besides that, our talented people sort and analyze voluminous data to help clients in decision analytics. \u00a0 We are one of the eight centers of Cotiviti Inc. which operates from seven more locations across the United States of America and constantly ranked among the best healthcare informatics companies. In Nepal, Cotiviti Nepal Pvt. Ltd. has its remarkable identity in the software industry.Posted On : 2020-10-28Days Left : 1 day leftBasic InformationLocation:KathmanduNo. of vacancy:2Experience:Minimum 2 years of experience in Software development using PL/SQL, MS-SQL.Job category:IT&TelecommunicationJob Level:Mid LevelSalary:NegotiablemonthEducational Qualification:Bachelor of Engineering in Computer/IT or equivalent degree in Computer related studiesExpiry date:2020-11-19Job DescriptionUnderstanding business requirements and technical documentsTranslate design into functional unit.Follow coding standard during developmentDevelop optimized queriesCreate unit test to validate changesActive participation in Project level discussion/meeting.Maintain legacy code and implement the new requirements in best possible way.Prepare Technical/flow diagram.Prepare documentation of the changes or legacy code base.Job SpecificationMinimum 2 years of experience in Software development using PL/SQL, MS-SQL.Strong knowledge of Relational DatabasesMust be familiar with Oracle Optimization techniquesMust be familiar with basic Linux commandsStrong theoretical and practical knowledge of object-oriented programmingFamiliar with design patternsExperience working with source control systems, such as Subversion, and GIT including branchingand merging strategies.Preferable SkillsKnowledge of Shell, Perl Scripting languageExperience with Atlassian suite of tools (Jira, Confluence, Bamboo)Other SkillsAbility to work independently or as part of a teamExperience of working in SCRUM/Agile team would be added valuePersuasive in both written and verbal communicationStrong Analytical SkillsUS Healthcare experience would be added valueApply InstructionTo apply, please log in tohttp://www.cotiviti.com.np/jobsor send your CV toktmjobs@cotiviti.comApply NowSavePrintShare", "Page_URL": "https://www.kumarijob.com/premiumjob/oracle-plsql-developer/28992"}, {"name": "Senior Oracle-PL/SQL Developer", "company": "Cotiviti Nepal Pvt. Ltd", "level": "Senior Level", "vacancy": "2", "address": "Hattisar, Kathmandu", "salary": "Negotiablemonth", "deadline": "2020-11-19", "education": "Bachelor's Degree", "experience": "At least 5 years of experience in Software development using PL/SQL, MS-SQL.", "desct": "Senior Oracle-PL/SQL DeveloperCotiviti Nepal Pvt. LtdHattisar, Kathmandu981Share ItView company profileApply NowAboutusEstablished in 2004, Cotiviti Nepal Pvt. Ltd. is a leading American Software company in Nepal. We are a proud to team of around 300 professionals who are involved in the design, development, testing and maintenance of an impressive lineup of trend-setting healthcare informatics solutions. Besides that, our talented people sort and analyze voluminous data to help clients in decision analytics. \u00a0 We are one of the eight centers of Cotiviti Inc. which operates from seven more locations across the United States of America and constantly ranked among the best healthcare informatics companies. In Nepal, Cotiviti Nepal Pvt. Ltd. has its remarkable identity in the software industry.Posted On : 2020-10-28Days Left : 1 day leftBasic InformationLocation:KathmanduNo. of vacancy:2Experience:At least 5 years of experience in Software development using PL/SQL, MS-SQL.Job category:IT&TelecommunicationJob Level:Senior LevelSalary:NegotiablemonthEducational Qualification:Bachelor's DegreeExpiry date:2020-11-19Job DescriptionShould have strong knowledge on all stages of Software life cycle process: Planning, design,development, Testing and deployment.Understanding business requirements and technical documentsTranslate design into functional unit.Follow coding standard during developmentDevelop optimized queriesCreate unit test to validate changesActive participation in Project level discussion/meeting.Maintain legacy code and implement the new requirements in best possible way.Prepare Technical/flow diagram.Prepare documentation of the changes or legacy code base.Job SpecificationAt least 5 years of experience in Software development using PL/SQL, MS-SQL.Strong knowledge of Relational DatabasesMust be familiar with Oracle Optimization techniquesMust be familiar with basic Linux commandsStrong theoretical and practical knowledge of object-oriented programmingFamiliar with design patternsExperience working with source control systems, such as Subversion, and GIT including branchingand merging strategies.Preferable SkillsKnowledge of Shell, Perl Scripting languageExperience with Atlassian suite of tools (Jira, Confluence, Bamboo, Crucible)Soft SkillsAbility to work independently or as part of a teamExperience of working in SCRUM/Agile team would be added valuePersuasive in both written and verbal communicationStrong Analytical SkillsUS Healthcare experience would be added valueApply InstructionTo apply, please log in tohttp://www.cotiviti.com.np/jobsor send your CV toktmjobs@cotiviti.comApply NowSavePrintShare", "Page_URL": "https://www.kumarijob.com/premiumjob/senior-oracle-plsql-developer/28991"}, {"name": "Java Developer", "company": "Cotiviti Nepal Pvt. Ltd", "level": "Mid Level", "vacancy": "6", "address": "Hattisar, Kathmandu", "salary": "Negotiablemonth", "deadline": "2020-11-19", "education": "Bachelor of Engineering in Computer/IT or equivalent degree in Computer related studies", "experience": "At least 2 years of experience in Software development using J2SE and J2EE.", "desct": "Java DeveloperCotiviti Nepal Pvt. LtdHattisar, Kathmandu1229Share ItView company profileApply NowAboutusEstablished in 2004, Cotiviti Nepal Pvt. Ltd. is a leading American Software company in Nepal. We are a proud to team of around 300 professionals who are involved in the design, development, testing and maintenance of an impressive lineup of trend-setting healthcare informatics solutions. Besides that, our talented people sort and analyze voluminous data to help clients in decision analytics. \u00a0 We are one of the eight centers of Cotiviti Inc. which operates from seven more locations across the United States of America and constantly ranked among the best healthcare informatics companies. In Nepal, Cotiviti Nepal Pvt. Ltd. has its remarkable identity in the software industry.Posted On : 2020-10-28Days Left : 1 day leftBasic InformationLocation:KathmanduNo. of vacancy:6Experience:At least 2 years of experience in Software development using J2SE and J2EE.Job category:IT&TelecommunicationJob Level:Mid LevelSalary:NegotiablemonthEducational Qualification:Bachelor of Engineering in Computer/IT or equivalent degree in Computer related studiesExpiry date:2020-11-19Job DescriptionInvolve in all stages of the project life cycle: requirements definition, design, and development.Translate application stories and requirements into functional applications.Write neat and clean code for desktop and web application.Create test cases and follow test cases to implement the requirements.Active participation in Project level discussion/meeting.Prepare use case/ flow diagram when needed.Regular follow up for tasks assigned from development phase to QAJob SpecificationAt least 2 years of experience in Software development using J2SE and J2EE.Experience in parallel and multithreaded programmingKnowledge of algorithms and data structuresInterest in achieving maximum performance from available hardware and softwareFamiliar with design patternsUI Development Skills (JavaFx, JavaScript, CSS, HTML, jQuery)Hands-on knowledge on Spring Framework.Strong knowledge of Relational Databases, SQL, and ORM technologiesExperience working with source control systems, such as Subversion, and GIT including branching andmerging strategies.Preferable SkillsHands-on knowledge on Apache Camel FrameworkKnowledge of testing frameworks/methodologies (TestNG, JUnit, TDD)Understanding of XML, JSON, web services technologiesExperience with Atlassian suite of tools (Jira, Confluence, Bamboo, Crucible)Experience in Continuous Integration leveraging tools such as Bamboo and Maven.Soft SkillsAbility to work independently or as part of a teamExperience of working in SCRUM/Agile team would be added valueDesire and ability to continuously improve, discover and expand the limitsCritical thinking, has an opinion on various technological topics.Apply InstructionTo apply, please log in tohttp://www.cotiviti.com.np/jobsor send your CV toktmjobs@cotiviti.comApply NowSavePrintShare", "Page_URL": "https://www.kumarijob.com/premiumjob/java-developer/28990"}, {"name": "Senior Java Developer", "company": "Cotiviti Nepal Pvt. Ltd", "level": "Senior Level", "vacancy": "7", "address": "Hattisar, Kathmandu", "salary": "Negotiablemonth", "deadline": "2020-11-19", "education": "BS Computer Science or related field or equivalent industry experience", "experience": "At least 5 years of experience in Software development", "desct": "Senior Java DeveloperCotiviti Nepal Pvt. LtdHattisar, Kathmandu928Share ItView company profileApply NowAboutusEstablished in 2004, Cotiviti Nepal Pvt. Ltd. is a leading American Software company in Nepal. We are a proud to team of around 300 professionals who are involved in the design, development, testing and maintenance of an impressive lineup of trend-setting healthcare informatics solutions. Besides that, our talented people sort and analyze voluminous data to help clients in decision analytics. \u00a0 We are one of the eight centers of Cotiviti Inc. which operates from seven more locations across the United States of America and constantly ranked among the best healthcare informatics companies. In Nepal, Cotiviti Nepal Pvt. Ltd. has its remarkable identity in the software industry.Posted On : 2020-10-28Days Left : 1 day leftBasic InformationLocation:KathmanduNo. of vacancy:7Experience:At least 5 years of experience in Software developmentJob category:IT&TelecommunicationJob Level:Senior LevelSalary:NegotiablemonthEducational Qualification:BS Computer Science or related field or equivalent industry experienceExpiry date:2020-11-19Job DescriptionExperience developing enterprise applications with proven enterprise experience level withRDBMS and SQL (Oracle and/or Microsoft SQL Server)Experience with Continuous Integration and writing automated unit and integration testsStrong object-oriented programming skills using JavaKnowledge of relevant technologies inclusive of (Angular 5, JavaScript, JOuery)Knowledge of algorithms and data structuresFamiliar with design patternsKnowledge of secure coding practices as it pertains to OWASPKnowledge of Version Control Software tools such as SVN, bitbucketExperience with Software development/management tools using the Atlassian suite (JIRA,Confluence)Experience with both Windows and Unix Operating systemJob SpecificationBS Computer Science or related field or equivalent industry experienceAt least 5 years of experience in Software developmentSoft SkillsAbility to work independently or as part of a teamExperience of working in SCRUM/Agile team would be added valueDesire and ability to continuously improve, discover and expand the limitsCritical thinking has an opinion on various technological topics.Apply InstructionTo apply, please log in tohttp://www.cotiviti.com.np/jobsor Send your CV toktmjobs@cotiviti.comApply NowSavePrintShare", "Page_URL": "https://www.kumarijob.com/premiumjob/senior-java-developer/28989"}, {"name": "Dot Net Developer", "company": "Cotiviti Nepal Pvt. Ltd", "level": "Mid Level", "vacancy": "4", "address": "Hattisar, Kathmandu", "salary": "Negotiablemonth", "deadline": "2020-11-19", "education": "Bachelor of Engineering in Computer/IT or equivalent degree in Computer related studies", "experience": "Minimum 2 years of experience in Software development using C#.", "desct": "Dot Net DeveloperCotiviti Nepal Pvt. LtdHattisar, Kathmandu1335Share ItView company profileApply NowAboutusEstablished in 2004, Cotiviti Nepal Pvt. Ltd. is a leading American Software company in Nepal. We are a proud to team of around 300 professionals who are involved in the design, development, testing and maintenance of an impressive lineup of trend-setting healthcare informatics solutions. Besides that, our talented people sort and analyze voluminous data to help clients in decision analytics. \u00a0 We are one of the eight centers of Cotiviti Inc. which operates from seven more locations across the United States of America and constantly ranked among the best healthcare informatics companies. In Nepal, Cotiviti Nepal Pvt. Ltd. has its remarkable identity in the software industry.Posted On : 2020-10-28Days Left : 1 day leftBasic InformationLocation:KathmanduNo. of vacancy:4Experience:Minimum 2 years of experience in Software development using C#.Job category:IT&TelecommunicationJob Level:Mid LevelSalary:NegotiablemonthEducational Qualification:Bachelor of Engineering in Computer/IT or equivalent degree in Computer related studiesExpiry date:2020-11-19Job DescriptionTranslate application stories and requirements into functional applications.Design, code, and maintain efficient and reliable C# code.Write neat and clean code mostly for desktop application.Create test cases and follow test cases to implement the requirements.Maintain legacy code and implement the new requirements in best possible way.Prepare use case/ flow diagram when needed.Regular follow up for tasks assigned from development phase to QAJob SpecificationMinimum 2 years of experience in Software development using C#.Strong theoretical and practical knowledge of object-oriented programmingAbility to write reusable C# librariesFamiliar with design patternsExperience in writing unit test and integration testing in Nunit Framework.Knack for writing clean, readable C# code.Strong knowledge of Relational Databases, SQL, and ORM technologiesExperience working with source control systems, such as Subversion, and GIT includingbranching and merging strategies.Web Service Frameworks (RESTful, SOAP)Preferable SkillsKnowledge of Javascript based front-end frameworks like ember.js, angular.js etc wouldbe an added advantage.Working knowledge of MVC design patterns.Experience in Continuous Integration leveraging tools such as Bamboo and Maven.Soft SkillsAbility to work independently or as part of a teamExperience of working in SCRUM/Agile team would be added valuePersuasive in both written and verbal communicationStrong Analytical SkillsUS Healthcare experience would be added valueApply InstructionTo apply, please log in tohttp://www.cotiviti.com.np/jobsor send your CV toktmjobs@cotiviti.comApply NowSavePrintShare", "Page_URL": "https://www.kumarijob.com/premiumjob/dot-net-developer/28988"}, {"name": "Senior Dot Net Developer", "company": "Cotiviti Nepal Pvt. Ltd", "level": "Senior Level", "vacancy": "10", "address": "Hattisar, Kathmandu", "salary": "Negotiablemonth", "deadline": "2020-11-19", "education": "Bachelor of Engineering in Computer/IT or equivalent degree in Computer related studies", "experience": "Minimum 5 years of experience in Software development using C#.", "desct": "Senior Dot Net DeveloperCotiviti Nepal Pvt. LtdHattisar, Kathmandu1003Share ItView company profileApply NowAboutusEstablished in 2004, Cotiviti Nepal Pvt. Ltd. is a leading American Software company in Nepal. We are a proud to team of around 300 professionals who are involved in the design, development, testing and maintenance of an impressive lineup of trend-setting healthcare informatics solutions. Besides that, our talented people sort and analyze voluminous data to help clients in decision analytics. \u00a0 We are one of the eight centers of Cotiviti Inc. which operates from seven more locations across the United States of America and constantly ranked among the best healthcare informatics companies. In Nepal, Cotiviti Nepal Pvt. Ltd. has its remarkable identity in the software industry.Posted On : 2020-10-28Days Left : 1 day leftBasic InformationLocation:KathmanduNo. of vacancy:10Experience:Minimum 5 years of experience in Software development using C#.Job category:IT&TelecommunicationJob Level:Senior LevelSalary:NegotiablemonthEducational Qualification:Bachelor of Engineering in Computer/IT or equivalent degree in Computer related studiesExpiry date:2020-11-19Job DescriptionTranslate application stories and requirements into functional applications.Design, code, and maintain efficient and reliable C# code.Write neat and clean code mostly for desktop applications.Create test cases and follow test cases to implement the requirements.Maintain legacy code and implement the new requirements in the best possible way.Prepare use case/ flow diagram when needed.Regular follow up for tasks assigned from development phase to QAJob SpecificationMinimum 5 years of experience in Software development using C#.Strong theoretical and practical knowledge of object-oriented programmingAbility to write reusable C# librariesFamiliar with design patternsExperience in writing unit tests and integration testing in Nunit Framework.Knack for writing clean, readable C# code.Strong knowledge of Relational Databases, SQL, and ORM technologiesExperience working with source control systems, such as Subversion, and GIT including branchingand merging strategies.Web Service Frameworks (RESTful, SOAP)Preferable SkillsKnowledge of Javascript based front-end frameworks like ember.js, angular.js etc would be anadded advantage.Working knowledge of MVC design patterns.Experience in Continuous Integration leveraging tools such as Bamboo and Maven.Soft SkillsAbility to work independently or as part of a teamExperience of working in SCRUM/Agile team would be added valuePersuasive in both written and verbal communicationStrong Analytical SkillsUS Healthcare experience would be added valueApply InstructionTo apply, please log in tohttp://www.cotiviti.com.np/jobsor send your CV toktmjobs@cotiviti.comApply NowSavePrintShare", "Page_URL": "https://www.kumarijob.com/premiumjob/senior-dot-net-developer/28987"}, {"name": "Team Lead(Cloud)", "company": "Bottle Technology Pvt. Ltd", "level": "Senior Level", "vacancy": "1", "address": "Kupondole, Lalitpur, Nepal.", "salary": "60,000month", "deadline": "2020-11-19", "education": "Bachelor Graduates", "experience": "Min 2 years of experience", "desct": "Team Lead(Cloud)Bottle Technology Pvt. LtdKupondole, Lalitpur, Nepal.4845Share ItView company profileApply NowAboutusBottle is a Nepal based \u201cRetail Experience Design\u201d Company with (technological) research subjects varying across the sphere of Machine Learning, Internet of Things, 3D Printing and Web 3.0 but our intention is not entirely based in technology. Bottle is composed of multiple divisions and departments, but we are working a long-timeout to eliminate the notion of psychological hierarchy which is only possible if we have people working, who have no respect for the dumb-down culture that is one of the reasons we build DYRE.\u00a0 Which you can visit and complete the application submission process.Posted On : 2020-10-05Days Left : 1 day leftBasic InformationLocation:KathmanduNo. of vacancy:1Experience:Min 2 years of experienceJob category:IT&TelecommunicationJob Level:Senior LevelSalary:60,000monthEducational Qualification:Bachelor GraduatesExpiry date:2020-11-19Job DescriptionDevelop, maintain, and monitor repos of deployable, tested, and documented code bases.Design, configure, implement and support an automated workflow for cloud and virtual environment provisioningWrite and maintain documentation of relevant operating procedures and processesDesign, develop, and build the business\u2019s cloud infrastructure architectureProvide design recommendations based on long-term IT organization strategyDesign and develop full-stack technologies (Database design, frontend, backend, microservices) Current / Recent tasks:Plan, write, and maintain serverless backend for the projectDesign, Orchestrate and Maintain the data platform Recommendation EngineJob SpecificationAs a Technical LeadAct as a subject matter expert to the organization for cloud and virtualization end-to-end architecture and IaaS, PaaSAssist developers in solving problems via hands-on or verbal guideFrequently researches and maintains knowledge in emerging technologies and possible application to the businessThink, plan and organize different growth-related activities ( Sessions, Engineering meet-up )Languages:JS, python Platform: serverless framework, AWS, nodejs, terraformApply InstructionInterested candidates are requested to send their resume atganga@bottle.com.npApply NowSavePrintShare", "Page_URL": "https://www.kumarijob.com/premiumjob/team-leadcloud/28849"}, {"name": "Project Manager", "company": "Bottle Technology Pvt. Ltd", "level": "Mid Level", "vacancy": "1", "address": "Kupondole, Lalitpur, Nepal.", "salary": "Negotiablemonth", "deadline": "2020-11-19", "education": "Bachelor's degree in Computer Science graduate or equivalent. A Master's degree is preferable", "experience": "At least 2 years of software project management experience in an agile environment.", "desct": "Project ManagerBottle Technology Pvt. LtdKupondole, Lalitpur, Nepal.6865Share ItView company profileApply NowAboutusBottle is a Nepal based \u201cRetail Experience Design\u201d Company with (technological) research subjects varying across the sphere of Machine Learning, Internet of Things, 3D Printing and Web 3.0 but our intention is not entirely based in technology. Bottle is composed of multiple divisions and departments, but we are working a long-timeout to eliminate the notion of psychological hierarchy which is only possible if we have people working, who have no respect for the dumb-down culture that is one of the reasons we build DYRE.\u00a0 Which you can visit and complete the application submission process.Posted On : 2020-10-05Days Left : 1 day leftBasic InformationLocation:KathmanduNo. of vacancy:1Experience:At least 2 years of software project management experience in an agile environment.Job category:IT&TelecommunicationJob Level:Mid LevelSalary:NegotiablemonthEducational Qualification:Bachelor's degree in Computer Science graduate or equivalent. A Master's degree is preferableExpiry date:2020-11-19Job DescriptionResponsible for requirement building, backlog prioritization, sprint planning, release, daily standups, reviews, and overall execution.Responsible for process implementation and improvements.Monitor resource availability and allocation.Responsible for quality assurance and control in accordance to project requirements.Perform overall project risk and issue management, and handle detailed tracking and mitigation planning.Responsible for establishing clear ownership of project tasks, ensuring every team member has the required tool & support needed and providing timely feedback.Set clear expectations, provide needed autonomy to team members, time monitor the progress, and give recognition for results.Developing schedules and methods for measuring results.Organizing and managing all phases of the project to ensure on-time completion.Planning and overseeing the preparation and dissemination of project communications.Coordinate project scope and objectives and ensure technical feasibility.Create and maintain comprehensive project documentation within the standards of the business.Job SpecificationBachelor's degree in Computer Science graduate or equivalent. A Master's degree is preferable.At least 2 years of software project management experience in an agile environment.A deep understanding of agile software development best practices.Strong leadership skills - highly pro-active, self-motivated, self-organized, decision-maker, committed, and an excellent team player.Technical background with understanding and/or hands-on experience in software development is preferred.Excellent analytical and problem-solving skills and the ability to analyze the available data and make decisions that affect the project on a regular basis.Sound knowledge and experience on project management tools (JIRA, Confluence) and frameworks such as scrum, kanban, etc.Ability to seamlessly handle multiple projects at once.Ability to work as part of the project management team, and to work independently.Excellent verbal and written communication skills \u2013 both English and Nepali.Certified Scrum Master certification is a plus.Apply InstructionInterested candidates are requested to send their resume atganga@bottle.com.npApply NowSavePrintShare", "Page_URL": "https://www.kumarijob.com/premiumjob/project-manager/28848"}, {"name": "System Support (Network and System)", "company": "Smart Card Nepal Pvt. Ltd", "level": "Mid Level", "vacancy": "2", "address": "Kathmandu", "salary": "As per organization rule'smonth", "deadline": "2020-11-19", "education": "Bachelor's Degree", "experience": "Minimum 1-2 years of experience in related field", "desct": "System Support (Network and System)Smart Card Nepal Pvt. LtdKathmandu17547Share ItView company profileApply NowAboutusSmart Card Nepal was founded in 2071 B.S. with the motive of providing remote bank deposit and digital wallet system in Nepal. Smart Card Nepal is license by Nepal Rastra Bank. Is the best Deposit & Payment Service Provider.Posted On : 2020-08-16Days Left : 1 day leftBasic InformationLocation:KathmanduNo. of vacancy:2Experience:Minimum 1-2 years of experience in related fieldJob category:IT&TelecommunicationJob Level:Mid LevelSalary:As per organization rule'smonthEducational Qualification:Bachelor's DegreeExpiry date:2020-11-19Job DescriptionResponsible for all aspects of the Hardware, Network and IT infrastructure Setup and Implementation from the initial specification, Product launching.Deal with Clients, ISP, BFI and Network providerResponsible for Setup, integration, Monitor System, Hardware and Network Connectivity along with Network and VPN Setup within the Office and Outside OfficeShould be able to Design Network Architecture, Firewall/FortiGate Setup DocumentInstall, configure, and support an organization's local area network (LAN), wide area network (WAN), and Internet system or a segment of a network system.May supervise other network support and client server specialists and plan, coordinate, and implement network security measures.Maintain and administer computernetworksand related computing environments, including computer hardware,systemssoftware, applications software, and all configurations.Job SpecificationGood knowledge of Network SecurityExpert with IPSEC/VPN and other Connectivity typesExtensive experience with OS, Hardware and Server Virtualizations and work independently and in a team environment.Hands on experience in networking, routing and switchingAbility to set up and configure server hardwareAble to lead the Team and ProjectApply NowSavePrintShare", "Page_URL": "https://www.kumarijob.com/premiumjob/system-support-network-and-system/28477"}, {"name": "System Administrator", "company": "Smart Card Nepal Pvt. Ltd", "level": "Mid Level", "vacancy": "1", "address": "Kathmandu", "salary": "As per organization rule'smonth", "deadline": "2020-11-19", "education": "Bachelor's Degree", "experience": "Minimum 2 years of experience in related field", "desct": "System AdministratorSmart Card Nepal Pvt. LtdKathmandu15117Share ItView company profileApply NowAboutusSmart Card Nepal was founded in 2071 B.S. with the motive of providing remote bank deposit and digital wallet system in Nepal. Smart Card Nepal is license by Nepal Rastra Bank. Is the best Deposit & Payment Service Provider.Posted On : 2020-08-16Days Left : 1 day leftBasic InformationLocation:KathmanduNo. of vacancy:1Experience:Minimum 2 years of experience in related fieldJob category:IT&TelecommunicationJob Level:Mid LevelSalary:As per organization rule'smonthEducational Qualification:Bachelor's DegreeExpiry date:2020-11-19Job DescriptionInstall and configure software and hardwareManage network servers and technology toolsSet up accounts and workstationsMonitor performance and maintain systems according to requirementsTroubleshoot issues and outagesEnsure security through access controls, backups and firewallsUpgrade systems with new releases and modelsDevelop expertise to train staff on new technologiesBuild an internal wiki with technical documentation, manuals and IT policiesJob SpecificationProven experience as a System Administrator, Network\u00a0Administrator\u00a0or similar role.Minimum 2 years of experience in related fieldApply NowSavePrintShare", "Page_URL": "https://www.kumarijob.com/premiumjob/system-administrator/28476"}]