[
    {
        "name": "Dot Net Developer : VN",
        "company": "Verisk Nepal",
        "logo": "https://merojob.com/media/uploads/job_logo/c3d22f92-c224-48c2-91b9-4fb191e691bf.jpg",
        "level": "Mid Level",
        "vacancy": "2",
        "time": "Full Time",
        "address": "Kathmandu",
        "salary": "Negotiable",
        "deadline": "Oct. 21, 2020 23:55\n(5 days, 9 hours from now)",
        "education": "Bachelor",
        "experience": "More than or equals to 1 year",
        "skills": "Asp.Net\nCommunication\nAws Services",
        "skills2": "Asp.Net\nCommunication\nAws Services",
        "desc5": "Have strong sense of ownership with demonstrated ability to work independentlyBe focused, passionate, and strive to find simple solutions to complex problemsHave previous design/development experience with large-scale production systems and/or data platforms with knowledge of high availability cloud-based applicationsExperience working with Business Stakeholders. Ability to elaborate and convert business requirements into technical requirements, create architecture and design documents for the stakeholders.Knowledge of cloud-based applications would be a strong plus pointExperience working with large-scale production systems and/or data platformsExperience leading a development effort, including mentoring younger developersExperience interfacing with external groups, product managers, partners, customersBe comfortable working in a dynamic environmentExcellent communication skills (written and verbal)",
        "desc4": "BS/MS degree in Computer Science, Engineering or a related subjectAt least 1 years full-time work experience with good knowledge of AWS environment    Strong ability to build RESTful services in C# with .NET/.NET Core and Python (nice to have).Net Frameworks 4.5+ and .Net Core 2.0+SQL and NoSQL databases (preferably PostgreSQL and/or DynamoDB), ElasticsearchProficient in SQL and relational database conceptsExperience or Knowledge of AWS services like EC2, Lambda, API Gateway, Kinesis, AWS Batch, Athena, Aurora PostgreSQL, DynamoDB, Elasticsearch is a strong plus pointPreferably certified in AWS skills",
        "desc": "",
        "desc1": "Verisk IoT/ Telematics is seeking an Application Developer to develop our next generation products with an opportunity to work with exciting, cutting-edge technologies that will enable us to deliver innovative, fast, scalable and reliable products to our customers.  You will join the core team responsible for the development of our data exchange for connected cars and home that is one of its kind in the world!In this role, you will be working alongside a diverse group of talented individuals that are responsible for creating and maintaining high traffic, API/web products depended on by top auto manufacturers and insurance companies for their daily business.Design and develop high performance software libraries and APIsImplement highly scalable, performant, fault tolerant processing systems in an AWS environmentBe involved in all phases of the agile software development lifecycleWork with our Product teams to gather detailed requirements for new products, services & tools.Proactively seek out and minimize pain points within the infrastructure and code baseKeep up-to-date with the latest technologies and introduce them as neededCreate next-gen solutions for unique and challenging use casesLead a team of junior developer(s), provide guidance and mentorship",
        "desc2": "Role and Required Skills :Have strong sense of ownership with demonstrated ability to work independentlyBe focused, passionate, and strive to find simple solutions to complex problemsHave previous design/development experience with large-scale production systems and/or data platforms with knowledge of high availability cloud-based applicationsExperience working with Business Stakeholders. Ability to elaborate and convert business requirements into technical requirements, create architecture and design documents for the stakeholders.Knowledge of cloud-based applications would be a strong plus pointExperience working with large-scale production systems and/or data platformsExperience leading a development effort, including mentoring younger developersExperience interfacing with external groups, product managers, partners, customersBe comfortable working in a dynamic environmentExcellent communication skills (written and verbal)Skills and Qualifications:BS/MS degree in Computer Science, Engineering or a related subjectAt least 1 years full-time work experience with good knowledge of AWS environment    Strong ability to build RESTful services in C# with .NET/.NET Core and Python (nice to have).Net Frameworks 4.5+ and .Net Core 2.0+SQL and NoSQL databases (preferably PostgreSQL and/or DynamoDB), ElasticsearchProficient in SQL and relational database conceptsExperience or Knowledge of AWS services like EC2, Lambda, API Gateway, Kinesis, AWS Batch, Athena, Aurora PostgreSQL, DynamoDB, Elasticsearch is a strong plus pointPreferably certified in AWS skills",
        "desc3": "Basic Job Information\n\n\n\nJob Category\n:\n\nIT & Telecommunication\n > Programmer/ Software Engineer\n \n\n\nJob Level\n:\n\nMid Level\n\n\n\nNo. of Vacancy/s\n:\n[ 2 ]\n\n\nEmployment Type\n:\n\nFull Time\n\n\n\nJob Location\n:\n\nKathmandu\n\n\n\nOffered Salary\n:\n\nNegotiable\n\n\n\nApply Before(Deadline)\n:\nOct. 21, 2020 23:55\n(5 days, 9 hours from now)\n\n\n\n\n\n\n\n\n\n\n\nJob Specification\n\n\n\nEducation Level\n:\n\nBachelor\n\n\n\nExperience Required\n:\n\nMore than or equals to 1 year\n\n\n\n\nProfessional Skill Required\n:\n\n\nAsp.Net\nCommunication\nAws Services\n\n\n\n\n\n\nOther Specification\n\n\nRole and Required Skills :Have strong sense of ownership with demonstrated ability to work independentlyBe focused, passionate, and strive to find simple solutions to complex problemsHave previous design/development experience with large-scale production systems and/or data platforms with knowledge of high availability cloud-based applicationsExperience working with Business Stakeholders. Ability to elaborate and convert business requirements into technical requirements, create architecture and design documents for the stakeholders.Knowledge of cloud-based applications would be a strong plus pointExperience working with large-scale production systems and/or data platformsExperience leading a development effort, including mentoring younger developersExperience interfacing with external groups, product managers, partners, customersBe comfortable working in a dynamic environmentExcellent communication skills (written and verbal)Skills and Qualifications:BS/MS degree in Computer Science, Engineering or a related subjectAt least 1 years full-time work experience with good knowledge of AWS environment    Strong ability to build RESTful services in C# with .NET/.NET Core and Python (nice to have).Net Frameworks 4.5+ and .Net Core 2.0+SQL and NoSQL databases (preferably PostgreSQL and/or DynamoDB), ElasticsearchProficient in SQL and relational database conceptsExperience or Knowledge of AWS services like EC2, Lambda, API Gateway, Kinesis, AWS Batch, Athena, Aurora PostgreSQL, DynamoDB, Elasticsearch is a strong plus pointPreferably certified in AWS skills\n\n\n\n\n\n\n\n\n\n\n\n Job Description\n\nVerisk IoT/ Telematics is seeking an Application Developer to develop our next generation products with an opportunity to work with exciting, cutting-edge technologies that will enable us to deliver innovative, fast, scalable and reliable products to our customers.  You will join the core team responsible for the development of our data exchange for connected cars and home that is one of its kind in the world!In this role, you will be working alongside a diverse group of talented individuals that are responsible for creating and maintaining high traffic, API/web products depended on by top auto manufacturers and insurance companies for their daily business.Design and develop high performance software libraries and APIsImplement highly scalable, performant, fault tolerant processing systems in an AWS environmentBe involved in all phases of the agile software development lifecycleWork with our Product teams to gather detailed requirements for new products, services & tools.Proactively seek out and minimize pain points within the infrastructure and code baseKeep up-to-date with the latest technologies and introduce them as neededCreate next-gen solutions for unique and challenging use casesLead a team of junior developer(s), provide guidance and mentorship\n\n\n\n\n\n\n\n\nApplying Procedure\n\nVerisk Analytics is an equal opportunity employer.All members of the Verisk Analytics family of companies are equal opportunity employers. We consider all qualified applicants for employment without regard to race, religion, color, national origin, citizenship, sex, gender identity and/or expression, sexual orientation, veteran's status, age or disability.Please apply through the below link : https://smrtr.io/4q7Kf   or  https://careers.smartrecruiters.com/Verisk?search=nepalUnsolicited resumes sent to Verisk, including unsolicited resumes sent to a Verisk business mailing address, fax machine or email address, or directly to Verisk employees, will be considered Verisk property. Verisk will NOT pay a fee for any placement resulting from the receipt of an unsolicited resume. ",
        "Page_URL": "https://merojob.com/dot-net-developer-vn/"
    },
    {
        "name": "Project Manager",
        "company": "AlphaBetaTheta Technologies",
        "logo": "https://merojob.com/media/uploads/job_logo/14afb21b-c406-47d2-ab6f-bb62fc8816ea.jpg",
        "level": "Mid Level",
        "vacancy": "1",
        "time": "Full Time",
        "address": "Butwal",
        "salary": "Negotiable",
        "deadline": "Oct. 30, 2020 23:55\n(2 weeks from now)",
        "education": "Bachelor",
        "experience": "More than or equals to 2 years",
        "skills": "Creative Thinking\nCommunication\nProject Management\nInterpersonal",
        "skills2": "Creative Thinking\nCommunication\nProject Management\nInterpersonal",
        "desc5": "Minimum of two (2) years Project Management experienceSolid knowledge of SDLC process and deep understanding of how a software development project works Good understanding of Agile and Kanban methodologies PMP certification preferredSix Sigma certification preferredStrong conceptual understanding of technology and tools including, but not limited to, ReactJS, C#, Adobe XD, Azure and QA processesDemonstrates a commitment to quality and risk awarenessStrong presentation and communication skills  Excellent verbal and written communication skillsStrong interpersonal skills with the ability to communicate and engage all levels of the organization including senior management and executive committeeProven ability to solve problems creatively Strong familiarity with project management software tools, methodologies, and best practices Strong knowledge of Kanban or Agile project management methodology Experience seeing projects through the full life cycle Excellent analytical skills Strong interpersonal skills and extremely resourceful Proven ability to complete projects according to outlined scope, budget, and timeline ",
        "desc4": "",
        "desc": "",
        "desc1": "We are a growing team and we are seeking to hire a Project Manager to join our team. We build custom applications using the latest and fastest technologies available in the market. We are a motivated team of individuals handling diverse IT projects. If you are passionate about handling unique challenges with a motivated team, this is a great place for you!  You have the unique opportunity to be a part of a transformational team that will create new experiences within Alpha Beta Theta, through modern practices of software development. We have highly talented team members and boast of top notch quality software on every aspect. In this high-paced, creative environment, we know that our people will make all the difference in our success. Leading their success will be you, as a project manager. We need energy, curiosity and a relentless interest in creating the best requirement to delivery experience! The number one thing you need to know about working at Alpha Beta Theta, our employees like being here. They are motivated to come together to reach goals, celebrate wins, and make this a fun place to work. After all, if you love what you do, you never work a day in your life!  Uses proven Project Management tools and methodologies to define and execute projects within defined guidelines and successfully manage projects through to completionActs as the central point of contact for project-related activitiesBreakdown the requirements and assign individual team membersActively participate in all stages of SDLC from requirement to deliveryFacilitates project meetings, hold project participants accountable, creates and posts meeting reviews and posts project documents, maintains project schedules and milestones and ensures project owners/contributors understand and follow standard processes, and adhere to set timelines, budgets and deliverablesManages and reports on changes to business requirements, project scope, and project schedules using appropriate, defined communication channelsForms collaborative partnerships with all levels of staff, including individual developers, developer leads, management, technology and other departmentsManages conflicting points of views to arrive at creative and responsive solutions. Influences completion of project activities through dotted line relationshipsManages day-to-day project activities and makes sound decisions based on project management experience and knowledge of the business/company/industryOther duties as assignedApplying Procedure:To apply for this position, please send an email: info@alphabetatheta.com or apply through the given link  http://alphabetatheta.comOR,",
        "desc2": "Minimum of two (2) years Project Management experienceSolid knowledge of SDLC process and deep understanding of how a software development project works Good understanding of Agile and Kanban methodologies PMP certification preferredSix Sigma certification preferredStrong conceptual understanding of technology and tools including, but not limited to, ReactJS, C#, Adobe XD, Azure and QA processesDemonstrates a commitment to quality and risk awarenessStrong presentation and communication skills  Excellent verbal and written communication skillsStrong interpersonal skills with the ability to communicate and engage all levels of the organization including senior management and executive committeeProven ability to solve problems creatively Strong familiarity with project management software tools, methodologies, and best practices Strong knowledge of Kanban or Agile project management methodology Experience seeing projects through the full life cycle Excellent analytical skills Strong interpersonal skills and extremely resourceful Proven ability to complete projects according to outlined scope, budget, and timeline ",
        "desc3": "Basic Job Information\n\n\n\nJob Category\n:\n\nIT & Telecommunication\n\n\n\nJob Level\n:\n\nMid Level\n\n\n \nNo. of Vacancy/s\n:\n[ 1 ]\n\n\nEmployment Type\n:\n\nFull Time\n\n\n\nJob Location\n:\n\nButwal\nKathmandu\n\n\n\nOffered Salary\n:\n\nNegotiable\n\n\n\nApply Before(Deadline)\n:\nOct. 30, 2020 23:55\n(2 weeks from now)\n\n\n\n\n\n\n\n\n\n\n\nJob Specification\n\n\n\nEducation Level\n:\n\nBachelor\n\n\n\nExperience Required\n:\n\nMore than or equals to 2 years\n\n\n\nProfessional Skill Required\n:\n\n\nCreative Thinking\nCommunication\nProject Management\nInterpersonal\n\n\n\n\n\n\nOther Specification\n\n\nMinimum of two (2) years Project Management experienceSolid knowledge of SDLC process and deep understanding of how a software development project works Good understanding of Agile and Kanban methodologies PMP certification preferredSix Sigma certification preferredStrong conceptual understanding of technology and tools including, but not limited to, ReactJS, C#, Adobe XD, Azure and QA processesDemonstrates a commitment to quality and risk awarenessStrong presentation and communication skills  Excellent verbal and written communication skillsStrong interpersonal skills with the ability to communicate and engage all levels of the organization including senior management and executive committeeProven ability to solve problems creatively Strong familiarity with project management software tools, methodologies, and best practices Strong knowledge of Kanban or Agile project management methodology Experience seeing projects through the full life cycle Excellent analytical skills Strong interpersonal skills and extremely resourceful Proven ability to complete projects according to outlined scope, budget, and timeline \n\n\n\n\n\n\n\n\n\n\n\nJob Description\n\nWe are a growing team and we are seeking to hire a Project Manager to join our team. We build custom applications using the latest and fastest technologies available in the market. We are a motivated team of individuals handling diverse IT projects. If you are passionate about handling unique challenges with a motivated team, this is a great place for you!  You have the unique opportunity to be a part of a transformational team that will create new experiences within Alpha Beta Theta, through modern practices of software development. We have highly talented team members and boast of top notch quality software on every aspect. In this high-paced, creative environment, we know that our people will make all the difference in our success. Leading their success will be you, as a project manager. We need energy, curiosity and a relentless interest in creating the best requirement to delivery experience! The number one thing you need to know about working at Alpha Beta Theta, our employees like being here. They are motivated to come together to reach goals, celebrate wins, and make this a fun place to work. After all, if you love what you do, you never work a day in your life!  Uses proven Project Management tools and methodologies to define and execute projects within defined guidelines and successfully manage projects through to completionActs as the central point of contact for project-related activitiesBreakdown the requirements and assign individual team membersActively participate in all stages of SDLC from requirement to deliveryFacilitates project meetings, hold project participants accountable, creates and posts meeting reviews and posts project documents, maintains project schedules and milestones and ensures project owners/contributors understand and follow standard processes, and adhere to set timelines, budgets and deliverablesManages and reports on changes to business requirements, project scope, and project schedules using appropriate, defined communication channelsForms collaborative partnerships with all levels of staff, including individual developers, developer leads, management, technology and other departmentsManages conflicting points of views to arrive at creative and responsive solutions. Influences completion of project activities through dotted line relationshipsManages day-to-day project activities and makes sound decisions based on project management experience and knowledge of the business/company/industryOther duties as assignedApplying Procedure:To apply for this position, please send an email: info@alphabetatheta.com or apply through the given link  http://alphabetatheta.comOR,\n\n\n\n\n\n\n\n\nAPPLY NOW",
        "Page_URL": "https://merojob.com/project-manager-391/"
    },
    {
        "name": "Back End Developer",
        "company": "AlphaBetaTheta Technologies",
        "logo": "https://merojob.com/media/uploads/job_logo/1b7e688b-193d-4482-a5a3-2a8e397caaed.jpg",
        "level": "Mid Level",
        "vacancy": "1",
        "time": "Full Time",
        "address": "Butwal",
        "salary": "Negotiable",
        "deadline": "Oct. 30, 2020 23:55\n(2 weeks from now)",
        "education": "Bachelor",
        "experience": "More than or equals to 1 year",
        "skills": "Debugging\nResearch\nQa Automation\nCoding Skills",
        "skills2": "Debugging\nResearch\nQa Automation\nCoding Skills",
        "desc5": "Hands-on professional development experience with C#/Asp.Net Framework and SQL ServerExperience in web development, including ASP.NET Web Services and Web APIExperience with version control system like gitProficient with SQL databaseExcellent research and debugging skills Ability to work independently as well as with a team to analyze business requirements and develop solutions Clean coding skills Investigate and develop skills in new technologies ",
        "desc4": "",
        "desc": "",
        "desc1": "We are a growing team and we are seeking to hire a C# Developer to join our team. We are a motivated team of individuals handling diverse projects. If getting the highest performance and reusability for your code excites you, this is a great place for you!  you have the unique opportunity to be a part of a transformational team that will create new experiences within Alpha Beta Theta through modern practices of coding. We leverage the latest serverless architecture and technologies to make our backend as reliable as possible. You will be working with our team with its highly talented members who take pride on their code and analysis. In this high-paced, creative environment, we know that our people will make all the difference in our success.  We need energy, curiosity and a relentless interest in creating the best performance!The number one thing you need to know about working at Alpha Beta Theta, our employees like being here. They are motivated to come together to reach goals, celebrate wins, and make this a fun place to work. After all, if you love what you do, you never work a day in your life! Gather and evaluate user requirements from project managerCollaborate with team members to complete the assigned taskProduce high-quality backend solutions with a well-structured and organized code Properly communicate databases migrations and schema when going to productionCreate a JSON contract with front end team Clearly communicate your architectural ideas to team membersStay up to date with new coding trends and technologiesWrite reliable code acknowledging security and maintainability challengesApplying Procedure :To apply for this position, please send an email: info@alphabetatheta.com or apply through the given link  http://alphabetatheta.comOR,",
        "desc2": "Hands-on professional development experience with C#/Asp.Net Framework and SQL ServerExperience in web development, including ASP.NET Web Services and Web APIExperience with version control system like gitProficient with SQL databaseExcellent research and debugging skills Ability to work independently as well as with a team to analyze business requirements and develop solutions Clean coding skills Investigate and develop skills in new technologies ",
        "desc3": "Basic Job Information\n\n\n\nJob Category\n:\n\nIT & Telecommunication\n\n\n\nJob Level\n:\n\nMid Level\n\n \n\nNo. of Vacancy/s\n:\n[ 1 ]\n\n\nEmployment Type\n:\n\nFull Time\n\n\n\nJob Location\n:\n\nButwal\nKathmandu\n\n\n\nOffered Salary\n:\n\nNegotiable\n\n\n\nApply Before(Deadline)\n:\nOct. 30, 2020 23:55\n(2 weeks from now)\n\n\n\n\n\n\n\n\n\n\n\nJob Specification\n\n\n\nEducation Level\n:\n\nBachelor\n\n\n\nExperience Required\n:\n\nMore than or equals to 1 year\n\n\n\n Professional Skill Required\n:\n\n\nDebugging\nResearch\nQa Automation\nCoding Skills\n\n\n\n\n\n\nOther Specification\n\n\nHands-on professional development experience with C#/Asp.Net Framework and SQL ServerExperience in web development, including ASP.NET Web Services and Web APIExperience with version control system like gitProficient with SQL databaseExcellent research and debugging skills Ability to work independently as well as with a team to analyze business requirements and develop solutions Clean coding skills Investigate and develop skills in new technologies \n\n\n\n\n\n\n\n\n\n\n\nJob Description\n\nWe are a growing team and we are seeking to hire a C# Developer to join our team. We are a motivated team of individuals handling diverse projects. If getting the highest performance and reusability for your code excites you, this is a great place for you!  you have the unique opportunity to be a part of a transformational team that will create new experiences within Alpha Beta Theta through modern practices of coding. We leverage the latest serverless architecture and technologies to make our backend as reliable as possible. You will be working with our team with its highly talented members who take pride on their code and analysis. In this high-paced, creative environment, we know that our people will make all the difference in our success.  We need energy, curiosity and a relentless interest in creating the best performance!The number one thing you need to know about working at Alpha Beta Theta, our employees like being here. They are motivated to come together to reach goals, celebrate wins, and make this a fun place to work. After all, if you love what you do, you never work a day in your life! Gather and evaluate user requirements from project managerCollaborate with team members to complete the assigned taskProduce high-quality backend solutions with a well-structured and organized code Properly communicate databases migrations and schema when going to productionCreate a JSON contract with front end team Clearly communicate your architectural ideas to team membersStay up to date with new coding trends and technologiesWrite reliable code acknowledging security and maintainability challengesApplying Procedure :To apply for this position, please send an email: info@alphabetatheta.com or apply through the given link  http://alphabetatheta.comOR,\n\n\n\n\n\n\n\n\nAPPLY NOW",
        "Page_URL": "https://merojob.com/back-end-developer-11/"
    },
    {
        "name": "Sr Node.js Developer",
        "company": "IDenTV Nepal",
        "logo": "https://merojob.com/media/uploads/job_logo/f4ffa663-e0fe-42b1-99a9-b5e0298216ed.jpg",
        "level": "Senior Level",
        "vacancy": "3",
        "time": "Full Time",
        "address": "Kathmandu",
        "salary": "NRs. 50,000.00 - 200,000.00 Monthly",
        "deadline": "Nov. 07, 2020 23:55\n(3 weeks, 1 day from now)",
        "education": "Bachelor",
        "experience": "More than or equals to 2 years",
        "skills": "Jest\nJavascript\nNode.Js",
        "skills2": "Jest\nJavascript\nNode.Js",
        "desc5": "Experience building enterprise-scale backend REST services using an API-first paradigmHands-on experience building services with Node.jsHands-on understanding of virtualization and experience with DockerExperience implementing NoSQL databases like MongoDBYou are very comfy with NodeJS / MongoDB / APIs. You master deep details of the language/librariesAble to work well on a remote, multi-national team with Agile and ScrumExcellent communication skills, both written and verbalAWS DevOps (EKS, EC2, CloudFront + more), ElasticSearch is a nice to have",
        "desc4": "",
        "desc": "",
        "desc1": "Oversee and/or lead analysis, architecture design, development and maintenance of large scale and/or complex applicationsWrite modular, reusable and excellent quality code, code reviews, and implement best practicesSupport the migration and redeployment of existing application (if any)Take responsibility of project and ensure robust hosting, application stability, security and system integration",
        "desc2": "Experience building enterprise-scale backend REST services using an API-first paradigmHands-on experience building services with Node.jsHands-on understanding of virtualization and experience with DockerExperience implementing NoSQL databases like MongoDBYou are very comfy with NodeJS / MongoDB / APIs. You master deep details of the language/librariesAble to work well on a remote, multi-national team with Agile and ScrumExcellent communication skills, both written and verbalAWS DevOps (EKS, EC2, CloudFront + more), ElasticSearch is a nice to have",
        "desc3": "Basic Job Information\n \n\n\nJob Category\n:\n\nIT & Telecommunication\n > Programmer/ Software Engineer, Software Architect, Team Leader (Software), Web Developer/Web Designer\n\n\n\nJob Level\n:\n\nSenior Level\n\n\n\nNo. of Vacancy/s\n:\n[ 3 ]\n\n\nEmployment Type\n:\n\nFull Time\n\n\n\nJob Location\n:\n\nKathmandu\n\n\n\nOffered Salary\n:\n\nNRs. 50,000.00 - 200,000.00 Monthly\n\n\n\nApply Before(Deadline)\n:\nNov. 07, 2020 23:55\n(3 weeks, 1 day from now)\n\n\n\n\n\n\n\n\n\n\n\nJob Specification\n\n\n\nEducation Level\n:\n \nBachelor\n\n\n\nExperience Required\n:\n\nMore than or equals to 2 years\n\n\n\nProfessional Skill Required\n:\n\n\nJest\nJavascript\nNode.Js\n\n\n\n\n\n\nOther Specification\n\n\nExperience building enterprise-scale backend REST services using an API-first paradigmHands-on experience building services with Node.jsHands-on understanding of virtualization and experience with DockerExperience implementing NoSQL databases like MongoDBYou are very comfy with NodeJS / MongoDB / APIs. You master deep details of the language/librariesAble to work well on a remote, multi-national team with Agile and ScrumExcellent communication skills, both written and verbalAWS DevOps (EKS, EC2, CloudFront + more), ElasticSearch is a nice to have\n\n\n\n\n\n\n\n\n\n\n\nJob Description\n\nOversee and/or lead analysis, architecture design, development and maintenance of large scale and/or complex applicationsWrite modular, reusable and excellent quality code, code reviews, and implement best practicesSupport the migration and redeployment of existing application (if any)Take responsibility of project and ensure robust hosting, application stability, security and system integration\n\n\n\n\n\n\n\n\nAPPLY NOW",
        "Page_URL": "https://merojob.com/sr-nodejs-developer/"
    },
    {
        "name": "Senior .Net Developer",
        "company": "Eightsquare",
        "logo": "https://merojob.com/media/uploads/job_logo/ee06ba0f-4300-4256-a091-411ecf85d77d.jpg",
        "level": "Senior Level",
        "vacancy": "2",
        "time": "Full Time",
        "address": "Kathmandu",
        "salary": "Negotiable",
        "deadline": "Nov. 01, 2020 23:55\n(2 weeks, 2 days from now)",
        "education": "Bachelor",
        "experience": "More than or equals to 5 years",
        "skills": "Problem Solving\nManagerial Skills\nCommunication\n\nProject Management",
        "skills2": "Problem Solving\nManagerial Skills\nCommunication\n\nProject Management",
        "desc5": "Strong knowledge of .NET web framework Must have and ample knowledge on front end development (especially Vue, Angular...).Proficient in C#, with a good knowledge of their ecosystemsStrong understanding of object-oriented programmingSkill for writing reusable librariesFamiliarity with Microsoft SQL Server and design/architectural patternsFamiliarity with architecture styles/APIs (REST, RPC)Understanding of Agile methodologiesExcellent troubleshooting and communication skillsAttention to detailExperience creating database schemas that represent and support business processesExperience implementing automated testing platforms and unit testsProficient understanding of code versioning tools such as Git, SVN, and MercurialSome knowledge in node js, MongoDB and Redis ",
        "desc4": "",
        "desc": "",
        "desc1": "Supporting the technical design process by participating in the analysis of technical application requirementsWriting scalable code for .NET software applicationsReviewing, debugging and upgrading existing .NET web and applicationsProviding support and training for junior developersCoding and testing program modules; assisting in design by collaborating with internal teamDrafting software and application operating proceduresTest and deploy applications and systemsDevelop documentation throughout the software development life cycle (SDLC)Participating in execution and documentation of testsDrive the delivery quality system utilizing automated unit testing, TDD and performance testingCollaborate with internal team to identify pain points, develop solutions and evangelize best practiceCompany Benefits:Competitive RemunerationTimely Appraisal and Pay UpgradationSophisticated InfrastructureMedical insurance inclusive Spouse, Parents & ChildrenAccidental and Term Life InsuranceFestival AllowanceOnsite Engagement with MultinationInternational Travel Exposure and Allowance.Technical and Soft Skills Trainings.Retreat ProgramsApplying Procedure:Candidates who meet the above specified requirements are encouraged to send their CV’s with a covering letter at hr@8squarei.com.OR,",
        "desc2": "Strong knowledge of .NET web framework Must have and ample knowledge on front end development (especially Vue, Angular...).Proficient in C#, with a good knowledge of their ecosystemsStrong understanding of object-oriented programmingSkill for writing reusable librariesFamiliarity with Microsoft SQL Server and design/architectural patternsFamiliarity with architecture styles/APIs (REST, RPC)Understanding of Agile methodologiesExcellent troubleshooting and communication skillsAttention to detailExperience creating database schemas that represent and support business processesExperience implementing automated testing platforms and unit testsProficient understanding of code versioning tools such as Git, SVN, and MercurialSome knowledge in node js, MongoDB and Redis ",
        "desc3": "Basic Job Information\n\n\n\nJob Category\n:\n\nIT & Telecommunication\n\n\n\nJob Level\n:\n\nSenior Level\n\n\n\nNo. of Vacancy/s\n:\n[ 2 ]\n\n\nEmployment Type\n:\n\nFull Time\n \n\n\nJob Location\n:\n\nKathmandu\n\n\n\nOffered Salary\n:\n\nNegotiable\n\n\n\nApply Before(Deadline)\n:\nNov. 01, 2020 23:55\n(2 weeks, 2 days from now)\n\n\n\n\n\n\n\n\n\n\n\nJob Specification\n\n\n\nEducation Level\n:\n\nBachelor\n\n\n\nExperience Required\n:\n\nMore than or equals to 5 years\n\n\n\nProfessional Skill Required\n:\n\n\nProblem Solving\nManagerial Skills\nCommunication\n\nProject Management\n\n\n\n\n\n\nOther Specification\n\n\nStrong knowledge of .NET web framework Must have and ample knowledge on front end development (especially Vue, Angular...).Proficient in C#, with a good knowledge of their ecosystemsStrong understanding of object-oriented programmingSkill for writing reusable librariesFamiliarity with Microsoft SQL Server and design/architectural patternsFamiliarity with architecture styles/APIs (REST, RPC)Understanding of Agile methodologiesExcellent troubleshooting and communication skillsAttention to detailExperience creating database schemas that represent and support business processesExperience implementing automated testing platforms and unit testsProficient understanding of code versioning tools such as Git, SVN, and MercurialSome knowledge in node js, MongoDB and Redis \n\n\n\n\n\n\n\n\n\n\n\nJob Description\n\nSupporting the technical design process by participating in the analysis of technical application requirementsWriting scalable code for .NET software applicationsReviewing, debugging and upgrading existing .NET web and applicationsProviding support and training for junior developersCoding and testing program modules; assisting in design by collaborating with internal teamDrafting software and application operating proceduresTest and deploy applications and systemsDevelop documentation throughout the software development life cycle (SDLC)Participating in execution and documentation of testsDrive the delivery quality system utilizing automated unit testing, TDD and performance testingCollaborate with internal team to identify pain points, develop solutions and evangelize best practiceCompany Benefits:Competitive RemunerationTimely Appraisal and Pay UpgradationSophisticated InfrastructureMedical insurance inclusive Spouse, Parents & ChildrenAccidental and Term Life InsuranceFestival AllowanceOnsite Engagement with MultinationInternational Travel Exposure and Allowance.Technical and Soft Skills Trainings.Retreat ProgramsApplying Procedure:Candidates who meet the above specified requirements are encouraged to send their CV’s with a covering letter at hr@8squarei.com.OR,\n\n\n\n\n\n\n\n\nAPPLY NOW",
        "Page_URL": "https://merojob.com/senior-net-developer-48/"
    },
    {
        "name": "iOS Developer",
        "company": "EBPearls",
        "logo": "https://merojob.com/media/uploads/job_logo/cc676175-3db2-4934-a790-18851758ef6c.jpg",
        "level": "Mid Level",
        "vacancy": "1",
        "time": "Full Time",
        "address": "Kandevsthan",
        "salary": "Negotiable",
        "deadline": "Oct. 17, 2020 23:55\n(1 day, 9 hours from now)",
        "education": "Bachelor",
        "experience": "More than or equals to 2 years",
        "skills": "Orm And Rdbms\nCoredata\nCocoa Touch",
        "skills2": "Orm And Rdbms\nCoredata\nCocoa Touch",
        "desc5": "University Bachelor's degree in Computer Engineering or equivalent in relevant stream Minimum 2 years of relevant professional work experience",
        "desc4": "Experience with Objective-C/Swift, with full command of the Cocoa Touch FrameworkExperience with Core Framework like Core Graphics, Core Location, Core AnimationStrong knowledge of CoreData, ORM and RDBMS conceptsExperience with RESTful web services and parsing JSON/XMLExperience with reactive programmingExperience with dependency management tools like: Cocoapods, SPM and commands related to Cocoapods dependency managerExperience with breakpoints and inspection, LLDB commandsExperience with concept of threads managementFluency with Xcode, JIRA, GITStrong knowledge of MVC, MVVM, Architecture component and memorymanagementUnderstanding of the full mobile development life cycleStrong coding and analytical skillsGood understanding of OOPS concepts, and Design patternsStrong coding and analytical skills",
        "desc": "Should be able to integrate 3rd party library manuallyProfessional experience with deployment, Apple Store policiesStrong software engineering skills, can design and implement software projects from the ground up.",
        "desc1": "Position OverviewAre you passionate about developing state of the art web and mobile app solutions? Do you want to work with the award winning iOS App Development team?We are looking for iOS Developers who will be a responsible member of the Mobile Apps development team, the largest team at EB Pearls. This position is responsible for developing projects as per clients’ requirements. iOS developer reports directly to the Project Manager and is accountable for the Project Development.Job Roles and Responsibilities1. Project AccountabilityUnderstand the project requirements clearly.Generate queries in case there is any confusion in understanding the project.Discuss any technical challenges that might come affront while working on the project.Realize the project delivery date and understand the communication channels.Write codes to develop a quality product on time.Conduct first hand testing of the project tasks before submitting the tasks to the Project Manager.Verify the product with SRS.2. Adapt to EB Work CultureAttend project meetings conducted by Project Manager with full preparation by studying the project documents and information.Follow company coding standards.3. Team CoordinationTake ownership of the project from planning to the delivery of the project.Be easily approachable and flexible in work.Perks and BenefitsWe strive to make sure that our people are comfortable, happy and growing at EB Pearls.We offer:Insurance: We enroll our employees in the company's group insurance policy that covers both medial and accidental insurance.Competitive Salary: We strive to ensure that our people get competitive remuneration as per the industry standardsTimely performance appraisal and salary reviews: We conduct bi yearly performance review to ensure that our people are always on top of their game and ensure yearly salary review on a timely basis to compliment.Paid Time Off (PTO)/ Paid Holidays: PTO refers to days when you can take time away from work while still being paid your usual salary. We provide 13 business days off as festival holidays.Employee Recognition: We are a company led by performers and we never fail to acknowledge the exemplary performance of our peopleSocial Security Fund: SSF is a contribution based social security scheme, the employee contributes 11 % and the employer adds 20% of the basic salary per month( 31% of the basic salary of employee) every month.Festival Allowance: We have the provision of festival allowance and provide Dashain bonus which is based on the amount of employees’ basic salary.Training and Development Programs: We are obsessed with constantly developing our competencies. Hence, we determine the training needs for our people from the performance review that we conduct bi- yearly.Work on next generation technology projectsWork with leading edge technologyFun At EBAll work and no play is not our cup of tea. At EB, we enjoy:Office Events: Chat and Chew, Residential Annual Event, Team Lunch OutEEC Club Activities: Night outs, Picnics, Lunch Outs, Futsal, Festival Events, Pool Parties, Day out eventsFood and Coffee: Office Provided lunch and stocked pantryInspiring Colleagues: Fun and friendly work environment with brilliant one of a kind teamApplying ProcedureSubmit a cover letter along with your recently updated resume via email to “careers@ebpearls.com” with “Application for iOS Developer” in the subject line.OR,Send your application via our website: CLICK HEREOR,",
        "desc2": "Qualifications RequiredUniversity Bachelor's degree in Computer Engineering or equivalent in relevant stream Minimum 2 years of relevant professional work experienceSkills RequiredExperience with Objective-C/Swift, with full command of the Cocoa Touch FrameworkExperience with Core Framework like Core Graphics, Core Location, Core AnimationStrong knowledge of CoreData, ORM and RDBMS conceptsExperience with RESTful web services and parsing JSON/XMLExperience with reactive programmingExperience with dependency management tools like: Cocoapods, SPM and commands related to Cocoapods dependency managerExperience with breakpoints and inspection, LLDB commandsExperience with concept of threads managementFluency with Xcode, JIRA, GITStrong knowledge of MVC, MVVM, Architecture component and memorymanagementUnderstanding of the full mobile development life cycleStrong coding and analytical skillsGood understanding of OOPS concepts, and Design patternsStrong coding and analytical skillsSkills PreferredShould be able to integrate 3rd party library manuallyProfessional experience with deployment, Apple Store policiesStrong software engineering skills, can design and implement software projects from the ground up.",
        "desc3": "Basic Job Information\n\n\n\nJob Category\n:\n\nIT & Telecommunication\n\n\n\nJob Level\n:\n\nMid Level\n\n\n\nNo. of Vacancy/s\n:\n[ 1 ]\n\n\nEmployment Type\n:\n\nFull Time\n\n\n\nJob Location\n:\n\nKandevsthan\n\n\n\nOffered Salary\n:\n\nNegotiable\n\n\n\nApply Before(Deadline)\n:\nOct. 17, 2020 23:55\n(1 day, 9 hours from now)\n\n\n\n\n\n\n\n\n\n\n\nJob Specification\n\n\n\nEducation Level\n:\n\nBachelor\n\n\n\nExperience Required\n:\n\nMore than or equals to 2 years\n\n\n\nProfessional Skill Required\n:\n\n\nOrm And Rdbms\nCoredata\nCocoa Touch\n\n\n\n\n\n\nOther Specification\n\n\nQualifications RequiredUniversity Bachelor's degree in Computer Engineering or equivalent in relevant stream Minimum 2 years of relevant professional work experienceSkills RequiredExperience with Objective-C/Swift, with full command of the Cocoa Touch FrameworkExperience with Core Framework like Core Graphics, Core Location, Core AnimationStrong knowledge of CoreData, ORM and RDBMS conceptsExperience with RESTful web services and parsing JSON/XMLExperience with reactive programmingExperience with dependency management tools like: Cocoapods, SPM and commands related to Cocoapods dependency managerExperience with breakpoints and inspection, LLDB commandsExperience with concept of threads managementFluency with Xcode, JIRA, GITStrong knowledge of MVC, MVVM, Architecture component and memorymanagementUnderstanding of the full mobile development life cycleStrong coding and analytical skillsGood understanding of OOPS concepts, and Design patternsStrong coding and analytical skillsSkills PreferredShould be able to integrate 3rd party library manuallyProfessional experience with deployment, Apple Store policiesStrong software engineering skills, can design and implement software projects from the ground up.\n\n \n\n\n\n\n\n\n\n\n\nJob Description\n\nPosition OverviewAre you passionate about developing state of the art web and mobile app solutions? Do you want to work with the award winning iOS App Development team?We are looking for iOS Developers who will be a responsible member of the Mobile Apps development team, the largest team at EB Pearls. This position is responsible for developing projects as per clients’ requirements. iOS developer reports directly to the Project Manager and is accountable for the Project Development.Job Roles and Responsibilities1. Project AccountabilityUnderstand the project requirements clearly.Generate queries in case there is any confusion in understanding the project.Discuss any technical challenges that might come affront while working on the project.Realize the project delivery date and understand the communication channels.Write codes to develop a quality product on time.Conduct first hand testing of the project tasks before submitting the tasks to the Project Manager.Verify the product with SRS.2. Adapt to EB Work CultureAttend project meetings conducted by Project Manager with full preparation by studying the project documents and information.Follow company coding standards.3. Team CoordinationTake ownership of the project from planning to the delivery of the project.Be easily approachable and flexible in work.Perks and BenefitsWe strive to make sure that our people are comfortable, happy and growing at EB Pearls.We offer:Insurance: We enroll our employees in the company's group insurance policy that covers both medial and accidental insurance.Competitive Salary: We strive to ensure that our people get competitive remuneration as per the industry standardsTimely performance appraisal and salary reviews: We conduct bi yearly performance review to ensure that our people are always on top of their game and ensure yearly salary review on a timely basis to compliment.Paid Time Off (PTO)/ Paid Holidays: PTO refers to days when you can take time away from work while still being paid your usual salary. We provide 13 business days off as festival holidays.Employee Recognition: We are a company led by performers and we never fail to acknowledge the exemplary performance of our peopleSocial Security Fund: SSF is a contribution based social security scheme, the employee contributes 11 % and the employer adds 20% of the basic salary per month( 31% of the basic salary of employee) every month.Festival Allowance: We have the provision of festival allowance and provide Dashain bonus which is based on the amount of employees’ basic salary.Training and Development Programs: We are obsessed with constantly developing our competencies. Hence, we determine the training needs for our people from the performance review that we conduct bi- yearly.Work on next generation technology projectsWork with leading edge technologyFun At EBAll work and no play is not our cup of tea. At EB, we enjoy:Office Events: Chat and Chew, Residential Annual Event, Team Lunch OutEEC Club Activities: Night outs, Picnics, Lunch Outs, Futsal, Festival Events, Pool Parties, Day out eventsFood and Coffee: Office Provided lunch and stocked pantryInspiring Colleagues: Fun and friendly work environment with brilliant one of a kind teamApplying ProcedureSubmit a cover letter along with your recently updated resume via email to “careers@ebpearls.com” with “Application for iOS Developer” in the subject line.OR,Send your application via our website: CLICK HEREOR,\n\n\n\n\n\n\n\n\nAPPLY NOW",
        "Page_URL": "https://merojob.com/ios-developer-102/"
    },
    {
        "name": "Android Developer",
        "company": "EBPearls",
        "logo": "https://merojob.com/media/uploads/job_logo/3c67e8d1-b656-4c45-8ee7-7ce60c93cdd7.jpg",
        "level": "Mid Level",
        "vacancy": "1",
        "time": "Full Time",
        "address": "Kandevsthan",
        "salary": "Negotiable",
        "deadline": "Oct. 17, 2020 22:55\n(1 day, 8 hours from now)",
        "education": "Bachelor",
        "experience": "More than or equals to 2 years",
        "skills": "Mvvm\nArchitecture\nMvc",
        "skills2": "Mvvm\nArchitecture\nMvc",
        "desc5": "University Bachelor's degree in Computer Engineering or equivalent in relevant streamMinimum 2 years of professional work experience in software development using technologies: Java/Kotlin",
        "desc4": "Experience in Kotlin/ Java (extensions, data classes, sealed classes, objects and basics of coroutines, Lambda & higher order functions)Strong knowledge of MVC, MVVM, Architecture component and memory managementStrong knowledge of ROOM models and define relationships, access dates using DAO'sExperience with offline storage, threading, and performance tuningExperience with Android Studio, Android Components and UI Component, Animation & Design GuidelinesHigh-caliber proficiency in Android SDK and experience with third-party SDKs and APIsStrong coding and analytical skills",
        "desc": "Understanding of Android Coding Architecture & PatternsStrong knowledge of Problem breakdown into multiple functionsStrong knowledge of SQLLite and able to perform CRUD operations, JOINs and proficient in RDBMS.Experience with Testing & Debugging (unit testing, UI testing and automation)Experience with RESTful web services and parsing JSON/XMLFluency with XCode, JIRA, GIT and other common software development toolsStrong software engineering skills, can design and implement software projects from the ground up.Understanding of the full mobile development life cycleGood understanding of OOPS concepts, and Design pattern",
        "desc1": "Position OverviewAre you passionate about developing state of the art web and mobile app solutions? Do you want to work with the award winning Android App Development team? We are looking for Android Developers who will be a responsible member of the Mobile Apps development team, the largest team at EB Pearls. This position is responsible for developing projects as per clients’ requirements. Android developer reports directly to the Project Manager and is accountable for the Project Development.Job Roles and Responsibilities:1. Project AccountabilityUnderstand the project requirements clearly.Generate queries in case there is any confusion in understanding the project.Discuss any technical challenges that might come affront while working on the project.Realize the project delivery date and understand the communication channels.Write codes to develop a quality product on time.Conduct first hand testing of the project tasks before submitting the tasks to the Project Manager.Verify the product with SRS.2. Adapt to EB Work CultureAttend project meetings conducted by Project Manager with full preparation by studying the project documents and information.Follow company coding standards.3. Team CoordinationTake ownership of the project from planning to the delivery of the project.Be easily approachable and flexible in work.Perks and BenefitsWe strive to make sure that our people are comfortable, happy and growing at EB Pearls.We offer:Insurance: We enroll our employees in the company's group insurance policy that covers both medial and accidental insurance.Competitive Salary: We strive to ensure that our people get competitive remuneration as per the industry standardsTimely performance appraisal and salary reviews: We conduct bi yearly performance review to ensure that our people are always on top of their game and ensure yearly salary review on a timely basis to compliment.Paid Time Off (PTO)/ Paid Holidays: PTO refers to days when you can take time away from work while still being paid your usual salary. We provide 13 business days off as festival holidays.Employee Recognition: We are a company led by performers and we never fail to acknowledge the exemplary performance of our peopleSocial Security Fund: SSF is a contribution based social security scheme, the employee contributes 11 % and the employer adds 20% of the basic salary per month( 31% of the basic salary of employee) every month.Festival Allowance: We have the provision of festival allowance and provide Dashain bonus which is based on the amount of employees’ basic salary.Training and Development Programs: We are obsessed with constantly developing our competencies. Hence, we determine the training needs for our people from the performance review that we conduct bi- yearly.Work on next generation technology projectsWork with leading edge technologyFun At EBAll work and no play is not our cup of tea. At EB, we enjoy:Office Events: Chat and Chew, Residential Annual Event, Team Lunch OutEEC Club Activities: Night outs, Picnics, Lunch Outs, Futsal, Festival Events, Pool Parties, Day out eventsFood and Coffee: Office Provided lunch and stocked pantryInspiring Colleagues: Fun and friendly work environment with brilliant one of a kind teamApplying ProcedureSubmit a cover letter along with your recently updated resume via email to “careers@ebpearls.com” with “Application for Android Developer” in the subject line.OR,Send your application via our website: CLICK HEREOR,",
        "desc2": "Qualifications RequiredUniversity Bachelor's degree in Computer Engineering or equivalent in relevant streamMinimum 2 years of professional work experience in software development using technologies: Java/KotlinSkills RequiredExperience in Kotlin/ Java (extensions, data classes, sealed classes, objects and basics of coroutines, Lambda & higher order functions)Strong knowledge of MVC, MVVM, Architecture component and memory managementStrong knowledge of ROOM models and define relationships, access dates using DAO'sExperience with offline storage, threading, and performance tuningExperience with Android Studio, Android Components and UI Component, Animation & Design GuidelinesHigh-caliber proficiency in Android SDK and experience with third-party SDKs and APIsStrong coding and analytical skillsSkills PreferredUnderstanding of Android Coding Architecture & PatternsStrong knowledge of Problem breakdown into multiple functionsStrong knowledge of SQLLite and able to perform CRUD operations, JOINs and proficient in RDBMS.Experience with Testing & Debugging (unit testing, UI testing and automation)Experience with RESTful web services and parsing JSON/XMLFluency with XCode, JIRA, GIT and other common software development toolsStrong software engineering skills, can design and implement software projects from the ground up.Understanding of the full mobile development life cycleGood understanding of OOPS concepts, and Design pattern",
        "desc3": "Basic Job Information\n\n\n\nJob Category\n:\n\nIT & Telecommunication\n\n\n\nJob Level\n:\n\nMid Level\n \n\n\nNo. of Vacancy/s\n:\n[ 1 ]\n\n\nEmployment Type\n:\n\nFull Time\n\n\n\nJob Location\n:\n\nKandevsthan\n\n\n\nOffered Salary\n:\n\nNegotiable\n\n\n\nApply Before(Deadline)\n:\nOct. 17, 2020 22:55\n(1 day, 8 hours from now)\n\n\n\n\n\n\n\n\n\n\n\nJob Specification\n\n\n\nEducation Level\n:\n\nBachelor\n\n\n\nExperience Required\n:\n\nMore than or equals to 2 years\n\n\n\nProfessional Skill Required\n:\n\n\nMvvm\nArchitecture\nMvc\n\n\n\n\n\n\nOther Specification\n\n\nQualifications RequiredUniversity Bachelor's degree in Computer Engineering or equivalent in relevant streamMinimum 2 years of professional work experience in software development using technologies: Java/KotlinSkills RequiredExperience in Kotlin/ Java (extensions, data classes, sealed classes, objects and basics of coroutines, Lambda & higher order functions)Strong knowledge of MVC, MVVM, Architecture component and memory managementStrong knowledge of ROOM models and define relationships, access dates using DAO'sExperience with offline storage, threading, and performance tuningExperience with Android Studio, Android Components and UI Component, Animation & Design GuidelinesHigh-caliber proficiency in Android SDK and experience with third-party SDKs and APIsStrong coding and analytical skillsSkills PreferredUnderstanding of Android Coding Architecture & PatternsStrong knowledge of Problem breakdown into multiple functionsStrong knowledge of SQLLite and able to perform CRUD operations, JOINs and proficient in RDBMS.Experience with Testing & Debugging (unit testing, UI testing and automation)Experience with RESTful web services and parsing JSON/XMLFluency with XCode, JIRA, GIT and other common software development toolsStrong software engineering skills, can design and implement software projects from the ground up.Understanding of the full mobile development life cycleGood understanding of OOPS concepts, and Design pattern\n\n\n\n\n\n\n\n\n\n\n\nJob Description\n\nPosition OverviewAre you passionate about developing state of the art web and mobile app solutions? Do you want to work with the award winning Android App Development team? We are looking for Android Developers who will be a responsible member of the Mobile Apps development team, the largest team at EB Pearls. This position is responsible for developing projects as per clients’ requirements. Android developer reports directly to the Project Manager and is accountable for the Project Development.Job Roles and Responsibilities:1. Project AccountabilityUnderstand the project requirements clearly.Generate queries in case there is any confusion in understanding the project.Discuss any technical challenges that might come affront while working on the project.Realize the project delivery date and understand the communication channels.Write codes to develop a quality product on time.Conduct first hand testing of the project tasks before submitting the tasks to the Project Manager.Verify the product with SRS.2. Adapt to EB Work CultureAttend project meetings conducted by Project Manager with full preparation by studying the project documents and information.Follow company coding standards.3. Team CoordinationTake ownership of the project from planning to the delivery of the project.Be easily approachable and flexible in work.Perks and BenefitsWe strive to make sure that our people are comfortable, happy and growing at EB Pearls.We offer:Insurance: We enroll our employees in the company's group insurance policy that covers both medial and accidental insurance.Competitive Salary: We strive to ensure that our people get competitive remuneration as per the industry standardsTimely performance appraisal and salary reviews: We conduct bi yearly performance review to ensure that our people are always on top of their game and ensure yearly salary review on a timely basis to compliment.Paid Time Off (PTO)/ Paid Holidays: PTO refers to days when you can take time away from work while still being paid your usual salary. We provide 13 business days off as festival holidays.Employee Recognition: We are a company led by performers and we never fail to acknowledge the exemplary performance of our peopleSocial Security Fund: SSF is a contribution based social security scheme, the employee contributes 11 % and the employer adds 20% of the basic salary per month( 31% of the basic salary of employee) every month.Festival Allowance: We have the provision of festival allowance and provide Dashain bonus which is based on the amount of employees’ basic salary.Training and Development Programs: We are obsessed with constantly developing our competencies. Hence, we determine the training needs for our people from the performance review that we conduct bi- yearly.Work on next generation technology projectsWork with leading edge technologyFun At EBAll work and no play is not our cup of tea. At EB, we enjoy:Office Events: Chat and Chew, Residential Annual Event, Team Lunch OutEEC Club Activities: Night outs, Picnics, Lunch Outs, Futsal, Festival Events, Pool Parties, Day out eventsFood and Coffee: Office Provided lunch and stocked pantryInspiring Colleagues: Fun and friendly work environment with brilliant one of a kind teamApplying ProcedureSubmit a cover letter along with your recently updated resume via email to “careers@ebpearls.com” with “Application for Android Developer” in the subject line.OR,Send your application via our website: CLICK HEREOR,\n\n\n\n\n\n\n\n\nAPPLY NOW",
        "Page_URL": "https://merojob.com/android-developer-164/"
    },
    {
        "name": "Node.js Developer",
        "company": "EBPearls",
        "logo": "https://merojob.com/media/uploads/job_logo/31945286-da57-4865-9eba-42758e219c2d.jpg",
        "level": "Mid Level",
        "vacancy": "1",
        "time": "Full Time",
        "address": "Lalitpur, Nepal",
        "salary": "Negotiable",
        "deadline": "Oct. 17, 2020 23:55\n(1 day, 9 hours from now)",
        "education": "Bachelor",
        "experience": "More than or equals to 2 years",
        "skills": "Nosql\nAnalytical\nVue.Js\nCommunication\nAngular",
        "skills2": "Nosql\nAnalytical\nVue.Js\nCommunication\nAngular",
        "desc5": "University Bachelor's degree in Computer Engineering or equivalent in relevant stream Minimum 2 years of professional work experience in software development using technologies: Node.js ",
        "desc4": "Strong coding and analytical skills Knowledge of Express, StrongLoop etc. MEAN stack development Strong knowledge of javascript template engine Strong proficiency with JavaScript and front end framework like Angular or vue.js Good database design and proficient in writing SQL queries Good knowledge of NoSQL database like Mongodb Experience in developing applications servicing large transactional system utilizing SQL. Understanding the nature of asynchronous programming and its idiosyncrasies. User authentication and authorization between multiple systems, servers, and environments Understanding fundamental design principles behind a scalable application Proficient understanding of code versioning tools, such as Git Understanding of web and mobile application architecture Strong development experience with developing RESTful Web Services using Node js Experience with 3rd party API integration like Twilio, payment gateway, AWS, google/facebook API Prior work experience in the development of international level of projects High level of personal and professional integrity and strong professional ethics ",
        "desc": "Knowledge in PHP, Laravel or similar MVC frameworks Familiarity with unit testing, UI testing and automation Familiarity with CI/CD Knowledge of firebase, AWS Technologies Experience working in an Agile environment ",
        "desc1": "Position Overview: Node.js Developer is a responsible member of Mobile Apps development team, the largest team at EB Pearls. This position is responsible for developing projects as per clients’ requirements. Node.js developer reports directly to the Project Manager and is accountable for the Project Development. 1. Project Accountability Understand the project requirements clearlyGenerate queries in case there is any confusion in understanding the projectDiscuss any technical challenges that might come affront while working on the projectRealize the project delivery date and understand the communication channelsWrite codes to develop a quality product on timeConduct first hand testing of the project tasks before submitting the tasks to the Project ManagerVerify the product with SRS2. Adapt to EB Work Culture Attend project meetings conducted by Project Manager with full preparation by studying the project documents and informationFollow company coding standards3. Team Coordination Take ownership of the project from planning to the delivery of the projectBe easily approachable and flexible in workBenefits and more Competitive and negotiable salary. No bar for deserving candidatesPeriodic salary reviewProvident fund and gratuity facilities Other benefits such as, insurance (medical and accidental), festival bonus, meal facility and recreational facilitiesDynamic and challenging working environmentFacilitate career growth via promoting learning cultureApplying Procedure: Interested candidates can submit a cover letter explaining with evidence how you meet the required criteria along with your recent CV/resume via email to “hr@ebpearls.com” with “Application for Node.js Developer” in the subject line. OR, Send your application with a cover letter via our website: https://ebpearls.com.au/job/nodejs-developer/ We shall update your current status in our recruitment process soon. OR,",
        "desc2": "Qualifications & Experience:University Bachelor's degree in Computer Engineering or equivalent in relevant stream Minimum 2 years of professional work experience in software development using technologies: Node.js Required:Strong coding and analytical skills Knowledge of Express, StrongLoop etc. MEAN stack development Strong knowledge of javascript template engine Strong proficiency with JavaScript and front end framework like Angular or vue.js Good database design and proficient in writing SQL queries Good knowledge of NoSQL database like Mongodb Experience in developing applications servicing large transactional system utilizing SQL. Understanding the nature of asynchronous programming and its idiosyncrasies. User authentication and authorization between multiple systems, servers, and environments Understanding fundamental design principles behind a scalable application Proficient understanding of code versioning tools, such as Git Understanding of web and mobile application architecture Strong development experience with developing RESTful Web Services using Node js Experience with 3rd party API integration like Twilio, payment gateway, AWS, google/facebook API Prior work experience in the development of international level of projects High level of personal and professional integrity and strong professional ethics Preferred Knowledge in PHP, Laravel or similar MVC frameworks Familiarity with unit testing, UI testing and automation Familiarity with CI/CD Knowledge of firebase, AWS Technologies Experience working in an Agile environment ",
        "desc3": "Basic Job Information\n\n\n\nJob Category\n:\n\n IT & Telecommunication\n\n\n\nJob Level\n:\n\nMid Level\n\n\n\nNo. of Vacancy/s\n:\n[ 1 ]\n\n\nEmployment Type\n:\n\nFull Time\n\n\n\nJob Location\n:\n\nLalitpur, Nepal\n\n\n\nOffered Salary\n:\n\nNegotiable\n\n\n\nApply Before(Deadline)\n:\nOct. 17, 2020 23:55\n(1 day, 9 hours from now)\n\n\n\n\n\n\n\n\n\n\n\nJob Specification\n\n\n\nEducation Level\n:\n\nBachelor\n\n\n\nExperience Required\n:\n\nMore than or equals to 2 years\n\n\n\nProfessional Skill Required\n:\n\n\nNosql\nAnalytical\nVue.Js\nCommunication\nAngular\n\n\n\n\n\n\nOther Specification\n\n\nQualifications & Experience:University Bachelor's degree in Computer Engineering or equivalent in relevant stream Minimum 2 years of professional work experience in software development using technologies: Node.js Required:Strong coding and analytical skills Knowledge of Express, StrongLoop etc. MEAN stack development Strong knowledge of javascript template engine Strong proficiency with JavaScript and front end framework like Angular or vue.js Good database design and proficient in writing SQL queries Good knowledge of NoSQL database like Mongodb Experience in developing applications servicing large transactional system utilizing SQL. Understanding the nature of asynchronous programming and its idiosyncrasies. User authentication and authorization between multiple systems, servers, and environments Understanding fundamental design principles behind a scalable application Proficient understanding of code versioning tools, such as Git Understanding of web and mobile application architecture Strong development experience with developing RESTful Web Services using Node js Experience with 3rd party API integration like Twilio, payment gateway, AWS, google/facebook API Prior work experience in the development of international level of projects High level of personal and professional integrity and strong professional ethics Preferred Knowledge in PHP, Laravel or similar MVC frameworks Familiarity with unit testing, UI testing and automation Familiarity with CI/CD Knowledge of firebase, AWS Technologies Experience working in an Agile environment \n\n \n\n\n\n\n\n\n\n\n\nJob Description\n\nPosition Overview: Node.js Developer is a responsible member of Mobile Apps development team, the largest team at EB Pearls. This position is responsible for developing projects as per clients’ requirements. Node.js developer reports directly to the Project Manager and is accountable for the Project Development. 1. Project Accountability Understand the project requirements clearlyGenerate queries in case there is any confusion in understanding the projectDiscuss any technical challenges that might come affront while working on the projectRealize the project delivery date and understand the communication channelsWrite codes to develop a quality product on timeConduct first hand testing of the project tasks before submitting the tasks to the Project ManagerVerify the product with SRS2. Adapt to EB Work Culture Attend project meetings conducted by Project Manager with full preparation by studying the project documents and informationFollow company coding standards3. Team Coordination Take ownership of the project from planning to the delivery of the projectBe easily approachable and flexible in workBenefits and more Competitive and negotiable salary. No bar for deserving candidatesPeriodic salary reviewProvident fund and gratuity facilities Other benefits such as, insurance (medical and accidental), festival bonus, meal facility and recreational facilitiesDynamic and challenging working environmentFacilitate career growth via promoting learning cultureApplying Procedure: Interested candidates can submit a cover letter explaining with evidence how you meet the required criteria along with your recent CV/resume via email to “hr@ebpearls.com” with “Application for Node.js Developer” in the subject line. OR, Send your application with a cover letter via our website: https://ebpearls.com.au/job/nodejs-developer/ We shall update your current status in our recruitment process soon. OR,\n\n\n\n\n\n\n\n\nAPPLY NOW",
        "Page_URL": "https://merojob.com/nodejs-developer-28/"
    },
    {
        "name": "Web Developer",
        "company": "Muncha.com",
        "logo": "https://merojob.com/media/uploads/job_logo/1123d027-1275-463a-9228-0498a1c51722.jpg",
        "level": "Mid Level",
        "vacancy": "1",
        "time": "Full Time",
        "address": "Ekantakuna, Lalitpur",
        "salary": "Negotiable",
        "deadline": "Nov. 04, 2020 23:55\n(2 weeks, 5 days from now)",
        "education": "Bachelor",
        "experience": "More than or equals to 1 year",
        "skills": "Nodejs\nVuejs\nMysql\nPhp",
        "skills2": "Nodejs\nVuejs\nMysql\nPhp",
        "desc5": "Experience: A year of experience in Backend DevelopmentSkill: Php (Laravel Preffered), Vuejs, Mysql & NodejsMust have knowledge in Git & Git- hub or any other version control tools",
        "desc4": "",
        "desc": "",
        "desc1": "Web-based chat application development and maintenanceDevelop, troubleshoot and enhance cutting edge web applicationsFrameworks - LaravelPayment gateway integration and maintenanceSource Version Control (git preferred, svn, cvs)Applying Procedure:Experienced candidate are requested to drop their updated resume at hr@muncha.com / 9801184441OR,",
        "desc2": "Experience: A year of experience in Backend DevelopmentSkill: Php (Laravel Preffered), Vuejs, Mysql & NodejsMust have knowledge in Git & Git- hub or any other version control tools",
        "desc3": "Basic Job Information\n\n\n\nJob Category\n:\n\nIT & Telecommunication\n\n\n\nJob Level\n:\n\nMid Level\n\n\n\nNo. of Vacancy/s\n:\n[ 1 ]\n\n\nEmployment Type\n:\n\nFull Time\n\n\n\nJob Location\n:\n\nEkantakuna, Lalitpur\n\n\n\nOffered Salary\n:\n\nNegotiable\n \n\n\nApply Before(Deadline)\n:\nNov. 04, 2020 23:55\n(2 weeks, 5 days from now)\n\n\n\n\n\n\n\n\n\n\n\nJob Specification\n\n\n\nEducation Level\n:\n\nBachelor\n\n\n\nExperience Required\n:\n\nMore than or equals to 1 year\n\n\n\nProfessional Skill Required\n:\n\n\nNodejs\nVuejs\nMysql\nPhp\n\n\n\n\n\n\nOther Specification\n\n\nExperience: A year of experience in Backend DevelopmentSkill: Php (Laravel Preffered), Vuejs, Mysql & NodejsMust have knowledge in Git & Git- hub or any other version control tools\n\n\n\n\n\n\n\n\n\n\n\nJob Description\n\nWeb-based chat application development and maintenanceDevelop, troubleshoot and enhance cutting edge web applicationsFrameworks - LaravelPayment gateway integration and maintenanceSource Version Control (git preferred, svn, cvs)Applying Procedure:Experienced candidate are requested to drop their updated resume at hr@muncha.com / 9801184441OR,\n\n\n\n\n\n\n\n\nAPPLY NOW",
        "Page_URL": "https://merojob.com/web-developer-350/"
    },
    {
        "name": "App Developer",
        "company": "Muncha.com",
        "logo": "https://merojob.com/media/uploads/job_logo/54e51f69-f608-4c7e-8ac1-055a8ed9a26a.jpg",
        "level": "Mid Level",
        "vacancy": "1",
        "time": "Full Time",
        "address": "Ekantakuna, Lalitpur",
        "salary": "Negotiable",
        "deadline": "Nov. 04, 2020 23:55\n(2 weeks, 5 days from now)",
        "education": "Bachelor",
        "experience": "More than or equals to 1 year",
        "skills": "Problem Solving\nTime Management\nCommunication\nJavascript",
        "skills2": "Problem Solving\nTime Management\nCommunication\nJavascript",
        "desc5": "Experience: A year of experience in flutterSkills: Dart & OOP ConceptsKnowledge: Git & git-hub or any other version control toolsCan develop application for Android and iOS platformAdditional experience in software development would be more beneficialProficiency with HTML, CSS, JavaScript, React.JsSolid understanding of object-oriented programming, functional programming, and design patternsExcellent communication skills, with a focus on clear and proactive communicationTranslating designs and wireframes into high quality codeOptimizing components for maximum performance across a vast array of web-capable devices and browsers",
        "desc4": "",
        "desc": "",
        "desc1": "Develop the best technical design and approach for new products or technologiesFamiliarity with code versioning tools such as GITDiagnose and fix bugs and performance bottlenecksIdentify project risks and clearly communicate risks and expectations to your team members and your managementCommunicate proactively with clients regarding projects’ status and progressStay aware of industry trends and use these to make informed technology choices and strategic decisionsApplying Procedure:Experienced candidate are requested to drop their updated resume at hr@muncha.com / 9801184441OR,",
        "desc2": "Experience: A year of experience in flutterSkills: Dart & OOP ConceptsKnowledge: Git & git-hub or any other version control toolsCan develop application for Android and iOS platformAdditional experience in software development would be more beneficialProficiency with HTML, CSS, JavaScript, React.JsSolid understanding of object-oriented programming, functional programming, and design patternsExcellent communication skills, with a focus on clear and proactive communicationTranslating designs and wireframes into high quality codeOptimizing components for maximum performance across a vast array of web-capable devices and browsers",
        "desc3": "Basic Job Information\n\n\n\nJob Category\n:\n\nIT & Telecommunication\n\n\n\nJob Level\n:\n\nMid Level\n\n\n\nNo. of Vacancy/s\n:\n[ 1 ]\n\n\nEmployment Type\n:\n\nFull Time\n\n\n\nJob Location\n:\n\nEkantakuna, Lalitpur\n\n\n\nOffered Salary\n:\n\nNegotiable\n \n\n\nApply Before(Deadline)\n:\nNov. 04, 2020 23:55\n(2 weeks, 5 days from now)\n\n\n\n\n\n\n\n\n\n\n\nJob Specification\n\n\n\nEducation Level\n:\n\nBachelor\n\n\n\nExperience Required\n:\n\nMore than or equals to 1 year\n\n\n\nProfessional Skill Required\n:\n\n\nProblem Solving\nTime Management\nCommunication\nJavascript\n\n\n\n\n\n\nOther Specification\n\n\nExperience: A year of experience in flutterSkills: Dart & OOP ConceptsKnowledge: Git & git-hub or any other version control toolsCan develop application for Android and iOS platformAdditional experience in software development would be more beneficialProficiency with HTML, CSS, JavaScript, React.JsSolid understanding of object-oriented programming, functional programming, and design patternsExcellent communication skills, with a focus on clear and proactive communicationTranslating designs and wireframes into high quality codeOptimizing components for maximum performance across a vast array of web-capable devices and browsers\n\n\n\n\n\n\n\n\n\n\n\nJob Description\n\nDevelop the best technical design and approach for new products or technologiesFamiliarity with code versioning tools such as GITDiagnose and fix bugs and performance bottlenecksIdentify project risks and clearly communicate risks and expectations to your team members and your managementCommunicate proactively with clients regarding projects’ status and progressStay aware of industry trends and use these to make informed technology choices and strategic decisionsApplying Procedure:Experienced candidate are requested to drop their updated resume at hr@muncha.com / 9801184441OR,\n\n\n\n\n\n\n\n\nAPPLY NOW",
        "Page_URL": "https://merojob.com/app-developer-11/"
    },
    {
        "name": "Team Lead (Java/Spring Framework)",
        "company": "Agram Infotech",
        "logo": "https://merojob.com/media/uploads/job_logo/89c897b9-cc52-4ce4-be38-e17d8ea0cdb7.jpg",
        "level": "Mid Level",
        "vacancy": "1",
        "time": "Full Time",
        "address": "Birgunj",
        "salary": "Negotiable",
        "deadline": "Nov. 05, 2020 23:55\n(2 weeks, 6 days from now)",
        "education": "Bachelor",
        "experience": "More than 3 years",
        "skills": "Problem Solving\nAnalytical\nCreative Thinking\nLogical Thinking",
        "skills2": "Problem Solving\nAnalytical\nCreative Thinking\nLogical Thinking",
        "desc5": "Bachelor's degree in Computer Science or related field of study OR equivalent combination of training and experience3+ years of overall software development experienceMust have led a team of 3 to 5 people for a period of at least 1 year. Hands on experience using the following, with advanced skills in at least one, and at least moderate skills in the rest:Hands on experience with at least 1 Java framework, such as: Spring and spring Boot (MVC)Html/CssAjax & XML and JSON and JQueryReact.jsExperience with (3 or more of the following):Various common javascript librariesResponsive designCreating and consuming secure web services, web APISecure website design and development",
        "desc4": "Experience with Git, Azure DevOpsExperience with SQL Server 2012/2014Experience with automated unit testing and integration testingExperience with graceful degradation and/or progressive enhancement websites",
        "desc": "",
        "desc1": "Position Summary: As Java Software Engineer, you will be part of an agile development team building and supporting software systems. In this crucial role, you'll work on a high performing team and be involved with the design, development, testing, and support of desktop, mobile and web applications. Who We Are: We are a startup software company focused on software development, Internet of Things, Cyber Security and Artificial IntelligenceOur Vision: Identify social challenges and develop technical solutions to ease themOur Mission: To be a leading and innovative software solution provider in NepalEssential Job Functions:Work with a cross-functional, highly talented team to design, develop and deliver new featuresUse the latest technologies to design and build flexible, scalable, reliable and high-performing applicationsWrite tests and perform code reviews to ensure that we're shipping reliable, readable, and reusable codeSupport our current applications, investing in fixing technical debt, and refactoring opportunitiesDevelop and design user interface components, web services, API’s, and database integrations Must have led a team of 3 to 5 people for a period of at least 1 yearMust have good verbal and written communication skills (Should be able to talk fluently and write emails without grammatical mistakes)Proven experience of delivering on-time and with qualityProven experience of handling risks and providing mitigation strategies",
        "desc2": "Bachelor's degree in Computer Science or related field of study OR equivalent combination of training and experience3+ years of overall software development experienceMust have led a team of 3 to 5 people for a period of at least 1 year. Hands on experience using the following, with advanced skills in at least one, and at least moderate skills in the rest:Hands on experience with at least 1 Java framework, such as: Spring and spring Boot (MVC)Html/CssAjax & XML and JSON and JQueryReact.jsExperience with (3 or more of the following):Various common javascript librariesResponsive designCreating and consuming secure web services, web APISecure website design and developmentNice To HaveExperience with Git, Azure DevOpsExperience with SQL Server 2012/2014Experience with automated unit testing and integration testingExperience with graceful degradation and/or progressive enhancement websitesNote:The ideal candidate is a smart, energetic, flexible person who can think creatively, and can work effectively independently as well as part of a collaborative team. They love writing software and solving complex problems and has a hunger for new knowledge. They strive to achieve superior results through high performance and execution excellence. They take calculated risks and exercise innovation. They move quickly, but not at the expense of results. Lastly, they hold themselves accountable.",
        "desc3": "Basic Job Information\n\n\n\nJob Category\n:\n\nIT & Telecommunication\n > Programmer/ Software Engineer\n \n\n\nJob Level\n:\n\nMid Level\n\n\n\nNo. of Vacancy/s\n:\n[ 1 ]\n\n\nEmployment Type\n:\n\nFull Time\n\n\n\nJob Location\n:\n\nBirgunj\n\n\n\nOffered Salary\n:\n\nNegotiable\n\n\n\nApply Before(Deadline)\n:\nNov. 05, 2020 23:55\n(2 weeks, 6 days from now)\n\n\n\n\n\n\n\n\n\n\n\nJob Specification\n\n\n\nEducation Level\n:\n\nBachelor\n\n\n\nExperience Required\n:\n\nMore than 3 years\n\n\n\n\nProfessional Skill Required\n:\n\n\nProblem Solving\nAnalytical\nCreative Thinking\nLogical Thinking\n\n\n\n\n\n\nOther Specification\n\n\nBachelor's degree in Computer Science or related field of study OR equivalent combination of training and experience3+ years of overall software development experienceMust have led a team of 3 to 5 people for a period of at least 1 year. Hands on experience using the following, with advanced skills in at least one, and at least moderate skills in the rest:Hands on experience with at least 1 Java framework, such as: Spring and spring Boot (MVC)Html/CssAjax & XML and JSON and JQueryReact.jsExperience with (3 or more of the following):Various common javascript librariesResponsive designCreating and consuming secure web services, web APISecure website design and developmentNice To HaveExperience with Git, Azure DevOpsExperience with SQL Server 2012/2014Experience with automated unit testing and integration testingExperience with graceful degradation and/or progressive enhancement websitesNote:The ideal candidate is a smart, energetic, flexible person who can think creatively, and can work effectively independently as well as part of a collaborative team. They love writing software and solving complex problems and has a hunger for new knowledge. They strive to achieve superior results through high performance and execution excellence. They take calculated risks and exercise innovation. They move quickly, but not at the expense of results. Lastly, they hold themselves accountable.\n\n\n\n\n\n\n\n\n\n\n\nJob Description\n\nPosition Summary: As Java Software Engineer, you will be part of an agile development team building and supporting software systems. In this crucial role, you'll work on a high performing team and be involved with the design, development, testing, and support of desktop, mobile and web applications. Who We Are: We are a startup software company focused on software development, Internet of Things, Cyber Security and Artificial IntelligenceOur Vision: Identify social challenges and develop technical solutions to ease themOur Mission: To be a leading and innovative software solution provider in NepalEssential Job Functions:Work with a cross-functional, highly talented team to design, develop and deliver new featuresUse the latest technologies to design and build flexible, scalable, reliable and high-performing applicationsWrite tests and perform code reviews to ensure that we're shipping reliable, readable, and reusable codeSupport our current applications, investing in fixing technical debt, and refactoring opportunitiesDevelop and design user interface components, web services, API’s, and database integrations Must have led a team of 3 to 5 people for a period of at least 1 yearMust have good verbal and written communication skills (Should be able to talk fluently and write emails without grammatical mistakes)Proven experience of delivering on-time and with qualityProven experience of handling risks and providing mitigation strategies\n\n\n\n\n\n\n\n\nAPPLY NOW",
        "Page_URL": "https://merojob.com/team-lead-javaspring-framework/"
    },
    {
        "name": "ETL Developer",
        "company": "Verisk Nepal",
        "logo": "https://merojob.com/media/uploads/job_logo/ee60e0aa-0770-4642-94e8-5b80889950b6.jpg",
        "level": "Mid Level",
        "vacancy": "4",
        "time": "Full Time",
        "address": "Kathmandu",
        "salary": "Negotiable",
        "deadline": "Nov. 06, 2020 23:55\n(3 weeks from now)",
        "education": "Bachelor",
        "experience": "More than or equals to 1 year",
        "skills": "Sql\nProgramming\nEtl",
        "skills2": "Sql\nProgramming\nEtl",
        "desc5": "1+ years of overall industry experience with experience in ETL design/developmentExperience in creating ETL pipeline including extraction, transformation, merging, filtering, joining, cleansing, scheduling, monitoring, troubleshootingExperience with ETL tools and processes (Pentaho/PDI preferred)Experience or Knowledge in Data masking and Data integrity checkExperience or Knowledge in any programing language like Java, Python, Shell Scripting etc.Experience in writing advanced SQL scriptsExperience or Knowledge in AWS ServicesExperience working in an Agile development processExcellent problem solving and data analysis skillsSuperior organization skills, skilled at recognizing priorities and keeping a team focused on most important featuresDemonstrated ability to work independently with minimal supervisionGood communication skill in verbal and writtenAbility to troubleshoot and maintain mid-level to complex applications",
        "desc4": "",
        "desc": "",
        "desc1": "Support, development and data operation workloadCoordinate and communicate effectively with team members and various stakeholdersUnderstand the business requirement, produce code and conduct testing to ensure that product meets the requirementsIdentify and test for bugs and bottlenecks in the ETL solutionEnsure the best possible performance and quality in the packagesParticipate in different support activitiesApplying Procedure: Please visit mentioned website : https://careers.smartrecruiters.com/Verisk?search=nepal",
        "desc2": "1+ years of overall industry experience with experience in ETL design/developmentExperience in creating ETL pipeline including extraction, transformation, merging, filtering, joining, cleansing, scheduling, monitoring, troubleshootingExperience with ETL tools and processes (Pentaho/PDI preferred)Experience or Knowledge in Data masking and Data integrity checkExperience or Knowledge in any programing language like Java, Python, Shell Scripting etc.Experience in writing advanced SQL scriptsExperience or Knowledge in AWS ServicesExperience working in an Agile development processExcellent problem solving and data analysis skillsSuperior organization skills, skilled at recognizing priorities and keeping a team focused on most important featuresDemonstrated ability to work independently with minimal supervisionGood communication skill in verbal and writtenAbility to troubleshoot and maintain mid-level to complex applications",
        "desc3": "Basic Job Information\n\n\n\nJob Category\n:\n\nIT & Telecommunication\n\n\n\nJob Level\n :\n\nMid Level\n\n\n\nNo. of Vacancy/s\n:\n[ 4 ]\n\n\nEmployment Type\n:\n\nFull Time\n\n\n\nJob Location\n:\n\nKathmandu\n\n\n\nOffered Salary\n:\n\nNegotiable\n\n\n\nApply Before(Deadline)\n:\nNov. 06, 2020 23:55\n(3 weeks from now)\n\n\n\n\n\n\n\n\n\n\n\nJob Specification\n\n\n\nEducation Level\n:\n\nBachelor\n\n\n\nExperience Required\n:\n\nMore than or equals to 1 year\n\n\n\n\nProfessional Skill Required\n:\n\n\nSql\nProgramming\nEtl\n\n\n\n\n\n\nOther Specification\n\n\n1+ years of overall industry experience with experience in ETL design/developmentExperience in creating ETL pipeline including extraction, transformation, merging, filtering, joining, cleansing, scheduling, monitoring, troubleshootingExperience with ETL tools and processes (Pentaho/PDI preferred)Experience or Knowledge in Data masking and Data integrity checkExperience or Knowledge in any programing language like Java, Python, Shell Scripting etc.Experience in writing advanced SQL scriptsExperience or Knowledge in AWS ServicesExperience working in an Agile development processExcellent problem solving and data analysis skillsSuperior organization skills, skilled at recognizing priorities and keeping a team focused on most important featuresDemonstrated ability to work independently with minimal supervisionGood communication skill in verbal and writtenAbility to troubleshoot and maintain mid-level to complex applications\n\n\n\n\n\n\n\n\n\n\n\nJob Description\n\nSupport, development and data operation workloadCoordinate and communicate effectively with team members and various stakeholdersUnderstand the business requirement, produce code and conduct testing to ensure that product meets the requirementsIdentify and test for bugs and bottlenecks in the ETL solutionEnsure the best possible performance and quality in the packagesParticipate in different support activitiesApplying Procedure: Please visit mentioned website : https://careers.smartrecruiters.com/Verisk?search=nepal\n\n\n\n\n\n\n\n\nAPPLY NOW",
        "Page_URL": "https://merojob.com/etl-developer-2/"
    },
    {
        "name": "ETL - Tester / QA Engineer",
        "company": "Verisk Nepal",
        "logo": "https://merojob.com/media/uploads/job_logo/8503df16-2e03-4a5e-8fe3-8e208d3eb883.jpg",
        "level": "Mid Level",
        "vacancy": "1",
        "time": "Full Time",
        "address": "Kathmandu",
        "salary": "Negotiable",
        "deadline": "Nov. 06, 2020 23:55\n(3 weeks from now)",
        "education": "Bachelor",
        "experience": "More than or equals to 1 year",
        "skills": "Sql\nEtl\nTesting",
        "skills2": "Sql\nEtl\nTesting",
        "desc5": "Bachelor’s in Computer Science, or related field or equivalent experience1 to 3 years of professional experience in Software Quality Assurance, back-end data testing and Data QA AutomationProficient in SQL queries and Relational Database concepts, Aurora Postgres, data structures and data operations in generalExpertise in data workflow testing, data analysis, Test Data Creation in different format/input files along detailed data verification testing with handling regulated dataExperience in ETL testing - Pentaho / Microsoft SQL Server Integration Services (SSIS)Technically familiar with development concepts and formats such as SQL, XML, JSON and scripting languagesExperience in testing non-GUI applications (SQL, Flat Files, XML, JSON etc.)Strong understanding of object-oriented programmingGood knowledge of a programming/scripting language – JAVA, Scripting, PythonKnowledge or Experience in AWS Services is a plus, but not required.Sound technical background, great communication skills, and a motivation to achieve results in a fast-paced environmentA wholesome QA resource with an ability to put together test plan and test case scenarios, create test data and verify output using scripted scenariosPossess excellent problem-solving abilitiesKnack for writing clean, readable, and easily maintainable QA automation workflowsProficient in developing and implementing automated testsProficient understanding of code versioning tool and familiarity with Continuous Integration atmosphere",
        "desc4": "",
        "desc": "",
        "desc1": "Act as QA lead on a wide variety of data intense projectsLead analysis for the purposes of developing test cases and test data for back-end data intense applicationPerform hands-on manual testing while scripting automated tests to ensure application and data quality.Test ETL systems in Pentaho which includes Data Analysis, Test Data Creation in different format/input files and Testing regulated data – majority in a scripted automated environmentContinuously develop and socialize best practices for the design and development of robust and easily maintainable QA Automation SuitesServe as a liaison to business analyst and product owner, providing feedback on application readiness for migrationsAdditional Information : Verisk Analytics is an equal opportunity employer.All members of the Verisk Analytics family of companies are equal opportunity employers. We consider all qualified applicants for employment without regard to race, religion, color, national origin, citizenship, sex, gender identity and/or expression, sexual orientation, veteran's status, age or disability. Applying Procedure:Please visit mentioned website:  https://careers.smartrecruiters.com/Verisk?search=nepalor https://jobs.smartrecruiters.com/Verisk/743999721164045-software-engineer-data-qa-automation-engineerUnsolicited resumes sent to Verisk, including unsolicited resumes sent to a Verisk business mailing address, fax machine or email address, or directly to Verisk employees, will be considered Verisk property. Verisk will NOT pay a fee for any placement resulting from the receipt of an unsolicited resume. Consumer Privacy Notice",
        "desc2": "Bachelor’s in Computer Science, or related field or equivalent experience1 to 3 years of professional experience in Software Quality Assurance, back-end data testing and Data QA AutomationProficient in SQL queries and Relational Database concepts, Aurora Postgres, data structures and data operations in generalExpertise in data workflow testing, data analysis, Test Data Creation in different format/input files along detailed data verification testing with handling regulated dataExperience in ETL testing - Pentaho / Microsoft SQL Server Integration Services (SSIS)Technically familiar with development concepts and formats such as SQL, XML, JSON and scripting languagesExperience in testing non-GUI applications (SQL, Flat Files, XML, JSON etc.)Strong understanding of object-oriented programmingGood knowledge of a programming/scripting language – JAVA, Scripting, PythonKnowledge or Experience in AWS Services is a plus, but not required.Sound technical background, great communication skills, and a motivation to achieve results in a fast-paced environmentA wholesome QA resource with an ability to put together test plan and test case scenarios, create test data and verify output using scripted scenariosPossess excellent problem-solving abilitiesKnack for writing clean, readable, and easily maintainable QA automation workflowsProficient in developing and implementing automated testsProficient understanding of code versioning tool and familiarity with Continuous Integration atmosphere",
        "desc3": "Basic Job Information\n\n\n\nJob Category\n:\n\nIT & Telecommunication\n\n\n\nJob Level\n:\n\nMid Level\n\n\n\nNo. of Vacancy/s\n:\n[ 1 ]\n\n\nEmployment Type\n:\n\nFull Time\n\n\n\nJob Location\n:\n\nKathmandu\n\n\n\nOffered Salary\n:\n\nNegotiable\n\n\n\nApply Before(Deadline)\n:\nNov. 06, 2020 23:55\n(3 weeks from now)\n\n\n\n\n\n\n\n\n\n\n\nJob Specification\n\n\n\nEducation Level\n:\n\nBachelor\n\n\n\n\nExperience Required\n:\n\nMore than or equals to 1 year\n\n\n\nProfessional Skill Required\n:\n\n\nSql\nEtl\nTesting\n\n\n\n\n\n\nOther Specification\n\n\nBachelor’s in Computer Science, or related field or equivalent experience1 to 3 years of professional experience in Software Quality Assurance, back-end data testing and Data QA AutomationProficient in SQL queries and Relational Database concepts, Aurora Postgres, data structures and data operations in generalExpertise in data workflow testing, data analysis, Test Data Creation in different format/input files along detailed data verification testing with handling regulated dataExperience in ETL testing - Pentaho / Microsoft SQL Server Integration Services (SSIS)Technically familiar with development concepts and formats such as SQL, XML, JSON and scripting languagesExperience in testing non-GUI applications (SQL, Flat Files, XML, JSON etc.)Strong understanding of object-oriented programmingGood knowledge of a programming/scripting language – JAVA, Scripting, PythonKnowledge or Experience in AWS Services is a plus, but not required.Sound technical background, great communication skills, and a motivation to achieve results in a fast-paced environmentA wholesome QA resource with an ability to put together test plan and test case scenarios, create test data and verify output using scripted scenariosPossess excellent problem-solving abilitiesKnack for writing clean, readable, and easily maintainable QA automation workflowsProficient in developing and implementing automated testsProficient understanding of code versioning tool and familiarity with Continuous Integration atmosphere\n\n \n\n\n\n\n\n\n\n\n\nJob Description\n\nAct as QA lead on a wide variety of data intense projectsLead analysis for the purposes of developing test cases and test data for back-end data intense applicationPerform hands-on manual testing while scripting automated tests to ensure application and data quality.Test ETL systems in Pentaho which includes Data Analysis, Test Data Creation in different format/input files and Testing regulated data – majority in a scripted automated environmentContinuously develop and socialize best practices for the design and development of robust and easily maintainable QA Automation SuitesServe as a liaison to business analyst and product owner, providing feedback on application readiness for migrationsAdditional Information : Verisk Analytics is an equal opportunity employer.All members of the Verisk Analytics family of companies are equal opportunity employers. We consider all qualified applicants for employment without regard to race, religion, color, national origin, citizenship, sex, gender identity and/or expression, sexual orientation, veteran's status, age or disability. Applying Procedure:Please visit mentioned website:  https://careers.smartrecruiters.com/Verisk?search=nepalor https://jobs.smartrecruiters.com/Verisk/743999721164045-software-engineer-data-qa-automation-engineerUnsolicited resumes sent to Verisk, including unsolicited resumes sent to a Verisk business mailing address, fax machine or email address, or directly to Verisk employees, will be considered Verisk property. Verisk will NOT pay a fee for any placement resulting from the receipt of an unsolicited resume. Consumer Privacy Notice\n\n\n\n\n\n\n\n\nAPPLY NOW",
        "Page_URL": "https://merojob.com/etl-tester-qa-engineer/"
    },
    {
        "name": "Sr. Machine Learning Engineer",
        "company": "IDenTV Nepal",
        "logo": "https://merojob.com/media/uploads/job_logo/e30b8cb3-1996-48cd-9b5d-a6fb2ccd2cab.jpg",
        "level": "Senior Level",
        "vacancy": "1",
        "time": "Full Time",
        "address": "Kathmandu",
        "salary": "$. 1,000.00 - 2,000.00 Monthly",
        "deadline": "Nov. 07, 2020 23:55\n(3 weeks, 1 day from now)",
        "education": "Bachelor",
        "experience": "More than or equals to 3 years",
        "skills": "Python\nProgramming",
        "skills2": "Python\nProgramming",
        "desc5": "Data engineering-Expertise and Hardcore Programming in Python. Hadoop and spark as well.Understanding of Machine LearningCloud engineering workLooking for someone with 3-5 years experience. Not an Architect or designer, just a smart, straight programmer.",
        "desc4": "",
        "desc": "",
        "desc1": "Building data pipelines and calling machine learning algorithms.Data cleansingCreate Visual ChartsThe project/s that this person will be supporting are around our Artificial Intelligence.",
        "desc2": "Data engineering-Expertise and Hardcore Programming in Python. Hadoop and spark as well.Understanding of Machine LearningCloud engineering workLooking for someone with 3-5 years experience. Not an Architect or designer, just a smart, straight programmer.",
        "desc3": "Basic Job Information\n\n\n\nJob Category\n:\n\nIT & Telecommunication\n > Programmer/ Software Engineer, Web Developer/Web Designer\n\n\n\nJob Level\n:\n\nSenior Level\n\n\n\nNo. of Vacancy/s\n:\n[ 1 ]\n\n\nEmployment Type\n:\n\nFull Time\n\n\n\nJob Location\n:\n\nKathmandu\n\n\n\nOffered Salary\n:\n\n$. 1,000.00 - 2,000.00 Monthly\n\n\n\nApply Before(Deadline)\n:\nNov. 07, 2020 23:55\n(3 weeks, 1 day from now)\n\n\n\n\n\n \n\n\n\n\n\nJob Specification\n\n\n\nEducation Level\n:\n\nBachelor\n\n\n\nExperience Required\n:\n\nMore than or equals to 3 years\n\n\n\nProfessional Skill Required\n:\n\n\nPython\nProgramming\n\n\n\n\n\n\nOther Specification\n\n\nData engineering-Expertise and Hardcore Programming in Python. Hadoop and spark as well.Understanding of Machine LearningCloud engineering workLooking for someone with 3-5 years experience. Not an Architect or designer, just a smart, straight programmer.\n\n\n\n\n\n\n\n\n\n\n\nJob Description\n\n Building data pipelines and calling machine learning algorithms.Data cleansingCreate Visual ChartsThe project/s that this person will be supporting are around our Artificial Intelligence.\n\n\n\n\n\n\n\n\nAPPLY NOW",
        "Page_URL": "https://merojob.com/sr-machine-learning-engineer-2/"
    },
    {
        "name": "Senior .Net Developer",
        "company": "Proshore Nepal",
        "logo": "https://merojob.com/media/uploads/job_logo/cc124869-c18b-4028-a2e4-db99c1233ac8.jpg",
        "level": "Senior Level",
        "vacancy": "1",
        "time": "Full Time",
        "address": "Tinkune Marg, Kathmandu, Nepal",
        "salary": "Negotiable",
        "deadline": "Oct. 21, 2020 23:55\n(5 days, 9 hours from now)",
        "education": "Bachelor",
        "experience": "Not Required",
        "skills": "Technical Lead\nC#\nJavascript\nCommunication",
        "skills2": "Technical Lead\nC#\nJavascript\nCommunication",
        "desc5": "",
        "desc4": "",
        "desc": "",
        "desc1": "We want you to be a team player and a real problem solver. Together we want to create something valuable and useful for our customers. Personal Skills We ValueNatural curiosity around new technologies and toolsYou always believe there is a better or smarter way to solve problemsA mindset of creating a solution that is valuable for the end userYou like to achieve a goal within a team You are assertive and feel free to express yourself and your idea’s in EnglishYour Technical Skill SetYou get energy from coding and and you are familiar in the Microsoft ecosystem such as Visual Studio, Azure & .NET CoreYou believe in writing clean, scalable code using C# .NETYou can act as a leader of your team and provide them technical assistanceWorking with API's and microservices is a piece of cake for youScalable and manageable solutions are in your DNA   You are familiar with front-end JS frameworks such as Angular, React or VueWhat We Have to Offer YouYour own workstation with dual monitorFlexible work timingFree Lunch and BreakfastParticipate in eventsExcellent career opportunitiesSpace for own initiativesHealth & Accidental insurance coverageRecreational activities  Paid Paternity, Maternity, Marriage, Sick and Casual LeaveFloating Holiday's  Open office environment This is what happens after you applyTell us more about yourself along with your CVLet's first have a 'virtual tea talk'  to introduce Proshore, the role and to get to know you. This will be done by Hangouts or Skype. During the interview phase (of max 2 round) we'll inform you as soon as we've decided whether we'd like to proceed with youThe interview phase may include a technical assessment to test your technical skills",
        "desc2": "",
        "desc3": "Basic Job Information\n\n\n\nJob Category\n:\n\nIT & Telecommunication\n > Database Engineer/Database Programmer, Programmer/ Software Engineer, Software Architect, Software Implementation, Web Developer/Web Designer\n \n\n\nJob Level\n:\n\nSenior Level\n\n\n\nNo. of Vacancy/s\n:\n[ 1 ]\n\n\nEmployment Type\n:\n\nFull Time\n\n\n\nJob Location\n:\n\nTinkune Marg, Kathmandu, Nepal\n\n\n\nOffered Salary\n:\n\nNegotiable\n\n\n\nApply Before(Deadline)\n:\nOct. 21, 2020 23:55\n(5 days, 9 hours from now)\n\n\n\n\n\n\n\n\n\n\n\nJob Specification\n\n\n\nEducation Level\n:\n\nBachelor\n\n\n\nExperience Required\n:\n\nNot Required\n\n\n\n\nProfessional Skill Required\n:\n\n\nTechnical Lead\nC#\nJavascript\nCommunication\n\n\n\n\n\n\n\n\n\n\n\n\nJob Description\n\nWe want you to be a team player and a real problem solver. Together we want to create something valuable and useful for our customers. Personal Skills We ValueNatural curiosity around new technologies and toolsYou always believe there is a better or smarter way to solve problemsA mindset of creating a solution that is valuable for the end userYou like to achieve a goal within a team You are assertive and feel free to express yourself and your idea’s in EnglishYour Technical Skill SetYou get energy from coding and and you are familiar in the Microsoft ecosystem such as Visual Studio, Azure & .NET CoreYou believe in writing clean, scalable code using C# .NETYou can act as a leader of your team and provide them technical assistanceWorking with API's and microservices is a piece of cake for youScalable and manageable solutions are in your DNA   You are familiar with front-end JS frameworks such as Angular, React or VueWhat We Have to Offer YouYour own workstation with dual monitorFlexible work timingFree Lunch and BreakfastParticipate in eventsExcellent career opportunitiesSpace for own initiativesHealth & Accidental insurance coverageRecreational activities  Paid Paternity, Maternity, Marriage, Sick and Casual LeaveFloating Holiday's  Open office environment This is what happens after you applyTell us more about yourself along with your CVLet's first have a 'virtual tea talk'  to introduce Proshore, the role and to get to know you. This will be done by Hangouts or Skype. During the interview phase (of max 2 round) we'll inform you as soon as we've decided whether we'd like to proceed with youThe interview phase may include a technical assessment to test your technical skills\n\n\n\n\n\n\n\n\nApplying Procedure\n\nInterested and enthusiast candidates are encouraged to apply from our career page directly https://careers.proshore.eu/senior-net-developer",
        "Page_URL": "https://merojob.com/senior-net-developer-49/"
    },
    {
        "name": "Software Developer",
        "company": "Pay Nep",
        "logo": "https://merojob.com/media/uploads/job_logo/cc228a5a-8cfb-461d-a9f5-513821d1857f.jpg",
        "level": "Senior Level",
        "vacancy": "1",
        "time": "Full Time",
        "address": "Kathmandu, Nepal",
        "salary": "Negotiable",
        "deadline": "Oct. 20, 2020 23:55\n(4 days, 9 hours from now)",
        "education": "Master",
        "experience": "More than or equals to 3 years",
        "skills": "Problem Solving\nTeamwork\nTime Management\nCommunication\nInterpersonal",
        "skills2": "Problem Solving\nTeamwork\nTime Management\nCommunication\nInterpersonal",
        "desc5": "Master’s degree related to Computer and information technology or Bachelor’s in Engineering of Computer Science3 years or above in building Mobile /Web Applications and Product ManagementMathematical aptitudeProblem-solving skillsProgramming languages (different types of developer role require different languages)Excellent organizational and time management skillsAccuracy and attention to detailAn understanding of the latest trends and their role in a commercial environmentTeamwork skillsSelf-development skills to keep up to date with fast-changing trends",
        "desc4": "",
        "desc": "",
        "desc1": "We are looking for Technical ninja who want to help us Design/Develop/Deploy cutting edge scalable products to meet our business requirements. We are building out a team and looking for multiple levels but you should have at least 5 years of programming experience.We need Full stack developer role to lead, manage a team of App & Web. UX/ UI design understanding. Development with Flutter, React JS, React Native, Node, Python, Java etc. API plugging’s workflow, concurrency, multithreading. Server integration- Exp in Product management. Cross functional knowledge in development, testing deployment, maintenance. Team Management, hiring, guiding, training. Lead R&D. Strong in Flutter, Python development environment.Roles and ResponsibilitiesExperience in developing functional code for front-end and back-endDesigning and developing and Integrating API’s using server-side programming languages such as Node, Python, JavaExperience in front-end JavaScript frameworks such Angular, React, Vue JS, React Native, Native Script, FlutterEffective programming skills in TypeScriptWorking experience with databases such as MongoDB, SQL, and Oracle.Knowledge of UI rendering programming languages such as HTML, CSS, JQueryExcellent at QA Testing Procedures and Cloud (AWS and Azure)Should be an active contributor to developer communities like Stack overflow, Top coder, GitHub, Google Developer Groups (GDGs)Customer- focused, react well to changes, work with teams and able to multi- task.Excellent data structure & algorithm and problem-solving skills.Working knowledge with JavaScript frameworks and librariesBuild features and applications with mobile responsive designDevelop and design documents based on functional specificationsGood communication and teamwork skillsDevelop medium to large scale applications using required technology, Database design and analysis.Stay abreast of changes in technology and learn new technologies as neededDevelop complex software componentsDocument and demonstrate solutions by developing documentation, flowcharts, layouts, diagrams, charts, code comments and clear codeProtect operations by keeping information confidentialAccomplish engineering and organization mission by completing related results as neededMentor junior-level developersCollaborate with the team to brainstorm and create new productsGrow engineering teams by interviewing, recruiting and hiringUnderstand business needs and know how to create the tools to manage themComply with the project plan and stay on the leading edge of development practicesAdvise team on software development and code creationDemonstrate strong knowledge proficiency in the development methodologies including Object-Oriented Development, Component-based Development, Test-Driven Development, Behavior-Driven Development, Design Patterns and Design for ReuseWork closely with stakeholders to obtain requirements, break them down to tasks, and manage a team of several developersPerform unit testing and integration testing of Apps and web applications with the test automation tools. Analyze and resolve performance issues in themShould be capable of Handling a product from planning phase to getting the product/project running which include, Product planning, Task bi-furcation, assigning tasks to the team and self-involvement, Setting the deadlines and working on the deadlines, Requirements Testing, Deployment, Maintenance, Security testing, etc.Must be a proven performer and team player that enjoy challenging assignments in a high- energy, fast growing and start- up workplaceMust be a self- starter who can work well with minimal guidance and in fluid environmentFor Further information:Please visit mentioned website Moru.com.np or contact on 9801035347",
        "desc2": "Master’s degree related to Computer and information technology or Bachelor’s in Engineering of Computer Science3 years or above in building Mobile /Web Applications and Product ManagementMathematical aptitudeProblem-solving skillsProgramming languages (different types of developer role require different languages)Excellent organizational and time management skillsAccuracy and attention to detailAn understanding of the latest trends and their role in a commercial environmentTeamwork skillsSelf-development skills to keep up to date with fast-changing trends",
        "desc3": "Basic Job Information\n\n\n\nJob Category\n:\n\nIT & Telecommunication\n\n\n\nJob Level\n:\n\nSenior Level\n\n\n\nNo. of Vacancy/s\n:\n[ 1 ]\n\n\nEmployment Type\n:\n\nFull Time\n\n\n\nJob Location\n:\n\nKathmandu, Nepal\n\n\n\n Offered Salary\n:\n\nNegotiable\n\n\n\nApply Before(Deadline)\n:\nOct. 20, 2020 23:55\n(4 days, 9 hours from now)\n\n\n\n\n\n\n\n\n\n\n\nJob Specification\n\n\n\nEducation Level\n:\n\nMaster\n\n\n\nExperience Required\n:\n\nMore than or equals to 3 years\n\n\n\nProfessional Skill Required\n:\n\n\nProblem Solving\nTeamwork\nTime Management\nCommunication\nInterpersonal\n\n\n\n\n\n\nOther Specification\n\n\nMaster’s degree related to Computer and information technology or Bachelor’s in Engineering of Computer Science3 years or above in building Mobile /Web Applications and Product ManagementMathematical aptitudeProblem-solving skillsProgramming languages (different types of developer role require different languages)Excellent organizational and time management skillsAccuracy and attention to detailAn understanding of the latest trends and their role in a commercial environmentTeamwork skillsSelf-development skills to keep up to date with fast-changing trends\n\n\n\n\n\n\n\n\n\n\n\nJob Description\n\nWe are looking for Technical ninja who want to help us Design/Develop/Deploy cutting edge scalable products to meet our business requirements. We are building out a team and looking for multiple levels but you should have at least 5 years of programming experience.We need Full stack developer role to lead, manage a team of App & Web. UX/ UI design understanding. Development with Flutter, React JS, React Native, Node, Python, Java etc. API plugging’s workflow, concurrency, multithreading. Server integration- Exp in Product management. Cross functional knowledge in development, testing deployment, maintenance. Team Management, hiring, guiding, training. Lead R&D. Strong in Flutter, Python development environment.Roles and ResponsibilitiesExperience in developing functional code for front-end and back-endDesigning and developing and Integrating API’s using server-side programming languages such as Node, Python, JavaExperience in front-end JavaScript frameworks such Angular, React, Vue JS, React Native, Native Script, FlutterEffective programming skills in TypeScriptWorking experience with databases such as MongoDB, SQL, and Oracle.Knowledge of UI rendering programming languages such as HTML, CSS, JQueryExcellent at QA Testing Procedures and Cloud (AWS and Azure)Should be an active contributor to developer communities like Stack overflow, Top coder, GitHub, Google Developer Groups (GDGs)Customer- focused, react well to changes, work with teams and able to multi- task.Excellent data structure & algorithm and problem-solving skills.Working knowledge with JavaScript frameworks and librariesBuild features and applications with mobile responsive designDevelop and design documents based on functional specificationsGood communication and teamwork skillsDevelop medium to large scale applications using required technology, Database design and analysis.Stay abreast of changes in technology and learn new technologies as neededDevelop complex software componentsDocument and demonstrate solutions by developing documentation, flowcharts, layouts, diagrams, charts, code comments and clear codeProtect operations by keeping information confidentialAccomplish engineering and organization mission by completing related results as neededMentor junior-level developersCollaborate with the team to brainstorm and create new productsGrow engineering teams by interviewing, recruiting and hiringUnderstand business needs and know how to create the tools to manage themComply with the project plan and stay on the leading edge of development practicesAdvise team on software development and code creationDemonstrate strong knowledge proficiency in the development methodologies including Object-Oriented Development, Component-based Development, Test-Driven Development, Behavior-Driven Development, Design Patterns and Design for ReuseWork closely with stakeholders to obtain requirements, break them down to tasks, and manage a team of several developersPerform unit testing and integration testing of Apps and web applications with the test automation tools. Analyze and resolve performance issues in themShould be capable of Handling a product from planning phase to getting the product/project running which include, Product planning, Task bi-furcation, assigning tasks to the team and self-involvement, Setting the deadlines and working on the deadlines, Requirements Testing, Deployment, Maintenance, Security testing, etc.Must be a proven performer and team player that enjoy challenging assignments in a high- energy, fast growing and start- up workplaceMust be a self- starter who can work well with minimal guidance and in fluid environmentFor Further information:Please visit mentioned website Moru.com.np or contact on 9801035347\n\n\n\n\n\n\n\n\nAPPLY NOW",
        "Page_URL": "https://merojob.com/senior-software-developer-20/"
    },
    {
        "name": "UI/UX Head",
        "company": "Pay Nep",
        "logo": "https://merojob.com/media/uploads/job_logo/2ddd16b2-3d06-4f45-ba9d-4dc129e95188.jpg",
        "level": "Mid Level",
        "vacancy": "1",
        "time": "Full Time",
        "address": "Kathmandu, Nepal",
        "salary": "Negotiable",
        "deadline": "Oct. 20, 2020 23:55\n(4 days, 9 hours from now)",
        "education": "Bachelor",
        "experience": "Not Required",
        "skills": "Web Design\nUser-Centered Design\nVideo Editing\nUi/Ux\nCommunication",
        "skills2": "Web Design\nUser-Centered Design\nVideo Editing\nUi/Ux\nCommunication",
        "desc5": "Some experience in designing mobile user interface, contest creative and user flowsDemonstrable Graphic/Product design skills with a strong portfolioProficiency in Photoshop, Illustrator, Sketch, or other visual design and wire-framing toolsExcellent visual design skills with sensitivity to user-system  interactionAbility to solve problems creatively and effectivelyAbility to explain design decisions as well as listen to feedback objectivelyMust have a keen interest in the latest trends and technologyMust believe in and be capable of conducting independent researchMust be able to think through corner-case situations and take care of them through design",
        "desc4": "UX DesignIllustrationUser FlowsBannersUser ExperienceUser InterfaceDesigningInteraction DesignUI / UXIT Product DevelopmentVisual DesignTypographyAdobe PhotoshopAdobe IllustratorAdobe XDSketchVideo Editing (Premiere Pro, After effects) is a plus",
        "desc": "",
        "desc1": "As a Product/UI designer, you will be the champion of UI & UX Design within the organization and create simple, intuitive and efficient experiences for the co.As one of the core members of the team, you would be responsible to design world-class mobile & web products to enhance user experience and contribute actively in making it a leading brand.ResponsibilitiesCreate and execute all visual designs from concept to final hand-off to engineeringConceptualize original ideas that bring simplicity and user-friendliness to complex design roadblocksCreate wireframes, storyboards, user flows, process flows and site maps to effectively communicate interaction and design ideasCreate banners for the app, advertisement, social mediaExcellent understanding of typography, colour theory, and layoutsBe accountable for the outcome of the design and own the delivery, quality, and outcome of the design including the learning and iteration cycleCollaborate actively with the Product Managers and Engineers to build best in class experiences, while pushing the needle of how front-end web & mobile technologies can help deliver experiences that delightCreate and manage the Design roadmap being alive and aligned with the overall Business and Product StrategyEvaluate competitive and innovative products and design approaches to identify best practices and encourage innovationFor Further information:Please visit mentioned website Moru.com.np or contact on 9801035347",
        "desc2": "Some experience in designing mobile user interface, contest creative and user flowsDemonstrable Graphic/Product design skills with a strong portfolioProficiency in Photoshop, Illustrator, Sketch, or other visual design and wire-framing toolsExcellent visual design skills with sensitivity to user-system  interactionAbility to solve problems creatively and effectivelyAbility to explain design decisions as well as listen to feedback objectivelyMust have a keen interest in the latest trends and technologyMust believe in and be capable of conducting independent researchMust be able to think through corner-case situations and take care of them through designKey SkillsUX DesignIllustrationUser FlowsBannersUser ExperienceUser InterfaceDesigningInteraction DesignUI / UXIT Product DevelopmentVisual DesignTypographyAdobe PhotoshopAdobe IllustratorAdobe XDSketchVideo Editing (Premiere Pro, After effects) is a plus",
        "desc3": "Basic Job Information\n\n\n\nJob Category\n:\n\nIT & Telecommunication\n\n\n\nJob Level\n:\n\nMid Level\n\n\n\nNo. of Vacancy/s\n:\n[ 1 ]\n\n\nEmployment Type\n:\n\nFull Time\n\n\n\nJob Location\n:\n\nKathmandu, Nepal\n\n\n\nOffered Salary\n:\n\nNegotiable\n\n\n\nApply Before(Deadline)\n:\nOct. 20, 2020 23:55\n(4 days, 9 hours from now)\n\n\n\n\n\n\n\n\n\n \n\nJob Specification\n\n\n\nEducation Level\n:\n\nBachelor\n\n\n\nExperience Required\n:\n\nNot Required\n\n\n\nProfessional Skill Required\n:\n\n\nWeb Design\nUser-Centered Design\nVideo Editing\nUi/Ux\nCommunication\n\n\n\n\n\n\nOther Specification\n\n\nSome experience in designing mobile user interface, contest creative and user flowsDemonstrable Graphic/Product design skills with a strong portfolioProficiency in Photoshop, Illustrator, Sketch, or other visual design and wire-framing toolsExcellent visual design skills with sensitivity to user-system  interactionAbility to solve problems creatively and effectivelyAbility to explain design decisions as well as listen to feedback objectivelyMust have a keen interest in the latest trends and technologyMust believe in and be capable of conducting independent researchMust be able to think through corner-case situations and take care of them through designKey SkillsUX DesignIllustrationUser FlowsBannersUser ExperienceUser InterfaceDesigningInteraction DesignUI / UXIT Product DevelopmentVisual DesignTypographyAdobe PhotoshopAdobe IllustratorAdobe XDSketchVideo Editing (Premiere Pro, After effects) is a plus\n\n\n\n\n\n\n\n\n\n\n\nJob Description\n\nAs a Product/UI designer, you will be the champion of UI & UX Design within the organization and create simple, intuitive and efficient experiences for the co.As one of the core members of the team, you would be responsible to design world-class mobile & web products to enhance user experience and contribute actively in making it a leading brand.ResponsibilitiesCreate and execute all visual designs from concept to final hand-off to engineeringConceptualize original ideas that bring simplicity and user-friendliness to complex design roadblocksCreate wireframes, storyboards, user flows, process flows and site maps to effectively communicate interaction and design ideasCreate banners for the app, advertisement, social mediaExcellent understanding of typography, colour theory, and layoutsBe accountable for the outcome of the design and own the delivery, quality, and outcome of the design including the learning and iteration cycleCollaborate actively with the Product Managers and Engineers to build best in class experiences, while pushing the needle of how front-end web & mobile technologies can help deliver experiences that delightCreate and manage the Design roadmap being alive and aligned with the overall Business and Product StrategyEvaluate competitive and innovative products and design approaches to identify best practices and encourage innovationFor Further information:Please visit mentioned website Moru.com.np or contact on 9801035347\n\n\n\n\n\n\n\n\nAPPLY NOW",
        "Page_URL": "https://merojob.com/uiux-head/"
    },
    {
        "name": "Senior Dot Net Developer",
        "company": "COTIVITI NEPAL",
        "logo": "https://merojob.com/media/uploads/job_logo/e6611287-fb00-4f00-bfe0-f2e662a7c0b8.jpg",
        "level": "Senior Level",
        "vacancy": "10",
        "time": "Full Time",
        "address": "Kathmandu",
        "salary": "Negotiable",
        "deadline": "Nov. 09, 2020 23:55\n(3 weeks, 3 days from now)",
        "education": "Bachelor",
        "experience": "More than or equals to 5 years",
        "skills": "Software Development\nAnalytical\nCommunication\nInterpersonal",
        "skills2": "Software Development\nAnalytical\nCommunication\nInterpersonal",
        "desc5": "",
        "desc4": "",
        "desc": "",
        "desc1": "ResponsibilitiesTranslate application stories and requirements into functional applications.Design, code, and maintain efficient and reliable C# code.Write neat and clean code mostly for desktop application.Create test cases and follow test cases to implement the requirements.Maintain legacy code and implement the new requirements in best possible way.Prepare use case/ flow diagram when needed.Regular follow up for tasks assigned from development phase to QAQualification and Education RequirementsBachelor of Engineering in Computer/IT or equivalent degree in Computer related studiesMust Have SkillsMinimum 5 years of experience in Software development using C#.Strong theoretical and practical knowledge of object-oriented programmingAbility to write reusable C# librariesFamiliar with design patternsExperience in writing unit test and integration testing in Nunit Framework.Knack for writing clean, readable C# code.Strong knowledge of Relational Databases, SQL, and ORM technologiesExperience working with source control systems, such as Subversion, and GIT including branching and merging strategies.Web Service Frameworks (RESTful, SOAP)Preferable SkillsKnowledge of Javascript based front-end frameworks like ember.js, angular.js etc would be an added advantage.Working knowledge of MVC design patterns.Experience in Continuous Integration leveraging tools such as Bamboo and Maven.Soft SkillsAbility to work independently or as part of a teamExperience of working in SCRUM/Agile team would be added valuePersuasive in both written and verbal communicationStrong Analytical SkillsUS Healthcare experience would be added value",
        "desc2": "",
        "desc3": "Basic Job Information\n\n\n\nJob Category\n:\n\nIT & Telecommunication\n\n\n\nJob Level\n:\n\nSenior Level\n\n\n\nNo. of Vacancy/s\n:\n[ 10 ]\n\n\nEmployment Type\n:\n\nFull Time\n\n\n\nJob Location\n:\n\nKathmandu\n\n\n\nOffered Salary\n:\n\nNegotiable\n\n\n\nApply Before(Deadline)\n:\nNov. 09, 2020 23:55\n(3 weeks, 3 days from now)\n\n\n\n\n\n\n\n\n\n\n\nJob Specification\n\n\n\nEducation Level\n:\n\nBachelor\n\n\n\nExperience Required\n:\n\nMore than or equals to 5 years\n\n\n\nProfessional Skill Required\n:\n\n\nSoftware Development\nAnalytical\nCommunication\nInterpersonal\n\n\n\n\n\n\n\n\n\n\n\n\nJob Description\n\nResponsibilitiesTranslate application stories and requirements into functional applications.Design, code, and maintain efficient and reliable C# code.Write neat and clean code mostly for desktop application.Create test cases and follow test cases to implement the requirements.Maintain legacy code and implement the new requirements in best possible way.Prepare use case/ flow diagram when needed.Regular follow up for tasks assigned from development phase to QAQualification and Education RequirementsBachelor of Engineering in Computer/IT or equivalent degree in Computer related studiesMust Have SkillsMinimum 5 years of experience in Software development using C#.Strong theoretical and practical knowledge of object-oriented programmingAbility to write reusable C# librariesFamiliar with design patternsExperience in writing unit test and integration testing in Nunit Framework.Knack for writing clean, readable C# code.Strong knowledge of Relational Databases, SQL, and ORM technologiesExperience working with source control systems, such as Subversion, and GIT including branching and merging strategies.Web Service Frameworks (RESTful, SOAP)Preferable SkillsKnowledge of Javascript based front-end frameworks like ember.js, angular.js etc would be an added advantage.Working knowledge of MVC design patterns.Experience in Continuous Integration leveraging tools such as Bamboo and Maven.Soft SkillsAbility to work independently or as part of a teamExperience of working in SCRUM/Agile team would be added valuePersuasive in both written and verbal communicationStrong Analytical SkillsUS Healthcare experience would be added value\n\n\n\n\n\n\n\n\nApplying Procedure\n\nTo apply, please login to http://www.cotiviti.com.np/jobs or Send your CV to ktmjobs@cotiviti.com",
        "Page_URL": "https://merojob.com/senior-dot-net-developer-12/"
    },
    {
        "name": "Dot Net Developer",
        "company": "COTIVITI NEPAL",
        "logo": "https://merojob.com/media/uploads/job_logo/07fb2d26-2798-4d8f-b0e1-6a5dca12bb2d.jpg",
        "level": "Mid Level",
        "vacancy": "4",
        "time": "Full Time",
        "address": "Kathmandu",
        "salary": "Negotiable",
        "deadline": "Nov. 09, 2020 23:55\n(3 weeks, 3 days from now)",
        "education": "Bachelor",
        "experience": "More than or equals to 2 years",
        "skills": "Analytical\nJavascript\nCommunication\nInterpersonal\nSoftware Development",
        "skills2": "Analytical\nJavascript\nCommunication\nInterpersonal\nSoftware Development",
        "desc5": "",
        "desc4": "",
        "desc": "",
        "desc1": "ResponsibilitiesTranslate application stories and requirements into functional applications.Design, code, and maintain efficient and reliable C# code.Write neat and clean code mostly for desktop application.Create test cases and follow test cases to implement the requirements.Maintain legacy code and implement the new requirements in best possible way.Prepare use case/ flow diagram when needed.Regular follow up for tasks assigned from development phase to QAQualification and Education RequirementsBachelor of Engineering in Computer/IT or equivalent degree in Computer related studiesMust Have SkillsMinimum 2 years of experience in Software development using C#.Strong theoretical and practical knowledge of object-oriented programmingAbility to write reusable C# librariesFamiliar with design patternsExperience in writing unit test and integration testing in Nunit Framework.Knack for writing clean, readable C# code.Strong knowledge of Relational Databases, SQL, and ORM technologiesExperience working with source control systems, such as Subversion, and GIT including branching and merging strategies.Web Service Frameworks (RESTful, SOAP)Preferable SkillsKnowledge of Javascript based front-end frameworks like ember.js, angular.js etc would be an added advantage.Working knowledge of MVC design patterns.Experience in Continuous Integration leveraging tools such as Bamboo and Maven.Soft SkillsAbility to work independently or as part of a teamExperience of working in SCRUM/Agile team would be added valuePersuasive in both written and verbal communicationStrong Analytical SkillsUS Healthcare experience would be added value",
        "desc2": "",
        "desc3": "Basic Job Information\n\n\n\nJob Category\n:\n\nIT & Telecommunication\n\n\n\nJob Level\n:\n\nMid Level\n\n\n\nNo. of Vacancy/s\n:\n[ 4 ]\n\n\nEmployment Type\n:\n\nFull Time\n\n\n\nJob Location\n:\n\nKathmandu\n\n\n\nOffered Salary\n:\n\nNegotiable\n\n\n\nApply Before(Deadline)\n:\nNov. 09, 2020 23:55\n(3 weeks, 3 days from now)\n\n\n\n\n\n\n\n\n\n\n\nJob Specification\n\n\n\nEducation Level\n:\n\nBachelor\n\n\n\nExperience Required\n:\n\nMore than or equals to 2 years\n\n\n\nProfessional Skill Required\n:\n\n\nAnalytical\nJavascript\nCommunication\nInterpersonal\nSoftware Development\n\n\n\n\n\n\n\n\n\n\n\n\nJob Description\n\nResponsibilitiesTranslate application stories and requirements into functional applications.Design, code, and maintain efficient and reliable C# code.Write neat and clean code mostly for desktop application.Create test cases and follow test cases to implement the requirements.Maintain legacy code and implement the new requirements in best possible way.Prepare use case/ flow diagram when needed.Regular follow up for tasks assigned from development phase to QAQualification and Education RequirementsBachelor of Engineering in Computer/IT or equivalent degree in Computer related studiesMust Have SkillsMinimum 2 years of experience in Software development using C#.Strong theoretical and practical knowledge of object-oriented programmingAbility to write reusable C# librariesFamiliar with design patternsExperience in writing unit test and integration testing in Nunit Framework.Knack for writing clean, readable C# code.Strong knowledge of Relational Databases, SQL, and ORM technologiesExperience working with source control systems, such as Subversion, and GIT including branching and merging strategies.Web Service Frameworks (RESTful, SOAP)Preferable SkillsKnowledge of Javascript based front-end frameworks like ember.js, angular.js etc would be an added advantage.Working knowledge of MVC design patterns.Experience in Continuous Integration leveraging tools such as Bamboo and Maven.Soft SkillsAbility to work independently or as part of a teamExperience of working in SCRUM/Agile team would be added valuePersuasive in both written and verbal communicationStrong Analytical SkillsUS Healthcare experience would be added value\n\n\n\n\n\n\n\n\nApplying Procedure\n\nTo apply, please login to http://www.cotiviti.com.np/jobs or Send your CV to ktmjobs@cotiviti.com",
        "Page_URL": "https://merojob.com/dot-net-developer-52/"
    },
    {
        "name": "Senior Java Developer",
        "company": "COTIVITI NEPAL",
        "logo": "https://merojob.com/media/uploads/job_logo/e9c6a299-5429-4710-9a1b-07181bc7cbc7.jpg",
        "level": "Senior Level",
        "vacancy": "7",
        "time": "Full Time",
        "address": "Kathmandu",
        "salary": "Negotiable",
        "deadline": "Nov. 09, 2020 23:55\n(3 weeks, 3 days from now)",
        "education": "Bachelor",
        "experience": "More than or equals to 5 years",
        "skills": "Jquery\nAngular 5\nJavascript\nCommunication\nSoftware Development",
        "skills2": "Jquery\nAngular 5\nJavascript\nCommunication\nSoftware Development",
        "desc5": "",
        "desc4": "",
        "desc": "",
        "desc1": "Experience developing enterprise applications with proven enterprise experience level with RDBMS and SQL (Oracle and/or Microsoft SQL Server) Experience with Continuous Integration and writing automated unit and integration tests Strong object-oriented programming skills using JavaKnowledge of relevant technologies inclusive of (Angular 5, JavaScript, JOuery) Knowledge of algorithms and data structures Familiar with design patterns Knowledge of secure coding practices as it pertains to OWASPKnowledge of Version Control Software tools such as SVN, bitbucketExperience with Software development/management tools using the Atlassian suite (JIRA, Confluence)  Experience with both Windows and Unix Operating systemQualification and Education RequirementsBS Computer Science or related field or equivalent industry experience At least 5 years of experience in Software developmentSoft SkillsAbility to work independently or as part of a team Experience of working in SCRUM/Agile team would be added value Desire and ability to continuously improve, discover and expand the limits Critical thinking has an opinion on various technological topics.",
        "desc2": "",
        "desc3": "Basic Job Information\n\n\n\nJob Category\n:\n\nIT & Telecommunication\n\n\n\nJob Level\n:\n\nSenior Level\n\n\n\nNo. of Vacancy/s\n:\n[ 7 ]\n\n\nEmployment Type\n:\n\nFull Time\n\n\n\nJob Location\n:\n\nKathmandu\n\n\n\nOffered Salary\n:\n\nNegotiable\n\n\n\nApply Before(Deadline)\n:\nNov. 09, 2020 23:55\n(3 weeks, 3 days from now)\n\n\n\n\n\n\n\n \n\n\n\nJob Specification\n\n\n\nEducation Level\n:\n\nBachelor\n\n\n\nExperience Required\n:\n\nMore than or equals to 5 years\n\n\n\nProfessional Skill Required\n:\n\n\nJquery\nAngular 5\nJavascript\nCommunication\nSoftware Development\n\n\n\n\n\n\n\n\n\n\n\n\nJob Description\n\nExperience developing enterprise applications with proven enterprise experience level with RDBMS and SQL (Oracle and/or Microsoft SQL Server) Experience with Continuous Integration and writing automated unit and integration tests Strong object-oriented programming skills using JavaKnowledge of relevant technologies inclusive of (Angular 5, JavaScript, JOuery) Knowledge of algorithms and data structures Familiar with design patterns Knowledge of secure coding practices as it pertains to OWASPKnowledge of Version Control Software tools such as SVN, bitbucketExperience with Software development/management tools using the Atlassian suite (JIRA, Confluence)  Experience with both Windows and Unix Operating systemQualification and Education RequirementsBS Computer Science or related field or equivalent industry experience At least 5 years of experience in Software developmentSoft SkillsAbility to work independently or as part of a team Experience of working in SCRUM/Agile team would be added value Desire and ability to continuously improve, discover and expand the limits Critical thinking has an opinion on various technological topics.\n\n\n\n\n\n\n\n\nApplying Procedure\n\nTo apply, please login to http://www.cotiviti.com.np/jobs or Send your CV to ktmjobs@cotiviti.com",
        "Page_URL": "https://merojob.com/senior-java-developer-45/"
    },
    {
        "name": "Java Developer",
        "company": "COTIVITI NEPAL",
        "logo": "https://merojob.com/media/uploads/job_logo/11ce2c46-bd33-4e70-b9b0-60d60fb3bc0b.jpg",
        "level": "Mid Level",
        "vacancy": "6",
        "time": "Full Time",
        "address": "Kathmandu",
        "salary": "Negotiable",
        "deadline": "Nov. 09, 2020 23:55\n(3 weeks, 3 days from now)",
        "education": "Bachelor",
        "experience": "More than or equals to 2 years",
        "skills": "Css\nHtml\nJquery\nJavascript\nSoftware Development",
        "skills2": "Css\nHtml\nJquery\nJavascript\nSoftware Development",
        "desc5": "",
        "desc4": "",
        "desc": "",
        "desc1": "ResponsibilitiesInvolve in all stages of the project life cycle: requirements definition, design, and development. Translate application stories and requirements into functional applications. Write neat and clean code for desktop and web application. Create test cases and follow test cases to implement the requirements. Active participation in Project level discussion/meeting. Prepare use case/ flow diagram when needed. Regular follow up for tasks assigned from development phase to QA Qualification and Education RequirementsBachelor of Engineering in Computer/IT or equivalent degree in Computer related studies Must Have SkillsAt least 2 years of experience in Software development using J2SE and J2EE. Experience in parallel and multithreaded programming Knowledge of algorithms and data structures Interest in achieving maximum performance from available hardware and software Familiar with design patterns UI Development Skills (JavaFx, JavaScript, CSS, HTML, jQuery) Hands on knowledge on Spring Framework. Strong knowledge of Relational Databases, SQL, and ORM technologies Experience working with source control systems, such as Subversion, and GIT including branching and merging strategies. Preferable SkillsHands on knowledge on Apache Camel Framework Knowledge of testing frameworks/methodologies (TestNG, JUnit, TDD) Understanding of XML, JSON, web services technologies Experience with Atlassian suite of tools (Jira, Confluence, Bamboo, Crucible) Experience in Continuous Integration leveraging tools such as Bamboo and Maven. Soft SkillsAbility to work independently or as part of a team Experience of working in SCRUM/Agile team would be added value Desire and ability to continuously improve, discover and expand the limits Critical thinking, has an opinion on various technological topics.",
        "desc2": "",
        "desc3": "Basic Job Information\n\n\n\nJob Category\n:\n\nIT & Telecommunication\n\n\n\nJob Level\n:\n\nMid Level\n\n\n\nNo. of Vacancy/s\n:\n[ 6 ]\n\n\nEmployment Type\n:\n\nFull Time\n\n\n\nJob Location\n:\n\nKathmandu\n\n\n\nOffered Salary\n:\n\nNegotiable\n\n\n\nApply Before(Deadline)\n:\nNov. 09, 2020 23:55\n(3 weeks, 3 days from now)\n\n\n\n\n\n\n\n\n\n\n\nJob Specification\n\n\n\nEducation Level\n:\n\nBachelor\n\n\n\nExperience Required\n:\n\nMore than or equals to 2 years\n\n\n\nProfessional Skill Required\n:\n\n\nCss\nHtml\nJquery\nJavascript\nSoftware Development\n\n\n\n\n\n\n\n\n\n\n\n\nJob Description\n\nResponsibilitiesInvolve in all stages of the project life cycle: requirements definition, design, and development. Translate application stories and requirements into functional applications. Write neat and clean code for desktop and web application. Create test cases and follow test cases to implement the requirements. Active participation in Project level discussion/meeting. Prepare use case/ flow diagram when needed. Regular follow up for tasks assigned from development phase to QA Qualification and Education RequirementsBachelor of Engineering in Computer/IT or equivalent degree in Computer related studies Must Have SkillsAt least 2 years of experience in Software development using J2SE and J2EE. Experience in parallel and multithreaded programming Knowledge of algorithms and data structures Interest in achieving maximum performance from available hardware and software Familiar with design patterns UI Development Skills (JavaFx, JavaScript, CSS, HTML, jQuery) Hands on knowledge on Spring Framework. Strong knowledge of Relational Databases, SQL, and ORM technologies Experience working with source control systems, such as Subversion, and GIT including branching and merging strategies. Preferable SkillsHands on knowledge on Apache Camel Framework Knowledge of testing frameworks/methodologies (TestNG, JUnit, TDD) Understanding of XML, JSON, web services technologies Experience with Atlassian suite of tools (Jira, Confluence, Bamboo, Crucible) Experience in Continuous Integration leveraging tools such as Bamboo and Maven. Soft SkillsAbility to work independently or as part of a team Experience of working in SCRUM/Agile team would be added value Desire and ability to continuously improve, discover and expand the limits Critical thinking, has an opinion on various technological topics.\n\n\n\n\n\n\n\n\nApplying Procedure\n\nTo apply, please login to http://www.cotiviti.com.np/jobs or Send your CV to ktmjobs@cotiviti.com",
        "Page_URL": "https://merojob.com/java-developer-118/"
    },
    {
        "name": "Oracle- PL/SQL Developer",
        "company": "COTIVITI NEPAL",
        "logo": "https://merojob.com/media/uploads/job_logo/fc50607b-e31f-468c-b0f3-91d30dd54f84.jpg",
        "level": "Mid Level",
        "vacancy": "2",
        "time": "Full Time",
        "address": "Kathmandu",
        "salary": "Negotiable",
        "deadline": "Nov. 09, 2020 23:55\n(3 weeks, 3 days from now)",
        "education": "Bachelor",
        "experience": "More than or equals to 2 years",
        "skills": "Analytical\nLinux\nCommunication\nSoftware Development",
        "skills2": "Analytical\nLinux\nCommunication\nSoftware Development",
        "desc5": "",
        "desc4": "",
        "desc": "",
        "desc1": "Experience Understanding business requirements and technical documentsTranslate design into functional unit.Follow coding standard during developmentDevelop optimized queriesCreate unit test to validate changesActive participation in Project level discussion/meeting.Maintain legacy code and implement the new requirements in best possible way.Prepare Technical/flow diagram.Prepare documentation of the changes or legacy code base.EducationBachelor of Engineering in Computer/IT or equivalent degree in Computer related studiesRequired Technical SkillMinimum 2 years of experience in Software development using PL/SQL, MS-SQL.Strong knowledge of Relational DatabasesMust be familiar with Oracle Optimization techniquesMust be familiar with basic Linux commandsStrong theoretical and practical knowledge of object-oriented programmingFamiliar with design patternsExperience working with source control systems, such as Subversion, and GIT including branching and merging strategies.Preferable SkillsKnowledge of Shell, Perl Scripting languageExperience with Atlassian suite of tools (Jira, Confluence, Bamboo)Other SkillsAbility to work independently or as part of a teamExperience of working in SCRUM/Agile team would be added valuePersuasive in both written and verbal communicationStrong Analytical SkillsUS Healthcare experience would be added value",
        "desc2": "",
        "desc3": "Basic Job Information\n\n\n\nJob Category\n:\n\nIT & Telecommunication\n\n\n\nJob Level\n:\n\nMid Level\n\n\n\nNo. of Vacancy/s\n:\n[ 2 ]\n\n\nEmployment Type\n:\n\nFull Time\n\n\n\nJob Location\n:\n\nKathmandu\n\n\n\nOffered Salary\n:\n\nNegotiable\n\n\n\nApply Before(Deadline)\n:\nNov. 09, 2020 23:55\n(3 weeks, 3 days from now)\n\n\n\n\n\n\n\n\n\n\n\nJob Specification\n\n\n\nEducation Level\n:\n\nBachelor\n\n\n\nExperience Required\n:\n\nMore than or equals to 2 years\n\n\n\nProfessional Skill Required\n:\n\n\nAnalytical\nLinux\nCommunication\nSoftware Development\n\n\n\n\n\n\n\n\n\n\n\n\nJob Description\n\nExperience Understanding business requirements and technical documentsTranslate design into functional unit.Follow coding standard during developmentDevelop optimized queriesCreate unit test to validate changesActive participation in Project level discussion/meeting.Maintain legacy code and implement the new requirements in best possible way.Prepare Technical/flow diagram.Prepare documentation of the changes or legacy code base.EducationBachelor of Engineering in Computer/IT or equivalent degree in Computer related studiesRequired Technical SkillMinimum 2 years of experience in Software development using PL/SQL, MS-SQL.Strong knowledge of Relational DatabasesMust be familiar with Oracle Optimization techniquesMust be familiar with basic Linux commandsStrong theoretical and practical knowledge of object-oriented programmingFamiliar with design patternsExperience working with source control systems, such as Subversion, and GIT including branching and merging strategies.Preferable SkillsKnowledge of Shell, Perl Scripting languageExperience with Atlassian suite of tools (Jira, Confluence, Bamboo)Other SkillsAbility to work independently or as part of a teamExperience of working in SCRUM/Agile team would be added valuePersuasive in both written and verbal communicationStrong Analytical SkillsUS Healthcare experience would be added value\n\n\n\n\n\n\n\n\nApplying Procedure\n\nTo apply, please login to http://www.cotiviti.com.np/jobs or Send your CV to ktmjobs@cotiviti.com",
        "Page_URL": "https://merojob.com/oracle-plsql-developer-6/"
    },
    {
        "name": "Senior Oracle – PL/SQL DEVELOPER",
        "company": "COTIVITI NEPAL",
        "logo": "https://merojob.com/media/uploads/job_logo/122ae500-bc71-49f9-8549-7d2ba5e01fc3.jpg",
        "level": "Senior Level",
        "vacancy": "2",
        "time": "Full Time",
        "address": "Kathmandu",
        "salary": "Negotiable",
        "deadline": "Nov. 09, 2020 23:55\n(3 weeks, 3 days from now)",
        "education": "Bachelor",
        "experience": "More than or equals to 5 years",
        "skills": "Analytical\nLinux\nCommunication\nSoftware Development",
        "skills2": "Analytical\nLinux\nCommunication\nSoftware Development",
        "desc5": "",
        "desc4": "",
        "desc": "",
        "desc1": "ResponsibilitiesShould have strong knowledge on all stages of Software life cycle process: Planning, design, development, Testing and deployment.Understanding business requirements and technical documentsTranslate design into functional unit.Follow coding standard during developmentDevelop optimized queriesCreate unit test to validate changesActive participation in Project level discussion/meeting.Maintain legacy code and implement the new requirements in best possible way.Prepare Technical/flow diagram.Prepare documentation of the changes or legacy code base.Qualification and Education RequirementsBachelor of Engineering in Computer/IT or equivalent degree in Computer related studiesMust Have SkillsAt least 5 years of experience in Software development using PL/SQL, MS-SQL.Strong knowledge of Relational DatabasesMust be familiar with Oracle Optimization techniquesMust be familiar with basic Linux commandsStrong theoretical and practical knowledge of object-oriented programmingFamiliar with design patternsExperience working with source control systems, such as Subversion, and GIT including branching and merging strategies.Preferable SkillsKnowledge of Shell, Perl Scripting languageExperience with Atlassian suite of tools (Jira, Confluence, Bamboo, Crucible)Soft SkillsAbility to work independently or as part of a teamExperience of working in SCRUM/Agile team would be added valuePersuasive in both written and verbal communicationStrong Analytical SkillsUS Healthcare experience would be added value",
        "desc2": "",
        "desc3": "Basic Job Information\n\n\n\nJob Category\n:\n\nIT & Telecommunication\n\n\n\nJob Level\n:\n\nSenior Level\n\n\n\nNo. of Vacancy/s\n:\n[ 2 ]\n\n\nEmployment Type\n:\n\nFull Time\n\n\n\nJob Location\n:\n\nKathmandu\n\n\n\nOffered Salary\n :\n\nNegotiable\n\n\n\nApply Before(Deadline)\n:\nNov. 09, 2020 23:55\n(3 weeks, 3 days from now)\n\n\n\n\n\n\n\n\n\n\n\nJob Specification\n\n\n\nEducation Level\n:\n\nBachelor\n\n\n\nExperience Required\n:\n\nMore than or equals to 5 years\n\n\n\nProfessional Skill Required\n:\n\n\nAnalytical\nLinux\nCommunication\nSoftware Development\n\n\n\n\n\n\n\n\n\n\n\n\nJob Description\n\nResponsibilitiesShould have strong knowledge on all stages of Software life cycle process: Planning, design, development, Testing and deployment.Understanding business requirements and technical documentsTranslate design into functional unit.Follow coding standard during developmentDevelop optimized queriesCreate unit test to validate changesActive participation in Project level discussion/meeting.Maintain legacy code and implement the new requirements in best possible way.Prepare Technical/flow diagram.Prepare documentation of the changes or legacy code base.Qualification and Education RequirementsBachelor of Engineering in Computer/IT or equivalent degree in Computer related studiesMust Have SkillsAt least 5 years of experience in Software development using PL/SQL, MS-SQL.Strong knowledge of Relational DatabasesMust be familiar with Oracle Optimization techniquesMust be familiar with basic Linux commandsStrong theoretical and practical knowledge of object-oriented programmingFamiliar with design patternsExperience working with source control systems, such as Subversion, and GIT including branching and merging strategies.Preferable SkillsKnowledge of Shell, Perl Scripting languageExperience with Atlassian suite of tools (Jira, Confluence, Bamboo, Crucible)Soft SkillsAbility to work independently or as part of a teamExperience of working in SCRUM/Agile team would be added valuePersuasive in both written and verbal communicationStrong Analytical SkillsUS Healthcare experience would be added value\n\n\n\n\n\n\n\n\nApplying Procedure\n\nTo apply, please login to http://www.cotiviti.com.np/jobs or Send your CV to ktmjobs@cotiviti.com",
        "Page_URL": "https://merojob.com/senior-oracle-plsql-developer-6/"
    },
    {
        "name": "Senior Test Automation Engineer",
        "company": "COTIVITI NEPAL",
        "logo": "https://merojob.com/media/uploads/job_logo/7947a442-9fcf-48fe-a9d5-9907c31d8695.jpg",
        "level": "Senior Level",
        "vacancy": "5",
        "time": "Full Time",
        "address": "Kathmandu",
        "salary": "Negotiable",
        "deadline": "Nov. 09, 2020 23:55\n(3 weeks, 3 days from now)",
        "education": "Bachelor",
        "experience": "More than or equals to 5 years",
        "skills": "Communication\nSoftware Development",
        "skills2": "Communication\nSoftware Development",
        "desc5": "",
        "desc4": "",
        "desc": "",
        "desc1": "ResponsibilitiesTest Automation Engineers would be expected to be doing following:Test Automation using Selenium in .NetTest Execution on various level (System Test, Regression Test, Smoke Test)Understand the existing products and business flowDefect reportingPrepare Testing platform (Application and Database)Performance Test using JMeterTest Automation of data/database level testingResearch/implementation of latest test automation frameworks.Qualification and Education RequirementsBachelor Degree or equivalent degree in Computer related studiesMust Have SkillsMinimum 5 years of Software Development/Programming in the past or recently. Preferably in .Net.Must have experience of selenium test automation in .netMust have sound knowledge of Software TestingExperience working with source control systems, such as Subversion, and GIT including branching and merging strategies.Preferable SkillsKnowledge of Relational DatabasesKnowledge of Build Scripting using MSBuild with BambooExperience of working in IIS Application Server",
        "desc2": "",
        "desc3": "Basic Job Information\n\n\n\nJob Category\n:\n\nIT & Telecommunication\n\n\n\nJob Level\n:\n\nSenior Level\n\n\n\nNo. of Vacancy/s\n:\n[ 5 ]\n\n\nEmployment Type\n:\n\nFull Time\n\n\n\nJob Location\n:\n\nKathmandu\n\n\n\nOffered Salary\n:\n\nNegotiable\n\n\n\nApply Before(Deadline)\n:\nNov. 09, 2020 23:55\n(3 weeks, 3 days from now)\n\n\n\n\n\n\n\n\n\n\n\nJob Specification\n\n\n\nEducation Level\n:\n\nBachelor\n\n\n\nExperience Required\n:\n\nMore than or equals to 5 years\n\n\n\nProfessional Skill Required\n:\n\n\nCommunication\nSoftware Development\n\n\n\n\n\n\n\n\n\n\n\n\nJob Description\n\nResponsibilitiesTest Automation Engineers would be expected to be doing following:Test Automation using Selenium in .NetTest Execution on various level (System Test, Regression Test, Smoke Test)Understand the existing products and business flowDefect reportingPrepare Testing platform (Application and Database)Performance Test using JMeterTest Automation of data/database level testingResearch/implementation of latest test automation frameworks.Qualification and Education RequirementsBachelor Degree or equivalent degree in Computer related studiesMust Have SkillsMinimum 5 years of Software Development/Programming in the past or recently. Preferably in .Net.Must have experience of selenium test automation in .netMust have sound knowledge of Software TestingExperience working with source control systems, such as Subversion, and GIT including branching and merging strategies.Preferable SkillsKnowledge of Relational DatabasesKnowledge of Build Scripting using MSBuild with BambooExperience of working in IIS Application Server\n\n\n\n\n\n\n\n\nApplying Procedure\n\nTo apply, please login to http://www.cotiviti.com.np/jobs or Send your CV to ktmjobs@cotiviti.com",
        "Page_URL": "https://merojob.com/senior-test-automation-engineer-3/"
    },
    {
        "name": "Test Automation Engineer",
        "company": "COTIVITI NEPAL",
        "logo": "https://merojob.com/media/uploads/job_logo/d15e39c8-7541-4fce-8e37-695876a7c3ea.jpg",
        "level": "Mid Level",
        "vacancy": "5",
        "time": "Full Time",
        "address": "Kathmandu",
        "salary": "Negotiable",
        "deadline": "Nov. 09, 2020 23:55\n(3 weeks, 3 days from now)",
        "education": "Bachelor",
        "experience": "More than or equals to 3 years",
        "skills": "Communication\nInterpersonal\nSoftware Development",
        "skills2": "Communication\nInterpersonal\nSoftware Development",
        "desc5": "",
        "desc4": "",
        "desc": "",
        "desc1": "ResponsibilitiesTest Automation Engineers would be expected to be doing following:Test Automation using Selenium in .NetTest Execution on various level (System Test, Regression Test, Smoke Test)Understand the existing products and business flowDefect reportingPrepare Testing platform (Application and Database)Performance Test using JMeterTest Automation of data/database level testingResearch/implementation of latest test automation frameworks.Qualification and Education RequirementsBachelor’s degree or equivalent degree in Computer related studiesMust Have SkillsMinimum 3 years of Software Development/Programming in the past or recently. Preferably in .Net.Must have experience of selenium test automation in .netMust have sound knowledge of Software TestingExperience working with source control systems, such as Subversion, and GIT including branching and merging strategies.Preferable SkillsKnowledge of Relational DatabasesKnowledge of Build Scripting using MSBuild with BambooExperience of working in IIS Application Server",
        "desc2": "",
        "desc3": "Basic Job Information\n\n\n\nJob Category\n:\n\nIT & Telecommunication\n\n\n\nJob Level\n:\n\nMid Level\n\n\n\nNo. of Vacancy/s\n:\n[ 5 ]\n\n\nEmployment Type\n:\n\nFull Time\n\n\n\nJob Location\n:\n\nKathmandu\n\n\n\nOffered Salary\n:\n\nNegotiable\n\n\n \nApply Before(Deadline)\n:\nNov. 09, 2020 23:55\n(3 weeks, 3 days from now)\n\n\n\n\n\n\n\n\n\n\n\nJob Specification\n\n\n\nEducation Level\n:\n\nBachelor\n\n\n\nExperience Required\n:\n\nMore than or equals to 3 years\n\n\n\nProfessional Skill Required\n:\n\n\nCommunication\nInterpersonal\nSoftware Development\n\n\n\n\n\n\n\n\n\n\n\n\nJob Description\n\nResponsibilitiesTest Automation Engineers would be expected to be doing following:Test Automation using Selenium in .NetTest Execution on various level (System Test, Regression Test, Smoke Test)Understand the existing products and business flowDefect reportingPrepare Testing platform (Application and Database)Performance Test using JMeterTest Automation of data/database level testingResearch/implementation of latest test automation frameworks.Qualification and Education RequirementsBachelor’s degree or equivalent degree in Computer related studiesMust Have SkillsMinimum 3 years of Software Development/Programming in the past or recently. Preferably in .Net.Must have experience of selenium test automation in .netMust have sound knowledge of Software TestingExperience working with source control systems, such as Subversion, and GIT including branching and merging strategies.Preferable SkillsKnowledge of Relational DatabasesKnowledge of Build Scripting using MSBuild with BambooExperience of working in IIS Application Server\n\n\n\n\n\n\n\n\nApplying Procedure\n\nTo apply, please login to http://www.cotiviti.com.np/jobs or Send your CV to ktmjobs@cotiviti.com",
        "Page_URL": "https://merojob.com/test-automation-engineer-6/"
    },
    {
        "name": "Business Analyst",
        "company": "COTIVITI NEPAL",
        "logo": "https://merojob.com/media/uploads/job_logo/1166e43e-2f3e-4c5a-8f94-4e4add1d96ae.jpg",
        "level": "Senior Level",
        "vacancy": "2",
        "time": "Full Time",
        "address": "Kathmandu",
        "salary": "Negotiable",
        "deadline": "Nov. 09, 2020 23:55\n(3 weeks, 3 days from now)",
        "education": "Bachelor",
        "experience": "More than or equals to 5 years",
        "skills": "Problem Solving\nTime Management\nOrganizational\nCommunication\nInterpersonal",
        "skills2": "Problem Solving\nTime Management\nOrganizational\nCommunication\nInterpersonal",
        "desc5": "",
        "desc4": "",
        "desc": "",
        "desc1": "The Business Analyst is the liaison between the agile sprint team and the business (SME, Product Manager and Product Owner). Works to create and refine the feature backlog in preparation for the next Program Increment through defining innovative improvements to business processes in order to meet the business requirements. Works with the Sprint Team to foster a collaborative atmosphere and provide clear understanding of the business problem being solved. Works well in a team-structured environment.Responsibilities Reviews existing legacy application documentation to develop an understanding of the existing functionality.Meets with business leadership (SME, Product Manager and Product Owner) to clarify business requirements.Documents existing business processes and proposes innovative improvements.Develops a clear definition and acceptance criteria for each of the features to ensure the business requirements will be addressed.Assists with documentation and prioritization of the business value associated with the business requirements.Develops product expertise.Conduct user acceptance testsQualifications Bachelor Degree in Computer or related field.5+ years of business analysis experience.Experience in an agile software development environment an asset.Possesses excellent communication, organizational and observational skills.Proficient problem solving skills with good judgment and decision making.Must work well as a member of a team.",
        "desc2": "",
        "desc3": "Basic Job Information\n\n\n\nJob Category\n:\n\nIT & Telecommunication\n\n\n\nJob Level\n:\n\nSenior Level\n\n\n\nNo. of Vacancy/s\n:\n[ 2 ]\n\n\nEmployment Type\n:\n\nFull Time\n\n\n\nJob Location\n:\n\nKathmandu\n\n\n\nOffered Salary\n:\n\nNegotiable\n\n\n\nApply Before(Deadline)\n:\nNov. 09, 2020 23:55\n(3 weeks, 3 days from now)\n\n\n\n\n\n\n\n\n\n\n\n\nJob Specification\n\n\n\nEducation Level\n:\n\nBachelor\n\n\n\nExperience Required\n:\n\nMore than or equals to 5 years\n\n\n\nProfessional Skill Required\n:\n\n\nProblem Solving\nTime Management\nOrganizational\nCommunication\nInterpersonal\n\n\n\n\n\n\n\n\n\n\n\n\nJob Description\n\nThe Business Analyst is the liaison between the agile sprint team and the business (SME, Product Manager and Product Owner). Works to create and refine the feature backlog in preparation for the next Program Increment through defining innovative improvements to business processes in order to meet the business requirements. Works with the Sprint Team to foster a collaborative atmosphere and provide clear understanding of the business problem being solved. Works well in a team-structured environment.Responsibilities Reviews existing legacy application documentation to develop an understanding of the existing functionality.Meets with business leadership (SME, Product Manager and Product Owner) to clarify business requirements.Documents existing business processes and proposes innovative improvements.Develops a clear definition and acceptance criteria for each of the features to ensure the business requirements will be addressed.Assists with documentation and prioritization of the business value associated with the business requirements.Develops product expertise.Conduct user acceptance testsQualifications Bachelor Degree in Computer or related field.5+ years of business analysis experience.Experience in an agile software development environment an asset.Possesses excellent communication, organizational and observational skills.Proficient problem solving skills with good judgment and decision making.Must work well as a member of a team.\n\n\n\n\n\n\n\n\nApplying Procedure\n\nTo apply, please login to http://www.cotiviti.com.np/jobs or Send your CV to ktmjobs@cotiviti.com",
        "Page_URL": "https://merojob.com/business-analyst-49/"
    },
    {
        "name": "Project Manager",
        "company": "COTIVITI NEPAL",
        "logo": "https://merojob.com/media/uploads/job_logo/9988341a-a920-47ad-a9a8-50272d00f721.jpg",
        "level": "Senior Level",
        "vacancy": "2",
        "time": "Full Time",
        "address": "Kathmandu",
        "salary": "Negotiable",
        "deadline": "Nov. 09, 2020 23:55\n(3 weeks, 3 days from now)",
        "education": "Bachelor",
        "experience": "More than or equals to 5 years",
        "skills": "Time Management\nOrganizational\nCommunication\nInterpersonal",
        "skills2": "Time Management\nOrganizational\nCommunication\nInterpersonal",
        "desc5": "",
        "desc4": "",
        "desc": "",
        "desc1": "ResponsibilitiesConduct and facilitate the planning. Help team to define their goals on each planning.Facilitate all the sprint rituals of own team.Coordinate with other teams on the Agile Release Train (ART) as needed. Participate in SOS to present own team's progress.Own team’s commitments and help team to achieve their goal.Help remove impediments and foster an environment for high-performing team dynamics, continuous flow, and relentless improvement.Help and guide the team to optimally plan their capacity.Make sure the team’s utilization is efficiently managed and has higher productivity.Conduct regular retrospective on every event. Make sure every action items have individual/team’s name and a date expected to get resolved with a follow up.Manage team’s RAID – Risk, Assumption, Issues and Dependencies.Compile, collect, produce and publish team’s report on different metrics.Work with Engineering manager for team’s development that helps the team to be more productive as well as efficient.Escalate to higher authority as required on any case that needs resolution from cross team.Coach the team in Scrum, Extreme Programming (XP), Kanban, and SAFe, ensuring that the agreed Agile process is being followed.Develop, document and conduct Agile development and process training as required – getting started and regular refresher training. Work with organization training manager/specialistRequirementsMinimum five years’ experience in similar role.",
        "desc2": "",
        "desc3": "Basic Job Information\n\n\n\nJob Category\n:\n\nIT & Telecommunication\n\n\n\nJob Level\n:\n\nSenior Level\n\n\n\nNo. of Vacancy/s\n:\n[ 2 ]\n\n\nEmployment Type\n:\n\nFull Time\n\n\n\nJob Location\n:\n\nKathmandu\n\n\n\nOffered Salary\n:\n\nNegotiable\n\n\n\nApply Before(Deadline)\n:\nNov. 09, 2020 23:55\n(3 weeks, 3 days from now)\n\n\n\n\n\n\n\n\n\n\n\nJob Specification\n\n\n\nEducation Level\n:\n\n Bachelor\n\n\n\nExperience Required\n:\n\nMore than or equals to 5 years\n\n\n\nProfessional Skill Required\n:\n\n\nTime Management\nOrganizational\nCommunication\nInterpersonal\n\n\n\n\n\n\n\n\n\n\n\n\nJob Description\n\nResponsibilitiesConduct and facilitate the planning. Help team to define their goals on each planning.Facilitate all the sprint rituals of own team.Coordinate with other teams on the Agile Release Train (ART) as needed. Participate in SOS to present own team's progress.Own team’s commitments and help team to achieve their goal.Help remove impediments and foster an environment for high-performing team dynamics, continuous flow, and relentless improvement.Help and guide the team to optimally plan their capacity.Make sure the team’s utilization is efficiently managed and has higher productivity.Conduct regular retrospective on every event. Make sure every action items have individual/team’s name and a date expected to get resolved with a follow up.Manage team’s RAID – Risk, Assumption, Issues and Dependencies.Compile, collect, produce and publish team’s report on different metrics.Work with Engineering manager for team’s development that helps the team to be more productive as well as efficient.Escalate to higher authority as required on any case that needs resolution from cross team.Coach the team in Scrum, Extreme Programming (XP), Kanban, and SAFe, ensuring that the agreed Agile process is being followed.Develop, document and conduct Agile development and process training as required – getting started and regular refresher training. Work with organization training manager/specialistRequirementsMinimum five years’ experience in similar role.\n\n\n\n\n\n\n\n\nApplying Procedure\n\nTo apply, please login to http://www.cotiviti.com.np/jobs or Send your CV to ktmjobs@cotiviti.com",
        "Page_URL": "https://merojob.com/project-manager-392/"
    },
    {
        "name": "Senior MS-SQL Developer",
        "company": "COTIVITI NEPAL",
        "logo": "https://merojob.com/media/uploads/job_logo/14d5e78d-b1ee-4b15-ac9d-34993d7f461b.jpg",
        "level": "Senior Level",
        "vacancy": "4",
        "time": "Full Time",
        "address": "Kathmandu",
        "salary": "Negotiable",
        "deadline": "Nov. 09, 2020 23:55\n(3 weeks, 3 days from now)",
        "education": "Bachelor",
        "experience": "More than or equals to 5 years",
        "skills": "Analytical\nCommunication\nInterpersonal",
        "skills2": "Analytical\nCommunication\nInterpersonal",
        "desc5": "",
        "desc4": "",
        "desc": "",
        "desc1": "ResponsibilitiesShould have strong knowledge on all stages of Software life cycle process: Planning, design, development, Testing and deployment.Understanding business requirements and technical documentsTranslate design into functional unit.Follow coding standard during developmentDevelop optimized queriesCreate unit test to validate changesActive participation in Project level discussion/meeting.Maintain legacy code and implement the new requirements in best possible way.Prepare Technical/flow diagram.Prepare documentation of the changes or legacy code base.Qualification and Education RequirementsBachelor of Engineering in Computer/IT or equivalent degree in Computer related studiesMust Have SkillsMinimum 5 years of experience in Software development using MS-SQL.Strong knowledge of Relational DatabasesExperience working with source control systems, such as Subversion, and GIT including branching and merging strategies.Knowledge of SSIS. Preferable SkillsExperience with Atlassian suite of tools (Jira, Confluence, Bamboo, Crucible)Soft SkillsAbility to work independently or as part of a teamExperience of working in SCRUM/Agile team would be added valuePersuasive in both written and verbal communicationStrong Analytical SkillsUS Healthcare experience would be added value",
        "desc2": "",
        "desc3": "Basic Job Information\n\n\n\nJob Category\n:\n\nIT & Telecommunication\n\n\n\nJob Level\n:\n\nSenior Level\n\n\n\nNo. of Vacancy/s\n:\n[ 4 ]\n\n\nEmployment Type\n:\n\nFull Time\n\n\n\nJob Location\n:\n\nKathmandu\n\n\n\n Offered Salary\n:\n\nNegotiable\n\n\n\nApply Before(Deadline)\n:\nNov. 09, 2020 23:55\n(3 weeks, 3 days from now)\n\n\n\n\n\n\n\n\n\n\n\nJob Specification\n\n\n\nEducation Level\n:\n\nBachelor\n\n\n\nExperience Required\n:\n\nMore than or equals to 5 years\n\n\n\nProfessional Skill Required\n:\n\n\nAnalytical\nCommunication\nInterpersonal\n\n\n\n\n\n\n\n\n\n\n\n\nJob Description\n\nResponsibilitiesShould have strong knowledge on all stages of Software life cycle process: Planning, design, development, Testing and deployment.Understanding business requirements and technical documentsTranslate design into functional unit.Follow coding standard during developmentDevelop optimized queriesCreate unit test to validate changesActive participation in Project level discussion/meeting.Maintain legacy code and implement the new requirements in best possible way.Prepare Technical/flow diagram.Prepare documentation of the changes or legacy code base.Qualification and Education RequirementsBachelor of Engineering in Computer/IT or equivalent degree in Computer related studiesMust Have SkillsMinimum 5 years of experience in Software development using MS-SQL.Strong knowledge of Relational DatabasesExperience working with source control systems, such as Subversion, and GIT including branching and merging strategies.Knowledge of SSIS. Preferable SkillsExperience with Atlassian suite of tools (Jira, Confluence, Bamboo, Crucible)Soft SkillsAbility to work independently or as part of a teamExperience of working in SCRUM/Agile team would be added valuePersuasive in both written and verbal communicationStrong Analytical SkillsUS Healthcare experience would be added value\n\n\n\n\n\n\n\n\nApplying Procedure\n\nTo apply, please login to http://www.cotiviti.com.np/jobs or Send your CV to ktmjobs@cotiviti.com",
        "Page_URL": "https://merojob.com/senior-ms-sql-developer-2/"
    },
    {
        "name": "Ful Stack .Net/ React developer",
        "company": "Infocom Solutions",
        "logo": "https://merojob.com/media/uploads/job_logo/020f7f24-1e4e-482e-a084-2e08e8d881e9.jpg",
        "level": "Mid Level",
        "vacancy": "1",
        "time": "Full Time",
        "address": "Kathmandu",
        "salary": "Negotiable",
        "deadline": "Nov. 09, 2020 23:55\n(3 weeks, 3 days from now)",
        "education": "Bachelor",
        "experience": "More than or equals to 2 years",
        "skills": "Css3\nJavascript\nDatabase Design",
        "skills2": "Css3\nJavascript\nDatabase Design",
        "desc5": "Proficient in CSS for effective presentation of the HTML elementsExtensive knowledge in both of these programming languages for creating an interactive, intuitive, and engaging frontend for applicationsMultiple skills pertaining to both frontend and backend developmentKnowledge of NoSQL databasesKnowledge of web storageMake a website look attractive and appealing",
        "desc4": "",
        "desc": "",
        "desc1": "Design and implementation of the overall web architecture“Pixel-perfect” implementation of our approved user interfaceDesign and deployment of our databaseEnsuring the entire stack is designed and built for speed and scalabilityDesign and construction of our REST APIIntegrating our front-end UI with the constructed APIDesign and implementation of continuous integration and deploymentBusiness Overview Representation & liaisonSystem Integration Value Added ServicesEnd-to-End IT Project ManagementIT Consulting and Advisory ServicesSoftware Solutions Networking Equipments Applying Procedure:Applicants are requested to send their CV in mentioned mail : info@ispl.com.npOR,",
        "desc2": "Language : c#, Asp.net Core Web API, React NativeSkills: GIT, MSSQL, Jquery, Winform, WPFIDE: Visual Studio Code, Visual Studio 2016, Android Studio, CodeXProficient in CSS for effective presentation of the HTML elementsExtensive knowledge in both of these programming languages for creating an interactive, intuitive, and engaging frontend for applicationsMultiple skills pertaining to both frontend and backend developmentKnowledge of NoSQL databasesKnowledge of web storageMake a website look attractive and appealing",
        "desc3": "Basic Job Information\n\n\n\nJob Category\n:\n\nIT & Telecommunication\n\n\n\nJob Level\n:\n\nMid Level\n\n\n\nNo. of Vacancy/s\n:\n[ 1 ]\n\n\n\nEmployment Type\n:\n\nFull Time\n\n\n\nJob Location\n:\n\nKathmandu\n\n\n\nOffered Salary\n:\n\nNegotiable\n\n\n\nApply Before(Deadline)\n:\nNov. 09, 2020 23:55\n(3 weeks, 3 days from now)\n\n\n\n\n\n\n\n\n\n\n\nJob Specification\n\n\n\nEducation Level\n:\n\nBachelor\n\n\n\nExperience Required\n:\n\nMore than or equals to 2 years\n\n\n\nProfessional Skill Required\n:\n\n\nCss3\nJavascript\nDatabase Design\n\n\n\n\n\n\nOther Specification\n\n\nLanguage : c#, Asp.net Core Web API, React NativeSkills: GIT, MSSQL, Jquery, Winform, WPFIDE: Visual Studio Code, Visual Studio 2016, Android Studio, CodeXProficient in CSS for effective presentation of the HTML elementsExtensive knowledge in both of these programming languages for creating an interactive, intuitive, and engaging frontend for applicationsMultiple skills pertaining to both frontend and backend developmentKnowledge of NoSQL databasesKnowledge of web storageMake a website look attractive and appealing\n\n\n\n\n\n\n\n\n\n\n\nJob Description\n\nDesign and implementation of the overall web architecture“Pixel-perfect” implementation of our approved user interfaceDesign and deployment of our databaseEnsuring the entire stack is designed and built for speed and scalabilityDesign and construction of our REST APIIntegrating our front-end UI with the constructed APIDesign and implementation of continuous integration and deploymentBusiness Overview Representation & liaisonSystem Integration Value Added ServicesEnd-to-End IT Project ManagementIT Consulting and Advisory ServicesSoftware Solutions Networking Equipments Applying Procedure:Applicants are requested to send their CV in mentioned mail : info@ispl.com.npOR,\n\n\n\n\n\n\n\n\n APPLY NOW",
        "Page_URL": "https://merojob.com/ful-stack-net-react-developer/"
    },
    {
        "name": "Java Developer - Benequick",
        "company": "Software Development House Nepal",
        "logo": "https://merojob.com/media/uploads/job_logo/6abea791-705b-449e-a24f-7ec80df19131.jpg",
        "level": "Mid Level",
        "vacancy": "2",
        "time": "Full Time",
        "address": "Kupondole",
        "salary": "$. 600.00 Monthly",
        "deadline": "Nov. 13, 2020 23:55\n(4 weeks from now)",
        "education": "Bachelor",
        "experience": "Not Required",
        "skills": "Java\nObject Oriented Programming\nJavascript\nJquery\nHtml",
        "skills2": "Java\nObject Oriented Programming\nJavascript\nJquery\nHtml",
        "desc5": "Good knowledge of JAVA and Object-Oriented ProgrammingGood knowledge of relational databasesExperience with J2EE, HTML, CSS, JavaScript, jQueryProficiency with Unix-like operating systemsExcellent Verbal and Written CommunicationExcellent Logical and Analytical SkillMath AptitudeTime Management and Professionalism",
        "desc4": "IT experienceAvailability to work nights and weekends if necessaryMust be able to work on Holidays to take care of urgent tasksAbility to work independently",
        "desc": "Health InsuranceProvident FundDashai Bonus, Performance Bonus, Referral Bonus15 Days PTO13 Days Govt Holidays5 Working Days per WeekRegular salary revision based on performanceFrequent team building activities",
        "desc1": " Duties and Responsibilities include, but are not limited to:Resolves assigned tasks in an efficient and effective manner. (Customer or internal.)Quality code with minimal bugsPositive code review resultsUnderstands and follows SDS (Smart Data Solutions) workflow and associated technical systemsApplies analytical and business knowledge to solve customer-specified problems adhering to SDS coding standards and policiesAdheres to SDS’s courteous and professional written and verbal communication standardsA consistently high rating on customer satisfaction surveys 5. Works independently with minimal guidanceDevelopmentCompletes development projects as specified by development manager, adhering to SDS coding standard and policiesPrograms appropriate changes as specified by development manager, adhering to SDS coding standard and policiesReviews applicable changes (in particular system related changes) with peer/manager and get approval on programming changes from managerDevelops test cases and data and test all changes and new modulesOther duties as assignedNew ImplementationsCommunicates with client regularly and documents all specifications and workflows. All implementation meetings are followed up with written listing of all tasksUnderstands related workflow and all associated nuancesCompletes all tasks as specified on the implementation checklistCompletes assigned tasks as specified by the development manager and follow the implementation manual/checklistMeets development milestones consistently. Do “what it takes” to achieve customer go live dateCommunicates to client and management if milestone dates are not metLeverages the expertise of other developers in the team on specific modules (Examples: scanner setup, OCR setup, etcSets up customer billing rates as specified on the contract and verify with sales or accounting. (Billing)Tracks and bills all applicable development hours. (Billing)Ensures unnecessary direct labor costs are not incurred in conjunction with the implementation.Business AnalysisUnderstands and follows all assigned customers workflow including import and export processAbility to interpret customer business processes, analyze problems and recommend programmable solutions.Risk DesignationThe role is classified as High Risk, due to access to Protected Healthcare Information. Employees in this role must be free of felony convictions on a background check report.Applying Procedure:Interested and qualified candidates are requested to apply with an updated Resume at sdhnrecruit@gmail.com with position applied as email Note :Only shortlisted candidates will be contacted for the programming test and interviewFreshers are discouraged to applyNon-Java developers with good programming background and willing to switch to Java can applyKeep checking inbox regularly for email notificationOR,",
        "desc2": "Must have skills:Good knowledge of JAVA and Object-Oriented ProgrammingGood knowledge of relational databasesExperience with J2EE, HTML, CSS, JavaScript, jQueryProficiency with Unix-like operating systemsExcellent Verbal and Written CommunicationExcellent Logical and Analytical SkillMath AptitudeTime Management and ProfessionalismOther Job Requirements:IT experienceAvailability to work nights and weekends if necessaryMust be able to work on Holidays to take care of urgent tasksAbility to work independently Benefits:Health InsuranceProvident FundDashai Bonus, Performance Bonus, Referral Bonus15 Days PTO13 Days Govt Holidays5 Working Days per WeekRegular salary revision based on performanceFrequent team building activities",
        "desc3": "Basic Job Information\n\n\n\nJob Category\n:\n\nIT & Telecommunication\n\n\n\nJob Level\n:\n\nMid Level\n\n\n\nNo. of Vacancy/s\n:\n[ 2 ]\n\n\nEmployment Type\n:\n\nFull Time\n\n\n\nJob Location\n:\n\nKupondole\nKathmandu\n\n\n\nOffered Salary\n:\n\n$. 600.00 Monthly\n\n\n\nApply Before(Deadline)\n:\nNov. 13, 2020 23:55\n(4 weeks from now)\n\n\n\n\n\n\n\n\n\n\n\nJob Specification\n\n \n\nEducation Level\n:\n\nBachelor\n\n\n\nExperience Required\n:\n\nNot Required\n\n\n\nProfessional Skill Required\n:\n\n\nJava\nObject Oriented Programming\nJavascript\nJquery\nHtml\n\n\n\n\n\n\nOther Specification\n\n\nMust have skills:Good knowledge of JAVA and Object-Oriented ProgrammingGood knowledge of relational databasesExperience with J2EE, HTML, CSS, JavaScript, jQueryProficiency with Unix-like operating systemsExcellent Verbal and Written CommunicationExcellent Logical and Analytical SkillMath AptitudeTime Management and ProfessionalismOther Job Requirements:IT experienceAvailability to work nights and weekends if necessaryMust be able to work on Holidays to take care of urgent tasksAbility to work independently Benefits:Health InsuranceProvident FundDashai Bonus, Performance Bonus, Referral Bonus15 Days PTO13 Days Govt Holidays5 Working Days per WeekRegular salary revision based on performanceFrequent team building activities\n\n\n\n\n\n\n\n\n\n\n\nJob Description\n\n Duties and Responsibilities include, but are not limited to:Resolves assigned tasks in an efficient and effective manner. (Customer or internal.)Quality code with minimal bugsPositive code review resultsUnderstands and follows SDS (Smart Data Solutions) workflow and associated technical systemsApplies analytical and business knowledge to solve customer-specified problems adhering to SDS coding standards and policiesAdheres to SDS’s courteous and professional written and verbal communication standardsA consistently high rating on customer satisfaction surveys 5. Works independently with minimal guidanceDevelopmentCompletes development projects as specified by development manager, adhering to SDS coding standard and policiesPrograms appropriate changes as specified by development manager, adhering to SDS coding standard and policiesReviews applicable changes (in particular system related changes) with peer/manager and get approval on programming changes from managerDevelops test cases and data and test all changes and new modulesOther duties as assignedNew ImplementationsCommunicates with client regularly and documents all specifications and workflows. All implementation meetings are followed up with written listing of all tasksUnderstands related workflow and all associated nuancesCompletes all tasks as specified on the implementation checklistCompletes assigned tasks as specified by the development manager and follow the implementation manual/checklistMeets development milestones consistently. Do “what it takes” to achieve customer go live dateCommunicates to client and management if milestone dates are not metLeverages the expertise of other developers in the team on specific modules (Examples: scanner setup, OCR setup, etcSets up customer billing rates as specified on the contract and verify with sales or accounting. (Billing)Tracks and bills all applicable development hours. (Billing)Ensures unnecessary direct labor costs are not incurred in conjunction with the implementation.Business AnalysisUnderstands and follows all assigned customers workflow including import and export processAbility to interpret customer business processes, analyze problems and recommend programmable solutions.Risk DesignationThe role is classified as High Risk, due to access to Protected Healthcare Information. Employees in this role must be free of felony convictions on a background check report.Applying Procedure:Interested and qualified candidates are requested to apply with an updated Resume at sdhnrecruit@gmail.com with position applied as email Note :Only shortlisted candidates will be contacted for the programming test and interviewFreshers are discouraged to applyNon-Java developers with good programming background and willing to switch to Java can applyKeep checking inbox regularly for email notificationOR,\n\n\n\n\n\n\n\n\nAPPLY NOW",
        "Page_URL": "https://merojob.com/java-developer-benequick/"
    },
    {
        "name": "Backend Developer (Python)",
        "company": "Tekvortex",
        "logo": "https://merojob.com/media/uploads/job_logo/900cde4b-a41a-4d79-913e-54b43dce6744.jpg",
        "level": "Senior Level",
        "vacancy": "3",
        "time": "Full Time",
        "address": "Harihar Bhawan, Pulchowk",
        "salary": "Negotiable",
        "deadline": "Oct. 25, 2020 23:55\n(1 week, 2 days from now)",
        "education": "Bachelor",
        "experience": "More than or equals to 2 years",
        "skills": "Python\nBackend\nData Analytics\nBig Data",
        "skills2": "Python\nBackend\nData Analytics\nBig Data",
        "desc5": "",
        "desc4": "",
        "desc": "",
        "desc1": "These are professional openings requiring a minimum of 2 years of experience in the software industry. Currently, we are seeking skilled and passionate development all-rounders to be key players in our dynamic team involved in the research and development of leading enterprise products and services globally.The ideal candidate will have extensive development experience working on enterprise grade SAAS applications. You will have the opportunity to work in a fast-paced environment. You should be ready and excited to learn and implement new technologies.ResponsibilitiesAnalyze product requirements and design/implement solutions to meet the sameMaintain, troubleshoot and enhance large scale enterprise applicationsEvaluate application performance and determine any applicable improvementsParticipate in the evolution of our technologies and practices, occasionally pitch new technologies that you believe in, and participate in workshops to learn new skillsUtilize various open source technologiesUse various tools to orchestrate solutionsBuild independent scripts, web-based tools, micro-services and solutionsWrite scripts and automation using Perl/Python/Bash etc.Configure and manage data sources/solutions like PostgreSQL, Redis, Hadoop, Athena etc.Desired Skills/Characteristics\n\nBachelor’s\nDegree or MS in Engineering or equivalent\nFluency in\nprogramming in core Python on Linux using OOP concepts with focus on data\nanalytics (Pandas, NumPy) and visualization (Bokeh, Matplotlib, Plotly)\nExperience\nwith big data solutions, Hadoop and machine learning is highly desirable\nExperience\nworking with web services using REST APIs\nAdequate\nknowledge of relational and NoSQL database systems \nWorking\nknowledge of R and Cloud Services (AWS preferred)\nStrong\nattention to detail while implementing technical specifications\nAbility to\nwork effectively with large code base using version control tools \nAbility to\nwork and thrive in a fast-paced environment, learn rapidly and master\ndiverse technologies and techniques\nCritical\nthinker, strong analytical, problem-solving and time-management skills\nExcellent\nverbal and written English communication skills\nWillingness\nto work in flexible hours overlapping with US office hours, if needed\nGood\nattitude and strong work ethics\n\n* Remuneration and benefits will be based on experience and will not be a constraint for deserving candidates.Applying Procedure:Candidates can also send their resume directly to jobs@tekvortex.com.\nPlease mention the vacancy you are applying for in the subject of the cover\nletter.OR,",
        "desc2": "",
        "desc3": "Basic Job Information\n\n\n\nJob Category\n:\n\nIT & Telecommunication\n > Programmer/ Software Engineer\n\n\n\nJob Level\n:\n\nSenior Level\n\n \n\nNo. of Vacancy/s\n:\n[ 3 ]\n\n\nEmployment Type\n:\n\nFull Time\n\n\n\nJob Location\n:\n\nHarihar Bhawan, Pulchowk\n\n\n\nOffered Salary\n:\n\nNegotiable\n\n\n\nApply Before(Deadline)\n:\nOct. 25, 2020 23:55\n(1 week, 2 days from now)\n\n\n\n\n\n\n\n\n\n\n\nJob Specification\n\n\n\nEducation Level\n:\n\nBachelor\n\n\n\nExperience Required\n:\n\nMore than or equals to 2 years\n\n\n\nProfessional Skill Required\n :\n\n\nPython\nBackend\nData Analytics\nBig Data\n\n\n\n\n\n\n\n\n\n\n\n\nJob Description\n\nThese are professional openings requiring a minimum of 2 years of experience in the software industry. Currently, we are seeking skilled and passionate development all-rounders to be key players in our dynamic team involved in the research and development of leading enterprise products and services globally.The ideal candidate will have extensive development experience working on enterprise grade SAAS applications. You will have the opportunity to work in a fast-paced environment. You should be ready and excited to learn and implement new technologies.ResponsibilitiesAnalyze product requirements and design/implement solutions to meet the sameMaintain, troubleshoot and enhance large scale enterprise applicationsEvaluate application performance and determine any applicable improvementsParticipate in the evolution of our technologies and practices, occasionally pitch new technologies that you believe in, and participate in workshops to learn new skillsUtilize various open source technologiesUse various tools to orchestrate solutionsBuild independent scripts, web-based tools, micro-services and solutionsWrite scripts and automation using Perl/Python/Bash etc.Configure and manage data sources/solutions like PostgreSQL, Redis, Hadoop, Athena etc.Desired Skills/Characteristics\n\nBachelor’s\nDegree or MS in Engineering or equivalent\nFluency in\nprogramming in core Python on Linux using OOP concepts with focus on data\nanalytics (Pandas, NumPy) and visualization (Bokeh, Matplotlib, Plotly)\nExperience\nwith big data solutions, Hadoop and machine learning is highly desirable\nExperience\nworking with web services using REST APIs\nAdequate\nknowledge of relational and NoSQL database systems \nWorking\nknowledge of R and Cloud Services (AWS preferred)\nStrong\nattention to detail while implementing technical specifications\nAbility to\nwork effectively with large code base using version control tools \nAbility to\nwork and thrive in a fast-paced environment, learn rapidly and master\ndiverse technologies and techniques\nCritical\nthinker, strong analytical, problem-solving and time-management skills\nExcellent\nverbal and written English communication skills\nWillingness\nto work in flexible hours overlapping with US office hours, if needed\nGood\nattitude and strong work ethics\n\n* Remuneration and benefits will be based on experience and will not be a constraint for deserving candidates.Applying Procedure:Candidates can also send their resume directly to jobs@tekvortex.com.\nPlease mention the vacancy you are applying for in the subject of the cover\nletter.OR,\n\n\n\n\n\n\n\n\nAPPLY NOW",
        "Page_URL": "https://merojob.com/backend-developer-python-3/"
    },
    {
        "name": "SQL / Database Developer",
        "company": "Verisk Nepal",
        "logo": "https://merojob.com/media/uploads/job_logo/04621ca6-a1dd-4ed7-ab69-8f850d9930fb.jpg",
        "level": "Mid Level",
        "vacancy": "1",
        "time": "Full Time",
        "address": "Lalitpur",
        "salary": "Negotiable",
        "deadline": "Nov. 15, 2020 23:55\n(1 month from now)",
        "education": "Bachelor",
        "experience": "More than or equals to 4 years",
        "skills": "Plsql\nSql\nDatabase Management",
        "skills2": "Plsql\nSql\nDatabase Management",
        "desc5": "Bachelor’s in computer science / Engineering.At least 4 years of experience working in TSQL/PLSQL.",
        "desc4": "Experience or Knowledge in AWS cloud services: S3, EC2, EMR, RDS, RedshiftExperience or Knowledge in relational SQL, Snowflake and NoSQL databases, including Postgres, working with the Apache Hadoop EcosystemGood working knowledge of python or Java or C#.Experience or Knowledge in Airflow system, and Tableau.Experience with Agile methodologiesGood knowledge of Shell scripting.Design and implement the development and release process including CICD based strategiesStrong knowledge in SQL scripting, procedures, functions and triggersExperience in data loading, analytics, logical and problem solvingSkilled at optimizing large complicated SQL statementsCapable of troubleshooting common database issuesKnowledge in DTS packagesHave experience working in MS Excel macros is a plus.Good interpersonal and communication skillsWillingness to learn new technologies as per requirement of the Project.",
        "desc": "",
        "desc1": "Responsibilities:Develop scripts to load different types of file and automate them through Airflow/Pentaho or ETL application.Develop file processing applications using python/java or C#.Develop, implement and optimize stored procedures and functions using T-SQLResearch required dataHandle common database issues and proceduresCollaborate with other team members and stakeholdersPrepare documentations and specifications ",
        "desc2": "QualificationsBachelor’s in computer science / Engineering.At least 4 years of experience working in TSQL/PLSQL.Skills and Expertise:Experience or Knowledge in AWS cloud services: S3, EC2, EMR, RDS, RedshiftExperience or Knowledge in relational SQL, Snowflake and NoSQL databases, including Postgres, working with the Apache Hadoop EcosystemGood working knowledge of python or Java or C#.Experience or Knowledge in Airflow system, and Tableau.Experience with Agile methodologiesGood knowledge of Shell scripting.Design and implement the development and release process including CICD based strategiesStrong knowledge in SQL scripting, procedures, functions and triggersExperience in data loading, analytics, logical and problem solvingSkilled at optimizing large complicated SQL statementsCapable of troubleshooting common database issuesKnowledge in DTS packagesHave experience working in MS Excel macros is a plus.Good interpersonal and communication skillsWillingness to learn new technologies as per requirement of the Project.",
        "desc3": "Basic Job Information\n\n\n\nJob Category\n:\n\nIT & Telecommunication\n > Database Engineer/Database Programmer, Programmer/ Software Engineer\n\n\n\n\nJob Level\n:\n\nMid Level\n\n\n\nNo. of Vacancy/s\n:\n[ 1 ]\n\n\nEmployment Type\n:\n\nFull Time\n\n\n\nJob Location\n:\n\nLalitpur\n\n\n\nOffered Salary\n:\n\nNegotiable\n\n\n\nApply Before(Deadline)\n:\nNov. 15, 2020 23:55\n(1 month from now)\n\n\n\n\n\n\n\n\n\n\n\nJob Specification\n\n\n\nEducation Level\n:\n\nBachelor\n\n\n\nExperience Required\n:\n\nMore than or equals to 4 years\n\n \n\nProfessional Skill Required\n:\n\n\nPlsql\nSql\nDatabase Management\n\n\n\n\n\n\nOther Specification\n\n\nQualificationsBachelor’s in computer science / Engineering.At least 4 years of experience working in TSQL/PLSQL.Skills and Expertise:Experience or Knowledge in AWS cloud services: S3, EC2, EMR, RDS, RedshiftExperience or Knowledge in relational SQL, Snowflake and NoSQL databases, including Postgres, working with the Apache Hadoop EcosystemGood working knowledge of python or Java or C#.Experience or Knowledge in Airflow system, and Tableau.Experience with Agile methodologiesGood knowledge of Shell scripting.Design and implement the development and release process including CICD based strategiesStrong knowledge in SQL scripting, procedures, functions and triggersExperience in data loading, analytics, logical and problem solvingSkilled at optimizing large complicated SQL statementsCapable of troubleshooting common database issuesKnowledge in DTS packagesHave experience working in MS Excel macros is a plus.Good interpersonal and communication skillsWillingness to learn new technologies as per requirement of the Project.\n\n\n\n\n\n\n\n\n\n\n\nJob Description\n\nResponsibilities:Develop scripts to load different types of file and automate them through Airflow/Pentaho or ETL application.Develop file processing applications using python/java or C#.Develop, implement and optimize stored procedures and functions using T-SQLResearch required dataHandle common database issues and proceduresCollaborate with other team members and stakeholdersPrepare documentations and specifications \n\n\n\n\n\n\n\n\nApplying Procedure\n\nPlease apply through the below link : https://jobs.smartrecruiters.com/Verisk/743999721536849-senior-software-engineer-sql-developer or https://careers.smartrecruiters.com/Verisk?search=nepalAdditional Information:Verisk Analytics is an equal opportunity employer.All members of the Verisk Analytics family of companies are equal opportunity employers. We consider all qualified applicants for employment without regard to race, religion, color, national origin, citizenship, sex, gender identity and/or expression, sexual orientation, veteran's status, age or disability.http://www.verisk.com/careers.htmlUnsolicited resumes sent to Verisk, including unsolicited resumes sent to a Verisk business mailing address, fax machine or email address, or directly to Verisk employees, will be considered Verisk property. Verisk will NOT pay a fee for any placement resulting from the receipt of an unsolicited resume. Consumer Privacy Notice",
        "Page_URL": "https://merojob.com/front-end-ui-develope/"
    },
    {
        "name": "Front End / UI Developer",
        "company": "Verisk Nepal",
        "logo": "https://merojob.com/media/uploads/job_logo/b7cf1c56-9379-4ce8-b890-729028a03e50.jpg",
        "level": "Mid Level",
        "vacancy": "1",
        "time": "Full Time",
        "address": "Lalitpur",
        "salary": "Negotiable",
        "deadline": "Nov. 15, 2020 23:55\n(1 month from now)",
        "education": "Bachelor",
        "experience": "More than or equals to 3 years",
        "skills": "Angular\nUi/Ux",
        "skills2": "Angular\nUi/Ux",
        "desc5": "Bachelor’s in Computer Science, or related field or equivalent experienceAt least 3 years of professional experience in JavaScript / Angular Technology",
        "desc4": "Passion for programming in general, rather than a specific languageBe focused, passionate, and strive to find simple solutions to complex problemsAbility to learn new, emerging technologiesYou have a solid general understanding of application components, what happens on the front end, what happens on the back end.You’re a professional. That means you follow through on commitments, meet deadlines, don’t cut corners, consider other people’s ideas, play nice with the team, learn from your mistakes, document things and communicate honestly and proactively if you anticipate an issue doing any of the aboveAbility to effectively work on multiple projects simultaneously and effectively contend with competing prioritiesPossess strong troubleshooting, code optimization and refactoring skillsHave strong sense of ownership with demonstrated ability to work independently without supervision",
        "desc": "JavaScript frameworks (Angular 4+ - preferably the latest verison, AngularJS, React, jQuery), RxJs, Redux, Web markup languages (HTML/HTML5, XML) and Style sheet language (CSS/CSS3), SASS, LESSWell versed in using UX and UI design tools like Adobe Photoshop, Adobe Illustrator, Adobe InDesign and Adobe XDExperience in working with using html frameworks like Bootstrap and FoundationWriting tested and documented JavaScript withExpertise in build processes (Angular CLI, Webpack)Experienced in writing test cases and performing unit testing using frameworks (ex. Jasmine, Karma)Used DevOps and CI/CD in previous work experienceDeveloped software in SCRUM environment using Agile methodologies and involved in SDLC process",
        "desc1": "Responsibilities Make design and technical decisions for Angular projectsPerform unit testing by using different frameworks like Jasmine, KarmaBe involved in all phases of the agile software development lifecycleProactively seek out and minimize pain points within the infrastructure and code baseKeep up to date with the latest technologies and introduce them as neededCreate next-gen solutions for unique and challenging use casesCommunicate proactively with Business stakeholders and provide design suggestionsAnalyze, debug and fix defects",
        "desc2": "QualificationsBachelor’s in Computer Science, or related field or equivalent experienceAt least 3 years of professional experience in JavaScript / Angular TechnologySkills and Knowledge Passion for programming in general, rather than a specific languageBe focused, passionate, and strive to find simple solutions to complex problemsAbility to learn new, emerging technologiesYou have a solid general understanding of application components, what happens on the front end, what happens on the back end.You’re a professional. That means you follow through on commitments, meet deadlines, don’t cut corners, consider other people’s ideas, play nice with the team, learn from your mistakes, document things and communicate honestly and proactively if you anticipate an issue doing any of the aboveAbility to effectively work on multiple projects simultaneously and effectively contend with competing prioritiesPossess strong troubleshooting, code optimization and refactoring skillsHave strong sense of ownership with demonstrated ability to work independently without supervisionTechnical Expertise:JavaScript frameworks (Angular 4+ - preferably the latest verison, AngularJS, React, jQuery), RxJs, Redux, Web markup languages (HTML/HTML5, XML) and Style sheet language (CSS/CSS3), SASS, LESSWell versed in using UX and UI design tools like Adobe Photoshop, Adobe Illustrator, Adobe InDesign and Adobe XDExperience in working with using html frameworks like Bootstrap and FoundationWriting tested and documented JavaScript withExpertise in build processes (Angular CLI, Webpack)Experienced in writing test cases and performing unit testing using frameworks (ex. Jasmine, Karma)Used DevOps and CI/CD in previous work experienceDeveloped software in SCRUM environment using Agile methodologies and involved in SDLC process",
        "desc3": "Basic Job Information\n\n\n\nJob Category\n:\n\nIT & Telecommunication\n > Programmer/ Software Engineer\n\n\n\nJob Level\n:\n\nMid Level\n\n\n\nNo. of Vacancy/s\n:\n[ 1 ]\n\n\nEmployment Type\n:\n\nFull Time\n\n\n\nJob Location\n:\n\nLalitpur\n\n\n\nOffered Salary\n:\n\nNegotiable\n\n\n\nApply Before(Deadline)\n:\nNov. 15, 2020 23:55\n(1 month from now)\n\n\n\n\n\n\n\n\n\n\n\nJob Specification\n\n\n\nEducation Level\n:\n\nBachelor\n\n\n\nExperience Required\n:\n\nMore than or equals to 3 years\n\n\n\nProfessional Skill Required\n:\n\n\nAngular\nUi/Ux\n\n\n\n\n\n\nOther Specification\n\n\nQualificationsBachelor’s in Computer Science, or related field or equivalent experienceAt least 3 years of professional experience in JavaScript / Angular TechnologySkills and Knowledge Passion for programming in general, rather than a specific languageBe focused, passionate, and strive to find simple solutions to complex problemsAbility to learn new, emerging technologiesYou have a solid general understanding of application components, what happens on the front end, what happens on the back end.You’re a professional. That means you follow through on commitments, meet deadlines, don’t cut corners, consider other people’s ideas, play nice with the team, learn from your mistakes, document things and communicate honestly and proactively if you anticipate an issue doing any of the aboveAbility to effectively work on multiple projects simultaneously and effectively contend with competing prioritiesPossess strong troubleshooting, code optimization and refactoring skillsHave strong sense of ownership with demonstrated ability to work independently without supervisionTechnical Expertise:JavaScript frameworks (Angular 4+ - preferably the latest verison, AngularJS, React, jQuery), RxJs, Redux, Web markup languages (HTML/HTML5, XML) and Style sheet language (CSS/CSS3), SASS, LESSWell versed in using UX and UI design tools like Adobe Photoshop, Adobe Illustrator, Adobe InDesign and Adobe XDExperience in working with using html frameworks like Bootstrap and FoundationWriting tested and documented JavaScript withExpertise in build processes (Angular CLI, Webpack)Experienced in writing test cases and performing unit testing using frameworks (ex. Jasmine, Karma)Used DevOps and CI/CD in previous work experienceDeveloped software in SCRUM environment using Agile methodologies and involved in SDLC process\n\n\n\n\n\n\n\n\n\n\n\nJob Description\n\nResponsibilities Make design and technical decisions for Angular projectsPerform unit testing by using different frameworks like Jasmine, KarmaBe involved in all phases of the agile software development lifecycleProactively seek out and minimize pain points within the infrastructure and code baseKeep up to date with the latest technologies and introduce them as neededCreate next-gen solutions for unique and challenging use casesCommunicate proactively with Business stakeholders and provide design suggestionsAnalyze, debug and fix defects\n\n\n\n\n\n\n\n\nApplying Procedure\n\nPlease apply through the below link : https://jobs.smartrecruiters.com/Verisk/743999721662476-software-engineer-front-end-developer or https://careers.smartrecruiters.com/Verisk?search=nepalAdditional Information:Verisk Analytics is an equal opportunity employer.All members of the Verisk Analytics family of companies are equal opportunity employers. We consider all qualified applicants for employment without regard to race, religion, color, national origin, citizenship, sex, gender identity and/or expression, sexual orientation, veteran's status, age or disability.http://www.verisk.com/careers.htmlUnsolicited resumes sent to Verisk, including unsolicited resumes sent to a Verisk business mailing address, fax machine or email address, or directly to Verisk employees, will be considered Verisk property. Verisk will NOT pay a fee for any placement resulting from the receipt of an unsolicited resume. Consumer Privacy Notice",
        "Page_URL": "https://merojob.com/front-end-ui-developer-2/"
    },
    {
        "name": "QA Automation Engineer",
        "company": "Verisk Nepal",
        "logo": "https://merojob.com/media/uploads/job_logo/e192e904-21e1-4ddf-926f-19365a89c401.jpg",
        "level": "Mid Level",
        "vacancy": "2",
        "time": "Full Time",
        "address": "Lalitpur",
        "salary": "Negotiable",
        "deadline": "Nov. 15, 2020 23:55\n(1 month from now)",
        "education": "Bachelor",
        "experience": "More than or equals to 1 year",
        "skills": "Programming\nAutomation\nTesting\nQa",
        "skills2": "Programming\nAutomation\nTesting\nQa",
        "desc5": "Bachelor’s in Computer Science, or related field or equivalent experience1 to 3 years of professional experience in Software Quality Assurance and Test Automation",
        "desc4": "Passion to work and grow as a Software QA EngineerAbility to analyze acceptance criteria and discuss scenarios with team with a goal of identifying possible issues upfront even before the feature is developedAbility to build automated test scripts, plan tests and strategies according to the projectThorough and disciplined, ability to analyze a problem and weight severity of the issueDedicated worker skilled at collaborating in a team settingProven excellent problem-solving and analytic skillsDemonstrated excellent communication skillsFamiliarity with Agile workflow as well as Atlassian Jira and Confluence",
        "desc": "Strong understanding of object-oriented programmingGood knowledge of a programming/scripting language – JAVA, C# .Net, Scripting, PythonKnack for writing clean, readable, and easily maintainable QA automation workflowsExperience in testing web services such as RESTful APIExperience in performance testing using tools such as Apache JMeterExperience of testing Search clusters like Solr, Lucene and Elastic SearchProficient in SQL and relational database concepts, experience or knowledge of NoSQL DB preferably MongoDBTechnically familiar with development concepts and formats such as SQL, XML, JSON and scripting languages with experience in testing non-GUI applicationsProficient understanding of code versioning tool and familiarity with Continuous Integration atmosphereKnowledge of AWS services would be a strong plus point.",
        "desc1": "Responsibilities Act as QA lead on a wide variety of projectsLead analysis for the purposes of developing test cases and test data for search intense back-end data applications in such a way that defects are uncovered as early as possibleClearly define test plans, scenarios, scripts, and proceduresPerform hands-on manual testing while scripting automated tests to ensure application functionality, performance and securityContinuously develop and socialize best practices for the design and development of robust and easily maintainable QA Automation Suites.Serve as a liaison to business analyst and product owner, providing feedback on application readiness for migrations.Be involved in all phases of the agile software development lifecycle",
        "desc2": "QualificationsBachelor’s in Computer Science, or related field or equivalent experience1 to 3 years of professional experience in Software Quality Assurance and Test AutomationSkills and Knowledge Passion to work and grow as a Software QA EngineerAbility to analyze acceptance criteria and discuss scenarios with team with a goal of identifying possible issues upfront even before the feature is developedAbility to build automated test scripts, plan tests and strategies according to the projectThorough and disciplined, ability to analyze a problem and weight severity of the issueDedicated worker skilled at collaborating in a team settingProven excellent problem-solving and analytic skillsDemonstrated excellent communication skillsFamiliarity with Agile workflow as well as Atlassian Jira and ConfluenceTechnical Expertise:Strong understanding of object-oriented programmingGood knowledge of a programming/scripting language – JAVA, C# .Net, Scripting, PythonKnack for writing clean, readable, and easily maintainable QA automation workflowsExperience in testing web services such as RESTful APIExperience in performance testing using tools such as Apache JMeterExperience of testing Search clusters like Solr, Lucene and Elastic SearchProficient in SQL and relational database concepts, experience or knowledge of NoSQL DB preferably MongoDBTechnically familiar with development concepts and formats such as SQL, XML, JSON and scripting languages with experience in testing non-GUI applicationsProficient understanding of code versioning tool and familiarity with Continuous Integration atmosphereKnowledge of AWS services would be a strong plus point.",
        "desc3": "Basic Job Information\n\n\n\nJob Category\n:\n\nIT & Telecommunication\n\n\n\nJob Level\n:\n\nMid Level\n\n\n\nNo. of Vacancy/s\n:\n[ 2 ]\n\n\nEmployment Type\n:\n\nFull Time\n\n\n\nJob Location\n:\n\nLalitpur\n\n\n\nOffered Salary\n:\n\nNegotiable\n\n\n\nApply Before(Deadline)\n:\nNov. 15, 2020 23:55\n(1 month from now)\n\n\n\n\n\n\n\n\n\n\n\nJob Specification\n\n\n\nEducation Level\n:\n\nBachelor\n\n\n\nExperience Required\n:\n\nMore than or equals to 1 year\n\n\n\n\nProfessional Skill Required\n:\n\n\nProgramming\nAutomation\nTesting\nQa\n\n\n\n\n\n\nOther Specification\n\n\nQualificationsBachelor’s in Computer Science, or related field or equivalent experience1 to 3 years of professional experience in Software Quality Assurance and Test AutomationSkills and Knowledge Passion to work and grow as a Software QA EngineerAbility to analyze acceptance criteria and discuss scenarios with team with a goal of identifying possible issues upfront even before the feature is developedAbility to build automated test scripts, plan tests and strategies according to the projectThorough and disciplined, ability to analyze a problem and weight severity of the issueDedicated worker skilled at collaborating in a team settingProven excellent problem-solving and analytic skillsDemonstrated excellent communication skillsFamiliarity with Agile workflow as well as Atlassian Jira and ConfluenceTechnical Expertise:Strong understanding of object-oriented programmingGood knowledge of a programming/scripting language – JAVA, C# .Net, Scripting, PythonKnack for writing clean, readable, and easily maintainable QA automation workflowsExperience in testing web services such as RESTful APIExperience in performance testing using tools such as Apache JMeterExperience of testing Search clusters like Solr, Lucene and Elastic SearchProficient in SQL and relational database concepts, experience or knowledge of NoSQL DB preferably MongoDBTechnically familiar with development concepts and formats such as SQL, XML, JSON and scripting languages with experience in testing non-GUI applicationsProficient understanding of code versioning tool and familiarity with Continuous Integration atmosphereKnowledge of AWS services would be a strong plus point.\n\n\n\n\n\n\n\n\n\n\n\nJob Description\n\nResponsibilities Act as QA lead on a wide variety of projectsLead analysis for the purposes of developing test cases and test data for search intense back-end data applications in such a way that defects are uncovered as early as possibleClearly define test plans, scenarios, scripts, and proceduresPerform hands-on manual testing while scripting automated tests to ensure application functionality, performance and securityContinuously develop and socialize best practices for the design and development of robust and easily maintainable QA Automation Suites.Serve as a liaison to business analyst and product owner, providing feedback on application readiness for migrations.Be involved in all phases of the agile software development lifecycle\n\n\n\n\n\n\n\n\nApplying Procedure\n\nPlease apply through the below link : https://careers.smartrecruiters.com/Verisk?search=nepal or https://jobs.smartrecruiters.com/Verisk/743999721769464-qa-automation-engineerAdditional Information:Verisk Analytics is an equal opportunity employer.All members of the Verisk Analytics family of companies are equal opportunity employers. We consider all qualified applicants for employment without regard to race, religion, color, national origin, citizenship, sex, gender identity and/or expression, sexual orientation, veteran's status, age or disability.http://www.verisk.com/careers.htmlUnsolicited resumes sent to Verisk, including unsolicited resumes sent to a Verisk business mailing address, fax machine or email address, or directly to Verisk employees, will be considered Verisk property. Verisk will NOT pay a fee for any placement resulting from the receipt of an unsolicited resume. Consumer Privacy Notice",
        "Page_URL": "https://merojob.com/qa-automation-engineer-7/"
    },
    {
        "name": "Java Developer",
        "company": "Verisk Nepal",
        "logo": "https://merojob.com/media/uploads/job_logo/af732acb-9804-4178-80fb-6fccd5a15357.jpg",
        "level": "Mid Level",
        "vacancy": "4",
        "time": "Full Time",
        "address": "lalitpur",
        "salary": "Negotiable",
        "deadline": "Nov. 14, 2020 11:00\n(4 weeks from now)",
        "education": "Bachelor",
        "experience": "More than or equals to 2 years",
        "skills": "Java\nAws",
        "skills2": "Java\nAws",
        "desc5": "Bachelor’s in Computer Science, or related field or equivalent experience2 to 3 years of professional experience in Java based application development",
        "desc4": "Have strong sense of ownership with demonstrated ability to work independentlyBe focused, passionate, and strive to find simple solutions to complex problemsExcellent understanding of OOP design concepts and software development processes and methodsAbility to learn new, emerging technologiesYou have a solid general understanding of application components and search engines – what happens on the front end, what happens on the back end.You’re a professional. That means you follow through on commitments, meet deadlines, don’t cut corners, consider other people’s ideas, play nice with the team, learn from your mistakes, document things and communicate honestly and proactively if you anticipate an issue doing any of the aboveAbility to effectively work on multiple projects simultaneously and effectively contend with competing prioritiesPossess strong troubleshooting, code optimization and refactoring skills",
        "desc": "Strong in JAVA programming and JAVA based technologies – JAVA 8+ features, J2EE Framework, Spring FrameworkExperience working in heavily multithreaded applicationExperience or knowledge of Search Engines like Solr, Lucene and Elastic SearchExperience in microservices architecture and RESTful API developmentKnowledge of SQL and NoSQL databases (preferably MongoDB, MSSQL and/or Postgres),Knowledge of queuing and messaging technologies like RabbitMQ, SNS and SQSProficient experience working with Maven, Jenkins, Bamboo, Octopus or any CI/CD tool and deep understanding of continuous integration/continuous delivery. Willing and able to work with DevOps team and contribute to CI/CDKnowledge of AWS services like EC2, S3, Lambda, API Gateway, Aurora PostgreSQL, DynamoDB, Elasticsearch is a strong plus point",
        "desc1": "Responsibilities Design, implement and maintain JAVA applicationTake part in software and architectural development activitiesBe involved in all phases of the agile software development lifecycleEngage in technical grooming discussions where you should be able to learn as well as contributeWrite well designed, testable, efficient codeProactively seek out and minimize pain points within the infrastructure and code baseKeep up to date with the latest technologies and introduce them as neededCreate next-gen solutions for unique and challenging use casesEnsure designs follow specificationsPrepare and produce releases of software componentsRecommend changes to improve established java application processes",
        "desc2": "QualificationsBachelor’s in Computer Science, or related field or equivalent experience2 to 3 years of professional experience in Java based application developmentSkills and Knowledge Have strong sense of ownership with demonstrated ability to work independentlyBe focused, passionate, and strive to find simple solutions to complex problemsExcellent understanding of OOP design concepts and software development processes and methodsAbility to learn new, emerging technologiesYou have a solid general understanding of application components and search engines – what happens on the front end, what happens on the back end.You’re a professional. That means you follow through on commitments, meet deadlines, don’t cut corners, consider other people’s ideas, play nice with the team, learn from your mistakes, document things and communicate honestly and proactively if you anticipate an issue doing any of the aboveAbility to effectively work on multiple projects simultaneously and effectively contend with competing prioritiesPossess strong troubleshooting, code optimization and refactoring skillsTechnical Expertise:Strong in JAVA programming and JAVA based technologies – JAVA 8+ features, J2EE Framework, Spring FrameworkExperience working in heavily multithreaded applicationExperience or knowledge of Search Engines like Solr, Lucene and Elastic SearchExperience in microservices architecture and RESTful API developmentKnowledge of SQL and NoSQL databases (preferably MongoDB, MSSQL and/or Postgres),Knowledge of queuing and messaging technologies like RabbitMQ, SNS and SQSProficient experience working with Maven, Jenkins, Bamboo, Octopus or any CI/CD tool and deep understanding of continuous integration/continuous delivery. Willing and able to work with DevOps team and contribute to CI/CDKnowledge of AWS services like EC2, S3, Lambda, API Gateway, Aurora PostgreSQL, DynamoDB, Elasticsearch is a strong plus point",
        "desc3": "Basic Job Information\n\n\n\nJob Category\n:\n\nIT & Telecommunication\n\n\n\nJob Level\n:\n\nMid Level\n\n\n\nNo. of Vacancy/s\n:\n[ 4 ]\n\n\nEmployment Type\n:\n\nFull Time\n\n\n\nJob Location\n:\n\nlalitpur\n\n\n\nOffered Salary\n:\n\nNegotiable\n\n\n\nApply Before(Deadline)\n:\nNov. 14, 2020 11:00\n(4 weeks from now)\n\n\n\n\n\n\n\n\n\n\n\nJob Specification\n\n\n\nEducation Level\n:\n\nBachelor\n\n\n\nExperience Required\n:\n\nMore than or equals to 2 years\n\n\n\n Professional Skill Required\n:\n\n\nJava\nAws\n\n\n\n\n\n\nOther Specification\n\n\nQualificationsBachelor’s in Computer Science, or related field or equivalent experience2 to 3 years of professional experience in Java based application developmentSkills and Knowledge Have strong sense of ownership with demonstrated ability to work independentlyBe focused, passionate, and strive to find simple solutions to complex problemsExcellent understanding of OOP design concepts and software development processes and methodsAbility to learn new, emerging technologiesYou have a solid general understanding of application components and search engines – what happens on the front end, what happens on the back end.You’re a professional. That means you follow through on commitments, meet deadlines, don’t cut corners, consider other people’s ideas, play nice with the team, learn from your mistakes, document things and communicate honestly and proactively if you anticipate an issue doing any of the aboveAbility to effectively work on multiple projects simultaneously and effectively contend with competing prioritiesPossess strong troubleshooting, code optimization and refactoring skillsTechnical Expertise:Strong in JAVA programming and JAVA based technologies – JAVA 8+ features, J2EE Framework, Spring FrameworkExperience working in heavily multithreaded applicationExperience or knowledge of Search Engines like Solr, Lucene and Elastic SearchExperience in microservices architecture and RESTful API developmentKnowledge of SQL and NoSQL databases (preferably MongoDB, MSSQL and/or Postgres),Knowledge of queuing and messaging technologies like RabbitMQ, SNS and SQSProficient experience working with Maven, Jenkins, Bamboo, Octopus or any CI/CD tool and deep understanding of continuous integration/continuous delivery. Willing and able to work with DevOps team and contribute to CI/CDKnowledge of AWS services like EC2, S3, Lambda, API Gateway, Aurora PostgreSQL, DynamoDB, Elasticsearch is a strong plus point\n\n\n\n\n\n\n\n\n\n\n\nJob Description\n \nResponsibilities Design, implement and maintain JAVA applicationTake part in software and architectural development activitiesBe involved in all phases of the agile software development lifecycleEngage in technical grooming discussions where you should be able to learn as well as contributeWrite well designed, testable, efficient codeProactively seek out and minimize pain points within the infrastructure and code baseKeep up to date with the latest technologies and introduce them as neededCreate next-gen solutions for unique and challenging use casesEnsure designs follow specificationsPrepare and produce releases of software componentsRecommend changes to improve established java application processes\n\n\n\n\n\n\n\n\nApplying Procedure\n\nPlease apply through the below link : https://careers.smartrecruiters.com/Verisk?search=nepal or https://jobs.smartrecruiters.com/Verisk/743999721765581-software-engineer-java-developerAdditional Information:Verisk Analytics is an equal opportunity employer.All members of the Verisk Analytics family of companies are equal opportunity employers. We consider all qualified applicants for employment without regard to race, religion, color, national origin, citizenship, sex, gender identity and/or expression, sexual orientation, veteran's status, age or disability.http://www.verisk.com/careers.htmlUnsolicited resumes sent to Verisk, including unsolicited resumes sent to a Verisk business mailing address, fax machine or email address, or directly to Verisk employees, will be considered Verisk property. Verisk will NOT pay a fee for any placement resulting from the receipt of an unsolicited resume. Consumer Privacy Notice",
        "Page_URL": "https://merojob.com/java-developer-119/"
    },
    {
        "name": "Backend Developer (Python)",
        "company": "Ashutosh Brokerage and Securities Pvt. Ltd.",
        "logo": "https://merojob.com/media/uploads/job_logo/82483317-e1db-440d-9f62-aacee5019f01.jpg",
        "level": "Senior Level",
        "vacancy": "2",
        "time": "Full Time",
        "address": "Kathmandu, Nepal",
        "salary": "Negotiable",
        "deadline": "Oct. 27, 2020 23:55\n(1 week, 4 days from now)",
        "education": "Master",
        "experience": "More than or equals to 5 years",
        "skills": "Backend Development\nJavascript\nPython\nPython Frameworks\nSoftware Engineering",
        "skills2": "Backend Development\nJavascript\nPython\nPython Frameworks\nSoftware Engineering",
        "desc5": "Solid experience as Python DeveloperExperience with Python frameworks (e.g. Django, Flask, Bottle)Familiarity with REST APIUnderstanding of databases and SQLKnowledge of JavaScript and the AngularJS framework is a plusAttention to detailLeadership skillsBSc in Computer Science, Engineering or relevant fieldAbility to work effectively with large code base using version control tools Excellent verbal and written English communication skillsAbility to work effectively with large code base using version control tools ",
        "desc4": "",
        "desc": "",
        "desc1": "We are looking for a Senior Python Developer to build functional and efficient server-side applications.Responsibilities include participating in all phases of the software development lifecycle and coaching junior developers. If you’re a seasoned developer with a love for back-end technologies, we’d like to meet you. This position requires a minimum of 2-3 years of experience in the software industry. The ideal candidate will have extensive development experience working on enterprise grade SAAS applications. You will have the opportunity to work in a fast-paced environment. You should be ready and excited to learn and implement new technologies.Responsibilities:Help design and implement functional requirementsBuild efficient back-end features in PythonIntegrate front-end components into applicationsManage testing and bug fixesPrepare technical documentationCollaborate with UX/UI designers to implement design into the codeCoach junior team membersImplement software enhancements and suggest improvementsRemuneration and benefits will be based on experience and will not be a constraint for deserving candidates.",
        "desc2": "RequirementsSolid experience as Python DeveloperExperience with Python frameworks (e.g. Django, Flask, Bottle)Familiarity with REST APIUnderstanding of databases and SQLKnowledge of JavaScript and the AngularJS framework is a plusAttention to detailLeadership skillsBSc in Computer Science, Engineering or relevant fieldAbility to work effectively with large code base using version control tools Excellent verbal and written English communication skillsAbility to work effectively with large code base using version control tools ",
        "desc3": "Basic Job Information\n\n\n\n Job Category\n:\n\nIT & Telecommunication\n\n\n\nJob Level\n:\n\nSenior Level\n\n\n\nNo. of Vacancy/s\n:\n[ 2 ]\n\n\nEmployment Type\n:\n\nFull Time\n\n\n\nJob Location\n:\n\nKathmandu, Nepal\n\n\n\nOffered Salary\n:\n\nNegotiable\n\n\n\nApply Before(Deadline)\n:\nOct. 27, 2020 23:55\n(1 week, 4 days from now)\n\n\n\n\n\n\n\n\n\n\n\nJob Specification\n\n\n\nEducation Level\n:\n\nMaster\n\n\n\nExperience Required\n:\n\nMore than or equals to 5 years\n\n\n\nProfessional Skill Required\n:\n\n\nBackend Development\nJavascript\nPython\nPython Frameworks\nSoftware Engineering\n\n\n\n\n\n\nOther Specification\n\n\nRequirementsSolid experience as Python DeveloperExperience with Python frameworks (e.g. Django, Flask, Bottle)Familiarity with REST APIUnderstanding of databases and SQLKnowledge of JavaScript and the AngularJS framework is a plusAttention to detailLeadership skillsBSc in Computer Science, Engineering or relevant fieldAbility to work effectively with large code base using version control tools Excellent verbal and written English communication skillsAbility to work effectively with large code base using version control tools \n\n\n\n\n\n\n\n\n\n\n\nJob Description\n\nWe are looking for a Senior Python Developer to build functional and efficient server-side applications.Responsibilities include participating in all phases of the software development lifecycle and coaching junior developers. If you’re a seasoned developer with a love for back-end technologies, we’d like to meet you. This position requires a minimum of 2-3 years of experience in the software industry. The ideal candidate will have extensive development experience working on enterprise grade SAAS applications. You will have the opportunity to work in a fast-paced environment. You should be ready and excited to learn and implement new technologies.Responsibilities:Help design and implement functional requirementsBuild efficient back-end features in PythonIntegrate front-end components into applicationsManage testing and bug fixesPrepare technical documentationCollaborate with UX/UI designers to implement design into the codeCoach junior team membersImplement software enhancements and suggest improvementsRemuneration and benefits will be based on experience and will not be a constraint for deserving candidates.\n\n\n\n\n\n\n\n\nAPPLY NOW",
        "Page_URL": "https://merojob.com/backend-developer-python-4/"
    },
    {
        "name": "React Native Developer",
        "company": "Agile Solutions",
        "logo": "https://merojob.com/media/uploads/job_logo/209da296-3455-4f53-95d9-580bfab08eb9.jpg",
        "level": "Mid Level",
        "vacancy": "1",
        "time": "Full Time",
        "address": "Gairidhara, Kathmandu",
        "salary": "Negotiable",
        "deadline": "Nov. 12, 2020 23:55\n(3 weeks, 6 days from now)",
        "education": "Bachelor",
        "experience": "More than or equals to 2 years",
        "skills": "Javascript\nNative\nMobile Application Development\nReact",
        "skills2": "Javascript\nNative\nMobile Application Development\nReact",
        "desc5": "At least 2 year experience of building mobile applications using React Native;Experience building and consuming APIs to interact with other applications using REST or GraphQL, Microsoft Graph API, OData etc; Proficiency with HTML, CSS, JavaScript;Experience both Android and IOS development;Experience in working in an agile environment to quickly iterate and deliver features to users.",
        "desc4": "Medical, accidental, OPD and COVID-19 insurance schemeFree Lunch at officeCompetitive salary packages to the deserving candidatesAttractive incentives and bonusesA friendly, competitive and creative working environment with higher level of exposure to the top corporate housesPaid leaves in compliance with the labor laws to maintain the healthy work life balance of employeesLoan program facility in case of financial emergency with zero interestConveyance allowance scheme that covers day to day transportation costTechnology allowance program for the employees who prefer using their own laptops",
        "desc": "",
        "desc1": "Design and implement a mobile application for iOS and Android using React Native;Create a scalable, testable, documented application so that we can grow the product over time;Keep up with technology changes in our space and leverage them when appropriate;Leverage native APIs for deep integrations with both platforms;Build reusable components and front-end libraries for future use;Participate in product design, offer new ideas and understand that not every idea will be adopted;Diagnose and fix bugs and performance bottlenecks for performance that feels native;Work independently to delivery software on time;Document all aspect of your work.",
        "desc2": "At least 2 year experience of building mobile applications using React Native;Experience building and consuming APIs to interact with other applications using REST or GraphQL, Microsoft Graph API, OData etc; Proficiency with HTML, CSS, JavaScript;Experience both Android and IOS development;Experience in working in an agile environment to quickly iterate and deliver features to users.Company Benefits:Medical, accidental, OPD and COVID-19 insurance schemeFree Lunch at officeCompetitive salary packages to the deserving candidatesAttractive incentives and bonusesA friendly, competitive and creative working environment with higher level of exposure to the top corporate housesPaid leaves in compliance with the labor laws to maintain the healthy work life balance of employeesLoan program facility in case of financial emergency with zero interestConveyance allowance scheme that covers day to day transportation costTechnology allowance program for the employees who prefer using their own laptops",
        "desc3": "Basic Job Information\n\n\n\nJob Category\n:\n\nIT & Telecommunication\n > Mobile Apps\n\n\n\nJob Level\n:\n\nMid Level\n\n\n\nNo. of Vacancy/s\n:\n[ 1 ]\n\n\nEmployment Type\n:\n\nFull Time\n\n\n\nJob Location\n:\n\nGairidhara, Kathmandu\n\n\n\nOffered Salary\n:\n\nNegotiable\n\n\n\nApply Before(Deadline)\n:\nNov. 12, 2020 23:55\n(3 weeks, 6 days from now)\n\n\n\n\n\n\n\n\n\n\n\nJob Specification\n\n\n\nEducation Level\n:\n\nBachelor\n\n\n\nExperience Required\n:\n\nMore than or equals to 2 years\n\n\n\nProfessional Skill Required\n:\n\n\nJavascript\nNative\nMobile Application Development\nReact\n\n\n\n\n\n\nOther Specification\n\n\nAt least 2 year experience of building mobile applications using React Native;Experience building and consuming APIs to interact with other applications using REST or GraphQL, Microsoft Graph API, OData etc; Proficiency with HTML, CSS, JavaScript;Experience both Android and IOS development;Experience in working in an agile environment to quickly iterate and deliver features to users.Company Benefits:Medical, accidental, OPD and COVID-19 insurance schemeFree Lunch at officeCompetitive salary packages to the deserving candidatesAttractive incentives and bonusesA friendly, competitive and creative working environment with higher level of exposure to the top corporate housesPaid leaves in compliance with the labor laws to maintain the healthy work life balance of employeesLoan program facility in case of financial emergency with zero interestConveyance allowance scheme that covers day to day transportation costTechnology allowance program for the employees who prefer using their own laptops\n\n\n\n\n\n\n\n\n\n\n\nJob Description\n\nDesign and implement a mobile application for iOS and Android using React Native;Create a scalable, testable, documented application so that we can grow the product over time;Keep up with technology changes in our space and leverage them when appropriate;Leverage native APIs for deep integrations with both platforms;Build reusable components and front-end libraries for future use;Participate in product design, offer new ideas and understand that not every idea will be adopted;Diagnose and fix bugs and performance bottlenecks for performance that feels native;Work independently to delivery software on time;Document all aspect of your work.\n\n\n\n\n\n\n\n\nAPPLY NOW",
        "Page_URL": "https://merojob.com/react-native-developer-8/"
    },
    {
        "name": "Sr. FullStack Developer",
        "company": "Tekkon Technologies",
        "logo": "https://merojob.com/media/uploads/job_logo/2c074c84-e85b-43de-81fa-11ac8cca6a38.jpg",
        "level": "Mid Level",
        "vacancy": "1",
        "time": "Full Time",
        "address": "Kathmandu",
        "salary": "Negotiable",
        "deadline": "Oct. 16, 2020 23:55\n (9 hours from now)",
        "education": "Bachelor",
        "experience": "More than or equals to 2 years",
        "skills": "Reactjs\nApollo Graphql\nPostgressql\nNode.Js\nTypescript",
        "skills2": "Reactjs\nApollo Graphql\nPostgressql\nNode.Js\nTypescript",
        "desc5": "Have a strong understanding of Javascript and TypeScript.Good understanding of Node.js and the most common packages in the ecosystem (i.e. Express).Familiarity with GraphQL. Confident with asynchronous programming concepts and using them programmatically from Javascript.Working knowledge of node.js package management and the tools ecosystem (like npm, grunt).Ability to model and apply authorization and permission control between users, systems, and services.Knowledge of incorporating different data sources and databases and to deliver the optimal output to different client platforms (mobile vs web)Familiarity with creating scalable Node.js applications with microservices. Proficiency with relational databases and pragmatically modeling business processes through schema.Understanding of automated unit tests and testing platforms and how to implement and integrate them.Knowledge around Docker is a plus. Thorough knowledge of code versioning tools such as Git.",
        "desc4": "",
        "desc": "",
        "desc1": "Creating professional dynamic web app forms & integrating them with a SQL DB.Handling large data sets, API calls, etc. Markdown editors. Image and file upload/download. Nginx and docker experience is highly desirable.Permissions systems, sign in/sign out and user account types with different components visible based on user type.Admin pages, changing users’ passwords, emails, etc. Setting up license trials for the app.UI design, charts, and dashboards.Bulk emailing of users based on actions made by users. Instant messaging.Company Benefits:A friendly, competitive, and creative working environment with foreign managersCompetitive salary (100k to 120k) based on experience.5 working days in a week(9 am – 5:30 pm)Timely salary review and performance bonus facilitiesAccess to the paid learning materials (udemy)Working with the latest technologiesLunch provided in the office (Currently Work From Home)Paid leave, sick leaveRefreshment, Recreational, team building activities.Applying Procedure:Interested candidates fulfilling the criteria mentioned above are highly encouraged to send a cover letter with their updated resume at jobs@tekkon.com.npOR,",
        "desc2": "Technical QualificationsHave a strong understanding of Javascript and TypeScript.Good understanding of Node.js and the most common packages in the ecosystem (i.e. Express).Familiarity with GraphQL. Confident with asynchronous programming concepts and using them programmatically from Javascript.Working knowledge of node.js package management and the tools ecosystem (like npm, grunt).Ability to model and apply authorization and permission control between users, systems, and services.Knowledge of incorporating different data sources and databases and to deliver the optimal output to different client platforms (mobile vs web)Familiarity with creating scalable Node.js applications with microservices. Proficiency with relational databases and pragmatically modeling business processes through schema.Understanding of automated unit tests and testing platforms and how to implement and integrate them.Knowledge around Docker is a plus. Thorough knowledge of code versioning tools such as Git.",
        "desc3": "Basic Job Information\n\n\n\nJob Category\n:\n\nIT & Telecommunication\n\n\n\nJob Level\n:\n\nMid Level\n\n\n\nNo. of Vacancy/s\n:\n[ 1 ]\n\n\nEmployment Type\n:\n\nFull Time\n\n\n\nJob Location\n:\n\nKathmandu\n\n\n\nOffered Salary\n:\n\nNegotiable\n\n\n\nApply Before(Deadline)\n:\nOct. 16, 2020 23:55\n (9 hours from now)\n\n\n\n\n\n\n\n\n\n\n\nJob Specification\n\n\n\nEducation Level\n:\n\nBachelor\n\n\n\nExperience Required\n:\n\nMore than or equals to 2 years\n\n\n\nProfessional Skill Required\n:\n\n\nReactjs\nApollo Graphql\nPostgressql\nNode.Js\nTypescript\n\n\n\n\n\n\nOther Specification\n\n\nTechnical QualificationsHave a strong understanding of Javascript and TypeScript.Good understanding of Node.js and the most common packages in the ecosystem (i.e. Express).Familiarity with GraphQL. Confident with asynchronous programming concepts and using them programmatically from Javascript.Working knowledge of node.js package management and the tools ecosystem (like npm, grunt).Ability to model and apply authorization and permission control between users, systems, and services.Knowledge of incorporating different data sources and databases and to deliver the optimal output to different client platforms (mobile vs web)Familiarity with creating scalable Node.js applications with microservices. Proficiency with relational databases and pragmatically modeling business processes through schema.Understanding of automated unit tests and testing platforms and how to implement and integrate them.Knowledge around Docker is a plus. Thorough knowledge of code versioning tools such as Git.\n\n\n\n\n\n\n\n\n\n\n\nJob Description\n\nCreating professional dynamic web app forms & integrating them with a SQL DB.Handling large data sets, API calls, etc. Markdown editors. Image and file upload/download. Nginx and docker experience is highly desirable.Permissions systems, sign in/sign out and user account types with different components visible based on user type.Admin pages, changing users’ passwords, emails, etc. Setting up license trials for the app.UI design, charts, and dashboards.Bulk emailing of users based on actions made by users. Instant messaging.Company Benefits:A friendly, competitive, and creative working environment with foreign managersCompetitive salary (100k to 120k) based on experience.5 working days in a week(9 am – 5:30 pm)Timely salary review and performance bonus facilitiesAccess to the paid learning materials (udemy)Working with the latest technologiesLunch provided in the office (Currently Work From Home)Paid leave, sick leaveRefreshment, Recreational, team building activities.Applying Procedure:Interested candidates fulfilling the criteria mentioned above are highly encouraged to send a cover letter with their updated resume at jobs@tekkon.com.npOR,\n\n\n\n\n\n\n\n\nAPPLY NOW",
        "Page_URL": "https://merojob.com/backend-developer-nodejs-typescript/"
    },
    {
        "name": "Android Developer",
        "company": "Foreveryng",
        "logo": "https://merojob.com/media/uploads/job_logo/5476251b-3c66-4d3c-8157-79b42bd66ae4.jpg",
        "level": "Senior Level",
        "vacancy": "1",
        "time": "Full Time",
        "address": "Sanepa, Lalitpur",
        "salary": "Negotiable",
        "deadline": "Nov. 02, 2020 23:55\n(2 weeks, 3 days from now)",
        "education": "Bachelor",
        "experience": "More than or equals to 2 years",
        "skills": "Html5\nSql/Sqlite\nBug Fixing",
        "skills2": "Html5\nSql/Sqlite\nBug Fixing",
        "desc5": "",
        "desc4": "",
        "desc": "",
        "desc1": "We are looking for an Android developer with 2 Years or more of Experience & responsible for the development and maintenance of applications aimed at a vast number of diverse Android devices. Your primary focus will be the development of Android applications and their integration with back-end services. You will be working along-side other engineers and developers working on different layers of the infrastructure. Therefore, a commitment to collaborative problem solving, sophisticated design, and creating quality products is essential.Skill RequiredKnowledge of Java Kotlin and Android StudioUnderstanding of Android Application Framework and Design Patterns Good understanding of UI placement, Wire frames and Design FlowGood understanding of REST Api, SQL/SQLite , HTML5 & ScriptingShould have Worked on bug fixing and improving application performance.",
        "desc2": "",
        "desc3": "Basic Job Information\n\n\n\n Job Category\n:\n\nIT & Telecommunication\n > Internet/E-commerce, Mobile Apps\n\n\n\nJob Level\n:\n\nSenior Level\n\n\n\nNo. of Vacancy/s\n:\n[ 1 ]\n\n\nEmployment Type\n:\n\nFull Time\n\n\n\nJob Location\n:\n\nSanepa, Lalitpur\n\n\n\nOffered Salary\n:\n\nNegotiable\n\n\n\nApply Before(Deadline)\n:\nNov. 02, 2020 23:55\n(2 weeks, 3 days from now)\n\n\n\n\n\n\n\n\n\n\n\nJob Specification\n\n\n\nEducation Level\n:\n\nBachelor\n\n\n\n\nExperience Required\n:\n\nMore than or equals to 2 years\n\n\n\nProfessional Skill Required\n:\n\n\nHtml5\nSql/Sqlite\nBug Fixing\n\n\n\n\n\n\n\n\n\n\n\n\nJob Description\n\nWe are looking for an Android developer with 2 Years or more of Experience & responsible for the development and maintenance of applications aimed at a vast number of diverse Android devices. Your primary focus will be the development of Android applications and their integration with back-end services. You will be working along-side other engineers and developers working on different layers of the infrastructure. Therefore, a commitment to collaborative problem solving, sophisticated design, and creating quality products is essential.Skill RequiredKnowledge of Java Kotlin and Android StudioUnderstanding of Android Application Framework and Design Patterns Good understanding of UI placement, Wire frames and Design FlowGood understanding of REST Api, SQL/SQLite , HTML5 & ScriptingShould have Worked on bug fixing and improving application performance.\n\n\n\n\n\n\n\n\nAPPLY NOW",
        "Page_URL": "https://merojob.com/android-developer-163/"
    },
    {
        "name": "Front End Developer",
        "company": "Sharelook PTE LTD",
        "logo": "https://merojob.com/media/uploads/job_logo/72624905-84ed-45b9-8e04-a9e8adebf07b.jpg",
        "level": "Mid Level",
        "vacancy": "1",
        "time": "Full Time",
        "address": "Kathmandu, Nepal",
        "salary": "NRs. 35,000.00 - 70,000.00 Monthly",
        "deadline": "Oct. 16, 2020 23:55\n(9 hours from now)",
        "education": "Bachelor",
        "experience": "More than or equals to 3 years",
        "skills": "React Native\nJavascript\nCss\nHtml",
        "skills2": "React Native\nJavascript\nCss\nHtml",
        "desc5": "3+ years of experience in software development with a proven track record of technical developmentStrong working experience with ReactJS and its core principlesExperience working with back-end RESTful APIsExperience with HTML, CSS and JavaScript librariesKnowledge in AWS services, Cognito AWS amplify is a plusExperience with React Native is a big advantageGood communication in English",
        "desc4": "",
        "desc": "",
        "desc1": "We are looking for programmers with a keen eye for design for the position of Front End Developer. Front end Developers are responsible for ensuring the alignment of web design and user experience requirements, optimizing web pages for maximum efficiency and maintaining brand consistency across all web pages, among other duties.Front End Developers are required to work in teams alongside Back end Developers, Graphic Designers and User Experience Designers to ensure all elements of web creation are consistent. This requires excellent communication and interpersonal skills.Responsibilities:Designing and developing user-facing web features using ReactJSLearning and working with new technology, and creating effective use of this in the businessBuilding reusable components and front-end libraries for future use",
        "desc2": "3+ years of experience in software development with a proven track record of technical developmentStrong working experience with ReactJS and its core principlesExperience working with back-end RESTful APIsExperience with HTML, CSS and JavaScript librariesKnowledge in AWS services, Cognito AWS amplify is a plusExperience with React Native is a big advantageGood communication in English",
        "desc3": "Basic Job Information\n\n\n\nJob Category\n:\n\nIT & Telecommunication\n\n\n\nJob Level\n:\n\nMid Level\n\n\n\nNo. of Vacancy/s\n:\n[ 1 ]\n\n\nEmployment Type\n:\n\nFull Time\n\n\n\nJob Location\n:\n\nKathmandu, Nepal\n\n\n\nOffered Salary\n:\n\nNRs. 35,000.00 - 70,000.00 Monthly\n\n\n\nApply Before(Deadline)\n:\nOct. 16, 2020 23:55\n(9 hours from now)\n\n\n\n\n\n\n\n\n\n\n\nJob Specification\n\n\n\nEducation Level\n:\n\nBachelor\n\n\n\nExperience Required\n:\n\nMore than or equals to 3 years\n\n\n\nProfessional Skill Required\n:\n\n\nReact Native\nJavascript\nCss\nHtml\n\n\n\n\n\n\nOther Specification\n\n\n3+ years of experience in software development with a proven track record of technical developmentStrong working experience with ReactJS and its core principlesExperience working with back-end RESTful APIsExperience with HTML, CSS and JavaScript librariesKnowledge in AWS services, Cognito AWS amplify is a plusExperience with React Native is a big advantageGood communication in English\n\n\n\n\n\n\n\n\n\n\n\nJob Description\n\nWe are looking for programmers with a keen eye for design for the position of Front End Developer. Front end Developers are responsible for ensuring the alignment of web design and user experience requirements, optimizing web pages for maximum efficiency and maintaining brand consistency across all web pages, among other duties.Front End Developers are required to work in teams alongside Back end Developers, Graphic Designers and User Experience Designers to ensure all elements of web creation are consistent. This requires excellent communication and interpersonal skills.Responsibilities:Designing and developing user-facing web features using ReactJSLearning and working with new technology, and creating effective use of this in the businessBuilding reusable components and front-end libraries for future use\n\n\n\n\n\n\n\n\nAPPLY NOW",
        "Page_URL": "https://merojob.com/front-end-developer-97/"
    },
    {
        "name": "HTML / CSS / JavaScript Developer",
        "company": "Himalayan Techies",
        "logo": "https://merojob.com/media/uploads/job_logo/ddc9a743-f5f7-4d15-89bb-362720af88b8.jpg",
        "level": "Mid Level",
        "vacancy": "10",
        "time": "Full Time",
        "address": "Babar Mahal, Kathmandu",
        "salary": "NRs. 20,000.00 Monthly",
        "deadline": "Oct. 31, 2020 18:00\n (2 weeks, 1 day from now)",
        "education": "Bachelor",
        "experience": "More than 2 years",
        "skills": "Html5\nJavascript\nCss\nHtml\nJquery",
        "skills2": "Html5\nJavascript\nCss\nHtml\nJquery",
        "desc5": "",
        "desc4": "",
        "desc": "",
        "desc1": "Good understanding of Javascript Beginner level familiarity with jQuery Good knowledge of HTML and CSSIn-Depth knowledge of CSS so that they could design-code keeping the responsiveness of the activities in mindMust have done at least 2 website or web app projects just to make sure about the fundamentals of web designing and web programmingKnowledge of AJAX, animation libraries, and UX would be a plusBonus skills adobe aftereffectsApplying Procedure:Interested candidates are requested to send their resume at careers@himalayantechies.com OR,",
        "desc2": "",
        "desc3": "Basic Job Information\n\n\n\nJob Category\n:\n\nIT & Telecommunication\n\n\n\nJob Level\n:\n\nMid Level\n\n\n\nNo. of Vacancy/s\n:\n[ 10 ]\n\n\nEmployment Type\n:\n\nFull Time\n\n\n\nJob Location\n:\n\nBabar Mahal, Kathmandu\n\n\n\nOffered Salary\n:\n\nNRs. 20,000.00 Monthly\n\n\n\nApply Before(Deadline)\n:\nOct. 31, 2020 18:00\n (2 weeks, 1 day from now)\n\n\n\n\n\n\n\n\n\n\n\nJob Specification\n\n\n\nEducation Level\n:\n\nBachelor\n\n\n\nExperience Required\n:\n\nMore than 2 years\n\n\n\nProfessional Skill Required\n:\n\n\nHtml5\nJavascript\nCss\nHtml\nJquery\n\n\n\n\n\n\n\n\n\n\n\n\nJob Description\n\nGood understanding of Javascript Beginner level familiarity with jQuery Good knowledge of HTML and CSSIn-Depth knowledge of CSS so that they could design-code keeping the responsiveness of the activities in mindMust have done at least 2 website or web app projects just to make sure about the fundamentals of web designing and web programmingKnowledge of AJAX, animation libraries, and UX would be a plusBonus skills adobe aftereffectsApplying Procedure:Interested candidates are requested to send their resume at careers@himalayantechies.com OR,\n\n\n\n\n\n\n\n\nAPPLY NOW",
        "Page_URL": "https://merojob.com/htmlcssjavascript-developer/"
    },
    {
        "name": "Front- End Developer",
        "company": "Foreveryng",
        "logo": "https://merojob.com/media/uploads/job_logo/2e799859-f1c8-4f1b-a58d-323275991575.jpg",
        "level": "Senior Level",
        "vacancy": "2",
        "time": "Full Time",
        "address": "Sanepa Height, Lalitpur",
        "salary": "Negotiable",
        "deadline": "Nov. 02, 2020 23:30\n(2 weeks, 3 days from now)",
        "education": "More than 2 years",
        "experience": "Javascript\nSass\nReact\nVue\nUi/Ux",
        "skills": "",
        "skills2": "",
        "desc5": "",
        "desc4": "",
        "desc": "",
        "desc1": "Design UI/UX for Website and Mobile Application using tools like Figma or similar toolsConvert UI/UX designs into responsive website using front-end technologies, languages and frameworksImplement API to develop and maintain dynamic website",
        "desc2": "",
        "desc3": "Basic Job Information\n\n \n\nJob Category\n:\n\nIT & Telecommunication\n > Graphic Designer, Internet/E-commerce\n\n\n\nJob Level\n:\n\nSenior Level\n\n\n\nNo. of Vacancy/s\n:\n[ 2 ]\n\n\nEmployment Type\n:\n\nFull Time\n\n\n\nJob Location\n:\n\nSanepa Height, Lalitpur\n\n\n\nOffered Salary\n:\n\nNegotiable\n\n\n\nApply Before(Deadline)\n:\nNov. 02, 2020 23:30\n(2 weeks, 3 days from now)\n\n\n\n\n\n\n\n\n\n\n\nJob Specification\n\n\n\nExperience Required\n:\n\nMore than 2 years\n\n\n\nProfessional Skill Required\n:\n\n\nJavascript\nSass\nReact\nVue\nUi/Ux\n\n\n\n\n\n\n\n\n\n\n\n\nJob Description\n\nDesign UI/UX for Website and Mobile Application using tools like Figma or similar toolsConvert UI/UX designs into responsive website using front-end technologies, languages and frameworksImplement API to develop and maintain dynamic website\n\n\n\n\n\n\n\n\nAPPLY NOW",
        "Page_URL": "https://merojob.com/uiux-web-and-mobile-application-designer/"
    },
    {
        "name": "Word Press Developer",
        "company": "Tej Solution",
        "logo": "https://merojob.com/media/uploads/job_logo/4f72a143-7da5-4b64-aa27-bf2ab2cc83b4.jpg",
        "level": "Mid Level",
        "vacancy": "1",
        "time": "Full Time",
        "address": "Kathmandu",
        "salary": "Negotiable",
        "deadline": "Nov. 02, 2020 23:55\n(2 weeks, 3 days from now)",
        "education": "Bachelor",
        "experience": "More than or equals to 5 years",
        "skills": "Css3\nHtml5\nJquery\n\nJavascript",
        "skills2": "Css3\nHtml5\nJquery\n\nJavascript",
        "desc5": "Must have a Bachelor's degree in Computer Science or related field5+ years of experience as a web developerExperience creating and integrating custom WordPress plugins, themes, working with WordPress hooks and filtersExperience creating websites for a mobile-first strategyStrong knowledge of PHP web frameworksStrong knowledge of common PHP or web server exploits and their solutionsExperience with limitations of PHP as a platform and its workaroundsKnowledge of HTML5, CSS3, Sass, JavaScript, jQuery, and responsive frameworks (Foundation, Bootstrap)Experience with online usability, accessibility, and web analyticsExperience with development languages (Java or Python)Experience integrating or working with ad serving technologies (prebid, DFPP)Experience with software versioning and revision control systems (Subversion or Git)",
        "desc4": "",
        "desc": "",
        "desc1": "We are seeking an experienced, motivated and resourceful PHP / WordPress developer with a blend of back-end and front-end skills to serve as lead developer. In this highly collaborative role, you will work with front end developers, designers and content developers to build efficient, beautiful and responsive media/news focused websites.Responsibilities:Code new WordPress themes, page templates, and plugins from scratch and modify existing themes and pluginsCandidates with experience in Graphic Design, Java Script, HTML & CSS will be preferableBuild efficient, testable, and reusable PHP modules including dynamic content and personalization featuresIntegrate wide range of WordPress plugins, API calls and third party apps and forms, such as EloquaManage back-end services and interchange of data between server and user, including server-side logic and database integrationEnsure high performance and responsiveness to requests from front-endProvide front-end development of digital marketing communications, including full websites and micro-sites, landing pages, emails, and other initiativesDevelop, test and troubleshoot across multiple browsers, platforms and devices, including tablets and smartphones, to support a consistent and positive customer experienceProvide guidance on SEO best practices for site developmentResearch and recommend new technologies and tools for effective integration across various platforms",
        "desc2": "Skills:Must have a Bachelor's degree in Computer Science or related field5+ years of experience as a web developerExperience creating and integrating custom WordPress plugins, themes, working with WordPress hooks and filtersExperience creating websites for a mobile-first strategyStrong knowledge of PHP web frameworksStrong knowledge of common PHP or web server exploits and their solutionsExperience with limitations of PHP as a platform and its workaroundsKnowledge of HTML5, CSS3, Sass, JavaScript, jQuery, and responsive frameworks (Foundation, Bootstrap)Experience with online usability, accessibility, and web analyticsExperience with development languages (Java or Python)Experience integrating or working with ad serving technologies (prebid, DFPP)Experience with software versioning and revision control systems (Subversion or Git)",
        "desc3": "Basic Job Information\n\n\n\nJob Category\n:\n\nIT & Telecommunication\n\n\n\nJob Level\n:\n\nMid Level\n\n\n\nNo. of Vacancy/s\n:\n[ 1 ]\n\n\nEmployment Type\n:\n\nFull Time\n\n\n\n\nJob Location\n:\n\nKathmandu\n\n\n\nOffered Salary\n:\n\nNegotiable\n\n\n\nApply Before(Deadline)\n:\nNov. 02, 2020 23:55\n(2 weeks, 3 days from now)\n\n\n\n\n\n\n\n\n\n\n\nJob Specification\n\n\n\nEducation Level\n:\n\nBachelor\n\n\n\nExperience Required\n:\n\nMore than or equals to 5 years\n\n\n\nProfessional Skill Required\n:\n\n\nCss3\nHtml5\nJquery\n\nJavascript\n\n\n\n\n\n\nOther Specification\n\n\nSkills:Must have a Bachelor's degree in Computer Science or related field5+ years of experience as a web developerExperience creating and integrating custom WordPress plugins, themes, working with WordPress hooks and filtersExperience creating websites for a mobile-first strategyStrong knowledge of PHP web frameworksStrong knowledge of common PHP or web server exploits and their solutionsExperience with limitations of PHP as a platform and its workaroundsKnowledge of HTML5, CSS3, Sass, JavaScript, jQuery, and responsive frameworks (Foundation, Bootstrap)Experience with online usability, accessibility, and web analyticsExperience with development languages (Java or Python)Experience integrating or working with ad serving technologies (prebid, DFPP)Experience with software versioning and revision control systems (Subversion or Git)\n\n\n\n\n\n\n\n\n\n\n\nJob Description\n\nWe are seeking an experienced, motivated and resourceful PHP / WordPress developer with a blend of back-end and front-end skills to serve as lead developer. In this highly collaborative role, you will work with front end developers, designers and content developers to build efficient, beautiful and responsive media/news focused websites.Responsibilities:Code new WordPress themes, page templates, and plugins from scratch and modify existing themes and pluginsCandidates with experience in Graphic Design, Java Script, HTML & CSS will be preferableBuild efficient, testable, and reusable PHP modules including dynamic content and personalization featuresIntegrate wide range of WordPress plugins, API calls and third party apps and forms, such as EloquaManage back-end services and interchange of data between server and user, including server-side logic and database integrationEnsure high performance and responsiveness to requests from front-endProvide front-end development of digital marketing communications, including full websites and micro-sites, landing pages, emails, and other initiativesDevelop, test and troubleshoot across multiple browsers, platforms and devices, including tablets and smartphones, to support a consistent and positive customer experienceProvide guidance on SEO best practices for site developmentResearch and recommend new technologies and tools for effective integration across various platforms\n \n\n\n\n\n\n\n\nAPPLY NOW",
        "Page_URL": "https://merojob.com/word-press-developer-7/"
    },
    {
        "name": "PHP Developer",
        "company": "Genese Solution",
        "logo": "https://merojob.com/media/uploads/job_logo/68d923f7-84f8-4868-b396-e326576c5a68.jpg",
        "level": "Mid Level",
        "vacancy": "1",
        "time": "Full Time",
        "address": "Kathmandu",
        "salary": "Negotiable",
        "deadline": "Oct. 17, 2020 23:55\n(1 day, 9 hours from now)",
        "education": "Bachelor",
        "experience": "More than or equals to 4 years",
        "skills": "Php Framework\nLampstack",
        "skills2": "Php Framework\nLampstack",
        "desc5": "",
        "desc4": "",
        "desc": "",
        "desc1": "Reports to: Team LeadDuties and Responsibilities:Designing and building enterprise-level learning management systems based on PHP frameworksPerform design, configure, customize and implement responsive and effective LMS systemsImplement multi-tenancy scalable architectureIntegrate and develop plugins when requiredPlanning and implementing API integrations with third parties when requiredAnalyze business processes, and user requirementsSupport PHP implementations and resolve any technical issuesQualifications:Bachelor’s Degree in Computer Science or related field4-5 years of experience in the LAMP stackPractical knowledge of OOP Working experience with different PHP frameworksExperience working with GITExperience working with different MVC FrameworksWorking experience of Laravel PHP Framework is a big plusNice to have:Involvement in Open Source projectsExperience of API integrationExperience with Continuous IntegrationWorking experience in Customizing functionalitiesExperience in XML data structures and Web Services (SOA)What we offer:A friendly, competitive and creative working environment5 working days in a week (09:00am-06:00 pm)Refreshment, Recreational, team building activitiesOpportunity to travel countries as part of training and developmentWork in the leadership firm in Cloud Computing in NepalWork in multidisciplinary areas in start-up ecosystemGet to know the working culture of companies like Amazon, Microsoft, Google, Alibaba being affiliates for them in NepalExposure in team management and leadershipApplying ProcedureSuitable candidates meeting the above criteria are requested to send their CV and cover letter to careers@genese.com.np . Only shortlisted candidates will be invited for the further selection process. You are requested to clearly mention the position you are applying for in the subject of the email.OR,",
        "desc2": "",
        "desc3": "Basic Job Information\n\n\n\nJob Category\n:\n\nIT & Telecommunication\n\n\n\nJob Level\n:\n\nMid Level\n\n\n\nNo. of Vacancy/s\n:\n[ 1 ]\n\n\nEmployment Type\n:\n\nFull Time\n\n\n\nJob Location\n:\n\nKathmandu\n\n\n\nOffered Salary\n:\n\nNegotiable\n\n\n\nApply Before(Deadline)\n:\nOct. 17, 2020 23:55\n(1 day, 9 hours from now)\n\n\n\n\n\n\n\n\n\n\n \nJob Specification\n\n\n\nEducation Level\n:\n\nBachelor\n\n\n\nExperience Required\n:\n\nMore than or equals to 4 years\n\n\n\nProfessional Skill Required\n:\n\n\nPhp Framework\nLampstack\n\n\n\n\n\n\n\n\n\n\n\n\nJob Description\n\nReports to: Team LeadDuties and Responsibilities:Designing and building enterprise-level learning management systems based on PHP frameworksPerform design, configure, customize and implement responsive and effective LMS systemsImplement multi-tenancy scalable architectureIntegrate and develop plugins when requiredPlanning and implementing API integrations with third parties when requiredAnalyze business processes, and user requirementsSupport PHP implementations and resolve any technical issuesQualifications:Bachelor’s Degree in Computer Science or related field4-5 years of experience in the LAMP stackPractical knowledge of OOP Working experience with different PHP frameworksExperience working with GITExperience working with different MVC FrameworksWorking experience of Laravel PHP Framework is a big plusNice to have:Involvement in Open Source projectsExperience of API integrationExperience with Continuous IntegrationWorking experience in Customizing functionalitiesExperience in XML data structures and Web Services (SOA)What we offer:A friendly, competitive and creative working environment5 working days in a week (09:00am-06:00 pm)Refreshment, Recreational, team building activitiesOpportunity to travel countries as part of training and developmentWork in the leadership firm in Cloud Computing in NepalWork in multidisciplinary areas in start-up ecosystemGet to know the working culture of companies like Amazon, Microsoft, Google, Alibaba being affiliates for them in NepalExposure in team management and leadershipApplying ProcedureSuitable candidates meeting the above criteria are requested to send their CV and cover letter to careers@genese.com.np . Only shortlisted candidates will be invited for the further selection process. You are requested to clearly mention the position you are applying for in the subject of the email.OR,\n\n\n\n\n\n\n\n\nAPPLY NOW",
        "Page_URL": "https://merojob.com/php-developer-279/"
    },
    {
        "name": "Trainee",
        "company": "EBPearls",
        "logo": "https://merojob.com/media/uploads/job_logo/ed046b12-7ba2-4ea5-8fc9-508f726dc2a0.jpg",
        "level": "Entry Level",
        "vacancy": "1",
        "time": "Traineeship ,\nFull Time",
        "address": "Lalitpur, Nepal",
        "salary": "Negotiable",
        "deadline": "Oct. 25, 2020 23:55\n(1 week, 2 days from now)",
        "education": "Bachelor",
        "experience": "Not Required",
        "skills": "Problem Solving\nTime Management\nAnalytical\nCommunication",
        "skills2": "Problem Solving\nTime Management\nAnalytical\nCommunication",
        "desc5": "University Bachelor's degree in Computer Engineering or equivalent in relevant stream Freshers are encouraged to apply",
        "desc4": "Good programming and development conceptsGood analytical and problem-solving skillsBasic understanding of software development principles and methodology",
        "desc": "Proactive and enthusiastic natureCreativity and innovativenessExcellent teamworkSelf-motivated, positive attitude and strong zeal towards learning",
        "desc1": "Are you passionate about developing state of the art web and mobile app solutions? Do you want to work with the award-winning Development team?We are looking for enthusiastic Trainees. This position is an entry-level position for the development team at EB Pearls. Trainees go through an insightful learning experience from beginning to completion of a sample project based on a real work environment under the direct supervision of our experienced Project Managers and Tech Leads.Key Roles and Responsibilities:Learn website and web application development in one or more frameworks Understand, analyze and modify existing codes and popular open sources Understand and analyze the clients' requirements Get involved in discussions pertaining to critical project issues and contribute to the\nteam effort in finding solutions to problems at hand Other duties and responsibilities as directed by Project Managers and/or mentorsPerks and Benefits:We strive to make sure that our people are comfortable, happy, and growing at EB Pearls. We offer:Insurance: We enroll our employees in the company's group insurance policy that covers both medical and accidental insurance.Competitive Salary: We strive to ensure that our people get competitive remuneration as per the industry standardsTimely performance appraisal and salary reviews: We conduct bi-yearly performance reviews to ensure that our people are always on top of their game and ensure yearly salary review on a timely basis to complement.Paid Time Off (PTO)/ Paid Holidays: PTO refers to days when you can take time away from work while still being paid your usual salary. We provide 13 business days off as festival holidays.Employee Recognition: We are a company led by performers and we never fail to acknowledge the exemplary performance of our peopleSocial Security Fund: SSF is a contribution-based social security scheme, the employeecontributes 11 % and the employer adds 20% of the basic salary per month( 31% of thebasic salary of the employee) every month.Festival Allowance: We have the provision of festival allowance and provide a Dashainbonus which is based on the amount of employees’ basic salary.Training and Development Programs: We are obsessed with constantly developing our competencies. Hence, we determine the training needs for our people from the performance review that we conduct bi- yearly.Work on next-generation technology projectsWork with leading-edge technologyFun At EBAll work and no play is not our cup of tea. At EB, we enjoy:Office Events: Chat and Chew, Residential Annual Event, Team Lunch OutEEC Club Activities: Night outs, Picnics, Lunch Outs, Futsal, Festival Events, Pool Parties, Day out eventsFood and Coffee: Office Provided lunch and stocked pantryInspiring Colleagues: Fun and friendly work environment with brilliant one of a kindApplying Procedure:Submit a cover letter along with your recent updated resume via email to\n“careers@ebpearls.com” with “Application for Flutter/ Android/iOS Trainee” as per your\ninterested platform in the subject line. OR,\nSend your application via our website:\nhttps://ebpearls.com.au/apply-now/?jobid=583547000001665013OR,",
        "desc2": "Qualifications RequiredUniversity Bachelor's degree in Computer Engineering or equivalent in relevant stream Freshers are encouraged to applySkills RequiredGood programming and development conceptsGood analytical and problem-solving skillsBasic understanding of software development principles and methodologySkills PreferredProactive and enthusiastic natureCreativity and innovativenessExcellent teamworkSelf-motivated, positive attitude and strong zeal towards learning",
        "desc3": "Basic Job Information\n\n\n\nJob Category\n:\n\nIT & Telecommunication\n\n\n\nJob Level\n:\n\nEntry Level\n\n\n\nNo. of Vacancy/s\n :\n[ 1 ]\n\n\nEmployment Type\n:\n\nTraineeship ,\nFull Time\n\n\n\nJob Location\n:\n\nLalitpur, Nepal\n\n\n\nOffered Salary\n:\n\nNegotiable\n\n\n\nApply Before(Deadline)\n:\nOct. 25, 2020 23:55\n(1 week, 2 days from now)\n\n\n\n\n\n\n\n\n\n\n\nJob Specification\n\n\n\nEducation Level\n:\n\nBachelor\n\n\n\nExperience Required\n:\n\nNot Required\n\n\n\nProfessional Skill Required\n:\n \n\nProblem Solving\nTime Management\nAnalytical\nCommunication\n\n\n\n\n\n\nOther Specification\n\n\nQualifications RequiredUniversity Bachelor's degree in Computer Engineering or equivalent in relevant stream Freshers are encouraged to applySkills RequiredGood programming and development conceptsGood analytical and problem-solving skillsBasic understanding of software development principles and methodologySkills PreferredProactive and enthusiastic natureCreativity and innovativenessExcellent teamworkSelf-motivated, positive attitude and strong zeal towards learning\n\n\n\n\n\n\n\n\n\n\n\nJob Description\n\nAre you passionate about developing state of the art web and mobile app solutions? Do you want to work with the award-winning Development team?We are looking for enthusiastic Trainees. This position is an entry-level position for the development team at EB Pearls. Trainees go through an insightful learning experience from beginning to completion of a sample project based on a real work environment under the direct supervision of our experienced Project Managers and Tech Leads.Key Roles and Responsibilities:Learn website and web application development in one or more frameworks Understand, analyze and modify existing codes and popular open sources Understand and analyze the clients' requirements Get involved in discussions pertaining to critical project issues and contribute to the\nteam effort in finding solutions to problems at hand Other duties and responsibilities as directed by Project Managers and/or mentorsPerks and Benefits:We strive to make sure that our people are comfortable, happy, and growing at EB Pearls. We offer:Insurance: We enroll our employees in the company's group insurance policy that covers both medical and accidental insurance.Competitive Salary: We strive to ensure that our people get competitive remuneration as per the industry standardsTimely performance appraisal and salary reviews: We conduct bi-yearly performance reviews to ensure that our people are always on top of their game and ensure yearly salary review on a timely basis to complement.Paid Time Off (PTO)/ Paid Holidays: PTO refers to days when you can take time away from work while still being paid your usual salary. We provide 13 business days off as festival holidays.Employee Recognition: We are a company led by performers and we never fail to acknowledge the exemplary performance of our peopleSocial Security Fund: SSF is a contribution-based social security scheme, the employeecontributes 11 % and the employer adds 20% of the basic salary per month( 31% of thebasic salary of the employee) every month.Festival Allowance: We have the provision of festival allowance and provide a Dashainbonus which is based on the amount of employees’ basic salary.Training and Development Programs: We are obsessed with constantly developing our competencies. Hence, we determine the training needs for our people from the performance review that we conduct bi- yearly.Work on next-generation technology projectsWork with leading-edge technologyFun At EBAll work and no play is not our cup of tea. At EB, we enjoy:Office Events: Chat and Chew, Residential Annual Event, Team Lunch OutEEC Club Activities: Night outs, Picnics, Lunch Outs, Futsal, Festival Events, Pool Parties, Day out eventsFood and Coffee: Office Provided lunch and stocked pantryInspiring Colleagues: Fun and friendly work environment with brilliant one of a kindApplying Procedure:Submit a cover letter along with your recent updated resume via email to\n“careers@ebpearls.com” with “Application for Flutter/ Android/iOS Trainee” as per your\ninterested platform in the subject line. OR,\nSend your application via our website:\nhttps://ebpearls.com.au/apply-now/?jobid=583547000001665013OR,\n\n\n\n\n\n\n\n\nAPPLY NOW",
        "Page_URL": "https://merojob.com/trainee-30/"
    },
    {
        "name": "Technical Writers (Work From Home)",
        "company": "ContentioLab",
        "logo": "https://merojob.com/media/uploads/job_logo/8bbb6109-6346-4008-bb70-c9253a468426.jpg",
        "level": "Entry Level",
        "vacancy": "12",
        "time": "Full Time",
        "address": "Kathmandu (Work from Home)",
        "salary": "NRs. 20,000.00 Monthly",
        "deadline": "Nov. 06, 2020 23:55\n(3 weeks from now)",
        "education": "Bachelor",
        "experience": "Not Required",
        "skills": "Critical Thinking\nMultitasking\nCommunication",
        "skills2": "Critical Thinking\nMultitasking\nCommunication",
        "desc5": "Bachelors in EngineeringIELTS above 6.5 or TOEFL above 79 will be an added advantageAbility to Work with Technical Writing ToolsExcellent written and verbal communication skillsProficiency in MS OfficeStrong attention to detailsSkilled at prioritization and multi-tasking",
        "desc4": "",
        "desc": "",
        "desc1": "Research, write, edit and  technical dataCreate, maintain and update manuals, procedures, specifications and other documentsCreate, maintain and update installation instructions, training material and other technical documentsDesign and establish style guidelines and standards for texts and illustrations to meet business needsReview, revise, modify or edit documents prepared by othersCoordinate project plans, budget and determine resourcesCompile, organize and write online help files to support end-usersWrite technical documents in compliance to the company’s established standards and guidelinesProvide writing, editing and design support to other team membersCategories:Computer Engineering/Bsc. CsIT -2; Proficiency in C#, .net, R-Programming Mechanical - 2Electrical - 3Electronics & Communication - 4Telecom- 1Office Hours:Morning Shift: 7:00 AM to 3:00 PMWorking Days: 6 Days a WeekNote:Fresher can apply. Training will be provided.Selected candidates will be writing Technical & Engineering Reports for clients based in UK & Australia.Knowledge with good software fluency will be prioritizedApplying Procedure:Applicants are requested to drop their application letter and CV/Bio-data to hr@contentiolab.com\nCV Should Contain All Of The Academic Scores From Schooling To Your Recent Qualification. Only shortlisted candidates will be scheduled for an online Interview and further selection process(es).OR,",
        "desc2": "Bachelors in EngineeringIELTS above 6.5 or TOEFL above 79 will be an added advantageAbility to Work with Technical Writing ToolsExcellent written and verbal communication skillsProficiency in MS OfficeStrong attention to detailsSkilled at prioritization and multi-tasking",
        "desc3": "Basic Job Information\n\n\n\nJob Category\n:\n\nIT & Telecommunication\n\n\n\nJob Level\n:\n\nEntry Level\n\n\n\nNo. of Vacancy/s\n:\n [ 12 ]\n\n\nEmployment Type\n:\n\nFull Time\n\n\n\nJob Location\n:\n\nKathmandu (Work from Home)\n\n\n\nOffered Salary\n:\n\nNRs. 20,000.00 Monthly\n\n\n\nApply Before(Deadline)\n:\nNov. 06, 2020 23:55\n(3 weeks from now)\n\n\n\n\n\n\n\n\n\n\n\nJob Specification\n\n\n\nEducation Level\n:\n\nBachelor\n\n\n\nExperience Required\n:\n\nNot Required\n\n\n\nProfessional Skill Required\n:\n\n\nCritical Thinking\nMultitasking\nCommunication\n\n\n\n\n\n\nOther Specification\n\n\nBachelors in EngineeringIELTS above 6.5 or TOEFL above 79 will be an added advantageAbility to Work with Technical Writing ToolsExcellent written and verbal communication skillsProficiency in MS OfficeStrong attention to detailsSkilled at prioritization and multi-tasking\n\n\n\n\n\n\n\n\n\n\n\nJob Description\n\nResearch, write, edit and  technical dataCreate, maintain and update manuals, procedures, specifications and other documentsCreate, maintain and update installation instructions, training material and other technical documentsDesign and establish style guidelines and standards for texts and illustrations to meet business needsReview, revise, modify or edit documents prepared by othersCoordinate project plans, budget and determine resourcesCompile, organize and write online help files to support end-usersWrite technical documents in compliance to the company’s established standards and guidelinesProvide writing, editing and design support to other team membersCategories:Computer Engineering/Bsc. CsIT -2; Proficiency in C#, .net, R-Programming Mechanical - 2Electrical - 3Electronics & Communication - 4Telecom- 1Office Hours:Morning Shift: 7:00 AM to 3:00 PMWorking Days: 6 Days a WeekNote:Fresher can apply. Training will be provided.Selected candidates will be writing Technical & Engineering Reports for clients based in UK & Australia.Knowledge with good software fluency will be prioritizedApplying Procedure:Applicants are requested to drop their application letter and CV/Bio-data to hr@contentiolab.com\nCV Should Contain All Of The Academic Scores From Schooling To Your Recent Qualification. Only shortlisted candidates will be scheduled for an online Interview and further selection process(es).OR,\n\n\n\n\n\n\n\n\nAPPLY NOW",
        "Page_URL": "https://merojob.com/technical-writers-work-from-home-2/"
    },
    {
        "name": "Senior Node JS Backend Developer",
        "company": "Concinnity Limited",
        "logo": "https://merojob.com/media/uploads/job_logo/e361eda5-5d89-492b-8606-dd34dc6081ff.jpg",
        "level": "Senior Level",
        "vacancy": "1",
        "time": "Part Time",
        "address": "Kathmandu",
        "salary": "NRs. 40,000.00 - 60,000.00 Monthly",
        "deadline": "Nov. 07, 2020 23:55\n(3 weeks, 1 day from now)",
        "education": "Bachelor",
        "experience": "More than or equals to 5 years",
        "skills": "Css3\nHtml5\nNode.Js\nWeb Development",
        "skills2": "Css3\nHtml5\nNode.Js\nWeb Development",
        "desc5": "5+ years of experience with Node.JSBS in computer science or engineeringStrong proficiency with JavaScript Familiar with AWS productsExperience with docker is a must. Knowledge of kubernetes is highly appreciated.Knowledge of Node.js and frameworks available such as Express, StrongLoopUnderstanding the nature of asynchronous programming and its quirks and workaroundsGood understanding of server-side templating languages such as Jade, EJSGood understanding of server-side CSS preprocessors such as Stylus, LessBasic understanding of front-end technologies, such as HTML5, and CSS3Understanding accessibility and security complianceUser authentication and authorization between multiple systems, servers, and environmentsIntegration of multiple data sources and databases into one systemUnderstanding fundamental design principles behind a scalable applicationUnderstanding differences between multiple delivery platforms, such as mobile vs. desktop, and optimizing output to match the specific platformCreating database schemas that represent and support business processesImplementing automated testing platforms and unit testsProficient understanding of code versioning tools, such as Git",
        "desc4": "",
        "desc": "",
        "desc1": "We are looking for a Node.js Developer responsible for managing the interchange of data between the server and the users. Your primary focus will be the development of all server-side logic, definition and maintenance of the central database, and ensuring high performance and responsiveness to requests from the front-end. You will also be responsible for integrating the front-end elements built by your co-workers into the application. Therefore, a basic understanding of front-end technologies is necessary as well.Responsibilities:Integration of user-facing elements developed by front-end developers with server side logicWriting reusable, testable, and efficient codeDesign and implementation of low-latency, high-availability, and performant applicationsIntegration of data storage solutionsImplementation of security and data protection",
        "desc2": "Skills and Qualifications:5+ years of experience with Node.JSBS in computer science or engineeringStrong proficiency with JavaScript Familiar with AWS productsExperience with docker is a must. Knowledge of kubernetes is highly appreciated.Knowledge of Node.js and frameworks available such as Express, StrongLoopUnderstanding the nature of asynchronous programming and its quirks and workaroundsGood understanding of server-side templating languages such as Jade, EJSGood understanding of server-side CSS preprocessors such as Stylus, LessBasic understanding of front-end technologies, such as HTML5, and CSS3Understanding accessibility and security complianceUser authentication and authorization between multiple systems, servers, and environmentsIntegration of multiple data sources and databases into one systemUnderstanding fundamental design principles behind a scalable applicationUnderstanding differences between multiple delivery platforms, such as mobile vs. desktop, and optimizing output to match the specific platformCreating database schemas that represent and support business processesImplementing automated testing platforms and unit testsProficient understanding of code versioning tools, such as Git",
        "desc3": "Basic Job Information\n\n\n\nJob Category\n:\n\nIT & Telecommunication\n > Programmer/ Software Engineer\n\n\n\nJob Level\n:\n\nSenior Level\n\n\n\nNo. of Vacancy/s\n:\n[ 1 ]\n\n\nEmployment Type\n:\n\nPart Time\n\n\n\nJob Location\n:\n\nKathmandu\n\n\n\nOffered Salary\n:\n\nNRs. 40,000.00 - 60,000.00 Monthly\n\n\n\nApply Before(Deadline)\n:\nNov. 07, 2020 23:55\n(3 weeks, 1 day from now)\n\n\n\n\n\n\n\n\n\n\n\nJob Specification\n\n\n\nEducation Level\n:\n\nBachelor\n\n\n\nExperience Required\n:\n\nMore than or equals to 5 years\n\n\n\nProfessional Skill Required\n:\n\n\nCss3\nHtml5\nNode.Js\nWeb Development\n\n\n\n\n\n\nOther Specification\n\n\nSkills and Qualifications:5+ years of experience with Node.JSBS in computer science or engineeringStrong proficiency with JavaScript Familiar with AWS productsExperience with docker is a must. Knowledge of kubernetes is highly appreciated.Knowledge of Node.js and frameworks available such as Express, StrongLoopUnderstanding the nature of asynchronous programming and its quirks and workaroundsGood understanding of server-side templating languages such as Jade, EJSGood understanding of server-side CSS preprocessors such as Stylus, LessBasic understanding of front-end technologies, such as HTML5, and CSS3Understanding accessibility and security complianceUser authentication and authorization between multiple systems, servers, and environmentsIntegration of multiple data sources and databases into one systemUnderstanding fundamental design principles behind a scalable applicationUnderstanding differences between multiple delivery platforms, such as mobile vs. desktop, and optimizing output to match the specific platformCreating database schemas that represent and support business processesImplementing automated testing platforms and unit testsProficient understanding of code versioning tools, such as Git\n\n\n\n\n\n\n\n\n\n\n\nJob Description\n\nWe are looking for a Node.js Developer responsible for managing the interchange of data between the server and the users. Your primary focus will be the development of all server-side logic, definition and maintenance of the central database, and ensuring high performance and responsiveness to requests from the front-end. You will also be responsible for integrating the front-end elements built by your co-workers into the application. Therefore, a basic understanding of front-end technologies is necessary as well.Responsibilities:Integration of user-facing elements developed by front-end developers with server side logicWriting reusable, testable, and efficient codeDesign and implementation of low-latency, high-availability, and performant applicationsIntegration of data storage solutionsImplementation of security and data protection\n\n\n\n\n\n\n\n\nAPPLY NOW",
        "Page_URL": "https://merojob.com/senior-backend-developer-5/"
    },
    {
        "name": "Senior Front-end Developer (Angular)",
        "company": "Concinnity Limited",
        "logo": "https://merojob.com/media/uploads/job_logo/e07e4163-d364-45c0-b08a-7dd6cf31122e.jpg",
        "level": "Senior Level",
        "vacancy": "1",
        "time": "Part Time",
        "address": "Kathmandu",
        "salary": "NRs. 40,000.00 - 60,000.00 Monthly",
        "deadline": "Nov. 07, 2020 23:55\n(3 weeks, 1 day from now)",
        "education": "Bachelor",
        "experience": "More than or equals to 5 years",
        "skills": "Html5\nCss\nCommunication\nSearch Engine Optimization (Seo)",
        "skills2": "Html5\nCss\nCommunication\nSearch Engine Optimization (Seo)",
        "desc5": "5+ years of experience with AngularBS degree in computer science or engineeringProficiency with JavaScript and HTML5Professional, precise communication skillsDeep knowledge of Angular practices and commonly used modules based on extensive work experienceCreating self-contained, reusable, and testable modules and componentsEnsuring a clear dependency chain, in regard to the app logic as well as the file systemAbility to provide SEO solutions for single page appsExtensive knowledge of CSS and JS methods for providing performant visual effects.Thorough understanding of the responsibilities of the platform, database, API, caching layer, proxies, and other web services used in the systemValidating user actions on the client side and providing responsive feedbackWriting non-blocking code, and resorting to advanced techniques such as multi-threading, when neededCreating custom, general use modules and components which extend the elements and modules of core AngularExperience with all levels of operation available to the front-end, such as from creating XHRs in vanilla JS to using a custom wrapper around $resourceExperience with building the infrastructure for serving the front-end app and assetsArchitecting and automating the build process for production, using task runners or scriptsDocumenting the code inline using JSDoc or other conventionsWriting extensive unit tests using automated TDD tasksCreating e2e test suites for all components, and running them with Protractor (or a well reasoned alternative)Creating configuration, build, and test scripts for Continuous Integration environments",
        "desc4": "",
        "desc": "",
        "desc1": "We are looking for an AngularJS Developer responsible for the client side of our service. Your primary focus will be to implement a complete user interface in the form of a mobile and desktop web app, with a focus on performance. Your main duties will include creating modules and components and coupling them together into a functional app. The artistic design will be delivered to you, together with a few HTML templates, but we will ask for your help in regard to animations, CSS, and final HTML output. You will work in a team with the back-end developer, and communicate with the API using standard methods. A thorough understanding of all of the components of our platform and infrastructure is required.ResponsibilitiesDelivering a complete front end applicationEnsuring high performance on mobile and desktopWriting tested, idiomatic, and documented JavaScript, HTML and CSSCoordinating the workflow between the graphic designer, the HTML coder, and yourselfCooperating with the back-end developer in the process of building the RESTful APICommunicating with external web services",
        "desc2": "Skills and Qualifications5+ years of experience with AngularBS degree in computer science or engineeringProficiency with JavaScript and HTML5Professional, precise communication skillsDeep knowledge of Angular practices and commonly used modules based on extensive work experienceCreating self-contained, reusable, and testable modules and componentsEnsuring a clear dependency chain, in regard to the app logic as well as the file systemAbility to provide SEO solutions for single page appsExtensive knowledge of CSS and JS methods for providing performant visual effects.Thorough understanding of the responsibilities of the platform, database, API, caching layer, proxies, and other web services used in the systemValidating user actions on the client side and providing responsive feedbackWriting non-blocking code, and resorting to advanced techniques such as multi-threading, when neededCreating custom, general use modules and components which extend the elements and modules of core AngularExperience with all levels of operation available to the front-end, such as from creating XHRs in vanilla JS to using a custom wrapper around $resourceExperience with building the infrastructure for serving the front-end app and assetsArchitecting and automating the build process for production, using task runners or scriptsDocumenting the code inline using JSDoc or other conventionsWriting extensive unit tests using automated TDD tasksCreating e2e test suites for all components, and running them with Protractor (or a well reasoned alternative)Creating configuration, build, and test scripts for Continuous Integration environments",
        "desc3": "Basic Job Information\n\n\n\nJob Category\n:\n\nIT & Telecommunication\n > Programmer/ Software Engineer\n\n\n\nJob Level\n:\n\nSenior Level\n\n\n\nNo. of Vacancy/s\n:\n[ 1 ]\n\n\nEmployment Type\n:\n\nPart Time\n\n\n\nJob Location\n:\n\n\nKathmandu\n\n\n\nOffered Salary\n:\n\nNRs. 40,000.00 - 60,000.00 Monthly\n\n\n\nApply Before(Deadline)\n:\nNov. 07, 2020 23:55\n(3 weeks, 1 day from now)\n\n\n\n\n\n\n\n\n\n\n\nJob Specification\n\n\n\nEducation Level\n:\n\nBachelor\n\n\n\nExperience Required\n:\n\nMore than or equals to 5 years\n\n\n\nProfessional Skill Required\n:\n\n\nHtml5\nCss\nCommunication\nSearch Engine Optimization (Seo)\n\n\n \n\n\n\nOther Specification\n\n\nSkills and Qualifications5+ years of experience with AngularBS degree in computer science or engineeringProficiency with JavaScript and HTML5Professional, precise communication skillsDeep knowledge of Angular practices and commonly used modules based on extensive work experienceCreating self-contained, reusable, and testable modules and componentsEnsuring a clear dependency chain, in regard to the app logic as well as the file systemAbility to provide SEO solutions for single page appsExtensive knowledge of CSS and JS methods for providing performant visual effects.Thorough understanding of the responsibilities of the platform, database, API, caching layer, proxies, and other web services used in the systemValidating user actions on the client side and providing responsive feedbackWriting non-blocking code, and resorting to advanced techniques such as multi-threading, when neededCreating custom, general use modules and components which extend the elements and modules of core AngularExperience with all levels of operation available to the front-end, such as from creating XHRs in vanilla JS to using a custom wrapper around $resourceExperience with building the infrastructure for serving the front-end app and assetsArchitecting and automating the build process for production, using task runners or scriptsDocumenting the code inline using JSDoc or other conventionsWriting extensive unit tests using automated TDD tasksCreating e2e test suites for all components, and running them with Protractor (or a well reasoned alternative)Creating configuration, build, and test scripts for Continuous Integration environments\n\n\n\n\n\n\n\n\n\n\n\nJob Description\n\nWe are looking for an AngularJS Developer responsible for the client side of our service. Your primary focus will be to implement a complete user interface in the form of a mobile and desktop web app, with a focus on performance. Your main duties will include creating modules and components and coupling them together into a functional app. The artistic design will be delivered to you, together with a few HTML templates, but we will ask for your help in regard to animations, CSS, and final HTML output. You will work in a team with the back-end developer, and communicate with the API using standard methods. A thorough understanding of all of the components of our platform and infrastructure is required.ResponsibilitiesDelivering a complete front end applicationEnsuring high performance on mobile and desktopWriting tested, idiomatic, and documented JavaScript, HTML and CSSCoordinating the workflow between the graphic designer, the HTML coder, and yourselfCooperating with the back-end developer in the process of building the RESTful APICommunicating with external web services\n\n\n\n\n\n\n\n\nAPPLY NOW",
        "Page_URL": "https://merojob.com/senior-front-end-developer-angular/"
    },
    {
        "name": "Full Stack Developer",
        "company": "Doransoft Pvt. Ltd.",
        "logo": "https://merojob.com/media/uploads/job_logo/b508b829-18e1-4631-8437-cef26decd84d.jpg",
        "level": "Mid Level",
        "vacancy": "3",
        "time": "Full Time",
        "address": "Kathmandu",
        "salary": "Negotiable",
        "deadline": "Nov. 12, 2020 23:55\n(3 weeks, 6 days from now)",
        "education": "Bachelor",
        "experience": "More than or equals to 2 years",
        "skills": "Laravel\nNode.Js\nReact\nCss3\nPostgresql",
        "skills2": "Laravel\nNode.Js\nReact\nCss3\nPostgresql",
        "desc5": "Should have minimum of 2 years of work experienceHands on experience writing NodeJS + AngularJS/ReactJS + PostgreSQL / MySQL / MongoDB code in productionExperience building highly scalable service APIs (REST, SOAP, Microservices) hosted on cloud environmentExperience with Agile Development, SCRUM, or Extreme Programming methodologies Skills Required Strong experience in HTML5, CSS3, Javascript, JQuery and latest Javascript frameworks (Backbone, Bootstrap,Node.js etc) Experience in one or more MVC frameworks(Laravel, Codeigniter, Ruby on Rails, Spring) is a plusCan provide support for existing applicationsSelf Motivated and open minded personGood learning attitudeExperience in integration and deliveryAbility to liaise at all levels within the businessSolid analysis and problem-solving skills",
        "desc4": "",
        "desc": "",
        "desc1": "We are a conscientious, reliable, creative and diligent team from Nepal with strong work ethics. We comprehend the beauty of digital products and deploy our passion to differentiate our self as a leading digital team. We represent and project client's goals and objectives in an artistic and digital form. We are the Software Developers, Web/Mobile Application developers, designers and marketers helping to bridge the gap between a business and its customers. We are recognized by the values we adopt like result oriented, individualized attention, creative, methodical, ethical and futuristic thinking. We impart the concrete combination of artistry and engineering and make new things familiar. We deliver what have been promised forthwith with the joint effort of our competent and devoted team members.Ability to work independently or as part of a teamIdentify technical problems and procedures and communicate their applicable solutionsParticipate in collecting information for developing enterprise level applicationsBe part of development team to migrate web applications in other technologies into NodeJS and MongoDB environmentResolve issues related to web application like cross-browser compatibility, security issues and moreDeveloping scalable applications (both Front-end (ReactJS / ReactJS Native and Back-end NodeJS)Basic Knowledge of secure coding practices as it pertains to OWASPExperience of working in a SCRUM/Agile team would be added valueWriting reusable code and libraries, optimize applications for performance and scalabilityDesign and implementation of low-latency, high-availability, and performance applicationsBuilding secured backend API's to be consumed by multiple applications (e.g. web and mobile) Implementation of security and data protectionWhat We OfferDashain BonusYour own workstationAnnual Paid LeavesFree LunchExcellent career opportunities5 days a weekOpen office environment",
        "desc2": "Should have minimum of 2 years of work experienceHands on experience writing NodeJS + AngularJS/ReactJS + PostgreSQL / MySQL / MongoDB code in productionExperience building highly scalable service APIs (REST, SOAP, Microservices) hosted on cloud environmentExperience with Agile Development, SCRUM, or Extreme Programming methodologies Skills Required Strong experience in HTML5, CSS3, Javascript, JQuery and latest Javascript frameworks (Backbone, Bootstrap,Node.js etc) Experience in one or more MVC frameworks(Laravel, Codeigniter, Ruby on Rails, Spring) is a plusCan provide support for existing applicationsSelf Motivated and open minded personGood learning attitudeExperience in integration and deliveryAbility to liaise at all levels within the businessSolid analysis and problem-solving skills",
        "desc3": "Basic Job Information\n\n\n\nJob Category\n:\n\nIT & Telecommunication\n\n\n\nJob Level\n:\n\nMid Level\n\n\n\nNo. of Vacancy/s\n:\n[ 3 ]\n\n\nEmployment Type\n:\n\nFull Time\n\n\n\nJob Location\n:\n\nKathmandu\n\n\n\nOffered Salary\n:\n\nNegotiable\n\n\n\nApply Before(Deadline)\n:\nNov. 12, 2020 23:55\n(3 weeks, 6 days from now)\n\n\n\n\n\n\n\n\n\n\n\nJob Specification\n\n\n\n Education Level\n:\n\nBachelor\n\n\n\nExperience Required\n:\n\nMore than or equals to 2 years\n\n\n\nProfessional Skill Required\n:\n\n\nLaravel\nNode.Js\nReact\nCss3\nPostgresql\n\n\n\n\n\n\nOther Specification\n\n\nShould have minimum of 2 years of work experienceHands on experience writing NodeJS + AngularJS/ReactJS + PostgreSQL / MySQL / MongoDB code in productionExperience building highly scalable service APIs (REST, SOAP, Microservices) hosted on cloud environmentExperience with Agile Development, SCRUM, or Extreme Programming methodologies Skills Required Strong experience in HTML5, CSS3, Javascript, JQuery and latest Javascript frameworks (Backbone, Bootstrap,Node.js etc) Experience in one or more MVC frameworks(Laravel, Codeigniter, Ruby on Rails, Spring) is a plusCan provide support for existing applicationsSelf Motivated and open minded personGood learning attitudeExperience in integration and deliveryAbility to liaise at all levels within the businessSolid analysis and problem-solving skills\n\n\n\n\n\n\n\n \n\n\n\nJob Description\n\nWe are a conscientious, reliable, creative and diligent team from Nepal with strong work ethics. We comprehend the beauty of digital products and deploy our passion to differentiate our self as a leading digital team. We represent and project client's goals and objectives in an artistic and digital form. We are the Software Developers, Web/Mobile Application developers, designers and marketers helping to bridge the gap between a business and its customers. We are recognized by the values we adopt like result oriented, individualized attention, creative, methodical, ethical and futuristic thinking. We impart the concrete combination of artistry and engineering and make new things familiar. We deliver what have been promised forthwith with the joint effort of our competent and devoted team members.Ability to work independently or as part of a teamIdentify technical problems and procedures and communicate their applicable solutionsParticipate in collecting information for developing enterprise level applicationsBe part of development team to migrate web applications in other technologies into NodeJS and MongoDB environmentResolve issues related to web application like cross-browser compatibility, security issues and moreDeveloping scalable applications (both Front-end (ReactJS / ReactJS Native and Back-end NodeJS)Basic Knowledge of secure coding practices as it pertains to OWASPExperience of working in a SCRUM/Agile team would be added valueWriting reusable code and libraries, optimize applications for performance and scalabilityDesign and implementation of low-latency, high-availability, and performance applicationsBuilding secured backend API's to be consumed by multiple applications (e.g. web and mobile) Implementation of security and data protectionWhat We OfferDashain BonusYour own workstationAnnual Paid LeavesFree LunchExcellent career opportunities5 days a weekOpen office environment\n\n\n\n\n\n\n\n\nAPPLY NOW",
        "Page_URL": "https://merojob.com/full-stack-developer-41/"
    },
    {
        "name": "Software Engineer",
        "company": "NBIT",
        "logo": "https://merojob.com/media/uploads/job_logo/1ba564cc-b1ad-4350-9c9b-a3d15757f73a.jpg",
        "level": "Mid Level",
        "vacancy": "1",
        "time": "Full Time",
        "address": "Kumaripati, Lalitpur",
        "salary": "Negotiable",
        "deadline": "Nov. 07, 2020 23:55\n(3 weeks, 1 day from now)",
        "education": "Bachelor",
        "experience": "More than or equals to 2 years",
        "skills": "C#\nJavascript\nWeb Development\nAsp.Net\nAgile Development",
        "skills2": "C#\nJavascript\nWeb Development\nAsp.Net\nAgile Development",
        "desc5": "Experience in .net coreGood understanding of AJAX , JavaScript Dom manipulation TechniquesExperience in JavaScript build tools .Expert in any one of the modern JavaScript MV-VM/MVC frameworks (AngularJS, JQuery, NodeJS, Vue.js)Ability to work independently or as part of a teamExperience of working in SCRUM/Agile teamExcellent communication skills both verbal and writtenStrong creative, logical and analytical skills",
        "desc4": "More than or equals to 2 years of experience with Asp.net, C#Bachelor’s degree in IT or related stream",
        "desc": "",
        "desc1": "Utilize established development tools, guidelines and conventions including but not limited to ASP.NET, SQL Server, HTML/HTML5/XHTML, CSS, JavaScript, and C#Design, code and test new web & Windows software applicationsEnhance existing systems by analyzing business objectives, preparing an action plan and identifying areas for modification and improvementMaintain existing software systems by identifying and correcting software defectsResearch and develop skills in new technologiesProactively initiate, develop, and maintain effective working relationships with team membersWe Provide:Provident fund schemesWorking in a team environment where initiative and dedication is encouragedHigh level of responsibility and excellent career possibilitiesOpen international work environment5 Working Days per WeekDashain BonusFlexible working environmentTeam Building ActivitiesTimely Salary Review and Performance Appraisals",
        "desc2": "Skills Required:Experience in .net coreGood understanding of AJAX , JavaScript Dom manipulation TechniquesExperience in JavaScript build tools .Expert in any one of the modern JavaScript MV-VM/MVC frameworks (AngularJS, JQuery, NodeJS, Vue.js)Ability to work independently or as part of a teamExperience of working in SCRUM/Agile teamExcellent communication skills both verbal and writtenStrong creative, logical and analytical skillsQualification Required:More than or equals to 2 years of experience with Asp.net, C#Bachelor’s degree in IT or related stream",
        "desc3": "Basic Job Information\n\n\n\nJob Category\n:\n\nIT & Telecommunication\n > Programmer/ Software Engineer\n\n \n\nJob Level\n:\n\nMid Level\n\n\n\nNo. of Vacancy/s\n:\n[ 1 ]\n\n\nEmployment Type\n:\n\nFull Time\n\n\n\nJob Location\n:\n\nKumaripati, Lalitpur\n\n\n\nOffered Salary\n:\n\nNegotiable\n\n\n\nApply Before(Deadline)\n:\nNov. 07, 2020 23:55\n(3 weeks, 1 day from now)\n\n\n\n\n\n\n\n\n\n\n\nJob Specification\n\n\n\nEducation Level\n:\n\nBachelor\n\n\n\nExperience Required\n:\n\nMore than or equals to 2 years\n\n\n\n\nProfessional Skill Required\n:\n\n\nC#\nJavascript\nWeb Development\nAsp.Net\nAgile Development\n\n\n\n\n\n\nOther Specification\n\n\nSkills Required:Experience in .net coreGood understanding of AJAX , JavaScript Dom manipulation TechniquesExperience in JavaScript build tools .Expert in any one of the modern JavaScript MV-VM/MVC frameworks (AngularJS, JQuery, NodeJS, Vue.js)Ability to work independently or as part of a teamExperience of working in SCRUM/Agile teamExcellent communication skills both verbal and writtenStrong creative, logical and analytical skillsQualification Required:More than or equals to 2 years of experience with Asp.net, C#Bachelor’s degree in IT or related stream\n\n\n\n\n\n\n\n\n\n\n\nJob Description\n\nUtilize established development tools, guidelines and conventions including but not limited to ASP.NET, SQL Server, HTML/HTML5/XHTML, CSS, JavaScript, and C#Design, code and test new web & Windows software applicationsEnhance existing systems by analyzing business objectives, preparing an action plan and identifying areas for modification and improvementMaintain existing software systems by identifying and correcting software defectsResearch and develop skills in new technologiesProactively initiate, develop, and maintain effective working relationships with team membersWe Provide:Provident fund schemesWorking in a team environment where initiative and dedication is encouragedHigh level of responsibility and excellent career possibilitiesOpen international work environment5 Working Days per WeekDashain BonusFlexible working environmentTeam Building ActivitiesTimely Salary Review and Performance Appraisals\n\n\n\n\n\n\n\n\nAPPLY NOW",
        "Page_URL": "https://merojob.com/software-engineer-104/"
    },
    {
        "name": "Java Backend Engineer",
        "company": "",
        "logo": "https://merojob.com/media/uploads/job_logo/ad41aae4-c911-4116-b6fc-4538c9d2610d.jpg",
        "level": "Senior Level",
        "vacancy": "1",
        "time": "Full Time",
        "address": "Remote",
        "salary": "$. 700.00 - 1,200.00 Monthly",
        "deadline": "Nov. 10, 2020 23:55\n(3 weeks, 4 days from now)",
        "education": "Bachelor",
        "experience": "More than or equals to 2 years",
        "skills": "Java\nCss\nJquery",
        "skills2": "Java\nCss\nJquery",
        "desc5": "Java 11Strong understanding of the Spring ecosystemStrong understanding of HibernateStrong understanding of the need and applications of Dependency InjectionStrong understanding of SOLID principles and Clean ArchitectureStrong understanding and experience with unit testing (Mockito, JUnit 5, AssertJ)Strong understanding of authentication and authorization with JWT tokensStrong understanding of GradleFamiliarity with KubernetesFamiliarity with integrating 3rd party vendorsFamiliarity with DockerFamiliarity with PostgreSQL and schema migrations (Liquibase)Familiarity with DDDFamiliarity with integration testing",
        "desc4": "TerraformHelm/KustomizeKnowledge of GCP ecosystemGeneral understanding of CI/CD pipelines and DevOpsGeneral understanding of networkingInstrumentation and monitoring",
        "desc": "",
        "desc1": "Looking for a Java Backend Developer to help develop a unique temporary staffing platform allowing companies to connect with workers on an ad hoc basisYou need a strong grasp of English, and willing to work remotely with our team in the UKCollaborating with the front-end developers and other team members to establish objectives and design more functional, cohesive codes to enhance the user experience",
        "desc2": "Essential SkillsJava 11Strong understanding of the Spring ecosystemStrong understanding of HibernateStrong understanding of the need and applications of Dependency InjectionStrong understanding of SOLID principles and Clean ArchitectureStrong understanding and experience with unit testing (Mockito, JUnit 5, AssertJ)Strong understanding of authentication and authorization with JWT tokensStrong understanding of GradleFamiliarity with KubernetesFamiliarity with integrating 3rd party vendorsFamiliarity with DockerFamiliarity with PostgreSQL and schema migrations (Liquibase)Familiarity with DDDFamiliarity with integration testingDesirable SkillsTerraformHelm/KustomizeKnowledge of GCP ecosystemGeneral understanding of CI/CD pipelines and DevOpsGeneral understanding of networkingInstrumentation and monitoring",
        "desc3": "Basic Job Information\n\n\n\nJob Category\n:\n\nIT & Telecommunication\n > Programmer/ Software Engineer\n\n\n\nJob Level\n:\n\nSenior Level\n\n\n\nNo. of Vacancy/s\n:\n[ 1 ]\n\n\nEmployment Type\n:\n\nFull Time\n\n\n\nJob Location\n:\n\n Remote\n\n\n\nOffered Salary\n:\n\n$. 700.00 - 1,200.00 Monthly\n\n\n\nApply Before(Deadline)\n:\nNov. 10, 2020 23:55\n(3 weeks, 4 days from now)\n\n\n\n\n\n\n\n\n\n\n\nJob Specification\n\n\n\nEducation Level\n:\n\nBachelor\n\n\n\nExperience Required\n:\n\nMore than or equals to 2 years\n\n\n\nProfessional Skill Required\n:\n\n\nJava\nCss\nJquery\n\n\n\n\n\n\n Other Specification\n\n\nEssential SkillsJava 11Strong understanding of the Spring ecosystemStrong understanding of HibernateStrong understanding of the need and applications of Dependency InjectionStrong understanding of SOLID principles and Clean ArchitectureStrong understanding and experience with unit testing (Mockito, JUnit 5, AssertJ)Strong understanding of authentication and authorization with JWT tokensStrong understanding of GradleFamiliarity with KubernetesFamiliarity with integrating 3rd party vendorsFamiliarity with DockerFamiliarity with PostgreSQL and schema migrations (Liquibase)Familiarity with DDDFamiliarity with integration testingDesirable SkillsTerraformHelm/KustomizeKnowledge of GCP ecosystemGeneral understanding of CI/CD pipelines and DevOpsGeneral understanding of networkingInstrumentation and monitoring\n\n\n\n\n\n\n\n\n\n\n\nJob Description\n\nLooking for a Java Backend Developer to help develop a unique temporary staffing platform allowing companies to connect with workers on an ad hoc basisYou need a strong grasp of English, and willing to work remotely with our team in the UKCollaborating with the front-end developers and other team members to establish objectives and design more functional, cohesive codes to enhance the user experience\n\n\n\n\n\n\n\n\nAPPLY NOW",
        "Page_URL": "https://merojob.com/java-backend-engineer/"
    },
    {
        "name": "Junior iOS Developer",
        "company": "EBPearls",
        "logo": "https://merojob.com/media/uploads/job_logo/bcb6606a-8302-45f1-96fb-a3ba0e6d9c7a.jpg",
        "level": "Mid Level",
        "vacancy": "1",
        "time": "Full Time",
        "address": "Kandevsthan",
        "salary": "Negotiable",
        "deadline": "Oct. 28, 2020 23:55\n(1 week, 5 days from now)",
        "education": "Bachelor",
        "experience": "More than or equals to 1 year",
        "skills": "Orm And Rdbms\nCoredata\nCocoa Touch",
        "skills2": "Orm And Rdbms\nCoredata\nCocoa Touch",
        "desc5": "University Bachelor's degree in Computer Engineering or equivalent in relevant stream  Minimum 1 year of relevant professional work experience ",
        "desc4": "Experience with Objective-C/Swift, with full command of the Cocoa Touch Framework Experience with Core Framework like Core Location Knowledge of CoreData, ORM and RDBMS concepts Experience with RESTful web services and parsing JSON/XML Experience with dependency management tools like- Cocoapods, SPM and commands related to Cocoapods dependency manager Experience with breakpoints and inspection Concept of threads management Fluency with Xcode, JIRA, GIT Knowledge of MVC, MVVM, Architecture component and memory management Understanding of the full mobile development life cycle Strong coding and analytical skills Good understanding of OOPS concepts, and Design patterns Coding and analytical skills ",
        "desc": "Should be able to integrate 3rd party library manually Professional experience with deployment, Apple Store policies Strong software engineering skills, can design and implement software projects from the ground up",
        "desc1": "Position OverviewAre you passionate about developing state of the art web and mobile app solutions? Do you want to work with the award winning iOS App Development team?We are looking for iOS Developers who will be a responsible member of the Mobile Apps development team, the largest team at EB Pearls. This position is responsible for developing projects as per clients’ requirements. iOS developer reports directly to the Project Manager and is accountable for the Project Development.Job Roles and Responsibilities1. Project AccountabilityUnderstand the project requirements clearlyGenerate queries in case there is any confusion in understanding the projectDiscuss any technical challenges that might come affront while working on the projectRealize the project delivery date and understand the communication channelsWrite codes to develop a quality product on timeConduct first hand testing of the project tasks before submitting the tasks to the Project ManagerVerify the product with SRS2. Adapt to EB Work CultureAttend project meetings conducted by Project Manager with full preparation by studying the project documents and information.Follow company coding standards.3. Team CoordinationTake ownership of the project from planning to the delivery of the project.Be easily approachable and flexible in work.Perks and BenefitsWe strive to make sure that our people are comfortable, happy and growing at EB Pearls.We offer:Insurance: We enroll our employees in the company's group insurance policy that covers both medial and accidental insurance.Competitive Salary: We strive to ensure that our people get competitive remuneration as per the industry standardsTimely performance appraisal and salary reviews: We conduct bi yearly performance review to ensure that our people are always on top of their game and ensure yearly salary review on a timely basis to compliment.Paid Time Off (PTO)/ Paid Holidays: PTO refers to days when you can take time away from work while still being paid your usual salary. We provide 13 business days off as festival holidays.Employee Recognition: We are a company led by performers and we never fail to acknowledge the exemplary performance of our peopleSocial Security Fund: SSF is a contribution based social security scheme, the employee contributes 11 % and the employer adds 20% of the basic salary per month( 31% of the basic salary of employee) every month.Festival Allowance: We have the provision of festival allowance and provide Dashain bonus which is based on the amount of employees’ basic salary.Training and Development Programs: We are obsessed with constantly developing our competencies. Hence, we determine the training needs for our people from the performance review that we conduct bi- yearly.Work on next generation technology projectsWork with leading edge technologyFun At EBAll work and no play is not our cup of tea. At EB, we enjoy:Office Events: Chat and Chew, Residential Annual Event, Team Lunch OutEEC Club Activities: Night outs, Picnics, Lunch Outs, Futsal, Festival Events, Pool Parties, Day out eventsFood and Coffee: Office Provided lunch and stocked pantryInspiring Colleagues: Fun and friendly work environment with brilliant one of a kind teamApplying ProcedureSubmit a cover letter along with your recently updated resume via email to “careers@ebpearls.com” with “Application for Junior iOS Developer” in the subject line.OR,Send your application via our website https://ebpearls.com.au/apply-now/?jobid=583547000001704274OR,",
        "desc2": "Qualifications Required University Bachelor's degree in Computer Engineering or equivalent in relevant stream  Minimum 1 year of relevant professional work experience Skills Required Experience with Objective-C/Swift, with full command of the Cocoa Touch Framework Experience with Core Framework like Core Location Knowledge of CoreData, ORM and RDBMS concepts Experience with RESTful web services and parsing JSON/XML Experience with dependency management tools like- Cocoapods, SPM and commands related to Cocoapods dependency manager Experience with breakpoints and inspection Concept of threads management Fluency with Xcode, JIRA, GIT Knowledge of MVC, MVVM, Architecture component and memory management Understanding of the full mobile development life cycle Strong coding and analytical skills Good understanding of OOPS concepts, and Design patterns Coding and analytical skills  Skills Preferred Should be able to integrate 3rd party library manually Professional experience with deployment, Apple Store policies Strong software engineering skills, can design and implement software projects from the ground up",
        "desc3": "Basic Job Information\n\n\n\nJob Category\n:\n\nIT & Telecommunication\n\n\n\nJob Level\n:\n\nMid Level\n\n \n\nNo. of Vacancy/s\n:\n[ 1 ]\n\n\nEmployment Type\n:\n\nFull Time\n\n\n\nJob Location\n:\n\nKandevsthan\n\n\n\nOffered Salary\n:\n\nNegotiable\n\n\n\nApply Before(Deadline)\n:\nOct. 28, 2020 23:55\n(1 week, 5 days from now)\n\n\n\n\n\n\n\n\n\n\n\nJob Specification\n\n\n\nEducation Level\n:\n\nBachelor\n\n\n\nExperience Required\n:\n\nMore than or equals to 1 year\n\n\n\nProfessional Skill Required\n :\n\n\nOrm And Rdbms\nCoredata\nCocoa Touch\n\n\n\n\n\n\nOther Specification\n\n\nQualifications Required University Bachelor's degree in Computer Engineering or equivalent in relevant stream  Minimum 1 year of relevant professional work experience Skills Required Experience with Objective-C/Swift, with full command of the Cocoa Touch Framework Experience with Core Framework like Core Location Knowledge of CoreData, ORM and RDBMS concepts Experience with RESTful web services and parsing JSON/XML Experience with dependency management tools like- Cocoapods, SPM and commands related to Cocoapods dependency manager Experience with breakpoints and inspection Concept of threads management Fluency with Xcode, JIRA, GIT Knowledge of MVC, MVVM, Architecture component and memory management Understanding of the full mobile development life cycle Strong coding and analytical skills Good understanding of OOPS concepts, and Design patterns Coding and analytical skills  Skills Preferred Should be able to integrate 3rd party library manually Professional experience with deployment, Apple Store policies Strong software engineering skills, can design and implement software projects from the ground up\n\n\n\n\n\n\n\n\n\n\n\nJob Description\n\nPosition OverviewAre you passionate about developing state of the art web and mobile app solutions? Do you want to work with the award winning iOS App Development team?We are looking for iOS Developers who will be a responsible member of the Mobile Apps development team, the largest team at EB Pearls. This position is responsible for developing projects as per clients’ requirements. iOS developer reports directly to the Project Manager and is accountable for the Project Development.Job Roles and Responsibilities1. Project AccountabilityUnderstand the project requirements clearlyGenerate queries in case there is any confusion in understanding the projectDiscuss any technical challenges that might come affront while working on the projectRealize the project delivery date and understand the communication channelsWrite codes to develop a quality product on timeConduct first hand testing of the project tasks before submitting the tasks to the Project ManagerVerify the product with SRS2. Adapt to EB Work CultureAttend project meetings conducted by Project Manager with full preparation by studying the project documents and information.Follow company coding standards.3. Team CoordinationTake ownership of the project from planning to the delivery of the project.Be easily approachable and flexible in work.Perks and BenefitsWe strive to make sure that our people are comfortable, happy and growing at EB Pearls.We offer:Insurance: We enroll our employees in the company's group insurance policy that covers both medial and accidental insurance.Competitive Salary: We strive to ensure that our people get competitive remuneration as per the industry standardsTimely performance appraisal and salary reviews: We conduct bi yearly performance review to ensure that our people are always on top of their game and ensure yearly salary review on a timely basis to compliment.Paid Time Off (PTO)/ Paid Holidays: PTO refers to days when you can take time away from work while still being paid your usual salary. We provide 13 business days off as festival holidays.Employee Recognition: We are a company led by performers and we never fail to acknowledge the exemplary performance of our peopleSocial Security Fund: SSF is a contribution based social security scheme, the employee contributes 11 % and the employer adds 20% of the basic salary per month( 31% of the basic salary of employee) every month.Festival Allowance: We have the provision of festival allowance and provide Dashain bonus which is based on the amount of employees’ basic salary.Training and Development Programs: We are obsessed with constantly developing our competencies. Hence, we determine the training needs for our people from the performance review that we conduct bi- yearly.Work on next generation technology projectsWork with leading edge technologyFun At EBAll work and no play is not our cup of tea. At EB, we enjoy:Office Events: Chat and Chew, Residential Annual Event, Team Lunch OutEEC Club Activities: Night outs, Picnics, Lunch Outs, Futsal, Festival Events, Pool Parties, Day out eventsFood and Coffee: Office Provided lunch and stocked pantryInspiring Colleagues: Fun and friendly work environment with brilliant one of a kind teamApplying ProcedureSubmit a cover letter along with your recently updated resume via email to “careers@ebpearls.com” with “Application for Junior iOS Developer” in the subject line.OR,Send your application via our website https://ebpearls.com.au/apply-now/?jobid=583547000001704274OR,\n\n\n\n\n\n\n\n\nAPPLY NOW",
        "Page_URL": "https://merojob.com/ios-developer-103/"
    },
    {
        "name": "Front End Developer",
        "company": "Socheko.com",
        "logo": "https://merojob.com/media/uploads/job_logo/c8f1ead4-3937-4a0c-aa66-5eaf9d16a829.jpg",
        "level": "Mid Level",
        "vacancy": "2",
        "time": "Full Time",
        "address": "Kathmandu",
        "salary": "Negotiable",
        "deadline": "Nov. 09, 2020 23:55\n(3 weeks, 3 days from now)",
        "education": "Bachelor",
        "experience": "Not Required",
        "skills": "Javascript\nCss\nDebugging",
        "skills2": "Javascript\nCss\nDebugging",
        "desc5": "Undertake development\noperational tasks to design website according to online shopping\nrequirement Build end to end websites\nalongside new features and widgets Design/Develop product and\ninterface concepts from their earliest stages.Develop frontend web\napplications Collaborate closely with the\ninter office team for any changes in theme & design  Conduct a test-driven development\napproach for the codes written Ensure the technical\nfeasibility of UI/UX designsOptimize application for\nmaximum speed and scalability",
        "desc4": "",
        "desc": "",
        "desc1": "Skill full in Website designing\nKnowledge about JS frontend\ntechnologyExperience on Data\nVisualization & Familiar with Developer tools HTML5, SASS (CSS 3)Have to possess good\nknowledge of software life cycle, database relations, and data structuresShould be able to write\nlibraries and modular codes from scratch.Deep understanding of JS\nprogramming, database modelling and design, scalable web architecture",
        "desc2": "Undertake development\noperational tasks to design website according to online shopping\nrequirement Build end to end websites\nalongside new features and widgets Design/Develop product and\ninterface concepts from their earliest stages.Develop frontend web\napplications Collaborate closely with the\ninter office team for any changes in theme & design  Conduct a test-driven development\napproach for the codes written Ensure the technical\nfeasibility of UI/UX designsOptimize application for\nmaximum speed and scalability",
        "desc3": "Basic Job Information\n\n\n\nJob Category\n:\n\nIT & Telecommunication\n > Internet/E-commerce, Web Developer/Web Designer\n\n\n\nJob Level\n:\n\nMid Level\n\n\n\nNo. of Vacancy/s\n:\n[ 2 ]\n\n\nEmployment Type\n:\n\nFull Time\n\n\n\nJob Location\n:\n\nKathmandu\n\n\n\nOffered Salary\n:\n\nNegotiable\n\n\n\nApply Before(Deadline)\n:\nNov. 09, 2020 23:55\n(3 weeks, 3 days from now)\n\n\n\n\n\n\n\n\n\n\n\nJob Specification\n\n\n\nEducation Level\n:\n\nBachelor\n\n\n\nExperience Required\n:\n\nNot Required\n\n\n\nProfessional Skill Required\n:\n\n\nJavascript\nCss\nDebugging\n\n\n\n\n\n\nOther Specification\n\n\nUndertake development\noperational tasks to design website according to online shopping\nrequirement Build end to end websites\nalongside new features and widgets Design/Develop product and\ninterface concepts from their earliest stages.Develop frontend web\napplications Collaborate closely with the\ninter office team for any changes in theme & design  Conduct a test-driven development\napproach for the codes written Ensure the technical\nfeasibility of UI/UX designsOptimize application for\nmaximum speed and scalability\n\n\n\n\n\n\n\n\n\n\n\nJob Description\n\nSkill full in Website designing\nKnowledge about JS frontend\ntechnologyExperience on Data\nVisualization & Familiar with Developer tools HTML5, SASS (CSS 3)Have to possess good\nknowledge of software life cycle, database relations, and data structuresShould be able to write\nlibraries and modular codes from scratch.Deep understanding of JS\nprogramming, database modelling and design, scalable web architecture\n\n\n\n\n\n\n\n\nAPPLY NOW",
        "Page_URL": "https://merojob.com/front-end-developer-98/"
    },
    {
        "name": "UI/UX Designer",
        "company": "Agile Solutions",
        "logo": "https://merojob.com/media/uploads/job_logo/9f57223e-f7eb-4144-bb0c-a7ab66279b23.jpg",
        "level": "Mid Level",
        "vacancy": "1",
        "time": "Full Time",
        "address": "Gairidhara, Kathmandu",
        "salary": "Negotiable",
        "deadline": "Nov. 12, 2020 23:55\n(3 weeks, 6 days from now)",
        "education": "Bachelor",
        "experience": "More than or equals to 1 year",
        "skills": "Wireframing And Ui Prototyping\nVisual Communication\nInteraction Design\nUx Research\nAnalytics",
        "skills2": "Wireframing And Ui Prototyping\nVisual Communication\nInteraction Design\nUx Research\nAnalytics",
        "desc5": "Up-to-date knowledge of design software like Adobe,\nIllustrator and PhotoshopKnowledge of wireframe tools (e.g. Figma, Sketch, XD,\nWireframe.cc and InVision)Knowledge of design language like CSS, Android XML\nlayout",
        "desc4": "Medical, accidental, OPD and COVID-19 insurance schemeFree Lunch at officeCompetitive salary packages to the deserving candidatesAttractive incentives and bonusesA friendly, competitive and creative working environment with higher level of exposure to the top corporate housesPaid leaves in compliance with the labor laws to maintain the healthy work life balance of employeesLoan program facility in case of financial emergency with zero interestConveyance allowance scheme that covers day to day transportation costTechnology allowance program for the employees who prefer using their own laptops",
        "desc": "",
        "desc1": "Gather and evaluate user requirements in collaboration with Managersllustrate design ideas using storyboards, process flows and sitemapsDesign graphic user interface elements, like menus, tabs and widgetsDevelop UI mockups and prototypes that clearly illustrate how sites function and look likeCreate original graphic designs (e.g. images, sketches and tables)Prepare and present rough drafts to internal teamsIdentify and troubleshoot UX problems (e.g. responsiveness)Conduct layout adjustments based on user feedbackAdhere to style standards on fonts, colors and images",
        "desc2": "Up-to-date knowledge of design software like Adobe,\nIllustrator and PhotoshopKnowledge of wireframe tools (e.g. Figma, Sketch, XD,\nWireframe.cc and InVision)Knowledge of design language like CSS, Android XML\nlayoutCompany Benefits:Medical, accidental, OPD and COVID-19 insurance schemeFree Lunch at officeCompetitive salary packages to the deserving candidatesAttractive incentives and bonusesA friendly, competitive and creative working environment with higher level of exposure to the top corporate housesPaid leaves in compliance with the labor laws to maintain the healthy work life balance of employeesLoan program facility in case of financial emergency with zero interestConveyance allowance scheme that covers day to day transportation costTechnology allowance program for the employees who prefer using their own laptops",
        "desc3": "Basic Job Information\n\n\n\nJob Category\n:\n\nIT & Telecommunication\n\n\n\nJob Level\n:\n\nMid Level\n\n\n\nNo. of Vacancy/s\n:\n[ 1 ]\n\n\nEmployment Type\n:\n\nFull Time\n\n\n\nJob Location\n:\n\nGairidhara, Kathmandu\n\n\n\nOffered Salary\n:\n\nNegotiable\n\n\n\nApply Before(Deadline)\n:\nNov. 12, 2020 23:55\n(3 weeks, 6 days from now)\n\n\n\n\n\n\n\n\n\n\n\nJob Specification\n\n\n\nEducation Level\n:\n\nBachelor\n\n\n\nExperience Required\n:\n\nMore than or equals to 1 year\n\n\n\nProfessional Skill Required\n:\n\n\nWireframing And Ui Prototyping\nVisual Communication\nInteraction Design\nUx Research\nAnalytics\n\n\n\n\n\n\nOther Specification\n\n\nUp-to-date knowledge of design software like Adobe,\nIllustrator and PhotoshopKnowledge of wireframe tools (e.g. Figma, Sketch, XD,\nWireframe.cc and InVision)Knowledge of design language like CSS, Android XML\nlayoutCompany Benefits:Medical, accidental, OPD and COVID-19 insurance schemeFree Lunch at officeCompetitive salary packages to the deserving candidatesAttractive incentives and bonusesA friendly, competitive and creative working environment with higher level of exposure to the top corporate housesPaid leaves in compliance with the labor laws to maintain the healthy work life balance of employeesLoan program facility in case of financial emergency with zero interestConveyance allowance scheme that covers day to day transportation costTechnology allowance program for the employees who prefer using their own laptops\n\n\n\n\n\n\n\n\n\n\n\nJob Description\n\nGather and evaluate user requirements in collaboration with Managersllustrate design ideas using storyboards, process flows and sitemapsDesign graphic user interface elements, like menus, tabs and widgetsDevelop UI mockups and prototypes that clearly illustrate how sites function and look likeCreate original graphic designs (e.g. images, sketches and tables)Prepare and present rough drafts to internal teamsIdentify and troubleshoot UX problems (e.g. responsiveness)Conduct layout adjustments based on user feedbackAdhere to style standards on fonts, colors and images\n\n\n\n\n\n\n\n\nAPPLY NOW",
        "Page_URL": "https://merojob.com/uiux-designer-53/"
    },
    {
        "name": "Data Manager",
        "company": "HLE Nepal",
        "logo": "https://merojob.com/media/uploads/job_logo/67c5f694-b85b-47ef-9759-9d8d1e1fcca3.jpg",
        "level": "Senior Level",
        "vacancy": "1",
        "time": "Full Time",
        "address": "Jawalakhel, Lalitpur, Nepal",
        "salary": "Negotiable",
        "deadline": "Oct. 28, 2020 23:55\n(1 week, 5 days from now)",
        "education": "Bachelor",
        "experience": "More than or equals to 3 years",
        "skills": "Data Analysis\nTime Management\nMultitasking\n Communication\nMs Office",
        "skills2": "Data Analysis\nTime Management\nMultitasking\n Communication\nMs Office",
        "desc5": "BSc/BA in Computer Science, Engineering or relevant field; graduate degree in Data Science or other quantitative field is preferred",
        "desc4": "3+ years as Data Analyst/ Data Scientist",
        "desc": "Extensive background in data mining and statistical analysisKnowledge of customer journey models and customer segmentationExperience with analysis problem-solving and interpreting financial, customer, third party dataAdvanced data/insights interpretation skillsKnowledge of a variety of machine learning techniques (clustering, decision tree learning, artificial neural networks, etc.) and their real-world advantages/drawbacksKnowledge of advanced statistical techniques and concepts (regression, properties of distributions, statistical tests and proper usage, etc.) and experience with applicationsExperience in stakeholder analysisExcellent communication skills, both written and verbalSuperior public presentation skillsUnderstanding of networks, databases and other technology Advanced Excel skillsAble to work with minimum supervisionAbility to work under pressureDriven and a strong desire to learnTeam player",
        "desc1": "The role of the Data Manager at Home Loan Experts (HLE) is to initially serve as a liaison between the marketing team and the broader HLE management team to develop and deliver world-class data customer/industry/opportunity insights that will improve customer profitability, customer targeting, internal processes, staff efficiencies and customer experience.Primary duties:Work with HLE business leaders (Senior Digital Marketing Manager, Digital Marketing Manager, CEO, Founder, GM Broking, Tech Team Manager) to understand the business needs for data and translate them into decision-ready user metricsMap and optimize the customer journey data flowIdentify valuable data sources and automate collection processesDeliver and implement a data strategy, (including managing/ prioritizing data and business intelligence requests) and converting them into clearly defined projects with well-defined parameters and deliverablesAnalyze large amounts of information to discover trends and patternsUndertake preprocessing of structured and unstructured dataDevelop custom data models and algorithms to apply to data setsBuild customer propensity models and machine learning algorithmsUse predictive modelling to increase and optimize customer experiences, revenue generation, marketing targeting and other business outcomesBuild and implement advanced machine learning algorithmsImplement regression models, simulations, scenario analysis, clustering, decision trees, neural networks, etc.to design the optimal data architecture for HLEDevelop processes and tools to monitor and analyze model performance and data accuracyResearch, acquire and apply mortgage industry knowledge to influence product design decisionsSecondary duties:Document business processes and propose innovative improvementsDevelop a clear definition and acceptance criteria for each of the features to ensure the business requirements will be addressedEnsure team activities are aligned with project objectives and stakeholders expectationsProvide regular updates to key stakeholdersAny other relevant duties as required from time to timeThe Benefits of Joining us!Get to work with one of our top outsourcing partnersA secure long-term rolePaid annual leave and sick leavePaid maternal and parental leavesA 5-day work week except for 1 Sunday of the monthAn environment that values continuous learning and developmentOffice-sponsored daily breakfasts and other benefitsRecreation room to unwind and chill!Parties and events – we want you to have some fun at work!Accident and health insurance for you and your two family membersOffice sponsored 'Employee Assistance Program' Work Hours: 8:00 am to 4:00 pm,  (including 1-hour lunch break)Note:  The detailed Position description will be discussed during the virtual interview. Applying Procedure:Sounds like an opportunity for you? Send us your resume and cover letter to recruitment@homeloanexperts.com.au with the subject line \"Career: Data Manager\", addressing all the essential requirements. Visit hlenepal.com.np and homeloanexperts.com.au to know more about us!Due to the high volume of applications received, we regret that only short-listed candidates will be contacted. Also note that we are working from home currently due to the Covid-19 lockdown, and will continue to do so in the coming months. ",
        "desc2": "Qualification:BSc/BA in Computer Science, Engineering or relevant field; graduate degree in Data Science or other quantitative field is preferredExperience:3+ years as Data Analyst/ Data ScientistSkills:Extensive background in data mining and statistical analysisKnowledge of customer journey models and customer segmentationExperience with analysis problem-solving and interpreting financial, customer, third party dataAdvanced data/insights interpretation skillsKnowledge of a variety of machine learning techniques (clustering, decision tree learning, artificial neural networks, etc.) and their real-world advantages/drawbacksKnowledge of advanced statistical techniques and concepts (regression, properties of distributions, statistical tests and proper usage, etc.) and experience with applicationsExperience in stakeholder analysisExcellent communication skills, both written and verbalSuperior public presentation skillsUnderstanding of networks, databases and other technology Advanced Excel skillsAble to work with minimum supervisionAbility to work under pressureDriven and a strong desire to learnTeam playerDesirable Skills & Experience:Advanced experience on R, Python, SQL, Google analytics and Tableau,Project managementSkills :Data visualisationProgramming skills",
        "desc3": "Basic Job Information\n\n\n\nJob Category\n:\n\nIT & Telecommunication\n > Business Analyst, Data Warehousing\n\n\n\nJob Level\n:\n\nSenior Level\n\n\n\nNo. of Vacancy/s\n:\n[ 1 ]\n\n\nEmployment Type\n:\n\nFull Time\n\n\n\nJob Location\n:\n\nJawalakhel, Lalitpur, Nepal\n\n\n\nOffered Salary\n:\n\nNegotiable\n\n\n\nApply Before(Deadline)\n:\nOct. 28, 2020 23:55\n(1 week, 5 days from now)\n\n\n\n\n\n\n\n\n\n\n\nJob Specification\n\n\n\nEducation Level\n:\n\nBachelor\n\n\n\nExperience Required\n:\n\nMore than or equals to 3 years\n\n\n\nProfessional Skill Required\n:\n\n\nData Analysis\nTime Management\nMultitasking\n Communication\nMs Office\n\n\n\n\n\n\nOther Specification\n\n\nQualification:BSc/BA in Computer Science, Engineering or relevant field; graduate degree in Data Science or other quantitative field is preferredExperience:3+ years as Data Analyst/ Data ScientistSkills:Extensive background in data mining and statistical analysisKnowledge of customer journey models and customer segmentationExperience with analysis problem-solving and interpreting financial, customer, third party dataAdvanced data/insights interpretation skillsKnowledge of a variety of machine learning techniques (clustering, decision tree learning, artificial neural networks, etc.) and their real-world advantages/drawbacksKnowledge of advanced statistical techniques and concepts (regression, properties of distributions, statistical tests and proper usage, etc.) and experience with applicationsExperience in stakeholder analysisExcellent communication skills, both written and verbalSuperior public presentation skillsUnderstanding of networks, databases and other technology Advanced Excel skillsAble to work with minimum supervisionAbility to work under pressureDriven and a strong desire to learnTeam playerDesirable Skills & Experience:Advanced experience on R, Python, SQL, Google analytics and Tableau,Project managementSkills :Data visualisationProgramming skills\n\n\n\n\n\n\n\n\n\n\n\nJob Description\n\nThe role of the Data Manager at Home Loan Experts (HLE) is to initially serve as a liaison between the marketing team and the broader HLE management team to develop and deliver world-class data customer/industry/opportunity insights that will improve customer profitability, customer targeting, internal processes, staff efficiencies and customer experience.Primary duties:Work with HLE business leaders (Senior Digital Marketing Manager, Digital Marketing Manager, CEO, Founder, GM Broking, Tech Team Manager) to understand the business needs for data and translate them into decision-ready user metricsMap and optimize the customer journey data flowIdentify valuable data sources and automate collection processesDeliver and implement a data strategy, (including managing/ prioritizing data and business intelligence requests) and converting them into clearly defined projects with well-defined parameters and deliverablesAnalyze large amounts of information to discover trends and patternsUndertake preprocessing of structured and unstructured dataDevelop custom data models and algorithms to apply to data setsBuild customer propensity models and machine learning algorithmsUse predictive modelling to increase and optimize customer experiences, revenue generation, marketing targeting and other business outcomesBuild and implement advanced machine learning algorithmsImplement regression models, simulations, scenario analysis, clustering, decision trees, neural networks, etc.to design the optimal data architecture for HLEDevelop processes and tools to monitor and analyze model performance and data accuracyResearch, acquire and apply mortgage industry knowledge to influence product design decisionsSecondary duties:Document business processes and propose innovative improvementsDevelop a clear definition and acceptance criteria for each of the features to ensure the business requirements will be addressedEnsure team activities are aligned with project objectives and stakeholders expectationsProvide regular updates to key stakeholdersAny other relevant duties as required from time to timeThe Benefits of Joining us!Get to work with one of our top outsourcing partnersA secure long-term rolePaid annual leave and sick leavePaid maternal and parental leavesA 5-day work week except for 1 Sunday of the monthAn environment that values continuous learning and developmentOffice-sponsored daily breakfasts and other benefitsRecreation room to unwind and chill!Parties and events – we want you to have some fun at work!Accident and health insurance for you and your two family membersOffice sponsored 'Employee Assistance Program' Work Hours: 8:00 am to 4:00 pm,  (including 1-hour lunch break)Note:  The detailed Position description will be discussed during the virtual interview. Applying Procedure:Sounds like an opportunity for you? Send us your resume and cover letter to recruitment@homeloanexperts.com.au with the subject line \"Career: Data Manager\", addressing all the essential requirements. Visit hlenepal.com.np and homeloanexperts.com.au to know more about us!Due to the high volume of applications received, we regret that only short-listed candidates will be contacted. Also note that we are working from home currently due to the Covid-19 lockdown, and will continue to do so in the coming months. \n\n\n\n\n\n\n\n\nAPPLY NOW",
        "Page_URL": "https://merojob.com/data-manager/"
    },
    {
        "name": "Business Intelligence",
        "company": "Safalsathi Incorporate Pvt. Ltd.",
        "logo": "https://merojob.com/media/uploads/job_logo/ab81f7f4-6f0a-42f3-9221-63a5c09c8ca6.jpg",
        "level": "Mid Level",
        "vacancy": "1",
        "time": "Full Time",
        "address": "Kathmandu, Nepal",
        "salary": "Negotiable",
        "deadline": "Nov. 13, 2020 23:55\n(4 weeks from now)",
        "education": "Bachelor",
        "experience": "Less than 1 year",
        "skills": "Problem Solving\nExcel\nAnalytical\nCommunication",
        "skills2": "Problem Solving\nExcel\nAnalytical\nCommunication",
        "desc5": "Bachelor’s degree in Information Technology, Computer Science, Engineer or related discipline preferred 6 months to 1 year of work experience with proven ability to manage multiple complex projects and clients under tight deadlines High proficiency in Excel; experience with the latest BI features in Excel Strong SQL skills Background in analytics or statistics preferred Must be intellectually curious—innately driven to ask questions and dive into the details and obsessed with problem solving and finding efficiencies to help grow an ever- changing business Excellent Verbal and Written English skills",
        "desc4": "",
        "desc": "",
        "desc1": "Interpret massive quantitative data, analyze results using statistical techniques and provide ongoing reports Identify trends or patterns in complex data sets Conduct full analytical life cycle activities which include data gathering, data extraction, analysis, and presentation of results Identify and resolve issues systematically and collect feedback for further modification Filter and clean data, and review reports, and performance indicators to locate and correct problem ",
        "desc2": "Bachelor’s degree in Information Technology, Computer Science, Engineer or related discipline preferred 6 months to 1 year of work experience with proven ability to manage multiple complex projects and clients under tight deadlines High proficiency in Excel; experience with the latest BI features in Excel Strong SQL skills Background in analytics or statistics preferred Must be intellectually curious—innately driven to ask questions and dive into the details and obsessed with problem solving and finding efficiencies to help grow an ever- changing business Excellent Verbal and Written English skills",
        "desc3": "Basic Job Information\n\n\n\nJob Category\n:\n\nIT & Telecommunication\n\n\n\nJob Level\n:\n\nMid Level\n\n\n\nNo. of Vacancy/s\n:\n[ 1 ]\n\n\nEmployment Type\n:\n\nFull Time\n\n\n\nJob Location\n :\n\nKathmandu, Nepal\n\n\n\nOffered Salary\n:\n\nNegotiable\n\n\n\nApply Before(Deadline)\n:\nNov. 13, 2020 23:55\n(4 weeks from now)\n\n\n\n\n\n\n\n\n\n\n\nJob Specification\n\n\n\nEducation Level\n:\n\nBachelor\n\n\n\nExperience Required\n:\n\nLess than 1 year\n\n\n\nProfessional Skill Required\n:\n\n\nProblem Solving\nExcel\nAnalytical\nCommunication\n\n\n \n\n\n\nOther Specification\n\n\nBachelor’s degree in Information Technology, Computer Science, Engineer or related discipline preferred 6 months to 1 year of work experience with proven ability to manage multiple complex projects and clients under tight deadlines High proficiency in Excel; experience with the latest BI features in Excel Strong SQL skills Background in analytics or statistics preferred Must be intellectually curious—innately driven to ask questions and dive into the details and obsessed with problem solving and finding efficiencies to help grow an ever- changing business Excellent Verbal and Written English skills\n\n\n\n\n\n\n\n\n\n\n\nJob Description\n\nInterpret massive quantitative data, analyze results using statistical techniques and provide ongoing reports Identify trends or patterns in complex data sets Conduct full analytical life cycle activities which include data gathering, data extraction, analysis, and presentation of results Identify and resolve issues systematically and collect feedback for further modification Filter and clean data, and review reports, and performance indicators to locate and correct problem \n\n\n\n\n\n\n\n\nAPPLY NOW",
        "Page_URL": "https://merojob.com/business-intelligence-3/"
    },
    {
        "name": "Content Writer (Commercial)",
        "company": "Safalsathi Incorporate Pvt. Ltd.",
        "logo": "https://merojob.com/media/uploads/job_logo/12eb6449-e905-4c0c-9927-dc3df92f6cbf.jpg",
        "level": "Mid Level",
        "vacancy": "1",
        "time": "Full Time",
        "address": "Kathmandu, Nepal",
        "salary": "Negotiable",
        "deadline": "Nov. 13, 2020 23:55\n(4 weeks from now)",
        "education": "Bachelor",
        "experience": "More than or equals to 2 years",
        "skills": "Organizational\nMs Office\nCommunication\nSearch Engine Optimization (Seo)",
        "skills2": "Organizational\nMs Office\nCommunication\nSearch Engine Optimization (Seo)",
        "desc5": "Proficiency in English and Nepali writing with experience in translation, proofreading and subtitlingExperience in producing copy for digital, print and broadcast channels.Understanding of SEO concepts preferredExceptional skill with the nuances of social media writing, including the use of hashtags, emoji’s and acronymsProficiency with Microsoft Office software, including Word, Excel, PowerPointA collaborative work ethic and easy-going natureAbility to take constructive criticism with ease and graceExperienced at multi-tasking and is not intimidated by the thought of juggling multiple projects and tasks at onceAbility to collaborate across all teams and can own projects from start to finishExcellent organizational, verbal and written communication skills",
        "desc4": "",
        "desc": "",
        "desc1": "Write original, high- engagement contents that reflects our brand’s voice in various mediums such as for advertisements, media releases, corporate releases, videos, blogs, social media etcCollaborate with Marketing, PR and Customer Service to develop a variety of contentsPrepare and publish articles that describe the company and productsShape language and tone used in sales emails, banners and brochuresLiaise with designers to enrich text with visual aids like images and chartsProduce error-free content that adheres to the company’s style guidelinesSimultaneously manage multiple projects with short deadlines",
        "desc2": "Knowledge, Skills and Ability:Proficiency in English and Nepali writing with experience in translation, proofreading and subtitlingExperience in producing copy for digital, print and broadcast channels.Understanding of SEO concepts preferredExceptional skill with the nuances of social media writing, including the use of hashtags, emoji’s and acronymsProficiency with Microsoft Office software, including Word, Excel, PowerPointA collaborative work ethic and easy-going natureAbility to take constructive criticism with ease and graceExperienced at multi-tasking and is not intimidated by the thought of juggling multiple projects and tasks at onceAbility to collaborate across all teams and can own projects from start to finishExcellent organizational, verbal and written communication skills",
        "desc3": "Basic Job Information\n\n\n\nJob Category\n:\n\nIT & Telecommunication\n > Content Developer\n\n\n\nJob Level\n:\n\nMid Level\n\n\n\nNo. of Vacancy/s\n:\n[ 1 ]\n\n\nEmployment Type\n:\n\nFull Time\n\n\n\n\nJob Location\n:\n\nKathmandu, Nepal\n\n\n\nOffered Salary\n:\n\nNegotiable\n\n\n\nApply Before(Deadline)\n:\nNov. 13, 2020 23:55\n(4 weeks from now)\n\n\n\n\n\n\n\n\n\n\n\nJob Specification\n\n\n\nEducation Level\n:\n\nBachelor\n\n\n\nExperience Required\n:\n\nMore than or equals to 2 years\n\n\n\nProfessional Skill Required\n:\n\n\nOrganizational\nMs Office\nCommunication\nSearch Engine Optimization (Seo)\n\n\n\n\n\n\nOther Specification\n\n\nKnowledge, Skills and Ability:Proficiency in English and Nepali writing with experience in translation, proofreading and subtitlingExperience in producing copy for digital, print and broadcast channels.Understanding of SEO concepts preferredExceptional skill with the nuances of social media writing, including the use of hashtags, emoji’s and acronymsProficiency with Microsoft Office software, including Word, Excel, PowerPointA collaborative work ethic and easy-going natureAbility to take constructive criticism with ease and graceExperienced at multi-tasking and is not intimidated by the thought of juggling multiple projects and tasks at onceAbility to collaborate across all teams and can own projects from start to finishExcellent organizational, verbal and written communication skills\n\n\n\n\n\n\n\n\n\n\n\nJob Description\n\nWrite original, high- engagement contents that reflects our brand’s voice in various mediums such as for advertisements, media releases, corporate releases, videos, blogs, social media etcCollaborate with Marketing, PR and Customer Service to develop a variety of contentsPrepare and publish articles that describe the company and productsShape language and tone used in sales emails, banners and brochuresLiaise with designers to enrich text with visual aids like images and chartsProduce error-free content that adheres to the company’s style guidelinesSimultaneously manage multiple projects with short deadlines\n\n\n\n\n\n\n\n\nAPPLY NOW",
        "Page_URL": "https://merojob.com/content-writer-commercial/"
    },
    {
        "name": "React Web Developer",
        "company": "Youth Innovation Lab",
        "logo": "https://merojob.com/media/uploads/job_logo/b27271bf-fd3f-4869-9cf6-0fea96095c01.jpg",
        "level": "Mid Level",
        "vacancy": "1",
        "time": "Full Time",
        "address": "Bishalnagar/ Work from home available.",
        "salary": "Negotiable",
        "deadline": "Nov. 14, 2020 23:55\n(4 weeks, 1 day from now)",
        "education": "Bachelor",
        "experience": "More than or equals to 2 years",
        "skills": "Javascript\nReact Js\nDebugging",
        "skills2": "Javascript\nReact Js\nDebugging",
        "desc5": "Minimum 2 years of experience in JavaScript / React JS TechnologyExperience with user interface designHands-on experience on working with Mapbox GL JS and Mapbox studio is a mustProficient in React and React state management through both Context API and ReduxUnderstanding of Typescript and its implementation in React projectsExperience working with webpack bundler, Babel, ESLintHaving Knowledge of Jest, Recharts and D3 is a plus pointSome experience with version control tool like GitA good understanding of REST APICapable of writing clean and reusable components with re-usability in mindRock solid at working with third-party dependencies and debugging dependency conflicts",
        "desc4": "",
        "desc": "",
        "desc1": "Passion for programming in general, rather than a specific languageAbility to learn new, emerging technologiesCommunicate with the technical team, express ideas, and collaborate with the team throughout the design and development processesWriting application interface codes using JavaScript following React.js workflowsPossess strong troubleshooting, code optimization and refactoring skillsDeveloping and implementing front-end architecture to support user interface conceptsDocumenting application changes and developing updatesApplying Procedure:Applicants are requested to drop their CV and cover letter in mentioned mail:  srijan@youthinnovationlab.org",
        "desc2": "Minimum 2 years of experience in JavaScript / React JS TechnologyExperience with user interface designHands-on experience on working with Mapbox GL JS and Mapbox studio is a mustProficient in React and React state management through both Context API and ReduxUnderstanding of Typescript and its implementation in React projectsExperience working with webpack bundler, Babel, ESLintHaving Knowledge of Jest, Recharts and D3 is a plus pointSome experience with version control tool like GitA good understanding of REST APICapable of writing clean and reusable components with re-usability in mindRock solid at working with third-party dependencies and debugging dependency conflicts",
        "desc3": "Basic Job Information\n\n\n\nJob Category\n:\n\nIT & Telecommunication\n\n\n\nJob Level\n:\n\nMid Level\n\n\n\nNo. of Vacancy/s\n:\n[ 1 ]\n\n\nEmployment Type\n:\n\nFull Time\n\n\n\nJob Location\n:\n\nBishalnagar/ Work from home available.\n\n\n\nOffered Salary\n:\n\nNegotiable\n\n\n\nApply Before(Deadline)\n:\nNov. 14, 2020 23:55\n(4 weeks, 1 day from now)\n\n\n\n\n\n\n\n\n\n\n\nJob Specification\n\n\n\nEducation Level\n:\n\nBachelor\n\n\n\nExperience Required\n:\n\nMore than or equals to 2 years\n\n\n\nProfessional Skill Required\n:\n\n\nJavascript\nReact Js\nDebugging\n\n\n\n\n\n\nOther Specification\n\n\nMinimum 2 years of experience in JavaScript / React JS TechnologyExperience with user interface designHands-on experience on working with Mapbox GL JS and Mapbox studio is a mustProficient in React and React state management through both Context API and ReduxUnderstanding of Typescript and its implementation in React projectsExperience working with webpack bundler, Babel, ESLintHaving Knowledge of Jest, Recharts and D3 is a plus pointSome experience with version control tool like GitA good understanding of REST APICapable of writing clean and reusable components with re-usability in mindRock solid at working with third-party dependencies and debugging dependency conflicts\n\n\n\n\n\n\n\n\n\n\n\nJob Description\n\nPassion for programming in general, rather than a specific languageAbility to learn new, emerging technologiesCommunicate with the technical team, express ideas, and collaborate with the team throughout the design and development processesWriting application interface codes using JavaScript following React.js workflowsPossess strong troubleshooting, code optimization and refactoring skillsDeveloping and implementing front-end architecture to support user interface conceptsDocumenting application changes and developing updatesApplying Procedure:Applicants are requested to drop their CV and cover letter in mentioned mail:  srijan@youthinnovationlab.org\n\n\n\n\n\n\n\n\nAPPLY NOW",
        "Page_URL": "https://merojob.com/react-web-developer/"
    },
    {
        "name": "Director of Applications Development",
        "company": "",
        "logo": "",
        "level": "Top Level",
        "vacancy": "1",
        "time": "Full Time",
        "address": "Katmandu",
        "salary": "Negotiable",
        "deadline": "Oct. 20, 2020 23:55\n(4 days, 9 hours from now)",
        "education": "Bachelor",
        "experience": "More than or equals to 10 years",
        "skills": "",
        "skills2": "More than 30 years",
        "desc5": "10+ years of software development experience among which 4+ years in Unified Communications, Contact Center or Telecommunication products.5+ years of experience in engineering management and leadership positionsExperience with developing software for Microsoft Lync, Skype for Business or Teams Phone system is a plusStrong English speaking and writing skillsMS/BS CS/EE or related majorExperience with SCRUM/Agile methodologies is preferredGreat interpersonal communication and leadership skillsWeb development experience (C#, Javascript, React, PowerShell Script, Angular) is a plus",
        "desc4": "Development of apps utilizing Microsoft’s Graph APIs would be idealVoIP or Call processing - Networking protocols (SIP Protocol)Contact Center software design/implement3+ years in Cloud application experience2+ years Microsoft Azure DevOps experience",
        "desc": "",
        "desc1": "Altigen Communications, a leader in UC communications platform\nproducts, is seeking a Director of Applications Development to lead our Asia engineering\nteam and contribute to our strategic success and expansion in the global marketplace.\nThe ideal candidate will lead multiple groups of engineers to develop Azure-based\ncommunications software for Microsoft Teams. \nHe/she needs to have strong leadership and management skills, solid\ndomain expertise in telecom, networking and Microsoft based communications, along\nwith experience in the full Software Development Life Cycle.  \nResponsibilitiesManage multiple Agile development groups and provide technical guidance to EngineersArchitect, design and develop software for Altigen's leading edge UC communications solutions for Microsoft TeamsCreate Software Specifications based on customer and market requirements Manage existing product sustaining and interact with QA and Technical Support",
        "desc2": "10+ years of software development experience among which 4+ years in Unified Communications, Contact Center or Telecommunication products.5+ years of experience in engineering management and leadership positionsExperience with developing software for Microsoft Lync, Skype for Business or Teams Phone system is a plusStrong English speaking and writing skillsMS/BS CS/EE or related majorExperience with SCRUM/Agile methodologies is preferredGreat interpersonal communication and leadership skillsWeb development experience (C#, Javascript, React, PowerShell Script, Angular) is a plusExperience in multiple areas below:Development of apps utilizing Microsoft’s Graph APIs would be idealVoIP or Call processing - Networking protocols (SIP Protocol)Contact Center software design/implement3+ years in Cloud application experience2+ years Microsoft Azure DevOps experience",
        "desc3": "Basic Job Information\n\n\n\nJob Category\n:\n\nIT & Telecommunication\n > Software Architect, System Engineer (Telecommunication Network), Team Leader (Software), Technical Lead (Software), Telecommunication Engineer\n\n\n\nJob Level\n:\n\nTop Level\n\n\n\nNo. of Vacancy/s\n:\n[ 1 ]\n\n\nEmployment Type\n:\n\nFull Time\n\n\n\nJob Location\n:\n\nKatmandu\n\n\n\nOffered Salary\n:\n\nNegotiable\n \n\n\nApply Before(Deadline)\n:\nOct. 20, 2020 23:55\n(4 days, 9 hours from now)\n\n\n\n\n\n\n\n\n\n\n\nJob Specification\n\n\n\nEducation Level\n:\n\nBachelor\n\n\n\nExperience Required\n:\n\nMore than or equals to 10 years\n\n\n\nAge\n:\n\nMore than 30 years\n\n\n\nProfessional Skill Required\n:\n\n\nJavascript\nWriting\nAngular\nLeadership\nCommunication\n\n\n\n\n \n\nOther Specification\n\n\n10+ years of software development experience among which 4+ years in Unified Communications, Contact Center or Telecommunication products.5+ years of experience in engineering management and leadership positionsExperience with developing software for Microsoft Lync, Skype for Business or Teams Phone system is a plusStrong English speaking and writing skillsMS/BS CS/EE or related majorExperience with SCRUM/Agile methodologies is preferredGreat interpersonal communication and leadership skillsWeb development experience (C#, Javascript, React, PowerShell Script, Angular) is a plusExperience in multiple areas below:Development of apps utilizing Microsoft’s Graph APIs would be idealVoIP or Call processing - Networking protocols (SIP Protocol)Contact Center software design/implement3+ years in Cloud application experience2+ years Microsoft Azure DevOps experience\n\n\n\n\n\n\n\n\n\n\n\nJob Description\n\nAltigen Communications, a leader in UC communications platform\nproducts, is seeking a Director of Applications Development to lead our Asia engineering\nteam and contribute to our strategic success and expansion in the global marketplace.\nThe ideal candidate will lead multiple groups of engineers to develop Azure-based\ncommunications software for Microsoft Teams. \nHe/she needs to have strong leadership and management skills, solid\ndomain expertise in telecom, networking and Microsoft based communications, along\nwith experience in the full Software Development Life Cycle.  \nResponsibilitiesManage multiple Agile development groups and provide technical guidance to EngineersArchitect, design and develop software for Altigen's leading edge UC communications solutions for Microsoft TeamsCreate Software Specifications based on customer and market requirements Manage existing product sustaining and interact with QA and Technical Support\n\n\n\n\n\n\n\n\nAPPLY NOW",
        "Page_URL": "https://merojob.com/director-of-applications-development-2/"
    },
    {
        "name": "PHP Developer (Senior/ Mid Level)",
        "company": "",
        "logo": "",
        "level": "Senior Level",
        "vacancy": "1",
        "time": "Full Time",
        "address": "Biratnagar",
        "salary": "Negotiable",
        "deadline": "Oct. 18, 2020 23:55\n(2 days, 9 hours from now)",
        "education": "Bachelor",
        "experience": "More than 3 years",
        "skills": "Javascript\nAjax\nHtml\nMysql\nXml",
        "skills2": "Javascript\nAjax\nHtml\nMysql\nXml",
        "desc5": "Bachelor’s in Computer Science/ EngineeringExperience in building applications. Excellent knowledge of PHP, MySQL, HTML, JQuery, JavaScript, XML, AjaxIn-depth understanding of Advanced PHP, MVC Frameworks (Preferably Laravel)Proficient understanding of code versioning tools, such as GitAbility to quickly grasp new tools and technology",
        "desc4": "Able to multitask and focus on deadlines under pressureTeam playerPassionate about new technologyExcellent team-working skills, hardworking, creative and innovative",
        "desc": "",
        "desc1": "Delta Tech is seeking a PHP Developer (Senior/ Mid Level) who is an in-depth understanding of advanced PHP, MCV frameworks, and also creative and innovative. You will be working on various internal products (Our products: DeltaSalesApp, DeltaSalesCRM, DeltaRetailerApp & DeltaInventory) and external projects with different levels of complexities and challenges.Role and Responsibilities:Your responsibilities will include (but are not limited to):Build server-side applications with the latest technologies for delivering the best experience for usersBuild platforms, frameworks, APIs, libraries & automated toolsKeeping up-to-date with technologyMentoring and assigning tasks to junior web developersClient CommunicationWhat we offer:Delta Tech is looking for candidates who are loyal and plan to make a long-term commitment. In return for your loyalty we offer:Position Benefits:Competitive/ Attractive Salary (No bar for right and deserving candidate)Timely performance appraisal and salary reviewsPaid holiday & paid leavesFestive bonusGreat work cultureFlexible timings against performanceWork from home (During COVID-19 pandemic situation)",
        "desc2": "Bachelor’s in Computer Science/ EngineeringExperience in building applications. Excellent knowledge of PHP, MySQL, HTML, JQuery, JavaScript, XML, AjaxIn-depth understanding of Advanced PHP, MVC Frameworks (Preferably Laravel)Proficient understanding of code versioning tools, such as GitAbility to quickly grasp new tools and technologyYou are:Able to multitask and focus on deadlines under pressureTeam playerPassionate about new technologyExcellent team-working skills, hardworking, creative and innovative",
        "desc3": "Basic Job Information\n\n\n\nJob Category\n:\n\nIT & Telecommunication\n > Programmer/ Software Engineer, Web Developer/Web Designer\n\n\n\nJob Level\n:\n\nSenior Level\n\n\n\nNo. of Vacancy/s\n:\n[ 1 ]\n\n\nEmployment Type\n:\n\nFull Time\n\n\n\nJob Location\n:\n\nBiratnagar\n\n\n\nOffered Salary\n:\n\nNegotiable\n\n\n\nApply Before(Deadline)\n:\nOct. 18, 2020 23:55\n(2 days, 9 hours from now)\n\n\n\n\n\n\n\n\n\n\n\nJob Specification\n\n\n\nEducation Level\n:\n\nBachelor\n\n\n\nExperience Required\n:\n\nMore than 3 years\n\n\n\nProfessional Skill Required\n:\n\n\nJavascript\nAjax\nHtml\nMysql\nXml\n\n\n\n\n\n\nOther Specification\n\n\nBachelor’s in Computer Science/ EngineeringExperience in building applications. Excellent knowledge of PHP, MySQL, HTML, JQuery, JavaScript, XML, AjaxIn-depth understanding of Advanced PHP, MVC Frameworks (Preferably Laravel)Proficient understanding of code versioning tools, such as GitAbility to quickly grasp new tools and technologyYou are:Able to multitask and focus on deadlines under pressureTeam playerPassionate about new technologyExcellent team-working skills, hardworking, creative and innovative\n\n\n\n\n\n\n\n\n\n\n\nJob Description\n\nDelta Tech is seeking a PHP Developer (Senior/ Mid Level) who is an in-depth understanding of advanced PHP, MCV frameworks, and also creative and innovative. You will be working on various internal products (Our products: DeltaSalesApp, DeltaSalesCRM, DeltaRetailerApp & DeltaInventory) and external projects with different levels of complexities and challenges.Role and Responsibilities:Your responsibilities will include (but are not limited to):Build server-side applications with the latest technologies for delivering the best experience for usersBuild platforms, frameworks, APIs, libraries & automated toolsKeeping up-to-date with technologyMentoring and assigning tasks to junior web developersClient CommunicationWhat we offer:Delta Tech is looking for candidates who are loyal and plan to make a long-term commitment. In return for your loyalty we offer:Position Benefits:Competitive/ Attractive Salary (No bar for right and deserving candidate)Timely performance appraisal and salary reviewsPaid holiday & paid leavesFestive bonusGreat work cultureFlexible timings against performanceWork from home (During COVID-19 pandemic situation)\n\n\n\n\n\n\n\n\nAPPLY NOW",
        "Page_URL": "https://merojob.com/php-developer-senior-mid-level-2/"
    },
    {
        "name": "Frontend Developer",
        "company": "",
        "logo": "",
        "level": "Mid Level",
        "vacancy": "1",
        "time": "Full Time",
        "address": "Biratnagar",
        "salary": "Negotiable",
        "deadline": "Oct. 18, 2020 23:55\n(2 days, 9 hours from now)",
        "education": "Bachelor",
        "experience": "More than 1 year",
        "skills": "Css3\nHtml5\nJquery\nIllustrator\nBootstrap",
        "skills2": "Css3\nHtml5\nJquery\nIllustrator\nBootstrap",
        "desc5": "Education Level: Bachelor of IT/ BE Computer EngineeringExperience Required: More than one yearShould be proficient in HTML5, CSS3, JQuery, and Bootstrap.Should have good knowledge on UI/ UX experience and developing pixel perfect designs on the frontendShould have creative skills on graphic designing tools like Photoshop, Illustrator etcShould have knowledge of color theory and updated with trendsShould have the knowledge of wireframe, prototype, mockupShould be creative and develop new ideasShould possess good communication and interpersonal skill",
        "desc4": "Fluent in spoken and written EnglishAble to multitask and focus on deadlines under pressureTeam playerPassionate about new technologyExcellent team-working skills, hardworking, creative and innovative",
        "desc": "",
        "desc1": "Delta Tech is seeking a Frontend Developer who has proven working experience in HTML5, CSS3, JQuery and is also creative and innovative. You will be working in various internal (Our products: DeltaSalesApp, DeltaSalesCRM, DeltaRetailerApp and DeltaInventory) and external projects with different levels of complexities and challenges.Role and Responsibilities:Your responsibilities will include (but are not limited to):Understand the requirement clearly, think creatively to produce new ideas and concepts to interactive designConceptualize ideas that bring simplicity and user-friendliness to complex design roadblocksWork with internal team to design and build user-friendly forms/ applications/ interfaces based on functional specificationsWireframe new features and templates and improvements to existing functionalityBuild prototypes of new features, templates, and apps to demonstrate and test new designs.Design UI and interaction layers using best practices and the latest Web/ Mobile trendsWhat we offerDelta Tech is looking for candidates who are loyal and plan to make a long-term commitment. In return for your loyalty we offer:Position BenefitsCompetitive/ Attractive Salary (No bar for right and deserving candidate)Timely performance appraisal and salary reviewsPaid holiday & paid leavesFestive bonusGreat work cultureFlexible timings against performanceWork from home (During COVID-19 pandemic situation)",
        "desc2": "Education Level: Bachelor of IT/ BE Computer EngineeringExperience Required: More than one yearShould be proficient in HTML5, CSS3, JQuery, and Bootstrap.Should have good knowledge on UI/ UX experience and developing pixel perfect designs on the frontendShould have creative skills on graphic designing tools like Photoshop, Illustrator etcShould have knowledge of color theory and updated with trendsShould have the knowledge of wireframe, prototype, mockupShould be creative and develop new ideasShould possess good communication and interpersonal skillYou areFluent in spoken and written EnglishAble to multitask and focus on deadlines under pressureTeam playerPassionate about new technologyExcellent team-working skills, hardworking, creative and innovative",
        "desc3": "Basic Job Information\n\n\n\nJob Category\n:\n\nIT & Telecommunication\n > Graphic Designer, Web Developer/Web Designer\n\n\n\nJob Level\n:\n\nMid Level\n\n\n\nNo. of Vacancy/s\n:\n[ 1 ]\n\n\nEmployment Type\n:\n\nFull Time\n\n\n\nJob Location\n:\n\nBiratnagar\n\n\n\nOffered Salary\n:\n\nNegotiable\n\n\n\nApply Before(Deadline)\n:\nOct. 18, 2020 23:55\n(2 days, 9 hours from now)\n\n\n\n\n\n\n\n\n\n\n\n Job Specification\n\n\n\nEducation Level\n:\n\nBachelor\n\n\n\nExperience Required\n:\n\nMore than 1 year\n\n\n\nProfessional Skill Required\n:\n\n\nCss3\nHtml5\nJquery\nIllustrator\nBootstrap\n\n\n\n\n\n\nOther Specification\n\n\nEducation Level: Bachelor of IT/ BE Computer EngineeringExperience Required: More than one yearShould be proficient in HTML5, CSS3, JQuery, and Bootstrap.Should have good knowledge on UI/ UX experience and developing pixel perfect designs on the frontendShould have creative skills on graphic designing tools like Photoshop, Illustrator etcShould have knowledge of color theory and updated with trendsShould have the knowledge of wireframe, prototype, mockupShould be creative and develop new ideasShould possess good communication and interpersonal skillYou areFluent in spoken and written EnglishAble to multitask and focus on deadlines under pressureTeam playerPassionate about new technologyExcellent team-working skills, hardworking, creative and innovative\n\n\n\n\n\n\n\n\n\n\n\nJob Description\n\nDelta Tech is seeking a Frontend Developer who has proven working experience in HTML5, CSS3, JQuery and is also creative and innovative. You will be working in various internal (Our products: DeltaSalesApp, DeltaSalesCRM, DeltaRetailerApp and DeltaInventory) and external projects with different levels of complexities and challenges.Role and Responsibilities:Your responsibilities will include (but are not limited to):Understand the requirement clearly, think creatively to produce new ideas and concepts to interactive designConceptualize ideas that bring simplicity and user-friendliness to complex design roadblocksWork with internal team to design and build user-friendly forms/ applications/ interfaces based on functional specificationsWireframe new features and templates and improvements to existing functionalityBuild prototypes of new features, templates, and apps to demonstrate and test new designs.Design UI and interaction layers using best practices and the latest Web/ Mobile trendsWhat we offerDelta Tech is looking for candidates who are loyal and plan to make a long-term commitment. In return for your loyalty we offer:Position BenefitsCompetitive/ Attractive Salary (No bar for right and deserving candidate)Timely performance appraisal and salary reviewsPaid holiday & paid leavesFestive bonusGreat work cultureFlexible timings against performanceWork from home (During COVID-19 pandemic situation)\n\n\n\n\n\n\n\n\nAPPLY NOW",
        "Page_URL": "https://merojob.com/frontend-developer-89/"
    },
    {
        "name": "Lead - Software Engineer",
        "company": "",
        "logo": "",
        "level": "Senior Level",
        "vacancy": "1",
        "time": "Full Time",
        "address": "New Baneshwor",
        "salary": "Negotiable",
        "deadline": "Oct. 17, 2020 23:55\n(1 day, 9 hours from now)",
        "education": "Bachelor",
        "experience": "More than or equals to 6 years",
        "skills": "Angular 2.0\nAsp.Net\nLeadership\nMs Sql Server\nInterpersonal",
        "skills2": "Angular 2.0\nAsp.Net\nLeadership\nMs Sql Server\nInterpersonal",
        "desc5": "A minimum of 6 years of experience in software\ndevelopment and at least 3 years in leadership roles\nMinimum of Bachelor’s degree in a computer related field, or equivalent work experience, MBA is a plus",
        "desc4": "A clear understanding of Typescript, JavaScript\n(ES6+) and Angular 2+\nASP.Net Core, ASP.Net Core Web API\nMS SQL Server with a very heavy focus on a\nstored procedure\nHTML/ CSS (Angular Material, Bootstrap 4.0, Sass\nLead and participate in the technical discussion\nto propose an ideal solution\nContribute to the technical\ndirection and innovation process within the software department\nAgile development processes within\nproject lifecycle constraints\nManage the performance of team members and mentor\nmore junior members\nAbility to handle multiple priorities in a\nresults-oriented environment, continuing to deliver quality service and consistently\nmeet deadlines",
        "desc": "",
        "desc1": "Design, develop and modify modules based\non functional and system requirements.Work closely with Business Analyst and\nProduct Owner for understanding the functional and system requirements.Manage daily scrum meetings and sprint\nplanning.Translate\nclients’ business requirements and objectives into technical applications and\nsolutions. Manage the Architecture Team to ensure\narchitectural integrity and product quality.Adhere to high-quality development\nprinciples while delivering solutions on-time and on-budget.Develop, refine, and tune integrations\nbetween applications.Run and participate in the peer-reviews of\nsolution designs and related code.Ability to develop unit testing of code\ncomponents or complete applications.Package and support deployment of\nreleases.Design,\ndevelop and implement new integration. Execute\nsystem development and maintenance activities. Responsible for the performance and\nresults of a department.As a leader responsible for deploying\nresources, performance evaluation, pay reviews, and other related decisions.Benefits:In addition to\nthe dynamic and professional environment at Aqore Software, we strive to ensure\nthat our employees have access to a competitive and valuable set of Total\nRewards—the mix of both monetary and non-monetary rewards provided to you in\nrecognition for your time, talents, efforts, and results.",
        "desc2": "A minimum of 6 years of experience in software\ndevelopment and at least 3 years in leadership roles\nMinimum of Bachelor’s degree in a computer related field, or equivalent work experience, MBA is a plusRequired Skills\nA clear understanding of Typescript, JavaScript\n(ES6+) and Angular 2+\nASP.Net Core, ASP.Net Core Web API\nMS SQL Server with a very heavy focus on a\nstored procedure\nHTML/ CSS (Angular Material, Bootstrap 4.0, Sass\nLead and participate in the technical discussion\nto propose an ideal solution\nContribute to the technical\ndirection and innovation process within the software department\nAgile development processes within\nproject lifecycle constraints\nManage the performance of team members and mentor\nmore junior members\nAbility to handle multiple priorities in a\nresults-oriented environment, continuing to deliver quality service and consistently\nmeet deadlines",
        "desc3": "Basic Job Information\n\n\n\nJob Category\n:\n\nIT & Telecommunication\n > Team Leader (Software)\n\n\n\nJob Level\n:\n\nSenior Level\n\n\n\nNo. of Vacancy/s\n:\n[ 1 ]\n\n\nEmployment Type\n:\n\nFull Time\n\n\n\nJob Location\n:\n\nNew Baneshwor\n\n\n\n Offered Salary\n:\n\nNegotiable\n\n\n\nApply Before(Deadline)\n:\nOct. 17, 2020 23:55\n(1 day, 9 hours from now)\n\n\n\n\n\n\n\n\n\n\n\nJob Specification\n\n\n\nEducation Level\n:\n\nBachelor\n\n\n\nExperience Required\n:\n\nMore than or equals to 6 years\n\n\n\nProfessional Skill Required\n:\n\n\nAngular 2.0\nAsp.Net\nLeadership\nMs Sql Server\nInterpersonal\n\n\n\n\n\n\nOther Specification\n\n\n\nA minimum of 6 years of experience in software\ndevelopment and at least 3 years in leadership roles\nMinimum of Bachelor’s degree in a computer related field, or equivalent work experience, MBA is a plusRequired Skills\nA clear understanding of Typescript, JavaScript\n(ES6+) and Angular 2+\nASP.Net Core, ASP.Net Core Web API\nMS SQL Server with a very heavy focus on a\nstored procedure\nHTML/ CSS (Angular Material, Bootstrap 4.0, Sass\nLead and participate in the technical discussion\nto propose an ideal solution\nContribute to the technical\ndirection and innovation process within the software department\nAgile development processes within\nproject lifecycle constraints\nManage the performance of team members and mentor\nmore junior members\nAbility to handle multiple priorities in a\nresults-oriented environment, continuing to deliver quality service and consistently\nmeet deadlines\n\n\n\n\n\n\n\n\n\n\n\n\nJob Description\n\nDesign, develop and modify modules based\non functional and system requirements.Work closely with Business Analyst and\nProduct Owner for understanding the functional and system requirements.Manage daily scrum meetings and sprint\nplanning.Translate\nclients’ business requirements and objectives into technical applications and\nsolutions. Manage the Architecture Team to ensure\narchitectural integrity and product quality.Adhere to high-quality development\nprinciples while delivering solutions on-time and on-budget.Develop, refine, and tune integrations\nbetween applications.Run and participate in the peer-reviews of\nsolution designs and related code.Ability to develop unit testing of code\ncomponents or complete applications.Package and support deployment of\nreleases.Design,\ndevelop and implement new integration. Execute\nsystem development and maintenance activities. Responsible for the performance and\nresults of a department.As a leader responsible for deploying\nresources, performance evaluation, pay reviews, and other related decisions.Benefits:In addition to\nthe dynamic and professional environment at Aqore Software, we strive to ensure\nthat our employees have access to a competitive and valuable set of Total\nRewards—the mix of both monetary and non-monetary rewards provided to you in\nrecognition for your time, talents, efforts, and results.\n\n\n\n\n\n\n\n\nAPPLY NOW",
        "Page_URL": "https://merojob.com/lead-software-engineer-5/"
    },
    {
        "name": "Content Writer",
        "company": "",
        "logo": "",
        "level": "Entry Level",
        "vacancy": "1",
        "time": "Freelance",
        "address": "Kathmandu",
        "salary": "Negotiable",
        "deadline": "Oct. 19, 2020 23:55\n(3 days, 9 hours from now)",
        "education": "Bachelor",
        "experience": "More than or equals to 1 year",
        "skills": "Market Research\nAnalytical\nCreative Thinking",
        "skills2": "Market Research\nAnalytical\nCreative Thinking",
        "desc5": "Creative writing/content writingAnalyze the content and provide a summarized reviewCreative approach along with good editing skillsStrong skills to analyze and research on the topic for content developmentResearching the subject, acquiring important materials from online and formulating the articleWriting in own style and avoiding plagiarism is the most",
        "desc4": "",
        "desc": "",
        "desc1": "Ability to write good content regarding Health in EnglishResearch industry-related topics (combining online sources, interviews and studies)Write clear marketing copy to promote our products/servicesPrepare well-structured drafts using Content Management SystemsPromote content on social media",
        "desc2": "Creative writing/content writingAnalyze the content and provide a summarized reviewCreative approach along with good editing skillsStrong skills to analyze and research on the topic for content developmentResearching the subject, acquiring important materials from online and formulating the articleWriting in own style and avoiding plagiarism is the most",
        "desc3": "Basic Job Information\n\n\n\nJob Category\n:\n\nIT & Telecommunication\n\n\n\nJob Level\n:\n\nEntry Level\n\n\n\nNo. of Vacancy/s\n:\n[ 1 ]\n\n\nEmployment Type\n:\n\nFreelance\n\n\n\nJob Location\n:\n\nKathmandu\n\n\n\nOffered Salary\n:\n\nNegotiable\n\n\n\nApply Before(Deadline)\n:\nOct. 19, 2020 23:55\n(3 days, 9 hours from now)\n\n\n\n \n\n\n\n\n\n\n\nJob Specification\n\n\n\nEducation Level\n:\n\nBachelor\n\n\n\nExperience Required\n:\n\nMore than or equals to 1 year\n\n\n\nProfessional Skill Required\n:\n\n\nMarket Research\nAnalytical\nCreative Thinking\n\n\n\n\n\n\nOther Specification\n\n\nCreative writing/content writingAnalyze the content and provide a summarized reviewCreative approach along with good editing skillsStrong skills to analyze and research on the topic for content developmentResearching the subject, acquiring important materials from online and formulating the articleWriting in own style and avoiding plagiarism is the most\n\n\n\n\n\n\n\n\n\n\n\nJob Description\n\nAbility to write good content regarding Health in EnglishResearch industry-related topics (combining online sources, interviews and studies)Write clear marketing copy to promote our products/servicesPrepare well-structured drafts using Content Management SystemsPromote content on social media\n\n\n\n\n\n\n\n\nAPPLY NOW",
        "Page_URL": "https://merojob.com/content-writer-301/"
    },
    {
        "name": "Node - React Developer",
        "company": "",
        "logo": "",
        "level": "Mid Level",
        "vacancy": "2",
        "time": "Full Time",
        "address": "Tinkune",
        "salary": "NRs. 40,000.00 Monthly",
        "deadline": "Oct. 16, 2020 23:55\n(9 hours from now)",
        "education": "Bachelor",
        "experience": "More than 1 year",
        "skills": "Time Management\nWeb Development\nProject Management\nDatabase Management",
        "skills2": "Time Management\nWeb Development\nProject Management\nDatabase Management",
        "desc5": "Strong proficiency in JavaScript, including DOM manipulation and the JavaScript object modelThorough understanding of React.js and its core principlesAbility to understand business requirements and translate them into technical requirementsVery Good knowledge of node, express js, posgreSQLFast to grasp new technologiesTime management skillsEasy on understanding existing project",
        "desc4": "",
        "desc": "",
        "desc1": "Developing new user-facing features using React.jsBuilding reusable components and front-end libraries for future useTranslating designs and wireframes into high quality code",
        "desc2": "Strong proficiency in JavaScript, including DOM manipulation and the JavaScript object modelThorough understanding of React.js and its core principlesAbility to understand business requirements and translate them into technical requirementsVery Good knowledge of node, express js, posgreSQLFast to grasp new technologiesTime management skillsEasy on understanding existing project",
        "desc3": "Basic Job Information\n\n\n\nJob Category\n:\n\nIT & Telecommunication\n > Programmer/ Software Engineer, Web Developer/Web Designer\n\n\n\nJob Level\n:\n\nMid Level\n\n\n\nNo. of Vacancy/s\n:\n[ 2 ]\n\n\nEmployment Type\n:\n\nFull Time\n\n\n\nJob Location\n:\n\nTinkune\n\n\n\n\nOffered Salary\n:\n\nNRs. 40,000.00 Monthly\n\n\n\nApply Before(Deadline)\n:\nOct. 16, 2020 23:55\n(9 hours from now)\n\n\n\n\n\n\n\n\n\n\n\nJob Specification\n\n\n\nEducation Level\n:\n\nBachelor\n\n\n\nExperience Required\n:\n\nMore than 1 year\n\n\n\nProfessional Skill Required\n:\n\n\nTime Management\nWeb Development\nProject Management\nDatabase Management\n\n\n\n\n\n\nOther Specification\n\n\nStrong proficiency in JavaScript, including DOM manipulation and the JavaScript object modelThorough understanding of React.js and its core principlesAbility to understand business requirements and translate them into technical requirementsVery Good knowledge of node, express js, posgreSQLFast to grasp new technologiesTime management skillsEasy on understanding existing project\n\n\n\n\n\n\n\n\n\n\n\nJob Description\n\nDeveloping new user-facing features using React.jsBuilding reusable components and front-end libraries for future useTranslating designs and wireframes into high quality code\n\n\n\n\n\n\n\n\nAPPLY NOW",
        "Page_URL": "https://merojob.com/node-react-developer/"
    },
    {
        "name": "Node.js Devloper",
        "company": "",
        "logo": "",
        "level": "Mid Level",
        "vacancy": "1",
        "time": "Full Time",
        "address": "Bagbazar",
        "salary": "Negotiable",
        "deadline": "Oct. 16, 2020 23:55\n(9 hours from now)",
        "education": "Intermediate",
        "experience": "More than or equals to 2 years",
        "skills": "Passion For Team Work\nNode.Js Knowledge\nInnovative\nAnalytical Problem Solver",
        "skills2": "Passion For Team Work\nNode.Js Knowledge\nInnovative\nAnalytical Problem Solver",
        "desc5": "",
        "desc4": "",
        "desc": "",
        "desc1": "Must have experience of 2+ years\nGood Javascript/Typescript knowledge Knowledge of Node.js and related frameworksGood understanding of server-side programming\nExperience with REST API\nExperience with databases: RDBMS, NoSQL Understanding of the basic programming pattern\nCreate testable, high-quality code\nExperience in React JS, experience in any kind of UI componentsWork as part of a team developing applications and services using Agile development methodsBuild customer-facing UI and back-end services for payment processing administration and managementCode, teste and operate node.js based servicesEffectively use tools and ingenuity to identify and fix defects before they become a problem",
        "desc2": "",
        "desc3": "Basic Job Information\n\n\n\nJob Category\n:\n\nIT & Telecommunication\n\n\n\nJob Level\n:\n\nMid Level\n\n\n\nNo. of Vacancy/s\n:\n[ 1 ]\n\n\nEmployment Type\n:\n\nFull Time\n\n\n\nJob Location\n:\n\nBagbazar\n\n\n\nOffered Salary\n:\n\nNegotiable\n\n\n\nApply Before(Deadline)\n:\nOct. 16, 2020 23:55\n(9 hours from now)\n\n\n\n\n\n\n\n\n\n\n\nJob Specification\n\n\n\nEducation Level\n:\n\nIntermediate\n\n\n\nExperience Required\n:\n\nMore than or equals to 2 years\n\n\n\nProfessional Skill Required\n:\n\n\nPassion For Team Work\nNode.Js Knowledge\nInnovative\nAnalytical Problem Solver\n\n\n\n\n\n\n\n\n\n\n\n\nJob Description\n\nMust have experience of 2+ years\nGood Javascript/Typescript knowledge Knowledge of Node.js and related frameworksGood understanding of server-side programming\nExperience with REST API\nExperience with databases: RDBMS, NoSQL Understanding of the basic programming pattern\nCreate testable, high-quality code\nExperience in React JS, experience in any kind of UI componentsWork as part of a team developing applications and services using Agile development methodsBuild customer-facing UI and back-end services for payment processing administration and managementCode, teste and operate node.js based servicesEffectively use tools and ingenuity to identify and fix defects before they become a problem\n\n\n\n\n\n\n\n\nAPPLY NOW",
        "Page_URL": "https://merojob.com/nodejs-devloper/"
    },
    {
        "name": "React.js Developer",
        "company": "",
        "logo": "",
        "level": "Mid Level",
        "vacancy": "1",
        "time": "Full Time",
        "address": "Baghbazar",
        "salary": "Negotiable",
        "deadline": "Oct. 16, 2020 23:55\n(9 hours from now)",
        "education": "Intermediate",
        "experience": "More than or equals to 2 years",
        "skills": "Javascript\nCss\nHtml\nReact.Js",
        "skills2": "Javascript\nCss\nHtml\nReact.Js",
        "desc5": "",
        "desc4": "",
        "desc": "",
        "desc1": "Must have experience of 2+ years Experience with state containers like Redux In-depth knowledge of JavaScript,CSS,HTML and front-end languages.Experience with user interface design.Familiarity with RESTful APIsFamiliarity with code versioning tools like Git\nExperience of testing utility like Enzyme\nExperience with browser-based debugging and performance testing software. Excellent troubleshooting skills.",
        "desc2": "",
        "desc3": "Basic Job Information\n\n\n\nJob Category\n:\n\nIT & Telecommunication\n > IT System Management, Programmer/ Software Engineer, Software Implementation\n\n\n\nJob Level\n:\n\nMid Level\n\n\n\nNo. of Vacancy/s\n:\n[ 1 ]\n\n\nEmployment Type\n:\n\nFull Time\n\n\n\nJob Location\n:\n\nBaghbazar\n\n\n\nOffered Salary\n:\n\nNegotiable\n\n\n\nApply Before(Deadline)\n:\nOct. 16, 2020 23:55\n(9 hours from now)\n\n\n\n\n\n \n\n\n\n\n\nJob Specification\n\n\n\nEducation Level\n:\n\nIntermediate\n\n\n\nExperience Required\n:\n\nMore than or equals to 2 years\n\n\n\nProfessional Skill Required\n:\n\n\nJavascript\nCss\nHtml\nReact.Js\n\n\n\n\n\n\n\n\n\n\n\n\nJob Description\n\nMust have experience of 2+ years Experience with state containers like Redux In-depth knowledge of JavaScript,CSS,HTML and front-end languages.Experience with user interface design.Familiarity with RESTful APIsFamiliarity with code versioning tools like Git\nExperience of testing utility like Enzyme\nExperience with browser-based debugging and performance testing software. Excellent troubleshooting skills.\n\n\n\n\n\n\n\n\nAPPLY NOW",
        "Page_URL": "https://merojob.com/reactjs-developer-7/"
    },
    {
        "name": "Android Developer (Mid Level)",
        "company": "",
        "logo": "",
        "level": "Mid Level",
        "vacancy": "2",
        "time": "Full Time",
        "address": "Biratnagar-02, Morang",
        "salary": "Negotiable",
        "deadline": "Oct. 31, 2020 23:55\n(2 weeks, 1 day from now)",
        "education": "Bachelor",
        "experience": "More than 1 year",
        "skills": "Remote Data Via Rest And Json\nAndroid App Development\nMobile Development Lifecycle\nAndroid Sdk\nThird-Party Libraries And Apis",
        "skills2": "Remote Data Via Rest And Json\nAndroid App Development\nMobile Development Lifecycle\nAndroid Sdk\nThird-Party Libraries And Apis",
        "desc5": "Bachelor of IT/ BE Computer EngineeringMore than one year of experienceProven software development experience and Android skills developmentProven Working Experience in Android app developmentExperience with Android SDKExperience working with Remote Data via REST and JSONExperience with third-party libraries and APIsWorking knowledge of the general mobile landscape, architecture, trends and emerging technologiesSolid understanding of the full mobile development lifecycle",
        "desc4": "Fluent in spoken and written EnglishAble to multitask and focus on deadlines under pressureTeam playerPassionate about new technologyExcellent team-working skills, hardworking, creative and innovative",
        "desc": "",
        "desc1": "Delta Tech is seeking an Android Developer (Mid Level) who is proven working experience in android app development with SDK and also creative and innovative. You will be working in various internal (Our products: DeltaSalesApp, DeltaRetailerApp, DeltaSalesCRM & DeltaInventory) and external projects with different levels of complexities and challenges.Role and Responsibilities:Your responsibilities will include (but are not limited to):Design and build advanced native applications for the Android platformCollaborate with cross-functional teams to define, design, and deliver new featuresWork with outside data sources and APIsUnit-test code for robustness, including edge cases, usability, and general reliabilityWork on bug fixing and improving application performanceContinuously discover, evaluate, and implement new technologies to maximize development efficiencyCommunicate with clients to understand his requirements and deliverWhat we offerDelta Tech is looking for candidates who are loyal and plan to make a long-term commitment. In return for your loyalty we offer:Position BenefitsCompetitive/ Attractive Salary (No bar for right and deserving candidate)Timely performance appraisal and salary reviewsPaid holiday & paid leavesFestive bonusGreat work cultureFlexible timings against performanceWork from home (During COVID-19 pandemic situation)",
        "desc2": "Bachelor of IT/ BE Computer EngineeringMore than one year of experienceProven software development experience and Android skills developmentProven Working Experience in Android app developmentExperience with Android SDKExperience working with Remote Data via REST and JSONExperience with third-party libraries and APIsWorking knowledge of the general mobile landscape, architecture, trends and emerging technologiesSolid understanding of the full mobile development lifecycleYou areFluent in spoken and written EnglishAble to multitask and focus on deadlines under pressureTeam playerPassionate about new technologyExcellent team-working skills, hardworking, creative and innovative",
        "desc3": "Basic Job Information\n\n\n\nJob Category\n:\n\nIT & Telecommunication\n > Mobile Apps, Programmer/ Software Engineer\n\n\n\nJob Level\n:\n\nMid Level\n\n\n\nNo. of Vacancy/s\n:\n[ 2 ]\n\n\nEmployment Type\n:\n\nFull Time\n\n\n\nJob Location\n:\n\nBiratnagar-02, Morang\n\n\n\nOffered Salary\n:\n\nNegotiable\n\n\n\nApply Before(Deadline)\n:\nOct. 31, 2020 23:55\n(2 weeks, 1 day from now)\n\n\n\n\n\n\n\n\n\n\n\nJob Specification\n\n\n\nEducation Level\n:\n\nBachelor\n\n\n\nExperience Required\n:\n\nMore than 1 year\n\n\n\nProfessional Skill Required\n:\n\n\nRemote Data Via Rest And Json\nAndroid App Development\nMobile Development Lifecycle\nAndroid Sdk\nThird-Party Libraries And Apis\n\n\n\n\n\n\nOther Specification\n\n\nBachelor of IT/ BE Computer EngineeringMore than one year of experienceProven software development experience and Android skills developmentProven Working Experience in Android app developmentExperience with Android SDKExperience working with Remote Data via REST and JSONExperience with third-party libraries and APIsWorking knowledge of the general mobile landscape, architecture, trends and emerging technologiesSolid understanding of the full mobile development lifecycleYou areFluent in spoken and written EnglishAble to multitask and focus on deadlines under pressureTeam playerPassionate about new technologyExcellent team-working skills, hardworking, creative and innovative\n\n\n\n\n\n\n\n\n\n\n\nJob Description\n\nDelta Tech is seeking an Android Developer (Mid Level) who is proven working experience in android app development with SDK and also creative and innovative. You will be working in various internal (Our products: DeltaSalesApp, DeltaRetailerApp, DeltaSalesCRM & DeltaInventory) and external projects with different levels of complexities and challenges.Role and Responsibilities:Your responsibilities will include (but are not limited to):Design and build advanced native applications for the Android platformCollaborate with cross-functional teams to define, design, and deliver new featuresWork with outside data sources and APIsUnit-test code for robustness, including edge cases, usability, and general reliabilityWork on bug fixing and improving application performanceContinuously discover, evaluate, and implement new technologies to maximize development efficiencyCommunicate with clients to understand his requirements and deliverWhat we offerDelta Tech is looking for candidates who are loyal and plan to make a long-term commitment. In return for your loyalty we offer:Position BenefitsCompetitive/ Attractive Salary (No bar for right and deserving candidate)Timely performance appraisal and salary reviewsPaid holiday & paid leavesFestive bonusGreat work cultureFlexible timings against performanceWork from home (During COVID-19 pandemic situation)\n\n\n\n\n\n\n\n\nAPPLY NOW",
        "Page_URL": "https://merojob.com/android-developer-mid-level-3/"
    },
    {
        "name": "Sr. Android Developer",
        "company": "",
        "logo": "",
        "level": "Senior Level",
        "vacancy": "1",
        "time": "Full Time",
        "address": "Biratnagar-02, Morang",
        "salary": "Negotiable",
        "deadline": "Oct. 31, 2020 23:55\n(2 weeks, 1 day from now)",
        "education": "Bachelor",
        "experience": "More than or equals to 3 years",
        "skills": "Remote Data Via Rest And Json\nAndroid App Development\nMobile Development Lifecycle\nAndroid Sdk\nThird-Party Libraries And Apis",
        "skills2": "Remote Data Via Rest And Json\nAndroid App Development\nMobile Development Lifecycle\nAndroid Sdk\nThird-Party Libraries And Apis",
        "desc5": "Bachelor of IT/ BE Computer EngineeringMore than or equal to 3 yearsProven software development experience and Android skills developmentProven Working Experience in Android app developmentExperience with Android SDKExperience working with Remote Data via REST and JSONExperience with third-party libraries and APIsWorking knowledge of the general mobile landscape, architecture, trends and emerging technologiesSolid understanding of the full mobile development lifecycle",
        "desc4": "Fluent in spoken and written EnglishAble to multitask and focus on deadlines under pressureTeam playerPassionate about new technologyExcellent team-working skills, hardworking, creative and innovative",
        "desc": "",
        "desc1": "Delta Tech is seeking a Senior Android Developer who is proven working experience in android app development with SDK and also creative and innovative. You will be working in various internal (Our products: DeltaSalesApp, DeltaRetailerApp, DeltaSalesCRM & DeltaInventory) and external projects with different levels of complexities and challenges.Role and Responsibilities:Your responsibilities will include (but are not limited to):Design and build advanced native applications for the Android platformCollaborate with cross-functional teams to define, design, and deliver new featuresWork with outside data sources and APIsUnit-test code for robustness, including edge cases, usability, and general reliabilityWork on bug fixing and improving application performanceContinuously discover, evaluate, and implement new technologies to maximize development efficiencyCommunicate with clients to understand his requirements and deliverWhat we offerDelta Tech is looking for candidates who are loyal and plan to make a long-term commitment. In return for your loyalty we offer:Position BenefitsCompetitive/ Attractive Salary (No bar for right and deserving candidate)Timely performance appraisal and salary reviewsPaid holiday & paid leavesFestive bonusGreat work cultureFlexible timings against performanceWork from home (During COVID-19 pandemic situation)",
        "desc2": "Bachelor of IT/ BE Computer EngineeringMore than or equal to 3 yearsProven software development experience and Android skills developmentProven Working Experience in Android app developmentExperience with Android SDKExperience working with Remote Data via REST and JSONExperience with third-party libraries and APIsWorking knowledge of the general mobile landscape, architecture, trends and emerging technologiesSolid understanding of the full mobile development lifecycleYou areFluent in spoken and written EnglishAble to multitask and focus on deadlines under pressureTeam playerPassionate about new technologyExcellent team-working skills, hardworking, creative and innovative",
        "desc3": "Basic Job Information\n\n\n\nJob Category\n:\n\nIT & Telecommunication\n > Mobile Apps, Programmer/ Software Engineer\n\n\n\nJob Level\n:\n\nSenior Level\n\n\n\nNo. of Vacancy/s\n:\n[ 1 ]\n\n\nEmployment Type\n:\n\nFull Time\n\n\n\nJob Location\n:\n\nBiratnagar-02, Morang\n\n\n\nOffered Salary\n:\n\nNegotiable\n\n\n\nApply Before(Deadline)\n:\nOct. 31, 2020 23:55\n(2 weeks, 1 day from now)\n\n\n\n\n\n\n\n\n\n\n\nJob Specification\n\n\n\nEducation Level\n:\n\nBachelor\n\n\n\nExperience Required\n:\n\nMore than or equals to 3 years\n\n\n\nProfessional Skill Required\n:\n\n\nRemote Data Via Rest And Json\nAndroid App Development\nMobile Development Lifecycle\nAndroid Sdk\nThird-Party Libraries And Apis\n\n\n\n\n\n\nOther Specification\n\n\nBachelor of IT/ BE Computer EngineeringMore than or equal to 3 yearsProven software development experience and Android skills developmentProven Working Experience in Android app developmentExperience with Android SDKExperience working with Remote Data via REST and JSONExperience with third-party libraries and APIsWorking knowledge of the general mobile landscape, architecture, trends and emerging technologiesSolid understanding of the full mobile development lifecycleYou areFluent in spoken and written EnglishAble to multitask and focus on deadlines under pressureTeam playerPassionate about new technologyExcellent team-working skills, hardworking, creative and innovative\n\n\n\n\n\n\n\n\n\n\n\nJob Description\n\nDelta Tech is seeking a Senior Android Developer who is proven working experience in android app development with SDK and also creative and innovative. You will be working in various internal (Our products: DeltaSalesApp, DeltaRetailerApp, DeltaSalesCRM & DeltaInventory) and external projects with different levels of complexities and challenges.Role and Responsibilities:Your responsibilities will include (but are not limited to):Design and build advanced native applications for the Android platformCollaborate with cross-functional teams to define, design, and deliver new featuresWork with outside data sources and APIsUnit-test code for robustness, including edge cases, usability, and general reliabilityWork on bug fixing and improving application performanceContinuously discover, evaluate, and implement new technologies to maximize development efficiencyCommunicate with clients to understand his requirements and deliverWhat we offerDelta Tech is looking for candidates who are loyal and plan to make a long-term commitment. In return for your loyalty we offer:Position BenefitsCompetitive/ Attractive Salary (No bar for right and deserving candidate)Timely performance appraisal and salary reviewsPaid holiday & paid leavesFestive bonusGreat work cultureFlexible timings against performanceWork from home (During COVID-19 pandemic situation)\n\n\n\n\n\n\n\n\nAPPLY NOW",
        "Page_URL": "https://merojob.com/sr-android-developer-16/"
    },
    {
        "name": "Technical Support Person",
        "company": "",
        "logo": "",
        "level": "Entry Level",
        "vacancy": "4",
        "time": "Internship",
        "address": "Kathmandu",
        "salary": "NRs. 10,000.00 Monthly",
        "deadline": "Oct. 22, 2020 23:55\n(6 days, 9 hours from now)",
        "education": "Bachelor",
        "experience": "Not Required",
        "skills": "",
        "skills2": "",
        "desc5": "Freshers with can-do attitude are encouraged to apply as we select based on practical skills than anything else.Good communication skills (written and verbal)Analytical, problem-solving, and troubleshooting skillsBasic knowledge on the logic with which a software worksSoft skills to interact with customers over the phone or video callWillingness to travel for workCandidate should have two wheeler license and a laptop.",
        "desc4": "",
        "desc": "",
        "desc1": "Okhati is well funded and is growing at amazing rate. We have on average 3 customers on boarding every week. To support our growth, we are hiring numerous interns who would help our customer onboard and use our software to its best.Your job would be to make sure that the client is given all the know-hows of the product and are able to use it easily.You are responsible for on boarding and supporting new customers and prospects. We are looking for someone who enjoys visiting places and talking to people, and has a knack for teaching. Apart from training customers, you will also be expected to take part in sales visits along with the sales managers. DutiesConfigure the Okhati software as per customer requirements.Help solve customer problems through our software.Train customers and their teams on the day to day use and administration of the product.Customer Support for all current clients.Learn to not only teach the software but to eventually be able to sell it to prospects.",
        "desc2": "RequirementsFreshers with can-do attitude are encouraged to apply as we select based on practical skills than anything else.Good communication skills (written and verbal)Analytical, problem-solving, and troubleshooting skillsBasic knowledge on the logic with which a software worksSoft skills to interact with customers over the phone or video callWillingness to travel for workCandidate should have two wheeler license and a laptop.",
        "desc3": "Basic Job Information\n\n\n\nJob Category\n:\n\nIT & Telecommunication\n > Software Implementation\n\n\n\nJob Level\n:\n\nEntry Level\n\n\n\nNo. of Vacancy/s\n:\n[ 4 ]\n\n\nEmployment Type\n:\n\nInternship\n\n\n\nJob Location\n:\n\nKathmandu\n\n\n\nOffered Salary\n:\n\nNRs. 10,000.00 Monthly\n\n\n\nApply Before(Deadline)\n:\nOct. 22, 2020 23:55\n(6 days, 9 hours from now)\n\n\n\n\n\n\n\n\n\n\n\nJob Specification\n\n\n\nEducation Level\n:\n\nBachelor\n\n \n\nExperience Required\n:\n\nNot Required\n\n\n\n\n\nOther Specification\n\n\nRequirementsFreshers with can-do attitude are encouraged to apply as we select based on practical skills than anything else.Good communication skills (written and verbal)Analytical, problem-solving, and troubleshooting skillsBasic knowledge on the logic with which a software worksSoft skills to interact with customers over the phone or video callWillingness to travel for workCandidate should have two wheeler license and a laptop.\n\n\n\n\n\n\n\n\n\n\n\nJob Description\n\nOkhati is well funded and is growing at amazing rate. We have on average 3 customers on boarding every week. To support our growth, we are hiring numerous interns who would help our customer onboard and use our software to its best.Your job would be to make sure that the client is given all the know-hows of the product and are able to use it easily.You are responsible for on boarding and supporting new customers and prospects. We are looking for someone who enjoys visiting places and talking to people, and has a knack for teaching. Apart from training customers, you will also be expected to take part in sales visits along with the sales managers. DutiesConfigure the Okhati software as per customer requirements.Help solve customer problems through our software.Train customers and their teams on the day to day use and administration of the product.Customer Support for all current clients.Learn to not only teach the software but to eventually be able to sell it to prospects.\n\n\n\n\n\n\n\n\nAPPLY NOW",
        "Page_URL": "https://merojob.com/technical-supporter-2/"
    },
    {
        "name": "Mobile App developer",
        "company": "",
        "logo": "",
        "level": "Mid Level",
        "vacancy": "1",
        "time": "Full Time",
        "address": "Bhaktapur Thimi",
        "salary": "Negotiable",
        "deadline": "Oct. 21, 2020 23:55\n(5 days, 9 hours from now)",
        "education": "Bachelor",
        "experience": "More than 2 years",
        "skills": "Communication\nCreative Thinking",
        "skills2": "Communication\nCreative Thinking",
        "desc5": "Good visual design sense and creative driveMust be a quick learner and be adaptable to new technologiesExcellent oral and written communication skillsAbility to write and maintain high-quality code",
        "desc4": "",
        "desc": "",
        "desc1": "Experience using version control systems like GitIn lieu of formal tertiary qualifications, relevant work experience and formal training will be considered2+ years of mobile development experience utilizing a range of modern technologiesExperience working in a software development teamExperience building, testing, and deploying mobile applications in both iOS and Android ( Flutter or React Native is Preferred)Comfortable working with ES6 JS Libraries (Vue.js / React.js)Confident with modern Javascript build tools, eg Node & Webpack, reactProficiency and accuracy in scoping development timelinesExperience designing creative and unique mobile app flowsExperience in working with a multidisciplinary, agile team Experience using design pattern",
        "desc2": "Good visual design sense and creative driveMust be a quick learner and be adaptable to new technologiesExcellent oral and written communication skillsAbility to write and maintain high-quality code",
        "desc3": "Basic Job Information\n\n\n\nJob Category\n:\n\nIT & Telecommunication\n > Mobile Apps\n\n\n\nJob Level\n:\n\nMid Level\n\n\n\nNo. of Vacancy/s\n:\n[ 1 ]\n\n\nEmployment Type\n:\n\nFull Time\n\n\n\nJob Location\n:\n\nBhaktapur Thimi\n\n\n\nOffered Salary\n:\n\nNegotiable\n\n\n\nApply Before(Deadline)\n:\nOct. 21, 2020 23:55\n(5 days, 9 hours from now)\n\n\n\n\n\n\n\n\n\n\n\n\nJob Specification\n\n\n\nEducation Level\n:\n\nBachelor\n\n\n\nExperience Required\n:\n\nMore than 2 years\n\n\n\nProfessional Skill Required\n:\n\n\nCommunication\nCreative Thinking\n\n\n\n\n\n\nOther Specification\n\n\nGood visual design sense and creative driveMust be a quick learner and be adaptable to new technologiesExcellent oral and written communication skillsAbility to write and maintain high-quality code\n\n\n\n\n\n\n\n\n\n\n\nJob Description\n\nExperience using version control systems like GitIn lieu of formal tertiary qualifications, relevant work experience and formal training will be considered2+ years of mobile development experience utilizing a range of modern technologiesExperience working in a software development teamExperience building, testing, and deploying mobile applications in both iOS and Android ( Flutter or React Native is Preferred)Comfortable working with ES6 JS Libraries (Vue.js / React.js)Confident with modern Javascript build tools, eg Node & Webpack, reactProficiency and accuracy in scoping development timelinesExperience designing creative and unique mobile app flowsExperience in working with a multidisciplinary, agile team Experience using design pattern\n\n\n\n\n\n\n\n\nAPPLY NOW",
        "Page_URL": "https://merojob.com/mobile-app-developer-15/"
    },
    {
        "name": "Mid-level PHP Software Engineer",
        "company": "",
        "logo": "",
        "level": "Mid Level",
        "vacancy": "1",
        "time": "Full Time",
        "address": "Kathmandu",
        "salary": "Negotiable",
        "deadline": "Oct. 21, 2020 23:55\n(5 days, 9 hours from now)",
        "education": "Bachelor",
        "experience": "More than 2 years",
        "skills": "Javascript\nLaravel Framework\nPhp\nWordpress\nCms",
        "skills2": "Javascript\nLaravel Framework\nPhp\nWordpress\nCms",
        "desc5": "Needs to have strong PHP skillsNeeds to have strong writing and communication skillsShould be willing to stay and grow with the company for many yearShould have good managerial and web designing skill",
        "desc4": "",
        "desc": "",
        "desc1": "An IT (computer programming) related degree and minimum 2 years digital agency experienceAdvanced knowledge of WordPress / WooCommerce / CMS (knowledge of hooks & custom WP dev)Advanced knowledge in JavaScript and related frameworksAdvanced knowledge of databases and SQLUnderstanding of PHP frameworks such as LaravelStrong understanding of HTML / CSS / JavaScriptStrong understanding of computer programming principles / git and version controlGood understanding of database design and SQLGood understanding of Sketch / Adobe Creative SuiteA genuine passion for web development (provide links to side projects if any)Good communication skills (a willingness to speak to clients a bonus)Familier with API for Mobile apps ",
        "desc2": "Needs to have strong PHP skillsNeeds to have strong writing and communication skillsShould be willing to stay and grow with the company for many yearShould have good managerial and web designing skill",
        "desc3": "Basic Job Information\n\n\n\nJob Category\n:\n\nIT & Telecommunication\n > Internet/E-commerce, Web Developer/Web Designer\n\n\n\nJob Level\n:\n\nMid Level\n\n\n\nNo. of Vacancy/s\n:\n[ 1 ]\n\n\nEmployment Type\n:\n\nFull Time\n\n\n\nJob Location\n:\n\nKathmandu\n\n\n\nOffered Salary\n:\n\nNegotiable\n\n\n\nApply Before(Deadline)\n:\nOct. 21, 2020 23:55\n(5 days, 9 hours from now)\n\n\n\n\n\n\n\n\n\n\n\nJob Specification\n\n\n\nEducation Level\n:\n\nBachelor\n\n\n\nExperience Required\n:\n\nMore than 2 years\n\n\n\nProfessional Skill Required\n:\n\n\nJavascript\nLaravel Framework\nPhp\nWordpress\nCms\n\n\n\n\n\n\nOther Specification\n\n\nNeeds to have strong PHP skillsNeeds to have strong writing and communication skillsShould be willing to stay and grow with the company for many yearShould have good managerial and web designing skill\n\n\n\n\n\n\n\n\n\n\n\nJob Description\n\nAn IT (computer programming) related degree and minimum 2 years digital agency experienceAdvanced knowledge of WordPress / WooCommerce / CMS (knowledge of hooks & custom WP dev)Advanced knowledge in JavaScript and related frameworksAdvanced knowledge of databases and SQLUnderstanding of PHP frameworks such as LaravelStrong understanding of HTML / CSS / JavaScriptStrong understanding of computer programming principles / git and version controlGood understanding of database design and SQLGood understanding of Sketch / Adobe Creative SuiteA genuine passion for web development (provide links to side projects if any)Good communication skills (a willingness to speak to clients a bonus)Familier with API for Mobile apps \n\n\n\n\n\n\n\n\nAPPLY NOW",
        "Page_URL": "https://merojob.com/mid-level-php-software-engineer/"
    }
]
