[{"name": "Sr Node.js Developer", "company": "IDenTV Nepal", "level": "Senior Level", "vacancy": "3", "time": "Full Time", "address": "Kathmandu", "salary": "NRs. 50,000.00 - 200,000.00 Monthly", "deadline": "Nov. 07, 2020 23:55\n(5\u00a0days, 4\u00a0hours from now)", "education": "Bachelor", "skills": "JestJavascriptNode.Js", "desct": "Basic Job InformationJob Category:IT & Telecommunication>Programmer/ Software Engineer, Software Architect, Team Leader (Software), Web Developer/Web DesignerJob Level:Senior LevelNo. of Vacancy/s:[3]Employment Type:Full TimeJob Location:KathmanduOffered Salary:NRs. 50,000.00 - 200,000.00 MonthlyApply Before(Deadline):Nov. 07, 2020 23:55\n(5\u00a0days, 4\u00a0hours from now)Job SpecificationEducation Level:BachelorExperience Required:More than or equals to 2 yearsProfessional Skill Required:JestJavascriptNode.JsOther SpecificationExperience building enterprise-scale backend REST services using an API-first paradigmHands-on experience building services with Node.jsHands-on understanding of virtualization and experience with DockerExperience implementing NoSQL databases like MongoDBYou are very comfy with NodeJS / MongoDB / APIs. You master deep details of the language/librariesAble to work well on a remote, multi-national team with Agile and ScrumExcellent communication skills, both written and verbalAWS DevOps (EKS, EC2, CloudFront + more), ElasticSearch is a nice to haveJob DescriptionOversee and/or lead analysis, architecture design, development and maintenance of large scale and/or complex applicationsWrite modular, reusable and excellent quality code, code reviews, and implement best practicesSupport the migration and redeployment of existing application (if any)Take responsibility of project and ensure robust hosting, application stability, security and system integrationAPPLY NOW", "Page_URL": "https://merojob.com/sr-nodejs-developer/"}, {"name": "Web Developer", "company": "Muncha.com", "level": "Mid Level", "vacancy": "1", "time": "Full Time", "address": "Ekantakuna, Lalitpur", "salary": "Negotiable", "deadline": "Nov. 04, 2020 23:55\n(2\u00a0days, 4\u00a0hours from now)", "education": "Bachelor", "skills": "NodejsVuejsMysqlPhp", "desct": "Basic Job InformationJob Category:IT & TelecommunicationJob Level:Mid LevelNo. of Vacancy/s:[1]Employment Type:Full TimeJob Location:Ekantakuna, LalitpurOffered Salary:NegotiableApply Before(Deadline):Nov. 04, 2020 23:55\n(2\u00a0days, 4\u00a0hours from now)Job SpecificationEducation Level:BachelorExperience Required:More than or equals to 1 yearProfessional Skill Required:NodejsVuejsMysqlPhpOther SpecificationExperience: A year of experience in Backend DevelopmentSkill: Php (Laravel Preffered), Vuejs, Mysql & NodejsMust have knowledge in Git & Git- hub or any other version control toolsJob DescriptionWeb-based chat application development and maintenanceDevelop, troubleshoot and enhance cutting edge web applicationsFrameworks - LaravelPayment gateway integration and maintenanceSource Version Control (git preferred, svn, cvs)Applying Procedure:Experienced candidate are requested to drop their updated resume at[email\u00a0protected]/ 9801184441OR,APPLY NOW", "Page_URL": "https://merojob.com/web-developer-350/"}, {"name": "App Developer", "company": "Muncha.com", "level": "Mid Level", "vacancy": "1", "time": "Full Time", "address": "Ekantakuna, Lalitpur", "salary": "Negotiable", "deadline": "Nov. 04, 2020 23:55\n(2\u00a0days, 4\u00a0hours from now)", "education": "Bachelor", "skills": "Problem SolvingTime ManagementCommunicationJavascript", "desct": "Basic Job InformationJob Category:IT & TelecommunicationJob Level:Mid LevelNo. of Vacancy/s:[1]Employment Type:Full TimeJob Location:Ekantakuna, LalitpurOffered Salary:NegotiableApply Before(Deadline):Nov. 04, 2020 23:55\n(2\u00a0days, 4\u00a0hours from now)Job SpecificationEducation Level:BachelorExperience Required:More than or equals to 1 yearProfessional Skill Required:Problem SolvingTime ManagementCommunicationJavascriptOther SpecificationExperience: A year of experience in flutterSkills: Dart & OOP ConceptsKnowledge: Git & git-hub or any other version control toolsCan develop application for Android and iOS platformAdditional experience in software development would be more beneficialProficiency with HTML, CSS, JavaScript, React.JsSolid understanding of object-oriented programming, functional programming, and design patternsExcellent communication skills, with a focus on clear and proactive communicationTranslating designs and wireframes into high quality codeOptimizing components for maximum performance across a vast array of web-capable devices and browsersJob DescriptionDevelop the best technical design and approach for new products or technologiesFamiliarity with code versioning tools such as GITDiagnose and fix bugs and performance bottlenecksIdentify project risks and clearly communicate risks and expectations to your team members and your managementCommunicate proactively with clients regarding projects\u2019 status and progressStay aware of industry trends and use these to make informed technology choices and strategic decisionsApplying Procedure:Experienced candidate are requested to drop their updated resume at[email\u00a0protected]/ 9801184441OR,APPLY NOW", "Page_URL": "https://merojob.com/app-developer-11/"}, {"name": "Team Lead (Java/Spring Framework)", "company": "Agram Infotech", "level": "Mid Level", "vacancy": "1", "time": "Full Time", "address": "Birgunj", "salary": "Negotiable", "deadline": "Nov. 05, 2020 23:55\n(3\u00a0days, 4\u00a0hours from now)", "education": "Bachelor", "skills": "Problem SolvingAnalyticalCreative ThinkingLogical Thinking", "desct": "Basic Job InformationJob Category:IT & Telecommunication>Programmer/ Software EngineerJob Level:Mid LevelNo. of Vacancy/s:[1]Employment Type:Full TimeJob Location:BirgunjOffered Salary:NegotiableApply Before(Deadline):Nov. 05, 2020 23:55\n(3\u00a0days, 4\u00a0hours from now)Job SpecificationEducation Level:BachelorExperience Required:More than 3 yearsProfessional Skill Required:Problem SolvingAnalyticalCreative ThinkingLogical ThinkingOther SpecificationBachelor's degree in Computer Science or related field of study OR equivalent combination of training and experience3+ years of overall software development experienceMust have led a team of 3 to 5 people for a period of at least 1 year.Hands on experience using the following, with advanced skills in at least one, and at least moderate skills in the rest:Hands on experience with at least 1 Java framework, such as: Spring and spring Boot (MVC)Html/CssAjax & XML and JSON and JQueryReact.jsExperience with (3 or more of the following):Various common javascript librariesResponsive designCreating and consuming secure web services, web APISecure website design and developmentNice To HaveExperience with Git, Azure DevOpsExperience with SQL Server 2012/2014Experience with automated unit testing and integration testingExperience with graceful degradation and/or progressive enhancement websitesNote:The ideal candidate is a smart, energetic, flexible person who can think creatively, and can work effectively independently as well as part of a collaborative team. They love writing software and solving complex problems and has a hunger for new knowledge. They strive to achieve superior results through high performance and execution excellence. They take calculated risks and exercise innovation. They move quickly, but not at the expense of results. Lastly, they hold themselves accountable.Job DescriptionPosition Summary:As Java Software Engineer, you will be part of an agile development team building and supporting software systems. In this crucial role, you'll work on a high performing team and be involved with the design, development, testing, and support of desktop, mobile and web applications.Who We Are:We are a startup software company focused on software development, Internet of Things, Cyber Security and Artificial IntelligenceOur Vision:Identify social challenges and develop technical solutions to ease themOur Mission:To be a leading and innovative software solution provider in NepalEssential Job Functions:Work with a cross-functional, highly talented team to design, develop and deliver new featuresUse the latest technologies to design and build flexible, scalable, reliable and high-performing applicationsWrite tests and perform code reviews to ensure that we're shipping reliable, readable, and reusable codeSupport our current applications, investing in fixing technical debt, and refactoring opportunitiesDevelop and design user interface components, web services, API\u2019s, and database integrationsMust have led a team of 3 to 5 people for a period of at least 1 yearMust have good verbal and written communication skills (Should be able to talk fluently and write emails without grammatical mistakes)Proven experience of delivering on-time and with qualityProven experience of handling risks and providing mitigation strategiesAPPLY NOW", "Page_URL": "https://merojob.com/team-lead-javaspring-framework/"}, {"name": "ETL Developer", "company": "Verisk Nepal", "level": "Mid Level", "vacancy": "4", "time": "Full Time", "address": "Kathmandu", "salary": "Negotiable", "deadline": "Nov. 06, 2020 23:55\n(4\u00a0days, 4\u00a0hours from now)", "education": "Bachelor", "skills": "SqlProgrammingEtl", "desct": "Basic Job InformationJob Category:IT & TelecommunicationJob Level:Mid LevelNo. of Vacancy/s:[4]Employment Type:Full TimeJob Location:KathmanduOffered Salary:NegotiableApply Before(Deadline):Nov. 06, 2020 23:55\n(4\u00a0days, 4\u00a0hours from now)Job SpecificationEducation Level:BachelorExperience Required:More than or equals to 1 yearProfessional Skill Required:SqlProgrammingEtlOther Specification1+ years of overall industry experience with experience in ETL design/developmentExperience in creating ETL pipeline including extraction, transformation, merging, filtering, joining, cleansing, scheduling, monitoring, troubleshootingExperience with ETL tools and processes (Pentaho/PDI preferred)Experience or Knowledge in Data masking and Data integrity checkExperience or Knowledge in any programing language like Java, Python, Shell Scripting etc.Experience in writing advanced SQL scriptsExperience or Knowledge in AWS ServicesExperience working in an Agile development processExcellent problem solving and data analysis skillsSuperior organization skills, skilled at recognizing priorities and keeping a team focused on most important featuresDemonstrated ability to work independently with minimal supervisionGood communication skill in verbal and writtenAbility to troubleshoot and maintain mid-level to complex applicationsJob DescriptionSupport, development and data operation workloadCoordinate and communicate effectively with team members and various stakeholdersUnderstand the business requirement, produce code and conduct testing to ensure that product meets the requirementsIdentify and test for bugs and bottlenecks in the ETL solutionEnsure the best possible performance and quality in the packagesParticipate in different support activitiesApplying Procedure:Please visit mentioned website :https://careers.smartrecruiters.com/Verisk?search=nepalAPPLY NOW", "Page_URL": "https://merojob.com/etl-developer-2/"}, {"name": "ETL - Tester / QA Engineer", "company": "Verisk Nepal", "level": "Mid Level", "vacancy": "1", "time": "Full Time", "address": "Kathmandu", "salary": "Negotiable", "deadline": "Nov. 06, 2020 23:55\n(4\u00a0days, 4\u00a0hours from now)", "education": "Bachelor", "skills": "SqlEtlTesting", "desct": "Basic Job InformationJob Category:IT & TelecommunicationJob Level:Mid LevelNo. of Vacancy/s:[1]Employment Type:Full TimeJob Location:KathmanduOffered Salary:NegotiableApply Before(Deadline):Nov. 06, 2020 23:55\n(4\u00a0days, 4\u00a0hours from now)Job SpecificationEducation Level:BachelorExperience Required:More than or equals to 1 yearProfessional Skill Required:SqlEtlTestingOther SpecificationBachelor\u2019s in Computer Science, or related field or equivalent experience1 to 3 years of professional experience in Software Quality Assurance, back-end data testing and Data QA AutomationProficient in SQL queries and Relational Database concepts, Aurora Postgres, data structures and data operations in generalExpertise in data workflow testing, data analysis, Test Data Creation in different format/input files along detailed data verification testing with handling regulated dataExperience in ETL testing - Pentaho / Microsoft SQL Server Integration Services (SSIS)Technically familiar with development concepts and formats such as SQL, XML, JSON and scripting languagesExperience in testing non-GUI applications (SQL, Flat Files, XML, JSON etc.)Strong understanding of object-oriented programmingGood knowledge of a programming/scripting language \u2013 JAVA, Scripting, PythonKnowledge or Experience in AWS Services is a plus, but not required.Sound technical background, great communication skills, and a motivation to achieve results in a fast-paced environmentA wholesome QA resource with an ability to put together test plan and test case scenarios, create test data and verify output using scripted scenariosPossess excellent problem-solving abilitiesKnack for writing clean, readable, and easily maintainable QA automation workflowsProficient in developing and implementing automated testsProficient understanding of code versioning tool and familiarity with Continuous Integration atmosphereJob DescriptionAct as QA lead on a wide variety of data intense projectsLead analysis for the purposes of developing test cases and test data for back-end data intense applicationPerform hands-on manual testing while scripting automated tests to ensure application and data quality.Test ETL systems in Pentaho which includes Data Analysis, Test Data Creation in different format/input files and Testing regulated data \u2013 majority in a scripted automated environmentContinuously develop and socialize best practices for the design and development of robust and easily maintainable QA Automation SuitesServe as a liaison to business analyst and product owner, providing feedback on application readiness for migrationsAdditional Information:\u00a0Verisk Analytics is an equal opportunity employer.All members of the Verisk Analytics family of companies are equal opportunity employers. We consider all qualified applicants for employment without regard to race, religion, color, national origin, citizenship, sex, gender identity and/or expression, sexual orientation, veteran's status, age or disability.Applying Procedure:Please visit mentioned website:https://careers.smartrecruiters.com/Verisk?search=nepalorhttps://jobs.smartrecruiters.com/Verisk/743999721164045-software-engineer-data-qa-automation-engineerUnsolicited resumes sent to Verisk, including unsolicited resumes sent to a Verisk business mailing address, fax machine or email address, or directly to Verisk employees, will be considered Verisk property. Verisk will NOT pay a fee for any placement resulting from the receipt of an unsolicited resume.Consumer Privacy NoticeAPPLY NOW", "Page_URL": "https://merojob.com/etl-tester-qa-engineer/"}, {"name": "Sr. Machine Learning Engineer", "company": "IDenTV Nepal", "level": "Senior Level", "vacancy": "1", "time": "Full Time", "address": "Kathmandu", "salary": "$. 1,000.00 - 2,000.00 Monthly", "deadline": "Nov. 07, 2020 23:55\n(5\u00a0days, 4\u00a0hours from now)", "education": "Bachelor", "skills": "PythonProgramming", "desct": "Basic Job InformationJob Category:IT & Telecommunication>Programmer/ Software Engineer, Web Developer/Web DesignerJob Level:Senior LevelNo. of Vacancy/s:[1]Employment Type:Full TimeJob Location:KathmanduOffered Salary:$. 1,000.00 - 2,000.00 MonthlyApply Before(Deadline):Nov. 07, 2020 23:55\n(5\u00a0days, 4\u00a0hours from now)Job SpecificationEducation Level:BachelorExperience Required:More than or equals to 3 yearsProfessional Skill Required:PythonProgrammingOther SpecificationData engineering-Expertise and Hardcore Programming in Python.Hadoop and spark as well.Understanding of Machine LearningCloud engineering workLooking for someone with 3-5 years experience. Not an Architect or designer, just a smart, straight programmer.Job DescriptionBuilding data pipelines and calling machine learning algorithms.Data cleansingCreate Visual ChartsThe project/s that this person will be supporting are around our Artificial Intelligence.APPLY NOW", "Page_URL": "https://merojob.com/sr-machine-learning-engineer-2/"}, {"name": "Senior .Net Developer", "company": "Proshore Nepal", "level": "Senior Level", "vacancy": "1", "time": "Full Time", "address": "Tinkune Marg, Kathmandu, Nepal", "salary": "Negotiable", "deadline": "Nov. 17, 2020 23:55\n(2\u00a0weeks, 1\u00a0day from now)", "education": "Bachelor", "skills": "Technical LeadC#JavascriptCommunication", "desct": "Basic Job InformationJob Category:IT & Telecommunication>Database Engineer/Database Programmer, Programmer/ Software Engineer, Software Architect, Software Implementation, Web Developer/Web DesignerJob Level:Senior LevelNo. of Vacancy/s:[1]Employment Type:Full TimeJob Location:Tinkune Marg, Kathmandu, NepalOffered Salary:NegotiableApply Before(Deadline):Nov. 17, 2020 23:55\n(2\u00a0weeks, 1\u00a0day from now)Job SpecificationEducation Level:BachelorExperience Required:Not RequiredProfessional Skill Required:Technical LeadC#JavascriptCommunicationJob DescriptionWe want you to be a team player and a real problem solver. Together we want to create something valuable and useful for our customers.Personal Skills We ValueNatural curiosity around new technologies and toolsYou always believe there is a better or smarter way to solve problemsA mindset of creating a solution that is valuable for the end userYou like to achieve a goal within a teamYou are assertive and feel free to express yourself and your idea\u2019s in EnglishYour Technical Skill SetYou get energy from coding and and you are familiar in the Microsoft ecosystem such as Visual Studio, Azure & .NET CoreYou believe in writing clean, scalable code using C# .NETYou can act as a leader of your team and provide them technical assistanceWorking with API's and microservices is a piece of cake for youScalable and manageable solutions are in your DNAYou are familiar with front-end JS frameworks such as Angular, React or VueWhat We Have to Offer YouYour own workstation with dual monitorFlexible work timingFree Lunch and BreakfastParticipate in eventsExcellent career opportunitiesSpace for own initiativesHealth & Accidental insurance coverageRecreational activitiesPaid Paternity, Maternity, Marriage, Sick and Casual LeaveFloating Holiday'sOpen office environmentThis is what happens after you applyTell us more about yourself along with your CVLet's first have a 'virtual tea talk'\u00a0 to introduce Proshore, the role and to get to know you. This will be done by Hangouts or Skype.During the interview phase (of max 2 round) we'll inform you as soon as we've decided whether we'd like to proceed with youThe interview phase may include a technical assessment to test your technical skillsApplying ProcedureInterested and enthusiast candidates are encouraged to apply from our career page directlyhttps://careers.proshore.eu/senior-net-developer", "Page_URL": "https://merojob.com/senior-net-developer-49/"}, {"name": "Senior Dot Net Developer", "company": "COTIVITI NEPAL", "level": "Senior Level", "vacancy": "10", "time": "Full Time", "address": "Kathmandu", "salary": "Negotiable", "deadline": "Nov. 09, 2020 23:55\n(1\u00a0week from now)", "education": "Bachelor", "skills": "Software DevelopmentAnalyticalCommunicationInterpersonal", "desct": "Basic Job InformationJob Category:IT & TelecommunicationJob Level:Senior LevelNo. of Vacancy/s:[10]Employment Type:Full TimeJob Location:KathmanduOffered Salary:NegotiableApply Before(Deadline):Nov. 09, 2020 23:55\n(1\u00a0week from now)Job SpecificationEducation Level:BachelorExperience Required:More than or equals to 5 yearsProfessional Skill Required:Software DevelopmentAnalyticalCommunicationInterpersonalJob DescriptionResponsibilitiesTranslate application stories and requirements into functional applications.Design, code, and maintain efficient and reliable C# code.Write neat and clean code mostly for desktop application.Create test cases and follow test cases to implement the requirements.Maintain legacy code and implement the new requirements in best possible way.Prepare use case/ flow diagram when needed.Regular follow up for tasks assigned from development phase to QAQualification and Education RequirementsBachelor of Engineering in Computer/IT or equivalent degree in Computer related studiesMust Have SkillsMinimum 5 years of experience in Software development using C#.Strong theoretical and practical knowledge of object-oriented programmingAbility to write reusable C# librariesFamiliar with design patternsExperience in writing unit test and integration testing in Nunit Framework.Knack for writing clean, readable C# code.Strong knowledge of Relational Databases, SQL, and ORM technologiesExperience working with source control systems, such as Subversion, and GIT including branching and merging strategies.Web Service Frameworks (RESTful, SOAP)Preferable SkillsKnowledge of Javascript based front-end frameworks like ember.js, angular.js etc would be an added advantage.Working knowledge of MVC design patterns.Experience in Continuous Integration leveraging tools such as Bamboo and Maven.Soft SkillsAbility to work independently or as part of a teamExperience of working in SCRUM/Agile team would be added valuePersuasive in both written and verbal communicationStrong Analytical SkillsUS Healthcare experience would be added valueApplying ProcedureTo apply, please login tohttp://www.cotiviti.com.np/jobsor Send your CV to[email\u00a0protected]", "Page_URL": "https://merojob.com/senior-dot-net-developer-12/"}, {"name": "Dot Net Developer", "company": "COTIVITI NEPAL", "level": "Mid Level", "vacancy": "4", "time": "Full Time", "address": "Kathmandu", "salary": "Negotiable", "deadline": "Nov. 09, 2020 23:55\n(1\u00a0week from now)", "education": "Bachelor", "skills": "AnalyticalJavascriptCommunicationInterpersonalSoftware Development", "desct": "Basic Job InformationJob Category:IT & TelecommunicationJob Level:Mid LevelNo. of Vacancy/s:[4]Employment Type:Full TimeJob Location:KathmanduOffered Salary:NegotiableApply Before(Deadline):Nov. 09, 2020 23:55\n(1\u00a0week from now)Job SpecificationEducation Level:BachelorExperience Required:More than or equals to 2 yearsProfessional Skill Required:AnalyticalJavascriptCommunicationInterpersonalSoftware DevelopmentJob DescriptionResponsibilitiesTranslate application stories and requirements into functional applications.Design, code, and maintain efficient and reliable C# code.Write neat and clean code mostly for desktop application.Create test cases and follow test cases to implement the requirements.Maintain legacy code and implement the new requirements in best possible way.Prepare use case/ flow diagram when needed.Regular follow up for tasks assigned from development phase to QAQualification and Education RequirementsBachelor of Engineering in Computer/IT or equivalent degree in Computer related studiesMust Have SkillsMinimum 2 years of experience in Software development using C#.Strong theoretical and practical knowledge of object-oriented programmingAbility to write reusable C# librariesFamiliar with design patternsExperience in writing unit test and integration testing in Nunit Framework.Knack for writing clean, readable C# code.Strong knowledge of Relational Databases, SQL, and ORM technologiesExperience working with source control systems, such as Subversion, and GIT including branching and merging strategies.Web Service Frameworks (RESTful, SOAP)Preferable SkillsKnowledge of Javascript based front-end frameworks like ember.js, angular.js etc would be an added advantage.Working knowledge of MVC design patterns.Experience in Continuous Integration leveraging tools such as Bamboo and Maven.Soft SkillsAbility to work independently or as part of a teamExperience of working in SCRUM/Agile team would be added valuePersuasive in both written and verbal communicationStrong Analytical SkillsUS Healthcare experience would be added valueApplying ProcedureTo apply, please login tohttp://www.cotiviti.com.np/jobsor Send your CV to[email\u00a0protected]", "Page_URL": "https://merojob.com/dot-net-developer-52/"}, {"name": "Senior Java Developer", "company": "COTIVITI NEPAL", "level": "Senior Level", "vacancy": "7", "time": "Full Time", "address": "Kathmandu", "salary": "Negotiable", "deadline": "Nov. 09, 2020 23:55\n(1\u00a0week from now)", "education": "Bachelor", "skills": "JqueryAngular 5JavascriptCommunicationSoftware Development", "desct": "Basic Job InformationJob Category:IT & TelecommunicationJob Level:Senior LevelNo. of Vacancy/s:[7]Employment Type:Full TimeJob Location:KathmanduOffered Salary:NegotiableApply Before(Deadline):Nov. 09, 2020 23:55\n(1\u00a0week from now)Job SpecificationEducation Level:BachelorExperience Required:More than or equals to 5 yearsProfessional Skill Required:JqueryAngular 5JavascriptCommunicationSoftware DevelopmentJob DescriptionExperience developing enterprise applications with proven enterprise experience level with RDBMS and SQL (Oracle and/or Microsoft SQL Server)Experience with Continuous Integration and writing automated unit and integration testsStrong object-oriented programming skills using JavaKnowledge of relevant technologies inclusive of (Angular 5, JavaScript, JOuery)Knowledge of algorithms and data structuresFamiliar with design patternsKnowledge of secure coding practices as it pertains to OWASPKnowledge of Version Control Software tools such as SVN, bitbucketExperience with Software development/management tools using the Atlassian suite (JIRA, Confluence)Experience with both Windows and Unix Operating systemQualification and Education RequirementsBS Computer Science or related field or equivalent industry experienceAt least 5 years of experience in Software developmentSoft SkillsAbility to work independently or as part of a teamExperience of working in SCRUM/Agile team would be added valueDesire and ability to continuously improve, discover and expand the limitsCritical thinking has an opinion on various technological topics.Applying ProcedureTo apply, please login tohttp://www.cotiviti.com.np/jobsor Send your CV to[email\u00a0protected]", "Page_URL": "https://merojob.com/senior-java-developer-45/"}, {"name": "Java Developer", "company": "COTIVITI NEPAL", "level": "Mid Level", "vacancy": "6", "time": "Full Time", "address": "Kathmandu", "salary": "Negotiable", "deadline": "Nov. 09, 2020 23:55\n(1\u00a0week from now)", "education": "Bachelor", "skills": "CssHtmlJqueryJavascriptSoftware Development", "desct": "Basic Job InformationJob Category:IT & TelecommunicationJob Level:Mid LevelNo. of Vacancy/s:[6]Employment Type:Full TimeJob Location:KathmanduOffered Salary:NegotiableApply Before(Deadline):Nov. 09, 2020 23:55\n(1\u00a0week from now)Job SpecificationEducation Level:BachelorExperience Required:More than or equals to 2 yearsProfessional Skill Required:CssHtmlJqueryJavascriptSoftware DevelopmentJob DescriptionResponsibilitiesInvolve in all stages of the project life cycle: requirements definition, design, and development.Translate application stories and requirements into functional applications.Write neat and clean code for desktop and web application.Create test cases and follow test cases to implement the requirements.Active participation in Project level discussion/meeting.Prepare use case/ flow diagram when needed.Regular follow up for tasks assigned from development phase to QAQualification and Education RequirementsBachelor of Engineering in Computer/IT or equivalent degree in Computer related studiesMust Have SkillsAt least 2 years of experience in Software development using J2SE and J2EE.Experience in parallel and multithreaded programmingKnowledge of algorithms and data structuresInterest in achieving maximum performance from available hardware and softwareFamiliar with design patternsUI Development Skills (JavaFx, JavaScript, CSS, HTML, jQuery)Hands on knowledge on Spring Framework.Strong knowledge of Relational Databases, SQL, and ORM technologiesExperience working with source control systems, such as Subversion, and GIT including branching and merging strategies.Preferable SkillsHands on knowledge on Apache Camel FrameworkKnowledge of testing frameworks/methodologies (TestNG, JUnit, TDD)Understanding of XML, JSON, web services technologiesExperience with Atlassian suite of tools (Jira, Confluence, Bamboo, Crucible)Experience in Continuous Integration leveraging tools such as Bamboo and Maven.Soft SkillsAbility to work independently or as part of a teamExperience of working in SCRUM/Agile team would be added valueDesire and ability to continuously improve, discover and expand the limitsCritical thinking, has an opinion on various technological topics.Applying ProcedureTo apply, please login tohttp://www.cotiviti.com.np/jobsor Send your CV to[email\u00a0protected]", "Page_URL": "https://merojob.com/java-developer-118/"}, {"name": "Oracle- PL/SQL Developer", "company": "COTIVITI NEPAL", "level": "Mid Level", "vacancy": "2", "time": "Full Time", "address": "Kathmandu", "salary": "Negotiable", "deadline": "Nov. 09, 2020 23:55\n(1\u00a0week from now)", "education": "Bachelor", "skills": "AnalyticalLinuxCommunicationSoftware Development", "desct": "Basic Job InformationJob Category:IT & TelecommunicationJob Level:Mid LevelNo. of Vacancy/s:[2]Employment Type:Full TimeJob Location:KathmanduOffered Salary:NegotiableApply Before(Deadline):Nov. 09, 2020 23:55\n(1\u00a0week from now)Job SpecificationEducation Level:BachelorExperience Required:More than or equals to 2 yearsProfessional Skill Required:AnalyticalLinuxCommunicationSoftware DevelopmentJob DescriptionExperienceUnderstanding business requirements and technical documentsTranslate design into functional unit.Follow coding standard during developmentDevelop optimized queriesCreate unit test to validate changesActive participation in Project level discussion/meeting.Maintain legacy code and implement the new requirements in best possible way.Prepare Technical/flow diagram.Prepare documentation of the changes or legacy code base.EducationBachelor of Engineering in Computer/IT or equivalent degree in Computer related studiesRequired Technical SkillMinimum 2 years of experience in Software development using PL/SQL, MS-SQL.Strong knowledge of Relational DatabasesMust be familiar with Oracle Optimization techniquesMust be familiar with basic Linux commandsStrong theoretical and practical knowledge of object-oriented programmingFamiliar with design patternsExperience working with source control systems, such as Subversion, and GIT including branching and merging strategies.Preferable SkillsKnowledge of Shell, Perl Scripting languageExperience with Atlassian suite of tools (Jira, Confluence, Bamboo)Other SkillsAbility to work independently or as part of a teamExperience of working in SCRUM/Agile team would be added valuePersuasive in both written and verbal communicationStrong Analytical SkillsUS Healthcare experience would be added valueApplying ProcedureTo apply, please login tohttp://www.cotiviti.com.np/jobsor Send your CV to[email\u00a0protected]", "Page_URL": "https://merojob.com/oracle-plsql-developer-6/"}, {"name": "Senior Oracle \u2013 PL/SQL DEVELOPER", "company": "COTIVITI NEPAL", "level": "Senior Level", "vacancy": "2", "time": "Full Time", "address": "Kathmandu", "salary": "Negotiable", "deadline": "Nov. 09, 2020 23:55\n(1\u00a0week from now)", "education": "Bachelor", "skills": "AnalyticalLinuxCommunicationSoftware Development", "desct": "Basic Job InformationJob Category:IT & TelecommunicationJob Level:Senior LevelNo. of Vacancy/s:[2]Employment Type:Full TimeJob Location:KathmanduOffered Salary:NegotiableApply Before(Deadline):Nov. 09, 2020 23:55\n(1\u00a0week from now)Job SpecificationEducation Level:BachelorExperience Required:More than or equals to 5 yearsProfessional Skill Required:AnalyticalLinuxCommunicationSoftware DevelopmentJob DescriptionResponsibilitiesShould have strong knowledge on all stages of Software life cycle process: Planning, design, development, Testing and deployment.Understanding business requirements and technical documentsTranslate design into functional unit.Follow coding standard during developmentDevelop optimized queriesCreate unit test to validate changesActive participation in Project level discussion/meeting.Maintain legacy code and implement the new requirements in best possible way.Prepare Technical/flow diagram.Prepare documentation of the changes or legacy code base.Qualification and Education RequirementsBachelor of Engineering in Computer/IT or equivalent degree in Computer related studiesMust Have SkillsAt least 5 years of experience in Software development using PL/SQL, MS-SQL.Strong knowledge of Relational DatabasesMust be familiar with Oracle Optimization techniquesMust be familiar with basic Linux commandsStrong theoretical and practical knowledge of object-oriented programmingFamiliar with design patternsExperience working with source control systems, such as Subversion, and GIT including branching and merging strategies.Preferable SkillsKnowledge of Shell, Perl Scripting languageExperience with Atlassian suite of tools (Jira, Confluence, Bamboo, Crucible)Soft SkillsAbility to work independently or as part of a teamExperience of working in SCRUM/Agile team would be added valuePersuasive in both written and verbal communicationStrong Analytical SkillsUS Healthcare experience would be added valueApplying ProcedureTo apply, please login tohttp://www.cotiviti.com.np/jobsor Send your CV to[email\u00a0protected]", "Page_URL": "https://merojob.com/senior-oracle-plsql-developer-6/"}, {"name": "Senior Test Automation Engineer", "company": "COTIVITI NEPAL", "level": "Senior Level", "vacancy": "5", "time": "Full Time", "address": "Kathmandu", "salary": "Negotiable", "deadline": "Nov. 09, 2020 23:55\n(1\u00a0week from now)", "education": "Bachelor", "skills": "CommunicationSoftware Development", "desct": "Basic Job InformationJob Category:IT & TelecommunicationJob Level:Senior LevelNo. of Vacancy/s:[5]Employment Type:Full TimeJob Location:KathmanduOffered Salary:NegotiableApply Before(Deadline):Nov. 09, 2020 23:55\n(1\u00a0week from now)Job SpecificationEducation Level:BachelorExperience Required:More than or equals to 5 yearsProfessional Skill Required:CommunicationSoftware DevelopmentJob DescriptionResponsibilitiesTest Automation Engineers would be expected to be doing following:Test Automation using Selenium in .NetTest Execution on various level (System Test, Regression Test, Smoke Test)Understand the existing products and business flowDefect reportingPrepare Testing platform (Application and Database)Performance Test using JMeterTest Automation of data/database level testingResearch/implementation of latest test automation frameworks.Qualification and Education RequirementsBachelor Degree or equivalent degree in Computer related studiesMust Have SkillsMinimum 5 years of Software Development/Programming in the past or recently. Preferably in .Net.Must have experience of selenium test automation in .netMust have sound knowledge of Software TestingExperience working with source control systems, such as Subversion, and GIT including branching and merging strategies.Preferable SkillsKnowledge of Relational DatabasesKnowledge of Build Scripting using MSBuild with BambooExperience of working in IIS Application ServerApplying ProcedureTo apply, please login tohttp://www.cotiviti.com.np/jobsor Send your CV to[email\u00a0protected]", "Page_URL": "https://merojob.com/senior-test-automation-engineer-3/"}, {"name": "Test Automation Engineer", "company": "COTIVITI NEPAL", "level": "Mid Level", "vacancy": "5", "time": "Full Time", "address": "Kathmandu", "salary": "Negotiable", "deadline": "Nov. 09, 2020 23:55\n(1\u00a0week from now)", "education": "Bachelor", "skills": "CommunicationInterpersonalSoftware Development", "desct": "Basic Job InformationJob Category:IT & TelecommunicationJob Level:Mid LevelNo. of Vacancy/s:[5]Employment Type:Full TimeJob Location:KathmanduOffered Salary:NegotiableApply Before(Deadline):Nov. 09, 2020 23:55\n(1\u00a0week from now)Job SpecificationEducation Level:BachelorExperience Required:More than or equals to 3 yearsProfessional Skill Required:CommunicationInterpersonalSoftware DevelopmentJob DescriptionResponsibilitiesTest Automation Engineers would be expected to be doing following:Test Automation using Selenium in .NetTest Execution on various level (System Test, Regression Test, Smoke Test)Understand the existing products and business flowDefect reportingPrepare Testing platform (Application and Database)Performance Test using JMeterTest Automation of data/database level testingResearch/implementation of latest test automation frameworks.Qualification and Education RequirementsBachelor\u2019s degree or equivalent degree in Computer related studiesMust Have SkillsMinimum 3 years of Software Development/Programming in the past or recently. Preferably in .Net.Must have experience of selenium test automation in .netMust have sound knowledge of Software TestingExperience working with source control systems, such as Subversion, and GIT including branching and merging strategies.Preferable SkillsKnowledge of Relational DatabasesKnowledge of Build Scripting using MSBuild with BambooExperience of working in IIS Application ServerApplying ProcedureTo apply, please login tohttp://www.cotiviti.com.np/jobsor Send your CV to[email\u00a0protected]", "Page_URL": "https://merojob.com/test-automation-engineer-6/"}, {"name": "Business Analyst", "company": "COTIVITI NEPAL", "level": "Senior Level", "vacancy": "2", "time": "Full Time", "address": "Kathmandu", "salary": "Negotiable", "deadline": "Nov. 09, 2020 23:55\n(1\u00a0week from now)", "education": "Bachelor", "skills": "Problem SolvingTime ManagementOrganizationalCommunicationInterpersonal", "desct": "Basic Job InformationJob Category:IT & TelecommunicationJob Level:Senior LevelNo. of Vacancy/s:[2]Employment Type:Full TimeJob Location:KathmanduOffered Salary:NegotiableApply Before(Deadline):Nov. 09, 2020 23:55\n(1\u00a0week from now)Job SpecificationEducation Level:BachelorExperience Required:More than or equals to 5 yearsProfessional Skill Required:Problem SolvingTime ManagementOrganizationalCommunicationInterpersonalJob DescriptionThe Business Analyst is the liaison between the agile sprint team and the business (SME, Product Manager and Product Owner). Works to create and refine the feature backlog in preparation for the next Program Increment through defining innovative improvements to business processes in order to meet the business requirements. Works with the Sprint Team to foster a collaborative atmosphere and provide clear understanding of the business problem being solved. Works well in a team-structured environment.ResponsibilitiesReviews existing legacy application documentation to develop an understanding of the existing functionality.Meets with business leadership (SME, Product Manager and Product Owner) to clarify business requirements.Documents existing business processes and proposes innovative improvements.Develops a clear definition and acceptance criteria for each of the features to ensure the business requirements will be addressed.Assists with documentation and prioritization of the business value associated with the business requirements.Develops product expertise.Conduct user acceptance testsQualificationsBachelor Degree in Computer or related field.5+ years of business analysis experience.Experience in an agile software development environment an asset.Possesses excellent communication, organizational and observational skills.Proficient problem solving skills with good judgment and decision making.Must work well as a member of a team.Applying ProcedureTo apply, please login tohttp://www.cotiviti.com.np/jobsor Send your CV to[email\u00a0protected]", "Page_URL": "https://merojob.com/business-analyst-49/"}, {"name": "Project Manager", "company": "COTIVITI NEPAL", "level": "Senior Level", "vacancy": "2", "time": "Full Time", "address": "Kathmandu", "salary": "Negotiable", "deadline": "Nov. 09, 2020 23:55\n(1\u00a0week from now)", "education": "Bachelor", "skills": "Time ManagementOrganizationalCommunicationInterpersonal", "desct": "Basic Job InformationJob Category:IT & TelecommunicationJob Level:Senior LevelNo. of Vacancy/s:[2]Employment Type:Full TimeJob Location:KathmanduOffered Salary:NegotiableApply Before(Deadline):Nov. 09, 2020 23:55\n(1\u00a0week from now)Job SpecificationEducation Level:BachelorExperience Required:More than or equals to 5 yearsProfessional Skill Required:Time ManagementOrganizationalCommunicationInterpersonalJob DescriptionResponsibilitiesConduct and facilitate the planning. Help team to define their goals on each planning.Facilitate all the sprint rituals of own team.Coordinate with other teams on the Agile Release Train (ART) as needed. Participate in SOS to present own team's progress.Own team\u2019s commitments and help team to achieve their goal.Help remove impediments and foster an environment for high-performing team dynamics, continuous flow, and relentless improvement.Help and guide the team to optimally plan their capacity.Make sure the team\u2019s utilization is efficiently managed and has higher productivity.Conduct regular retrospective on every event. Make sure every action items have individual/team\u2019s name and a date expected to get resolved with a follow up.Manage team\u2019s RAID \u2013 Risk, Assumption, Issues and Dependencies.Compile, collect, produce and publish team\u2019s report on different metrics.Work with Engineering manager for team\u2019s development that helps the team to be more productive as well as efficient.Escalate to higher authority as required on any case that needs resolution from cross team.Coach the team in Scrum, Extreme Programming (XP), Kanban, and SAFe, ensuring that the agreed Agile process is being followed.Develop, document and conduct Agile development and process training as required \u2013 getting started and regular refresher training. Work with organization training manager/specialistRequirementsMinimum five years\u2019 experience in similar role.Applying ProcedureTo apply, please login tohttp://www.cotiviti.com.np/jobsor Send your CV to[email\u00a0protected]", "Page_URL": "https://merojob.com/project-manager-392/"}, {"name": "Senior MS-SQL Developer", "company": "COTIVITI NEPAL", "level": "Senior Level", "vacancy": "4", "time": "Full Time", "address": "Kathmandu", "salary": "Negotiable", "deadline": "Nov. 09, 2020 23:55\n(1\u00a0week from now)", "education": "Bachelor", "skills": "AnalyticalCommunicationInterpersonal", "desct": "Basic Job InformationJob Category:IT & TelecommunicationJob Level:Senior LevelNo. of Vacancy/s:[4]Employment Type:Full TimeJob Location:KathmanduOffered Salary:NegotiableApply Before(Deadline):Nov. 09, 2020 23:55\n(1\u00a0week from now)Job SpecificationEducation Level:BachelorExperience Required:More than or equals to 5 yearsProfessional Skill Required:AnalyticalCommunicationInterpersonalJob DescriptionResponsibilitiesShould have strong knowledge on all stages of Software life cycle process: Planning, design, development, Testing and deployment.Understanding business requirements and technical documentsTranslate design into functional unit.Follow coding standard during developmentDevelop optimized queriesCreate unit test to validate changesActive participation in Project level discussion/meeting.Maintain legacy code and implement the new requirements in best possible way.Prepare Technical/flow diagram.Prepare documentation of the changes or legacy code base.Qualification and Education RequirementsBachelor of Engineering in Computer/IT or equivalent degree in Computer related studiesMust Have SkillsMinimum 5 years of experience in Software development using MS-SQL.Strong knowledge of Relational DatabasesExperience working with source control systems, such as Subversion, and GIT including branching and merging strategies.Knowledge of SSIS.Preferable SkillsExperience with Atlassian suite of tools (Jira, Confluence, Bamboo, Crucible)Soft SkillsAbility to work independently or as part of a teamExperience of working in SCRUM/Agile team would be added valuePersuasive in both written and verbal communicationStrong Analytical SkillsUS Healthcare experience would be added valueApplying ProcedureTo apply, please login tohttp://www.cotiviti.com.np/jobsor Send your CV to[email\u00a0protected]", "Page_URL": "https://merojob.com/senior-ms-sql-developer-2/"}, {"name": "Ful Stack .Net/ React developer", "company": "Infocom Solutions", "level": "Mid Level", "vacancy": "1", "time": "Full Time", "address": "Kathmandu", "salary": "Negotiable", "deadline": "Nov. 09, 2020 23:55\n(1\u00a0week from now)", "education": "Bachelor", "skills": "Css3JavascriptDatabase Design", "desct": "Basic Job InformationJob Category:IT & TelecommunicationJob Level:Mid LevelNo. of Vacancy/s:[1]Employment Type:Full TimeJob Location:KathmanduOffered Salary:NegotiableApply Before(Deadline):Nov. 09, 2020 23:55\n(1\u00a0week from now)Job SpecificationEducation Level:BachelorExperience Required:More than or equals to 2 yearsProfessional Skill Required:Css3JavascriptDatabase DesignOther SpecificationLanguage: c#,Asp.netCore Web API, React NativeSkills:GIT, MSSQL, Jquery, Winform, WPFIDE:Visual Studio Code, Visual Studio 2016, Android Studio, CodeXProficient in CSS for effective presentation of the HTML elementsExtensive knowledge in both of these programming languages for creating an interactive, intuitive, and engaging frontend for applicationsMultiple skills pertaining to both frontend and backend developmentKnowledge of NoSQL databasesKnowledge of web storageMake a website look attractive and appealingJob DescriptionDesign and implementation of the overall web architecture\u201cPixel-perfect\u201d implementation of our approved user interfaceDesign and deployment of our databaseEnsuring the entire stack is designed and built for speed and scalabilityDesign and construction of our REST APIIntegrating our front-end UI with the constructed APIDesign and implementation of continuous integration and deploymentBusiness OverviewRepresentation & liaisonSystem IntegrationValue Added ServicesEnd-to-End IT Project ManagementIT Consulting and Advisory ServicesSoftware SolutionsNetworking EquipmentsApplying Procedure:Applicants are requested to send their CV in mentioned mail :[email\u00a0protected]OR,APPLY NOW", "Page_URL": "https://merojob.com/ful-stack-net-react-developer/"}, {"name": "Java Developer", "company": "Software Development House Nepal", "level": "Mid Level", "vacancy": "2", "time": "Full Time", "address": "Kupondole", "salary": "$. 600.00 Monthly", "deadline": "Nov. 13, 2020 23:55\n(1\u00a0week, 4\u00a0days from now)", "education": "Bachelor", "skills": "JavaObject Oriented ProgrammingJavascriptJqueryHtml", "desct": "Basic Job InformationJob Category:IT & TelecommunicationJob Level:Mid LevelNo. of Vacancy/s:[2]Employment Type:Full TimeJob Location:KupondoleKathmanduOffered Salary:$. 600.00 MonthlyApply Before(Deadline):Nov. 13, 2020 23:55\n(1\u00a0week, 4\u00a0days from now)Job SpecificationEducation Level:BachelorExperience Required:Not RequiredProfessional Skill Required:JavaObject Oriented ProgrammingJavascriptJqueryHtmlOther SpecificationMust have skills:Good knowledge of JAVA and Object-Oriented ProgrammingGood knowledge of relational databasesExperience with J2EE, HTML, CSS, JavaScript, jQueryProficiency with Unix-like operating systemsExcellent Verbal and Written CommunicationExcellent Logical and Analytical SkillMath AptitudeTime Management and ProfessionalismOther Job Requirements:IT experienceAvailability to work nights and weekends if necessaryMust be able to work on Holidays to take care of urgent tasksAbility to work independentlyBenefits:Health InsuranceProvident FundDashai Bonus, Performance Bonus, Referral Bonus15 Days PTO13 Days Govt Holidays5 Working Days per WeekRegular salary revision based on performanceFrequent team building activitiesJob DescriptionDuties and Responsibilities include, but are not limited to:Resolves assigned tasks in an efficient and effective manner. (Customer or internal.)Quality code with minimal bugsPositive code review resultsUnderstands and follows SDS (Smart Data Solutions) workflow and associated technical systemsApplies analytical and business knowledge to solve customer-specified problems adhering to SDS coding standards and policiesAdheres to SDS\u2019s courteous and professional written and verbal communication standardsA consistently high rating on customer satisfaction surveys 5. Works independently with minimal guidanceDevelopmentCompletes development projects as specified by development manager, adhering to SDS coding standard and policiesPrograms appropriate changes as specified by development manager, adhering to SDS coding standard and policiesReviews applicable changes (in particular system related changes) with peer/manager and get approval on programming changes from managerDevelops test cases and data and test all changes and new modulesOther duties as assignedNew ImplementationsCommunicates with client regularly and documents all specifications and workflows. All implementation meetings are followed up with written listing of all tasksUnderstands related workflow and all associated nuancesCompletes all tasks as specified on the implementation checklistCompletes assigned tasks as specified by the development manager and follow the implementation manual/checklistMeets development milestones consistently. Do \u201cwhat it takes\u201d to achieve customer go live dateCommunicates to client and management if milestone dates are not metLeverages the expertise of other developers in the team on specific modules (Examples: scanner setup, OCR setup, etcSets up customer billing rates as specified on the contract and verify with sales or accounting. (Billing)Tracks and bills all applicable development hours. (Billing)Ensures unnecessary direct labor costs are not incurred in conjunction with the implementation.Business AnalysisUnderstands and follows all assigned customers workflow including import and export processAbility to interpret customer business processes, analyze problems and recommend programmable solutions.Risk DesignationThe role is classified as High Risk, due to access to Protected Healthcare Information. Employees in this role must be free of felony convictions on a background check report.Applying Procedure:Interested and qualified candidates are requested to apply with anupdated Resumeat[email\u00a0protected]with position applied as emailNote :Only shortlisted candidates will be contacted for the programming test and interviewFreshers are discouraged to applyNon-Java developers with good programming background and willing to switch to Java can applyKeep checking inbox regularly for email notificationOR,APPLY NOW", "Page_URL": "https://merojob.com/java-developer-benequick/"}, {"name": "SQL / Database Developer", "company": "Verisk Nepal", "level": "Mid Level", "vacancy": "1", "time": "Full Time", "address": "Lalitpur", "salary": "Negotiable", "deadline": "Nov. 15, 2020 23:55\n(1\u00a0week, 6\u00a0days from now)", "education": "Bachelor", "skills": "PlsqlSqlDatabase Management", "desct": "Basic Job InformationJob Category:IT & Telecommunication>Database Engineer/Database Programmer, Programmer/ Software EngineerJob Level:Mid LevelNo. of Vacancy/s:[1]Employment Type:Full TimeJob Location:LalitpurOffered Salary:NegotiableApply Before(Deadline):Nov. 15, 2020 23:55\n(1\u00a0week, 6\u00a0days from now)Job SpecificationEducation Level:BachelorExperience Required:More than or equals to 4 yearsProfessional Skill Required:PlsqlSqlDatabase ManagementOther SpecificationQualificationsBachelor\u2019s in computer science / Engineering.At least 4 years of experience working in TSQL/PLSQL.Skills and Expertise:Experience or Knowledge in AWS cloud services: S3, EC2, EMR, RDS, RedshiftExperience or Knowledge in relational SQL, Snowflake and NoSQL databases, including Postgres, working with the Apache Hadoop EcosystemGood working knowledge of python or Java or C#.Experience or Knowledge in Airflow system, and Tableau.Experience with Agile methodologiesGood knowledge of Shell scripting.Design and implement the development and release process including CICD based strategiesStrong knowledge in SQL scripting, procedures, functions and triggersExperience in data loading, analytics, logical and problem solvingSkilled at optimizing large complicated SQL statementsCapable of troubleshooting common database issuesKnowledge in DTS packagesHave experience working in MS Excel macros is a plus.Good interpersonal and communication skillsWillingness to learn new technologies as per requirement of the Project.Job DescriptionResponsibilities:Develop scripts to load different types of file and automate them through Airflow/Pentaho or ETL application.Develop file processing applications using python/java or C#.Develop, implement and optimize stored procedures and functions using T-SQLResearch required dataHandle common database issues and proceduresCollaborate with other team members and stakeholdersPrepare documentations and specificationsApplying ProcedurePlease apply through the below link :https://jobs.smartrecruiters.com/Verisk/743999721536849-senior-software-engineer-sql-developerorhttps://careers.smartrecruiters.com/Verisk?search=nepalAdditional Information:Verisk Analytics is an equal opportunity employer.All members of the Verisk Analytics family of companies are equal opportunity employers. We consider all qualified applicants for employment without regard to race, religion, color, national origin, citizenship, sex, gender identity and/or expression, sexual orientation, veteran's status, age or disability.http://www.verisk.com/careers.htmlUnsolicited resumes sent to Verisk, including unsolicited resumes sent to a Verisk business mailing address, fax machine or email address, or directly to Verisk employees, will be considered Verisk property. Verisk will NOT pay a fee for any placement resulting from the receipt of an unsolicited resume.Consumer Privacy Notice", "Page_URL": "https://merojob.com/front-end-ui-develope/"}, {"name": "Front End / UI Developer", "company": "Verisk Nepal", "level": "Mid Level", "vacancy": "1", "time": "Full Time", "address": "Lalitpur", "salary": "Negotiable", "deadline": "Nov. 15, 2020 23:55\n(1\u00a0week, 6\u00a0days from now)", "education": "Bachelor", "skills": "AngularUi/Ux", "desct": "Basic Job InformationJob Category:IT & Telecommunication>Programmer/ Software EngineerJob Level:Mid LevelNo. of Vacancy/s:[1]Employment Type:Full TimeJob Location:LalitpurOffered Salary:NegotiableApply Before(Deadline):Nov. 15, 2020 23:55\n(1\u00a0week, 6\u00a0days from now)Job SpecificationEducation Level:BachelorExperience Required:More than or equals to 3 yearsProfessional Skill Required:AngularUi/UxOther SpecificationQualificationsBachelor\u2019s in Computer Science, or related field or equivalent experienceAt least 3 years of professional experience in JavaScript / Angular TechnologySkills and KnowledgePassion for programming in general, rather than a specific languageBe focused, passionate, and strive to find simple solutions to complex problemsAbility to learn new, emerging technologiesYou have a solid general understanding of application components, what happens on the front end, what happens on the back end.You\u2019re a professional. That means you follow through on commitments, meet deadlines, don\u2019t cut corners, consider other people\u2019s ideas, play nice with the team, learn from your mistakes, document things and communicate honestly and proactively if you anticipate an issue doing any of the aboveAbility to effectively work on multiple projects simultaneously and effectively contend with competing prioritiesPossess strong troubleshooting, code optimization and refactoring skillsHave strong sense of ownership with demonstrated ability to work independently without supervisionTechnical Expertise:JavaScript frameworks (Angular 4+ - preferably the latest verison, AngularJS, React, jQuery), RxJs, Redux, Web markup languages (HTML/HTML5, XML) and Style sheet language (CSS/CSS3), SASS, LESSWell versed in using UX and UI design tools like Adobe Photoshop, Adobe Illustrator, Adobe InDesign and Adobe XDExperience in working with using html frameworks like Bootstrap and FoundationWriting tested and documented JavaScript withExpertise in build processes (Angular CLI, Webpack)Experienced in writing test cases and performing unit testing using frameworks (ex. Jasmine, Karma)Used DevOps and CI/CD in previous work experienceDeveloped software in SCRUM environment using Agile methodologies and involved in SDLC processJob DescriptionResponsibilitiesMake design and technical decisions for Angular projectsPerform unit testing by using different frameworks like Jasmine, KarmaBe involved in all phases of the agile software development lifecycleProactively seek out and minimize pain points within the infrastructure and code baseKeep up to date with the latest technologies and introduce them as neededCreate next-gen solutions for unique and challenging use casesCommunicate proactively with Business stakeholders and provide design suggestionsAnalyze, debug and fix defectsApplying ProcedurePlease apply through the below link :https://jobs.smartrecruiters.com/Verisk/743999721662476-software-engineer-front-end-developerorhttps://careers.smartrecruiters.com/Verisk?search=nepalAdditional Information:Verisk Analytics is an equal opportunity employer.All members of the Verisk Analytics family of companies are equal opportunity employers. We consider all qualified applicants for employment without regard to race, religion, color, national origin, citizenship, sex, gender identity and/or expression, sexual orientation, veteran's status, age or disability.http://www.verisk.com/careers.htmlUnsolicited resumes sent to Verisk, including unsolicited resumes sent to a Verisk business mailing address, fax machine or email address, or directly to Verisk employees, will be considered Verisk property. Verisk will NOT pay a fee for any placement resulting from the receipt of an unsolicited resume.Consumer Privacy Notice", "Page_URL": "https://merojob.com/front-end-ui-developer-2/"}, {"name": "QA Automation Engineer", "company": "Verisk Nepal", "level": "Mid Level", "vacancy": "2", "time": "Full Time", "address": "Lalitpur", "salary": "Negotiable", "deadline": "Nov. 15, 2020 23:55\n(1\u00a0week, 6\u00a0days from now)", "education": "Bachelor", "skills": "ProgrammingAutomationTestingQa", "desct": "Basic Job InformationJob Category:IT & TelecommunicationJob Level:Mid LevelNo. of Vacancy/s:[2]Employment Type:Full TimeJob Location:LalitpurOffered Salary:NegotiableApply Before(Deadline):Nov. 15, 2020 23:55\n(1\u00a0week, 6\u00a0days from now)Job SpecificationEducation Level:BachelorExperience Required:More than or equals to 1 yearProfessional Skill Required:ProgrammingAutomationTestingQaOther SpecificationQualificationsBachelor\u2019s in Computer Science, or related field or equivalent experience1 to 3 years of professional experience in Software Quality Assurance and Test AutomationSkills and KnowledgePassion to work and grow as a Software QA EngineerAbility to analyze acceptance criteria and discuss scenarios with team with a goal of identifying possible issues upfront even before the feature is developedAbility to build automated test scripts, plan tests and strategies according to the projectThorough and disciplined, ability to analyze a problem and weight severity of the issueDedicated worker skilled at collaborating in a team settingProven excellent problem-solving and analytic skillsDemonstrated excellent communication skillsFamiliarity with Agile workflow as well as Atlassian Jira and ConfluenceTechnical Expertise:Strong understanding of object-oriented programmingGood knowledge of a programming/scripting language \u2013 JAVA, C# .Net, Scripting, PythonKnack for writing clean, readable, and easily maintainable QA automation workflowsExperience in testing web services such as RESTful APIExperience in performance testing using tools such as Apache JMeterExperience of testing Search clusters like Solr, Lucene and Elastic SearchProficient in SQL and relational database concepts, experience or knowledge of NoSQL DB preferably MongoDBTechnically familiar with development concepts and formats such as SQL, XML, JSON and scripting languages with experience in testing non-GUI applicationsProficient understanding of code versioning tool and familiarity with Continuous Integration atmosphereKnowledge of AWS services would be a strong plus point.Job DescriptionResponsibilitiesAct as QA lead on a wide variety of projectsLead analysis for the purposes of developing test cases and test data for search intense back-end data applications in such a way that defects are uncovered as early as possibleClearly define test plans, scenarios, scripts, and proceduresPerform hands-on manual testing while scripting automated tests to ensure application functionality, performance and securityContinuously develop and socialize best practices for the design and development of robust and easily maintainable QA Automation Suites.Serve as a liaison to business analyst and product owner, providing feedback on application readiness for migrations.Be involved in all phases of the agile software development lifecycleApplying ProcedurePlease apply through the below link :https://careers.smartrecruiters.com/Verisk?search=nepalorhttps://jobs.smartrecruiters.com/Verisk/743999721769464-qa-automation-engineerAdditional Information:Verisk Analytics is an equal opportunity employer.All members of the Verisk Analytics family of companies are equal opportunity employers. We consider all qualified applicants for employment without regard to race, religion, color, national origin, citizenship, sex, gender identity and/or expression, sexual orientation, veteran's status, age or disability.http://www.verisk.com/careers.htmlUnsolicited resumes sent to Verisk, including unsolicited resumes sent to a Verisk business mailing address, fax machine or email address, or directly to Verisk employees, will be considered Verisk property. Verisk will NOT pay a fee for any placement resulting from the receipt of an unsolicited resume.Consumer Privacy Notice", "Page_URL": "https://merojob.com/qa-automation-engineer-7/"}, {"name": "Java Developer", "company": "Verisk Nepal", "level": "Mid Level", "vacancy": "4", "time": "Full Time", "address": "lalitpur", "salary": "Negotiable", "deadline": "Nov. 14, 2020 11:00\n(1\u00a0week, 4\u00a0days from now)", "education": "Bachelor", "skills": "JavaAws", "desct": "Basic Job InformationJob Category:IT & TelecommunicationJob Level:Mid LevelNo. of Vacancy/s:[4]Employment Type:Full TimeJob Location:lalitpurOffered Salary:NegotiableApply Before(Deadline):Nov. 14, 2020 11:00\n(1\u00a0week, 4\u00a0days from now)Job SpecificationEducation Level:BachelorExperience Required:More than or equals to 2 yearsProfessional Skill Required:JavaAwsOther SpecificationQualificationsBachelor\u2019s in Computer Science, or related field or equivalent experience2 to 3 years of professional experience in Java based application developmentSkills and KnowledgeHave strong sense of ownership with demonstrated ability to work independentlyBe focused, passionate, and strive to find simple solutions to complex problemsExcellent understanding of OOP design concepts and software development processes and methodsAbility to learn new, emerging technologiesYou have a solid general understanding of application components and search engines \u2013 what happens on the front end, what happens on the back end.You\u2019re a professional. That means you follow through on commitments, meet deadlines, don\u2019t cut corners, consider other people\u2019s ideas, play nice with the team, learn from your mistakes, document things and communicate honestly and proactively if you anticipate an issue doing any of the aboveAbility to effectively work on multiple projects simultaneously and effectively contend with competing prioritiesPossess strong troubleshooting, code optimization and refactoring skillsTechnical Expertise:Strong in JAVA programming and JAVA based technologies \u2013 JAVA 8+ features, J2EE Framework, Spring FrameworkExperience working in heavily multithreaded applicationExperience or knowledge of Search Engines like Solr, Lucene and Elastic SearchExperience in microservices architecture and RESTful API developmentKnowledge of SQL and NoSQL databases (preferably MongoDB, MSSQL and/or Postgres),Knowledge of queuing and messaging technologies like RabbitMQ, SNS and SQSProficient experience working with Maven, Jenkins, Bamboo, Octopus or any CI/CD tool and deep understanding of continuous integration/continuous delivery. Willing and able to work with DevOps team and contribute to CI/CDKnowledge of AWS services like EC2, S3, Lambda, API Gateway, Aurora PostgreSQL, DynamoDB, Elasticsearch is a strong plus pointJob DescriptionResponsibilitiesDesign, implement and maintain JAVA applicationTake part in software and architectural development activitiesBe involved in all phases of the agile software development lifecycleEngage in technical grooming discussions where you should be able to learn as well as contributeWrite well designed, testable, efficient codeProactively seek out and minimize pain points within the infrastructure and code baseKeep up to date with the latest technologies and introduce them as neededCreate next-gen solutions for unique and challenging use casesEnsure designs follow specificationsPrepare and produce releases of software componentsRecommend changes to improve established java application processesApplying ProcedurePlease apply through the below link :https://careers.smartrecruiters.com/Verisk?search=nepalorhttps://jobs.smartrecruiters.com/Verisk/743999721765581-software-engineer-java-developerAdditional Information:Verisk Analytics is an equal opportunity employer.All members of the Verisk Analytics family of companies are equal opportunity employers. We consider all qualified applicants for employment without regard to race, religion, color, national origin, citizenship, sex, gender identity and/or expression, sexual orientation, veteran's status, age or disability.http://www.verisk.com/careers.htmlUnsolicited resumes sent to Verisk, including unsolicited resumes sent to a Verisk business mailing address, fax machine or email address, or directly to Verisk employees, will be considered Verisk property. Verisk will NOT pay a fee for any placement resulting from the receipt of an unsolicited resume.Consumer Privacy Notice", "Page_URL": "https://merojob.com/java-developer-119/"}, {"name": "Senior System Engineer", "company": "Verisk Nepal", "level": "Senior Level", "vacancy": "1", "time": "Full Time", "address": "Lalitpur , Nepal", "salary": "Negotiable", "deadline": "Nov. 19, 2020 23:55\n(2\u00a0weeks, 3\u00a0days from now)", "education": "Bachelor", "skills": "Ldap/Ad As Well As Linux Shell/Pyt\u2026LinuxUnixDns", "desct": "Basic Job InformationJob Category:IT & TelecommunicationJob Level:Senior LevelNo. of Vacancy/s:[1]Employment Type:Full TimeJob Location:Lalitpur , NepalOffered Salary:NegotiableApply Before(Deadline):Nov. 19, 2020 23:55\n(2\u00a0weeks, 3\u00a0days from now)Job SpecificationEducation Level:BachelorExperience Required:More than or equals to 4 yearsProfessional Skill Required:Ldap/Ad As Well As Linux Shell/Pyt\u2026LinuxUnixDnsOther Specification4+ years of technical hands on experience, supporting and administering application and systemsPositive, energetic, and self-driven attitude to continually develop technical skills and troubleshoot issuesStrong communication skills - both verbal and writtenExperience in administering Windows/Linux systems, user management and application supportExperience with Linux, Unix, DNS, LDAP/AD as well as Linux shell/Python/PowerShell scripting is a plusFamiliarity with Microsoft SCCM is a plusGood knowledge of Networking (CCNA/CCNP or equivalent work experience)Expert in LAN and WAN management and troubleshooting, supporting multiple remote locationsKnowledge of SD-WAN, SD-BranchFamiliarity with Amazon Web Services a plusFamiliarity in DevOps tools (Chef/Ansible) is a plusJob DescriptionAt the heart of what we do is help clients manage risk. Verisk (Nasdaq: VRSK) provides data and insights to our customers in insurance, energy and the financial services markets so they can make faster and more informed decisions.Our global team uses AI, machine learning, automation, and other emerging technologies to collect and analyze billions of records. We provide advanced decision-support to prevent credit, lending, and cyber risks. In addition, we monitor and advise companies on complex global matters such as climate change, catastrophes, and geopolitical issues.But why we do our work is what sets us apart. It stems from a commitment to making the world better, safer and stronger.It\u2019s the reason Verisk is part of the UN Global Compact sustainability initiative. It\u2019s why we made a commitment to balancing 100 percent of our carbon emissions. It\u2019s the aim of our \u201creturnship\u201d program for experienced professionals rejoining the workforce after time away. And, it\u2019s what drives our annual Innovation Day, where we identify our next first-to-market innovations to solve our customers\u2019 problems.At its core, Verisk uses data to minimize risk and maximize value. But far bigger, is why we do what we do.At Verisk you can build an exciting career with meaningful work; create positive and lasting impact on business; and find the support, coaching, and training you need to advance your career.\u202fWe have received the Great Place to Work\u00ae Certification for the fourth consecutive year. We\u2019ve been recognized by Forbes as a World\u2019s Best Employer and a Best Employer for Women, testaments to our culture of engagement and the value we place on an inclusive and diverse workforce.\u00a0 Verisk\u2019s Statement on Racial Equity and Diversity supports our commitment to these values and affecting positive and lasting change in the communities where we live and work.We are looking for a talented and passionate System Engineer on our technology team. We are seeking a high-energy, motivated individual with strong technical, problem-solving, and communication skills to join our engineering team.\u00a0 The team is responsible for supporting, maintaining production systems and applications.\u00a0 The candidate will be working in a dynamic, fast paced agile environment whose responsibilities include:Providing technical supportTroubleshoot issues (Network and System)Analyze, install, monitor, and support of application and/or Operating SystemMaintain a high performing network infrastructure through routine monitoring, maintenance and troubleshootingCoordinates with service providers and vendors to ensure reliable serviceSupport and troubleshoot WAN/LAN circuits and servicesManage a variety of support requests to completion to support the needs of our users and clientsAdopting and working on new technologyApplying Procedure :Please apply through the below link :https://smrtr.io/4w8TtOR,APPLY NOW", "Page_URL": "https://merojob.com/senior-system-engineer-12/"}, {"name": "Javascript Developer", "company": "Gurzu Inc", "level": "Mid Level", "vacancy": "3", "time": "Full Time", "address": "Kathmandu", "salary": "Negotiable", "deadline": "Nov. 21, 2020 23:55\n(2\u00a0weeks, 5\u00a0days from now)", "education": "Bachelor", "skills": "Css3JavascriptHtmlNode.Js", "desct": "Basic Job InformationJob Category:IT & TelecommunicationJob Level:Mid LevelNo. of Vacancy/s:[3]Employment Type:Full TimeJob Location:KathmanduOffered Salary:NegotiableApply Before(Deadline):Nov. 21, 2020 23:55\n(2\u00a0weeks, 5\u00a0days from now)Job SpecificationEducation Level:BachelorExperience Required:More than or equals to 2 yearsProfessional Skill Required:Css3JavascriptHtmlNode.JsOther SpecificationAt least 2 years\u2019 hands-on front-end development work experienceStrong knowledge of at least one of the modern UI frameworks such as React or VueExcellent knowledge of HTML, CSS;Excellent knowledge of JavaScript and ES8;Experience in Restful services and Node JS and AMQPHands-on experience with build tools like Web-pack;Experience with agile methodologies (SCRUM framework) and Continuous Integration practicesExperience with reactive and functional programmingExperience in developing user-eccentric applicationsProven experience in leading and managing the delivery of projects, in addition any experience leading developers would be highly desirableBachelor's degree in Computer Science, Engineering, similar relevant fieldJob DescriptionArchitect, build and maintain a modern web application based on Node JS;Work closely with product designers in order to deliver great user experiences;Ownership of the whole development and deployment cycle;Collaborate with your team, participate in reviews and pairing sessions in order to ensure high level of code qualityUI/UX implementation using state of the art technologies including HTML 5, CSS 3, React, and further frameworksConception, implementation, and improvement of front-end applicationsExpertise in creating RESTful APIs and Web ServicesUnderstanding the nature of asynchronous programmingExperience in Mongo DB and SQL DBExcellent verbal and written communication skillsTeam spirit with an enthusiastic attitudeAPPLY NOW", "Page_URL": "https://merojob.com/javascript-developer-30/"}, {"name": "RoR developer", "company": "Gurzu Inc", "level": "Mid Level", "vacancy": "5", "time": "Full Time", "address": "Kathmandu", "salary": "Negotiable", "deadline": "Nov. 21, 2020 23:55\n(2\u00a0weeks, 5\u00a0days from now)", "education": "Bachelor", "skills": "Html5JavascriptPostgresqlDatabase Management", "desct": "Basic Job InformationJob Category:IT & TelecommunicationJob Level:Mid LevelNo. of Vacancy/s:[5]Employment Type:Full TimeJob Location:KathmanduOffered Salary:NegotiableApply Before(Deadline):Nov. 21, 2020 23:55\n(2\u00a0weeks, 5\u00a0days from now)Job SpecificationEducation Level:BachelorExperience Required:More than or equals to 3 yearsProfessional Skill Required:Html5JavascriptPostgresqlDatabase ManagementOther SpecificationAt least three years of demonstrable working experienceProficient on Ruby on RailsMust have a philosophical understanding of software development, deployment and maintenanceMust know the software development best practices, coding conventions and design patterns.Must be able to design/develop RESTful web APIsMust understand the concept, philosophy and importance of TDDProficient understanding of databases including Mongodb, MySQL. Postgresql etcVery good understanding of Git and Linux operating systemJob DescriptionHas a basic understanding of development best practices and comfortable writing codeUses and understands tools needed to debug and diagnose issues in a test and/or simple production environmentUnderstands the scope of medium featuresHas a basic understanding of all their product componentsPerforms standard programming tasksContributes to functional specifications and participates in code reviewsWrites and executes test plansAPPLY NOW", "Page_URL": "https://merojob.com/ror-developer-2/"}, {"name": "Mobile Developer", "company": "Gurzu Inc", "level": "Mid Level", "vacancy": "2", "time": "Full Time", "address": "Kathmandu", "salary": "Negotiable", "deadline": "Nov. 21, 2020 23:55\n(2\u00a0weeks, 5\u00a0days from now)", "education": "Bachelor", "skills": "TechnicalCommunicationProgramming Language", "desct": "Basic Job InformationJob Category:IT & TelecommunicationJob Level:Mid LevelNo. of Vacancy/s:[2]Employment Type:Full TimeJob Location:KathmanduOffered Salary:NegotiableApply Before(Deadline):Nov. 21, 2020 23:55\n(2\u00a0weeks, 5\u00a0days from now)Job SpecificationEducation Level:BachelorExperience Required:More than or equals to 2 yearsProfessional Skill Required:TechnicalCommunicationProgramming LanguageOther SpecificationMinimum 2 years working as a full-time professional mobile developer with at least 1-year experience in React NativeAt least 3 demonstrable apps made in React-Native or Native(Java/Kotlin/Swift/Objective C) available in stores or gitExcellent communication skills, both verbal and writtenWilling to learn and work on different mobile platforms/frameworks when neededBachelor\u2019s Degree in related technical fieldJob DescriptionWork with in a team to understand, collaborate and deliver the business goalsDevelop, build and deploy advanced applications for the iOS & Android platforms in React NativeDevelop clean, elegant and reusable code that is easy to maintain and extendLeverage native APIs for deep integrations with both iOS and Android platformsDevelop automated tests to ensure high quality of productsImplement third party library and API to the applicationBuilt pixel perfect and smooth UIs across multiple mobile platformsDetect and fix bugs and performance bottlenecksCollaborate with team to deliver an innovative solutionWork with team to understand existing applications and design new features to itKeeping yourself updated on current trends and technologies in this industryAPPLY NOW", "Page_URL": "https://merojob.com/mobile-developer-7/"}, {"name": "Product Designer", "company": "Gurzu Inc", "level": "Mid Level", "vacancy": "2", "time": "Full Time", "address": "Kathmandu", "salary": "Negotiable", "deadline": "Nov. 21, 2020 23:55\n(2\u00a0weeks, 5\u00a0days from now)", "education": "Bachelor", "skills": "Problem SolvingAnalyticalCommunicationCreative Thinking", "desct": "Basic Job InformationJob Category:IT & TelecommunicationJob Level:Mid LevelNo. of Vacancy/s:[2]Employment Type:Full TimeJob Location:KathmanduOffered Salary:NegotiableApply Before(Deadline):Nov. 21, 2020 23:55\n(2\u00a0weeks, 5\u00a0days from now)Job SpecificationEducation Level:BachelorExperience Required:More than or equals to 2 yearsProfessional Skill Required:Problem SolvingAnalyticalCommunicationCreative ThinkingOther SpecificationPrevious working experience as a Product Designer for minimum of 2 year(s)Strong knowledge of the industry and market trendsKnowledge of user centric design processes and methodsSharp analytical and problem-solving skillsExcellent attention to detailA well-rounded portfolio of client work, demonstrating a strong understanding of client objectivesCreativity in mixing up colors, shapes and techniquesOutstanding communication, presentation and leadership skillsFamiliarity with prototyping tools including InVision Studio, Sketch, XD and FigmaJob DescriptionTake part in user experience researchCreate prototypes, wireframes, sketches, journey maps, and other digital tools to test and improve product experiences in collaboration with internal and external customersUse research to challenge and validate design decisions in an ongoing development process that strives to make the customer experience betterDefine the right interaction model and evaluate its successFind creative ways to solve UX problems (e.g. usability, findability)Communicate design ideas and prototypes to developersAPPLY NOW", "Page_URL": "https://merojob.com/product-desinger/"}, {"name": "Machine Learning Engineer - Part Time", "company": "Chulo Solutions", "level": "Mid Level", "vacancy": "1", "time": "Part Time", "address": "Online", "salary": "NRs. 30,000.00 - 45,000.00 Monthly", "deadline": "Nov. 21, 2020 23:55\n(2\u00a0weeks, 5\u00a0days from now)", "education": "Bachelor", "skills": "Sequence ModelingNlpMachine LearningPythonCommunication", "desct": "Basic Job InformationJob Category:IT & Telecommunication>Programmer/ Software EngineerJob Level:Mid LevelNo. of Vacancy/s:[1]Employment Type:Part TimeJob Location:OnlineOffered Salary:NRs. 30,000.00 - 45,000.00 MonthlyApply Before(Deadline):Nov. 21, 2020 23:55\n(2\u00a0weeks, 5\u00a0days from now)Job SpecificationEducation Level:BachelorExperience Required:More than or equals to 3 yearsProfessional Skill Required:Sequence ModelingNlpMachine LearningPythonCommunicationJob DescriptionWe are looking for:An expert in machine learning to help us to design and build an online e-learning program.A person who can work part-time for about 15 - 20 hours a week. (It is remote work. Working hours can be decided according to your circumstances.)Required skills:Advanced degree in computer science, math, statistics or a related disciplineExtensive data modeling and data architecture skillsProgramming experience in PythonExperience in machine learning frameworks in python such as TensorFlow or KerasStrong knowledge about machine learning and deep learning algorithms such as k-Nearest, NLP and sequence modeling, along with CNNStrong written and verbal communications in EnglishCore responsibilities:Create, check, and modify online courses about machine learningCommunicate with the foreign team for any improvement in our online programsResearch, Design and Frame Machine Learning SystemsUnderstand and Transform the Prototypes of Data ScienceVerifying data quality, and/or ensuring it via data cleaningPerform Machine Learning Model Tests and ExperimentsDevelop the Machine Learning Model as per the NeedSelect and Implement Right Machine Learning AlgorithmsUnderstand Business Objectives and Developing the ML ModelsCompany benefits:Friendly, creative working environment with a foreign teamWorking with the latest technologiesTimely salary reviewRemote working policyApplying Procedure:If you believe you are the one and have a passion to work with us,APPLY NOWwithYour recent resume\u00a0in PDF formatYour desired weekly working hours and\u00a0monthly salaryat[email\u00a0protected].We are looking forward to receiving your application!OR,APPLY NOW", "Page_URL": "https://merojob.com/part-time-machine-learning-engineer-2/"}, {"name": "Sr. React Developer", "company": "Deerhold Nepal", "level": "Mid Level", "vacancy": "3", "time": "Full Time", "address": "Kathmandu", "salary": "Negotiable", "deadline": "Nov. 22, 2020 23:55\n(2\u00a0weeks, 6\u00a0days from now)", "education": "Bachelor", "skills": "Time ManagementCssHtmlCommunicationInterpersonal", "desct": "Basic Job InformationJob Category:IT & TelecommunicationJob Level:Mid LevelNo. of Vacancy/s:[3]Employment Type:Full TimeJob Location:KathmanduOffered Salary:NegotiableApply Before(Deadline):Nov. 22, 2020 23:55\n(2\u00a0weeks, 6\u00a0days from now)Job SpecificationEducation Level:BachelorExperience Required:More than or equals to 3 yearsProfessional Skill Required:Time ManagementCssHtmlCommunicationInterpersonalOther SpecificationBachelor\u2019s degree in Computer Science, Information Technology, or a similar fieldPrevious experience working as a React.js DeveloperIn-depth knowledge of JavaScript,the DOM, CSS, HTML and front-end languagesKnowledge of REACT tools including React.js, hooks, ReduxExperience with user interface designKnowledge of performance testing frameworks including JestExperience with browser-based debugging and performance testing softwareExcellent troubleshooting skillsFamiliarity with RESTful APIsExperience using GitExcellent communication skills, both written and verbalExperience in cloud platforms such as AWSExperience working on content modeling is a plus pointIn-depth experience working on custom CMS integration and developmentAble to work well on a remote, multi-national team with Agile and ScrumJob DescriptionAs a React Engineer, you are a self-motivated, life long learner with a passion for design and engineering. You love great UX. You like to keep up with the latest trends in the frontend and design world to ensure we are always using the best techniques possible. You are familiar with Agile Scrum. Beyond coding, you enjoy working in an evolving industry.Write codes in React/JavascriptCollaborate closely with the development team to design and launch new featuresTest and troubleshoot the systemUtilize test-driven development practices for the codes generatedSuggest and improve the functionality of the existing systemUtilize best practices with the technologies to ensure effective and efficient processing of tasksApplying Procedure:Interested and eligible candidates are requested to submit their updated resume to[email\u00a0protected]OR,APPLY NOW", "Page_URL": "https://merojob.com/sr-react-developer-2/"}, {"name": "Backend Developer (Python)", "company": "Tekvortex", "level": "Senior Level", "vacancy": "3", "time": "Full Time", "address": "Harihar Bhawan, Pulchowk", "salary": "Negotiable", "deadline": "Nov. 14, 2020 23:55\n(1\u00a0week, 5\u00a0days from now)", "education": "Bachelor", "skills": "PythonBackendData AnalyticsBig Data", "desct": "Basic Job InformationJob Category:IT & Telecommunication>Programmer/ Software EngineerJob Level:Senior LevelNo. of Vacancy/s:[3]Employment Type:Full TimeJob Location:Harihar Bhawan, PulchowkOffered Salary:NegotiableApply Before(Deadline):Nov. 14, 2020 23:55\n(1\u00a0week, 5\u00a0days from now)Job SpecificationEducation Level:BachelorExperience Required:More than or equals to 2 yearsProfessional Skill Required:PythonBackendData AnalyticsBig DataJob DescriptionThese are professional openings requiring a minimum of 2 years of experience in the software industry. Currently, we are seeking skilled and passionate development all-rounders to be key players in our dynamic team involved in the research and development of leading enterprise products and services globally.The ideal candidate will have extensive development experience working on enterprise grade SAAS applications. You will have the opportunity to work in a fast-paced environment. You should be ready and excited to learn and implement new technologies.ResponsibilitiesAnalyze product requirements and design/implement solutions to meet the sameMaintain, troubleshoot and enhance large scale enterprise applicationsEvaluate application performance and determine any applicable improvementsParticipate in the evolution of our technologies and practices, occasionally pitch new technologies that you believe in, and participate in workshops to learn new skillsUtilize various open source technologiesUse various tools to orchestrate solutionsBuild independent scripts, web-based tools,\u00a0micro-services\u00a0and solutionsWrite scripts and automation using Perl/Python/Bash etc.Configure and manage data sources/solutions like PostgreSQL, Redis, Hadoop, Athena etc.Desired Skills/CharacteristicsBachelor\u2019s\nDegree or MS in Engineering or equivalentFluency in\nprogramming in core Python on Linux using OOP concepts with focus on data\nanalytics (Pandas, NumPy) and visualization (Bokeh, Matplotlib, Plotly)Experience\nwith big data solutions, Hadoop and machine learning is highly desirableExperience\nworking with web services using REST APIsAdequate\nknowledge of relational and NoSQL database systemsWorking\nknowledge of R and Cloud Services (AWS preferred)Strong\nattention to detail while implementing technical specificationsAbility to\nwork effectively with largecode baseusing version control toolsAbility to\nwork and thrive in a fast-paced environment, learn rapidly and master\ndiverse technologies and techniquesCritical\nthinker, strong analytical, problem-solving and time-management skillsExcellent\nverbal and written English communication skillsWillingness\nto work in flexible hours overlapping with US office hours, if neededGood\nattitude and strong work ethics*Remuneration and benefits will be based on experience and will not be a constraint for deserving candidates.Applying Procedure:Candidates can also send their resume directly to[email\u00a0protected].\nPlease mention the vacancy you are applying for in the subject of the cover\nletter.OR,APPLY NOW", "Page_URL": "https://merojob.com/backend-developer-python-5/"}, {"name": "Flutter Developer", "company": "", "level": "Mid Level", "vacancy": "2", "time": "Full Time", "address": "Chakrapath, Kathmandu", "salary": "Negotiable", "deadline": "Nov. 09, 2020 23:55\n(1\u00a0week from now)", "education": "Bachelor", "skills": "Mobile Application DevelopmentFlutter", "desct": "Basic Job InformationJob Category:IT & TelecommunicationJob Level:Mid LevelNo. of Vacancy/s:[2]Employment Type:Full TimeJob Location:Chakrapath, KathmanduOffered Salary:NegotiableApply Before(Deadline):Nov. 09, 2020 23:55\n(1\u00a0week from now)Job SpecificationEducation Level:BachelorExperience Required:More than or equals to 2 yearsProfessional Skill Required:Mobile Application DevelopmentFlutterOther SpecificationMust have build different mobile applications, for iOS and Android usingNative as well as Hybrid platformMinimum 2 years of experience in flutter application developmentNeeds to have his/her own laptopJob DescriptionCollaborate with cross-functional teams to define, design, and ship new features.Work with outside data sources and APIs.Work on bug fixing and improving application performanceUnit-test code for robustness, including edge cases, usability, and general reliability.Continuously discover, evaluate, and implement new technologies to maximize development efficiency.Must have built at least one Android, iOS, apps with Flutter or Hybrid Framework.Must have knowledge of different state management & architecture pattern like provider, bloc.Mainly CRM, E-commerce, Social Network app will be assigned.APPLY NOW", "Page_URL": "https://merojob.com/flutter-developer-12/"}, {"name": "QA Engineer", "company": "Proshore Nepal", "level": "Senior Level", "vacancy": "1", "time": "Full Time", "address": "Tinkune Marg, Kathmandu, Nepal", "salary": "Negotiable", "deadline": "Nov. 17, 2020 23:55\n(2\u00a0weeks, 1\u00a0day from now)", "education": "Bachelor", "skills": "ProactiveCommunication", "desct": "Basic Job InformationJob Category:IT & Telecommunication>Database Engineer/Database Programmer, Programmer/ Software Engineer, Software Architect, Software Implementation, Web Developer/Web DesignerJob Level:Senior LevelNo. of Vacancy/s:[1]Employment Type:Full TimeJob Location:Tinkune Marg, Kathmandu, NepalOffered Salary:NegotiableApply Before(Deadline):Nov. 17, 2020 23:55\n(2\u00a0weeks, 1\u00a0day from now)Job SpecificationEducation Level:BachelorExperience Required:Not RequiredProfessional Skill Required:ProactiveCommunicationJob DescriptionWe want you to be a team player and a real problem solver. Together we want to create something valuable and useful for our customers.Personal Skills We ValueNatural curiosity around new technologies and toolsYou always believe there is a better or smarter way to solve problemsA mindset of creating a solution that is valuable for the end userYou like to achieve a goal within a teamYou are assertive and feel free to express yourself and your idea\u2019s in EnglishYour Technical Skill SetProactiveness on understanding the product and its flowCome up with new and creative ways to test our productPerform software quality assurance using various types of manual and automated testingOf course you know about Performance, Security & Integration TestingYes you work with the scrum team to deliver well-tested software in each sprintYou make suggestions, ask questions and is able to push the limits of the rest of the teamWhat We Have to Offer YouYour own workstation with dual monitorFlexible work timingFree Lunch and BreakfastParticipate in eventsExcellent career opportunitiesSpace for own initiativesHealth & Accidental insurance coverageRecreational activitiesPaid Paternity, Maternity, Marriage, Sick and Casual LeaveFloating Holiday'sOpen office environmentThis is what happens after you applyTell us more about yourself along with your CVLet's first have a 'virtual tea talk'\u00a0 to introduce Proshore, the role and to get to know you. This will be done by Hangouts or Skype.During the interview phase (of max 2 round) we'll inform you as soon as we've decided whether we'd like to proceed with youThe interview phase may include a technical assessment to test your technical skillsApplying ProcedureInterested and enthusiast candidates are encouraged to apply from our career page directlyhttps://careers.proshore.eu/qa-engineer", "Page_URL": "https://merojob.com/qa-engineer-40/"}, {"name": "UI/UX Designer", "company": "Proshore Nepal", "level": "Senior Level", "vacancy": "1", "time": "Full Time", "address": "Tinkune Marg, Kathmandu, Nepal", "salary": "Negotiable", "deadline": "Nov. 17, 2020 23:55\n(2\u00a0weeks, 1\u00a0day from now)", "education": "Bachelor", "skills": "Visual CommunicationWeb DesignCommunication", "desct": "Basic Job InformationJob Category:IT & Telecommunication>Database Engineer/Database Programmer, Programmer/ Software Engineer, Software Architect, Software Implementation, Web Developer/Web DesignerJob Level:Senior LevelNo. of Vacancy/s:[1]Employment Type:Full TimeJob Location:Tinkune Marg, Kathmandu, NepalOffered Salary:NegotiableApply Before(Deadline):Nov. 17, 2020 23:55\n(2\u00a0weeks, 1\u00a0day from now)Job SpecificationEducation Level:BachelorExperience Required:Not RequiredProfessional Skill Required:Visual CommunicationWeb DesignCommunicationJob DescriptionWe want you to be a team player and a real problem solver. Together we want to create something valuable and useful for our customers.Personal Skills We ValueNatural curiosity around new technologies and toolsYou always believe there is a better or smarter way to solve problemsA mindset of creating a solution that is valuable for the end userYou like to achieve a goal within a teamYou are assertive and feel free to express yourself and your idea\u2019s in EnglishYour Technical Skill SetBuild high-quality mockups and design using Adobe Suite, Sketch etcFollow best practices in responsive design, style standards on fonts, colors and imagesWrite optimized, industry-standard, cross-browser compatible HTML/CSSDeliver strong design based on business requirements, brand, strategy and user empathyWhat We Have to Offer YouYour own workstation with dual monitorFlexible work timingFree Lunch and BreakfastParticipate in eventsExcellent career opportunitiesSpace for own initiativesHealth & Accidental insurance coverageRecreational activitiesPaid Paternity, Maternity, Marriage, Sick and Casual LeaveFloating Holiday'sOpen office environmentThis is what happens after you applyTell us more about yourself along with your CVLet's first have a 'virtual tea talk'\u00a0 to introduce Proshore, the role and to get to know you. This will be done by Hangouts or Skype.During the interview phase (of max 2 round) we'll inform you as soon as we've decided whether we'd like to proceed with youThe interview phase may include a technical assessment to test your technical skillsApplying ProcedureInterested and enthusiast candidates are encouraged to apply from our career page directlyhttps://careers.proshore.eu/ui-ux-designer", "Page_URL": "https://merojob.com/uiux-designer-55/"}, {"name": "React Native Developer", "company": "Agile Solutions", "level": "Mid Level", "vacancy": "1", "time": "Full Time", "address": "Gairidhara, Kathmandu", "salary": "Negotiable", "deadline": "Nov. 12, 2020 23:55\n(1\u00a0week, 3\u00a0days from now)", "education": "Bachelor", "skills": "JavascriptNativeMobile Application DevelopmentReact", "desct": "Basic Job InformationJob Category:IT & Telecommunication>Mobile AppsJob Level:Mid LevelNo. of Vacancy/s:[1]Employment Type:Full TimeJob Location:Gairidhara, KathmanduOffered Salary:NegotiableApply Before(Deadline):Nov. 12, 2020 23:55\n(1\u00a0week, 3\u00a0days from now)Job SpecificationEducation Level:BachelorExperience Required:More than or equals to 2 yearsProfessional Skill Required:JavascriptNativeMobile Application DevelopmentReactOther SpecificationAt least 2 year experience of building mobile applications using React Native;Experience building and consuming APIs to interact with other applications using REST or GraphQL,Microsoft Graph API, OData etc;Proficiency with HTML, CSS, JavaScript;Experience both Android and IOS development;Experiencein working in an agile environment to quickly iterate and deliver features to users.Company Benefits:Medical, accidental, OPD and COVID-19 insurance schemeFree Lunch at officeCompetitive salary packages to the deserving candidatesAttractive incentives and bonusesA friendly, competitive and creative working environment with higher level of exposure to the top corporate housesPaid leaves in compliance with the labor laws to maintain the healthy work life balance of employeesLoan program facility in case of financial emergency with zero interestConveyance allowance scheme that covers day to day transportation costTechnology allowance program for the employees who prefer using their own laptopsJob DescriptionDesign and implement a mobile application for iOS and Android using React Native;Create a scalable, testable, documented application so that we can grow the product over time;Keep up with technology changes in our space and leverage them when appropriate;Leverage native APIs for deep integrations with both platforms;Build reusable components and front-end libraries for future use;Participate in product design, offer new ideas and understand that not every idea will be adopted;Diagnose and fix bugs and performance bottlenecks for performance that feels native;Work independently to delivery software on time;Document all aspect of your work.APPLY NOW", "Page_URL": "https://merojob.com/react-native-developer-8/"}, {"name": "NodeJS | Typescript | Angular | NestJS Developer", "company": "Thingerz", "level": "Senior Level", "vacancy": "2", "time": "Full Time", "address": "Remote, Work From Home", "salary": "NRs. 20,000.00 - 50,000.00 Monthly", "deadline": "Nov. 18, 2020 23:55\n(2\u00a0weeks, 2\u00a0days from now)", "education": "", "skills": "Node.JsJavascriptCommunicationAngular", "desct": "Basic Job InformationJob Category:IT & Telecommunication>Database Engineer/Database Programmer, Programmer/ Software Engineer, Web Developer/Web DesignerJob Level:Senior LevelNo. of Vacancy/s:[2]Employment Type:Full TimeJob Location:Remote, Work From HomeOffered Salary:NRs. 20,000.00 - 50,000.00 MonthlyApply Before(Deadline):Nov. 18, 2020 23:55\n(2\u00a0weeks, 2\u00a0days from now)Job SpecificationExperience Required:More than 2 yearsProfessional Skill Required:Node.JsJavascriptCommunicationAngularOther SpecificationRequired SkillsStrong proficiency with JavaScript and TypescriptStrong working experience with Node.jsExperience with Angular FrameworkExperience with MongoDBDesirable Skills:NestJS FrameworkAngular FrameworkIonic FrameworkTest Driven Development SkillsExperience with Socket IOJob DescriptionIntegration of user-facing elements developed by front-end developers with server side logicWriting reusable, testable, and efficient codeDesign and implementation of low-latency, high-availability, and performant applicationsImplementation of security and data protectionIntegration of data storage solutionsWrite modular, reusable and excellent quality code, code reviews, and implement best practicesTake responsibility of project and ensure robust hosting, application stability, security and system integrationSupport the migration and redeployment of existing application (if any)APPLY NOW", "Page_URL": "https://merojob.com/nodejs-typescript-developer/"}, {"name": "Android Developer", "company": "Foreveryng", "level": "Senior Level", "vacancy": "1", "time": "Full Time", "address": "Sanepa, Lalitpur", "salary": "Negotiable", "deadline": "Nov. 02, 2020 23:55\n(3\u00a0hours from now)", "education": "Bachelor", "skills": "Html5Sql/SqliteBug Fixing", "desct": "Basic Job InformationJob Category:IT & Telecommunication>Internet/E-commerce, Mobile AppsJob Level:Senior LevelNo. of Vacancy/s:[1]Employment Type:Full TimeJob Location:Sanepa, LalitpurOffered Salary:NegotiableApply Before(Deadline):Nov. 02, 2020 23:55\n(3\u00a0hours from now)Job SpecificationEducation Level:BachelorExperience Required:More than or equals to 2 yearsProfessional Skill Required:Html5Sql/SqliteBug FixingJob DescriptionWe are looking for an Android developer with 2 Years or more of Experience & responsible for the development and maintenance of applications aimed at a vast number of diverse Android devices. Your primary focus will be the development of Android applications and their integration with back-end services. You will be working along-side other engineers and developers working on different layers of the infrastructure. Therefore, a commitment to collaborative problem solving, sophisticated design, and creating quality products is essential.Skill RequiredKnowledge of Java Kotlin and Android StudioUnderstanding of Android Application Framework and Design PatternsGood understanding of UI placement, Wire frames and Design FlowGood understanding of REST Api, SQL/SQLite , HTML5 & ScriptingShould have Worked on bug fixing and improving application performance.APPLY NOW", "Page_URL": "https://merojob.com/android-developer-163/"}, {"name": "Front- End Developer", "company": "Foreveryng", "level": "Senior Level", "vacancy": "2", "time": "Full Time", "address": "Sanepa Height, Lalitpur", "salary": "Negotiable", "deadline": "Nov. 02, 2020 23:30\n(3\u00a0hours from now)", "education": "", "skills": "JavascriptSassReactVueUi/Ux", "desct": "Basic Job InformationJob Category:IT & Telecommunication>Graphic Designer, Internet/E-commerceJob Level:Senior LevelNo. of Vacancy/s:[2]Employment Type:Full TimeJob Location:Sanepa Height, LalitpurOffered Salary:NegotiableApply Before(Deadline):Nov. 02, 2020 23:30\n(3\u00a0hours from now)Job SpecificationExperience Required:More than 2 yearsProfessional Skill Required:JavascriptSassReactVueUi/UxJob DescriptionDesign UI/UX for Website and Mobile Application using tools like Figma or similar toolsConvert UI/UX designs into responsive website using front-end technologies, languages and frameworksImplement API to develop and maintain dynamic websiteAPPLY NOW", "Page_URL": "https://merojob.com/uiux-web-and-mobile-application-designer/"}, {"name": "Word Press Developer", "company": "Tej Solution", "level": "Mid Level", "vacancy": "1", "time": "Full Time", "address": "Kathmandu", "salary": "Negotiable", "deadline": "Nov. 02, 2020 23:55\n(3\u00a0hours from now)", "education": "Bachelor", "skills": "Css3Html5JqueryJavascript", "desct": "Basic Job InformationJob Category:IT & TelecommunicationJob Level:Mid LevelNo. of Vacancy/s:[1]Employment Type:Full TimeJob Location:KathmanduOffered Salary:NegotiableApply Before(Deadline):Nov. 02, 2020 23:55\n(3\u00a0hours from now)Job SpecificationEducation Level:BachelorExperience Required:More than or equals to 5 yearsProfessional Skill Required:Css3Html5JqueryJavascriptOther SpecificationSkills:Must have a Bachelor's degree in Computer Science or related field5+ years of experience as a web developerExperience creating and integrating custom WordPress plugins, themes, working with WordPress hooks and filtersExperience creating websites for a mobile-first strategyStrong knowledge of PHP web frameworksStrong knowledge of common PHP or web server exploits and their solutionsExperience with limitations of PHP as a platform and its workaroundsKnowledge of HTML5, CSS3, Sass, JavaScript, jQuery, and responsive frameworks (Foundation, Bootstrap)Experience with online usability, accessibility, and web analyticsExperience with development languages (Java or Python)Experience integrating or working with ad serving technologies (prebid, DFPP)Experience with software versioning and revision control systems (Subversion or Git)Job DescriptionWe are seeking an experienced, motivated and resourceful PHP / WordPress developer with a blend of back-end and front-end skills to serve as lead developer. In this highly collaborative role, you will work with front end developers, designers and content developers to build efficient, beautiful and responsive media/news focused websites.Responsibilities:Code new WordPress themes, page templates, and plugins from scratch and modify existing themes and pluginsCandidates with experience in Graphic Design, Java Script, HTML & CSS will be preferableBuild efficient, testable, and reusable PHP modules including dynamic content and personalization featuresIntegrate wide range of WordPress plugins, API calls and third party apps and forms, such as EloquaManage back-end services and interchange of data between server and user, including server-side logic and database integrationEnsure high performance and responsiveness to requests from front-endProvide front-end development of digital marketing communications, including full websites and micro-sites, landing pages, emails, and other initiativesDevelop, test and troubleshoot across multiple browsers, platforms and devices, including tablets and smartphones, to support a consistent and positive customer experienceProvide guidance on SEO best practices for site developmentResearch and recommend new technologies and tools for effective integration across various platformsAPPLY NOW", "Page_URL": "https://merojob.com/word-press-developer-7/"}, {"name": "Technical Writers (Work From Home)", "company": "ContentioLab", "level": "Entry Level", "vacancy": "12", "time": "Full Time", "address": "Kathmandu (Work from Home)", "salary": "NRs. 20,000.00 Monthly", "deadline": "Nov. 06, 2020 23:55\n(4\u00a0days, 3\u00a0hours from now)", "education": "Bachelor", "skills": "Critical ThinkingMultitaskingCommunication", "desct": "Basic Job InformationJob Category:IT & TelecommunicationJob Level:Entry LevelNo. of Vacancy/s:[12]Employment Type:Full TimeJob Location:Kathmandu (Work from Home)Offered Salary:NRs. 20,000.00 MonthlyApply Before(Deadline):Nov. 06, 2020 23:55\n(4\u00a0days, 3\u00a0hours from now)Job SpecificationEducation Level:BachelorExperience Required:Not RequiredProfessional Skill Required:Critical ThinkingMultitaskingCommunicationOther SpecificationBachelors in EngineeringIELTS above 6.5 or TOEFL above 79 will be an added advantageAbility to Work with Technical Writing ToolsExcellent written and verbal communication skillsProficiency in MS OfficeStrong attention to detailsSkilled at prioritization and multi-taskingJob DescriptionResearch, write, edit and\u00a0 technical dataCreate, maintain and update manuals, procedures, specifications and other documentsCreate, maintain and update installation instructions, training material and other technical documentsDesign and establish style guidelines and standards for texts and illustrations to meet business needsReview, revise, modify or edit documents prepared by othersCoordinate project plans, budget and determine resourcesCompile, organize and write online help files to support end-usersWrite technical documents in compliance to the company\u2019s established standards and guidelinesProvide writing, editing and design support to other team membersCategories:Computer Engineering/Bsc. CsIT -2; Proficiency in C#, .net, R-ProgrammingMechanical - 2Electrical - 3Electronics & Communication - 4Telecom- 1Office Hours:Morning Shift: 7:00 AM to 3:00 PMWorking Days:6 Days a WeekNote:Fresher can apply. Training will be provided.Selected candidates will be writing Technical & Engineering Reports for clients based in UK & Australia.Knowledge with good software fluency will be prioritizedApplying Procedure:Applicants are requested to drop their application letter and CV/Bio-data to[email\u00a0protected]CV Should Contain All Of The Academic Scores From Schooling To Your Recent Qualification.Only shortlisted candidates will be scheduled for an online Interview and further selection process(es).OR,APPLY NOW", "Page_URL": "https://merojob.com/technical-writers-work-from-home-2/"}, {"name": "Senior Node JS Backend Developer", "company": "Concinnity Limited", "level": "Senior Level", "vacancy": "1", "time": "Part Time", "address": "Kathmandu", "salary": "NRs. 40,000.00 - 60,000.00 Monthly", "deadline": "Nov. 07, 2020 23:55\n(5\u00a0days, 3\u00a0hours from now)", "education": "Bachelor", "skills": "Css3Html5Node.JsWeb Development", "desct": "Basic Job InformationJob Category:IT & Telecommunication>Programmer/ Software EngineerJob Level:Senior LevelNo. of Vacancy/s:[1]Employment Type:Part TimeJob Location:KathmanduOffered Salary:NRs. 40,000.00 - 60,000.00 MonthlyApply Before(Deadline):Nov. 07, 2020 23:55\n(5\u00a0days, 3\u00a0hours from now)Job SpecificationEducation Level:BachelorExperience Required:More than or equals to 5 yearsProfessional Skill Required:Css3Html5Node.JsWeb DevelopmentOther SpecificationSkills and Qualifications:5+ years of experience with Node.JSBS in computer science or engineeringStrong proficiency with JavaScriptFamiliar with AWS productsExperience with docker is a must. Knowledge of kubernetes is highly appreciated.Knowledge of Node.js and frameworks available such as Express, StrongLoopUnderstanding the nature of asynchronous programming and its quirks and workaroundsGood understanding of server-side templating languages such as Jade, EJSGood understanding of server-side CSS preprocessors such as Stylus, LessBasic understanding of front-end technologies, such as HTML5, and CSS3Understanding accessibility and security complianceUser authentication and authorization between multiple systems, servers, and environmentsIntegration of multiple data sources and databases into one systemUnderstanding fundamental design principles behind a scalable applicationUnderstanding differences between multiple delivery platforms, such as mobile vs. desktop, and optimizing output to match the specific platformCreating database schemas that represent and support business processesImplementing automated testing platforms and unit testsProficient understanding of code versioning tools, such as GitJob DescriptionWe are looking for a Node.js Developer responsible for managing the interchange of data between the server and the users. Your primary focus will be the development of all server-side logic, definition and maintenance of the central database, and ensuring high performance and responsiveness to requests from the front-end. You will also be responsible for integrating the front-end elements built by your co-workers into the application. Therefore, a basic understanding of front-end technologies is necessary as well.Responsibilities:Integration of user-facing elements developed by front-end developers with server side logicWriting reusable, testable, and efficient codeDesign and implementation of low-latency, high-availability, and performant applicationsIntegration of data storage solutionsImplementation of security and data protectionAPPLY NOW", "Page_URL": "https://merojob.com/senior-backend-developer-5/"}, {"name": "Senior Front-end Developer (Angular)", "company": "Concinnity Limited", "level": "Senior Level", "vacancy": "1", "time": "Part Time", "address": "Kathmandu", "salary": "NRs. 40,000.00 - 60,000.00 Monthly", "deadline": "Nov. 07, 2020 23:55\n(5\u00a0days, 3\u00a0hours from now)", "education": "Bachelor", "skills": "Html5CssCommunicationSearch Engine Optimization (Seo)", "desct": "Basic Job InformationJob Category:IT & Telecommunication>Programmer/ Software EngineerJob Level:Senior LevelNo. of Vacancy/s:[1]Employment Type:Part TimeJob Location:KathmanduOffered Salary:NRs. 40,000.00 - 60,000.00 MonthlyApply Before(Deadline):Nov. 07, 2020 23:55\n(5\u00a0days, 3\u00a0hours from now)Job SpecificationEducation Level:BachelorExperience Required:More than or equals to 5 yearsProfessional Skill Required:Html5CssCommunicationSearch Engine Optimization (Seo)Other SpecificationSkills and Qualifications5+ years of experience with AngularBS degree in computer science or engineeringProficiency with JavaScript and HTML5Professional, precise communication skillsDeep knowledge of Angular practices and commonly used modules based on extensive work experienceCreating self-contained, reusable, and testable modules and componentsEnsuring a clear dependency chain, in regard to the app logic as well as the file systemAbility to provide SEO solutions for single page appsExtensive knowledge of CSS and JS methods for providing performant visual effects.Thorough understanding of the responsibilities of the platform, database, API, caching layer, proxies, and other web services used in the systemValidating user actions on the client side and providing responsive feedbackWriting non-blocking code, and resorting to advanced techniques such as multi-threading, when neededCreating custom, general use modules and components which extend the elements and modules of core AngularExperience with all levels of operation available to the front-end, such as from creating XHRs in vanilla JS to using a custom wrapper around $resourceExperience with building the infrastructure for serving the front-end app and assetsArchitecting and automating the build process for production, using task runners or scriptsDocumenting the code inline using JSDoc or other conventionsWriting extensive unit tests using automated TDD tasksCreating e2e test suites for all components, and running them with Protractor (or a well reasoned alternative)Creating configuration, build, and test scripts for Continuous Integration environmentsJob DescriptionWe are looking for an AngularJS Developer responsible for the client side of our service. Your primary focus will be to implement a complete user interface in the form of a mobile and desktop web app, with a focus on performance. Your main duties will include creating modules and components and coupling them together into a functional app. The artistic design will be delivered to you, together with a few HTML templates, but we will ask for your help in regard to animations, CSS, and final HTML output. You will work in a team with the back-end developer, and communicate with the API using standard methods. A thorough understanding of all of the components of our platform and infrastructure is required.ResponsibilitiesDelivering a complete front end applicationEnsuring high performance on mobile and desktopWriting tested, idiomatic, and documented JavaScript, HTML and CSSCoordinating the workflow between the graphic designer, the HTML coder, and yourselfCooperating with the back-end developer in the process of building the RESTful APICommunicating with external web servicesAPPLY NOW", "Page_URL": "https://merojob.com/senior-front-end-developer-angular/"}, {"name": "Full Stack Developer", "company": "Doransoft Pvt. Ltd.", "level": "Mid Level", "vacancy": "3", "time": "Full Time", "address": "Kathmandu", "salary": "Negotiable", "deadline": "Nov. 12, 2020 23:55\n(1\u00a0week, 3\u00a0days from now)", "education": "Bachelor", "skills": "LaravelNode.JsReactCss3Postgresql", "desct": "Basic Job InformationJob Category:IT & TelecommunicationJob Level:Mid LevelNo. of Vacancy/s:[3]Employment Type:Full TimeJob Location:KathmanduOffered Salary:NegotiableApply Before(Deadline):Nov. 12, 2020 23:55\n(1\u00a0week, 3\u00a0days from now)Job SpecificationEducation Level:BachelorExperience Required:More than or equals to 2 yearsProfessional Skill Required:LaravelNode.JsReactCss3PostgresqlOther SpecificationShould have minimum of 2 years of work experienceHands on experience writing NodeJS + AngularJS/ReactJS + PostgreSQL / MySQL / MongoDB code in productionExperience building highly scalable service APIs (REST, SOAP, Microservices) hosted on cloud environmentExperience with Agile Development, SCRUM, or Extreme Programming methodologies Skills RequiredStrong experience in HTML5, CSS3, Javascript, JQuery and latest Javascript frameworks (Backbone, Bootstrap,Node.js etc)Experience in one or more MVC frameworks(Laravel, Codeigniter, Ruby on Rails, Spring) is a plusCan provide support for existing applicationsSelf Motivated and open minded personGood learning attitudeExperience in integration and deliveryAbility to liaise at all levels within the businessSolid analysis and problem-solving skillsJob DescriptionWe are a conscientious, reliable, creative and diligent team from Nepal with strong work ethics. We comprehend the beauty of digital products and deploy our passion to differentiate our self as a leading digital team. We represent and project client's goals and objectives in an artistic and digital form. We are the Software Developers, Web/Mobile Application developers, designers and marketers helping to bridge the gap between a business and its customers. We are recognized by the values we adopt like result oriented, individualized attention, creative, methodical, ethical and futuristic thinking. We impart the concrete combination of artistry and engineering and make new things familiar. We deliver what have been promised forthwith with the joint effort of our competent and devoted team members.Ability to work independently or as part of a teamIdentify technical problems and procedures and communicate their applicable solutionsParticipate in collecting information for developing enterprise level applicationsBe part of development team to migrate web applications in other technologies into NodeJS and MongoDB environmentResolve issues related to web application like cross-browser compatibility, security issues and moreDeveloping scalable applications (both Front-end (ReactJS / ReactJS Native and Back-end NodeJS)Basic Knowledge of secure coding practices as it pertains to OWASPExperience of working in a SCRUM/Agile team would be added valueWriting reusable code and libraries, optimize applications for performance and scalabilityDesign and implementation of low-latency, high-availability, and performance applicationsBuilding secured backend API's to be consumed by multiple applications (e.g. web and mobile) Implementation of security and data protectionWhat We OfferDashain BonusYour own workstationAnnual Paid LeavesFree LunchExcellent career opportunities5 days a weekOpen office environmentAPPLY NOW", "Page_URL": "https://merojob.com/full-stack-developer-41/"}, {"name": "Software Engineer", "company": "NBIT", "level": "Mid Level", "vacancy": "1", "time": "Full Time", "address": "Kumaripati, Lalitpur", "salary": "Negotiable", "deadline": "Nov. 07, 2020 23:55\n(5\u00a0days, 3\u00a0hours from now)", "education": "Bachelor", "skills": "C#JavascriptWeb DevelopmentAsp.NetAgile Development", "desct": "Basic Job InformationJob Category:IT & Telecommunication>Programmer/ Software EngineerJob Level:Mid LevelNo. of Vacancy/s:[1]Employment Type:Full TimeJob Location:Kumaripati, LalitpurOffered Salary:NegotiableApply Before(Deadline):Nov. 07, 2020 23:55\n(5\u00a0days, 3\u00a0hours from now)Job SpecificationEducation Level:BachelorExperience Required:More than or equals to 2 yearsProfessional Skill Required:C#JavascriptWeb DevelopmentAsp.NetAgile DevelopmentOther SpecificationSkills Required:Experience in .net coreGood understanding of AJAX , JavaScript Dom manipulation TechniquesExperience in JavaScript build tools .Expert in any one of the modern JavaScript MV-VM/MVC frameworks (AngularJS, JQuery, NodeJS, Vue.js)Ability to work independently or as part of a teamExperience of working in SCRUM/Agile teamExcellent communication skills both verbal and writtenStrong\u00a0creative, logical and analytical skillsQualification\u00a0Required:More than or equals to 2 years of experience withAsp.net, C#Bachelor\u2019s degree in IT or related streamJob DescriptionUtilize established development tools, guidelines and conventions including but not limited toASP.NET, SQL Server, HTML/HTML5/XHTML, CSS, JavaScript, and C#Design, code and test new web & Windows software applicationsEnhance existing systems by analyzing business objectives, preparing an action plan and identifying areas for modification and improvementMaintain existing software systems by identifying and correcting software defectsResearch and develop skills in new technologiesProactively initiate, develop, and maintain effective working relationships with team membersWe Provide:Provident fund schemesWorking in a team environment where initiative and dedication is encouragedHigh level of responsibility and excellent career possibilitiesOpen international work environment5 Working Days per WeekDashain BonusFlexible working environmentTeam Building ActivitiesTimely Salary Review and Performance AppraisalsAPPLY NOW", "Page_URL": "https://merojob.com/software-engineer-104/"}, {"name": "Java Backend Engineer", "company": "", "level": "Senior Level", "vacancy": "1", "time": "Full Time", "address": "Remote", "salary": "$. 700.00 - 1,200.00 Monthly", "deadline": "Nov. 10, 2020 23:55\n(1\u00a0week, 1\u00a0day from now)", "education": "Bachelor", "skills": "JavaCssJquery", "desct": "Basic Job InformationJob Category:IT & Telecommunication>Programmer/ Software EngineerJob Level:Senior LevelNo. of Vacancy/s:[1]Employment Type:Full TimeJob Location:RemoteOffered Salary:$. 700.00 - 1,200.00 MonthlyApply Before(Deadline):Nov. 10, 2020 23:55\n(1\u00a0week, 1\u00a0day from now)Job SpecificationEducation Level:BachelorExperience Required:More than or equals to 2 yearsProfessional Skill Required:JavaCssJqueryOther SpecificationEssential SkillsJava 11Strong understanding of the Spring ecosystemStrong understanding of HibernateStrong understanding of the need and applications of Dependency InjectionStrong understanding of SOLID principles and Clean ArchitectureStrong understanding and experience with unit testing (Mockito, JUnit 5, AssertJ)Strong understanding of authentication and authorization with JWT tokensStrong understanding of GradleFamiliarity with KubernetesFamiliarity with integrating 3rd party vendorsFamiliarity with DockerFamiliarity with PostgreSQL and schema migrations (Liquibase)Familiarity with DDDFamiliarity with integration testingDesirable SkillsTerraformHelm/KustomizeKnowledge of GCP ecosystemGeneral understanding of CI/CD pipelines and DevOpsGeneral understanding of networkingInstrumentation and monitoringJob DescriptionLooking for a Java Backend Developer to help develop a unique temporary staffing platform allowing companies to connect with workers on an ad hoc basisYou need a strong grasp of English, and willing to work remotely with our team in the UKCollaborating with the front-end developers and other team members to establish objectives and design more functional, cohesive codes to enhance the user experienceAPPLY NOW", "Page_URL": "https://merojob.com/java-backend-engineer/"}, {"name": "Front End Developer", "company": "Socheko.com", "level": "Mid Level", "vacancy": "2", "time": "Full Time", "address": "Kathmandu", "salary": "Negotiable", "deadline": "Nov. 09, 2020 23:55\n(1\u00a0week from now)", "education": "Bachelor", "skills": "JavascriptCssDebugging", "desct": "Basic Job InformationJob Category:IT & Telecommunication>Internet/E-commerce, Web Developer/Web DesignerJob Level:Mid LevelNo. of Vacancy/s:[2]Employment Type:Full TimeJob Location:KathmanduOffered Salary:NegotiableApply Before(Deadline):Nov. 09, 2020 23:55\n(1\u00a0week from now)Job SpecificationEducation Level:BachelorExperience Required:Not RequiredProfessional Skill Required:JavascriptCssDebuggingOther SpecificationUndertake development\noperational tasks to design website according to online shopping\nrequirementBuild end to end websites\nalongside new features and widgetsDesign/Develop product and\ninterface concepts from their earliest stages.Develop frontend web\napplicationsCollaborate closely with the\ninter office team for any changes in theme & designConduct a test-driven development\napproach for the codes writtenEnsure the technical\nfeasibility of UI/UX designsOptimize application for\nmaximum speed and scalabilityJob DescriptionSkill full in Website designingKnowledge about JS frontend\ntechnologyExperience on Data\nVisualization & Familiar with Developer toolsHTML5, SASS (CSS 3)Have to possess good\nknowledge of software life cycle, database relations, and data structuresShould be able to write\nlibraries and modular codes from scratch.Deep understanding of JS\nprogramming, database modelling and design, scalable web architectureAPPLY NOW", "Page_URL": "https://merojob.com/front-end-developer-98/"}, {"name": "UI/UX Designer", "company": "Agile Solutions", "level": "Mid Level", "vacancy": "1", "time": "Full Time", "address": "Gairidhara, Kathmandu", "salary": "Negotiable", "deadline": "Nov. 12, 2020 23:55\n(1\u00a0week, 3\u00a0days from now)", "education": "Bachelor", "skills": "Wireframing And Ui PrototypingVisual CommunicationInteraction DesignUx ResearchAnalytics", "desct": "Basic Job InformationJob Category:IT & TelecommunicationJob Level:Mid LevelNo. of Vacancy/s:[1]Employment Type:Full TimeJob Location:Gairidhara, KathmanduOffered Salary:NegotiableApply Before(Deadline):Nov. 12, 2020 23:55\n(1\u00a0week, 3\u00a0days from now)Job SpecificationEducation Level:BachelorExperience Required:More than or equals to 1 yearProfessional Skill Required:Wireframing And Ui PrototypingVisual CommunicationInteraction DesignUx ResearchAnalyticsOther SpecificationUp-to-date knowledge of design software like Adobe,\nIllustrator and PhotoshopKnowledge of wireframe tools (e.g. Figma, Sketch, XD,Wireframe.ccand InVision)Knowledge of design language like CSS, Android XML\nlayoutCompany Benefits:Medical, accidental, OPD and COVID-19 insurance schemeFree Lunch at officeCompetitive salary packages to the deserving candidatesAttractive incentives and bonusesA friendly, competitive and creative working environment with higher level of exposure to the top corporate housesPaid leaves in compliance with the labor laws to maintain the healthy work life balance of employeesLoan program facility in case of financial emergency with zero interestConveyance allowance scheme that covers day to day transportation costTechnology allowance program for the employees who prefer using their own laptopsJob DescriptionGather and evaluate user requirements in collaboration with Managersllustrate design ideas using storyboards, process flows and sitemapsDesign graphic user interface elements, like menus, tabs and widgetsDevelop UI mockups and prototypes that clearly illustrate how sites function and look likeCreate original graphic designs (e.g. images, sketches and tables)Prepare and present rough drafts to internal teamsIdentify and troubleshoot UX problems (e.g. responsiveness)Conduct layout adjustments based on user feedbackAdhere to style standards on fonts, colors and imagesAPPLY NOW", "Page_URL": "https://merojob.com/uiux-designer-53/"}, {"name": "Business Intelligence", "company": "Safalsathi Incorporate Pvt. Ltd.", "level": "Mid Level", "vacancy": "1", "time": "Full Time", "address": "Kathmandu, Nepal", "salary": "Negotiable", "deadline": "Nov. 13, 2020 23:55\n(1\u00a0week, 4\u00a0days from now)", "education": "Bachelor", "skills": "Problem SolvingExcelAnalyticalCommunication", "desct": "Basic Job InformationJob Category:IT & TelecommunicationJob Level:Mid LevelNo. of Vacancy/s:[1]Employment Type:Full TimeJob Location:Kathmandu, NepalOffered Salary:NegotiableApply Before(Deadline):Nov. 13, 2020 23:55\n(1\u00a0week, 4\u00a0days from now)Job SpecificationEducation Level:BachelorExperience Required:Less than 1 yearProfessional Skill Required:Problem SolvingExcelAnalyticalCommunicationOther SpecificationBachelor\u2019s degree in Information Technology, Computer Science, Engineer or related discipline preferred6 months to 1 year of work experience with proven ability to manage multiple complex projects and clients under tight deadlinesHigh proficiency in Excel; experience with the latest BI features in ExcelStrong SQL skillsBackground in analytics or statistics preferredMust be intellectually curious\u2014innately driven to ask questions and dive into the details and obsessed with problem solving and finding efficiencies to help grow an ever- changing businessExcellent Verbal and Written English skillsJob DescriptionInterpret massive quantitative data, analyze results using statistical techniques and provide ongoing reportsIdentify trends or patterns in complex data setsConduct full analytical life cycle activities which include data gathering, data extraction, analysis, and presentation of resultsIdentify and resolve issues systematically and collect feedback for further modificationFilter and clean data, and review reports, and performance indicators to locate and correct problemAPPLY NOW", "Page_URL": "https://merojob.com/business-intelligence-3/"}, {"name": "Content Writer (Commercial)", "company": "Safalsathi Incorporate Pvt. Ltd.", "level": "Mid Level", "vacancy": "1", "time": "Full Time", "address": "Kathmandu, Nepal", "salary": "Negotiable", "deadline": "Nov. 13, 2020 23:55\n(1\u00a0week, 4\u00a0days from now)", "education": "Bachelor", "skills": "OrganizationalMs OfficeCommunicationSearch Engine Optimization (Seo)", "desct": "Basic Job InformationJob Category:IT & Telecommunication>Content DeveloperJob Level:Mid LevelNo. of Vacancy/s:[1]Employment Type:Full TimeJob Location:Kathmandu, NepalOffered Salary:NegotiableApply Before(Deadline):Nov. 13, 2020 23:55\n(1\u00a0week, 4\u00a0days from now)Job SpecificationEducation Level:BachelorExperience Required:More than or equals to 2 yearsProfessional Skill Required:OrganizationalMs OfficeCommunicationSearch Engine Optimization (Seo)Other SpecificationKnowledge, Skills and Ability:Proficiency in English and Nepali writing with experience in translation, proofreading and subtitlingExperience in producing copy for digital, print and broadcast channels.Understanding of SEO concepts preferredExceptional skill with the nuances of social media writing, including the use of hashtags, emoji\u2019s and acronymsProficiency with Microsoft Office software, including Word, Excel, PowerPointA collaborative work ethic and easy-going natureAbility to take constructive criticism with ease and graceExperienced at multi-tasking and is not intimidated by the thought of juggling multiple projects and tasks at onceAbility to collaborate across all teams and can own projects from start to finishExcellent organizational, verbal and written communication skillsJob DescriptionWrite original, high- engagement contents that reflects our brand\u2019s voice in various mediums such as for advertisements, media releases, corporate releases, videos, blogs, social media etcCollaborate with Marketing, PR and Customer Service to develop a variety of contentsPrepare and publish articles that describe the company and productsShape language and tone used in sales emails, banners and brochuresLiaise with designers to enrich text with visual aids like images and chartsProduce error-free content that adheres to the company\u2019s style guidelinesSimultaneously manage multiple projects with short deadlinesAPPLY NOW", "Page_URL": "https://merojob.com/content-writer-commercial/"}, {"name": "React Web Developer", "company": "Youth Innovation Lab", "level": "Mid Level", "vacancy": "1", "time": "Full Time", "address": "Bishalnagar/ Work from home available.", "salary": "Negotiable", "deadline": "Nov. 14, 2020 23:55\n(1\u00a0week, 5\u00a0days from now)", "education": "Bachelor", "skills": "JavascriptReact JsDebugging", "desct": "Basic Job InformationJob Category:IT & TelecommunicationJob Level:Mid LevelNo. of Vacancy/s:[1]Employment Type:Full TimeJob Location:Bishalnagar/ Work from home available.Offered Salary:NegotiableApply Before(Deadline):Nov. 14, 2020 23:55\n(1\u00a0week, 5\u00a0days from now)Job SpecificationEducation Level:BachelorExperience Required:More than or equals to 2 yearsProfessional Skill Required:JavascriptReact JsDebuggingOther SpecificationMinimum 2 years of experience in JavaScript / React JS TechnologyExperience with user interface designHands-on experience on working with Mapbox GL JS and Mapbox studio is a mustProficient in React and React state management through both Context API and ReduxUnderstanding of Typescript and its implementation in React projectsExperience working with webpack bundler, Babel, ESLintHaving Knowledge of Jest, Recharts and D3 is a plus pointSome experience with version control tool like GitA good understanding of REST APICapable of writing clean and reusable components with re-usability in mindRock solid at working with third-party dependencies and debugging dependency conflictsJob DescriptionPassion for programming in general, rather than a specific languageAbility to learn new, emerging technologiesCommunicate with the technical team, express ideas, and collaborate with the team throughout the design and development processesWriting application interface codes using JavaScript following React.js workflowsPossess strong troubleshooting, code optimization and refactoring skillsDeveloping and implementing front-end architecture to support user interface conceptsDocumenting application changes and developing updatesApplying Procedure:Applicants are requested to drop their CV and cover letter in mentioned mail:srijan@youthinnovationlab.orgAPPLY NOW", "Page_URL": "https://merojob.com/react-web-developer/"}, {"name": "System Administrator", "company": "Khalti Digital Wallet", "level": "Mid Level", "vacancy": "1", "time": "Full Time", "address": "Bakhundole, Lalipur", "salary": "Negotiable", "deadline": "Nov. 03, 2020 23:55\n(1\u00a0day, 3\u00a0hours from now)", "education": "Bachelor", "skills": "Problem SolvingNetworkingLinuxCommunicationInterpersonal", "desct": "Basic Job InformationJob Category:IT & TelecommunicationJob Level:Mid LevelNo. of Vacancy/s:[1]Employment Type:Full TimeJob Location:Bakhundole, LalipurOffered Salary:NegotiableApply Before(Deadline):Nov. 03, 2020 23:55\n(1\u00a0day, 3\u00a0hours from now)Job SpecificationEducation Level:BachelorExperience Required:More than or equals to 2 yearsProfessional Skill Required:Problem SolvingNetworkingLinuxCommunicationInterpersonalOther SpecificationMinimum 2 years of relevant and progressive work\nexperience in Network and SystemAdministrationHaving worked in a company with a large customer\nbase and high traffic workloadsJob RequirementsMinimum Bachelor\u2019s Degree in Computer Science\n(IT)/ Computer Engineering orequivalent.Good knowledge of the Linux/Windows server\nenvironment.Good knowledge in networking, routing and\nswitching.Hands-on experience on Router, Switches, Network\nfirewalls, VPN(IPsec, SSL), LoadBalancers, Nginx, WAP, WAF)Knowledge of virtualization and storage(VMware,\nXEN)Knowledge of cloud computing(AWS, GCP) services\nand technologiesKnowledge of Docker, Ansible, Terraform and\nsimilar DevOps tools shall be an addedadvantage.Basic knowledge of web vulnerabilities and\nsecurity.Basic knowledge of VOIP technologies.(Asterisk,\nElastix, GSM gateways, IP-Phones)Good analytical and problem-solving skills.Additional certification (CCNA/RHCE/MCSE/AWS)\nwill be an added advantage.Excellent written and verbal communication and\ninterpersonal skills.Strong ability to source information from users,\nvendors, and colleagues and deliver it tothe required audienceJob DescriptionWork with a team of System Administrators to monitor the existing system infrastructure,\nbackbone network, application delivery network, applications, and services.Perform installation, configuration, and maintenance of Linux/Windows Servers and\napplications in a virtualization-based infrastructure.Proactively manage and install network routers, switches, servers, and firewall systems.Administration of windows server and maintaining Active Directory, DNS, NPS, File and\nStorage, DHCP.Participate in designing a network, system infrastructure, and Data Center management.Maintain proper backup and recovery of the system.Upgrade systems with new releases and patchesCoordinate with vendors and service providers for connectivity, support, and infra related\nincidents in the production environmentApplying Procedure:Interested candidates are requested to send their recently updated resume to[email\u00a0protected]along with a cover letter mentioning your work and academic credentials.Note:While sending your CV via mail please mention the position you are applying for.OR,APPLY NOW", "Page_URL": "https://merojob.com/system-administrator-56/"}, {"name": "SEO Associate", "company": "Khalti Digital Wallet", "level": "Mid Level", "vacancy": "1", "time": "Full Time", "address": "Kathmandu", "salary": "Negotiable", "deadline": "Nov. 08, 2020 23:55\n(6\u00a0days, 3\u00a0hours from now)", "education": "Bachelor", "skills": "JavascriptCssHtmlWordpress", "desct": "Basic Job InformationJob Category:IT & TelecommunicationJob Level:Mid LevelNo. of Vacancy/s:[1]Employment Type:Full TimeJob Location:KathmanduOffered Salary:NegotiableApply Before(Deadline):Nov. 08, 2020 23:55\n(6\u00a0days, 3\u00a0hours from now)Job SpecificationEducation Level:BachelorExperience Required:More than or equals to 1 yearProfessional Skill Required:JavascriptCssHtmlWordpressOther SpecificationConduct research and testing to determine effective topics/keywords for Khalti Website and Blog postsCreate content briefs using keyword researchWrite SEO-optimized headlines and meta dataWork on off-site link building initiativesGood understanding of Search Engine OptimizationFamiliar with WordPress, HTML, CSS and Javascript preferredJob DescriptionDevelop optimization strategies that increase the company's search engine results rankingsResearch SEO keywords to use throughout the company's website and marketing materialsWork on Off-site link buildingMonitor daily performance metrics to understand SEO strategy performanceEfficiently communicate with other marketing professionals to align goalsWrite compelling and high-quality website content, including blog posts and page descriptionsUpdate content and website links for maximum optimization and search engine rankingsApplying Procedure:Interested candidates are requested to send their recently updated resume to[email\u00a0protected]along with a cover letter mentioning your work and academic credentials.Note:While sending your CV via mail please mention the position you are applying for.OR,APPLY NOW", "Page_URL": "https://merojob.com/seo-associate/"}, {"name": "Senior Front-End Developer", "company": "Web Experts Nepal", "level": "Senior Level", "vacancy": "2", "time": "Full Time", "address": "Satdobato", "salary": "Negotiable", "deadline": "Nov. 06, 2020 23:55\n(4\u00a0days, 3\u00a0hours from now)", "education": "Bachelor", "skills": "Css3JavascriptHtmlGulpCoding", "desct": "Basic Job InformationJob Category:IT & TelecommunicationJob Level:Senior LevelNo. of Vacancy/s:[2]Employment Type:Full TimeJob Location:SatdobatoOffered Salary:NegotiableApply Before(Deadline):Nov. 06, 2020 23:55\n(4\u00a0days, 3\u00a0hours from now)Job SpecificationEducation Level:BachelorExperience Required:More than or equals to 2 yearsProfessional Skill Required:Css3JavascriptHtmlGulpCodingOther SpecificationMinimum 2+ years experience with HTML5/CSS3 and BootstrapKnowledge on SASS would add credibility to your chancesShould be able to handle sketch, illustrators , adobe premier, ZeplinMust have good knowledge on Javascript, Gulp etcKnowledge on SEO headers and coding standardsShould possess excellent written and spoken englishMust understand work culture of remote working (due to current situation)Ability to work under tight deadlines with flexible timingExperience with version control such as GitJob DescriptionWork with the team in cohesion and extract the design specifications from client's requirementConvert PSDs to responsive web development with the company's coding standardsAble to lead a team of few and have the zeal to undertake new design trends and be bold enough to present to othersHave a good understanding of SRS and sketch out tasks for milestonesCreativity will be tested on daily basis and will be challenged to better it dailyApplying Procedure:If you are looking to work in exciting environment then send in your application along with a Cover letter to[email\u00a0protected]OR,APPLY NOW", "Page_URL": "https://merojob.com/senior-front-end-developer-13/"}, {"name": "Software Engineering Manager", "company": "Cloudyfox Technology", "level": "Mid Level", "vacancy": "1", "time": "Full Time", "address": "Anamnagar, Kathmandu", "salary": "Negotiable", "deadline": "Nov. 13, 2020 23:55\n(1\u00a0week, 4\u00a0days from now)", "education": "Bachelor", "skills": "LeadershipAnalyticalCommunicationInterpersonal", "desct": "Basic Job InformationJob Category:IT & TelecommunicationJob Level:Mid LevelNo. of Vacancy/s:[1]Employment Type:Full TimeJob Location:Anamnagar, KathmanduOffered Salary:NegotiableApply Before(Deadline):Nov. 13, 2020 23:55\n(1\u00a0week, 4\u00a0days from now)Job SpecificationEducation Level:BachelorExperience Required:More than or equals to 3 yearsProfessional Skill Required:LeadershipAnalyticalCommunicationInterpersonalOther SpecificationSkills and Qualifications:Minimum of a bachelor\u2019s degree in engineering/computer science or relatedfieldsMaster\u2019s degree in related field will be added advantage3+ years of engineering experience, ideally in a leading a small team roleAnalytical and mathematical mind, capable of evaluating and solving various\u00a0 complex problemsLeadership skills necessary to manage and develop a teamOrganizational competencies and project management skills to keep projects, processes, and the entire engineering team on trackSelf-motivated attitude with the ability to multitask and thrive in a timeline-driven environmentInterpersonal communication skills with expertise in distilling complicated topics to a broader audienceAbility to work individually or as part of a teamJob DescriptionWe are seeking an experienced, detail-oriented engineering manager to join our growing team. In this position, you will play a key role in the overall success of our organization by planning, managing, and monitoring engineering functions. You will be responsible for overseeing various engineering projects, processes, budgets, and timelines and making any necessary adjustments in order to ensure successful completion.Responsibilities:Serve as the engineering leader and technical expertAnswer questions and resolve issues brought forth by the engineering teammembersCreate detailed engineering plans, processes, and procedures for engineering staff to use and abide byPropose and oversee budgets and timelines for engineering projectsCheck and confirm the accuracy of the work performed and the methods used by engineering staffConduct various tests and quality assurance checks to verify the quality ofcompleted projectsMonitor and determine various staffing and training needsHire, train, and supervise engineering staff membersSpearhead various research and development initiatives to identify opportunities for new projects and improved processesCommunicate and collaborate with other managers, suppliers, and contractorsPrepare and deliver various engineering-related presentations, both internally and externallyBe a mentor to the teamMotivate the team and bring their voice to top levelsAPPLY NOW", "Page_URL": "https://merojob.com/engineer-manager/"}, {"name": "Sr Software Engineer - Go Lang", "company": "Cloudyfox Technology", "level": "Senior Level", "vacancy": "1", "time": "Full Time", "address": "Anamnagar, Kathmandu", "salary": "Negotiable", "deadline": "Nov. 13, 2020 23:55\n(1\u00a0week, 4\u00a0days from now)", "education": "Bachelor", "skills": "GraphqlGrpcTdd", "desct": "Basic Job InformationJob Category:IT & TelecommunicationJob Level:Senior LevelNo. of Vacancy/s:[1]Employment Type:Full TimeJob Location:Anamnagar, KathmanduOffered Salary:NegotiableApply Before(Deadline):Nov. 13, 2020 23:55\n(1\u00a0week, 4\u00a0days from now)Job SpecificationEducation Level:BachelorExperience Required:Not RequiredProfessional Skill Required:GraphqlGrpcTddOther SpecificationSkills:Strong knowledge of Go programming language, paradigms, constructs, and idiomsKnowledge of common Goroutine and channel patternsExperience with the full site of Go frameworks and toolsDependency management tools such as Godep, Sltr, etc.Go\u2019s templating languageGo\u2019s code generation tools, such as StringerPopular Go web frameworks, such as RevelRouter packages, such as Gorilla MuxAbility to write clean and effective Godoc commentsFamiliarity with code versioning tools GitTDDExperience on docker or AWS Lambdas will be added advantageExperience with GraphQL, gRPC would be added advantageJob DescriptionWe are looking for a great Go developer who possesses a strong understanding of how best to leverage and exploit the language\u2019s unique paradigms, idioms, and syntax. Your primary focus will be on developing robost microservices using Go. You will ensure that these Go packages and programs are well documented and has a reasonable test coverage. You will coordinate with the rest of the team working on different layers of theinfrastructure. A commitment to collaborative problem solving, sophisticated design, and quality product is essential.Responsibilities:Writing scalable, robust, testable, efficient, and easily maintainable codeTranslating software requirements into stable, working, high performance softwarePlaying a key role in architectural and design decisions, building toward an efficient micro services distributed architecturePeer programming & Code reviewImproving the teamAPPLY NOW", "Page_URL": "https://merojob.com/sr-software-engineer-go-lang/"}, {"name": "Quality Assurance Engineer", "company": "Cloudyfox Technology", "level": "Mid Level", "vacancy": "1", "time": "Full Time", "address": "Anamnagar, Kathmandu", "salary": "Negotiable", "deadline": "Nov. 13, 2020 23:55\n(1\u00a0week, 4\u00a0days from now)", "education": "Bachelor", "skills": "Problem SolvingCritical ThinkingTechnicalAnalyticalCommunication", "desct": "Basic Job InformationJob Category:IT & TelecommunicationJob Level:Mid LevelNo. of Vacancy/s:[1]Employment Type:Full TimeJob Location:Anamnagar, KathmanduOffered Salary:NegotiableApply Before(Deadline):Nov. 13, 2020 23:55\n(1\u00a0week, 4\u00a0days from now)Job SpecificationEducation Level:BachelorExperience Required:Not RequiredProfessional Skill Required:Problem SolvingCritical ThinkingTechnicalAnalyticalCommunicationOther SpecificationSkills and Qualifications:BS/BA in computer science, engineering, information technology, or related fieldProven work experience as a QA tester or similar role Significant work history showing aptitude for project management and QA methodologyWorking knowledge of Agile frameworks and regression testing is a plusCompetence in all technical skills needed to document and troubleshoot errorsExperience and familiarity with test management software and SQLStrong critical thinking skills, an analytical mind, and problem-solving aptitudeBe willing to help your teammates, share your knowledge with them, and learn from themBe open to receiving constructive feedback and turning it into process improvementsJob DescriptionWe are currently seeking a highly-skilled Quality Assurance Engineer to assess software quality through manual and automated testing. In this position, you must have a keen eye for detail, excellent organizational, and communication skills. Critical thinking and problem-solving abilities are a must, as well as skilled execution of test cases and a passion for quality.Responsibilities:Review and analyze requirements, specifications, and technical design documents, providing timely feedbackDevelop detailed, comprehensive, and well-structured test plans and test casesCollaborate with QA Engineers to develop effective strategies and test plansConsistently execute test cases (manual and/or automated) and analyze results in a timely mannerEvaluate product code according to specificationsPlay the role of test engineer: Design, develop, and execute automated testsGenerate logs to document testing phases and defectsEffectively report bugs and errors to development teams Help troubleshoot issues.Follow-through and conduct post-release/post-implementation testing Work with cross-functional teams to ensure quality throughout the software development lifecyclePrioritize and plan testing activitiesAPPLY NOW", "Page_URL": "https://merojob.com/quality-assurance-engineer-23/"}, {"name": "Sr Software Engineer \u2013 NodeJS", "company": "Cloudyfox Technology", "level": "Senior Level", "vacancy": "1", "time": "Full Time", "address": "Anamnagar, Kathmandu", "salary": "Negotiable", "deadline": "Nov. 13, 2020 23:55\n(1\u00a0week, 4\u00a0days from now)", "education": "Bachelor", "skills": "Css3Html5Node.JsTypescript", "desct": "Basic Job InformationJob Category:IT & TelecommunicationJob Level:Senior LevelNo. of Vacancy/s:[1]Employment Type:Full TimeJob Location:Anamnagar, KathmanduOffered Salary:NegotiableApply Before(Deadline):Nov. 13, 2020 23:55\n(1\u00a0week, 4\u00a0days from now)Job SpecificationEducation Level:BachelorExperience Required:Not RequiredProfessional Skill Required:Css3Html5Node.JsTypescriptOther SpecificationSkills and Qualifications:Strong proficiency with JavaScriptTypeScriptVery good Knowledge of Node.js & ExpressThe nature of asynchronous programming and its quirks and workaroundsGood understanding of server-side templating languages eg JadeGood understanding of server-side CSS preprocessorsBasic understanding of front-end technologies, such as HTML5, and CSS3Understanding accessibility and security complianceUser authentication and authorization between multiple systems, servers, and environmentsIntegration of multiple data sources and databases into one systemUnderstanding fundamental design principles behind a scalable applicationUnderstanding differences between multiple delivery platforms, such as mobile vs. desktop, and optimizing output to match the specific platformCreating database schemas that represent and support business processesImplementing automated testing platforms and unit testsProficient understanding of code versioning tools, such as GitWe follow TDD so testing should be a easy thing for youWe love AWS so expertise on Lambdas, ECS , DynamoDB will be an addedadvantageExperience with GraphQL would be added advantageJob DescriptionWe are looking for a Node.js Developer to join our awesome team. Your primary focus will be building, documenting, shipping & maintaining apis. Also you will help other engineers & coding ninjas with feedbacks, reviews etc.Responsibilities:Follow api first design and build robust apis for microservicesWriting reusable, testable, and efficient codeDesign and implementation of low-latency, high-availability, and performantapplications, servicesImplementation of security and data protectionIntegration with databases preferably NoSQL - DynamoDBWork in team, is very important, you not only grow yourself, but you growtogetherYou should be flexible & openYou should do sometime peer programming & code reviewsAPPLY NOW", "Page_URL": "https://merojob.com/sr-software-engineer-nodejs/"}, {"name": "Sr iOS Developer \u2013 Swift", "company": "Cloudyfox Technology", "level": "Senior Level", "vacancy": "1", "time": "Full Time", "address": "Anamnagar, Kathmandu", "salary": "Negotiable", "deadline": "Nov. 13, 2020 23:55\n(1\u00a0week, 4\u00a0days from now)", "education": "Bachelor", "skills": "GitTddRestful ApisUi/Ux", "desct": "Basic Job InformationJob Category:IT & TelecommunicationJob Level:Senior LevelNo. of Vacancy/s:[1]Employment Type:Full TimeJob Location:Anamnagar, KathmanduOffered Salary:NegotiableApply Before(Deadline):Nov. 13, 2020 23:55\n(1\u00a0week, 4\u00a0days from now)Job SpecificationEducation Level:BachelorExperience Required:Not RequiredProfessional Skill Required:GitTddRestful ApisUi/UxOther SpecificationSkillsProficient with Objective-C or Swift, and Cocoa TouchExperience with iOS frameworks such as Core Data, Core Animation, etc.Experience with offline storage, threading, and performance tuningFamiliarity with RESTful APIs to connect iOS applications to back-end servicesKnowledge of other web technologies and UI/UX standardsUnderstanding of Apple\u2019s design principles and interface guidelinesKnowledge of low-level C-based libraries is preferredExperience with performance and memory tuning with tools such as InstrumentsFamiliarity with cloud message APIs and push notificationsKnack for benchmarking and optimizationProficient understanding of GitTDDFamiliarity with continuous integrationJob DescriptionWe are looking for an iOS developer who will be responsible for developing applications for mobile devices powered by Apple\u2019s iOS operating system. Your primary focus will be development of iOS applications and their integration with back-end services. You should be proficient with one of the two programming languages for this platform: Objective-C or Swift.You must also have a strong understanding of the patterns and practices that revolve around the iOS platform. You will be working alongside other engineers and developers working on different layers of the infrastructure. Therefore, a commitment to collaborative problem solving, sophisticated design, and the creation of quality products is essential.ResponsibilitiesDesign and build applications for the iOS platformWriting scalable, robust, testable, efficient, and easily maintainable codeEnsure the performance, quality, and responsiveness of applicationsCollaborate with a team to define, design, and ship new featuresIdentify and correct bottlenecks and fix bugsHelp maintain code quality, organization, and automatizationAPPLY NOW", "Page_URL": "https://merojob.com/sr-ios-developer-swift/"}, {"name": "Sr Android Developer \u2013 Kotlin", "company": "Cloudyfox Technology", "level": "Senior Level", "vacancy": "1", "time": "Full Time", "address": "Anamnagar, Kathmandu", "salary": "Negotiable", "deadline": "Nov. 13, 2020 23:55\n(1\u00a0week, 4\u00a0days from now)", "education": "Bachelor", "skills": "GitTddRestful Apis", "desct": "Basic Job InformationJob Category:IT & TelecommunicationJob Level:Senior LevelNo. of Vacancy/s:[1]Employment Type:Full TimeJob Location:Anamnagar, KathmanduOffered Salary:NegotiableApply Before(Deadline):Nov. 13, 2020 23:55\n(1\u00a0week, 4\u00a0days from now)Job SpecificationEducation Level:BachelorExperience Required:Not RequiredProfessional Skill Required:GitTddRestful ApisOther SpecificationSkillsProficient with Java or Kotlin, and Android StudioStrong knowledge of Android SDK, different versions of Android, and how to deal with different screen sizesFamiliarity with RESTful APIs to connect Android applications to back-end servicesStrong knowledge of Android UI design principles, patterns, and best practicesExperience with offline storage, threading, and performance tuningAbility to design applications around natural user interfaces, such as \u201ctouch\u201dFamiliarity with the use of additional sensors, such as gyroscopes and accelerometersKnowledge of the open-source Android ecosystem and the libraries available for common tasksAbility to understand business requirements and translate them into technical requirementsFamiliarity with cloud message APIs and push notificationsA knack for benchmarking and optimizationUnderstanding of Google\u2019s Android design principles and interface guidelinesProficient understanding of GitTDDFamiliarity with continuous integrationJob DescriptionWe are looking for an iOS developer who will be responsible for developing applications for devices powered by the Android operating system. Your primary focus will be the development of Android applications and their integration with back-end services. Due to the fragmentation ofthis ecosystem, you must pay special attention to the application\u2019s compatibility with multiple versions of Android and device types.You must also have a strong understanding of the patterns and practices that revolve around such a platform. You will be working along-side other engineers and developers working on different layers of the infrastructure. Therefore, commitment to collaborative problem solving, sophisticated design, and creating quality products is essential.ResponsibilitiesDesign and build applications for the Android platformTranslate designs and wireframes into high quality codeWriting scalable, robust, testable, efficient, and easily maintainable codeEnsure the performance, quality, and responsiveness of applicationsCollaborate with a team to define, design, and ship new featuresIdentify and correct bottlenecks and fix bugsHelp maintain code quality, organization, and automatizationAPPLY NOW", "Page_URL": "https://merojob.com/sr-android-developer-kotlin/"}, {"name": "Backend Developer", "company": "Sharelook PTE LTD", "level": "Senior Level", "vacancy": "1", "time": "Full Time", "address": "Kathmandu, Nepal", "salary": "NRs. 60,000.00 - 90,000.00 Monthly", "deadline": "Nov. 13, 2020 23:55\n(1\u00a0week, 4\u00a0days from now)", "education": "Bachelor", "skills": "CdkDevopsBack End DeveloperAws ArchitectNode.Js", "desct": "Basic Job InformationJob Category:IT & TelecommunicationJob Level:Senior LevelNo. of Vacancy/s:[1]Employment Type:Full TimeJob Location:Kathmandu, NepalOffered Salary:NRs. 60,000.00 - 90,000.00 MonthlyApply Before(Deadline):Nov. 13, 2020 23:55\n(1\u00a0week, 4\u00a0days from now)Job SpecificationEducation Level:BachelorExperience Required:Not RequiredProfessional Skill Required:CdkDevopsBack End DeveloperAws ArchitectNode.JsOther SpecificationStrongly capable NodeJS developer, preferably experience with typescriptExperience with AWS and Lambda's a plus, training will be provided by senior AWS serverless professionalUnderstanding of cybersecurity and efficient codingExperience with DevOps a plusStrong Typescript developerExperience with CDK a plusAble to communicate effectively in EnglishAble to travel when neededJob DescriptionWe are looking for:Experienced NodeJS (Java script) developer.\u00a0 (AWS architect is a plus)Be the technical product owner of an existing hybrid serverless backend system on AWSResponsibilitiesImplement security and optimisation improvementsImprove DevOps and automated CI/CD workflowBe responsible for ensuring security and privacy compliance in all backend codeOversee evolving the platform to AWS\u00a0 (from Serverless framework) and typescript (from javascript)Responsible for publishing new changes to live and monitoring the live platformAPPLY NOW", "Page_URL": "https://merojob.com/backend-developer-28/"}, {"name": "Machine Learning", "company": "Sharelook PTE LTD", "level": "Mid Level", "vacancy": "1", "time": "Full Time", "address": "Kathmandu, Nepal", "salary": "NRs. 80,000.00 - 100,000.00 Monthly", "deadline": "Nov. 13, 2020 23:55\n(1\u00a0week, 4\u00a0days from now)", "education": "Bachelor", "skills": "Ai/MlDatabaseJupyterSparkPython Developer", "desct": "Basic Job InformationJob Category:IT & TelecommunicationJob Level:Mid LevelNo. of Vacancy/s:[1]Employment Type:Full TimeJob Location:Kathmandu, NepalOffered Salary:NRs. 80,000.00 - 100,000.00 MonthlyApply Before(Deadline):Nov. 13, 2020 23:55\n(1\u00a0week, 4\u00a0days from now)Job SpecificationEducation Level:BachelorExperience Required:More than or equals to 3 yearsProfessional Skill Required:Ai/MlDatabaseJupyterSparkPython DeveloperOther SpecificationYour experience should include:Demonstratable practical experience with machine learning and data science techniquesProven competency in managing your own time and projectsCapable Python developer (with a focus on data science)Familiar with tools such as Jupyter, Spark, databases, etc.Familiar with AI/ML models and strategiesFamiliar with cloud-based ML services a plus (e.g. AWS Sagemaker, Athena, etc.)At least 3 years of relevant working experienceRelevant education a plusJob DescriptionThis is a very hands-on role covering the full data lifecycle: collection, preparation, analysis and reporting. As the lead data scientist you will be expected to be independent and take the initiative with new ideas and feature suggestions for the platform.Natural Language Processing (NLP) will often be a big part of what we do, understanding, interpretating and re-using written and spoken contentDeep learning for data categorisation, course design and content matchingData analytics to drive insights about study progress, knowledge gaps, learning goals, etc.Reporting directly to the owner, your responsibilities will include:Working with the user-facing teams to determine of ML can solve particular requirementsOwnership of all collected data, ensuring it is stored and accessible in a format optimised for data analyticsMonitoring and analysing collected data, and making suggestions on additional data that could be captured for new insightsDesigning and training of models to achieve new data insights and add or improve platform featuresAPPLY NOW", "Page_URL": "https://merojob.com/natural-language-processing/"}, {"name": "WordPress Developer", "company": "Web Experts Nepal", "level": "Mid Level", "vacancy": "3", "time": "Full Time", "address": "Kathmandu", "salary": "Negotiable", "deadline": "Nov. 29, 2020 23:55\n(3\u00a0weeks, 6\u00a0days from now)", "education": "Bachelor", "skills": "JavascriptJqueryCommunicationPhp Framework", "desct": "Basic Job InformationJob Category:IT & TelecommunicationJob Level:Mid LevelNo. of Vacancy/s:[3]Employment Type:Full TimeJob Location:KathmanduOffered Salary:NegotiableApply Before(Deadline):Nov. 29, 2020 23:55\n(3\u00a0weeks, 6\u00a0days from now)Job SpecificationEducation Level:BachelorExperience Required:More than or equals to 2 yearsProfessional Skill Required:JavascriptJqueryCommunicationPhp FrameworkOther SpecificationQualification:Bachelors in related field is MUST but we do not undermine the skill sets possessed by a personnel who do not meet minimum education criteriaSkills:Should have 2+ year experience working with real time WordPress projectsShould have adequate knowledge in\u00a0 PHP, MYSQL, JavaScript, jQueryGood knowledge in any PHP frameworks is a plusGood understanding of React is of high valueMust be comfortable working in multiple projects across different framework and platformShould be highly enthusiastic, eager to learn and have strong problem solving skillBe able to document your work and direct project hand-over documentation and/or usage guidesMust have strong communication and written skills (English)Job DescriptionSit with Technical Lead and Projects Coordinator in Requirement Analysis and Features BreakdownDiscuss with team for Estimates based on Features BreakdownSetup Working Environment and maintain files through version control (Git)Follow Company's Coding standards to achieve results with minimum (if not nil) deviationsDevelop and Test builds that meet Client's requirementPerform Unit Testing and make multiple commitsDeploy on staging or on client's serverProvide factual and detailed update document to clientHandle updates and take charge to complete the project based on the timeline and milestones sketchedConduct knowledge sharing session and should always be looking to introduce new and efficient development trendsCompany BenefitsCompetitive SalaryAmazing team of enthusiasts where learning never goes southLunch, Snacks, Tea & Beverages with other refreshmentsFlexible Time SlotTimely Performance Review and Salary IncrementAdrenaline and Adventurous excursions on timely basis along with Office partyDashain and Project/Performance bonusesTraveling allowanceApplying Procedure:Send your updated resume to[email\u00a0protected]. We would schedule an interview from the final shortlist.OR,APPLY NOW", "Page_URL": "https://merojob.com/wordpress-developer-196/"}, {"name": "UI/UX Designer", "company": "Versatile Information Solutions", "level": "Mid Level", "vacancy": "1", "time": "Full Time", "address": "Birendra Marg, Dill bazar, Kathmandu", "salary": "Negotiable", "deadline": "Nov. 30, 2020 23:55\n(4\u00a0weeks from now)", "education": "Bachelor", "skills": "LlustratorPhotoshopCommunicationAftereffectIndesign", "desct": "Basic Job InformationJob Category:IT & TelecommunicationJob Level:Mid LevelNo. of Vacancy/s:[1]Employment Type:Full TimeJob Location:Birendra Marg, Dill bazar, KathmanduOffered Salary:NegotiableApply Before(Deadline):Nov. 30, 2020 23:55\n(4\u00a0weeks from now)Job SpecificationEducation Level:BachelorExperience Required:Not RequiredProfessional Skill Required:LlustratorPhotoshopCommunicationAftereffectIndesignOther SpecificationSkills and Qualifications:Knowledge of current designs, trends and techniques.Expert in Photoshop, llustrator, Indesign, AftereffectsHave knowledge of software like Premier Pro, AftereffectsKnowledge of Typography and colour schemesAbility to prioritise tasks and work on deadlinesAbility to work from homeAbility to come up with creative ideas and conceptsFlexible, responsible and focused on the assigned jobFamiliar with social mediaExcellent communication skillNote:This role is not open for freshers and beginnersJob DescriptionBranding Designs (Logos, promotional banners, social media banners,\u00a0GIFs)Designing creative graphics content for websitesNewsletters - Creating designs, convert site designs in different formats PSD into HTML and XHTMLDesigning and Customising Landing PagesSkills and knowledge about page layout, typography, colour theory, and aesthetic design conceptsBranding short videosWorking Hours:4 hours per day, Sunday \u2013 FridayApplying Procedure:Email us your CV and some design samples at[email\u00a0protected]ORAPPLY NOW", "Page_URL": "https://merojob.com/uiux-designer-54/"}, {"name": "Wordpress Developer", "company": "Versatile Information Solutions", "level": "Mid Level", "vacancy": "1", "time": "Full Time", "address": "Birendra Marg, Dill bazar, Kathmandu", "salary": "Negotiable", "deadline": "Nov. 30, 2020 23:55\n(4\u00a0weeks from now)", "education": "Bachelor", "skills": "JavascriptCssHtmlPhpRestful", "desct": "Basic Job InformationJob Category:IT & TelecommunicationJob Level:Mid LevelNo. of Vacancy/s:[1]Employment Type:Full TimeJob Location:Birendra Marg, Dill bazar, KathmanduOffered Salary:NegotiableApply Before(Deadline):Nov. 30, 2020 23:55\n(4\u00a0weeks from now)Job SpecificationEducation Level:BachelorExperience Required:More than or equals to 3 yearsProfessional Skill Required:JavascriptCssHtmlPhpRestfulOther SpecificationSkills and Qualifications:At least 3 years\u2019 experience working on WordPress platformProven Experience in PHP, mySQL,HTML,CSS and JavascriptExperience in customizing WordPress Plugins and WordPress themesKnowledge of CodeIgnitor, Laravel would be a plusAbility to use RestFul web services and experience in working withJSON and AJAX RequestExtremely detail-oriented with strong attention to detailsProactive and able to work autonomouslyFlexible in work functions and dutiesAbility to prioritise tasks and work on deadlinesMust be a team playerMust be able to work from homeNote:This role is not open for freshers and beginnersJob DescriptionBuilding websites and landing pages in WordPress themeCreating website architectureDesigning and managing the website back-end including database andserver integrationGenerating WordPress theme and pluginsConducting website performance testsTroubleshooting content issuesMonitoring performance of live websitePreparing comprehensive documentation including website manualDesigning and implementing new features and functionalityHelping formulate an effective, responsive design and turning it into aworking theme and pluginCollaborating with the marketing team to complete tasksWorking Hours:7:00 AM to 3:00 PM, Sunday to FridayApplying Procedure:Email us your CV and some samples at[email\u00a0protected]ORAPPLY NOW", "Page_URL": "https://merojob.com/wordpress-developer-197/"}, {"name": "Flutter Developer", "company": "Smartmobe", "level": "Mid Level", "vacancy": "2", "time": "Full Time", "address": "Kathmandu", "salary": "Negotiable", "deadline": "Nov. 15, 2020 23:55\n(1\u00a0week, 6\u00a0days from now)", "education": "Bachelor", "skills": "Flutter FrameworkCommunicationAgile Development", "desct": "Basic Job InformationJob Category:IT & TelecommunicationJob Level:Mid LevelNo. of Vacancy/s:[2]Employment Type:Full TimeJob Location:KathmanduOffered Salary:NegotiableApply Before(Deadline):Nov. 15, 2020 23:55\n(1\u00a0week, 6\u00a0days from now)Job SpecificationEducation Level:BachelorExperience Required:More than or equals to 2 yearsProfessional Skill Required:Flutter FrameworkCommunicationAgile DevelopmentOther SpecificationShould have 2-5 years of good expertise in developing hybrid mobile applications,with at least 2 years of experience in the Flutter frameworkShould have worked on multiple Flutter projectsShould have good communication skillsA strong commitment to quality and willingness to learnExperience with third-party libraries and APIsExperience working in an agile development processBe proficient in using version control and continuous integration, with tools such asBitbucket and GitWrite clear, maintainable and testable code that you are proud ofGood communication skillsSolid understanding of the full mobile development life cycle, including automatedtesting and buildingJob DescriptionDevelop hybrid mobile apps for iOS and Android platform using Flutter frameworkHands of experience in FlutterProven software development experienceEnsure the performance, quality, and responsiveness of applicationsCollaborate with a team to define, design, and ship new featuresReport to the Project Manager/Team Leader regarding the progress, impediments ofassigned project/tasksShare knowledge and ideas among other developers on the project or tools used, oron any R&D done during the project timelineBenefits:Attractive salary to match your performanceMedical and Accidental InsuranceInternet Allowance5 Working days onlyDashain BonusFlexible and creative working environmentRefreshment Parties and OutingsFree lunch/snacks/teaTraining and development programsNote :Female Candidates are encouraged to applyApplying Procedure:If you think you are the perfect one for the above post then send your CV with cover-letter in pdf format to[email\u00a0protected].Come and Be A Part of the SmartMobe Family!!!SmartMobe Solutions, is an Equal Opportunity Employer. This company does not and will not discriminate in employment and\u00a0personnel practices on the basis of race, sex, age, handicap, religion, national origin or any other basis prohibited by applicable law.OR,APPLY NOW", "Page_URL": "https://merojob.com/flutter-developer-11/"}, {"name": "Laravel Developer", "company": "Global Interface", "level": "Mid Level", "vacancy": "2", "time": "Full Time", "address": "New Baneshwor", "salary": "Negotiable", "deadline": "Dec. 01, 2020 23:55\n(4\u00a0weeks, 1\u00a0day from now)", "education": "Bachelor", "skills": "MysqlPhpLaravel Framework", "desct": "Basic Job InformationJob Category:IT & Telecommunication>Web Developer/Web DesignerJob Level:Mid LevelNo. of Vacancy/s:[2]Employment Type:Full TimeJob Location:New BaneshworOffered Salary:NegotiableApply Before(Deadline):Dec. 01, 2020 23:55\n(4\u00a0weeks, 1\u00a0day from now)Job SpecificationEducation Level:BachelorExperience Required:More than 1 yearProfessional Skill Required:MysqlPhpLaravel FrameworkOther SpecificationProficient PHP proficiency in large, scalable web applicationsProficient proficiency with LaravelStrong understanding of REST APIs, SQL query authoring, performance tuning, relational database design and working with data at scaleVersion control systems, Git and GitHubFunctional understanding of Unix commands and environmentsGood communication skills and client-oriented attitudeProblem solving skills, analytical mind and positive attitudeResults oriented and focused on meeting deliverable timelinesEagerness to learn new ideas, concepts and technologiesJob DescriptionWrite technical and developed documentation for new and existing applicationsDevelop APIs and applicationsBuild efficient, testable, and reusable PHP modulesSolve complex performance problems and architectural challengesPerform unit and system-level testing using various testing frameworksBuild innovative, state-of-the-art applications and collaborate with the User Experience (UX) team.Ensure HTML, CSS, and shared JavaScript is valid and consistent across applicationsPrepare and maintain all applications utilizing standard development toolsUtilize backend data services and contribute to increase existing data services APIConvey effectively with all task progress, evaluations, suggestions, schedules along with technical and process issuesDocument the development process, architecture, and standard componentsKeep abreast of new trends and best practices in web developmentAPPLY NOW", "Page_URL": "https://merojob.com/laravel-developer-52/"}, {"name": "Junior IT Officer", "company": "Nature Herbs International", "level": "Mid Level", "vacancy": "1", "time": "Full Time", "address": "Kathmandu", "salary": "Negotiable", "deadline": "Nov. 09, 2020 23:55\n(1\u00a0week from now)", "education": "Bachelor", "skills": "Problem SolvingTime ManagementMultitaskingCommunication", "desct": "Basic Job InformationJob Category:IT & TelecommunicationJob Level:Mid LevelNo. of Vacancy/s:[1]Employment Type:Full TimeJob Location:KathmanduOffered Salary:NegotiableApply Before(Deadline):Nov. 09, 2020 23:55\n(1\u00a0week from now)Job SpecificationEducation Level:BachelorExperience Required:More than or equals to 1 yearProfessional Skill Required:Problem SolvingTime ManagementMultitaskingCommunicationOther SpecificationGood communication skills both in English and NepaliAbility to work under pressure and meet deadlinesWorking knowledge of Microsoft server and client-based environmentsWorking knowledge of Windows and Linux ServersExcellent diagnostic and problem-solving skillsA good memory of how software and operating systems workExcellent listening and questioning skills, combined with the ability to interact confidently with clients to establish what the problem is and explain the solutionJob DescriptionInstall and configure computer hardware, operating systems and applicationsMonitor and maintain computer systems and networksShould talk to the staffs or clients through a series of actions, either face to face or over phone, to help setting up a system and to resolve the issuesTroubleshoot the systems and network problems, diagnosing and solving hardware or software faultsProvide support, including procedural documentation and relevant reportsFollow diagrams and written instructions to repair a fault or set up a systemSupport a roll-out of new applicationsSet up new users accounts and profiles and deal with password issuesRespond within agreed time limits to call-outsWork continuously on a task until completion (or referral to third parties if appropriate)Prioritize and manage many open cases at one timeRapidly establish a good working relationship with customers and other professionals; such as software developersTest and evaluate new technologyConduct electrical safety checks on computer equipmentBasic knowledge on graphic designingApplying Procedure:Interested applicants are requested to drop theirCVandCover Lettermentioning thepositionthey are applying at[email\u00a0protected]OR,APPLY NOW", "Page_URL": "https://merojob.com/junior-it-officer-3/"}, {"name": "Mobile Developer", "company": "Nature Herbs International", "level": "Mid Level", "vacancy": "1", "time": "Full Time", "address": "New Baneshwor, Kathmandu", "salary": "Negotiable", "deadline": "Nov. 09, 2020 23:55\n(1\u00a0week from now)", "education": "Bachelor", "skills": "JavascriptOrganizationalCommunicationCreative ThinkingRest Apis", "desct": "Basic Job InformationJob Category:IT & TelecommunicationJob Level:Mid LevelNo. of Vacancy/s:[1]Employment Type:Full TimeJob Location:New Baneshwor, KathmanduOffered Salary:NegotiableApply Before(Deadline):Nov. 09, 2020 23:55\n(1\u00a0week from now)Job SpecificationEducation Level:BachelorExperience Required:More than or equals to 1 yearProfessional Skill Required:JavascriptOrganizationalCommunicationCreative ThinkingRest ApisOther SpecificationBachelors Degree or Diploma preferredKnowledge of functional or object-oriented programmingReact Native /FlutterCandidate must have good communication skillsAbility to write well-documented, clean JavaScript codeRock-solid at working with third-party dependencies and debugging dependency conflictsFamiliarity with native build tools, like XCode, Gradle Android Studio, IntelliJUnderstanding of\u00a0 REST APIs, the document request model, and offline storagePerform additional duties as determined by business needs and as directed by managementGood analytical, organizational, and problem - solving abilitiesGood at prioritizing the tasks and commitment to complete themGood to have the implementation of Firebase and Google KitsApp Store Build process for Mobile App ReleasesJob DescriptionWe are looking for a React Native or Flutter mobile application developer interested in building performant mobile apps on both the iOS and Android platforms. You will be responsible for architecting and building these applications and coordinating with the teams responsible for other layers of the product infrastructure. Building a product is a highly collaborative effort, and as such, a strong team player with a commitment to perfection is required.ResponsibilitiesBuild pixel-perfect, buttery smooth UIs across both mobile platformsLeverage native APIs for deep integrations with both platformsResponsible for developing applications for iOS / Android / Windows phones using Ionic Framework, React Native, FlutterMust have in the development of a Hybrid Mobile application using Ionic Framework / Cordova framework / Angular JS / React NativeGood to have knowledge in plugin implementation in Mobile Apps, Geo-fencing based Location service applicationsExposure to integrations using middleware technologies and web services SOAP, REST, JSON XMLDiagnose and fix bugs and performance bottlenecks for performance that feels nativeMaintain code and write automated tests to ensure the product is of the highest qualityGood to have knowledge in plugin implementation in Mobile Apps, Geo-fencing based Location service applicationsApplying procedure:Interested applicants are requested to drop theirCVandCover Lettermentioning thepositionthey are applying at[email\u00a0protected].OR,APPLY NOW", "Page_URL": "https://merojob.com/mobile-developer-8/"}, {"name": "Senior WordPress Programmer", "company": "", "level": "Senior Level", "vacancy": "1", "time": "Full Time", "address": "Dhobhighat, Jhamsikhel, Lalitpur", "salary": "Negotiable", "deadline": "Nov. 16, 2020 23:55\n(2\u00a0weeks from now)", "education": "Bachelor", "skills": "HtmlResponsive DesignCssWordpress", "desct": "Basic Job InformationJob Category:IT & TelecommunicationJob Level:Senior LevelNo. of Vacancy/s:[1]Employment Type:Full TimeJob Location:Dhobhighat, Jhamsikhel, LalitpurOffered Salary:NegotiableApply Before(Deadline):Nov. 16, 2020 23:55\n(2\u00a0weeks from now)Job SpecificationEducation Level:BachelorExperience Required:More than or equals to 2 yearsProfessional Skill Required:HtmlResponsive DesignCssWordpressOther SpecificationShould have minimum 2+ years of professional work experience in WordPressExtensive knowledge and experience of building WordPress websitesShould have experience in WordPress theme and plugin developmentKnowledge of WordPress coding standard andbest practices for developing efficient and high-quality back-end systemKnowledge of responsive design/css is a plusjQuery, JavaScript, AJAX knowledge is importantGood knowledge of WooCommerceProficient understanding of code versioning tools (such as Git)Experience with building REST API services and integrating with 3rd party API servicesAdvanced proficiency in coding and applying effective techniquesHave a good understanding of Gutenberg, Blocks, Sage, WP Bakery, Elementor and premium themes.Experience in code review and optimisationJob DescriptionWe are looking for an experienced WordPress Developer to join our team.Responsibilities:Build and maintain simple to complex websites in WordPressPlanning and executing the development process efficientlyCommunicate effectively with team members and PM\u2019s throughout the developmentDevelop and maintain WP plugins/themes and build custom solutions depending on the requirementsBenefits:Competitive Salary and benefitsLunch providedUnlimited Tea/Coffee and snacksRegular Team building eventsTeam partiesAPPLY NOW", "Page_URL": "https://merojob.com/senior-wordpress-programmer-10/"}, {"name": "Software Developer", "company": "", "level": "Mid Level", "vacancy": "1", "time": "Full Time", "address": "Gyaneshwor, Kathmandu", "salary": "Negotiable", "deadline": "Nov. 05, 2020 23:55\n(3\u00a0days, 3\u00a0hours from now)", "education": "Bachelor", "skills": "Software EngineeringJapanese Language", "desct": "Basic Job InformationJob Category:IT & Telecommunication>Software Architect, Software Implementation, Technical Lead (Software), Test EngineerJob Level:Mid LevelNo. of Vacancy/s:[1]Employment Type:Full TimeJob Location:Gyaneshwor, KathmanduOffered Salary:NegotiableApply Before(Deadline):Nov. 05, 2020 23:55\n(3\u00a0days, 3\u00a0hours from now)Job SpecificationEducation Level:BachelorExperience Required:More than or equals to 1 yearProfessional Skill Required:Software EngineeringJapanese LanguageOther SpecificationMathematical aptitudeProblem-solving skillsProgramming languages (different types of developer role require different languages)Excellent organizational and time management skillsAccuracy and attention to detailAn understanding of the latest trends and their role in a commercial environmentTeamwork skillsSelf-development skills to keep up to date with fast-changing trendsJob DescriptionSoftware (web application) design, development, testing and implementationsWork on a quality assurance project for an American company located in JapanAPPLY NOW", "Page_URL": "https://merojob.com/software-developer-121/"}]